Bluetooth monitor ver 5.72
btmon[1566151]: = Note: Linux version 6.17.0-14-generic (x86_64)       0.265397
btmon[1566151]: = Note: Bluetooth subsystem version 2.22               0.265399
= New Index: 68:34:21:E5:84:DF (Primary,USB,hci0)               [hci0] 0.265400
= Open Index: 68:34:21:E5:84:DF                                 [hci0] 0.265400
= Index Info: 68:34:21:E5:84:DF (Intel Corp.)                   [hci0] 0.265401
bluetoothd[2915165]: @ MGMT Open.. (privileged) version 1.23  {0x0001} 0.265401
bluetoothctl[1566256]: @ MGMT Open: bluetooth.. version 1.23  {0x0002} 1.260294
bluetoothd[2915165]: @ MGMT Command.. (0x0024) plen 1  {0x0001} [hci0] 1.263374
        Address type: 0x01
          BR/EDR
< HCI Command: Inquiry Cancel (0x01|0x0002) plen 0           #1 [hci0] 1.263564
> HCI Event: Command Complete (0x0e) plen 4                  #2 [hci0] 1.358428
      Inquiry Cancel (0x01|0x0002) ncmd 1
        Status: Success (0x00)
@ MGMT Event: Discovering (0x0013) plen 2              {0x0001} [hci0] 1.358524
        Address type: 0x01
          BR/EDR
        Discovery: Disabled (0x00)
@ MGMT Event: Command Complete (0x0001) plen 4         {0x0001} [hci0] 1.358544
      Stop Discovery (0x0024) plen 1
        Status: Success (0x00)
        Address type: 0x01
          BR/EDR
bluetoothd[2915165]: @ MGMT Command.. (0x003a) plen 4  {0x0001} [hci0] 1.358766
        Address type: 0x07
          BR/EDR
          LE Public
          LE Random
        RSSI: invalid (0x7f)
        UUIDs: 0
< HCI Command: LE Set Address Resolu.. (0x08|0x002d) plen 1  #3 [hci0] 1.358897
        Address resolution: Disabled (0x00)
> HCI Event: Command Complete (0x0e) plen 4                  #4 [hci0] 1.359430
      LE Set Address Resolution Enable (0x08|0x002d) ncmd 1
        Status: Success (0x00)
< HCI Command: LE Set Random Address (0x08|0x0005) plen 6    #5 [hci0] 1.359532
        Address: 3A:95:27:77:21:A7 (Non-Resolvable)
> HCI Event: Command Complete (0x0e) plen 4                  #6 [hci0] 1.360431
      LE Set Random Address (0x08|0x0005) ncmd 1
        Status: Success (0x00)
< HCI Command: LE Set Extended Scan.. (0x08|0x0041) plen 13  #7 [hci0] 1.360578
        Own address type: Random (0x01)
        Filter policy: Accept all advertisement (0x00)
        PHYs: 0x05
        Entry 0: LE 1M
          Type: Active (0x01)
          Interval: 22.500 msec (0x0024)
          Window: 11.250 msec (0x0012)
        Entry 1: LE Coded
          Type: Active (0x01)
          Interval: 67.500 msec (0x006c)
          Window: 33.750 msec (0x0036)
> HCI Event: Command Complete (0x0e) plen 4                  #8 [hci0] 1.361430
      LE Set Extended Scan Parameters (0x08|0x0041) ncmd 1
        Status: Success (0x00)
< HCI Command: LE Set Extended Scan... (0x08|0x0042) plen 6  #9 [hci0] 1.361538
        Extended scan: Enabled (0x01)
        Filter duplicates: Disabled (0x00)
        Duration: 0 msec (0x0000)
        Period: 0.00 sec (0x0000)
> HCI Event: Command Complete (0x0e) plen 4                 #10 [hci0] 1.362430
      LE Set Extended Scan Enable (0x08|0x0042) ncmd 1
        Status: Success (0x00)
@ MGMT Event: Discovering (0x0013) plen 2              {0x0001} [hci0] 1.362575
        Address type: 0x07
          BR/EDR
          LE Public
          LE Random
        Discovery: Enabled (0x01)
< HCI Command: Inquiry (0x01|0x0001) plen 5                 #11 [hci0] 1.362587
        Access code: 0x9e8b33 (General Inquiry)
        Length: 10.24s (0x08)
        Num responses: 0
> HCI Event: Command Status (0x0f) plen 4                   #12 [hci0] 1.374550
      Inquiry (0x01|0x0001) ncmd 1
        Status: Success (0x00)
@ MGMT Event: Command Complete (0x0001) plen 4         {0x0001} [hci0] 1.374703
      Start Service Discovery (0x003a) plen 1
        Status: Success (0x00)
        Address type: 0x07
          BR/EDR
          LE Public
          LE Random
> HCI Event: LE Meta Event (0x3e) plen 57                   #13 [hci0] 2.348547
      LE Extended Advertising Report (0x0d)
        Num reports: 1
        Entry 0
          Event type: 0x0010
            Props: 0x0010
              Use legacy advertising PDUs
            Data status: [0;32mComplete[0m
          Legacy PDU Type: ADV_NONCONN_IND (0x0010)
          Address type: Random (0x01)
          Address: 69:54:EF:53:DD:98 (Resolvable)
          Primary PHY: LE 1M
          Secondary PHY: No packets
          SID: no ADI field (0xff)
          TX power: 127 dBm
          RSSI: -95 dBm (0xa1)
          Periodic advertising interval: 0.00 msec (0x0000)
          Direct address type: Public (0x00)
          Direct address: 00:00:00:00:00:00 (OUI 00-00-00)
          Data length: 0x1f
        1e ff 06 00 01 09 20 02 2e c8 d0 c1 5f 7f 64 f2  ...... ....._.d.
        63 bf 25 3b a5 99 d4 5d 8a 03 e0 f9 51 11 29     c.%;...]....Q.) 
        Company: Microsoft (6)
          Data: 010920022ec8d0c15f7f64f263bf253ba599d45d8a03e0f9511129
@ MGMT Event: Device Found (0x0012) plen 45            {0x0001} [hci0] 2.348699
        LE Address: 69:54:EF:53:DD:98 (Resolvable)
        RSSI: -95 dBm (0xa1)
        Flags: 0x00000004
          Not Connectable
        Data length: 31
        Company: Microsoft (6)
          Data: 010920022ec8d0c15f7f64f263bf253ba599d45d8a03e0f9511129
> HCI Event: LE Meta Event (0x3e) plen 57                   #14 [hci0] 2.352535
      LE Extended Advertising Report (0x0d)
        Num reports: 1
        Entry 0
          Event type: 0x0010
            Props: 0x0010
              Use legacy advertising PDUs
            Data status: [0;32mComplete[0m
          Legacy PDU Type: ADV_NONCONN_IND (0x0010)
          Address type: Random (0x01)
          Address: C7:F9:6F:16:65:0A (Static)
          Primary PHY: LE 1M
          Secondary PHY: No packets
          SID: no ADI field (0xff)
          TX power: 127 dBm
          RSSI: -78 dBm (0xb2)
          Periodic advertising interval: 0.00 msec (0x0000)
          Direct address type: Public (0x00)
          Direct address: 00:00:00:00:00:00 (OUI 00-00-00)
          Data length: 0x1f
        1e ff 4c 00 12 19 00 a4 5c a2 9d fd a7 95 89 e3  ..L.....\.......
        a4 83 b2 fd 10 c7 c6 3f 26 36 9b 2e 6c 00 00     .......?&6..l.. 
        Company: Apple, Inc. (76)
          Type: Unknown (18)
          Data: 00a45ca29dfda79589e3a483b2fd10c7c63f26369b2e6c0000
@ MGMT Event: Device Found (0x0012) plen 45            {0x0001} [hci0] 2.352697
        LE Address: C7:F9:6F:16:65:0A (Static)
        RSSI: -78 dBm (0xb2)
        Flags: 0x00000004
          Not Connectable
        Data length: 31
        Company: Apple, Inc. (76)
          Type: Unknown (18)
          Data: 00a45ca29dfda79589e3a483b2fd10c7c63f26369b2e6c0000
> HCI Event: LE Meta Event (0x3e) plen 39                   #15 [hci0] 3.879628
      LE Extended Advertising Report (0x0d)
        Num reports: 1
        Entry 0
          Event type: 0x0013
            Props: 0x0013
              Connectable
              Scannable
              Use legacy advertising PDUs
            Data status: [0;32mComplete[0m
          Legacy PDU Type: ADV_IND (0x0013)
          Address type: Random (0x01)
          Address: C0:DE:54:15:00:51 (Static)
          Primary PHY: LE 1M
          Secondary PHY: No packets
          SID: no ADI field (0xff)
          TX power: 127 dBm
          RSSI: -80 dBm (0xb0)
          Periodic advertising interval: 0.00 msec (0x0000)
          Direct address type: Public (0x00)
          Direct address: 00:00:00:00:00:00 (OUI 00-00-00)
          Data length: 0x0d
        02 01 06 09 09 58 35 34 2d 50 41 49 52           .....X54-PAIR   
        Flags: 0x06
          LE General Discoverable Mode
          BR/EDR Not Supported
        Name (complete): X54-PAIR
> HCI Event: LE Meta Event (0x3e) plen 57                   #16 [hci0] 4.325787
      LE Extended Advertising Report (0x0d)
        Num reports: 1
        Entry 0
          Event type: 0x0010
            Props: 0x0010
              Use legacy advertising PDUs
            Data status: [0;32mComplete[0m
          Legacy PDU Type: ADV_NONCONN_IND (0x0010)
          Address type: Random (0x01)
          Address: 69:54:EF:53:DD:98 (Resolvable)
          Primary PHY: LE 1M
          Secondary PHY: No packets
          SID: no ADI field (0xff)
          TX power: 127 dBm
          RSSI: -95 dBm (0xa1)
          Periodic advertising interval: 0.00 msec (0x0000)
          Direct address type: Public (0x00)
          Direct address: 00:00:00:00:00:00 (OUI 00-00-00)
          Data length: 0x1f
        1e ff 06 00 01 09 20 02 2e c8 d0 c1 5f 7f 64 f2  ...... ....._.d.
        63 bf 25 3b a5 99 d4 5d 8a 03 e0 f9 51 11 29     c.%;...]....Q.) 
        Company: Microsoft (6)
          Data: 010920022ec8d0c15f7f64f263bf253ba599d45d8a03e0f9511129
@ MGMT Event: Device Found (0x0012) plen 27            {0x0001} [hci0] 4.325891
        LE Address: C0:DE:54:15:00:51 (Static)
        RSSI: -80 dBm (0xb0)
        Flags: 0x00000000
        Data length: 13
        Flags: 0x06
          LE General Discoverable Mode
          BR/EDR Not Supported
        Name (complete): X54-PAIR
@ MGMT Event: Device Found (0x0012) plen 45            {0x0001} [hci0] 4.325895
        LE Address: 69:54:EF:53:DD:98 (Resolvable)
        RSSI: -95 dBm (0xa1)
        Flags: 0x00000004
          Not Connectable
        Data length: 31
        Company: Microsoft (6)
          Data: 010920022ec8d0c15f7f64f263bf253ba599d45d8a03e0f9511129
> HCI Event: LE Meta Event (0x3e) plen 43                   #17 [hci0] 4.717710
      LE Extended Advertising Report (0x0d)
        Num reports: 1
        Entry 0
          Event type: 0x0013
            Props: 0x0013
              Connectable
              Scannable
              Use legacy advertising PDUs
            Data status: [0;32mComplete[0m
          Legacy PDU Type: ADV_IND (0x0013)
          Address type: Random (0x01)
          Address: 7D:3A:27:49:7C:A9 (Resolvable)
          Primary PHY: LE 1M
          Secondary PHY: No packets
          SID: no ADI field (0xff)
          TX power: 127 dBm
          RSSI: -86 dBm (0xaa)
          Periodic advertising interval: 0.00 msec (0x0000)
          Direct address type: Public (0x00)
          Direct address: 00:00:00:00:00:00 (OUI 00-00-00)
          Data length: 0x11
        02 01 1a 02 0a 0c 0a ff 4c 00 10 05 3b 1c 4a cf  ........L...;.J.
        31                                               1               
        Flags: 0x1a
          LE General Discoverable Mode
          Simultaneous LE and BR/EDR (Controller)
          Simultaneous LE and BR/EDR (Host)
        TX power: 12 dBm
        Company: Apple, Inc. (76)
          Type: Unknown (16)
          Data: 3b1c4acf31
> HCI Event: LE Meta Event (0x3e) plen 43                   #18 [hci0] 5.272847
      LE Extended Advertising Report (0x0d)
        Num reports: 1
        Entry 0
          Event type: 0x0013
            Props: 0x0013
              Connectable
              Scannable
              Use legacy advertising PDUs
            Data status: [0;32mComplete[0m
          Legacy PDU Type: ADV_IND (0x0013)
          Address type: Random (0x01)
          Address: 7D:3A:27:49:7C:A9 (Resolvable)
          Primary PHY: LE 1M
          Secondary PHY: No packets
          SID: no ADI field (0xff)
          TX power: 127 dBm
          RSSI: -86 dBm (0xaa)
          Periodic advertising interval: 0.00 msec (0x0000)
          Direct address type: Public (0x00)
          Direct address: 00:00:00:00:00:00 (OUI 00-00-00)
          Data length: 0x11
        02 01 1a 02 0a 0c 0a ff 4c 00 10 05 3b 1c 4a cf  ........L...;.J.
        31                                               1               
        Flags: 0x1a
          LE General Discoverable Mode
          Simultaneous LE and BR/EDR (Controller)
          Simultaneous LE and BR/EDR (Host)
        TX power: 12 dBm
        Company: Apple, Inc. (76)
          Type: Unknown (16)
          Data: 3b1c4acf31
> HCI Event: LE Meta Event (0x3e) plen 26                   #19 [hci0] 5.273844
      LE Extended Advertising Report (0x0d)
        Num reports: 1
        Entry 0
          Event type: 0x001b
            Props: 0x001b
              Connectable
              Scannable
              Scan response
              Use legacy advertising PDUs
            Data status: [0;32mComplete[0m
          Legacy PDU Type: SCAN_RSP to an ADV_SCAN_IND (0x001b)
          Address type: Random (0x01)
          Address: 7D:3A:27:49:7C:A9 (Resolvable)
          Primary PHY: LE 1M
          Secondary PHY: No packets
          SID: no ADI field (0xff)
          TX power: 127 dBm
          RSSI: -86 dBm (0xaa)
          Periodic advertising interval: 0.00 msec (0x0000)
          Direct address type: Public (0x00)
          Direct address: 00:00:00:00:00:00 (OUI 00-00-00)
          Data length: 0x00
@ MGMT Event: Device Found (0x0012) plen 31            {0x0001} [hci0] 5.274008
        LE Address: 7D:3A:27:49:7C:A9 (Resolvable)
        RSSI: -86 dBm (0xaa)
        Flags: 0x00000000
        Data length: 17
        Flags: 0x1a
          LE General Discoverable Mode
          Simultaneous LE and BR/EDR (Controller)
          Simultaneous LE and BR/EDR (Host)
        TX power: 12 dBm
        Company: Apple, Inc. (76)
          Type: Unknown (16)
          Data: 3b1c4acf31
> HCI Event: LE Meta Event (0x3e) plen 26                   #20 [hci0] 5.360825
      LE Extended Advertising Report (0x0d)
        Num reports: 1
        Entry 0
          Event type: 0x0013
            Props: 0x0013
              Connectable
              Scannable
              Use legacy advertising PDUs
            Data status: [0;32mComplete[0m
          Legacy PDU Type: ADV_IND (0x0013)
          Address type: Public (0x00)
          Address: 7D:3A:27:49:7C:A9 (OUI 7D-3A-27)
          Primary PHY: LE 1M
          Secondary PHY: No packets
          SID: no ADI field (0xff)
          TX power: 127 dBm
          RSSI: -86 dBm (0xaa)
          Periodic advertising interval: 0.00 msec (0x0000)
          Direct address type: Public (0x00)
          Direct address: 00:00:00:00:00:00 (OUI 00-00-00)
          Data length: 0x00
> HCI Event: LE Meta Event (0x3e) plen 43                   #21 [hci0] 5.810852
      LE Extended Advertising Report (0x0d)
        Num reports: 1
        Entry 0
          Event type: 0x0013
            Props: 0x0013
              Connectable
              Scannable
              Use legacy advertising PDUs
            Data status: [0;32mComplete[0m
          Legacy PDU Type: ADV_IND (0x0013)
          Address type: Public (0x00)
          Address: A4:C1:38:8D:7D:4F (Telink Semiconductor (Taipei) Co. Ltd.)
          Primary PHY: LE 1M
          Secondary PHY: No packets
          SID: no ADI field (0xff)
          TX power: 127 dBm
          RSSI: -90 dBm (0xa6)
          Periodic advertising interval: 0.00 msec (0x0000)
          Direct address type: Public (0x00)
          Direct address: 00:00:00:00:00:00 (OUI 00-00-00)
          Data length: 0x11
        10 16 1a 18 a4 c1 38 8d 7d 4f 00 bb 3c 51 0b 74  ......8.}O..<Q.t
        fc                                               .               
        Service Data: Environmental Sensing (0x181a)
          Data: a4c1388d7d4f00bb3c510b74fc
@ MGMT Event: Device Found (0x0012) plen 14            {0x0001} [hci0] 5.810885
        LE Address: 7D:3A:27:49:7C:A9 (OUI 7D-3A-27)
        RSSI: -86 dBm (0xaa)
        Flags: 0x00000000
        Data length: 0
bluetoothd[2915165]: = src/device.c:device_new() Unable to registe..   5.811293
bluetoothd[2915165]: = Unable to create object for found de..   [hci0] 5.811326
> HCI Event: LE Meta Event (0x3e) plen 38                   #22 [hci0] 5.811765
      LE Extended Advertising Report (0x0d)
        Num reports: 1
        Entry 0
          Event type: 0x001b
            Props: 0x001b
              Connectable
              Scannable
              Scan response
              Use legacy advertising PDUs
            Data status: [0;32mComplete[0m
          Legacy PDU Type: SCAN_RSP to an ADV_SCAN_IND (0x001b)
          Address type: Public (0x00)
          Address: A4:C1:38:8D:7D:4F (Telink Semiconductor (Taipei) Co. Ltd.)
          Primary PHY: LE 1M
          Secondary PHY: No packets
          SID: no ADI field (0xff)
          TX power: 127 dBm
          RSSI: -93 dBm (0xa3)
          Periodic advertising interval: 0.00 msec (0x0000)
          Direct address type: Public (0x00)
          Direct address: 00:00:00:00:00:00 (OUI 00-00-00)
          Data length: 0x0c
        0b 09 41 54 43 5f 38 44 37 44 34 46              ..ATC_8D7D4F    
        Name (complete): ATC_8D7D4F
@ MGMT Event: Device Found (0x0012) plen 43            {0x0001} [hci0] 5.811965
        LE Address: A4:C1:38:8D:7D:4F (Telink Semiconductor (Taipei) Co. Ltd.)
        RSSI: -93 dBm (0xa3)
        Flags: 0x00000000
        Data length: 29
        Service Data: Environmental Sensing (0x181a)
          Data: a4c1388d7d4f00bb3c510b74fc
        Name (complete): ATC_8D7D4F
> HCI Event: LE Meta Event (0x3e) plen 39                   #23 [hci0] 5.814868
      LE Extended Advertising Report (0x0d)
        Num reports: 1
        Entry 0
          Event type: 0x0013
            Props: 0x0013
              Connectable
              Scannable
              Use legacy advertising PDUs
            Data status: [0;32mComplete[0m
          Legacy PDU Type: ADV_IND (0x0013)
          Address type: Random (0x01)
          Address: C0:DE:54:15:00:51 (Static)
          Primary PHY: LE 1M
          Secondary PHY: No packets
          SID: no ADI field (0xff)
          TX power: 127 dBm
          RSSI: -79 dBm (0xb1)
          Periodic advertising interval: 0.00 msec (0x0000)
          Direct address type: Public (0x00)
          Direct address: 00:00:00:00:00:00 (OUI 00-00-00)
          Data length: 0x0d
        02 01 06 09 09 58 35 34 2d 50 41 49 52           .....X54-PAIR   
        Flags: 0x06
          LE General Discoverable Mode
          BR/EDR Not Supported
        Name (complete): X54-PAIR
> HCI Event: LE Meta Event (0x3e) plen 43                   #24 [hci0] 6.096886
      LE Extended Advertising Report (0x0d)
        Num reports: 1
        Entry 0
          Event type: 0x0013
            Props: 0x0013
              Connectable
              Scannable
              Use legacy advertising PDUs
            Data status: [0;32mComplete[0m
          Legacy PDU Type: ADV_IND (0x0013)
          Address type: Random (0x01)
          Address: 7D:3A:27:49:7C:A9 (Resolvable)
          Primary PHY: LE 1M
          Secondary PHY: No packets
          SID: no ADI field (0xff)
          TX power: 127 dBm
          RSSI: -86 dBm (0xaa)
          Periodic advertising interval: 0.00 msec (0x0000)
          Direct address type: Public (0x00)
          Direct address: 00:00:00:00:00:00 (OUI 00-00-00)
          Data length: 0x11
        02 01 1a 02 0a 0c 0a ff 4c 00 10 05 3b 1c 4a cf  ........L...;.J.
        31                                               1               
        Flags: 0x1a
          LE General Discoverable Mode
          Simultaneous LE and BR/EDR (Controller)
          Simultaneous LE and BR/EDR (Host)
        TX power: 12 dBm
        Company: Apple, Inc. (76)
          Type: Unknown (16)
          Data: 3b1c4acf31
@ MGMT Event: Device Found (0x0012) plen 27            {0x0001} [hci0] 6.096910
        LE Address: C0:DE:54:15:00:51 (Static)
        RSSI: -79 dBm (0xb1)
        Flags: 0x00000000
        Data length: 13
        Flags: 0x06
          LE General Discoverable Mode
          BR/EDR Not Supported
        Name (complete): X54-PAIR
> HCI Event: LE Meta Event (0x3e) plen 26                   #25 [hci0] 6.097863
      LE Extended Advertising Report (0x0d)
        Num reports: 1
        Entry 0
          Event type: 0x001b
            Props: 0x001b
              Connectable
              Scannable
              Scan response
              Use legacy advertising PDUs
            Data status: [0;32mComplete[0m
          Legacy PDU Type: SCAN_RSP to an ADV_SCAN_IND (0x001b)
          Address type: Random (0x01)
          Address: 7D:3A:27:49:7C:A9 (Resolvable)
          Primary PHY: LE 1M
          Secondary PHY: No packets
          SID: no ADI field (0xff)
          TX power: 127 dBm
          RSSI: -87 dBm (0xa9)
          Periodic advertising interval: 0.00 msec (0x0000)
          Direct address type: Public (0x00)
          Direct address: 00:00:00:00:00:00 (OUI 00-00-00)
          Data length: 0x00
@ MGMT Event: Device Found (0x0012) plen 31            {0x0001} [hci0] 6.097881
        LE Address: 7D:3A:27:49:7C:A9 (Resolvable)
        RSSI: -87 dBm (0xa9)
        Flags: 0x00000000
        Data length: 17
        Flags: 0x1a
          LE General Discoverable Mode
          Simultaneous LE and BR/EDR (Controller)
          Simultaneous LE and BR/EDR (Host)
        TX power: 12 dBm
        Company: Apple, Inc. (76)
          Type: Unknown (16)
          Data: 3b1c4acf31
> HCI Event: LE Meta Event (0x3e) plen 43                   #26 [hci0] 6.649914
      LE Extended Advertising Report (0x0d)
        Num reports: 1
        Entry 0
          Event type: 0x0013
            Props: 0x0013
              Connectable
              Scannable
              Use legacy advertising PDUs
            Data status: [0;32mComplete[0m
          Legacy PDU Type: ADV_IND (0x0013)
          Address type: Random (0x01)
          Address: 7D:3A:27:49:7C:A9 (Resolvable)
          Primary PHY: LE 1M
          Secondary PHY: No packets
          SID: no ADI field (0xff)
          TX power: 127 dBm
          RSSI: -91 dBm (0xa5)
          Periodic advertising interval: 0.00 msec (0x0000)
          Direct address type: Public (0x00)
          Direct address: 00:00:00:00:00:00 (OUI 00-00-00)
          Data length: 0x11
        02 01 1a 02 0a 0c 0a ff 4c 00 10 05 3b 1c 4a cf  ........L...;.J.
        31                                               1               
        Flags: 0x1a
          LE General Discoverable Mode
          Simultaneous LE and BR/EDR (Controller)
          Simultaneous LE and BR/EDR (Host)
        TX power: 12 dBm
        Company: Apple, Inc. (76)
          Type: Unknown (16)
          Data: 3b1c4acf31
> HCI Event: LE Meta Event (0x3e) plen 26                   #27 [hci0] 6.650962
      LE Extended Advertising Report (0x0d)
        Num reports: 1
        Entry 0
          Event type: 0x001b
            Props: 0x001b
              Connectable
              Scannable
              Scan response
              Use legacy advertising PDUs
            Data status: [0;32mComplete[0m
          Legacy PDU Type: SCAN_RSP to an ADV_SCAN_IND (0x001b)
          Address type: Random (0x01)
          Address: 7D:3A:27:49:7C:A9 (Resolvable)
          Primary PHY: LE 1M
          Secondary PHY: No packets
          SID: no ADI field (0xff)
          TX power: 127 dBm
          RSSI: -91 dBm (0xa5)
          Periodic advertising interval: 0.00 msec (0x0000)
          Direct address type: Public (0x00)
          Direct address: 00:00:00:00:00:00 (OUI 00-00-00)
          Data length: 0x00
@ MGMT Event: Device Found (0x0012) plen 31            {0x0001} [hci0] 6.650974
        LE Address: 7D:3A:27:49:7C:A9 (Resolvable)
        RSSI: -91 dBm (0xa5)
        Flags: 0x00000000
        Data length: 17
        Flags: 0x1a
          LE General Discoverable Mode
          Simultaneous LE and BR/EDR (Controller)
          Simultaneous LE and BR/EDR (Host)
        TX power: 12 dBm
        Company: Apple, Inc. (76)
          Type: Unknown (16)
          Data: 3b1c4acf31
> HCI Event: LE Meta Event (0x3e) plen 47                   #28 [hci0] 6.811976
      LE Extended Advertising Report (0x0d)
        Num reports: 1
        Entry 0
          Event type: 0x0013
            Props: 0x0013
              Connectable
              Scannable
              Use legacy advertising PDUs
            Data status: [0;32mComplete[0m
          Legacy PDU Type: ADV_IND (0x0013)
          Address type: Public (0x00)
          Address: A4:C1:38:75:8A:D6 (Telink Semiconductor (Taipei) Co. Ltd.)
          Primary PHY: LE 1M
          Secondary PHY: No packets
          SID: no ADI field (0xff)
          TX power: 127 dBm
          RSSI: -78 dBm (0xb2)
          Periodic advertising interval: 0.00 msec (0x0000)
          Direct address type: Public (0x00)
          Direct address: 00:00:00:00:00:00 (OUI 00-00-00)
          Data length: 0x15
        02 01 06 11 16 95 fe 30 58 5b 05 01 d6 8a 75 38  .......0X[....u8
        c1 a4 28 01 00                                   ..(..           
        Flags: 0x06
          LE General Discoverable Mode
          BR/EDR Not Supported
        Service Data: Xiaomi Inc. (0xfe95)
          Data: 30585b0501d68a7538c1a4280100
> HCI Event: LE Meta Event (0x3e) plen 38                   #29 [hci0] 6.812862
      LE Extended Advertising Report (0x0d)
        Num reports: 1
        Entry 0
          Event type: 0x001b
            Props: 0x001b
              Connectable
              Scannable
              Scan response
              Use legacy advertising PDUs
            Data status: [0;32mComplete[0m
          Legacy PDU Type: SCAN_RSP to an ADV_SCAN_IND (0x001b)
          Address type: Public (0x00)
          Address: A4:C1:38:75:8A:D6 (Telink Semiconductor (Taipei) Co. Ltd.)
          Primary PHY: LE 1M
          Secondary PHY: No packets
          SID: no ADI field (0xff)
          TX power: 127 dBm
          RSSI: -78 dBm (0xb2)
          Periodic advertising interval: 0.00 msec (0x0000)
          Direct address type: Public (0x00)
          Direct address: 00:00:00:00:00:00 (OUI 00-00-00)
          Data length: 0x0c
        0b 09 4c 59 57 53 44 30 33 4d 4d 43              ..LYWSD03MMC    
        Name (complete): LYWSD03MMC
@ MGMT Event: Device Found (0x0012) plen 47            {0x0001} [hci0] 6.812977
        LE Address: A4:C1:38:75:8A:D6 (Telink Semiconductor (Taipei) Co. Ltd.)
        RSSI: -78 dBm (0xb2)
        Flags: 0x00000000
        Data length: 33
        Flags: 0x06
          LE General Discoverable Mode
          BR/EDR Not Supported
        Service Data: Xiaomi Inc. (0xfe95)
          Data: 30585b0501d68a7538c1a4280100
        Name (complete): LYWSD03MMC
bluetoothctl[1566256]: @ MGMT Close: bluetoothctl             {0x0002} 9.266344
bluetoothd[2915165]: @ MGMT Command.. (0x0024) plen 1  {0x0001} [hci0] 9.276572
        Address type: 0x07
          BR/EDR
          LE Public
          LE Random
< HCI Command: Inquiry Cancel (0x01|0x0002) plen 0          #30 [hci0] 9.276707
bluetoothctl[1566990]: @ MGMT Open: bluetooth.. version 1.23  {0x0002} 9.282608
bluetoothd[2915165]: @ MGMT Command.. (0x001a) plen 7  {0x0001} [hci0] 9.288486
        LE Address: C0:DE:54:15:00:51 (Static)
@ MGMT Event: Command Status (0x0002) plen 3           {0x0001} [hci0] 9.288489
      Cancel Pair Device (0x001a)
        Status: Invalid Parameters (0x0d)
bluetoothctl[1566990]: @ MGMT Close: bluetoothctl             {0x0002} 9.288645
bluetoothd[2915165]: @ MGMT Command.. (0x001a) plen 7  {0x0001} [hci0] 9.290927
        LE Address: C0:DE:54:15:00:51 (Static)
@ MGMT Event: Command Status (0x0002) plen 3           {0x0001} [hci0] 9.290929
      Cancel Pair Device (0x001a)
        Status: Invalid Parameters (0x0d)
> HCI Event: Command Complete (0x0e) plen 4                 #31 [hci0] 9.389075
      Inquiry Cancel (0x01|0x0002) ncmd 1
        Status: Success (0x00)
< HCI Command: LE Set Extended Scan.. (0x08|0x0042) plen 6  #32 [hci0] 9.389466
        Extended scan: Disabled (0x00)
        Filter duplicates: Disabled (0x00)
        Duration: 0 msec (0x0000)
        Period: 0.00 sec (0x0000)
> HCI Event: Command Complete (0x0e) plen 4                 #33 [hci0] 9.401057
      LE Set Extended Scan Enable (0x08|0x0042) ncmd 1
        Status: Success (0x00)
@ MGMT Event: Command Complete (0x0001) plen 4         {0x0001} [hci0] 9.401337
      Stop Discovery (0x0024) plen 1
        Status: Success (0x00)
        Address type: 0x07
          BR/EDR
          LE Public
          LE Random
@ MGMT Event: Discovering (0x0013) plen 2              {0x0001} [hci0] 9.401346
        Address type: 0x07
          BR/EDR
          LE Public
          LE Random
        Discovery: Disabled (0x00)
< HCI Command: LE Set Address Resol.. (0x08|0x002d) plen 1  #34 [hci0] 9.401485
        Address resolution: Enabled (0x01)
bluetoothd[2915165]: @ MGMT Command.. (0x0024) plen 1  {0x0001} [hci0] 9.401580
        Address type: 0x07
          BR/EDR
          LE Public
          LE Random
@ MGMT Event: Command Complete (0x0001) plen 4         {0x0001} [hci0] 9.401586
      Stop Discovery (0x0024) plen 1
        Status: Rejected (0x0b)
        Address type: 0x07
          BR/EDR
          LE Public
          LE Random
bluetoothd[2915165]: @ MGMT Command.. (0x0019) plen 8  {0x0001} [hci0] 9.401634
        LE Address: C0:DE:54:15:00:51 (Static)
        Capability: NoInputNoOutput (0x03)
> HCI Event: Command Complete (0x0e) plen 4                 #35 [hci0] 9.402093
      LE Set Address Resolution Enable (0x08|0x002d) ncmd 1
        Status: Success (0x00)
< HCI Command: LE Set Extended Sca.. (0x08|0x0041) plen 13  #36 [hci0] 9.402441
        Own address type: Public (0x00)
        Filter policy: Ignore not in accept list (0x01)
        PHYs: 0x05
        Entry 0: LE 1M
          Type: Passive (0x00)
          Interval: 60.000 msec (0x0060)
          Window: 60.000 msec (0x0060)
        Entry 1: LE Coded
          Type: Passive (0x00)
          Interval: 180.000 msec (0x0120)
          Window: 180.000 msec (0x0120)
> HCI Event: Command Complete (0x0e) plen 4                 #37 [hci0] 9.402977
      LE Set Extended Scan Parameters (0x08|0x0041) ncmd 1
        Status: Success (0x00)
< HCI Command: LE Set Extended Scan.. (0x08|0x0042) plen 6  #38 [hci0] 9.403294
        Extended scan: Enabled (0x01)
        Filter duplicates: Enabled (0x01)
        Duration: 0 msec (0x0000)
        Period: 0.00 sec (0x0000)
> HCI Event: Command Complete (0x0e) plen 4                 #39 [hci0] 9.403976
      LE Set Extended Scan Enable (0x08|0x0042) ncmd 1
        Status: Success (0x00)
@ MGMT Event: Connect Failed (0x000d) plen 8           {0x0001} [hci0] 9.404238
        LE Address: C0:DE:54:15:00:51 (Static)
        Status: Disconnected (0x0e)
@ MGMT Event: Command Complete (0x0001) plen 10        {0x0001} [hci0] 9.428748
      Pair Device (0x0019) plen 7
        Status: Disconnected (0x0e)
        LE Address: C0:DE:54:15:00:51 (Static)
< HCI Command: LE Set Extended Scan.. (0x08|0x0042) plen 6  #40 [hci0] 9.438836
        Extended scan: Disabled (0x00)
        Filter duplicates: Disabled (0x00)
        Duration: 0 msec (0x0000)
        Period: 0.00 sec (0x0000)
> HCI Event: Command Complete (0x0e) plen 4                 #41 [hci0] 9.467074
      LE Set Extended Scan Enable (0x08|0x0042) ncmd 1
        Status: Success (0x00)
bluetoothd[2915165]: @ MGMT Comman.. (0x003a) plen 4  {0x0001} [hci0] 14.725945
        Address type: 0x01
          BR/EDR
        RSSI: invalid (0x7f)
        UUIDs: 0
< HCI Command: Inquiry (0x01|0x0001) plen 5                #42 [hci0] 14.726155
        Access code: 0x9e8b33 (General Inquiry)
        Length: 10.24s (0x08)
        Num responses: 0
> HCI Event: Command Status (0x0f) plen 4                  #43 [hci0] 14.820451
      Inquiry (0x01|0x0001) ncmd 1
        Status: Success (0x00)
@ MGMT Event: Command Complete (0x0001) plen 4        {0x0001} [hci0] 14.820670
      Start Service Discovery (0x003a) plen 1
        Status: Success (0x00)
        Address type: 0x01
          BR/EDR
@ MGMT Event: Discovering (0x0013) plen 2             {0x0001} [hci0] 14.820678
        Address type: 0x01
          BR/EDR
        Discovery: Enabled (0x01)
> HCI Event: Inquiry Complete (0x01) plen 1                #44 [hci0] 25.125126
        Status: Success (0x00)
@ MGMT Event: Discovering (0x0013) plen 2             {0x0001} [hci0] 25.125262
        Address type: 0x01
          BR/EDR
        Discovery: Disabled (0x00)
bluetoothd[2915165]: @ MGMT Comman.. (0x003a) plen 4  {0x0001} [hci0] 25.125530
        Address type: 0x01
          BR/EDR
        RSSI: invalid (0x7f)
        UUIDs: 0
< HCI Command: Inquiry (0x01|0x0001) plen 5                #45 [hci0] 25.125795
        Access code: 0x9e8b33 (General Inquiry)
        Length: 10.24s (0x08)
        Num responses: 0
> HCI Event: Command Status (0x0f) plen 4                  #46 [hci0] 25.127027
      Inquiry (0x01|0x0001) ncmd 1
        Status: Success (0x00)
@ MGMT Event: Command Complete (0x0001) plen 4        {0x0001} [hci0] 25.127236
      Start Service Discovery (0x003a) plen 1
        Status: Success (0x00)
        Address type: 0x01
          BR/EDR
@ MGMT Event: Discovering (0x0013) plen 2             {0x0001} [hci0] 25.127247
        Address type: 0x01
          BR/EDR
        Discovery: Enabled (0x01)
> HCI Event: Inquiry Complete (0x01) plen 1                #47 [hci0] 35.431864
        Status: Success (0x00)
@ MGMT Event: Discovering (0x0013) plen 2             {0x0001} [hci0] 35.431911
        Address type: 0x01
          BR/EDR
        Discovery: Disabled (0x00)
bluetoothd[2915165]: @ MGMT Comman.. (0x003a) plen 4  {0x0001} [hci0] 35.432084
        Address type: 0x01
          BR/EDR
        RSSI: invalid (0x7f)
        UUIDs: 0
< HCI Command: Inquiry (0x01|0x0001) plen 5                #48 [hci0] 35.432316
        Access code: 0x9e8b33 (General Inquiry)
        Length: 10.24s (0x08)
        Num responses: 0
> HCI Event: Command Status (0x0f) plen 4                  #49 [hci0] 35.433713
      Inquiry (0x01|0x0001) ncmd 1
        Status: Success (0x00)
@ MGMT Event: Command Complete (0x0001) plen 4        {0x0001} [hci0] 35.433970
      Start Service Discovery (0x003a) plen 1
        Status: Success (0x00)
        Address type: 0x01
          BR/EDR
@ MGMT Event: Discovering (0x0013) plen 2             {0x0001} [hci0] 35.433982
        Address type: 0x01
          BR/EDR
        Discovery: Enabled (0x01)
> HCI Event: Inquiry Complete (0x01) plen 1                #50 [hci0] 45.739403
        Status: Success (0x00)
@ MGMT Event: Discovering (0x0013) plen 2             {0x0001} [hci0] 45.739511
        Address type: 0x01
          BR/EDR
        Discovery: Disabled (0x00)
bluetoothd[2915165]: @ MGMT Comman.. (0x003a) plen 4  {0x0001} [hci0] 45.739601
        Address type: 0x01
          BR/EDR
        RSSI: invalid (0x7f)
        UUIDs: 0
< HCI Command: Inquiry (0x01|0x0001) plen 5                #51 [hci0] 45.739639
        Access code: 0x9e8b33 (General Inquiry)
        Length: 10.24s (0x08)
        Num responses: 0
> HCI Event: Command Status (0x0f) plen 4                  #52 [hci0] 45.740387
      Inquiry (0x01|0x0001) ncmd 1
        Status: Success (0x00)
@ MGMT Event: Command Complete (0x0001) plen 4        {0x0001} [hci0] 45.740628
      Start Service Discovery (0x003a) plen 1
        Status: Success (0x00)
        Address type: 0x01
          BR/EDR
@ MGMT Event: Discovering (0x0013) plen 2             {0x0001} [hci0] 45.740640
        Address type: 0x01
          BR/EDR
        Discovery: Enabled (0x01)
> HCI Event: Inquiry Complete (0x01) plen 1                #53 [hci0] 56.045082
        Status: Success (0x00)
@ MGMT Event: Discovering (0x0013) plen 2             {0x0001} [hci0] 56.045115
        Address type: 0x01
          BR/EDR
        Discovery: Disabled (0x00)
bluetoothd[2915165]: @ MGMT Comman.. (0x003a) plen 4  {0x0001} [hci0] 56.045280
        Address type: 0x01
          BR/EDR
        RSSI: invalid (0x7f)
        UUIDs: 0
< HCI Command: Inquiry (0x01|0x0001) plen 5                #54 [hci0] 56.045386
        Access code: 0x9e8b33 (General Inquiry)
        Length: 10.24s (0x08)
        Num responses: 0
> HCI Event: Command Status (0x0f) plen 4                  #55 [hci0] 56.046062
      Inquiry (0x01|0x0001) ncmd 1
        Status: Success (0x00)
@ MGMT Event: Command Complete (0x0001) plen 4        {0x0001} [hci0] 56.046166
      Start Service Discovery (0x003a) plen 1
        Status: Success (0x00)
        Address type: 0x01
          BR/EDR
@ MGMT Event: Discovering (0x0013) plen 2             {0x0001} [hci0] 56.046178
        Address type: 0x01
          BR/EDR
        Discovery: Enabled (0x01)
> HCI Event: Inquiry Complete (0x01) plen 1                #56 [hci0] 66.349738
        Status: Success (0x00)
@ MGMT Event: Discovering (0x0013) plen 2             {0x0001} [hci0] 66.349767
        Address type: 0x01
          BR/EDR
        Discovery: Disabled (0x00)
bluetoothd[2915165]: @ MGMT Comman.. (0x003a) plen 4  {0x0001} [hci0] 66.350071
        Address type: 0x01
          BR/EDR
        RSSI: invalid (0x7f)
        UUIDs: 0
< HCI Command: Inquiry (0x01|0x0001) plen 5                #57 [hci0] 66.350100
        Access code: 0x9e8b33 (General Inquiry)
        Length: 10.24s (0x08)
        Num responses: 0
> HCI Event: Command Status (0x0f) plen 4                  #58 [hci0] 66.350726
      Inquiry (0x01|0x0001) ncmd 1
        Status: Success (0x00)
@ MGMT Event: Command Complete (0x0001) plen 4        {0x0001} [hci0] 66.350875
      Start Service Discovery (0x003a) plen 1
        Status: Success (0x00)
        Address type: 0x01
          BR/EDR
@ MGMT Event: Discovering (0x0013) plen 2             {0x0001} [hci0] 66.350890
        Address type: 0x01
          BR/EDR
        Discovery: Enabled (0x01)
> HCI Event: Inquiry Complete (0x01) plen 1                #59 [hci0] 76.656517
        Status: Success (0x00)
@ MGMT Event: Discovering (0x0013) plen 2             {0x0001} [hci0] 76.656543
        Address type: 0x01
          BR/EDR
        Discovery: Disabled (0x00)
bluetoothd[2915165]: @ MGMT Comman.. (0x003a) plen 4  {0x0001} [hci0] 76.656654
        Address type: 0x01
          BR/EDR
        RSSI: invalid (0x7f)
        UUIDs: 0
< HCI Command: Inquiry (0x01|0x0001) plen 5                #60 [hci0] 76.656772
        Access code: 0x9e8b33 (General Inquiry)
        Length: 10.24s (0x08)
        Num responses: 0
> HCI Event: Command Status (0x0f) plen 4                  #61 [hci0] 76.657381
      Inquiry (0x01|0x0001) ncmd 1
        Status: Success (0x00)
@ MGMT Event: Command Complete (0x0001) plen 4        {0x0001} [hci0] 76.657547
      Start Service Discovery (0x003a) plen 1
        Status: Success (0x00)
        Address type: 0x01
          BR/EDR
@ MGMT Event: Discovering (0x0013) plen 2             {0x0001} [hci0] 76.657556
        Address type: 0x01
          BR/EDR
        Discovery: Enabled (0x01)
> HCI Event: Inquiry Complete (0x01) plen 1                #62 [hci0] 86.963048
        Status: Success (0x00)
@ MGMT Event: Discovering (0x0013) plen 2             {0x0001} [hci0] 86.963180
        Address type: 0x01
          BR/EDR
        Discovery: Disabled (0x00)
bluetoothd[2915165]: @ MGMT Comman.. (0x003a) plen 4  {0x0001} [hci0] 86.963252
        Address type: 0x01
          BR/EDR
        RSSI: invalid (0x7f)
        UUIDs: 0
< HCI Command: Inquiry (0x01|0x0001) plen 5                #63 [hci0] 86.963303
        Access code: 0x9e8b33 (General Inquiry)
        Length: 10.24s (0x08)
        Num responses: 0
> HCI Event: Command Status (0x0f) plen 4                  #64 [hci0] 86.964033
      Inquiry (0x01|0x0001) ncmd 1
        Status: Success (0x00)
@ MGMT Event: Command Complete (0x0001) plen 4        {0x0001} [hci0] 86.964246
      Start Service Discovery (0x003a) plen 1
        Status: Success (0x00)
        Address type: 0x01
          BR/EDR
@ MGMT Event: Discovering (0x0013) plen 2             {0x0001} [hci0] 86.964250
        Address type: 0x01
          BR/EDR
        Discovery: Enabled (0x01)
> HCI Event: Inquiry Complete (0x01) plen 1                #65 [hci0] 97.268789
        Status: Success (0x00)
@ MGMT Event: Discovering (0x0013) plen 2             {0x0001} [hci0] 97.268816
        Address type: 0x01
          BR/EDR
        Discovery: Disabled (0x00)
bluetoothd[2915165]: @ MGMT Comman.. (0x003a) plen 4  {0x0001} [hci0] 97.268911
        Address type: 0x01
          BR/EDR
        RSSI: invalid (0x7f)
        UUIDs: 0
< HCI Command: Inquiry (0x01|0x0001) plen 5                #66 [hci0] 97.268959
        Access code: 0x9e8b33 (General Inquiry)
        Length: 10.24s (0x08)
        Num responses: 0
> HCI Event: Command Status (0x0f) plen 4                  #67 [hci0] 97.269683
      Inquiry (0x01|0x0001) ncmd 1
        Status: Success (0x00)
@ MGMT Event: Command Complete (0x0001) plen 4        {0x0001} [hci0] 97.269792
      Start Service Discovery (0x003a) plen 1
        Status: Success (0x00)
        Address type: 0x01
          BR/EDR
@ MGMT Event: Discovering (0x0013) plen 2             {0x0001} [hci0] 97.269798
        Address type: 0x01
          BR/EDR
        Discovery: Enabled (0x01)
