Bluetooth monitor ver 5.72
btmon[1497474]: = Note: Linux version 6.17.0-14-generic (x86_64)       0.271561
btmon[1497474]: = Note: Bluetooth subsystem version 2.22               0.271563
= New Index: 68:34:21:E5:84:DF (Primary,USB,hci0)               [hci0] 0.271563
= Open Index: 68:34:21:E5:84:DF                                 [hci0] 0.271563
= Index Info: 68:34:21:E5:84:DF (Intel Corp.)                   [hci0] 0.271564
bluetoothd[2915165]: @ MGMT Open.. (privileged) version 1.23  {0x0001} 0.271564
> HCI Event: Command Complete (0x0e) plen 4                  #1 [hci0] 0.275259
      LE Set Extended Scan Enable (0x08|0x0042) ncmd 1
        Status: Success (0x00)
@ MGMT Event: Discovering (0x0013) plen 2              {0x0001} [hci0] 0.275269
        Address type: 0x07
          BR/EDR
          LE Public
          LE Random
        Discovery: Disabled (0x00)
@ MGMT Event: Command Complete (0x0001) plen 4         {0x0001} [hci0] 0.275375
      Stop Discovery (0x0024) plen 1
        Status: Success (0x00)
        Address type: 0x07
          BR/EDR
          LE Public
          LE Random
bluetoothd[2915165]: @ MGMT Command.. (0x003a) plen 4  {0x0001} [hci0] 0.275552
        Address type: 0x01
          BR/EDR
        RSSI: invalid (0x7f)
        UUIDs: 0
< HCI Command: Inquiry (0x01|0x0001) plen 5                  #2 [hci0] 0.275675
        Access code: 0x9e8b33 (General Inquiry)
        Length: 10.24s (0x08)
        Num responses: 0
> HCI Event: Command Status (0x0f) plen 4                    #3 [hci0] 0.277136
      Inquiry (0x01|0x0001) ncmd 1
        Status: Success (0x00)
@ MGMT Event: Command Complete (0x0001) plen 4         {0x0001} [hci0] 0.277276
      Start Service Discovery (0x003a) plen 1
        Status: Success (0x00)
        Address type: 0x01
          BR/EDR
@ MGMT Event: Discovering (0x0013) plen 2              {0x0001} [hci0] 0.277282
        Address type: 0x01
          BR/EDR
        Discovery: Enabled (0x01)
bluetoothctl[1497579]: @ MGMT Open: bluetooth.. version 1.23  {0x0002} 1.271667
> HCI Event: Inquiry Complete (0x01) plen 1                 #4 [hci0] 10.517463
        Status: Success (0x00)
@ MGMT Event: Discovering (0x0013) plen 2             {0x0001} [hci0] 10.517482
        Address type: 0x01
          BR/EDR
        Discovery: Disabled (0x00)
< HCI Command: LE Remove Device Fro.. (0x08|0x0012) plen 7  #5 [hci0] 10.517558
        Address type: Random (0x01)
        Address: 5C:A0:04:A6:75:BE (Resolvable)
bluetoothd[2915165]: @ MGMT Comman.. (0x003a) plen 4  {0x0001} [hci0] 10.517673
        Address type: 0x01
          BR/EDR
        RSSI: invalid (0x7f)
        UUIDs: 0
> HCI Event: Command Complete (0x0e) plen 4                 #6 [hci0] 10.518464
      LE Remove Device From Accept List (0x08|0x0012) ncmd 1
        Status: Success (0x00)
< HCI Command: LE Add Device To Acc.. (0x08|0x0011) plen 7  #7 [hci0] 10.518769
        Address type: Random (0x01)
        Address: 5B:40:82:EE:70:5E (Resolvable)
> HCI Event: Command Complete (0x0e) plen 4                 #8 [hci0] 10.519350
      LE Add Device To Accept List (0x08|0x0011) ncmd 1
        Status: Success (0x00)
< HCI Command: LE Set Address Resol.. (0x08|0x002d) plen 1  #9 [hci0] 10.519523
        Address resolution: Enabled (0x01)
> HCI Event: Command Complete (0x0e) plen 4                #10 [hci0] 10.520354
      LE Set Address Resolution Enable (0x08|0x002d) ncmd 1
        Status: Success (0x00)
< HCI Command: LE Set Extended Sc.. (0x08|0x0041) plen 13  #11 [hci0] 10.520538
        Own address type: Public (0x00)
        Filter policy: Ignore not in accept list (0x01)
        PHYs: 0x05
        Entry 0: LE 1M
          Type: Passive (0x00)
          Interval: 60.000 msec (0x0060)
          Window: 60.000 msec (0x0060)
        Entry 1: LE Coded
          Type: Passive (0x00)
          Interval: 180.000 msec (0x0120)
          Window: 180.000 msec (0x0120)
> HCI Event: Command Complete (0x0e) plen 4                #12 [hci0] 10.521349
      LE Set Extended Scan Parameters (0x08|0x0041) ncmd 1
        Status: Success (0x00)
< HCI Command: LE Set Extended Sca.. (0x08|0x0042) plen 6  #13 [hci0] 10.521591
        Extended scan: Enabled (0x01)
        Filter duplicates: Enabled (0x01)
        Duration: 0 msec (0x0000)
        Period: 0.00 sec (0x0000)
> HCI Event: Command Complete (0x0e) plen 4                #14 [hci0] 10.522348
      LE Set Extended Scan Enable (0x08|0x0042) ncmd 1
        Status: Success (0x00)
< HCI Command: Inquiry (0x01|0x0001) plen 5                #15 [hci0] 10.522491
        Access code: 0x9e8b33 (General Inquiry)
        Length: 10.24s (0x08)
        Num responses: 0
> HCI Event: LE Meta Event (0x3e) plen 44                  #16 [hci0] 10.539505
      LE Extended Advertising Report (0x0d)
        Num reports: 1
        Entry 0
          Event type: 0x0013
            Props: 0x0013
              Connectable
              Scannable
              Use legacy advertising PDUs
            Data status: [0;32mComplete[0m
          Legacy PDU Type: ADV_IND (0x0013)
          Address type: Random (0x01)
          Address: 5B:40:82:EE:70:5E (Resolvable)
          Primary PHY: LE 1M
          Secondary PHY: No packets
          SID: no ADI field (0xff)
          TX power: 127 dBm
          RSSI: -64 dBm (0xc0)
          Periodic advertising interval: 0.00 msec (0x0000)
          Direct address type: Public (0x00)
          Direct address: 00:00:00:00:00:00 (OUI 00-00-00)
          Data length: 0x12
        02 01 06 0e 09 58 49 41 4f 2d 6e 52 46 35 34 4c  .....XIAO-nRF54L
        31 35                                            15              
        Flags: 0x06
          LE General Discoverable Mode
          BR/EDR Not Supported
        Name (complete): XIAO-nRF54L15
> HCI Event: Command Status (0x0f) plen 4                  #17 [hci0] 10.540346
      Inquiry (0x01|0x0001) ncmd 1
        Status: Success (0x00)
@ MGMT Event: Command Complete (0x0001) plen 4        {0x0001} [hci0] 10.540361
      Start Service Discovery (0x003a) plen 1
        Status: Success (0x00)
        Address type: 0x01
          BR/EDR
@ MGMT Event: Discovering (0x0013) plen 2             {0x0001} [hci0] 10.540365
        Address type: 0x01
          BR/EDR
        Discovery: Enabled (0x01)
< HCI Command: LE Set Extended Sca.. (0x08|0x0042) plen 6  #18 [hci0] 10.540370
        Extended scan: Disabled (0x00)
        Filter duplicates: Disabled (0x00)
        Duration: 0 msec (0x0000)
        Period: 0.00 sec (0x0000)
> HCI Event: Command Complete (0x0e) plen 4                #19 [hci0] 10.545349
      LE Set Extended Scan Enable (0x08|0x0042) ncmd 1
        Status: Success (0x00)
< HCI Command: LE Extended Create.. (0x08|0x0043) plen 26  #20 [hci0] 10.545490
        Filter policy: Accept list is not used (0x00)
        Own address type: Public (0x00)
        Peer address type: Random (0x01)
        Peer address: 5B:40:82:EE:70:5E (Resolvable)
        Initiating PHYs: 0x01
        Entry 0: LE 1M
          Scan interval: 60.000 msec (0x0060)
          Scan window: 60.000 msec (0x0060)
          Min connection interval: 30.00 msec (0x0018)
          Max connection interval: 50.00 msec (0x0028)
          Connection latency: 0 (0x0000)
          Supervision timeout: 420 msec (0x002a)
          Min connection length: 0.000 msec (0x0000)
          Max connection length: 0.000 msec (0x0000)
> HCI Event: Command Status (0x0f) plen 4                  #21 [hci0] 10.547349
      LE Extended Create Connection (0x08|0x0043) ncmd 1
        Status: Success (0x00)
> HCI Event: LE Meta Event (0x3e) plen 31                  #22 [hci0] 10.569435
      LE Enhanced Connection Complete (0x0a)
        Status: Success (0x00)
        Handle: 2048
        Role: Central (0x00)
        Peer address type: Random (0x01)
        Peer address: 5B:40:82:EE:70:5E (Resolvable)
        Local resolvable private address: 00:00:00:00:00:00 (Non-Resolvable)
        Peer resolvable private address: 00:00:00:00:00:00 (Non-Resolvable)
        Connection interval: 45.00 msec (0x0024)
        Connection latency: 0 (0x0000)
        Supervision timeout: 420 msec (0x002a)
        Central clock accuracy: 0x00
@ MGMT Event: Device Connected (0x000b) plen 31       {0x0001} [hci0] 10.569449
        LE Address: 5B:40:82:EE:70:5E (Resolvable)
        Flags: 0x00000008
          Connection Locally Initiated
        Data length: 18
        Flags: 0x06
          LE General Discoverable Mode
          BR/EDR Not Supported
        Name (complete): XIAO-nRF54L15
btmon[1497474]: @ RAW Open: btmon (privileged) version 2.22  {0x0003} 10.569760
btmon[1497474]: @ RAW Close: btmon                           {0x0003} 10.569764
> HCI Event: LE Meta Event (0x3e) plen 4                   #23 [hci0] 10.570438
      LE Channel Selection Algorithm (0x14)
        Handle: 2048 Address: 5B:40:82:EE:70:5E (Resolvable)
        Algorithm: #2 (0x01)
< HCI Command: LE Read Remote Used.. (0x08|0x0016) plen 2  #24 [hci0] 10.592738
        Handle: 2048 Address: 5B:40:82:EE:70:5E (Resolvable)
> HCI Event: Command Status (0x0f) plen 4                  #25 [hci0] 10.593430
      LE Read Remote Used Features (0x08|0x0016) ncmd 1
        Status: Success (0x00)
> HCI Event: LE Meta Event (0x3e) plen 12                  #26 [hci0] 10.639459
      LE Read Remote Used Features (0x04)
        Status: Success (0x00)
        Handle: 2048 Address: 5B:40:82:EE:70:5E (Resolvable)
        Features: 0xff 0x41 0x01 0x00 0x00 0x00 0x00 0x00
          LE Encryption
          Connection Parameter Request Procedure
          Extended Reject Indication
          Peripheral-initiated Features Exchange
          LE Ping
          LE Data Packet Length Extension
          LL Privacy
          Extended Scanner Filter Policies
          LE 2M PHY
          Channel Selection Algorithm #2
          Minimum Number of Used Channels Procedure
bluetoothd[2915165]: < ACL Data TX: H.. flags 0x00 dlen 7  #27 [hci0] 10.640089
      ATT: Exchange MTU Request (0x02) len 2
        Client RX MTU: 517
> HCI Event: Number of Completed Packets (0x13) plen 5     #28 [hci0] 10.685455
        Num handles: 1
        Handle: 2048 Address: 5B:40:82:EE:70:5E (Resolvable)
        Count: 1
        #27: len 7 (1 Kb/s)
        Latency: 45 msec (45-45 msec ~45 msec)
> HCI Event: LE Meta Event (0x3e) plen 11                  #29 [hci0] 10.729454
      LE Data Length Change (0x07)
        Handle: 2048 Address: 5B:40:82:EE:70:5E (Resolvable)
        Max TX octets: 69
        Max TX time: 664
        Max RX octets: 27
        Max RX time: 328
> ACL Data RX: Handle 2048 flags 0x02 dlen 7               #30 [hci0] 10.819812
      ATT: Exchange MTU Response (0x03) len 2
        Server RX MTU: 65
bluetoothd[2915165]: < ACL Data TX:... flags 0x00 dlen 11  #31 [hci0] 10.820206
      ATT: Read By Type Request (0x08) len 6
        Handle range: 0x0001-0xffff
        Attribute type: Server Supported Features (0x2b3a)
> HCI Event: Number of Completed Packets (0x13) plen 5     #32 [hci0] 10.909486
        Num handles: 1
        Handle: 2048 Address: 5B:40:82:EE:70:5E (Resolvable)
        Count: 1
        #31: len 11 (0 Kb/s)
        Latency: 89 msec (45-89 msec ~67 msec)
> ACL Data RX: Handle 2048 flags 0x02 dlen 9               #33 [hci0] 11.044808
      ATT: Error Response (0x01) len 4
        Read By Type Request (0x08)
        Handle: 0x0001
        Error: Attribute Not Found (0x0a)
bluetoothd[2915165]: < ACL Data TX:... flags 0x00 dlen 11  #34 [hci0] 11.045210
      ATT: Read By Group Type Request (0x10) len 6
        Handle range: 0x0001-0xffff
        Attribute group type: Primary Service (0x2800)
> HCI Event: Number of Completed Packets (0x13) plen 5     #35 [hci0] 11.089442
        Num handles: 1
        Handle: 2048 Address: 5B:40:82:EE:70:5E (Resolvable)
        Count: 1
        #34: len 11 (2 Kb/s)
        Latency: 44 msec (44-89 msec ~55 msec)
> ACL Data RX: Handle 2048 flags 0x02 dlen 18              #36 [hci0] 11.136733
      ATT: Read By Group Type Response (0x11) len 13
        Attribute data length: 6
        Attribute group list: 2 entries
        Handle range: 0x0001-0x0008
        UUID: Generic Attribute Profile (0x1801)
        Handle range: 0x0009-0x0011
        UUID: Generic Access Profile (0x1800)
bluetoothd[2915165]: < ACL Data TX:... flags 0x00 dlen 11  #37 [hci0] 11.137228
      ATT: Read By Group Type Request (0x10) len 6
        Handle range: 0x0012-0xffff
        Attribute group type: Primary Service (0x2800)
> HCI Event: Number of Completed Packets (0x13) plen 5     #38 [hci0] 11.224458
        Num handles: 1
        Handle: 2048 Address: 5B:40:82:EE:70:5E (Resolvable)
        Count: 1
        #37: len 11 (1 Kb/s)
        Latency: 87 msec (44-89 msec ~71 msec)
> ACL Data RX: Handle 2048 flags 0x02 dlen 9               #39 [hci0] 11.269813
      ATT: Error Response (0x01) len 4
        Read By Group Type Request (0x10)
        Handle: 0x0012
        Error: Attribute Not Found (0x0a)
bluetoothd[2915165]: < ACL Data TX:... flags 0x00 dlen 11  #40 [hci0] 11.270313
      ATT: Read By Group Type Request (0x10) len 6
        Handle range: 0x0001-0xffff
        Attribute group type: Secondary Service (0x2801)
> HCI Event: LE Meta Event (0x3e) plen 6                   #41 [hci0] 11.313460
      LE PHY Update Complete (0x0c)
        Status: Success (0x00)
        Handle: 2048 Address: 5B:40:82:EE:70:5E (Resolvable)
        TX PHY: LE 2M (0x02)
        RX PHY: LE 2M (0x02)
> HCI Event: Number of Completed Packets (0x13) plen 5     #42 [hci0] 11.314370
        Num handles: 1
        Handle: 2048 Address: 5B:40:82:EE:70:5E (Resolvable)
        Count: 1
        #40: len 11 (2 Kb/s)
        Latency: 44 msec (44-89 msec ~57 msec)
> ACL Data RX: Handle 2048 flags 0x02 dlen 9               #43 [hci0] 11.359823
      ATT: Error Response (0x01) len 4
        Read By Group Type Request (0x10)
        Handle: 0x0001
        Error: Attribute Not Found (0x0a)
bluetoothd[2915165]: < ACL Data TX:... flags 0x00 dlen 11  #44 [hci0] 11.360275
      ATT: Read By Type Request (0x08) len 6
        Handle range: 0x0001-0x0011
        Attribute type: Include (0x2802)
> HCI Event: Number of Completed Packets (0x13) plen 5     #45 [hci0] 11.404375
        Num handles: 1
        Handle: 2048 Address: 5B:40:82:EE:70:5E (Resolvable)
        Count: 1
        #44: len 11 (2 Kb/s)
        Latency: 44 msec (44-89 msec ~50 msec)
> ACL Data RX: Handle 2048 flags 0x02 dlen 9               #46 [hci0] 11.449776
      ATT: Error Response (0x01) len 4
        Read By Type Request (0x08)
        Handle: 0x0001
        Error: Attribute Not Found (0x0a)
bluetoothd[2915165]: < ACL Data TX:... flags 0x00 dlen 11  #47 [hci0] 11.450185
      ATT: Read By Type Request (0x08) len 6
        Handle range: 0x0001-0x0011
        Attribute type: Characteristic (0x2803)
> HCI Event: Number of Completed Packets (0x13) plen 5     #48 [hci0] 11.494386
        Num handles: 1
        Handle: 2048 Address: 5B:40:82:EE:70:5E (Resolvable)
        Count: 1
        #47: len 11 (2 Kb/s)
        Latency: 44 msec (44-89 msec ~47 msec)
> ACL Data RX: Handle 2048 flags 0x02 dlen 27              #49 [hci0] 11.539761
> ACL Data RX: Handle 2048 flags 0x01 dlen 27              #50 [hci0] 11.539764
> ACL Data RX: Handle 2048 flags 0x01 dlen 1               #51 [hci0] 11.539765
      ATT: Read By Type Response (0x09) len 50
        Attribute data length: 7
        Attribute data list: 7 entries
        Handle: 0x0002
        Value: 200300052a
            Properties: 0x20
              Indicate (0x20)
            Value Handle: 0x0003
            Value UUID: Service Changed (0x2a05)
        Handle: 0x0005
        Value: 0a0600292b
            Properties: 0x0a
              Read (0x02)
              Write (0x08)
            Value Handle: 0x0006
            Value UUID: Client Supported Features (0x2b29)
        Handle: 0x0007
        Value: 0208002a2b
            Properties: 0x02
              Read (0x02)
            Value Handle: 0x0008
            Value UUID: Database Hash (0x2b2a)
        Handle: 0x000a
        Value: 0a0b00002a
            Properties: 0x0a
              Read (0x02)
              Write (0x08)
            Value Handle: 0x000b
            Value UUID: Device Name (0x2a00)
        Handle: 0x000c
        Value: 020d00012a
            Properties: 0x02
              Read (0x02)
            Value Handle: 0x000d
            Value UUID: Appearance (0x2a01)
        Handle: 0x000e
        Value: 020f00a62a
            Properties: 0x02
              Read (0x02)
            Value Handle: 0x000f
            Value UUID: Central Address Resolution (0x2aa6)
        Handle: 0x0010
        Value: 021100042a
            Properties: 0x02
              Read (0x02)
            Value Handle: 0x0011
            Value UUID: Peripheral Preferred Connection Parameters (0x2a04)
bluetoothd[2915165]: < ACL Data TX:... flags 0x00 dlen 11  #52 [hci0] 11.540137
      ATT: Read By Type Request (0x08) len 6
        Handle range: 0x0011-0x0011
        Attribute type: Characteristic (0x2803)
> HCI Event: Number of Completed Packets (0x13) plen 5     #53 [hci0] 11.584382
        Num handles: 1
        Handle: 2048 Address: 5B:40:82:EE:70:5E (Resolvable)
        Count: 1
        #52: len 11 (2 Kb/s)
        Latency: 44 msec (44-89 msec ~45 msec)
> ACL Data RX: Handle 2048 flags 0x02 dlen 9               #54 [hci0] 11.629756
      ATT: Error Response (0x01) len 4
        Read By Type Request (0x08)
        Handle: 0x0011
        Error: Attribute Not Found (0x0a)
bluetoothd[2915165]: < ACL Data TX:... flags 0x00 dlen 11  #55 [hci0] 11.630038
      ATT: Read By Type Request (0x08) len 6
        Handle range: 0x0001-0xffff
        Attribute type: Database Hash (0x2b2a)
> HCI Event: Number of Completed Packets (0x13) plen 5     #56 [hci0] 11.674444
        Num handles: 1
        Handle: 2048 Address: 5B:40:82:EE:70:5E (Resolvable)
        Count: 1
        #55: len 11 (2 Kb/s)
        Latency: 44 msec (44-89 msec ~45 msec)
> ACL Data RX: Handle 2048 flags 0x02 dlen 24              #57 [hci0] 11.720726
      ATT: Read By Type Response (0x09) len 19
        Attribute data length: 18
        Attribute data list: 1 entry
        Handle: 0x0008
        Value: 74822c08a3f1c9a633be5dbaa577e880
bluetoothd[2915165]: < ACL Data TX:... flags 0x00 dlen 11  #58 [hci0] 11.721033
      ATT: Read By Type Request (0x08) len 6
        Handle range: 0x0009-0xffff
        Attribute type: Database Hash (0x2b2a)
> HCI Event: Number of Completed Packets (0x13) plen 5     #59 [hci0] 11.809456
        Num handles: 1
        Handle: 2048 Address: 5B:40:82:EE:70:5E (Resolvable)
        Count: 1
        #58: len 11 (1 Kb/s)
        Latency: 88 msec (44-89 msec ~66 msec)
> ACL Data RX: Handle 2048 flags 0x02 dlen 9               #60 [hci0] 11.854733
      ATT: Error Response (0x01) len 4
        Read By Type Request (0x08)
        Handle: 0x0009
        Error: Attribute Not Found (0x0a)
bluetoothd[2915165]: < ACL Data TX: H.. flags 0x00 dlen 8  #61 [hci0] 11.855305
      ATT: Write Request (0x12) len 3
        Handle: 0x0006 Type: Client Supported Features (0x2b29)
          Data: 05
> HCI Event: Number of Completed Packets (0x13) plen 5     #62 [hci0] 11.899385
        Num handles: 1
        Handle: 2048 Address: 5B:40:82:EE:70:5E (Resolvable)
        Count: 1
        #61: len 8 (1 Kb/s)
        Latency: 44 msec (44-89 msec ~55 msec)
> ACL Data RX: Handle 2048 flags 0x02 dlen 5               #63 [hci0] 11.944741
      ATT: Write Response (0x13) len 0
bluetoothd[2915165]: < ACL Data TX: H.. flags 0x00 dlen 9  #64 [hci0] 11.945075
      ATT: Write Request (0x12) len 4
        Handle: 0x0004
          Data: 0200
> HCI Event: Number of Completed Packets (0x13) plen 5     #65 [hci0] 11.989391
        Num handles: 1
        Handle: 2048 Address: 5B:40:82:EE:70:5E (Resolvable)
        Count: 1
        #64: len 9 (1 Kb/s)
        Latency: 44 msec (44-89 msec ~49 msec)
> ACL Data RX: Handle 2048 flags 0x02 dlen 5               #66 [hci0] 12.034736
      ATT: Write Response (0x13) len 0
bluetoothd[2915165]: < ACL Data TX: H.. flags 0x00 dlen 7  #67 [hci0] 12.035099
      ATT: Read Request (0x0a) len 2
        Handle: 0x000b Type: Device Name (0x2a00)
> HCI Event: Number of Completed Packets (0x13) plen 5     #68 [hci0] 12.079471
        Num handles: 1
        Handle: 2048 Address: 5B:40:82:EE:70:5E (Resolvable)
        Count: 1
        #67: len 7 (1 Kb/s)
        Latency: 44 msec (44-89 msec ~47 msec)
> ACL Data RX: Handle 2048 flags 0x02 dlen 18              #69 [hci0] 12.124733
      ATT: Read Response (0x0b) len 13
bluetoothd[2915165]: < ACL Data TX: H.. flags 0x00 dlen 7  #70 [hci0] 12.125219
      ATT: Read Request (0x0a) len 2
        Handle: 0x000d Type: Appearance (0x2a01)
> HCI Event: Number of Completed Packets (0x13) plen 5     #71 [hci0] 12.169530
        Num handles: 1
        Handle: 2048 Address: 5B:40:82:EE:70:5E (Resolvable)
        Count: 1
        #70: len 7 (1 Kb/s)
        Latency: 44 msec (44-89 msec ~45 msec)
> ACL Data RX: Handle 2048 flags 0x02 dlen 7               #72 [hci0] 12.214741
      ATT: Read Response (0x0b) len 2
bluetoothctl[1497579]: @ MGMT Close: bluetoothctl            {0x0002} 13.286501
bluetoothctl[1498643]: @ MGMT Open: bluetoot.. version 1.23  {0x0002} 13.296520
bluetoothd[2915165]: @ MGMT Comman.. (0x0024) plen 1  {0x0001} [hci0] 13.301540
        Address type: 0x01
          BR/EDR
< HCI Command: Inquiry Cancel (0x01|0x0002) plen 0         #73 [hci0] 13.301749
> HCI Event: Command Complete (0x0e) plen 4                #74 [hci0] 13.303420
      Inquiry Cancel (0x01|0x0002) ncmd 1
        Status: Success (0x00)
@ MGMT Event: Discovering (0x0013) plen 2             {0x0001} [hci0] 13.303521
        Address type: 0x01
          BR/EDR
        Discovery: Disabled (0x00)
@ MGMT Event: Command Complete (0x0001) plen 4        {0x0001} [hci0] 13.303539
      Stop Discovery (0x0024) plen 1
        Status: Success (0x00)
        Address type: 0x01
          BR/EDR
bluetoothd[2915165]: @ MGMT Comman.. (0x0019) plen 8  {0x0001} [hci0] 13.303553
        LE Address: 5B:40:82:EE:70:5E (Resolvable)
        Capability: DisplayYesNo (0x01)
< ACL Data TX: Handle 2048 flags 0x00 dlen 11              #75 [hci0] 13.303581
      SMP: Pairing Request (0x01) len 6
        IO capability: DisplayYesNo (0x01)
        OOB data: Authentication data not present (0x00)
        Authentication requirement: Bonding, MITM, SC, No Keypresses, CT2 (0x2d)
        Max encryption key size: 16
        Initiator key distribution: EncKey Sign LinkKey (0x0d)
        Responder key distribution: EncKey IdKey Sign LinkKey (0x0f)
> HCI Event: Number of Completed Packets (0x13) plen 5     #76 [hci0] 13.339512
        Num handles: 1
        Handle: 2048 Address: 5B:40:82:EE:70:5E (Resolvable)
        Count: 1
        #75: len 11 (2 Kb/s)
        Latency: 35 msec (35-89 msec ~40 msec)
> ACL Data RX: Handle 2048 flags 0x02 dlen 11              #77 [hci0] 13.384803
      SMP: Pairing Response (0x02) len 6
        IO capability: NoInputNoOutput (0x03)
        OOB data: Authentication data not present (0x00)
        Authentication requirement: Bonding, No MITM, SC, No Keypresses (0x09)
        Max encryption key size: 16
        Initiator key distribution: <none> (0x00)
        Responder key distribution: IdKey (0x02)
< ACL Data TX: Handle 2048 flags 0x00 dlen 69              #78 [hci0] 13.387380
      SMP: Pairing Public Key (0x0c) len 64
        X: 5f6adbfe1aea24ccd30a25ab685c897b9c10f4514e9e9bc7d94e7abae533b537
        Y: 4e1c8e4269b1c22e477ac1158488d8725d2ca7c64652d5f8badf12275a5c4491
> HCI Event: Number of Completed Packets (0x13) plen 5     #79 [hci0] 13.429411
        Num handles: 1
        Handle: 2048 Address: 5B:40:82:EE:70:5E (Resolvable)
        Count: 1
        #78: len 69 (13 Kb/s)
        Latency: 42 msec (35-89 msec ~41 msec)
> ACL Data RX: Handle 2048 flags 0x02 dlen 27              #80 [hci0] 13.474734
> ACL Data RX: Handle 2048 flags 0x01 dlen 27              #81 [hci0] 13.474737
> ACL Data RX: Handle 2048 flags 0x01 dlen 15              #82 [hci0] 13.474738
      SMP: Pairing Public Key (0x0c) len 64
        X: 726e250ddc754bd522c5dfdd9b8c33dfa880c8a5db993d7c34fc77f5ae8a3668
        Y: 351f33827857588b3a594aae9494b4bd67da889f99494b149f54ffbe3b1d8404
> ACL Data RX: Handle 2048 flags 0x02 dlen 21              #83 [hci0] 13.476728
      SMP: Pairing Confirm (0x03) len 16
        Confim value: cdf386adbd47a59b03df721f4af8cb36
< ACL Data TX: Handle 2048 flags 0x00 dlen 21              #84 [hci0] 13.476873
      SMP: Pairing Random (0x04) len 16
        Random value: 4fa7c209ca0a30c3acfb8e244dcf0ef1
> HCI Event: Number of Completed Packets (0x13) plen 5     #85 [hci0] 13.519552
        Num handles: 1
        Handle: 2048 Address: 5B:40:82:EE:70:5E (Resolvable)
        Count: 1
        #84: len 21 (4 Kb/s)
        Latency: 42 msec (35-89 msec ~42 msec)
> ACL Data RX: Handle 2048 flags 0x02 dlen 21              #86 [hci0] 13.565830
      SMP: Pairing Random (0x04) len 16
        Random value: e7d01ac97c87d348bc284bacdb55bb59
@ MGMT Event: User Confirmation R.. (0x000f) plen 12  {0x0001} [hci0] 13.565939
        LE Address: 5B:40:82:EE:70:5E (Resolvable)
        Confirm hint: 0x01
        Value: 0x0001e1b5
bluetoothd[2915165]: @ MGMT Comman.. (0x001c) plen 7  {0x0001} [hci0] 13.566143
        LE Address: 5B:40:82:EE:70:5E (Resolvable)
@ MGMT Event: Command Complete (0x0001) plen 10       {0x0001} [hci0] 13.566166
      User Confirmation Reply (0x001c) plen 7
        Status: Success (0x00)
        LE Address: 5B:40:82:EE:70:5E (Resolvable)
< ACL Data TX: Handle 2048 flags 0x00 dlen 21              #87 [hci0] 13.566288
      SMP: Pairing DHKey Check (0x0d) len 16
        E: 2033b92b4dafe68f96a38b3af349a9e7
> HCI Event: Number of Completed Packets (0x13) plen 5     #88 [hci0] 13.609490
        Num handles: 1
        Handle: 2048 Address: 5B:40:82:EE:70:5E (Resolvable)
        Count: 1
        #87: len 21 (3 Kb/s)
        Latency: 43 msec (35-89 msec ~42 msec)
> HCI Event: Disconnect Complete (0x05) plen 4             #89 [hci0] 14.014516
        Status: Success (0x00)
        Handle: 2048 Address: 5B:40:82:EE:70:5E (Resolvable)
        Reason: Connection Timeout (0x08)
@ MGMT Event: Device Disconnected (0x000c) plen 8     {0x0001} [hci0] 14.014629
        LE Address: 5B:40:82:EE:70:5E (Resolvable)
        Reason: Connection timeout (0x01)
@ MGMT Event: Command Complete (0x0001) plen 10       {0x0001} [hci0] 14.014642
      Pair Device (0x0019) plen 7
        Status: Failed (0x03)
        LE Address: 5B:40:82:EE:70:5E (Resolvable)
bluetoothd[2915165]: @ MGMT Comman.. (0x003a) plen 4  {0x0001} [hci0] 19.722497
        Address type: 0x01
          BR/EDR
        RSSI: invalid (0x7f)
        UUIDs: 0
< HCI Command: Inquiry (0x01|0x0001) plen 5                #90 [hci0] 19.722668
        Access code: 0x9e8b33 (General Inquiry)
        Length: 10.24s (0x08)
        Num responses: 0
> HCI Event: Command Status (0x0f) plen 4                  #91 [hci0] 19.816645
      Inquiry (0x01|0x0001) ncmd 1
        Status: Success (0x00)
@ MGMT Event: Command Complete (0x0001) plen 4        {0x0001} [hci0] 19.816944
      Start Service Discovery (0x003a) plen 1
        Status: Success (0x00)
        Address type: 0x01
          BR/EDR
@ MGMT Event: Discovering (0x0013) plen 2             {0x0001} [hci0] 19.816958
        Address type: 0x01
          BR/EDR
        Discovery: Enabled (0x01)
> HCI Event: Inquiry Complete (0x01) plen 1                #92 [hci0] 30.120867
        Status: Success (0x00)
@ MGMT Event: Discovering (0x0013) plen 2             {0x0001} [hci0] 30.120900
        Address type: 0x01
          BR/EDR
        Discovery: Disabled (0x00)
bluetoothd[2915165]: @ MGMT Comman.. (0x003a) plen 4  {0x0001} [hci0] 30.121203
        Address type: 0x01
          BR/EDR
        RSSI: invalid (0x7f)
        UUIDs: 0
< HCI Command: Inquiry (0x01|0x0001) plen 5                #93 [hci0] 30.121341
        Access code: 0x9e8b33 (General Inquiry)
        Length: 10.24s (0x08)
        Num responses: 0
> HCI Event: Command Status (0x0f) plen 4                  #94 [hci0] 30.122774
      Inquiry (0x01|0x0001) ncmd 1
        Status: Success (0x00)
@ MGMT Event: Command Complete (0x0001) plen 4        {0x0001} [hci0] 30.122937
      Start Service Discovery (0x003a) plen 1
        Status: Success (0x00)
        Address type: 0x01
          BR/EDR
@ MGMT Event: Discovering (0x0013) plen 2             {0x0001} [hci0] 30.122945
        Address type: 0x01
          BR/EDR
        Discovery: Enabled (0x01)
> HCI Event: Inquiry Complete (0x01) plen 1                #95 [hci0] 40.427003
        Status: Success (0x00)
@ MGMT Event: Discovering (0x0013) plen 2             {0x0001} [hci0] 40.427118
        Address type: 0x01
          BR/EDR
        Discovery: Disabled (0x00)
bluetoothd[2915165]: @ MGMT Comman.. (0x003a) plen 4  {0x0001} [hci0] 40.427399
        Address type: 0x01
          BR/EDR
        RSSI: invalid (0x7f)
        UUIDs: 0
< HCI Command: Inquiry (0x01|0x0001) plen 5                #96 [hci0] 40.427679
        Access code: 0x9e8b33 (General Inquiry)
        Length: 10.24s (0x08)
        Num responses: 0
> HCI Event: Command Status (0x0f) plen 4                  #97 [hci0] 40.429067
      Inquiry (0x01|0x0001) ncmd 1
        Status: Success (0x00)
@ MGMT Event: Command Complete (0x0001) plen 4        {0x0001} [hci0] 40.429263
      Start Service Discovery (0x003a) plen 1
        Status: Success (0x00)
        Address type: 0x01
          BR/EDR
@ MGMT Event: Discovering (0x0013) plen 2             {0x0001} [hci0] 40.429275
        Address type: 0x01
          BR/EDR
        Discovery: Enabled (0x01)
> HCI Event: Inquiry Complete (0x01) plen 1                #98 [hci0] 50.733221
        Status: Success (0x00)
@ MGMT Event: Discovering (0x0013) plen 2             {0x0001} [hci0] 50.733358
        Address type: 0x01
          BR/EDR
        Discovery: Disabled (0x00)
bluetoothd[2915165]: @ MGMT Comman.. (0x003a) plen 4  {0x0001} [hci0] 50.733621
        Address type: 0x01
          BR/EDR
        RSSI: invalid (0x7f)
        UUIDs: 0
< HCI Command: Inquiry (0x01|0x0001) plen 5                #99 [hci0] 50.733856
        Access code: 0x9e8b33 (General Inquiry)
        Length: 10.24s (0x08)
        Num responses: 0
> HCI Event: Command Status (0x0f) plen 4                 #100 [hci0] 50.735205
      Inquiry (0x01|0x0001) ncmd 1
        Status: Success (0x00)
@ MGMT Event: Command Complete (0x0001) plen 4        {0x0001} [hci0] 50.735447
      Start Service Discovery (0x003a) plen 1
        Status: Success (0x00)
        Address type: 0x01
          BR/EDR
@ MGMT Event: Discovering (0x0013) plen 2             {0x0001} [hci0] 50.735454
        Address type: 0x01
          BR/EDR
        Discovery: Enabled (0x01)
> HCI Event: Inquiry Complete (0x01) plen 1               #101 [hci0] 61.039562
        Status: Success (0x00)
@ MGMT Event: Discovering (0x0013) plen 2             {0x0001} [hci0] 61.039736
        Address type: 0x01
          BR/EDR
        Discovery: Disabled (0x00)
bluetoothd[2915165]: @ MGMT Comman.. (0x003a) plen 4  {0x0001} [hci0] 61.039960
        Address type: 0x01
          BR/EDR
        RSSI: invalid (0x7f)
        UUIDs: 0
< HCI Command: Inquiry (0x01|0x0001) plen 5               #102 [hci0] 61.040204
        Access code: 0x9e8b33 (General Inquiry)
        Length: 10.24s (0x08)
        Num responses: 0
> HCI Event: Command Status (0x0f) plen 4                 #103 [hci0] 61.041418
      Inquiry (0x01|0x0001) ncmd 1
        Status: Success (0x00)
@ MGMT Event: Command Complete (0x0001) plen 4        {0x0001} [hci0] 61.041623
      Start Service Discovery (0x003a) plen 1
        Status: Success (0x00)
        Address type: 0x01
          BR/EDR
@ MGMT Event: Discovering (0x0013) plen 2             {0x0001} [hci0] 61.041630
        Address type: 0x01
          BR/EDR
        Discovery: Enabled (0x01)
> HCI Event: Inquiry Complete (0x01) plen 1               #104 [hci0] 71.344740
        Status: Success (0x00)
@ MGMT Event: Discovering (0x0013) plen 2             {0x0001} [hci0] 71.344840
        Address type: 0x01
          BR/EDR
        Discovery: Disabled (0x00)
bluetoothd[2915165]: @ MGMT Comman.. (0x003a) plen 4  {0x0001} [hci0] 71.345015
        Address type: 0x01
          BR/EDR
        RSSI: invalid (0x7f)
        UUIDs: 0
< HCI Command: Inquiry (0x01|0x0001) plen 5               #105 [hci0] 71.345158
        Access code: 0x9e8b33 (General Inquiry)
        Length: 10.24s (0x08)
        Num responses: 0
> HCI Event: Command Status (0x0f) plen 4                 #106 [hci0] 71.346638
      Inquiry (0x01|0x0001) ncmd 1
        Status: Success (0x00)
@ MGMT Event: Command Complete (0x0001) plen 4        {0x0001} [hci0] 71.346758
      Start Service Discovery (0x003a) plen 1
        Status: Success (0x00)
        Address type: 0x01
          BR/EDR
@ MGMT Event: Discovering (0x0013) plen 2             {0x0001} [hci0] 71.346760
        Address type: 0x01
          BR/EDR
        Discovery: Enabled (0x01)
bluetoothctl[1498643]: @ MGMT Close: bluetoothctl            {0x0002} 73.330340
bluetoothctl[1504025]: @ MGMT Open: bluetoot.. version 1.23  {0x0002} 73.341905
> HCI Event: Inquiry Complete (0x01) plen 1               #107 [hci0] 81.650882
        Status: Success (0x00)
@ MGMT Event: Discovering (0x0013) plen 2             {0x0001} [hci0] 81.650999
        Address type: 0x01
          BR/EDR
        Discovery: Disabled (0x00)
bluetoothd[2915165]: @ MGMT Comman.. (0x003a) plen 4  {0x0001} [hci0] 81.651263
        Address type: 0x01
          BR/EDR
        RSSI: invalid (0x7f)
        UUIDs: 0
< HCI Command: Inquiry (0x01|0x0001) plen 5               #108 [hci0] 81.651571
        Access code: 0x9e8b33 (General Inquiry)
        Length: 10.24s (0x08)
        Num responses: 0
> HCI Event: Command Status (0x0f) plen 4                 #109 [hci0] 81.652962
      Inquiry (0x01|0x0001) ncmd 1
        Status: Success (0x00)
@ MGMT Event: Command Complete (0x0001) plen 4        {0x0001} [hci0] 81.653222
      Start Service Discovery (0x003a) plen 1
        Status: Success (0x00)
        Address type: 0x01
          BR/EDR
@ MGMT Event: Discovering (0x0013) plen 2             {0x0001} [hci0] 81.653228
        Address type: 0x01
          BR/EDR
        Discovery: Enabled (0x01)
bluetoothctl[1504025]: @ MGMT Close: bluetoothctl            {0x0002} 85.367167
bluetoothctl[1505113]: @ MGMT Open: bluetoot.. version 1.23  {0x0002} 85.374649
