Bluetooth monitor ver 5.72
btmon[1828283]: = Note: Linux version 6.17.0-14-generic (x86_64)       0.355628
btmon[1828283]: = Note: Bluetooth subsystem version 2.22               0.355629
= New Index: 68:34:21:E5:84:DF (Primary,USB,hci0)               [hci0] 0.355630
= Open Index: 68:34:21:E5:84:DF                                 [hci0] 0.355630
= Index Info: 68:34:21:E5:84:DF (Intel Corp.)                   [hci0] 0.355631
bluetoothd[3155986]: @ MGMT Open.. (privileged) version 1.23  {0x0001} 0.355632
> HCI Event: Inquiry Complete (0x01) plen 1                  #1 [hci0] 6.426684
        Status: Success (0x00)
@ MGMT Event: Discovering (0x0013) plen 2              {0x0001} [hci0] 6.426827
        Address type: 0x01
          BR/EDR
        Discovery: Disabled (0x00)
bluetoothd[3155986]: @ MGMT Command.. (0x003a) plen 4  {0x0001} [hci0] 6.427091
        Address type: 0x01
          BR/EDR
        RSSI: invalid (0x7f)
        UUIDs: 0
< HCI Command: Inquiry (0x01|0x0001) plen 5                  #2 [hci0] 6.427318
        Access code: 0x9e8b33 (General Inquiry)
        Length: 10.24s (0x08)
        Num responses: 0
> HCI Event: Command Status (0x0f) plen 4                    #3 [hci0] 6.428601
      Inquiry (0x01|0x0001) ncmd 1
        Status: Success (0x00)
@ MGMT Event: Command Complete (0x0001) plen 4         {0x0001} [hci0] 6.428806
      Start Service Discovery (0x003a) plen 1
        Status: Success (0x00)
        Address type: 0x01
          BR/EDR
@ MGMT Event: Discovering (0x0013) plen 2              {0x0001} [hci0] 6.428812
        Address type: 0x01
          BR/EDR
        Discovery: Enabled (0x01)
bluetoothctl[1828946]: @ MGMT Op.. (privileged) version 1.23  {0x0002} 7.784664
> HCI Event: Inquiry Complete (0x01) plen 1                 #4 [hci0] 16.732902
        Status: Success (0x00)
@ MGMT Event: Discovering (0x0013) plen 2             {0x0002} [hci0] 16.733038
        Address type: 0x01
          BR/EDR
        Discovery: Disabled (0x00)
@ MGMT Event: Discovering (0x0013) plen 2             {0x0001} [hci0] 16.733038
        Address type: 0x01
          BR/EDR
        Discovery: Disabled (0x00)
bluetoothd[3155986]: @ MGMT Comman.. (0x003a) plen 4  {0x0001} [hci0] 16.733299
        Address type: 0x01
          BR/EDR
        RSSI: invalid (0x7f)
        UUIDs: 0
< HCI Command: Inquiry (0x01|0x0001) plen 5                 #5 [hci0] 16.733516
        Access code: 0x9e8b33 (General Inquiry)
        Length: 10.24s (0x08)
        Num responses: 0
> HCI Event: Command Status (0x0f) plen 4                   #6 [hci0] 16.734884
      Inquiry (0x01|0x0001) ncmd 1
        Status: Success (0x00)
@ MGMT Event: Command Complete (0x0001) plen 4        {0x0001} [hci0] 16.735146
      Start Service Discovery (0x003a) plen 1
        Status: Success (0x00)
        Address type: 0x01
          BR/EDR
@ MGMT Event: Discovering (0x0013) plen 2             {0x0002} [hci0] 16.735151
        Address type: 0x01
          BR/EDR
        Discovery: Enabled (0x01)
@ MGMT Event: Discovering (0x0013) plen 2             {0x0001} [hci0] 16.735151
        Address type: 0x01
          BR/EDR
        Discovery: Enabled (0x01)
bluetoothd[3155986]: @ MGMT Comman.. (0x0018) plen 1  {0x0001} [hci0] 19.165856
        Capability: KeyboardDisplay (0x04)
@ MGMT Event: Command Complete (0x0001) plen 3        {0x0001} [hci0] 19.165866
      Set IO Capability (0x0018) plen 0
        Status: Success (0x00)
bluetoothd[3155986]: @ MGMT Comman.. (0x0024) plen 1  {0x0001} [hci0] 19.165952
        Address type: 0x01
          BR/EDR
< HCI Command: Inquiry Cancel (0x01|0x0002) plen 0          #7 [hci0] 19.166159
> HCI Event: Command Complete (0x0e) plen 4                 #8 [hci0] 19.261963
      Inquiry Cancel (0x01|0x0002) ncmd 1
        Status: Success (0x00)
@ MGMT Event: Discovering (0x0013) plen 2             {0x0002} [hci0] 19.262092
        Address type: 0x01
          BR/EDR
        Discovery: Disabled (0x00)
@ MGMT Event: Discovering (0x0013) plen 2             {0x0001} [hci0] 19.262092
        Address type: 0x01
          BR/EDR
        Discovery: Disabled (0x00)
@ MGMT Event: Command Complete (0x0001) plen 4        {0x0001} [hci0] 19.262113
      Stop Discovery (0x0024) plen 1
        Status: Success (0x00)
        Address type: 0x01
          BR/EDR
bluetoothd[3155986]: @ MGMT Comman.. (0x003a) plen 4  {0x0001} [hci0] 19.262466
        Address type: 0x07
          BR/EDR
          LE Public
          LE Random
        RSSI: invalid (0x7f)
        UUIDs: 0
< HCI Command: LE Set Address Resol.. (0x08|0x002d) plen 1  #9 [hci0] 19.262577
        Address resolution: Disabled (0x00)
> HCI Event: Command Complete (0x0e) plen 4                #10 [hci0] 19.262959
      LE Set Address Resolution Enable (0x08|0x002d) ncmd 1
        Status: Success (0x00)
< HCI Command: LE Set Random Address (0x08|0x0005) plen 6  #11 [hci0] 19.263083
        Address: 25:F7:5B:0A:FF:84 (Non-Resolvable)
> HCI Event: Command Complete (0x0e) plen 4                #12 [hci0] 19.263959
      LE Set Random Address (0x08|0x0005) ncmd 1
        Status: Success (0x00)
< HCI Command: LE Set Extended Sc.. (0x08|0x0041) plen 13  #13 [hci0] 19.264095
        Own address type: Random (0x01)
        Filter policy: Accept all advertisement (0x00)
        PHYs: 0x05
        Entry 0: LE 1M
          Type: Active (0x01)
          Interval: 22.500 msec (0x0024)
          Window: 11.250 msec (0x0012)
        Entry 1: LE Coded
          Type: Active (0x01)
          Interval: 67.500 msec (0x006c)
          Window: 33.750 msec (0x0036)
> HCI Event: Command Complete (0x0e) plen 4                #14 [hci0] 19.264958
      LE Set Extended Scan Parameters (0x08|0x0041) ncmd 1
        Status: Success (0x00)
< HCI Command: LE Set Extended Sca.. (0x08|0x0042) plen 6  #15 [hci0] 19.265134
        Extended scan: Enabled (0x01)
        Filter duplicates: Disabled (0x00)
        Duration: 0 msec (0x0000)
        Period: 0.00 sec (0x0000)
> HCI Event: Command Complete (0x0e) plen 4                #16 [hci0] 19.265959
      LE Set Extended Scan Enable (0x08|0x0042) ncmd 1
        Status: Success (0x00)
@ MGMT Event: Discovering (0x0013) plen 2             {0x0002} [hci0] 19.266063
        Address type: 0x07
          BR/EDR
          LE Public
          LE Random
        Discovery: Enabled (0x01)
@ MGMT Event: Discovering (0x0013) plen 2             {0x0001} [hci0] 19.266063
        Address type: 0x07
          BR/EDR
          LE Public
          LE Random
        Discovery: Enabled (0x01)
< HCI Command: Inquiry (0x01|0x0001) plen 5                #17 [hci0] 19.266349
        Access code: 0x9e8b33 (General Inquiry)
        Length: 10.24s (0x08)
        Num responses: 0
> HCI Event: Command Status (0x0f) plen 4                  #18 [hci0] 19.274046
      Inquiry (0x01|0x0001) ncmd 1
        Status: Success (0x00)
@ MGMT Event: Command Complete (0x0001) plen 4        {0x0001} [hci0] 19.274273
      Start Service Discovery (0x003a) plen 1
        Status: Success (0x00)
        Address type: 0x07
          BR/EDR
          LE Public
          LE Random
> HCI Event: LE Meta Event (0x3e) plen 43                  #19 [hci0] 19.275077
      LE Extended Advertising Report (0x0d)
        Num reports: 1
        Entry 0
          Event type: 0x0013
            Props: 0x0013
              Connectable
              Scannable
              Use legacy advertising PDUs
            Data status: [0;32mComplete[0m
          Legacy PDU Type: ADV_IND (0x0013)
          Address type: Random (0x01)
          Address: 41:0D:85:B3:03:26 (Resolvable)
          Primary PHY: LE 1M
          Secondary PHY: No packets
          SID: no ADI field (0xff)
          TX power: 127 dBm
          RSSI: -80 dBm (0xb0)
          Periodic advertising interval: 0.00 msec (0x0000)
          Direct address type: Public (0x00)
          Direct address: 00:00:00:00:00:00 (OUI 00-00-00)
          Data length: 0x11
        02 01 1a 02 0a 0c 0a ff 4c 00 10 05 37 1c 99 ec  ........L...7...
        b7                                               .               
        Flags: 0x1a
          LE General Discoverable Mode
          Simultaneous LE and BR/EDR (Controller)
          Simultaneous LE and BR/EDR (Host)
        TX power: 12 dBm
        Company: Apple, Inc. (76)
          Type: Unknown (16)
          Data: 371c99ecb7
> HCI Event: LE Meta Event (0x3e) plen 26                  #20 [hci0] 19.275970
      LE Extended Advertising Report (0x0d)
        Num reports: 1
        Entry 0
          Event type: 0x001b
            Props: 0x001b
              Connectable
              Scannable
              Scan response
              Use legacy advertising PDUs
            Data status: [0;32mComplete[0m
          Legacy PDU Type: SCAN_RSP to an ADV_SCAN_IND (0x001b)
          Address type: Random (0x01)
          Address: 41:0D:85:B3:03:26 (Resolvable)
          Primary PHY: LE 1M
          Secondary PHY: No packets
          SID: no ADI field (0xff)
          TX power: 127 dBm
          RSSI: -79 dBm (0xb1)
          Periodic advertising interval: 0.00 msec (0x0000)
          Direct address type: Public (0x00)
          Direct address: 00:00:00:00:00:00 (OUI 00-00-00)
          Data length: 0x00
@ MGMT Event: Device Found (0x0012) plen 31           {0x0002} [hci0] 19.276055
        LE Address: 41:0D:85:B3:03:26 (Resolvable)
        RSSI: -79 dBm (0xb1)
        Flags: 0x00000000
        Data length: 17
        Flags: 0x1a
          LE General Discoverable Mode
          Simultaneous LE and BR/EDR (Controller)
          Simultaneous LE and BR/EDR (Host)
        TX power: 12 dBm
        Company: Apple, Inc. (76)
          Type: Unknown (16)
          Data: 371c99ecb7
@ MGMT Event: Device Found (0x0012) plen 31           {0x0001} [hci0] 19.276055
        LE Address: 41:0D:85:B3:03:26 (Resolvable)
        RSSI: -79 dBm (0xb1)
        Flags: 0x00000000
        Data length: 17
        Flags: 0x1a
          LE General Discoverable Mode
          Simultaneous LE and BR/EDR (Controller)
          Simultaneous LE and BR/EDR (Host)
        TX power: 12 dBm
        Company: Apple, Inc. (76)
          Type: Unknown (16)
          Data: 371c99ecb7
> HCI Event: LE Meta Event (0x3e) plen 35                  #21 [hci0] 19.390074
      LE Extended Advertising Report (0x0d)
        Num reports: 1
        Entry 0
          Event type: 0x0013
            Props: 0x0013
              Connectable
              Scannable
              Use legacy advertising PDUs
            Data status: [0;32mComplete[0m
          Legacy PDU Type: ADV_IND (0x0013)
          Address type: Random (0x01)
          Address: 40:00:00:8E:54:A8 (Resolvable)
          Primary PHY: LE 1M
          Secondary PHY: No packets
          SID: no ADI field (0xff)
          TX power: 127 dBm
          RSSI: -99 dBm (0x9d)
          Periodic advertising interval: 0.00 msec (0x0000)
          Direct address type: Public (0x00)
          Direct address: 00:00:00:00:00:00 (OUI 00-00-00)
          Data length: 0x09
        02 0a fd 05 16 2c fe 00 00                       .....,...       
        TX power: -3 dBm
        Service Data: Google (0xfe2c)
          Data: 0000
> HCI Event: LE Meta Event (0x3e) plen 26                  #22 [hci0] 20.155106
      LE Extended Advertising Report (0x0d)
        Num reports: 1
        Entry 0
          Event type: 0x0013
            Props: 0x0013
              Connectable
              Scannable
              Use legacy advertising PDUs
            Data status: [0;32mComplete[0m
          Legacy PDU Type: ADV_IND (0x0013)
          Address type: Public (0x00)
          Address: 40:00:00:8E:54:A8 (OUI 40-00-00)
          Primary PHY: LE 1M
          Secondary PHY: No packets
          SID: no ADI field (0xff)
          TX power: 127 dBm
          RSSI: -99 dBm (0x9d)
          Periodic advertising interval: 0.00 msec (0x0000)
          Direct address type: Public (0x00)
          Direct address: 00:00:00:00:00:00 (OUI 00-00-00)
          Data length: 0x00
@ MGMT Event: Device Found (0x0012) plen 23           {0x0002} [hci0] 20.155261
        LE Address: 40:00:00:8E:54:A8 (Resolvable)
        RSSI: -99 dBm (0x9d)
        Flags: 0x00000000
        Data length: 9
        TX power: -3 dBm
        Service Data: Google (0xfe2c)
          Data: 0000
@ MGMT Event: Device Found (0x0012) plen 23           {0x0001} [hci0] 20.155261
        LE Address: 40:00:00:8E:54:A8 (Resolvable)
        RSSI: -99 dBm (0x9d)
        Flags: 0x00000000
        Data length: 9
        TX power: -3 dBm
        Service Data: Google (0xfe2c)
          Data: 0000
> HCI Event: LE Meta Event (0x3e) plen 39                  #23 [hci0] 21.588137
      LE Extended Advertising Report (0x0d)
        Num reports: 1
        Entry 0
          Event type: 0x0013
            Props: 0x0013
              Connectable
              Scannable
              Use legacy advertising PDUs
            Data status: [0;32mComplete[0m
          Legacy PDU Type: ADV_IND (0x0013)
          Address type: Random (0x01)
          Address: C0:DE:54:15:00:51 (Static)
          Primary PHY: LE 1M
          Secondary PHY: No packets
          SID: no ADI field (0xff)
          TX power: 127 dBm
          RSSI: -93 dBm (0xa3)
          Periodic advertising interval: 0.00 msec (0x0000)
          Direct address type: Public (0x00)
          Direct address: 00:00:00:00:00:00 (OUI 00-00-00)
          Data length: 0x0d
        02 01 06 09 09 58 35 34 2d 50 41 49 52           .....X54-PAIR   
        Flags: 0x06
          LE General Discoverable Mode
          BR/EDR Not Supported
        Name (complete): X54-PAIR
@ MGMT Event: Device Found (0x0012) plen 14           {0x0002} [hci0] 21.588256
        LE Address: 40:00:00:8E:54:A8 (OUI 40-00-00)
        RSSI: -99 dBm (0x9d)
        Flags: 0x00000000
        Data length: 0
@ MGMT Event: Device Found (0x0012) plen 14           {0x0001} [hci0] 21.588256
        LE Address: 40:00:00:8E:54:A8 (OUI 40-00-00)
        RSSI: -99 dBm (0x9d)
        Flags: 0x00000000
        Data length: 0
bluetoothd[3155986]: = src/device.c:device_new() Unable to regist..   21.588619
bluetoothd[3155986]: = Unable to create object for found d..   [hci0] 21.588636
> HCI Event: LE Meta Event (0x3e) plen 39                  #24 [hci0] 21.791133
      LE Extended Advertising Report (0x0d)
        Num reports: 1
        Entry 0
          Event type: 0x0013
            Props: 0x0013
              Connectable
              Scannable
              Use legacy advertising PDUs
            Data status: [0;32mComplete[0m
          Legacy PDU Type: ADV_IND (0x0013)
          Address type: Random (0x01)
          Address: C0:DE:54:15:00:51 (Static)
          Primary PHY: LE 1M
          Secondary PHY: No packets
          SID: no ADI field (0xff)
          TX power: 127 dBm
          RSSI: -84 dBm (0xac)
          Periodic advertising interval: 0.00 msec (0x0000)
          Direct address type: Public (0x00)
          Direct address: 00:00:00:00:00:00 (OUI 00-00-00)
          Data length: 0x0d
        02 01 06 09 09 58 35 34 2d 50 41 49 52           .....X54-PAIR   
        Flags: 0x06
          LE General Discoverable Mode
          BR/EDR Not Supported
        Name (complete): X54-PAIR
> HCI Event: LE Meta Event (0x3e) plen 43                  #25 [hci0] 22.308169
      LE Extended Advertising Report (0x0d)
        Num reports: 1
        Entry 0
          Event type: 0x0013
            Props: 0x0013
              Connectable
              Scannable
              Use legacy advertising PDUs
            Data status: [0;32mComplete[0m
          Legacy PDU Type: ADV_IND (0x0013)
          Address type: Random (0x01)
          Address: 41:0D:85:B3:03:26 (Resolvable)
          Primary PHY: LE 1M
          Secondary PHY: No packets
          SID: no ADI field (0xff)
          TX power: 127 dBm
          RSSI: -85 dBm (0xab)
          Periodic advertising interval: 0.00 msec (0x0000)
          Direct address type: Public (0x00)
          Direct address: 00:00:00:00:00:00 (OUI 00-00-00)
          Data length: 0x11
        02 01 1a 02 0a 0c 0a ff 4c 00 10 05 37 1c 99 ec  ........L...7...
        b7                                               .               
        Flags: 0x1a
          LE General Discoverable Mode
          Simultaneous LE and BR/EDR (Controller)
          Simultaneous LE and BR/EDR (Host)
        TX power: 12 dBm
        Company: Apple, Inc. (76)
          Type: Unknown (16)
          Data: 371c99ecb7
@ MGMT Event: Device Found (0x0012) plen 27           {0x0002} [hci0] 22.308281
        LE Address: C0:DE:54:15:00:51 (Static)
        RSSI: -84 dBm (0xac)
        Flags: 0x00000000
        Data length: 13
        Flags: 0x06
          LE General Discoverable Mode
          BR/EDR Not Supported
        Name (complete): X54-PAIR
@ MGMT Event: Device Found (0x0012) plen 27           {0x0001} [hci0] 22.308281
        LE Address: C0:DE:54:15:00:51 (Static)
        RSSI: -84 dBm (0xac)
        Flags: 0x00000000
        Data length: 13
        Flags: 0x06
          LE General Discoverable Mode
          BR/EDR Not Supported
        Name (complete): X54-PAIR
> HCI Event: LE Meta Event (0x3e) plen 26                  #26 [hci0] 22.309172
      LE Extended Advertising Report (0x0d)
        Num reports: 1
        Entry 0
          Event type: 0x001b
            Props: 0x001b
              Connectable
              Scannable
              Scan response
              Use legacy advertising PDUs
            Data status: [0;32mComplete[0m
          Legacy PDU Type: SCAN_RSP to an ADV_SCAN_IND (0x001b)
          Address type: Random (0x01)
          Address: 41:0D:85:B3:03:26 (Resolvable)
          Primary PHY: LE 1M
          Secondary PHY: No packets
          SID: no ADI field (0xff)
          TX power: 127 dBm
          RSSI: -85 dBm (0xab)
          Periodic advertising interval: 0.00 msec (0x0000)
          Direct address type: Public (0x00)
          Direct address: 00:00:00:00:00:00 (OUI 00-00-00)
          Data length: 0x00
@ MGMT Event: Device Found (0x0012) plen 31           {0x0002} [hci0] 22.309334
        LE Address: 41:0D:85:B3:03:26 (Resolvable)
        RSSI: -85 dBm (0xab)
        Flags: 0x00000000
        Data length: 17
        Flags: 0x1a
          LE General Discoverable Mode
          Simultaneous LE and BR/EDR (Controller)
          Simultaneous LE and BR/EDR (Host)
        TX power: 12 dBm
        Company: Apple, Inc. (76)
          Type: Unknown (16)
          Data: 371c99ecb7
@ MGMT Event: Device Found (0x0012) plen 31           {0x0001} [hci0] 22.309334
        LE Address: 41:0D:85:B3:03:26 (Resolvable)
        RSSI: -85 dBm (0xab)
        Flags: 0x00000000
        Data length: 17
        Flags: 0x1a
          LE General Discoverable Mode
          Simultaneous LE and BR/EDR (Controller)
          Simultaneous LE and BR/EDR (Host)
        TX power: 12 dBm
        Company: Apple, Inc. (76)
          Type: Unknown (16)
          Data: 371c99ecb7
> HCI Event: LE Meta Event (0x3e) plen 43                  #27 [hci0] 22.423164
      LE Extended Advertising Report (0x0d)
        Num reports: 1
        Entry 0
          Event type: 0x0013
            Props: 0x0013
              Connectable
              Scannable
              Use legacy advertising PDUs
            Data status: [0;32mComplete[0m
          Legacy PDU Type: ADV_IND (0x0013)
          Address type: Public (0x00)
          Address: A4:C1:38:D0:E4:84 (Telink Semiconductor (Taipei) Co. Ltd.)
          Primary PHY: LE 1M
          Secondary PHY: No packets
          SID: no ADI field (0xff)
          TX power: 127 dBm
          RSSI: -84 dBm (0xac)
          Periodic advertising interval: 0.00 msec (0x0000)
          Direct address type: Public (0x00)
          Direct address: 00:00:00:00:00:00 (OUI 00-00-00)
          Data length: 0x11
        10 16 1a 18 a4 c1 38 d0 e4 84 00 ca 43 50 0b 6f  ......8.....CP.o
        d7                                               .               
        Service Data: Environmental Sensing (0x181a)
          Data: a4c138d0e48400ca43500b6fd7
> HCI Event: LE Meta Event (0x3e) plen 38                  #28 [hci0] 22.424187
      LE Extended Advertising Report (0x0d)
        Num reports: 1
        Entry 0
          Event type: 0x001b
            Props: 0x001b
              Connectable
              Scannable
              Scan response
              Use legacy advertising PDUs
            Data status: [0;32mComplete[0m
          Legacy PDU Type: SCAN_RSP to an ADV_SCAN_IND (0x001b)
          Address type: Public (0x00)
          Address: A4:C1:38:D0:E4:84 (Telink Semiconductor (Taipei) Co. Ltd.)
          Primary PHY: LE 1M
          Secondary PHY: No packets
          SID: no ADI field (0xff)
          TX power: 127 dBm
          RSSI: -84 dBm (0xac)
          Periodic advertising interval: 0.00 msec (0x0000)
          Direct address type: Public (0x00)
          Direct address: 00:00:00:00:00:00 (OUI 00-00-00)
          Data length: 0x0c
        0b 09 41 54 43 5f 44 30 45 34 38 34              ..ATC_D0E484    
        Name (complete): ATC_D0E484
@ MGMT Event: Device Found (0x0012) plen 43           {0x0002} [hci0] 22.424280
        LE Address: A4:C1:38:D0:E4:84 (Telink Semiconductor (Taipei) Co. Ltd.)
        RSSI: -84 dBm (0xac)
        Flags: 0x00000000
        Data length: 29
        Service Data: Environmental Sensing (0x181a)
          Data: a4c138d0e48400ca43500b6fd7
        Name (complete): ATC_D0E484
@ MGMT Event: Device Found (0x0012) plen 43           {0x0001} [hci0] 22.424280
        LE Address: A4:C1:38:D0:E4:84 (Telink Semiconductor (Taipei) Co. Ltd.)
        RSSI: -84 dBm (0xac)
        Flags: 0x00000000
        Data length: 29
        Service Data: Environmental Sensing (0x181a)
          Data: a4c138d0e48400ca43500b6fd7
        Name (complete): ATC_D0E484
> HCI Event: LE Meta Event (0x3e) plen 47                  #29 [hci0] 23.257201
      LE Extended Advertising Report (0x0d)
        Num reports: 1
        Entry 0
          Event type: 0x0013
            Props: 0x0013
              Connectable
              Scannable
              Use legacy advertising PDUs
            Data status: [0;32mComplete[0m
          Legacy PDU Type: ADV_IND (0x0013)
          Address type: Public (0x00)
          Address: A4:C1:38:75:8A:D6 (Telink Semiconductor (Taipei) Co. Ltd.)
          Primary PHY: LE 1M
          Secondary PHY: No packets
          SID: no ADI field (0xff)
          TX power: 127 dBm
          RSSI: -78 dBm (0xb2)
          Periodic advertising interval: 0.00 msec (0x0000)
          Direct address type: Public (0x00)
          Direct address: 00:00:00:00:00:00 (OUI 00-00-00)
          Data length: 0x15
        02 01 06 11 16 95 fe 30 58 5b 05 01 d6 8a 75 38  .......0X[....u8
        c1 a4 28 01 00                                   ..(..           
        Flags: 0x06
          LE General Discoverable Mode
          BR/EDR Not Supported
        Service Data: Xiaomi Inc. (0xfe95)
          Data: 30585b0501d68a7538c1a4280100
> HCI Event: LE Meta Event (0x3e) plen 38                  #30 [hci0] 23.258177
      LE Extended Advertising Report (0x0d)
        Num reports: 1
        Entry 0
          Event type: 0x001b
            Props: 0x001b
              Connectable
              Scannable
              Scan response
              Use legacy advertising PDUs
            Data status: [0;32mComplete[0m
          Legacy PDU Type: SCAN_RSP to an ADV_SCAN_IND (0x001b)
          Address type: Public (0x00)
          Address: A4:C1:38:75:8A:D6 (Telink Semiconductor (Taipei) Co. Ltd.)
          Primary PHY: LE 1M
          Secondary PHY: No packets
          SID: no ADI field (0xff)
          TX power: 127 dBm
          RSSI: -78 dBm (0xb2)
          Periodic advertising interval: 0.00 msec (0x0000)
          Direct address type: Public (0x00)
          Direct address: 00:00:00:00:00:00 (OUI 00-00-00)
          Data length: 0x0c
        0b 09 4c 59 57 53 44 30 33 4d 4d 43              ..LYWSD03MMC    
        Name (complete): LYWSD03MMC
@ MGMT Event: Device Found (0x0012) plen 47           {0x0002} [hci0] 23.258316
        LE Address: A4:C1:38:75:8A:D6 (Telink Semiconductor (Taipei) Co. Ltd.)
        RSSI: -78 dBm (0xb2)
        Flags: 0x00000000
        Data length: 33
        Flags: 0x06
          LE General Discoverable Mode
          BR/EDR Not Supported
        Service Data: Xiaomi Inc. (0xfe95)
          Data: 30585b0501d68a7538c1a4280100
        Name (complete): LYWSD03MMC
@ MGMT Event: Device Found (0x0012) plen 47           {0x0001} [hci0] 23.258316
        LE Address: A4:C1:38:75:8A:D6 (Telink Semiconductor (Taipei) Co. Ltd.)
        RSSI: -78 dBm (0xb2)
        Flags: 0x00000000
        Data length: 33
        Flags: 0x06
          LE General Discoverable Mode
          BR/EDR Not Supported
        Service Data: Xiaomi Inc. (0xfe95)
          Data: 30585b0501d68a7538c1a4280100
        Name (complete): LYWSD03MMC
> HCI Event: LE Meta Event (0x3e) plen 39                  #31 [hci0] 25.283244
      LE Extended Advertising Report (0x0d)
        Num reports: 1
        Entry 0
          Event type: 0x0013
            Props: 0x0013
              Connectable
              Scannable
              Use legacy advertising PDUs
            Data status: [0;32mComplete[0m
          Legacy PDU Type: ADV_IND (0x0013)
          Address type: Random (0x01)
          Address: C0:DE:54:15:00:51 (Static)
          Primary PHY: LE 1M
          Secondary PHY: No packets
          SID: no ADI field (0xff)
          TX power: 127 dBm
          RSSI: -86 dBm (0xaa)
          Periodic advertising interval: 0.00 msec (0x0000)
          Direct address type: Public (0x00)
          Direct address: 00:00:00:00:00:00 (OUI 00-00-00)
          Data length: 0x0d
        02 01 06 09 09 58 35 34 2d 50 41 49 52           .....X54-PAIR   
        Flags: 0x06
          LE General Discoverable Mode
          BR/EDR Not Supported
        Name (complete): X54-PAIR
> HCI Event: LE Meta Event (0x3e) plen 39                  #32 [hci0] 27.709324
      LE Extended Advertising Report (0x0d)
        Num reports: 1
        Entry 0
          Event type: 0x0013
            Props: 0x0013
              Connectable
              Scannable
              Use legacy advertising PDUs
            Data status: [0;32mComplete[0m
          Legacy PDU Type: ADV_IND (0x0013)
          Address type: Random (0x01)
          Address: C0:DE:54:15:00:51 (Static)
          Primary PHY: LE 1M
          Secondary PHY: No packets
          SID: no ADI field (0xff)
          TX power: 127 dBm
          RSSI: -86 dBm (0xaa)
          Periodic advertising interval: 0.00 msec (0x0000)
          Direct address type: Public (0x00)
          Direct address: 00:00:00:00:00:00 (OUI 00-00-00)
          Data length: 0x0d
        02 01 06 09 09 58 35 34 2d 50 41 49 52           .....X54-PAIR   
        Flags: 0x06
          LE General Discoverable Mode
          BR/EDR Not Supported
        Name (complete): X54-PAIR
> HCI Event: LE Meta Event (0x3e) plen 39                  #33 [hci0] 29.292349
      LE Extended Advertising Report (0x0d)
        Num reports: 1
        Entry 0
          Event type: 0x0013
            Props: 0x0013
              Connectable
              Scannable
              Use legacy advertising PDUs
            Data status: [0;32mComplete[0m
          Legacy PDU Type: ADV_IND (0x0013)
          Address type: Random (0x01)
          Address: C0:DE:54:15:00:51 (Static)
          Primary PHY: LE 1M
          Secondary PHY: No packets
          SID: no ADI field (0xff)
          TX power: 127 dBm
          RSSI: -93 dBm (0xa3)
          Periodic advertising interval: 0.00 msec (0x0000)
          Direct address type: Public (0x00)
          Direct address: 00:00:00:00:00:00 (OUI 00-00-00)
          Data length: 0x0d
        02 01 06 09 09 58 35 34 2d 50 41 49 52           .....X54-PAIR   
        Flags: 0x06
          LE General Discoverable Mode
          BR/EDR Not Supported
        Name (complete): X54-PAIR
> HCI Event: Inquiry Complete (0x01) plen 1                #34 [hci0] 29.515332
        Status: Success (0x00)
> HCI Event: LE Meta Event (0x3e) plen 39                  #35 [hci0] 29.621368
      LE Extended Advertising Report (0x0d)
        Num reports: 1
        Entry 0
          Event type: 0x0013
            Props: 0x0013
              Connectable
              Scannable
              Use legacy advertising PDUs
            Data status: [0;32mComplete[0m
          Legacy PDU Type: ADV_IND (0x0013)
          Address type: Random (0x01)
          Address: C0:DE:54:15:00:51 (Static)
          Primary PHY: LE 1M
          Secondary PHY: No packets
          SID: no ADI field (0xff)
          TX power: 127 dBm
          RSSI: -86 dBm (0xaa)
          Periodic advertising interval: 0.00 msec (0x0000)
          Direct address type: Public (0x00)
          Direct address: 00:00:00:00:00:00 (OUI 00-00-00)
          Data length: 0x0d
        02 01 06 09 09 58 35 34 2d 50 41 49 52           .....X54-PAIR   
        Flags: 0x06
          LE General Discoverable Mode
          BR/EDR Not Supported
        Name (complete): X54-PAIR
> HCI Event: LE Meta Event (0x3e) plen 39                  #36 [hci0] 29.624367
      LE Extended Advertising Report (0x0d)
        Num reports: 1
        Entry 0
          Event type: 0x0013
            Props: 0x0013
              Connectable
              Scannable
              Use legacy advertising PDUs
            Data status: [0;32mComplete[0m
          Legacy PDU Type: ADV_IND (0x0013)
          Address type: Random (0x01)
          Address: C0:DE:54:15:00:51 (Static)
          Primary PHY: LE 1M
          Secondary PHY: No packets
          SID: no ADI field (0xff)
          TX power: 127 dBm
          RSSI: -86 dBm (0xaa)
          Periodic advertising interval: 0.00 msec (0x0000)
          Direct address type: Public (0x00)
          Direct address: 00:00:00:00:00:00 (OUI 00-00-00)
          Data length: 0x0d
        02 01 06 09 09 58 35 34 2d 50 41 49 52           .....X54-PAIR   
        Flags: 0x06
          LE General Discoverable Mode
          BR/EDR Not Supported
        Name (complete): X54-PAIR
@ MGMT Event: Discovering (0x0013) plen 2             {0x0002} [hci0] 29.932004
        Address type: 0x07
          BR/EDR
          LE Public
          LE Random
        Discovery: Disabled (0x00)
@ MGMT Event: Discovering (0x0013) plen 2             {0x0001} [hci0] 29.932004
        Address type: 0x07
          BR/EDR
          LE Public
          LE Random
        Discovery: Disabled (0x00)
< HCI Command: LE Set Extended Sca.. (0x08|0x0042) plen 6  #37 [hci0] 29.932173
        Extended scan: Disabled (0x00)
        Filter duplicates: Disabled (0x00)
        Duration: 0 msec (0x0000)
        Period: 0.00 sec (0x0000)
bluetoothd[3155986]: @ MGMT Comman.. (0x003a) plen 4  {0x0001} [hci0] 29.932327
        Address type: 0x07
          BR/EDR
          LE Public
          LE Random
        RSSI: invalid (0x7f)
        UUIDs: 0
> HCI Event: Command Complete (0x0e) plen 4                #38 [hci0] 29.945394
      LE Set Extended Scan Enable (0x08|0x0042) ncmd 1
        Status: Success (0x00)
< HCI Command: LE Set Random Address (0x08|0x0005) plen 6  #39 [hci0] 29.945760
        Address: 29:52:DD:31:5F:E2 (Non-Resolvable)
> HCI Event: Command Complete (0x0e) plen 4                #40 [hci0] 29.946261
      LE Set Random Address (0x08|0x0005) ncmd 1
        Status: Success (0x00)
< HCI Command: LE Set Extended Sc.. (0x08|0x0041) plen 13  #41 [hci0] 29.946468
        Own address type: Random (0x01)
        Filter policy: Accept all advertisement (0x00)
        PHYs: 0x05
        Entry 0: LE 1M
          Type: Active (0x01)
          Interval: 22.500 msec (0x0024)
          Window: 11.250 msec (0x0012)
        Entry 1: LE Coded
          Type: Active (0x01)
          Interval: 67.500 msec (0x006c)
          Window: 33.750 msec (0x0036)
> HCI Event: Command Complete (0x0e) plen 4                #42 [hci0] 29.947257
      LE Set Extended Scan Parameters (0x08|0x0041) ncmd 1
        Status: Success (0x00)
< HCI Command: LE Set Extended Sca.. (0x08|0x0042) plen 6  #43 [hci0] 29.947507
        Extended scan: Enabled (0x01)
        Filter duplicates: Enabled (0x01)
        Duration: 0 msec (0x0000)
        Period: 0.00 sec (0x0000)
> HCI Event: Command Complete (0x0e) plen 4                #44 [hci0] 29.948258
      LE Set Extended Scan Enable (0x08|0x0042) ncmd 1
        Status: Success (0x00)
@ MGMT Event: Discovering (0x0013) plen 2             {0x0002} [hci0] 29.948373
        Address type: 0x07
          BR/EDR
          LE Public
          LE Random
        Discovery: Enabled (0x01)
@ MGMT Event: Discovering (0x0013) plen 2             {0x0001} [hci0] 29.948373
        Address type: 0x07
          BR/EDR
          LE Public
          LE Random
        Discovery: Enabled (0x01)
< HCI Command: Inquiry (0x01|0x0001) plen 5                #45 [hci0] 29.948490
        Access code: 0x9e8b33 (General Inquiry)
        Length: 10.24s (0x08)
        Num responses: 0
> HCI Event: Command Status (0x0f) plen 4                  #46 [hci0] 29.961337
      Inquiry (0x01|0x0001) ncmd 1
        Status: Success (0x00)
@ MGMT Event: Command Complete (0x0001) plen 4        {0x0001} [hci0] 29.961641
      Start Service Discovery (0x003a) plen 1
        Status: Success (0x00)
        Address type: 0x07
          BR/EDR
          LE Public
          LE Random
> HCI Event: LE Meta Event (0x3e) plen 43                  #47 [hci0] 29.978360
      LE Extended Advertising Report (0x0d)
        Num reports: 1
        Entry 0
          Event type: 0x0013
            Props: 0x0013
              Connectable
              Scannable
              Use legacy advertising PDUs
            Data status: [0;32mComplete[0m
          Legacy PDU Type: ADV_IND (0x0013)
          Address type: Public (0x00)
          Address: A4:C1:38:D0:E4:84 (Telink Semiconductor (Taipei) Co. Ltd.)
          Primary PHY: LE 1M
          Secondary PHY: No packets
          SID: no ADI field (0xff)
          TX power: 127 dBm
          RSSI: -81 dBm (0xaf)
          Periodic advertising interval: 0.00 msec (0x0000)
          Direct address type: Public (0x00)
          Direct address: 00:00:00:00:00:00 (OUI 00-00-00)
          Data length: 0x11
        10 16 1a 18 a4 c1 38 d0 e4 84 00 ca 43 50 0b 6f  ......8.....CP.o
        d7                                               .               
        Service Data: Environmental Sensing (0x181a)
          Data: a4c138d0e48400ca43500b6fd7
> HCI Event: LE Meta Event (0x3e) plen 38                  #48 [hci0] 29.979412
      LE Extended Advertising Report (0x0d)
        Num reports: 1
        Entry 0
          Event type: 0x001b
            Props: 0x001b
              Connectable
              Scannable
              Scan response
              Use legacy advertising PDUs
            Data status: [0;32mComplete[0m
          Legacy PDU Type: SCAN_RSP to an ADV_SCAN_IND (0x001b)
          Address type: Public (0x00)
          Address: A4:C1:38:D0:E4:84 (Telink Semiconductor (Taipei) Co. Ltd.)
          Primary PHY: LE 1M
          Secondary PHY: No packets
          SID: no ADI field (0xff)
          TX power: 127 dBm
          RSSI: -81 dBm (0xaf)
          Periodic advertising interval: 0.00 msec (0x0000)
          Direct address type: Public (0x00)
          Direct address: 00:00:00:00:00:00 (OUI 00-00-00)
          Data length: 0x0c
        0b 09 41 54 43 5f 44 30 45 34 38 34              ..ATC_D0E484    
        Name (complete): ATC_D0E484
@ MGMT Event: Device Found (0x0012) plen 43           {0x0002} [hci0] 29.979541
        LE Address: A4:C1:38:D0:E4:84 (Telink Semiconductor (Taipei) Co. Ltd.)
        RSSI: -81 dBm (0xaf)
        Flags: 0x00000000
        Data length: 29
        Service Data: Environmental Sensing (0x181a)
          Data: a4c138d0e48400ca43500b6fd7
        Name (complete): ATC_D0E484
@ MGMT Event: Device Found (0x0012) plen 43           {0x0001} [hci0] 29.979541
        LE Address: A4:C1:38:D0:E4:84 (Telink Semiconductor (Taipei) Co. Ltd.)
        RSSI: -81 dBm (0xaf)
        Flags: 0x00000000
        Data length: 29
        Service Data: Environmental Sensing (0x181a)
          Data: a4c138d0e48400ca43500b6fd7
        Name (complete): ATC_D0E484
> HCI Event: LE Meta Event (0x3e) plen 39                  #49 [hci0] 31.818456
      LE Extended Advertising Report (0x0d)
        Num reports: 1
        Entry 0
          Event type: 0x0013
            Props: 0x0013
              Connectable
              Scannable
              Use legacy advertising PDUs
            Data status: [0;32mComplete[0m
          Legacy PDU Type: ADV_IND (0x0013)
          Address type: Random (0x01)
          Address: C0:DE:54:15:00:51 (Static)
          Primary PHY: LE 1M
          Secondary PHY: No packets
          SID: no ADI field (0xff)
          TX power: 127 dBm
          RSSI: -86 dBm (0xaa)
          Periodic advertising interval: 0.00 msec (0x0000)
          Direct address type: Public (0x00)
          Direct address: 00:00:00:00:00:00 (OUI 00-00-00)
          Data length: 0x0d
        02 01 06 09 09 58 35 34 2d 50 41 49 52           .....X54-PAIR   
        Flags: 0x06
          LE General Discoverable Mode
          BR/EDR Not Supported
        Name (complete): X54-PAIR
> HCI Event: LE Meta Event (0x3e) plen 26                  #50 [hci0] 32.398495
      LE Extended Advertising Report (0x0d)
        Num reports: 1
        Entry 0
          Event type: 0x0013
            Props: 0x0013
              Connectable
              Scannable
              Use legacy advertising PDUs
            Data status: [0;32mComplete[0m
          Legacy PDU Type: ADV_IND (0x0013)
          Address type: Public (0x00)
          Address: C0:DE:54:15:00:51 (OUI C0-DE-54)
          Primary PHY: LE 1M
          Secondary PHY: No packets
          SID: no ADI field (0xff)
          TX power: 127 dBm
          RSSI: -86 dBm (0xaa)
          Periodic advertising interval: 0.00 msec (0x0000)
          Direct address type: Public (0x00)
          Direct address: 00:00:00:00:00:00 (OUI 00-00-00)
          Data length: 0x00
@ MGMT Event: Device Found (0x0012) plen 27           {0x0002} [hci0] 32.398595
        LE Address: C0:DE:54:15:00:51 (Static)
        RSSI: -86 dBm (0xaa)
        Flags: 0x00000000
        Data length: 13
        Flags: 0x06
          LE General Discoverable Mode
          BR/EDR Not Supported
        Name (complete): X54-PAIR
@ MGMT Event: Device Found (0x0012) plen 27           {0x0001} [hci0] 32.398595
        LE Address: C0:DE:54:15:00:51 (Static)
        RSSI: -86 dBm (0xaa)
        Flags: 0x00000000
        Data length: 13
        Flags: 0x06
          LE General Discoverable Mode
          BR/EDR Not Supported
        Name (complete): X54-PAIR
> HCI Event: LE Meta Event (0x3e) plen 35                  #51 [hci0] 33.163448
      LE Extended Advertising Report (0x0d)
        Num reports: 1
        Entry 0
          Event type: 0x0013
            Props: 0x0013
              Connectable
              Scannable
              Use legacy advertising PDUs
            Data status: [0;32mComplete[0m
          Legacy PDU Type: ADV_IND (0x0013)
          Address type: Random (0x01)
          Address: 40:00:00:8E:54:A8 (Resolvable)
          Primary PHY: LE 1M
          Secondary PHY: No packets
          SID: no ADI field (0xff)
          TX power: 127 dBm
          RSSI: -98 dBm (0x9e)
          Periodic advertising interval: 0.00 msec (0x0000)
          Direct address type: Public (0x00)
          Direct address: 00:00:00:00:00:00 (OUI 00-00-00)
          Data length: 0x09
        02 0a fd 05 16 2c fe 00 00                       .....,...       
        TX power: -3 dBm
        Service Data: Google (0xfe2c)
          Data: 0000
@ MGMT Event: Device Found (0x0012) plen 14           {0x0002} [hci0] 33.163572
        LE Address: C0:DE:54:15:00:51 (OUI C0-DE-54)
        RSSI: -86 dBm (0xaa)
        Flags: 0x00000000
        Data length: 0
@ MGMT Event: Device Found (0x0012) plen 14           {0x0001} [hci0] 33.163572
        LE Address: C0:DE:54:15:00:51 (OUI C0-DE-54)
        RSSI: -86 dBm (0xaa)
        Flags: 0x00000000
        Data length: 0
bluetoothd[3155986]: = src/device.c:device_new() Unable to regist..   33.164038
bluetoothd[3155986]: = Unable to create object for found d..   [hci0] 33.164066
> HCI Event: LE Meta Event (0x3e) plen 43                  #52 [hci0] 36.656475
      LE Extended Advertising Report (0x0d)
        Num reports: 1
        Entry 0
          Event type: 0x0013
            Props: 0x0013
              Connectable
              Scannable
              Use legacy advertising PDUs
            Data status: [0;32mComplete[0m
          Legacy PDU Type: ADV_IND (0x0013)
          Address type: Random (0x01)
          Address: 41:0D:85:B3:03:26 (Resolvable)
          Primary PHY: LE 1M
          Secondary PHY: No packets
          SID: no ADI field (0xff)
          TX power: 127 dBm
          RSSI: -85 dBm (0xab)
          Periodic advertising interval: 0.00 msec (0x0000)
          Direct address type: Public (0x00)
          Direct address: 00:00:00:00:00:00 (OUI 00-00-00)
          Data length: 0x11
        02 01 1a 02 0a 0c 0a ff 4c 00 10 05 37 1c 99 ec  ........L...7...
        b7                                               .               
        Flags: 0x1a
          LE General Discoverable Mode
          Simultaneous LE and BR/EDR (Controller)
          Simultaneous LE and BR/EDR (Host)
        TX power: 12 dBm
        Company: Apple, Inc. (76)
          Type: Unknown (16)
          Data: 371c99ecb7
@ MGMT Event: Device Found (0x0012) plen 23           {0x0002} [hci0] 36.656567
        LE Address: 40:00:00:8E:54:A8 (Resolvable)
        RSSI: -98 dBm (0x9e)
        Flags: 0x00000000
        Data length: 9
        TX power: -3 dBm
        Service Data: Google (0xfe2c)
          Data: 0000
@ MGMT Event: Device Found (0x0012) plen 23           {0x0001} [hci0] 36.656567
        LE Address: 40:00:00:8E:54:A8 (Resolvable)
        RSSI: -98 dBm (0x9e)
        Flags: 0x00000000
        Data length: 9
        TX power: -3 dBm
        Service Data: Google (0xfe2c)
          Data: 0000
> HCI Event: LE Meta Event (0x3e) plen 26                  #53 [hci0] 36.657457
      LE Extended Advertising Report (0x0d)
        Num reports: 1
        Entry 0
          Event type: 0x001b
            Props: 0x001b
              Connectable
              Scannable
              Scan response
              Use legacy advertising PDUs
            Data status: [0;32mComplete[0m
          Legacy PDU Type: SCAN_RSP to an ADV_SCAN_IND (0x001b)
          Address type: Random (0x01)
          Address: 41:0D:85:B3:03:26 (Resolvable)
          Primary PHY: LE 1M
          Secondary PHY: No packets
          SID: no ADI field (0xff)
          TX power: 127 dBm
          RSSI: -85 dBm (0xab)
          Periodic advertising interval: 0.00 msec (0x0000)
          Direct address type: Public (0x00)
          Direct address: 00:00:00:00:00:00 (OUI 00-00-00)
          Data length: 0x00
@ MGMT Event: Device Found (0x0012) plen 31           {0x0002} [hci0] 36.657552
        LE Address: 41:0D:85:B3:03:26 (Resolvable)
        RSSI: -85 dBm (0xab)
        Flags: 0x00000000
        Data length: 17
        Flags: 0x1a
          LE General Discoverable Mode
          Simultaneous LE and BR/EDR (Controller)
          Simultaneous LE and BR/EDR (Host)
        TX power: 12 dBm
        Company: Apple, Inc. (76)
          Type: Unknown (16)
          Data: 371c99ecb7
@ MGMT Event: Device Found (0x0012) plen 31           {0x0001} [hci0] 36.657552
        LE Address: 41:0D:85:B3:03:26 (Resolvable)
        RSSI: -85 dBm (0xab)
        Flags: 0x00000000
        Data length: 17
        Flags: 0x1a
          LE General Discoverable Mode
          Simultaneous LE and BR/EDR (Controller)
          Simultaneous LE and BR/EDR (Host)
        TX power: 12 dBm
        Company: Apple, Inc. (76)
          Type: Unknown (16)
          Data: 371c99ecb7
> HCI Event: Inquiry Complete (0x01) plen 1                #54 [hci0] 40.264651
        Status: Success (0x00)
@ MGMT Event: Discovering (0x0013) plen 2             {0x0002} [hci0] 40.683909
        Address type: 0x07
          BR/EDR
          LE Public
          LE Random
        Discovery: Disabled (0x00)
@ MGMT Event: Discovering (0x0013) plen 2             {0x0001} [hci0] 40.683909
        Address type: 0x07
          BR/EDR
          LE Public
          LE Random
        Discovery: Disabled (0x00)
< HCI Command: LE Set Extended Sca.. (0x08|0x0042) plen 6  #55 [hci0] 40.684108
        Extended scan: Disabled (0x00)
        Filter duplicates: Disabled (0x00)
        Duration: 0 msec (0x0000)
        Period: 0.00 sec (0x0000)
bluetoothd[3155986]: @ MGMT Comman.. (0x003a) plen 4  {0x0001} [hci0] 40.684282
        Address type: 0x07
          BR/EDR
          LE Public
          LE Random
        RSSI: invalid (0x7f)
        UUIDs: 0
> HCI Event: Command Complete (0x0e) plen 4                #56 [hci0] 40.686583
      LE Set Extended Scan Enable (0x08|0x0042) ncmd 1
        Status: Success (0x00)
< HCI Command: LE Set Random Address (0x08|0x0005) plen 6  #57 [hci0] 40.686923
        Address: 27:4A:08:95:6F:91 (Non-Resolvable)
> HCI Event: Command Complete (0x0e) plen 4                #58 [hci0] 40.687559
      LE Set Random Address (0x08|0x0005) ncmd 1
        Status: Success (0x00)
< HCI Command: LE Set Extended Sc.. (0x08|0x0041) plen 13  #59 [hci0] 40.687924
        Own address type: Random (0x01)
        Filter policy: Accept all advertisement (0x00)
        PHYs: 0x05
        Entry 0: LE 1M
          Type: Active (0x01)
          Interval: 22.500 msec (0x0024)
          Window: 11.250 msec (0x0012)
        Entry 1: LE Coded
          Type: Active (0x01)
          Interval: 67.500 msec (0x006c)
          Window: 33.750 msec (0x0036)
> HCI Event: Command Complete (0x0e) plen 4                #60 [hci0] 40.688558
      LE Set Extended Scan Parameters (0x08|0x0041) ncmd 1
        Status: Success (0x00)
< HCI Command: LE Set Extended Sca.. (0x08|0x0042) plen 6  #61 [hci0] 40.688979
        Extended scan: Enabled (0x01)
        Filter duplicates: Disabled (0x00)
        Duration: 0 msec (0x0000)
        Period: 0.00 sec (0x0000)
> HCI Event: Command Complete (0x0e) plen 4                #62 [hci0] 40.689559
      LE Set Extended Scan Enable (0x08|0x0042) ncmd 1
        Status: Success (0x00)
@ MGMT Event: Discovering (0x0013) plen 2             {0x0002} [hci0] 40.689708
        Address type: 0x07
          BR/EDR
          LE Public
          LE Random
        Discovery: Enabled (0x01)
@ MGMT Event: Discovering (0x0013) plen 2             {0x0001} [hci0] 40.689708
        Address type: 0x07
          BR/EDR
          LE Public
          LE Random
        Discovery: Enabled (0x01)
< HCI Command: Inquiry (0x01|0x0001) plen 5                #63 [hci0] 40.690000
        Access code: 0x9e8b33 (General Inquiry)
        Length: 10.24s (0x08)
        Num responses: 0
> HCI Event: Command Status (0x0f) plen 4                  #64 [hci0] 40.691558
      Inquiry (0x01|0x0001) ncmd 1
        Status: Success (0x00)
@ MGMT Event: Command Complete (0x0001) plen 4        {0x0001} [hci0] 40.691810
      Start Service Discovery (0x003a) plen 1
        Status: Success (0x00)
        Address type: 0x07
          BR/EDR
          LE Public
          LE Random
> HCI Event: LE Meta Event (0x3e) plen 43                  #65 [hci0] 40.692657
      LE Extended Advertising Report (0x0d)
        Num reports: 1
        Entry 0
          Event type: 0x0013
            Props: 0x0013
              Connectable
              Scannable
              Use legacy advertising PDUs
            Data status: [0;32mComplete[0m
          Legacy PDU Type: ADV_IND (0x0013)
          Address type: Random (0x01)
          Address: 41:0D:85:B3:03:26 (Resolvable)
          Primary PHY: LE 1M
          Secondary PHY: No packets
          SID: no ADI field (0xff)
          TX power: 127 dBm
          RSSI: -80 dBm (0xb0)
          Periodic advertising interval: 0.00 msec (0x0000)
          Direct address type: Public (0x00)
          Direct address: 00:00:00:00:00:00 (OUI 00-00-00)
          Data length: 0x11
        02 01 1a 02 0a 0c 0a ff 4c 00 10 05 37 1c 99 ec  ........L...7...
        b7                                               .               
        Flags: 0x1a
          LE General Discoverable Mode
          Simultaneous LE and BR/EDR (Controller)
          Simultaneous LE and BR/EDR (Host)
        TX power: 12 dBm
        Company: Apple, Inc. (76)
          Type: Unknown (16)
          Data: 371c99ecb7
> HCI Event: LE Meta Event (0x3e) plen 26                  #66 [hci0] 40.693652
      LE Extended Advertising Report (0x0d)
        Num reports: 1
        Entry 0
          Event type: 0x001b
            Props: 0x001b
              Connectable
              Scannable
              Scan response
              Use legacy advertising PDUs
            Data status: [0;32mComplete[0m
          Legacy PDU Type: SCAN_RSP to an ADV_SCAN_IND (0x001b)
          Address type: Random (0x01)
          Address: 41:0D:85:B3:03:26 (Resolvable)
          Primary PHY: LE 1M
          Secondary PHY: No packets
          SID: no ADI field (0xff)
          TX power: 127 dBm
          RSSI: -79 dBm (0xb1)
          Periodic advertising interval: 0.00 msec (0x0000)
          Direct address type: Public (0x00)
          Direct address: 00:00:00:00:00:00 (OUI 00-00-00)
          Data length: 0x00
@ MGMT Event: Device Found (0x0012) plen 31           {0x0002} [hci0] 40.693746
        LE Address: 41:0D:85:B3:03:26 (Resolvable)
        RSSI: -79 dBm (0xb1)
        Flags: 0x00000000
        Data length: 17
        Flags: 0x1a
          LE General Discoverable Mode
          Simultaneous LE and BR/EDR (Controller)
          Simultaneous LE and BR/EDR (Host)
        TX power: 12 dBm
        Company: Apple, Inc. (76)
          Type: Unknown (16)
          Data: 371c99ecb7
@ MGMT Event: Device Found (0x0012) plen 31           {0x0001} [hci0] 40.693746
        LE Address: 41:0D:85:B3:03:26 (Resolvable)
        RSSI: -79 dBm (0xb1)
        Flags: 0x00000000
        Data length: 17
        Flags: 0x1a
          LE General Discoverable Mode
          Simultaneous LE and BR/EDR (Controller)
          Simultaneous LE and BR/EDR (Host)
        TX power: 12 dBm
        Company: Apple, Inc. (76)
          Type: Unknown (16)
          Data: 371c99ecb7
> HCI Event: LE Meta Event (0x3e) plen 43                  #67 [hci0] 41.397812
      LE Extended Advertising Report (0x0d)
        Num reports: 1
        Entry 0
          Event type: 0x0013
            Props: 0x0013
              Connectable
              Scannable
              Use legacy advertising PDUs
            Data status: [0;32mComplete[0m
          Legacy PDU Type: ADV_IND (0x0013)
          Address type: Public (0x00)
          Address: A4:C1:38:26:4E:DA (Telink Semiconductor (Taipei) Co. Ltd.)
          Primary PHY: LE 1M
          Secondary PHY: No packets
          SID: no ADI field (0xff)
          TX power: 127 dBm
          RSSI: -67 dBm (0xbd)
          Periodic advertising interval: 0.00 msec (0x0000)
          Direct address type: Public (0x00)
          Direct address: 00:00:00:00:00:00 (OUI 00-00-00)
          Data length: 0x11
        10 16 1a 18 a4 c1 38 26 4e da 00 da 31 25 0a 05  ......8&N...1%..
        d7                                               .               
        Service Data: Environmental Sensing (0x181a)
          Data: a4c138264eda00da31250a05d7
> HCI Event: LE Meta Event (0x3e) plen 38                  #68 [hci0] 41.398603
      LE Extended Advertising Report (0x0d)
        Num reports: 1
        Entry 0
          Event type: 0x001b
            Props: 0x001b
              Connectable
              Scannable
              Scan response
              Use legacy advertising PDUs
            Data status: [0;32mComplete[0m
          Legacy PDU Type: SCAN_RSP to an ADV_SCAN_IND (0x001b)
          Address type: Public (0x00)
          Address: A4:C1:38:26:4E:DA (Telink Semiconductor (Taipei) Co. Ltd.)
          Primary PHY: LE 1M
          Secondary PHY: No packets
          SID: no ADI field (0xff)
          TX power: 127 dBm
          RSSI: -66 dBm (0xbe)
          Periodic advertising interval: 0.00 msec (0x0000)
          Direct address type: Public (0x00)
          Direct address: 00:00:00:00:00:00 (OUI 00-00-00)
          Data length: 0x0c
        0b 09 41 54 43 5f 32 36 34 45 44 41              ..ATC_264EDA    
        Name (complete): ATC_264EDA
@ MGMT Event: Device Found (0x0012) plen 43           {0x0002} [hci0] 41.398700
        LE Address: A4:C1:38:26:4E:DA (Telink Semiconductor (Taipei) Co. Ltd.)
        RSSI: -66 dBm (0xbe)
        Flags: 0x00000000
        Data length: 29
        Service Data: Environmental Sensing (0x181a)
          Data: a4c138264eda00da31250a05d7
        Name (complete): ATC_264EDA
@ MGMT Event: Device Found (0x0012) plen 43           {0x0001} [hci0] 41.398700
        LE Address: A4:C1:38:26:4E:DA (Telink Semiconductor (Taipei) Co. Ltd.)
        RSSI: -66 dBm (0xbe)
        Flags: 0x00000000
        Data length: 29
        Service Data: Environmental Sensing (0x181a)
          Data: a4c138264eda00da31250a05d7
        Name (complete): ATC_264EDA
> HCI Event: LE Meta Event (0x3e) plen 43                  #69 [hci0] 42.061708
      LE Extended Advertising Report (0x0d)
        Num reports: 1
        Entry 0
          Event type: 0x0013
            Props: 0x0013
              Connectable
              Scannable
              Use legacy advertising PDUs
            Data status: [0;32mComplete[0m
          Legacy PDU Type: ADV_IND (0x0013)
          Address type: Random (0x01)
          Address: 41:0D:85:B3:03:26 (Resolvable)
          Primary PHY: LE 1M
          Secondary PHY: No packets
          SID: no ADI field (0xff)
          TX power: 127 dBm
          RSSI: -80 dBm (0xb0)
          Periodic advertising interval: 0.00 msec (0x0000)
          Direct address type: Public (0x00)
          Direct address: 00:00:00:00:00:00 (OUI 00-00-00)
          Data length: 0x11
        02 01 1a 02 0a 0c 0a ff 4c 00 10 05 37 1c 99 ec  ........L...7...
        b7                                               .               
        Flags: 0x1a
          LE General Discoverable Mode
          Simultaneous LE and BR/EDR (Controller)
          Simultaneous LE and BR/EDR (Host)
        TX power: 12 dBm
        Company: Apple, Inc. (76)
          Type: Unknown (16)
          Data: 371c99ecb7
> HCI Event: LE Meta Event (0x3e) plen 26                  #70 [hci0] 42.062709
      LE Extended Advertising Report (0x0d)
        Num reports: 1
        Entry 0
          Event type: 0x001b
            Props: 0x001b
              Connectable
              Scannable
              Scan response
              Use legacy advertising PDUs
            Data status: [0;32mComplete[0m
          Legacy PDU Type: SCAN_RSP to an ADV_SCAN_IND (0x001b)
          Address type: Random (0x01)
          Address: 41:0D:85:B3:03:26 (Resolvable)
          Primary PHY: LE 1M
          Secondary PHY: No packets
          SID: no ADI field (0xff)
          TX power: 127 dBm
          RSSI: -80 dBm (0xb0)
          Periodic advertising interval: 0.00 msec (0x0000)
          Direct address type: Public (0x00)
          Direct address: 00:00:00:00:00:00 (OUI 00-00-00)
          Data length: 0x00
@ MGMT Event: Device Found (0x0012) plen 31           {0x0002} [hci0] 42.062855
        LE Address: 41:0D:85:B3:03:26 (Resolvable)
        RSSI: -80 dBm (0xb0)
        Flags: 0x00000000
        Data length: 17
        Flags: 0x1a
          LE General Discoverable Mode
          Simultaneous LE and BR/EDR (Controller)
          Simultaneous LE and BR/EDR (Host)
        TX power: 12 dBm
        Company: Apple, Inc. (76)
          Type: Unknown (16)
          Data: 371c99ecb7
@ MGMT Event: Device Found (0x0012) plen 31           {0x0001} [hci0] 42.062855
        LE Address: 41:0D:85:B3:03:26 (Resolvable)
        RSSI: -80 dBm (0xb0)
        Flags: 0x00000000
        Data length: 17
        Flags: 0x1a
          LE General Discoverable Mode
          Simultaneous LE and BR/EDR (Controller)
          Simultaneous LE and BR/EDR (Host)
        TX power: 12 dBm
        Company: Apple, Inc. (76)
          Type: Unknown (16)
          Data: 371c99ecb7
> HCI Event: LE Meta Event (0x3e) plen 39                  #71 [hci0] 42.626735
      LE Extended Advertising Report (0x0d)
        Num reports: 1
        Entry 0
          Event type: 0x0013
            Props: 0x0013
              Connectable
              Scannable
              Use legacy advertising PDUs
            Data status: [0;32mComplete[0m
          Legacy PDU Type: ADV_IND (0x0013)
          Address type: Random (0x01)
          Address: C0:DE:54:15:00:51 (Static)
          Primary PHY: LE 1M
          Secondary PHY: No packets
          SID: no ADI field (0xff)
          TX power: 127 dBm
          RSSI: -86 dBm (0xaa)
          Periodic advertising interval: 0.00 msec (0x0000)
          Direct address type: Public (0x00)
          Direct address: 00:00:00:00:00:00 (OUI 00-00-00)
          Data length: 0x0d
        02 01 06 09 09 58 35 34 2d 50 41 49 52           .....X54-PAIR   
        Flags: 0x06
          LE General Discoverable Mode
          BR/EDR Not Supported
        Name (complete): X54-PAIR
> HCI Event: LE Meta Event (0x3e) plen 39                  #72 [hci0] 43.091734
      LE Extended Advertising Report (0x0d)
        Num reports: 1
        Entry 0
          Event type: 0x0013
            Props: 0x0013
              Connectable
              Scannable
              Use legacy advertising PDUs
            Data status: [0;32mComplete[0m
          Legacy PDU Type: ADV_IND (0x0013)
          Address type: Random (0x01)
          Address: C0:DE:54:15:00:51 (Static)
          Primary PHY: LE 1M
          Secondary PHY: No packets
          SID: no ADI field (0xff)
          TX power: 127 dBm
          RSSI: -93 dBm (0xa3)
          Periodic advertising interval: 0.00 msec (0x0000)
          Direct address type: Public (0x00)
          Direct address: 00:00:00:00:00:00 (OUI 00-00-00)
          Data length: 0x0d
        02 01 06 09 09 58 35 34 2d 50 41 49 52           .....X54-PAIR   
        Flags: 0x06
          LE General Discoverable Mode
          BR/EDR Not Supported
        Name (complete): X54-PAIR
> HCI Event: LE Meta Event (0x3e) plen 26                  #73 [hci0] 43.577740
      LE Extended Advertising Report (0x0d)
        Num reports: 1
        Entry 0
          Event type: 0x0013
            Props: 0x0013
              Connectable
              Scannable
              Use legacy advertising PDUs
            Data status: [0;32mComplete[0m
          Legacy PDU Type: ADV_IND (0x0013)
          Address type: Public (0x00)
          Address: C0:DE:54:15:00:51 (OUI C0-DE-54)
          Primary PHY: LE 1M
          Secondary PHY: No packets
          SID: no ADI field (0xff)
          TX power: 127 dBm
          RSSI: -93 dBm (0xa3)
          Periodic advertising interval: 0.00 msec (0x0000)
          Direct address type: Public (0x00)
          Direct address: 00:00:00:00:00:00 (OUI 00-00-00)
          Data length: 0x00
@ MGMT Event: Device Found (0x0012) plen 27           {0x0002} [hci0] 43.577880
        LE Address: C0:DE:54:15:00:51 (Static)
        RSSI: -93 dBm (0xa3)
        Flags: 0x00000000
        Data length: 13
        Flags: 0x06
          LE General Discoverable Mode
          BR/EDR Not Supported
        Name (complete): X54-PAIR
@ MGMT Event: Device Found (0x0012) plen 27           {0x0001} [hci0] 43.577880
        LE Address: C0:DE:54:15:00:51 (Static)
        RSSI: -93 dBm (0xa3)
        Flags: 0x00000000
        Data length: 13
        Flags: 0x06
          LE General Discoverable Mode
          BR/EDR Not Supported
        Name (complete): X54-PAIR
> HCI Event: LE Meta Event (0x3e) plen 43                  #74 [hci0] 44.268799
      LE Extended Advertising Report (0x0d)
        Num reports: 1
        Entry 0
          Event type: 0x0013
            Props: 0x0013
              Connectable
              Scannable
              Use legacy advertising PDUs
            Data status: [0;32mComplete[0m
          Legacy PDU Type: ADV_IND (0x0013)
          Address type: Random (0x01)
          Address: 41:0D:85:B3:03:26 (Resolvable)
          Primary PHY: LE 1M
          Secondary PHY: No packets
          SID: no ADI field (0xff)
          TX power: 127 dBm
          RSSI: -80 dBm (0xb0)
          Periodic advertising interval: 0.00 msec (0x0000)
          Direct address type: Public (0x00)
          Direct address: 00:00:00:00:00:00 (OUI 00-00-00)
          Data length: 0x11
        02 01 1a 02 0a 0c 0a ff 4c 00 10 05 37 1c 99 ec  ........L...7...
        b7                                               .               
        Flags: 0x1a
          LE General Discoverable Mode
          Simultaneous LE and BR/EDR (Controller)
          Simultaneous LE and BR/EDR (Host)
        TX power: 12 dBm
        Company: Apple, Inc. (76)
          Type: Unknown (16)
          Data: 371c99ecb7
@ MGMT Event: Device Found (0x0012) plen 14           {0x0002} [hci0] 44.268892
        LE Address: C0:DE:54:15:00:51 (OUI C0-DE-54)
        RSSI: -93 dBm (0xa3)
        Flags: 0x00000000
        Data length: 0
@ MGMT Event: Device Found (0x0012) plen 14           {0x0001} [hci0] 44.268892
        LE Address: C0:DE:54:15:00:51 (OUI C0-DE-54)
        RSSI: -93 dBm (0xa3)
        Flags: 0x00000000
        Data length: 0
bluetoothd[3155986]: = src/device.c:device_new() Unable to regist..   44.269185
bluetoothd[3155986]: = Unable to create object for found d..   [hci0] 44.269194
> HCI Event: LE Meta Event (0x3e) plen 43                  #75 [hci0] 45.115810
      LE Extended Advertising Report (0x0d)
        Num reports: 1
        Entry 0
          Event type: 0x0013
            Props: 0x0013
              Connectable
              Scannable
              Use legacy advertising PDUs
            Data status: [0;32mComplete[0m
          Legacy PDU Type: ADV_IND (0x0013)
          Address type: Public (0x00)
          Address: A4:C1:38:D0:E4:84 (Telink Semiconductor (Taipei) Co. Ltd.)
          Primary PHY: LE 1M
          Secondary PHY: No packets
          SID: no ADI field (0xff)
          TX power: 127 dBm
          RSSI: -80 dBm (0xb0)
          Periodic advertising interval: 0.00 msec (0x0000)
          Direct address type: Public (0x00)
          Direct address: 00:00:00:00:00:00 (OUI 00-00-00)
          Data length: 0x11
        10 16 1a 18 a4 c1 38 d0 e4 84 00 ca 43 50 0b 6f  ......8.....CP.o
        d7                                               .               
        Service Data: Environmental Sensing (0x181a)
          Data: a4c138d0e48400ca43500b6fd7
@ MGMT Event: Device Found (0x0012) plen 31           {0x0002} [hci0] 45.116014
        LE Address: 41:0D:85:B3:03:26 (Resolvable)
        RSSI: -80 dBm (0xb0)
        Flags: 0x00000000
        Data length: 17
        Flags: 0x1a
          LE General Discoverable Mode
          Simultaneous LE and BR/EDR (Controller)
          Simultaneous LE and BR/EDR (Host)
        TX power: 12 dBm
        Company: Apple, Inc. (76)
          Type: Unknown (16)
          Data: 371c99ecb7
@ MGMT Event: Device Found (0x0012) plen 31           {0x0001} [hci0] 45.116014
        LE Address: 41:0D:85:B3:03:26 (Resolvable)
        RSSI: -80 dBm (0xb0)
        Flags: 0x00000000
        Data length: 17
        Flags: 0x1a
          LE General Discoverable Mode
          Simultaneous LE and BR/EDR (Controller)
          Simultaneous LE and BR/EDR (Host)
        TX power: 12 dBm
        Company: Apple, Inc. (76)
          Type: Unknown (16)
          Data: 371c99ecb7
> HCI Event: LE Meta Event (0x3e) plen 38                  #76 [hci0] 45.116717
      LE Extended Advertising Report (0x0d)
        Num reports: 1
        Entry 0
          Event type: 0x001b
            Props: 0x001b
              Connectable
              Scannable
              Scan response
              Use legacy advertising PDUs
            Data status: [0;32mComplete[0m
          Legacy PDU Type: SCAN_RSP to an ADV_SCAN_IND (0x001b)
          Address type: Public (0x00)
          Address: A4:C1:38:D0:E4:84 (Telink Semiconductor (Taipei) Co. Ltd.)
          Primary PHY: LE 1M
          Secondary PHY: No packets
          SID: no ADI field (0xff)
          TX power: 127 dBm
          RSSI: -80 dBm (0xb0)
          Periodic advertising interval: 0.00 msec (0x0000)
          Direct address type: Public (0x00)
          Direct address: 00:00:00:00:00:00 (OUI 00-00-00)
          Data length: 0x0c
        0b 09 41 54 43 5f 44 30 45 34 38 34              ..ATC_D0E484    
        Name (complete): ATC_D0E484
@ MGMT Event: Device Found (0x0012) plen 43           {0x0002} [hci0] 45.116871
        LE Address: A4:C1:38:D0:E4:84 (Telink Semiconductor (Taipei) Co. Ltd.)
        RSSI: -80 dBm (0xb0)
        Flags: 0x00000000
        Data length: 29
        Service Data: Environmental Sensing (0x181a)
          Data: a4c138d0e48400ca43500b6fd7
        Name (complete): ATC_D0E484
@ MGMT Event: Device Found (0x0012) plen 43           {0x0001} [hci0] 45.116871
        LE Address: A4:C1:38:D0:E4:84 (Telink Semiconductor (Taipei) Co. Ltd.)
        RSSI: -80 dBm (0xb0)
        Flags: 0x00000000
        Data length: 29
        Service Data: Environmental Sensing (0x181a)
          Data: a4c138d0e48400ca43500b6fd7
        Name (complete): ATC_D0E484
> HCI Event: LE Meta Event (0x3e) plen 43                  #77 [hci0] 45.380889
      LE Extended Advertising Report (0x0d)
        Num reports: 1
        Entry 0
          Event type: 0x0013
            Props: 0x0013
              Connectable
              Scannable
              Use legacy advertising PDUs
            Data status: [0;32mComplete[0m
          Legacy PDU Type: ADV_IND (0x0013)
          Address type: Random (0x01)
          Address: 41:0D:85:B3:03:26 (Resolvable)
          Primary PHY: LE 1M
          Secondary PHY: No packets
          SID: no ADI field (0xff)
          TX power: 127 dBm
          RSSI: -80 dBm (0xb0)
          Periodic advertising interval: 0.00 msec (0x0000)
          Direct address type: Public (0x00)
          Direct address: 00:00:00:00:00:00 (OUI 00-00-00)
          Data length: 0x11
        02 01 1a 02 0a 0c 0a ff 4c 00 10 05 37 1c 99 ec  ........L...7...
        b7                                               .               
        Flags: 0x1a
          LE General Discoverable Mode
          Simultaneous LE and BR/EDR (Controller)
          Simultaneous LE and BR/EDR (Host)
        TX power: 12 dBm
        Company: Apple, Inc. (76)
          Type: Unknown (16)
          Data: 371c99ecb7
> HCI Event: LE Meta Event (0x3e) plen 26                  #78 [hci0] 45.381854
      LE Extended Advertising Report (0x0d)
        Num reports: 1
        Entry 0
          Event type: 0x001b
            Props: 0x001b
              Connectable
              Scannable
              Scan response
              Use legacy advertising PDUs
            Data status: [0;32mComplete[0m
          Legacy PDU Type: SCAN_RSP to an ADV_SCAN_IND (0x001b)
          Address type: Random (0x01)
          Address: 41:0D:85:B3:03:26 (Resolvable)
          Primary PHY: LE 1M
          Secondary PHY: No packets
          SID: no ADI field (0xff)
          TX power: 127 dBm
          RSSI: -79 dBm (0xb1)
          Periodic advertising interval: 0.00 msec (0x0000)
          Direct address type: Public (0x00)
          Direct address: 00:00:00:00:00:00 (OUI 00-00-00)
          Data length: 0x00
@ MGMT Event: Device Found (0x0012) plen 31           {0x0002} [hci0] 45.381860
        LE Address: 41:0D:85:B3:03:26 (Resolvable)
        RSSI: -79 dBm (0xb1)
        Flags: 0x00000000
        Data length: 17
        Flags: 0x1a
          LE General Discoverable Mode
          Simultaneous LE and BR/EDR (Controller)
          Simultaneous LE and BR/EDR (Host)
        TX power: 12 dBm
        Company: Apple, Inc. (76)
          Type: Unknown (16)
          Data: 371c99ecb7
@ MGMT Event: Device Found (0x0012) plen 31           {0x0001} [hci0] 45.381860
        LE Address: 41:0D:85:B3:03:26 (Resolvable)
        RSSI: -79 dBm (0xb1)
        Flags: 0x00000000
        Data length: 17
        Flags: 0x1a
          LE General Discoverable Mode
          Simultaneous LE and BR/EDR (Controller)
          Simultaneous LE and BR/EDR (Host)
        TX power: 12 dBm
        Company: Apple, Inc. (76)
          Type: Unknown (16)
          Data: 371c99ecb7
bluetoothd[3155986]: @ MGMT Comman.. (0x0024) plen 1  {0x0001} [hci0] 45.815663
        Address type: 0x07
          BR/EDR
          LE Public
          LE Random
< HCI Command: Inquiry Cancel (0x01|0x0002) plen 0         #79 [hci0] 45.815767
> HCI Event: Command Complete (0x0e) plen 4                #80 [hci0] 45.816701
      Inquiry Cancel (0x01|0x0002) ncmd 1
        Status: Success (0x00)
< HCI Command: LE Set Extended Sca.. (0x08|0x0042) plen 6  #81 [hci0] 45.816818
        Extended scan: Disabled (0x00)
        Filter duplicates: Disabled (0x00)
        Duration: 0 msec (0x0000)
        Period: 0.00 sec (0x0000)
> HCI Event: Command Complete (0x0e) plen 4                #82 [hci0] 45.829794
      LE Set Extended Scan Enable (0x08|0x0042) ncmd 1
        Status: Success (0x00)
@ MGMT Event: Command Complete (0x0001) plen 4        {0x0001} [hci0] 45.829930
      Stop Discovery (0x0024) plen 1
        Status: Success (0x00)
        Address type: 0x07
          BR/EDR
          LE Public
          LE Random
@ MGMT Event: Discovering (0x0013) plen 2             {0x0002} [hci0] 45.829937
        Address type: 0x07
          BR/EDR
          LE Public
          LE Random
        Discovery: Disabled (0x00)
@ MGMT Event: Discovering (0x0013) plen 2             {0x0001} [hci0] 45.829937
        Address type: 0x07
          BR/EDR
          LE Public
          LE Random
        Discovery: Disabled (0x00)
< HCI Command: LE Set Address Reso.. (0x08|0x002d) plen 1  #83 [hci0] 45.829996
        Address resolution: Enabled (0x01)
> HCI Event: Command Complete (0x0e) plen 4                #84 [hci0] 45.830770
      LE Set Address Resolution Enable (0x08|0x002d) ncmd 1
        Status: Success (0x00)
< HCI Command: LE Set Extended Sc.. (0x08|0x0041) plen 13  #85 [hci0] 45.830947
        Own address type: Public (0x00)
        Filter policy: Ignore not in accept list (0x01)
        PHYs: 0x05
        Entry 0: LE 1M
          Type: Passive (0x00)
          Interval: 60.000 msec (0x0060)
          Window: 60.000 msec (0x0060)
        Entry 1: LE Coded
          Type: Passive (0x00)
          Interval: 180.000 msec (0x0120)
          Window: 180.000 msec (0x0120)
> HCI Event: Command Complete (0x0e) plen 4                #86 [hci0] 45.831704
      LE Set Extended Scan Parameters (0x08|0x0041) ncmd 1
        Status: Success (0x00)
< HCI Command: LE Set Extended Sca.. (0x08|0x0042) plen 6  #87 [hci0] 45.831838
        Extended scan: Enabled (0x01)
        Filter duplicates: Enabled (0x01)
        Duration: 0 msec (0x0000)
        Period: 0.00 sec (0x0000)
> HCI Event: Command Complete (0x0e) plen 4                #88 [hci0] 45.832703
      LE Set Extended Scan Enable (0x08|0x0042) ncmd 1
        Status: Success (0x00)
bluetoothd[3155986]: @ MGMT Comman.. (0x0019) plen 8  {0x0001} [hci0] 45.848686
        LE Address: C0:DE:54:15:00:51 (Static)
        Capability: KeyboardDisplay (0x04)
> HCI Event: LE Meta Event (0x3e) plen 39                  #89 [hci0] 45.931840
      LE Extended Advertising Report (0x0d)
        Num reports: 1
        Entry 0
          Event type: 0x0013
            Props: 0x0013
              Connectable
              Scannable
              Use legacy advertising PDUs
            Data status: [0;32mComplete[0m
          Legacy PDU Type: ADV_IND (0x0013)
          Address type: Random (0x01)
          Address: C0:DE:54:15:00:51 (Static)
          Primary PHY: LE 1M
          Secondary PHY: No packets
          SID: no ADI field (0xff)
          TX power: 127 dBm
          RSSI: -86 dBm (0xaa)
          Periodic advertising interval: 0.00 msec (0x0000)
          Direct address type: Public (0x00)
          Direct address: 00:00:00:00:00:00 (OUI 00-00-00)
          Data length: 0x0d
        02 01 06 09 09 58 35 34 2d 50 41 49 52           .....X54-PAIR   
        Flags: 0x06
          LE General Discoverable Mode
          BR/EDR Not Supported
        Name (complete): X54-PAIR
< HCI Command: LE Set Extended Sca.. (0x08|0x0042) plen 6  #90 [hci0] 45.931971
        Extended scan: Disabled (0x00)
        Filter duplicates: Disabled (0x00)
        Duration: 0 msec (0x0000)
        Period: 0.00 sec (0x0000)
> HCI Event: Command Complete (0x0e) plen 4                #91 [hci0] 45.936706
      LE Set Extended Scan Enable (0x08|0x0042) ncmd 1
        Status: Success (0x00)
< HCI Command: LE Extended Create.. (0x08|0x0043) plen 26  #92 [hci0] 45.936869
        Filter policy: Accept list is not used (0x00)
        Own address type: Public (0x00)
        Peer address type: Random (0x01)
        Peer address: C0:DE:54:15:00:51 (Static)
        Initiating PHYs: 0x01
        Entry 0: LE 1M
          Scan interval: 60.000 msec (0x0060)
          Scan window: 60.000 msec (0x0060)
          Min connection interval: 30.00 msec (0x0018)
          Max connection interval: 50.00 msec (0x0028)
          Connection latency: 0 (0x0000)
          Supervision timeout: 420 msec (0x002a)
          Min connection length: 0.000 msec (0x0000)
          Max connection length: 0.000 msec (0x0000)
> HCI Event: Command Status (0x0f) plen 4                  #93 [hci0] 45.937705
      LE Extended Create Connection (0x08|0x0043) ncmd 1
        Status: Success (0x00)
> HCI Event: LE Meta Event (0x3e) plen 31                  #94 [hci0] 46.907872
      LE Enhanced Connection Complete (0x0a)
        Status: Success (0x00)
        Handle: 2048
        Role: Central (0x00)
        Peer address type: Random (0x01)
        Peer address: C0:DE:54:15:00:51 (Static)
        Local resolvable private address: 00:00:00:00:00:00 (Non-Resolvable)
        Peer resolvable private address: 00:00:00:00:00:00 (Non-Resolvable)
        Connection interval: 45.00 msec (0x0024)
        Connection latency: 0 (0x0000)
        Supervision timeout: 420 msec (0x002a)
        Central clock accuracy: 0x00
@ MGMT Event: Device Connected (0x000b) plen 26       {0x0002} [hci0] 46.908020
        LE Address: C0:DE:54:15:00:51 (Static)
        Flags: 0x00000008
          Connection Locally Initiated
        Data length: 13
        Flags: 0x06
          LE General Discoverable Mode
          BR/EDR Not Supported
        Name (complete): X54-PAIR
@ MGMT Event: Device Connected (0x000b) plen 26       {0x0001} [hci0] 46.908020
        LE Address: C0:DE:54:15:00:51 (Static)
        Flags: 0x00000008
          Connection Locally Initiated
        Data length: 13
        Flags: 0x06
          LE General Discoverable Mode
          BR/EDR Not Supported
        Name (complete): X54-PAIR
btmon[1828283]: @ RAW Open: btmon (privileged) version 2.22  {0x0003} 46.908184
btmon[1828283]: @ RAW Close: btmon                           {0x0003} 46.908188
> HCI Event: LE Meta Event (0x3e) plen 4                   #95 [hci0] 46.908847
      LE Channel Selection Algorithm (0x14)
        Handle: 2048 Address: C0:DE:54:15:00:51 (Static)
        Algorithm: #2 (0x01)
< HCI Command: LE Read Remote Used.. (0x08|0x0016) plen 2  #96 [hci0] 46.914827
        Handle: 2048 Address: C0:DE:54:15:00:51 (Static)
> HCI Event: Command Status (0x0f) plen 4                  #97 [hci0] 46.915844
      LE Read Remote Used Features (0x08|0x0016) ncmd 1
        Status: Success (0x00)
> HCI Event: LE Meta Event (0x3e) plen 12                  #98 [hci0] 46.974749
      LE Read Remote Used Features (0x04)
        Status: Success (0x00)
        Handle: 2048 Address: C0:DE:54:15:00:51 (Static)
        Features: 0x1f 0x00 0x00 0x00 0x00 0x00 0x00 0x00
          LE Encryption
          Connection Parameter Request Procedure
          Extended Reject Indication
          Peripheral-initiated Features Exchange
          LE Ping
< ACL Data TX: Handle 2048 flags 0x00 dlen 11              #99 [hci0] 46.974942
      SMP: Pairing Request (0x01) len 6
        IO capability: KeyboardDisplay (0x04)
        OOB data: Authentication data not present (0x00)
        Authentication requirement: Bonding, MITM, SC, No Keypresses, CT2 (0x2d)
        Max encryption key size: 16
        Initiator key distribution: EncKey Sign LinkKey (0x0d)
        Responder key distribution: EncKey IdKey Sign LinkKey (0x0f)
bluetoothd[3155986]: < ACL Data TX:... flags 0x00 dlen 7  #100 [hci0] 46.975280
      ATT: Exchange MTU Request (0x02) len 2
        Client RX MTU: 517
> HCI Event: Number of Completed Packets (0x13) plen 5    #101 [hci0] 47.063780
        Num handles: 1
        Handle: 2048 Address: C0:DE:54:15:00:51 (Static)
        Count: 1
        #99: len 11 (1 Kb/s)
        Latency: 88 msec (88-88 msec ~88 msec)
> HCI Event: Number of Completed Packets (0x13) plen 5    #102 [hci0] 47.108740
        Num handles: 1
        Handle: 2048 Address: C0:DE:54:15:00:51 (Static)
        Count: 1
        #100: len 7 (0 Kb/s)
        Latency: 133 msec (88-133 msec ~111 msec)
> ACL Data RX: Handle 2048 flags 0x02 dlen 11             #103 [hci0] 47.109731
      SMP: Pairing Response (0x02) len 6
        IO capability: NoInputNoOutput (0x03)
        OOB data: Authentication data not present (0x00)
        Authentication requirement: Bonding, No MITM, Legacy, No Keypresses (0x01)
        Max encryption key size: 16
        Initiator key distribution: EncKey (0x01)
        Responder key distribution: <none> (0x00)
@ MGMT Event: User Confirmation R.. (0x000f) plen 12  {0x0002} [hci0] 47.109868
        LE Address: C0:DE:54:15:00:51 (Static)
        Confirm hint: 0x01
        Value: 0x00000000
@ MGMT Event: User Confirmation R.. (0x000f) plen 12  {0x0001} [hci0] 47.109868
        LE Address: C0:DE:54:15:00:51 (Static)
        Confirm hint: 0x01
        Value: 0x00000000
bluetoothd[3155986]: @ MGMT Comman.. (0x001c) plen 7  {0x0001} [hci0] 47.110061
        LE Address: C0:DE:54:15:00:51 (Static)
@ MGMT Event: Command Complete (0x0001) plen 10       {0x0001} [hci0] 47.110075
      User Confirmation Reply (0x001c) plen 7
        Status: Success (0x00)
        LE Address: C0:DE:54:15:00:51 (Static)
< ACL Data TX: Handle 2048 flags 0x00 dlen 21             #104 [hci0] 47.110181
      SMP: Pairing Confirm (0x03) len 16
        Confim value: 47c00863025f0259ffe54abc81b43a66
> HCI Event: Number of Completed Packets (0x13) plen 5    #105 [hci0] 47.153741
        Num handles: 1
        Handle: 2048 Address: C0:DE:54:15:00:51 (Static)
        Count: 1
        #104: len 21 (3 Kb/s)
        Latency: 43 msec (43-133 msec ~77 msec)
> ACL Data RX: Handle 2048 flags 0x02 dlen 7              #106 [hci0] 47.154728
      ATT: Exchange MTU Response (0x03) len 2
        Server RX MTU: 23
bluetoothd[3155986]: < ACL Data TX:.. flags 0x00 dlen 11  #107 [hci0] 47.155021
      ATT: Read By Type Request (0x08) len 6
        Handle range: 0x0001-0xffff
        Attribute type: Server Supported Features (0x2b3a)
> HCI Event: Number of Completed Packets (0x13) plen 5    #108 [hci0] 47.288830
        Num handles: 1
        Handle: 2048 Address: C0:DE:54:15:00:51 (Static)
        Count: 1
        #107: len 11 (0 Kb/s)
        Latency: 133 msec (43-133 msec ~105 msec)
> ACL Data RX: Handle 2048 flags 0x02 dlen 21             #109 [hci0] 47.289850
        frame too long
        01 08 01 00 0a e2 9e 96 93 7c 6c 9f 5d 5d 99 dc  .........|l.]]..
        fa                                               .               
bluetoothd[3155986]: < ACL Data TX:.. flags 0x00 dlen 11  #110 [hci0] 47.290275
      ATT: Read By Group Type Request (0x10) len 6
        Handle range: 0x0001-0xffff
        Attribute group type: Primary Service (0x2800)
> HCI Event: Number of Completed Packets (0x13) plen 5    #111 [hci0] 47.378746
        Num handles: 1
        Handle: 2048 Address: C0:DE:54:15:00:51 (Static)
        Count: 1
        #110: len 11 (1 Kb/s)
        Latency: 88 msec (43-133 msec ~97 msec)
> ACL Data RX: Handle 2048 flags 0x02 dlen 9              #112 [hci0] 47.379744
> ACL Data RX: Handle 2048 flags 0x02 dlen 24             #113 [hci0] 47.424834
        unexpected start frame
        14 00 04 00 11 06 01 00 07 00 00 18 08 00 0b 00  ................
        01 18 10 00 13 00 0f 18                          ........        
bluetoothd[3155986]: < ACL Data TX:.. flags 0x00 dlen 11  #114 [hci0] 47.425148
      ATT: Read By Group Type Request (0x10) len 6
        Handle range: 0x0014-0xffff
        Attribute group type: Primary Service (0x2800)
> HCI Event: Number of Completed Packets (0x13) plen 5    #115 [hci0] 47.468900
        Num handles: 1
        Handle: 2048 Address: C0:DE:54:15:00:51 (Static)
        Count: 1
        #114: len 11 (2 Kb/s)
        Latency: 43 msec (43-133 msec ~70 msec)
> ACL Data RX: Handle 2048 flags 0x02 dlen 9              #116 [hci0] 47.514730
      ATT: Error Response (0x01) len 4
        Read By Group Type Request (0x10)
        Handle: 0x0014
        Error: Attribute Not Found (0x0a)
bluetoothd[3155986]: < ACL Data TX:.. flags 0x00 dlen 11  #117 [hci0] 47.515200
      ATT: Read By Group Type Request (0x10) len 6
        Handle range: 0x0001-0xffff
        Attribute group type: Secondary Service (0x2801)
> HCI Event: Number of Completed Packets (0x13) plen 5    #118 [hci0] 47.558856
        Num handles: 1
        Handle: 2048 Address: C0:DE:54:15:00:51 (Static)
        Count: 1
        #117: len 11 (2 Kb/s)
        Latency: 43 msec (43-133 msec ~57 msec)
> ACL Data RX: Handle 2048 flags 0x02 dlen 9              #119 [hci0] 47.604823
      ATT: Error Response (0x01) len 4
        Read By Group Type Request (0x10)
        Handle: 0x0001
        Error: Unsupported Group Type (0x10)
bluetoothd[3155986]: < ACL Data TX:.. flags 0x00 dlen 11  #120 [hci0] 47.605193
      ATT: Read By Type Request (0x08) len 6
        Handle range: 0x0001-0x0013
        Attribute type: Include (0x2802)
> HCI Event: Number of Completed Packets (0x13) plen 5    #121 [hci0] 47.648844
        Num handles: 1
        Handle: 2048 Address: C0:DE:54:15:00:51 (Static)
        Count: 1
        #120: len 11 (2 Kb/s)
        Latency: 43 msec (43-133 msec ~50 msec)
> ACL Data RX: Handle 2048 flags 0x02 dlen 9              #122 [hci0] 47.695861
      ATT: Error Response (0x01) len 4
        Read By Type Request (0x08)
        Handle: 0x0001
        Error: Attribute Not Found (0x0a)
bluetoothd[3155986]: < ACL Data TX:.. flags 0x00 dlen 11  #123 [hci0] 47.696187
      ATT: Read By Type Request (0x08) len 6
        Handle range: 0x0001-0x0013
        Attribute type: Characteristic (0x2803)
> HCI Event: Number of Completed Packets (0x13) plen 5    #124 [hci0] 47.738759
        Num handles: 1
        Handle: 2048 Address: C0:DE:54:15:00:51 (Static)
        Count: 1
        #123: len 11 (2 Kb/s)
        Latency: 42 msec (42-133 msec ~46 msec)
> ACL Data RX: Handle 2048 flags 0x02 dlen 27             #125 [hci0] 47.784836
      ATT: Read By Type Response (0x09) len 22
        Attribute data length: 7
        Attribute data list: 3 entries
        Handle: 0x0002
        Value: 020300002a
            Properties: 0x02
              Read (0x02)
            Value Handle: 0x0003
            Value UUID: Device Name (0x2a00)
        Handle: 0x0004
        Value: 020500012a
            Properties: 0x02
              Read (0x02)
            Value Handle: 0x0005
            Value UUID: Appearance (0x2a01)
        Handle: 0x0006
        Value: 020700042a
            Properties: 0x02
              Read (0x02)
            Value Handle: 0x0007
            Value UUID: Peripheral Preferred Connection Parameters (0x2a04)
bluetoothd[3155986]: < ACL Data TX:.. flags 0x00 dlen 11  #126 [hci0] 47.785343
      ATT: Read By Type Request (0x08) len 6
        Handle range: 0x0007-0x0013
        Attribute type: Characteristic (0x2803)
> HCI Event: Number of Completed Packets (0x13) plen 5    #127 [hci0] 47.828767
        Num handles: 1
        Handle: 2048 Address: C0:DE:54:15:00:51 (Static)
        Count: 1
        #126: len 11 (2 Kb/s)
        Latency: 43 msec (42-133 msec ~44 msec)
> ACL Data RX: Handle 2048 flags 0x02 dlen 20             #128 [hci0] 47.874834
      ATT: Read By Type Response (0x09) len 15
        Attribute data length: 7
        Attribute data list: 2 entries
        Handle: 0x0009
        Value: 200a00052a
            Properties: 0x20
              Indicate (0x20)
            Value Handle: 0x000a
            Value UUID: Service Changed (0x2a05)
        Handle: 0x0011
        Value: 121200192a
            Properties: 0x12
              Read (0x02)
              Notify (0x10)
            Value Handle: 0x0012
            Value UUID: Battery Level (0x2a19)
bluetoothd[3155986]: < ACL Data TX:.. flags 0x00 dlen 11  #129 [hci0] 47.875246
      ATT: Read By Type Request (0x08) len 6
        Handle range: 0x0012-0x0013
        Attribute type: Characteristic (0x2803)
> HCI Event: Number of Completed Packets (0x13) plen 5    #130 [hci0] 47.918949
        Num handles: 1
        Handle: 2048 Address: C0:DE:54:15:00:51 (Static)
        Count: 1
        #129: len 11 (2 Kb/s)
        Latency: 43 msec (42-133 msec ~44 msec)
> ACL Data RX: Handle 2048 flags 0x02 dlen 9              #131 [hci0] 47.964745
      ATT: Error Response (0x01) len 4
        Read By Type Request (0x08)
        Handle: 0x0012
        Error: Attribute Not Found (0x0a)
bluetoothd[3155986]: < ACL Data TX:... flags 0x00 dlen 9  #132 [hci0] 48.002028
      ATT: Write Request (0x12) len 4
        Handle: 0x000b Type: Client Characteristic Configuration (0x2902)
        Value Handle: 0x000a Type: Service Changed (0x2a05)
          Data: 0200
            Indication (0x02)
> HCI Event: Number of Completed Packets (0x13) plen 5    #133 [hci0] 48.008772
        Num handles: 1
        Handle: 2048 Address: C0:DE:54:15:00:51 (Static)
        Count: 1
        #132: len 9 (12 Kb/s)
        Latency: 6 msec (6-133 msec ~25 msec)
> ACL Data RX: Handle 2048 flags 0x02 dlen 5              #134 [hci0] 48.054832
      ATT: Write Response (0x13) len 0
bluetoothd[3155986]: < ACL Data TX:... flags 0x00 dlen 7  #135 [hci0] 48.055243
      ATT: Read Request (0x0a) len 2
        Handle: 0x0003 Type: Device Name (0x2a00)
> HCI Event: Number of Completed Packets (0x13) plen 5    #136 [hci0] 48.098758
        Num handles: 1
        Handle: 2048 Address: C0:DE:54:15:00:51 (Static)
        Count: 1
        #135: len 7 (1 Kb/s)
        Latency: 43 msec (6-133 msec ~34 msec)
> ACL Data RX: Handle 2048 flags 0x02 dlen 11             #137 [hci0] 48.100729
      ATT: Handle Value Indication (0x1d) len 6
        Handle: 0x000a Type: Service Changed (0x2a05)
          Data: 0100ffff
bluetoothd[3155986]: < ACL Data TX:... flags 0x00 dlen 5  #138 [hci0] 48.101161
      ATT: Handle Value Confirmation (0x1e) len 0
> HCI Event: Number of Completed Packets (0x13) plen 5    #139 [hci0] 48.143762
        Num handles: 1
        Handle: 2048 Address: C0:DE:54:15:00:51 (Static)
        Count: 1
        #138: len 5 (0 Kb/s)
        Latency: 42 msec (6-133 msec ~38 msec)
> ACL Data RX: Handle 2048 flags 0x02 dlen 22             #140 [hci0] 48.144737
      ATT: Read Response (0x0b) len 17
bluetoothd[3155986]: < ACL Data TX:... flags 0x00 dlen 7  #141 [hci0] 48.145018
      ATT: Read Request (0x0a) len 2
        Handle: 0x0005 Type: Appearance (0x2a01)
> HCI Event: Number of Completed Packets (0x13) plen 5    #142 [hci0] 48.188857
        Num handles: 1
        Handle: 2048 Address: C0:DE:54:15:00:51 (Static)
        Count: 1
        #141: len 7 (1 Kb/s)
        Latency: 43 msec (6-133 msec ~41 msec)
> ACL Data RX: Handle 2048 flags 0x02 dlen 7              #143 [hci0] 48.234853
      ATT: Read Response (0x0b) len 2
bluetoothd[3155986]: < ACL Data TX:... flags 0x00 dlen 7  #144 [hci0] 48.235247
      ATT: Read Request (0x0a) len 2
        Handle: 0x0012 Type: Battery Level (0x2a19)
> HCI Event: Number of Completed Packets (0x13) plen 5    #145 [hci0] 48.278873
        Num handles: 1
        Handle: 2048 Address: C0:DE:54:15:00:51 (Static)
        Count: 1
        #144: len 7 (1 Kb/s)
        Latency: 43 msec (6-133 msec ~42 msec)
> ACL Data RX: Handle 2048 flags 0x02 dlen 6              #146 [hci0] 48.370724
      ATT: Read Response (0x0b) len 1
bluetoothd[3155986]: < ACL Data TX:.. flags 0x00 dlen 11  #147 [hci0] 48.371180
      ATT: Read By Group Type Request (0x10) len 6
        Handle range: 0x0001-0xffff
        Attribute group type: Primary Service (0x2800)
> HCI Event: Number of Completed Packets (0x13) plen 5    #148 [hci0] 48.413779
        Num handles: 1
        Handle: 2048 Address: C0:DE:54:15:00:51 (Static)
        Count: 1
        #147: len 11 (2 Kb/s)
        Latency: 42 msec (6-133 msec ~42 msec)
> ACL Data RX: Handle 2048 flags 0x02 dlen 24             #149 [hci0] 48.459752
      ATT: Read By Group Type Response (0x11) len 19
        Attribute data length: 6
        Attribute group list: 3 entries
        Handle range: 0x0001-0x0007
        UUID: Generic Access Profile (0x1800)
        Handle range: 0x0008-0x000b
        UUID: Generic Attribute Profile (0x1801)
        Handle range: 0x0010-0x0013
        UUID: Battery Service (0x180f)
bluetoothd[3155986]: < ACL Data TX:... flags 0x00 dlen 9  #150 [hci0] 48.460135
      ATT: Write Request (0x12) len 4
        Handle: 0x0013 Type: Client Characteristic Configuration (0x2902)
        Value Handle: 0x0012 Type: Battery Level (0x2a19)
          Data: 0100
            Notification (0x01)
> HCI Event: Number of Completed Packets (0x13) plen 5    #151 [hci0] 48.503958
        Num handles: 1
        Handle: 2048 Address: C0:DE:54:15:00:51 (Static)
        Count: 1
        #150: len 9 (1 Kb/s)
        Latency: 43 msec (6-133 msec ~43 msec)
> ACL Data RX: Handle 2048 flags 0x02 dlen 5              #152 [hci0] 48.549879
      ATT: Write Response (0x13) len 0
bluetoothd[3155986]: < ACL Data TX:.. flags 0x00 dlen 11  #153 [hci0] 48.550362
      ATT: Read By Group Type Request (0x10) len 6
        Handle range: 0x0014-0xffff
        Attribute group type: Primary Service (0x2800)
> HCI Event: Number of Completed Packets (0x13) plen 5    #154 [hci0] 48.593911
        Num handles: 1
        Handle: 2048 Address: C0:DE:54:15:00:51 (Static)
        Count: 1
        #153: len 11 (2 Kb/s)
        Latency: 43 msec (6-133 msec ~43 msec)
> ACL Data RX: Handle 2048 flags 0x02 dlen 8              #155 [hci0] 48.595731
      ATT: Handle Value Notification (0x1b) len 3
        Handle: 0x0012 Type: Battery Level (0x2a19)
          Data: 60
> ACL Data RX: Handle 2048 flags 0x02 dlen 9              #156 [hci0] 48.639797
      ATT: Error Response (0x01) len 4
        Read By Group Type Request (0x10)
        Handle: 0x0014
        Error: Attribute Not Found (0x0a)
< HCI Command: Disconnect (0x01|0x0006) plen 3            #157 [hci0] 77.549709
        Handle: 2048 Address: C0:DE:54:15:00:51 (Static)
        Reason: Authentication Failure (0x05)
> HCI Event: Command Status (0x0f) plen 4                 #158 [hci0] 77.550587
      Disconnect (0x01|0x0006) ncmd 1
        Status: Success (0x00)
> HCI Event: Disconnect Complete (0x05) plen 4            #159 [hci0] 77.663677
        Status: Success (0x00)
        Handle: 2048 Address: C0:DE:54:15:00:51 (Static)
        Reason: Connection Terminated By Local Host (0x16)
@ MGMT Event: Device Disconnected (0x000c) plen 8     {0x0002} [hci0] 77.663805
        LE Address: C0:DE:54:15:00:51 (Static)
        Reason: Connection terminated by local host (0x02)
@ MGMT Event: Device Disconnected (0x000c) plen 8     {0x0001} [hci0] 77.663805
        LE Address: C0:DE:54:15:00:51 (Static)
        Reason: Connection terminated by local host (0x02)
@ MGMT Event: Command Complete (0x0001) plen 10       {0x0001} [hci0] 77.663821
      Pair Device (0x0019) plen 7
        Status: Failed (0x03)
        LE Address: C0:DE:54:15:00:51 (Static)
bluetoothd[3155986]: @ MGMT Comman.. (0x0019) plen 8  {0x0001} [hci0] 77.664132
        LE Address: C0:DE:54:15:00:51 (Static)
        Capability: KeyboardDisplay (0x04)
< HCI Command: LE Set Address Res.. (0x08|0x002d) plen 1  #160 [hci0] 77.684186
        Address resolution: Disabled (0x00)
> HCI Event: Command Complete (0x0e) plen 4               #161 [hci0] 77.684590
      LE Set Address Resolution Enable (0x08|0x002d) ncmd 1
        Status: Success (0x00)
< HCI Command: LE Set Address Res.. (0x08|0x002d) plen 1  #162 [hci0] 77.685003
        Address resolution: Enabled (0x01)
> HCI Event: Command Complete (0x0e) plen 4               #163 [hci0] 77.685590
      LE Set Address Resolution Enable (0x08|0x002d) ncmd 1
        Status: Success (0x00)
< HCI Command: LE Set Extended S.. (0x08|0x0041) plen 13  #164 [hci0] 77.685980
        Own address type: Public (0x00)
        Filter policy: Ignore not in accept list (0x01)
        PHYs: 0x05
        Entry 0: LE 1M
          Type: Passive (0x00)
          Interval: 60.000 msec (0x0060)
          Window: 60.000 msec (0x0060)
        Entry 1: LE Coded
          Type: Passive (0x00)
          Interval: 180.000 msec (0x0120)
          Window: 180.000 msec (0x0120)
> HCI Event: Command Complete (0x0e) plen 4               #165 [hci0] 77.686594
      LE Set Extended Scan Parameters (0x08|0x0041) ncmd 1
        Status: Success (0x00)
< HCI Command: LE Set Extended Sc.. (0x08|0x0042) plen 6  #166 [hci0] 77.686981
        Extended scan: Enabled (0x01)
        Filter duplicates: Enabled (0x01)
        Duration: 0 msec (0x0000)
        Period: 0.00 sec (0x0000)
> HCI Event: Command Complete (0x0e) plen 4               #167 [hci0] 77.687593
      LE Set Extended Scan Enable (0x08|0x0042) ncmd 1
        Status: Success (0x00)
bluetoothctl[1828946]: @ MGMT Close: bluetoothctl           {0x0002} 106.100001
bluetoothd[3155986]: = Pair device failed: Timeout (0x08)     [hci0] 197.723161
bluetoothd[3155986]: @ MGMT Comma.. (0x003a) plen 4  {0x0001} [hci0] 214.726821
        Address type: 0x01
          BR/EDR
        RSSI: invalid (0x7f)
        UUIDs: 0
< HCI Command: Inquiry (0x01|0x0001) plen 5              #168 [hci0] 214.726990
        Access code: 0x9e8b33 (General Inquiry)
        Length: 10.24s (0x08)
        Num responses: 0
> HCI Event: Command Status (0x0f) plen 4                #169 [hci0] 214.750527
      Inquiry (0x01|0x0001) ncmd 1
        Status: Success (0x00)
@ MGMT Event: Command Complete (0x0001) plen 4       {0x0001} [hci0] 214.750799
      Start Service Discovery (0x003a) plen 1
        Status: Success (0x00)
        Address type: 0x01
          BR/EDR
@ MGMT Event: Discovering (0x0013) plen 2            {0x0001} [hci0] 214.750807
        Address type: 0x01
          BR/EDR
        Discovery: Enabled (0x01)
bluetoothd[3155986]: @ MGMT Comma.. (0x0018) plen 1  {0x0001} [hci0] 214.751033
        Capability: DisplayYesNo (0x01)
@ MGMT Event: Command Complete (0x0001) plen 3       {0x0001} [hci0] 214.751042
      Set IO Capability (0x0018) plen 0
        Status: Success (0x00)
bluetoothd[3155986]: @ MGMT Comma.. (0x003a) plen 4  {0x0001} [hci0] 214.751094
        Address type: 0x01
          BR/EDR
        RSSI: invalid (0x7f)
        UUIDs: 0
@ MGMT Event: Command Complete (0x0001) plen 4       {0x0001} [hci0] 214.751097
      Start Service Discovery (0x003a) plen 1
        Status: Busy (0x0a)
        Address type: 0x01
          BR/EDR
bluetoothd[3155986]: @ MGMT Comma.. (0x003a) plen 4  {0x0001} [hci0] 214.751141
        Address type: 0x01
          BR/EDR
        RSSI: invalid (0x7f)
        UUIDs: 0
@ MGMT Event: Command Complete (0x0001) plen 4       {0x0001} [hci0] 214.751142
      Start Service Discovery (0x003a) plen 1
        Status: Busy (0x0a)
        Address type: 0x01
          BR/EDR
