Bluetooth monitor ver 5.72
btmon[2449519]: = Note: Linux version 6.17.0-14-generic (x86_64)       0.616090
btmon[2449519]: = Note: Bluetooth subsystem version 2.22               0.616091
= New Index: 68:34:21:E5:84:DF (Primary,USB,hci0)               [hci0] 0.616092
= Open Index: 68:34:21:E5:84:DF                                 [hci0] 0.616092
= Index Info: 68:34:21:E5:84:DF (Intel Corp.)                   [hci0] 0.616092
bluetoothd[2915165]: @ MGMT Open.. (privileged) version 1.23  {0x0001} 0.616094
bluetoothctl[2449676]: @ MGMT Open: bluetooth.. version 1.23  {0x0002} 2.618729
bluetoothctl[2449676]: @ MGMT Close: bluetoothctl             {0x0002} 2.630159
bluetoothctl[2449677]: @ MGMT Open: bluetooth.. version 1.23  {0x0002} 2.637777
bluetoothd[2915165]: @ MGMT Command.. (0x0024) plen 1  {0x0001} [hci0] 2.645914
        Address type: 0x01
          BR/EDR
< HCI Command: Inquiry Cancel (0x01|0x0002) plen 0           #1 [hci0] 2.646234
> HCI Event: Command Complete (0x0e) plen 4                  #2 [hci0] 2.741225
      Inquiry Cancel (0x01|0x0002) ncmd 1
        Status: Success (0x00)
@ MGMT Event: Discovering (0x0013) plen 2              {0x0001} [hci0] 2.741249
        Address type: 0x01
          BR/EDR
        Discovery: Disabled (0x00)
@ MGMT Event: Command Complete (0x0001) plen 4         {0x0001} [hci0] 2.741380
      Stop Discovery (0x0024) plen 1
        Status: Success (0x00)
        Address type: 0x01
          BR/EDR
bluetoothd[2915165]: @ MGMT Command.. (0x003a) plen 4  {0x0001} [hci0] 2.741425
        Address type: 0x07
          BR/EDR
          LE Public
          LE Random
        RSSI: invalid (0x7f)
        UUIDs: 0
< HCI Command: LE Set Address Resolu.. (0x08|0x002d) plen 1  #3 [hci0] 2.741441
        Address resolution: Disabled (0x00)
> HCI Event: Command Complete (0x0e) plen 4                  #4 [hci0] 2.742223
      LE Set Address Resolution Enable (0x08|0x002d) ncmd 1
        Status: Success (0x00)
< HCI Command: LE Set Random Address (0x08|0x0005) plen 6    #5 [hci0] 2.742328
        Address: 02:C8:7E:99:E1:4F (Non-Resolvable)
> HCI Event: Command Complete (0x0e) plen 4                  #6 [hci0] 2.743222
      LE Set Random Address (0x08|0x0005) ncmd 1
        Status: Success (0x00)
< HCI Command: LE Set Extended Scan.. (0x08|0x0041) plen 13  #7 [hci0] 2.743328
        Own address type: Random (0x01)
        Filter policy: Accept all advertisement (0x00)
        PHYs: 0x05
        Entry 0: LE 1M
          Type: Active (0x01)
          Interval: 22.500 msec (0x0024)
          Window: 11.250 msec (0x0012)
        Entry 1: LE Coded
          Type: Active (0x01)
          Interval: 67.500 msec (0x006c)
          Window: 33.750 msec (0x0036)
> HCI Event: Command Complete (0x0e) plen 4                  #8 [hci0] 2.744222
      LE Set Extended Scan Parameters (0x08|0x0041) ncmd 1
        Status: Success (0x00)
< HCI Command: LE Set Extended Scan... (0x08|0x0042) plen 6  #9 [hci0] 2.744312
        Extended scan: Enabled (0x01)
        Filter duplicates: Disabled (0x00)
        Duration: 0 msec (0x0000)
        Period: 0.00 sec (0x0000)
> HCI Event: Command Complete (0x0e) plen 4                 #10 [hci0] 2.745222
      LE Set Extended Scan Enable (0x08|0x0042) ncmd 1
        Status: Success (0x00)
@ MGMT Event: Discovering (0x0013) plen 2              {0x0001} [hci0] 2.745230
        Address type: 0x07
          BR/EDR
          LE Public
          LE Random
        Discovery: Enabled (0x01)
< HCI Command: Inquiry (0x01|0x0001) plen 5                 #11 [hci0] 2.745361
        Access code: 0x9e8b33 (General Inquiry)
        Length: 10.24s (0x08)
        Num responses: 0
> HCI Event: LE Meta Event (0x3e) plen 57                   #12 [hci0] 2.757256
      LE Extended Advertising Report (0x0d)
        Num reports: 1
        Entry 0
          Event type: 0x0010
            Props: 0x0010
              Use legacy advertising PDUs
            Data status: [0;32mComplete[0m
          Legacy PDU Type: ADV_NONCONN_IND (0x0010)
          Address type: Random (0x01)
          Address: D9:08:D5:69:61:41 (Static)
          Primary PHY: LE 1M
          Secondary PHY: No packets
          SID: no ADI field (0xff)
          TX power: 127 dBm
          RSSI: -76 dBm (0xb4)
          Periodic advertising interval: 0.00 msec (0x0000)
          Direct address type: Public (0x00)
          Direct address: 00:00:00:00:00:00 (OUI 00-00-00)
          Data length: 0x1f
        1e ff 4c 00 12 19 00 24 33 7a cb 50 39 c8 a0 b4  ..L....$3z.P9...
        b2 f2 de 88 5e ac 5a 2f d9 ef 26 0b 45 00 00     ....^.Z/..&.E.. 
        Company: Apple, Inc. (76)
          Type: Unknown (18)
          Data: 0024337acb5039c8a0b4b2f2de885eac5a2fd9ef260b450000
@ MGMT Event: Device Found (0x0012) plen 45            {0x0001} [hci0] 2.757263
        LE Address: D9:08:D5:69:61:41 (Static)
        RSSI: -76 dBm (0xb4)
        Flags: 0x00000004
          Not Connectable
        Data length: 31
        Company: Apple, Inc. (76)
          Type: Unknown (18)
          Data: 0024337acb5039c8a0b4b2f2de885eac5a2fd9ef260b450000
> HCI Event: Command Status (0x0f) plen 4                   #13 [hci0] 2.758238
      Inquiry (0x01|0x0001) ncmd 1
        Status: Success (0x00)
@ MGMT Event: Command Complete (0x0001) plen 4         {0x0001} [hci0] 2.758373
      Start Service Discovery (0x003a) plen 1
        Status: Success (0x00)
        Address type: 0x07
          BR/EDR
          LE Public
          LE Random
> HCI Event: LE Meta Event (0x3e) plen 57                   #14 [hci0] 2.768264
      LE Extended Advertising Report (0x0d)
        Num reports: 1
        Entry 0
          Event type: 0x0010
            Props: 0x0010
              Use legacy advertising PDUs
            Data status: [0;32mComplete[0m
          Legacy PDU Type: ADV_NONCONN_IND (0x0010)
          Address type: Random (0x01)
          Address: 69:2B:FC:47:52:B9 (Resolvable)
          Primary PHY: LE 1M
          Secondary PHY: No packets
          SID: no ADI field (0xff)
          TX power: 127 dBm
          RSSI: -98 dBm (0x9e)
          Periodic advertising interval: 0.00 msec (0x0000)
          Direct address type: Public (0x00)
          Direct address: 00:00:00:00:00:00 (OUI 00-00-00)
          Data length: 0x1f
        1e ff 06 00 01 09 20 02 5e 92 e0 8f 6c cc 5e 33  ...... .^...l.^3
        0e fd 4a 2c df 76 48 7d 92 de a5 e1 f6 e9 90     ..J,.vH}....... 
        Company: Microsoft (6)
          Data: 010920025e92e08f6ccc5e330efd4a2cdf76487d92dea5e1f6e990
@ MGMT Event: Device Found (0x0012) plen 45            {0x0001} [hci0] 2.768386
        LE Address: 69:2B:FC:47:52:B9 (Resolvable)
        RSSI: -98 dBm (0x9e)
        Flags: 0x00000004
          Not Connectable
        Data length: 31
        Company: Microsoft (6)
          Data: 010920025e92e08f6ccc5e330efd4a2cdf76487d92dea5e1f6e990
> HCI Event: LE Meta Event (0x3e) plen 47                   #15 [hci0] 2.776254
      LE Extended Advertising Report (0x0d)
        Num reports: 1
        Entry 0
          Event type: 0x0013
            Props: 0x0013
              Connectable
              Scannable
              Use legacy advertising PDUs
            Data status: [0;32mComplete[0m
          Legacy PDU Type: ADV_IND (0x0013)
          Address type: Public (0x00)
          Address: A4:C1:38:75:8A:D6 (Telink Semiconductor (Taipei) Co. Ltd.)
          Primary PHY: LE 1M
          Secondary PHY: No packets
          SID: no ADI field (0xff)
          TX power: 127 dBm
          RSSI: -77 dBm (0xb3)
          Periodic advertising interval: 0.00 msec (0x0000)
          Direct address type: Public (0x00)
          Direct address: 00:00:00:00:00:00 (OUI 00-00-00)
          Data length: 0x15
        02 01 06 11 16 95 fe 30 58 5b 05 01 d6 8a 75 38  .......0X[....u8
        c1 a4 28 01 00                                   ..(..           
        Flags: 0x06
          LE General Discoverable Mode
          BR/EDR Not Supported
        Service Data: Xiaomi Inc. (0xfe95)
          Data: 30585b0501d68a7538c1a4280100
> HCI Event: LE Meta Event (0x3e) plen 38                   #16 [hci0] 2.777246
      LE Extended Advertising Report (0x0d)
        Num reports: 1
        Entry 0
          Event type: 0x001b
            Props: 0x001b
              Connectable
              Scannable
              Scan response
              Use legacy advertising PDUs
            Data status: [0;32mComplete[0m
          Legacy PDU Type: SCAN_RSP to an ADV_SCAN_IND (0x001b)
          Address type: Public (0x00)
          Address: A4:C1:38:75:8A:D6 (Telink Semiconductor (Taipei) Co. Ltd.)
          Primary PHY: LE 1M
          Secondary PHY: No packets
          SID: no ADI field (0xff)
          TX power: 127 dBm
          RSSI: -77 dBm (0xb3)
          Periodic advertising interval: 0.00 msec (0x0000)
          Direct address type: Public (0x00)
          Direct address: 00:00:00:00:00:00 (OUI 00-00-00)
          Data length: 0x0c
        0b 09 4c 59 57 53 44 30 33 4d 4d 43              ..LYWSD03MMC    
        Name (complete): LYWSD03MMC
@ MGMT Event: Device Found (0x0012) plen 47            {0x0001} [hci0] 2.777355
        LE Address: A4:C1:38:75:8A:D6 (Telink Semiconductor (Taipei) Co. Ltd.)
        RSSI: -77 dBm (0xb3)
        Flags: 0x00000000
        Data length: 33
        Flags: 0x06
          LE General Discoverable Mode
          BR/EDR Not Supported
        Service Data: Xiaomi Inc. (0xfe95)
          Data: 30585b0501d68a7538c1a4280100
        Name (complete): LYWSD03MMC
> HCI Event: LE Meta Event (0x3e) plen 39                   #17 [hci0] 3.239356
      LE Extended Advertising Report (0x0d)
        Num reports: 1
        Entry 0
          Event type: 0x0013
            Props: 0x0013
              Connectable
              Scannable
              Use legacy advertising PDUs
            Data status: [0;32mComplete[0m
          Legacy PDU Type: ADV_IND (0x0013)
          Address type: Random (0x01)
          Address: C0:DE:54:15:00:51 (Static)
          Primary PHY: LE 1M
          Secondary PHY: No packets
          SID: no ADI field (0xff)
          TX power: 127 dBm
          RSSI: -75 dBm (0xb5)
          Periodic advertising interval: 0.00 msec (0x0000)
          Direct address type: Public (0x00)
          Direct address: 00:00:00:00:00:00 (OUI 00-00-00)
          Data length: 0x0d
        02 01 06 09 09 58 35 34 2d 50 41 49 52           .....X54-PAIR   
        Flags: 0x06
          LE General Discoverable Mode
          BR/EDR Not Supported
        Name (complete): X54-PAIR
> HCI Event: LE Meta Event (0x3e) plen 57                   #18 [hci0] 3.506372
      LE Extended Advertising Report (0x0d)
        Num reports: 1
        Entry 0
          Event type: 0x0010
            Props: 0x0010
              Use legacy advertising PDUs
            Data status: [0;32mComplete[0m
          Legacy PDU Type: ADV_NONCONN_IND (0x0010)
          Address type: Random (0x01)
          Address: 69:2B:FC:47:52:B9 (Resolvable)
          Primary PHY: LE 1M
          Secondary PHY: No packets
          SID: no ADI field (0xff)
          TX power: 127 dBm
          RSSI: -98 dBm (0x9e)
          Periodic advertising interval: 0.00 msec (0x0000)
          Direct address type: Public (0x00)
          Direct address: 00:00:00:00:00:00 (OUI 00-00-00)
          Data length: 0x1f
        1e ff 06 00 01 09 20 02 5e 92 e0 8f 6c cc 5e 33  ...... .^...l.^3
        0e fd 4a 2c df 76 48 7d 92 de a5 e1 f6 e9 90     ..J,.vH}....... 
        Company: Microsoft (6)
          Data: 010920025e92e08f6ccc5e330efd4a2cdf76487d92dea5e1f6e990
@ MGMT Event: Device Found (0x0012) plen 27            {0x0001} [hci0] 3.506468
        LE Address: C0:DE:54:15:00:51 (Static)
        RSSI: -75 dBm (0xb5)
        Flags: 0x00000000
        Data length: 13
        Flags: 0x06
          LE General Discoverable Mode
          BR/EDR Not Supported
        Name (complete): X54-PAIR
@ MGMT Event: Device Found (0x0012) plen 45            {0x0001} [hci0] 3.506472
        LE Address: 69:2B:FC:47:52:B9 (Resolvable)
        RSSI: -98 dBm (0x9e)
        Flags: 0x00000004
          Not Connectable
        Data length: 31
        Company: Microsoft (6)
          Data: 010920025e92e08f6ccc5e330efd4a2cdf76487d92dea5e1f6e990
> HCI Event: LE Meta Event (0x3e) plen 34                   #19 [hci0] 3.515414
      LE Extended Advertising Report (0x0d)
        Num reports: 1
        Entry 0
          Event type: 0x0010
            Props: 0x0010
              Use legacy advertising PDUs
            Data status: [0;32mComplete[0m
          Legacy PDU Type: ADV_NONCONN_IND (0x0010)
          Address type: Random (0x01)
          Address: EB:FE:10:94:D6:61 (Static)
          Primary PHY: LE 1M
          Secondary PHY: No packets
          SID: no ADI field (0xff)
          TX power: 127 dBm
          RSSI: -88 dBm (0xa8)
          Periodic advertising interval: 0.00 msec (0x0000)
          Direct address type: Public (0x00)
          Direct address: 00:00:00:00:00:00 (OUI 00-00-00)
          Data length: 0x08
        07 ff 4c 00 12 02 00 03                          ..L.....        
        Company: Apple, Inc. (76)
          Type: Unknown (18)
          Data: 0003
@ MGMT Event: Device Found (0x0012) plen 22            {0x0001} [hci0] 3.515505
        LE Address: EB:FE:10:94:D6:61 (Static)
        RSSI: -88 dBm (0xa8)
        Flags: 0x00000004
          Not Connectable
        Data length: 8
        Company: Apple, Inc. (76)
          Type: Unknown (18)
          Data: 0003
> HCI Event: LE Meta Event (0x3e) plen 39                   #20 [hci0] 4.486374
      LE Extended Advertising Report (0x0d)
        Num reports: 1
        Entry 0
          Event type: 0x0013
            Props: 0x0013
              Connectable
              Scannable
              Use legacy advertising PDUs
            Data status: [0;32mComplete[0m
          Legacy PDU Type: ADV_IND (0x0013)
          Address type: Random (0x01)
          Address: C0:DE:54:15:00:51 (Static)
          Primary PHY: LE 1M
          Secondary PHY: No packets
          SID: no ADI field (0xff)
          TX power: 127 dBm
          RSSI: -81 dBm (0xaf)
          Periodic advertising interval: 0.00 msec (0x0000)
          Direct address type: Public (0x00)
          Direct address: 00:00:00:00:00:00 (OUI 00-00-00)
          Data length: 0x0d
        02 01 06 09 09 58 35 34 2d 50 41 49 52           .....X54-PAIR   
        Flags: 0x06
          LE General Discoverable Mode
          BR/EDR Not Supported
        Name (complete): X54-PAIR
> HCI Event: LE Meta Event (0x3e) plen 43                   #21 [hci0] 5.430433
      LE Extended Advertising Report (0x0d)
        Num reports: 1
        Entry 0
          Event type: 0x0013
            Props: 0x0013
              Connectable
              Scannable
              Use legacy advertising PDUs
            Data status: [0;32mComplete[0m
          Legacy PDU Type: ADV_IND (0x0013)
          Address type: Public (0x00)
          Address: A4:C1:38:8D:7D:4F (Telink Semiconductor (Taipei) Co. Ltd.)
          Primary PHY: LE 1M
          Secondary PHY: No packets
          SID: no ADI field (0xff)
          TX power: 127 dBm
          RSSI: -92 dBm (0xa4)
          Periodic advertising interval: 0.00 msec (0x0000)
          Direct address type: Public (0x00)
          Direct address: 00:00:00:00:00:00 (OUI 00-00-00)
          Data length: 0x11
        10 16 1a 18 a4 c1 38 8d 7d 4f 00 b8 3c 51 0b 73  ......8.}O..<Q.s
        b3                                               .               
        Service Data: Environmental Sensing (0x181a)
          Data: a4c1388d7d4f00b83c510b73b3
@ MGMT Event: Device Found (0x0012) plen 27            {0x0001} [hci0] 5.430456
        LE Address: C0:DE:54:15:00:51 (Static)
        RSSI: -81 dBm (0xaf)
        Flags: 0x00000000
        Data length: 13
        Flags: 0x06
          LE General Discoverable Mode
          BR/EDR Not Supported
        Name (complete): X54-PAIR
> HCI Event: LE Meta Event (0x3e) plen 38                   #22 [hci0] 5.431451
      LE Extended Advertising Report (0x0d)
        Num reports: 1
        Entry 0
          Event type: 0x001b
            Props: 0x001b
              Connectable
              Scannable
              Scan response
              Use legacy advertising PDUs
            Data status: [0;32mComplete[0m
          Legacy PDU Type: SCAN_RSP to an ADV_SCAN_IND (0x001b)
          Address type: Public (0x00)
          Address: A4:C1:38:8D:7D:4F (Telink Semiconductor (Taipei) Co. Ltd.)
          Primary PHY: LE 1M
          Secondary PHY: No packets
          SID: no ADI field (0xff)
          TX power: 127 dBm
          RSSI: -90 dBm (0xa6)
          Periodic advertising interval: 0.00 msec (0x0000)
          Direct address type: Public (0x00)
          Direct address: 00:00:00:00:00:00 (OUI 00-00-00)
          Data length: 0x0c
        0b 09 41 54 43 5f 38 44 37 44 34 46              ..ATC_8D7D4F    
        Name (complete): ATC_8D7D4F
@ MGMT Event: Device Found (0x0012) plen 43            {0x0001} [hci0] 5.431469
        LE Address: A4:C1:38:8D:7D:4F (Telink Semiconductor (Taipei) Co. Ltd.)
        RSSI: -90 dBm (0xa6)
        Flags: 0x00000000
        Data length: 29
        Service Data: Environmental Sensing (0x181a)
          Data: a4c1388d7d4f00b83c510b73b3
        Name (complete): ATC_8D7D4F
> HCI Event: LE Meta Event (0x3e) plen 34                   #23 [hci0] 5.518334
      LE Extended Advertising Report (0x0d)
        Num reports: 1
        Entry 0
          Event type: 0x0010
            Props: 0x0010
              Use legacy advertising PDUs
            Data status: [0;32mComplete[0m
          Legacy PDU Type: ADV_NONCONN_IND (0x0010)
          Address type: Random (0x01)
          Address: EB:FE:10:94:D6:61 (Static)
          Primary PHY: LE 1M
          Secondary PHY: No packets
          SID: no ADI field (0xff)
          TX power: 127 dBm
          RSSI: -92 dBm (0xa4)
          Periodic advertising interval: 0.00 msec (0x0000)
          Direct address type: Public (0x00)
          Direct address: 00:00:00:00:00:00 (OUI 00-00-00)
          Data length: 0x08
        07 ff 4c 00 12 02 00 03                          ..L.....        
        Company: Apple, Inc. (76)
          Type: Unknown (18)
          Data: 0003
@ MGMT Event: Device Found (0x0012) plen 22            {0x0001} [hci0] 5.518350
        LE Address: EB:FE:10:94:D6:61 (Static)
        RSSI: -92 dBm (0xa4)
        Flags: 0x00000004
          Not Connectable
        Data length: 8
        Company: Apple, Inc. (76)
          Type: Unknown (18)
          Data: 0003
> HCI Event: LE Meta Event (0x3e) plen 57                   #24 [hci0] 5.601423
      LE Extended Advertising Report (0x0d)
        Num reports: 1
        Entry 0
          Event type: 0x0010
            Props: 0x0010
              Use legacy advertising PDUs
            Data status: [0;32mComplete[0m
          Legacy PDU Type: ADV_NONCONN_IND (0x0010)
          Address type: Random (0x01)
          Address: 69:2B:FC:47:52:B9 (Resolvable)
          Primary PHY: LE 1M
          Secondary PHY: No packets
          SID: no ADI field (0xff)
          TX power: 127 dBm
          RSSI: -93 dBm (0xa3)
          Periodic advertising interval: 0.00 msec (0x0000)
          Direct address type: Public (0x00)
          Direct address: 00:00:00:00:00:00 (OUI 00-00-00)
          Data length: 0x1f
        1e ff 06 00 01 09 20 02 5e 92 e0 8f 6c cc 5e 33  ...... .^...l.^3
        0e fd 4a 2c df 76 48 7d 92 de a5 e1 f6 e9 90     ..J,.vH}....... 
        Company: Microsoft (6)
          Data: 010920025e92e08f6ccc5e330efd4a2cdf76487d92dea5e1f6e990
@ MGMT Event: Device Found (0x0012) plen 45            {0x0001} [hci0] 5.601533
        LE Address: 69:2B:FC:47:52:B9 (Resolvable)
        RSSI: -93 dBm (0xa3)
        Flags: 0x00000004
          Not Connectable
        Data length: 31
        Company: Microsoft (6)
          Data: 010920025e92e08f6ccc5e330efd4a2cdf76487d92dea5e1f6e990
> HCI Event: LE Meta Event (0x3e) plen 57                   #25 [hci0] 7.576503
      LE Extended Advertising Report (0x0d)
        Num reports: 1
        Entry 0
          Event type: 0x0010
            Props: 0x0010
              Use legacy advertising PDUs
            Data status: [0;32mComplete[0m
          Legacy PDU Type: ADV_NONCONN_IND (0x0010)
          Address type: Random (0x01)
          Address: 69:2B:FC:47:52:B9 (Resolvable)
          Primary PHY: LE 1M
          Secondary PHY: No packets
          SID: no ADI field (0xff)
          TX power: 127 dBm
          RSSI: -92 dBm (0xa4)
          Periodic advertising interval: 0.00 msec (0x0000)
          Direct address type: Public (0x00)
          Direct address: 00:00:00:00:00:00 (OUI 00-00-00)
          Data length: 0x1f
        1e ff 06 00 01 09 20 02 5e 92 e0 8f 6c cc 5e 33  ...... .^...l.^3
        0e fd 4a 2c df 76 48 7d 92 de a5 e1 f6 e9 90     ..J,.vH}....... 
        Company: Microsoft (6)
          Data: 010920025e92e08f6ccc5e330efd4a2cdf76487d92dea5e1f6e990
@ MGMT Event: Device Found (0x0012) plen 45            {0x0001} [hci0] 7.576592
        LE Address: 69:2B:FC:47:52:B9 (Resolvable)
        RSSI: -92 dBm (0xa4)
        Flags: 0x00000004
          Not Connectable
        Data length: 31
        Company: Microsoft (6)
          Data: 010920025e92e08f6ccc5e330efd4a2cdf76487d92dea5e1f6e990
> HCI Event: LE Meta Event (0x3e) plen 57                   #26 [hci0] 8.777560
      LE Extended Advertising Report (0x0d)
        Num reports: 1
        Entry 0
          Event type: 0x0010
            Props: 0x0010
              Use legacy advertising PDUs
            Data status: [0;32mComplete[0m
          Legacy PDU Type: ADV_NONCONN_IND (0x0010)
          Address type: Random (0x01)
          Address: D9:08:D5:69:61:41 (Static)
          Primary PHY: LE 1M
          Secondary PHY: No packets
          SID: no ADI field (0xff)
          TX power: 127 dBm
          RSSI: -76 dBm (0xb4)
          Periodic advertising interval: 0.00 msec (0x0000)
          Direct address type: Public (0x00)
          Direct address: 00:00:00:00:00:00 (OUI 00-00-00)
          Data length: 0x1f
        1e ff 4c 00 12 19 00 24 33 7a cb 50 39 c8 a0 b4  ..L....$3z.P9...
        b2 f2 de 88 5e ac 5a 2f d9 ef 26 0b 45 00 00     ....^.Z/..&.E.. 
        Company: Apple, Inc. (76)
          Type: Unknown (18)
          Data: 0024337acb5039c8a0b4b2f2de885eac5a2fd9ef260b450000
@ MGMT Event: Device Found (0x0012) plen 45            {0x0001} [hci0] 8.777614
        LE Address: D9:08:D5:69:61:41 (Static)
        RSSI: -76 dBm (0xb4)
        Flags: 0x00000004
          Not Connectable
        Data length: 31
        Company: Apple, Inc. (76)
          Type: Unknown (18)
          Data: 0024337acb5039c8a0b4b2f2de885eac5a2fd9ef260b450000
> HCI Event: LE Meta Event (0x3e) plen 43                   #27 [hci0] 9.240535
      LE Extended Advertising Report (0x0d)
        Num reports: 1
        Entry 0
          Event type: 0x0013
            Props: 0x0013
              Connectable
              Scannable
              Use legacy advertising PDUs
            Data status: [0;32mComplete[0m
          Legacy PDU Type: ADV_IND (0x0013)
          Address type: Random (0x01)
          Address: 77:97:32:85:74:A1 (Resolvable)
          Primary PHY: LE 1M
          Secondary PHY: No packets
          SID: no ADI field (0xff)
          TX power: 127 dBm
          RSSI: -87 dBm (0xa9)
          Periodic advertising interval: 0.00 msec (0x0000)
          Direct address type: Public (0x00)
          Direct address: 00:00:00:00:00:00 (OUI 00-00-00)
          Data length: 0x11
        02 01 1a 02 0a 0c 0a ff 4c 00 10 05 32 1c 19 e3  ........L...2...
        a2                                               .               
        Flags: 0x1a
          LE General Discoverable Mode
          Simultaneous LE and BR/EDR (Controller)
          Simultaneous LE and BR/EDR (Host)
        TX power: 12 dBm
        Company: Apple, Inc. (76)
          Type: Unknown (16)
          Data: 321c19e3a2
> HCI Event: LE Meta Event (0x3e) plen 26                   #28 [hci0] 9.241511
      LE Extended Advertising Report (0x0d)
        Num reports: 1
        Entry 0
          Event type: 0x001b
            Props: 0x001b
              Connectable
              Scannable
              Scan response
              Use legacy advertising PDUs
            Data status: [0;32mComplete[0m
          Legacy PDU Type: SCAN_RSP to an ADV_SCAN_IND (0x001b)
          Address type: Random (0x01)
          Address: 77:97:32:85:74:A1 (Resolvable)
          Primary PHY: LE 1M
          Secondary PHY: No packets
          SID: no ADI field (0xff)
          TX power: 127 dBm
          RSSI: -86 dBm (0xaa)
          Periodic advertising interval: 0.00 msec (0x0000)
          Direct address type: Public (0x00)
          Direct address: 00:00:00:00:00:00 (OUI 00-00-00)
          Data length: 0x00
@ MGMT Event: Device Found (0x0012) plen 31            {0x0001} [hci0] 9.241648
        LE Address: 77:97:32:85:74:A1 (Resolvable)
        RSSI: -86 dBm (0xaa)
        Flags: 0x00000000
        Data length: 17
        Flags: 0x1a
          LE General Discoverable Mode
          Simultaneous LE and BR/EDR (Controller)
          Simultaneous LE and BR/EDR (Host)
        TX power: 12 dBm
        Company: Apple, Inc. (76)
          Type: Unknown (16)
          Data: 321c19e3a2
> HCI Event: LE Meta Event (0x3e) plen 34                   #29 [hci0] 9.527531
      LE Extended Advertising Report (0x0d)
        Num reports: 1
        Entry 0
          Event type: 0x0010
            Props: 0x0010
              Use legacy advertising PDUs
            Data status: [0;32mComplete[0m
          Legacy PDU Type: ADV_NONCONN_IND (0x0010)
          Address type: Random (0x01)
          Address: EB:FE:10:94:D6:61 (Static)
          Primary PHY: LE 1M
          Secondary PHY: No packets
          SID: no ADI field (0xff)
          TX power: 127 dBm
          RSSI: -87 dBm (0xa9)
          Periodic advertising interval: 0.00 msec (0x0000)
          Direct address type: Public (0x00)
          Direct address: 00:00:00:00:00:00 (OUI 00-00-00)
          Data length: 0x08
        07 ff 4c 00 12 02 00 03                          ..L.....        
        Company: Apple, Inc. (76)
          Type: Unknown (18)
          Data: 0003
@ MGMT Event: Device Found (0x0012) plen 22            {0x0001} [hci0] 9.527644
        LE Address: EB:FE:10:94:D6:61 (Static)
        RSSI: -87 dBm (0xa9)
        Flags: 0x00000004
          Not Connectable
        Data length: 8
        Company: Apple, Inc. (76)
          Type: Unknown (18)
          Data: 0003
> HCI Event: LE Meta Event (0x3e) plen 43                  #30 [hci0] 10.064593
      LE Extended Advertising Report (0x0d)
        Num reports: 1
        Entry 0
          Event type: 0x0013
            Props: 0x0013
              Connectable
              Scannable
              Use legacy advertising PDUs
            Data status: [0;32mComplete[0m
          Legacy PDU Type: ADV_IND (0x0013)
          Address type: Random (0x01)
          Address: 77:97:32:85:74:A1 (Resolvable)
          Primary PHY: LE 1M
          Secondary PHY: No packets
          SID: no ADI field (0xff)
          TX power: 127 dBm
          RSSI: -89 dBm (0xa7)
          Periodic advertising interval: 0.00 msec (0x0000)
          Direct address type: Public (0x00)
          Direct address: 00:00:00:00:00:00 (OUI 00-00-00)
          Data length: 0x11
        02 01 1a 02 0a 0c 0a ff 4c 00 10 05 32 1c 19 e3  ........L...2...
        a2                                               .               
        Flags: 0x1a
          LE General Discoverable Mode
          Simultaneous LE and BR/EDR (Controller)
          Simultaneous LE and BR/EDR (Host)
        TX power: 12 dBm
        Company: Apple, Inc. (76)
          Type: Unknown (16)
          Data: 321c19e3a2
> HCI Event: LE Meta Event (0x3e) plen 26                  #31 [hci0] 10.066460
      LE Extended Advertising Report (0x0d)
        Num reports: 1
        Entry 0
          Event type: 0x0013
            Props: 0x0013
              Connectable
              Scannable
              Use legacy advertising PDUs
            Data status: [0;32mComplete[0m
          Legacy PDU Type: ADV_IND (0x0013)
          Address type: Public (0x00)
          Address: 77:97:32:85:74:A1 (OUI 77-97-32)
          Primary PHY: LE 1M
          Secondary PHY: No packets
          SID: no ADI field (0xff)
          TX power: 127 dBm
          RSSI: -89 dBm (0xa7)
          Periodic advertising interval: 0.00 msec (0x0000)
          Direct address type: Public (0x00)
          Direct address: 00:00:00:00:00:00 (OUI 00-00-00)
          Data length: 0x00
@ MGMT Event: Device Found (0x0012) plen 31           {0x0001} [hci0] 10.066633
        LE Address: 77:97:32:85:74:A1 (Resolvable)
        RSSI: -89 dBm (0xa7)
        Flags: 0x00000000
        Data length: 17
        Flags: 0x1a
          LE General Discoverable Mode
          Simultaneous LE and BR/EDR (Controller)
          Simultaneous LE and BR/EDR (Host)
        TX power: 12 dBm
        Company: Apple, Inc. (76)
          Type: Unknown (16)
          Data: 321c19e3a2
> HCI Event: LE Meta Event (0x3e) plen 57                  #32 [hci0] 10.625602
      LE Extended Advertising Report (0x0d)
        Num reports: 1
        Entry 0
          Event type: 0x0010
            Props: 0x0010
              Use legacy advertising PDUs
            Data status: [0;32mComplete[0m
          Legacy PDU Type: ADV_NONCONN_IND (0x0010)
          Address type: Random (0x01)
          Address: 69:2B:FC:47:52:B9 (Resolvable)
          Primary PHY: LE 1M
          Secondary PHY: No packets
          SID: no ADI field (0xff)
          TX power: 127 dBm
          RSSI: -92 dBm (0xa4)
          Periodic advertising interval: 0.00 msec (0x0000)
          Direct address type: Public (0x00)
          Direct address: 00:00:00:00:00:00 (OUI 00-00-00)
          Data length: 0x1f
        1e ff 06 00 01 09 20 02 5e 92 e0 8f 6c cc 5e 33  ...... .^...l.^3
        0e fd 4a 2c df 76 48 7d 92 de a5 e1 f6 e9 90     ..J,.vH}....... 
        Company: Microsoft (6)
          Data: 010920025e92e08f6ccc5e330efd4a2cdf76487d92dea5e1f6e990
@ MGMT Event: Device Found (0x0012) plen 14           {0x0001} [hci0] 10.625630
        LE Address: 77:97:32:85:74:A1 (OUI 77-97-32)
        RSSI: -89 dBm (0xa7)
        Flags: 0x00000000
        Data length: 0
@ MGMT Event: Device Found (0x0012) plen 45           {0x0001} [hci0] 10.625636
        LE Address: 69:2B:FC:47:52:B9 (Resolvable)
        RSSI: -92 dBm (0xa4)
        Flags: 0x00000004
          Not Connectable
        Data length: 31
        Company: Microsoft (6)
          Data: 010920025e92e08f6ccc5e330efd4a2cdf76487d92dea5e1f6e990
bluetoothd[2915165]: = src/device.c:device_new() Unable to regist..   10.626003
bluetoothd[2915165]: = Unable to create object for found d..   [hci0] 10.626013
bluetoothctl[2449677]: @ MGMT Close: bluetoothctl            {0x0002} 12.647199
bluetoothd[2915165]: @ MGMT Comman.. (0x0024) plen 1  {0x0001} [hci0] 12.652595
        Address type: 0x07
          BR/EDR
          LE Public
          LE Random
< HCI Command: Inquiry Cancel (0x01|0x0002) plen 0         #33 [hci0] 12.652740
> HCI Event: Command Complete (0x0e) plen 4                #34 [hci0] 12.654516
      Inquiry Cancel (0x01|0x0002) ncmd 1
        Status: Success (0x00)
< HCI Command: LE Set Extended Sca.. (0x08|0x0042) plen 6  #35 [hci0] 12.654533
        Extended scan: Disabled (0x00)
        Filter duplicates: Disabled (0x00)
        Duration: 0 msec (0x0000)
        Period: 0.00 sec (0x0000)
bluetoothctl[2450615]: @ MGMT Open: bluetoot.. version 1.23  {0x0002} 12.654555
> HCI Event: Command Complete (0x0e) plen 4                #36 [hci0] 12.667582
      LE Set Extended Scan Enable (0x08|0x0042) ncmd 1
        Status: Success (0x00)
@ MGMT Event: Discovering (0x0013) plen 2             {0x0001} [hci0] 12.667702
        Address type: 0x07
          BR/EDR
          LE Public
          LE Random
        Discovery: Disabled (0x00)
@ MGMT Event: Command Complete (0x0001) plen 4        {0x0001} [hci0] 12.667714
      Stop Discovery (0x0024) plen 1
        Status: Success (0x00)
        Address type: 0x07
          BR/EDR
          LE Public
          LE Random
bluetoothd[2915165]: @ MGMT Comman.. (0x003a) plen 4  {0x0001} [hci0] 12.668001
        Address type: 0x01
          BR/EDR
        RSSI: invalid (0x7f)
        UUIDs: 0
< HCI Command: Inquiry (0x01|0x0001) plen 5                #37 [hci0] 12.668023
        Access code: 0x9e8b33 (General Inquiry)
        Length: 10.24s (0x08)
        Num responses: 0
> HCI Event: Command Status (0x0f) plen 4                  #38 [hci0] 12.668508
      Inquiry (0x01|0x0001) ncmd 1
        Status: Success (0x00)
@ MGMT Event: Command Complete (0x0001) plen 4        {0x0001} [hci0] 12.668641
      Start Service Discovery (0x003a) plen 1
        Status: Success (0x00)
        Address type: 0x01
          BR/EDR
@ MGMT Event: Discovering (0x0013) plen 2             {0x0001} [hci0] 12.668644
        Address type: 0x01
          BR/EDR
        Discovery: Enabled (0x01)
bluetoothctl[2450615]: @ MGMT Close: bluetoothctl            {0x0002} 20.659743
bluetoothctl[2451292]: @ MGMT Open: bluetoot.. version 1.23  {0x0002} 20.667997
bluetoothctl[2451292]: @ MGMT Close: bluetoothctl            {0x0002} 20.671424
bluetoothctl[2451293]: @ MGMT Open: bluetoot.. version 1.23  {0x0002} 20.679326
bluetoothd[2915165]: @ MGMT Comman.. (0x0024) plen 1  {0x0001} [hci0] 20.682444
        Address type: 0x01
          BR/EDR
< HCI Command: Inquiry Cancel (0x01|0x0002) plen 0         #39 [hci0] 20.682466
bluetoothctl[2451293]: @ MGMT Close: bluetoothctl            {0x0002} 20.682556
bluetoothd[2915165]: @ MGMT Comman.. (0x001a) plen 7  {0x0001} [hci0] 20.683989
        LE Address: C0:DE:54:15:00:51 (Static)
@ MGMT Event: Command Status (0x0002) plen 3          {0x0001} [hci0] 20.683991
      Cancel Pair Device (0x001a)
        Status: Invalid Parameters (0x0d)
bluetoothctl[2451294]: @ MGMT Open: bluetoot.. version 1.23  {0x0002} 20.686469
> HCI Event: Command Complete (0x0e) plen 4                #40 [hci0] 20.775772
      Inquiry Cancel (0x01|0x0002) ncmd 1
        Status: Success (0x00)
@ MGMT Event: Discovering (0x0013) plen 2             {0x0001} [hci0] 20.775831
        Address type: 0x01
          BR/EDR
        Discovery: Disabled (0x00)
@ MGMT Event: Command Complete (0x0001) plen 4        {0x0001} [hci0] 20.775844
      Stop Discovery (0x0024) plen 1
        Status: Success (0x00)
        Address type: 0x01
          BR/EDR
bluetoothd[2915165]: @ MGMT Comman.. (0x0019) plen 8  {0x0001} [hci0] 20.776114
        LE Address: C0:DE:54:15:00:51 (Static)
        Capability: NoInputNoOutput (0x03)
< HCI Command: LE Set Address Reso.. (0x08|0x002d) plen 1  #41 [hci0] 20.776140
        Address resolution: Enabled (0x01)
> HCI Event: Command Complete (0x0e) plen 4                #42 [hci0] 20.776743
      LE Set Address Resolution Enable (0x08|0x002d) ncmd 1
        Status: Success (0x00)
< HCI Command: LE Set Extended Sc.. (0x08|0x0041) plen 13  #43 [hci0] 20.776895
        Own address type: Public (0x00)
        Filter policy: Ignore not in accept list (0x01)
        PHYs: 0x05
        Entry 0: LE 1M
          Type: Passive (0x00)
          Interval: 60.000 msec (0x0060)
          Window: 60.000 msec (0x0060)
        Entry 1: LE Coded
          Type: Passive (0x00)
          Interval: 180.000 msec (0x0120)
          Window: 180.000 msec (0x0120)
> HCI Event: Command Complete (0x0e) plen 4                #44 [hci0] 20.777746
      LE Set Extended Scan Parameters (0x08|0x0041) ncmd 1
        Status: Success (0x00)
< HCI Command: LE Set Extended Sca.. (0x08|0x0042) plen 6  #45 [hci0] 20.777871
        Extended scan: Enabled (0x01)
        Filter duplicates: Enabled (0x01)
        Duration: 0 msec (0x0000)
        Period: 0.00 sec (0x0000)
> HCI Event: Command Complete (0x0e) plen 4                #46 [hci0] 20.778755
      LE Set Extended Scan Enable (0x08|0x0042) ncmd 1
        Status: Success (0x00)
> HCI Event: LE Meta Event (0x3e) plen 39                  #47 [hci0] 22.480834
      LE Extended Advertising Report (0x0d)
        Num reports: 1
        Entry 0
          Event type: 0x0013
            Props: 0x0013
              Connectable
              Scannable
              Use legacy advertising PDUs
            Data status: [0;32mComplete[0m
          Legacy PDU Type: ADV_IND (0x0013)
          Address type: Random (0x01)
          Address: C0:DE:54:15:00:51 (Static)
          Primary PHY: LE 1M
          Secondary PHY: No packets
          SID: no ADI field (0xff)
          TX power: 127 dBm
          RSSI: -77 dBm (0xb3)
          Periodic advertising interval: 0.00 msec (0x0000)
          Direct address type: Public (0x00)
          Direct address: 00:00:00:00:00:00 (OUI 00-00-00)
          Data length: 0x0d
        02 01 06 09 09 58 35 34 2d 50 41 49 52           .....X54-PAIR   
        Flags: 0x06
          LE General Discoverable Mode
          BR/EDR Not Supported
        Name (complete): X54-PAIR
< HCI Command: LE Set Extended Sca.. (0x08|0x0042) plen 6  #48 [hci0] 22.481058
        Extended scan: Disabled (0x00)
        Filter duplicates: Disabled (0x00)
        Duration: 0 msec (0x0000)
        Period: 0.00 sec (0x0000)
> HCI Event: Command Complete (0x0e) plen 4                #49 [hci0] 22.555874
      LE Set Extended Scan Enable (0x08|0x0042) ncmd 1
        Status: Success (0x00)
< HCI Command: LE Extended Create.. (0x08|0x0043) plen 26  #50 [hci0] 22.556045
        Filter policy: Accept list is not used (0x00)
        Own address type: Public (0x00)
        Peer address type: Random (0x01)
        Peer address: C0:DE:54:15:00:51 (Static)
        Initiating PHYs: 0x01
        Entry 0: LE 1M
          Scan interval: 60.000 msec (0x0060)
          Scan window: 60.000 msec (0x0060)
          Min connection interval: 30.00 msec (0x0018)
          Max connection interval: 50.00 msec (0x0028)
          Connection latency: 0 (0x0000)
          Supervision timeout: 420 msec (0x002a)
          Min connection length: 0.000 msec (0x0000)
          Max connection length: 0.000 msec (0x0000)
> HCI Event: Command Status (0x0f) plen 4                  #51 [hci0] 22.556801
      LE Extended Create Connection (0x08|0x0043) ncmd 1
        Status: Success (0x00)
> HCI Event: LE Meta Event (0x3e) plen 31                  #52 [hci0] 22.635993
      LE Enhanced Connection Complete (0x0a)
        Status: Success (0x00)
        Handle: 2048
        Role: Central (0x00)
        Peer address type: Random (0x01)
        Peer address: C0:DE:54:15:00:51 (Static)
        Local resolvable private address: 00:00:00:00:00:00 (Non-Resolvable)
        Peer resolvable private address: 00:00:00:00:00:00 (Non-Resolvable)
        Connection interval: 45.00 msec (0x0024)
        Connection latency: 0 (0x0000)
        Supervision timeout: 420 msec (0x002a)
        Central clock accuracy: 0x00
@ MGMT Event: Device Connected (0x000b) plen 26       {0x0001} [hci0] 22.636011
        LE Address: C0:DE:54:15:00:51 (Static)
        Flags: 0x00000008
          Connection Locally Initiated
        Data length: 13
        Flags: 0x06
          LE General Discoverable Mode
          BR/EDR Not Supported
        Name (complete): X54-PAIR
btmon[2449519]: @ RAW Open: btmon (privileged) version 2.22  {0x0003} 22.636076
btmon[2449519]: @ RAW Close: btmon                           {0x0003} 22.636082
> HCI Event: LE Meta Event (0x3e) plen 4                   #53 [hci0] 22.636799
      LE Channel Selection Algorithm (0x14)
        Handle: 2048 Address: C0:DE:54:15:00:51 (Static)
        Algorithm: #2 (0x01)
< HCI Command: LE Read Remote Used.. (0x08|0x0016) plen 2  #54 [hci0] 22.648746
        Handle: 2048 Address: C0:DE:54:15:00:51 (Static)
> HCI Event: Command Status (0x0f) plen 4                  #55 [hci0] 22.649923
      LE Read Remote Used Features (0x08|0x0016) ncmd 1
        Status: Success (0x00)
> HCI Event: LE Meta Event (0x3e) plen 12                  #56 [hci0] 22.694928
      LE Read Remote Used Features (0x04)
        Status: Success (0x00)
        Handle: 2048 Address: C0:DE:54:15:00:51 (Static)
        Features: 0x1f 0x00 0x00 0x00 0x00 0x00 0x00 0x00
          LE Encryption
          Connection Parameter Request Procedure
          Extended Reject Indication
          Peripheral-initiated Features Exchange
          LE Ping
< ACL Data TX: Handle 2048 flags 0x00 dlen 11              #57 [hci0] 22.695139
      SMP: Pairing Request (0x01) len 6
        IO capability: NoInputNoOutput (0x03)
        OOB data: Authentication data not present (0x00)
        Authentication requirement: Bonding, No MITM, SC, No Keypresses, CT2 (0x29)
        Max encryption key size: 16
        Initiator key distribution: EncKey Sign LinkKey (0x0d)
        Responder key distribution: EncKey IdKey Sign LinkKey (0x0f)
bluetoothd[2915165]: < ACL Data TX: H.. flags 0x00 dlen 7  #58 [hci0] 22.695606
      ATT: Exchange MTU Request (0x02) len 2
        Client RX MTU: 517
> HCI Event: Number of Completed Packets (0x13) plen 5     #59 [hci0] 22.829009
        Num handles: 1
        Handle: 2048 Address: C0:DE:54:15:00:51 (Static)
        Count: 1
        #57: len 11 (0 Kb/s)
        Latency: 133 msec (133-133 msec ~133 msec)
> HCI Event: Number of Completed Packets (0x13) plen 5     #60 [hci0] 22.873912
        Num handles: 1
        Handle: 2048 Address: C0:DE:54:15:00:51 (Static)
        Count: 1
        #58: len 7 (0 Kb/s)
        Latency: 178 msec (133-178 msec ~156 msec)
> ACL Data RX: Handle 2048 flags 0x02 dlen 11              #61 [hci0] 22.875805
      SMP: Pairing Response (0x02) len 6
        IO capability: NoInputNoOutput (0x03)
        OOB data: Authentication data not present (0x00)
        Authentication requirement: Bonding, No MITM, Legacy, No Keypresses (0x01)
        Max encryption key size: 16
        Initiator key distribution: EncKey (0x01)
        Responder key distribution: <none> (0x00)
@ MGMT Event: User Confirmation R.. (0x000f) plen 12  {0x0001} [hci0] 22.875820
        LE Address: C0:DE:54:15:00:51 (Static)
        Confirm hint: 0x01
        Value: 0x00000000
bluetoothd[2915165]: @ MGMT Comman.. (0x001c) plen 7  {0x0001} [hci0] 22.876078
        LE Address: C0:DE:54:15:00:51 (Static)
@ MGMT Event: Command Complete (0x0001) plen 10       {0x0001} [hci0] 22.876087
      User Confirmation Reply (0x001c) plen 7
        Status: Success (0x00)
        LE Address: C0:DE:54:15:00:51 (Static)
< ACL Data TX: Handle 2048 flags 0x00 dlen 21              #62 [hci0] 22.876176
      SMP: Pairing Confirm (0x03) len 16
        Confim value: ed21460b4163e0ec015804343e0b8f4f
> HCI Event: Number of Completed Packets (0x13) plen 5     #63 [hci0] 22.918927
        Num handles: 1
        Handle: 2048 Address: C0:DE:54:15:00:51 (Static)
        Count: 1
        #62: len 21 (4 Kb/s)
        Latency: 42 msec (42-178 msec ~99 msec)
> ACL Data RX: Handle 2048 flags 0x02 dlen 7               #64 [hci0] 22.918957
      ATT: Exchange MTU Response (0x03) len 2
        Server RX MTU: 23
bluetoothd[2915165]: < ACL Data TX:... flags 0x00 dlen 11  #65 [hci0] 22.919389
      ATT: Read By Type Request (0x08) len 6
        Handle range: 0x0001-0xffff
        Attribute type: Server Supported Features (0x2b3a)
> HCI Event: Number of Completed Packets (0x13) plen 5     #66 [hci0] 22.964894
        Num handles: 1
        Handle: 2048 Address: C0:DE:54:15:00:51 (Static)
        Count: 1
        #65: len 11 (1 Kb/s)
        Latency: 45 msec (42-178 msec ~72 msec)
> ACL Data RX: Handle 2048 flags 0x02 dlen 21              #67 [hci0] 22.965745
      SMP: Pairing Confirm (0x03) len 16
        Confim value: 79a5076932a74a79f45d1fca14e90813
< ACL Data TX: Handle 2048 flags 0x00 dlen 21              #68 [hci0] 22.965909
      SMP: Pairing Random (0x04) len 16
        Random value: 9d813a5a13bd0a7052f71eae4b69e921
> HCI Event: Number of Completed Packets (0x13) plen 5     #69 [hci0] 23.008918
        Num handles: 1
        Handle: 2048 Address: C0:DE:54:15:00:51 (Static)
        Count: 1
        #68: len 21 (3 Kb/s)
        Latency: 43 msec (42-178 msec ~57 msec)
> ACL Data RX: Handle 2048 flags 0x02 dlen 9               #70 [hci0] 23.009788
      ATT: Error Response (0x01) len 4
        Read By Type Request (0x08)
        Handle: 0x0001
        Error: Attribute Not Found (0x0a)
bluetoothd[2915165]: < ACL Data TX:... flags 0x00 dlen 11  #71 [hci0] 23.009994
      ATT: Read By Group Type Request (0x10) len 6
        Handle range: 0x0001-0xffff
        Attribute group type: Primary Service (0x2800)
> HCI Event: Number of Completed Packets (0x13) plen 5     #72 [hci0] 23.054969
        Num handles: 1
        Handle: 2048 Address: C0:DE:54:15:00:51 (Static)
        Count: 1
        #71: len 11 (2 Kb/s)
        Latency: 44 msec (42-178 msec ~51 msec)
> ACL Data RX: Handle 2048 flags 0x02 dlen 21              #73 [hci0] 23.055748
      SMP: Pairing Random (0x04) len 16
        Random value: e44abd706ed89e86cac222fbef0ae564
< HCI Command: LE Start Encryption (0x08|0x0019) plen 28   #74 [hci0] 23.055843
        Handle: 2048 Address: C0:DE:54:15:00:51 (Static)
        Random number: 0x0000000000000000
        Encrypted diversifier: 0x0000
        Long term key: 40b7e596876557bfb4c8f4ab0b47995b
> HCI Event: Command Status (0x0f) plen 4                  #75 [hci0] 23.056814
      LE Start Encryption (0x08|0x0019) ncmd 1
        Status: Success (0x00)
> HCI Event: Encryption Change (0x08) plen 4               #76 [hci0] 23.188822
        Status: Success (0x00)
        Handle: 2048 Address: C0:DE:54:15:00:51 (Static)
        Encryption: Enabled with AES-CCM (0x01)
@ MGMT Event: New Long Term Key (0x000a) plen 37      {0x0001} [hci0] 23.188945
        Store hint: Yes (0x01)
        LE Address: C0:DE:54:15:00:51 (Static)
        Key type: Unauthenticated legacy key (0x00)
        Central: 0x00
        Encryption size: 16
        Diversifier: e72a
        Randomizer: 78e8734aeccb211c
        Key: d3dcfff615474856b1234dbb11126251
@ MGMT Event: Command Complete (0x0001) plen 10       {0x0001} [hci0] 23.188951
      Pair Device (0x0019) plen 7
        Status: Success (0x00)
        LE Address: C0:DE:54:15:00:51 (Static)
< HCI Command: Write Authenticated.. (0x03|0x007c) plen 4  #77 [hci0] 23.188961
        Handle: 2048 Address: C0:DE:54:15:00:51 (Static)
        Timeout: 30000 msec (0x0bb8)
< ACL Data TX: Handle 2048 flags 0x00 dlen 21              #78 [hci0] 23.188977
      SMP: Encryption Information (0x06) len 16
        Long term key: d3dcfff615474856b1234dbb11126251
< ACL Data TX: Handle 2048 flags 0x00 dlen 15              #79 [hci0] 23.188984
      SMP: Central Identification (0x07) len 10
        EDIV: 0x2ae7
        Rand: 0x1c21cbec4a73e878
> HCI Event: Command Complete (0x0e) plen 6                #80 [hci0] 23.189817
      Write Authenticated Payload Timeout (0x03|0x007c) ncmd 1
        Status: Success (0x00)
        Handle: 2048 Address: C0:DE:54:15:00:51 (Static)
> HCI Event: Disconnect Complete (0x05) plen 4             #81 [hci0] 23.593870
        Status: Success (0x00)
        Handle: 2048 Address: C0:DE:54:15:00:51 (Static)
        Reason: Connection Timeout (0x08)
@ MGMT Event: Device Disconnected (0x000c) plen 8     {0x0001} [hci0] 23.593883
        LE Address: C0:DE:54:15:00:51 (Static)
        Reason: Connection timeout (0x01)
bluetoothctl[2451294]: @ MGMT Close: bluetoothctl            {0x0002} 28.696024
bluetoothd[2915165]: @ MGMT Comman.. (0x003a) plen 4  {0x0001} [hci0] 28.726042
        Address type: 0x01
          BR/EDR
        RSSI: invalid (0x7f)
        UUIDs: 0
< HCI Command: Inquiry (0x01|0x0001) plen 5                #82 [hci0] 28.726150
        Access code: 0x9e8b33 (General Inquiry)
        Length: 10.24s (0x08)
        Num responses: 0
> HCI Event: Command Status (0x0f) plen 4                  #83 [hci0] 28.820016
      Inquiry (0x01|0x0001) ncmd 1
        Status: Success (0x00)
@ MGMT Event: Command Complete (0x0001) plen 4        {0x0001} [hci0] 28.820045
      Start Service Discovery (0x003a) plen 1
        Status: Success (0x00)
        Address type: 0x01
          BR/EDR
@ MGMT Event: Discovering (0x0013) plen 2             {0x0001} [hci0] 28.820053
        Address type: 0x01
          BR/EDR
        Discovery: Enabled (0x01)
> HCI Event: Inquiry Complete (0x01) plen 1                #84 [hci0] 39.124394
        Status: Success (0x00)
@ MGMT Event: Discovering (0x0013) plen 2             {0x0001} [hci0] 39.124426
        Address type: 0x01
          BR/EDR
        Discovery: Disabled (0x00)
bluetoothd[2915165]: @ MGMT Comman.. (0x003a) plen 4  {0x0001} [hci0] 39.124753
        Address type: 0x01
          BR/EDR
        RSSI: invalid (0x7f)
        UUIDs: 0
< HCI Command: Inquiry (0x01|0x0001) plen 5                #85 [hci0] 39.124876
        Access code: 0x9e8b33 (General Inquiry)
        Length: 10.24s (0x08)
        Num responses: 0
> HCI Event: Command Status (0x0f) plen 4                  #86 [hci0] 39.126282
      Inquiry (0x01|0x0001) ncmd 1
        Status: Success (0x00)
@ MGMT Event: Command Complete (0x0001) plen 4        {0x0001} [hci0] 39.126378
      Start Service Discovery (0x003a) plen 1
        Status: Success (0x00)
        Address type: 0x01
          BR/EDR
@ MGMT Event: Discovering (0x0013) plen 2             {0x0001} [hci0] 39.126384
        Address type: 0x01
          BR/EDR
        Discovery: Enabled (0x01)
