Bluetooth monitor ver 5.72
btmon[1036653]: = Note: Linux version 6.17.0-14-generic (x86_64)       0.975660
btmon[1036653]: = Note: Bluetooth subsystem version 2.22               0.975662
= New Index: 68:34:21:E5:84:DF (Primary,USB,hci0)               [hci0] 0.975663
= Open Index: 68:34:21:E5:84:DF                                 [hci0] 0.975663
= Index Info: 68:34:21:E5:84:DF (Intel Corp.)                   [hci0] 0.975663
bluetoothd[2915165]: @ MGMT Open.. (privileged) version 1.23  {0x0001} 0.975664
bluetoothctl[1036864]: @ MGMT Op.. (privileged) version 1.23  {0x0002} 2.985291
bluetoothctl[1036864]: @ MGMT Close: bluetoothctl             {0x0002} 2.989416
bluetoothctl[1036867]: @ MGMT Op.. (privileged) version 1.23  {0x0002} 2.997662
bluetoothd[2915165]: @ MGMT Command.. (0x0024) plen 1  {0x0001} [hci0] 3.038975
        Address type: 0x01
          BR/EDR
< HCI Command: Inquiry Cancel (0x01|0x0002) plen 0           #1 [hci0] 3.039147
> HCI Event: Command Complete (0x0e) plen 4                  #2 [hci0] 3.133827
      Inquiry Cancel (0x01|0x0002) ncmd 1
        Status: Success (0x00)
@ MGMT Event: Discovering (0x0013) plen 2              {0x0002} [hci0] 3.133914
        Address type: 0x01
          BR/EDR
        Discovery: Disabled (0x00)
@ MGMT Event: Discovering (0x0013) plen 2              {0x0001} [hci0] 3.133914
        Address type: 0x01
          BR/EDR
        Discovery: Disabled (0x00)
@ MGMT Event: Command Complete (0x0001) plen 4         {0x0001} [hci0] 3.134021
      Stop Discovery (0x0024) plen 1
        Status: Success (0x00)
        Address type: 0x01
          BR/EDR
bluetoothd[2915165]: @ MGMT Command.. (0x003a) plen 4  {0x0001} [hci0] 3.134107
        Address type: 0x07
          BR/EDR
          LE Public
          LE Random
        RSSI: invalid (0x7f)
        UUIDs: 0
< HCI Command: LE Set Address Resolu.. (0x08|0x002d) plen 1  #3 [hci0] 3.134310
        Address resolution: Disabled (0x00)
> HCI Event: Command Complete (0x0e) plen 4                  #4 [hci0] 3.134826
      LE Set Address Resolution Enable (0x08|0x002d) ncmd 1
        Status: Success (0x00)
< HCI Command: LE Set Random Address (0x08|0x0005) plen 6    #5 [hci0] 3.135193
        Address: 1A:58:10:FF:35:BC (Non-Resolvable)
> HCI Event: Command Complete (0x0e) plen 4                  #6 [hci0] 3.135826
      LE Set Random Address (0x08|0x0005) ncmd 1
        Status: Success (0x00)
< HCI Command: LE Set Extended Scan.. (0x08|0x0041) plen 13  #7 [hci0] 3.135928
        Own address type: Random (0x01)
        Filter policy: Accept all advertisement (0x00)
        PHYs: 0x05
        Entry 0: LE 1M
          Type: Active (0x01)
          Interval: 22.500 msec (0x0024)
          Window: 11.250 msec (0x0012)
        Entry 1: LE Coded
          Type: Active (0x01)
          Interval: 67.500 msec (0x006c)
          Window: 33.750 msec (0x0036)
> HCI Event: Command Complete (0x0e) plen 4                  #8 [hci0] 3.137838
      LE Set Extended Scan Parameters (0x08|0x0041) ncmd 1
        Status: Success (0x00)
< HCI Command: LE Set Extended Scan... (0x08|0x0042) plen 6  #9 [hci0] 3.138255
        Extended scan: Enabled (0x01)
        Filter duplicates: Disabled (0x00)
        Duration: 0 msec (0x0000)
        Period: 0.00 sec (0x0000)
> HCI Event: Command Complete (0x0e) plen 4                 #10 [hci0] 3.138830
      LE Set Extended Scan Enable (0x08|0x0042) ncmd 1
        Status: Success (0x00)
@ MGMT Event: Discovering (0x0013) plen 2              {0x0002} [hci0] 3.138942
        Address type: 0x07
          BR/EDR
          LE Public
          LE Random
        Discovery: Enabled (0x01)
@ MGMT Event: Discovering (0x0013) plen 2              {0x0001} [hci0] 3.138942
        Address type: 0x07
          BR/EDR
          LE Public
          LE Random
        Discovery: Enabled (0x01)
< HCI Command: Inquiry (0x01|0x0001) plen 5                 #11 [hci0] 3.139204
        Access code: 0x9e8b33 (General Inquiry)
        Length: 10.24s (0x08)
        Num responses: 0
> HCI Event: Command Status (0x0f) plen 4                   #12 [hci0] 3.150912
      Inquiry (0x01|0x0001) ncmd 1
        Status: Success (0x00)
@ MGMT Event: Command Complete (0x0001) plen 4         {0x0001} [hci0] 3.151195
      Start Service Discovery (0x003a) plen 1
        Status: Success (0x00)
        Address type: 0x07
          BR/EDR
          LE Public
          LE Random
> HCI Event: LE Meta Event (0x3e) plen 43                   #13 [hci0] 3.349972
      LE Extended Advertising Report (0x0d)
        Num reports: 1
        Entry 0
          Event type: 0x0013
            Props: 0x0013
              Connectable
              Scannable
              Use legacy advertising PDUs
            Data status: [0;32mComplete[0m
          Legacy PDU Type: ADV_IND (0x0013)
          Address type: Random (0x01)
          Address: 4B:21:C2:20:D7:B3 (Resolvable)
          Primary PHY: LE 1M
          Secondary PHY: No packets
          SID: no ADI field (0xff)
          TX power: 127 dBm
          RSSI: -87 dBm (0xa9)
          Periodic advertising interval: 0.00 msec (0x0000)
          Direct address type: Public (0x00)
          Direct address: 00:00:00:00:00:00 (OUI 00-00-00)
          Data length: 0x11
        02 01 1a 02 0a 0c 0a ff 4c 00 10 05 37 1c 3c ea  ........L...7.<.
        4b                                               K               
        Flags: 0x1a
          LE General Discoverable Mode
          Simultaneous LE and BR/EDR (Controller)
          Simultaneous LE and BR/EDR (Host)
        TX power: 12 dBm
        Company: Apple, Inc. (76)
          Type: Unknown (16)
          Data: 371c3cea4b
> HCI Event: LE Meta Event (0x3e) plen 26                   #14 [hci0] 3.350936
      LE Extended Advertising Report (0x0d)
        Num reports: 1
        Entry 0
          Event type: 0x001b
            Props: 0x001b
              Connectable
              Scannable
              Scan response
              Use legacy advertising PDUs
            Data status: [0;32mComplete[0m
          Legacy PDU Type: SCAN_RSP to an ADV_SCAN_IND (0x001b)
          Address type: Random (0x01)
          Address: 4B:21:C2:20:D7:B3 (Resolvable)
          Primary PHY: LE 1M
          Secondary PHY: No packets
          SID: no ADI field (0xff)
          TX power: 127 dBm
          RSSI: -87 dBm (0xa9)
          Periodic advertising interval: 0.00 msec (0x0000)
          Direct address type: Public (0x00)
          Direct address: 00:00:00:00:00:00 (OUI 00-00-00)
          Data length: 0x00
@ MGMT Event: Device Found (0x0012) plen 31            {0x0002} [hci0] 3.351063
        LE Address: 4B:21:C2:20:D7:B3 (Resolvable)
        RSSI: -87 dBm (0xa9)
        Flags: 0x00000000
        Data length: 17
        Flags: 0x1a
          LE General Discoverable Mode
          Simultaneous LE and BR/EDR (Controller)
          Simultaneous LE and BR/EDR (Host)
        TX power: 12 dBm
        Company: Apple, Inc. (76)
          Type: Unknown (16)
          Data: 371c3cea4b
@ MGMT Event: Device Found (0x0012) plen 31            {0x0001} [hci0] 3.351063
        LE Address: 4B:21:C2:20:D7:B3 (Resolvable)
        RSSI: -87 dBm (0xa9)
        Flags: 0x00000000
        Data length: 17
        Flags: 0x1a
          LE General Discoverable Mode
          Simultaneous LE and BR/EDR (Controller)
          Simultaneous LE and BR/EDR (Host)
        TX power: 12 dBm
        Company: Apple, Inc. (76)
          Type: Unknown (16)
          Data: 371c3cea4b
> HCI Event: LE Meta Event (0x3e) plen 57                   #15 [hci0] 3.431043
      LE Extended Advertising Report (0x0d)
        Num reports: 1
        Entry 0
          Event type: 0x0010
            Props: 0x0010
              Use legacy advertising PDUs
            Data status: [0;32mComplete[0m
          Legacy PDU Type: ADV_NONCONN_IND (0x0010)
          Address type: Random (0x01)
          Address: 7A:A0:FC:B5:07:16 (Resolvable)
          Primary PHY: LE 1M
          Secondary PHY: No packets
          SID: no ADI field (0xff)
          TX power: 127 dBm
          RSSI: -92 dBm (0xa4)
          Periodic advertising interval: 0.00 msec (0x0000)
          Direct address type: Public (0x00)
          Direct address: 00:00:00:00:00:00 (OUI 00-00-00)
          Data length: 0x1f
        1e ff 06 00 01 09 20 02 6f 90 f9 03 c7 c9 df 21  ...... .o......!
        91 59 df 0d ef 42 aa a5 3d a0 7f ee e3 f5 e9     .Y...B..=...... 
        Company: Microsoft (6)
          Data: 010920026f90f903c7c9df219159df0def42aaa53da07feee3f5e9
@ MGMT Event: Device Found (0x0012) plen 45            {0x0002} [hci0] 3.431167
        LE Address: 7A:A0:FC:B5:07:16 (Resolvable)
        RSSI: -92 dBm (0xa4)
        Flags: 0x00000004
          Not Connectable
        Data length: 31
        Company: Microsoft (6)
          Data: 010920026f90f903c7c9df219159df0def42aaa53da07feee3f5e9
@ MGMT Event: Device Found (0x0012) plen 45            {0x0001} [hci0] 3.431167
        LE Address: 7A:A0:FC:B5:07:16 (Resolvable)
        RSSI: -92 dBm (0xa4)
        Flags: 0x00000004
          Not Connectable
        Data length: 31
        Company: Microsoft (6)
          Data: 010920026f90f903c7c9df219159df0def42aaa53da07feee3f5e9
> HCI Event: LE Meta Event (0x3e) plen 57                   #16 [hci0] 4.064989
      LE Extended Advertising Report (0x0d)
        Num reports: 1
        Entry 0
          Event type: 0x0010
            Props: 0x0010
              Use legacy advertising PDUs
            Data status: [0;32mComplete[0m
          Legacy PDU Type: ADV_NONCONN_IND (0x0010)
          Address type: Random (0x01)
          Address: 7A:A0:FC:B5:07:16 (Resolvable)
          Primary PHY: LE 1M
          Secondary PHY: No packets
          SID: no ADI field (0xff)
          TX power: 127 dBm
          RSSI: -95 dBm (0xa1)
          Periodic advertising interval: 0.00 msec (0x0000)
          Direct address type: Public (0x00)
          Direct address: 00:00:00:00:00:00 (OUI 00-00-00)
          Data length: 0x1f
        1e ff 06 00 01 09 20 02 6f 90 f9 03 c7 c9 df 21  ...... .o......!
        91 59 df 0d ef 42 aa a5 3d a0 7f ee e3 f5 e9     .Y...B..=...... 
        Company: Microsoft (6)
          Data: 010920026f90f903c7c9df219159df0def42aaa53da07feee3f5e9
@ MGMT Event: Device Found (0x0012) plen 45            {0x0002} [hci0] 4.065116
        LE Address: 7A:A0:FC:B5:07:16 (Resolvable)
        RSSI: -95 dBm (0xa1)
        Flags: 0x00000004
          Not Connectable
        Data length: 31
        Company: Microsoft (6)
          Data: 010920026f90f903c7c9df219159df0def42aaa53da07feee3f5e9
@ MGMT Event: Device Found (0x0012) plen 45            {0x0001} [hci0] 4.065116
        LE Address: 7A:A0:FC:B5:07:16 (Resolvable)
        RSSI: -95 dBm (0xa1)
        Flags: 0x00000004
          Not Connectable
        Data length: 31
        Company: Microsoft (6)
          Data: 010920026f90f903c7c9df219159df0def42aaa53da07feee3f5e9
> HCI Event: LE Meta Event (0x3e) plen 57                   #17 [hci0] 4.163995
      LE Extended Advertising Report (0x0d)
        Num reports: 1
        Entry 0
          Event type: 0x0010
            Props: 0x0010
              Use legacy advertising PDUs
            Data status: [0;32mComplete[0m
          Legacy PDU Type: ADV_NONCONN_IND (0x0010)
          Address type: Random (0x01)
          Address: 7A:A0:FC:B5:07:16 (Resolvable)
          Primary PHY: LE 1M
          Secondary PHY: No packets
          SID: no ADI field (0xff)
          TX power: 127 dBm
          RSSI: -89 dBm (0xa7)
          Periodic advertising interval: 0.00 msec (0x0000)
          Direct address type: Public (0x00)
          Direct address: 00:00:00:00:00:00 (OUI 00-00-00)
          Data length: 0x1f
        1e ff 06 00 01 09 20 02 6f 90 f9 03 c7 c9 df 21  ...... .o......!
        91 59 df 0d ef 42 aa a5 3d a0 7f ee e3 f5 e9     .Y...B..=...... 
        Company: Microsoft (6)
          Data: 010920026f90f903c7c9df219159df0def42aaa53da07feee3f5e9
@ MGMT Event: Device Found (0x0012) plen 45            {0x0002} [hci0] 4.164090
        LE Address: 7A:A0:FC:B5:07:16 (Resolvable)
        RSSI: -89 dBm (0xa7)
        Flags: 0x00000004
          Not Connectable
        Data length: 31
        Company: Microsoft (6)
          Data: 010920026f90f903c7c9df219159df0def42aaa53da07feee3f5e9
@ MGMT Event: Device Found (0x0012) plen 45            {0x0001} [hci0] 4.164090
        LE Address: 7A:A0:FC:B5:07:16 (Resolvable)
        RSSI: -89 dBm (0xa7)
        Flags: 0x00000004
          Not Connectable
        Data length: 31
        Company: Microsoft (6)
          Data: 010920026f90f903c7c9df219159df0def42aaa53da07feee3f5e9
> HCI Event: LE Meta Event (0x3e) plen 43                   #18 [hci0] 4.734030
      LE Extended Advertising Report (0x0d)
        Num reports: 1
        Entry 0
          Event type: 0x0013
            Props: 0x0013
              Connectable
              Scannable
              Use legacy advertising PDUs
            Data status: [0;32mComplete[0m
          Legacy PDU Type: ADV_IND (0x0013)
          Address type: Random (0x01)
          Address: 4B:21:C2:20:D7:B3 (Resolvable)
          Primary PHY: LE 1M
          Secondary PHY: No packets
          SID: no ADI field (0xff)
          TX power: 127 dBm
          RSSI: -90 dBm (0xa6)
          Periodic advertising interval: 0.00 msec (0x0000)
          Direct address type: Public (0x00)
          Direct address: 00:00:00:00:00:00 (OUI 00-00-00)
          Data length: 0x11
        02 01 1a 02 0a 0c 0a ff 4c 00 10 05 37 1c 3c ea  ........L...7.<.
        4b                                               K               
        Flags: 0x1a
          LE General Discoverable Mode
          Simultaneous LE and BR/EDR (Controller)
          Simultaneous LE and BR/EDR (Host)
        TX power: 12 dBm
        Company: Apple, Inc. (76)
          Type: Unknown (16)
          Data: 371c3cea4b
> HCI Event: LE Meta Event (0x3e) plen 26                   #19 [hci0] 4.734893
      LE Extended Advertising Report (0x0d)
        Num reports: 1
        Entry 0
          Event type: 0x001b
            Props: 0x001b
              Connectable
              Scannable
              Scan response
              Use legacy advertising PDUs
            Data status: [0;32mComplete[0m
          Legacy PDU Type: SCAN_RSP to an ADV_SCAN_IND (0x001b)
          Address type: Random (0x01)
          Address: 4B:21:C2:20:D7:B3 (Resolvable)
          Primary PHY: LE 1M
          Secondary PHY: No packets
          SID: no ADI field (0xff)
          TX power: 127 dBm
          RSSI: -89 dBm (0xa7)
          Periodic advertising interval: 0.00 msec (0x0000)
          Direct address type: Public (0x00)
          Direct address: 00:00:00:00:00:00 (OUI 00-00-00)
          Data length: 0x00
@ MGMT Event: Device Found (0x0012) plen 31            {0x0002} [hci0] 4.734977
        LE Address: 4B:21:C2:20:D7:B3 (Resolvable)
        RSSI: -89 dBm (0xa7)
        Flags: 0x00000000
        Data length: 17
        Flags: 0x1a
          LE General Discoverable Mode
          Simultaneous LE and BR/EDR (Controller)
          Simultaneous LE and BR/EDR (Host)
        TX power: 12 dBm
        Company: Apple, Inc. (76)
          Type: Unknown (16)
          Data: 371c3cea4b
@ MGMT Event: Device Found (0x0012) plen 31            {0x0001} [hci0] 4.734977
        LE Address: 4B:21:C2:20:D7:B3 (Resolvable)
        RSSI: -89 dBm (0xa7)
        Flags: 0x00000000
        Data length: 17
        Flags: 0x1a
          LE General Discoverable Mode
          Simultaneous LE and BR/EDR (Controller)
          Simultaneous LE and BR/EDR (Host)
        TX power: 12 dBm
        Company: Apple, Inc. (76)
          Type: Unknown (16)
          Data: 371c3cea4b
> HCI Event: LE Meta Event (0x3e) plen 57                   #20 [hci0] 5.004014
      LE Extended Advertising Report (0x0d)
        Num reports: 1
        Entry 0
          Event type: 0x0010
            Props: 0x0010
              Use legacy advertising PDUs
            Data status: [0;32mComplete[0m
          Legacy PDU Type: ADV_NONCONN_IND (0x0010)
          Address type: Random (0x01)
          Address: 7A:A0:FC:B5:07:16 (Resolvable)
          Primary PHY: LE 1M
          Secondary PHY: No packets
          SID: no ADI field (0xff)
          TX power: 127 dBm
          RSSI: -89 dBm (0xa7)
          Periodic advertising interval: 0.00 msec (0x0000)
          Direct address type: Public (0x00)
          Direct address: 00:00:00:00:00:00 (OUI 00-00-00)
          Data length: 0x1f
        1e ff 06 00 01 09 20 02 6f 90 f9 03 c7 c9 df 21  ...... .o......!
        91 59 df 0d ef 42 aa a5 3d a0 7f ee e3 f5 e9     .Y...B..=...... 
        Company: Microsoft (6)
          Data: 010920026f90f903c7c9df219159df0def42aaa53da07feee3f5e9
@ MGMT Event: Device Found (0x0012) plen 45            {0x0002} [hci0] 5.004139
        LE Address: 7A:A0:FC:B5:07:16 (Resolvable)
        RSSI: -89 dBm (0xa7)
        Flags: 0x00000004
          Not Connectable
        Data length: 31
        Company: Microsoft (6)
          Data: 010920026f90f903c7c9df219159df0def42aaa53da07feee3f5e9
@ MGMT Event: Device Found (0x0012) plen 45            {0x0001} [hci0] 5.004139
        LE Address: 7A:A0:FC:B5:07:16 (Resolvable)
        RSSI: -89 dBm (0xa7)
        Flags: 0x00000004
          Not Connectable
        Data length: 31
        Company: Microsoft (6)
          Data: 010920026f90f903c7c9df219159df0def42aaa53da07feee3f5e9
> HCI Event: LE Meta Event (0x3e) plen 26                   #21 [hci0] 5.263018
      LE Extended Advertising Report (0x0d)
        Num reports: 1
        Entry 0
          Event type: 0x0013
            Props: 0x0013
              Connectable
              Scannable
              Use legacy advertising PDUs
            Data status: [0;32mComplete[0m
          Legacy PDU Type: ADV_IND (0x0013)
          Address type: Public (0x00)
          Address: 7A:A0:FC:B5:07:16 (OUI 7A-A0-FC)
          Primary PHY: LE 1M
          Secondary PHY: No packets
          SID: no ADI field (0xff)
          TX power: 127 dBm
          RSSI: -89 dBm (0xa7)
          Periodic advertising interval: 0.00 msec (0x0000)
          Direct address type: Public (0x00)
          Direct address: 00:00:00:00:00:00 (OUI 00-00-00)
          Data length: 0x00
> HCI Event: LE Meta Event (0x3e) plen 57                   #22 [hci0] 6.369041
      LE Extended Advertising Report (0x0d)
        Num reports: 1
        Entry 0
          Event type: 0x0010
            Props: 0x0010
              Use legacy advertising PDUs
            Data status: [0;32mComplete[0m
          Legacy PDU Type: ADV_NONCONN_IND (0x0010)
          Address type: Random (0x01)
          Address: 7A:A0:FC:B5:07:16 (Resolvable)
          Primary PHY: LE 1M
          Secondary PHY: No packets
          SID: no ADI field (0xff)
          TX power: 127 dBm
          RSSI: -90 dBm (0xa6)
          Periodic advertising interval: 0.00 msec (0x0000)
          Direct address type: Public (0x00)
          Direct address: 00:00:00:00:00:00 (OUI 00-00-00)
          Data length: 0x1f
        1e ff 06 00 01 09 20 02 6f 90 f9 03 c7 c9 df 21  ...... .o......!
        91 59 df 0d ef 42 aa a5 3d a0 7f ee e3 f5 e9     .Y...B..=...... 
        Company: Microsoft (6)
          Data: 010920026f90f903c7c9df219159df0def42aaa53da07feee3f5e9
@ MGMT Event: Device Found (0x0012) plen 14            {0x0002} [hci0] 6.369058
        LE Address: 7A:A0:FC:B5:07:16 (OUI 7A-A0-FC)
        RSSI: -89 dBm (0xa7)
        Flags: 0x00000000
        Data length: 0
@ MGMT Event: Device Found (0x0012) plen 14            {0x0001} [hci0] 6.369058
        LE Address: 7A:A0:FC:B5:07:16 (OUI 7A-A0-FC)
        RSSI: -89 dBm (0xa7)
        Flags: 0x00000000
        Data length: 0
@ MGMT Event: Device Found (0x0012) plen 45            {0x0002} [hci0] 6.369063
        LE Address: 7A:A0:FC:B5:07:16 (Resolvable)
        RSSI: -90 dBm (0xa6)
        Flags: 0x00000004
          Not Connectable
        Data length: 31
        Company: Microsoft (6)
          Data: 010920026f90f903c7c9df219159df0def42aaa53da07feee3f5e9
@ MGMT Event: Device Found (0x0012) plen 45            {0x0001} [hci0] 6.369063
        LE Address: 7A:A0:FC:B5:07:16 (Resolvable)
        RSSI: -90 dBm (0xa6)
        Flags: 0x00000004
          Not Connectable
        Data length: 31
        Company: Microsoft (6)
          Data: 010920026f90f903c7c9df219159df0def42aaa53da07feee3f5e9
bluetoothd[2915165]: = src/device.c:device_new() Unable to registe..   6.369377
bluetoothd[2915165]: = Unable to create object for found de..   [hci0] 6.369441
> HCI Event: LE Meta Event (0x3e) plen 57                   #23 [hci0] 7.728113
      LE Extended Advertising Report (0x0d)
        Num reports: 1
        Entry 0
          Event type: 0x0010
            Props: 0x0010
              Use legacy advertising PDUs
            Data status: [0;32mComplete[0m
          Legacy PDU Type: ADV_NONCONN_IND (0x0010)
          Address type: Random (0x01)
          Address: 7A:A0:FC:B5:07:16 (Resolvable)
          Primary PHY: LE 1M
          Secondary PHY: No packets
          SID: no ADI field (0xff)
          TX power: 127 dBm
          RSSI: -90 dBm (0xa6)
          Periodic advertising interval: 0.00 msec (0x0000)
          Direct address type: Public (0x00)
          Direct address: 00:00:00:00:00:00 (OUI 00-00-00)
          Data length: 0x1f
        1e ff 06 00 01 09 20 02 6f 90 f9 03 c7 c9 df 21  ...... .o......!
        91 59 df 0d ef 42 aa a5 3d a0 7f ee e3 f5 e9     .Y...B..=...... 
        Company: Microsoft (6)
          Data: 010920026f90f903c7c9df219159df0def42aaa53da07feee3f5e9
@ MGMT Event: Device Found (0x0012) plen 45            {0x0002} [hci0] 7.728149
        LE Address: 7A:A0:FC:B5:07:16 (Resolvable)
        RSSI: -90 dBm (0xa6)
        Flags: 0x00000004
          Not Connectable
        Data length: 31
        Company: Microsoft (6)
          Data: 010920026f90f903c7c9df219159df0def42aaa53da07feee3f5e9
@ MGMT Event: Device Found (0x0012) plen 45            {0x0001} [hci0] 7.728149
        LE Address: 7A:A0:FC:B5:07:16 (Resolvable)
        RSSI: -90 dBm (0xa6)
        Flags: 0x00000004
          Not Connectable
        Data length: 31
        Company: Microsoft (6)
          Data: 010920026f90f903c7c9df219159df0def42aaa53da07feee3f5e9
> HCI Event: LE Meta Event (0x3e) plen 57                   #24 [hci0] 7.835226
      LE Extended Advertising Report (0x0d)
        Num reports: 1
        Entry 0
          Event type: 0x0010
            Props: 0x0010
              Use legacy advertising PDUs
            Data status: [0;32mComplete[0m
          Legacy PDU Type: ADV_NONCONN_IND (0x0010)
          Address type: Random (0x01)
          Address: 7A:A0:FC:B5:07:16 (Resolvable)
          Primary PHY: LE 1M
          Secondary PHY: No packets
          SID: no ADI field (0xff)
          TX power: 127 dBm
          RSSI: -93 dBm (0xa3)
          Periodic advertising interval: 0.00 msec (0x0000)
          Direct address type: Public (0x00)
          Direct address: 00:00:00:00:00:00 (OUI 00-00-00)
          Data length: 0x1f
        1e ff 06 00 01 09 20 02 6f 90 f9 03 c7 c9 df 21  ...... .o......!
        91 59 df 0d ef 42 aa a5 3d a0 7f ee e3 f5 e9     .Y...B..=...... 
        Company: Microsoft (6)
          Data: 010920026f90f903c7c9df219159df0def42aaa53da07feee3f5e9
@ MGMT Event: Device Found (0x0012) plen 45            {0x0002} [hci0] 7.835405
        LE Address: 7A:A0:FC:B5:07:16 (Resolvable)
        RSSI: -93 dBm (0xa3)
        Flags: 0x00000004
          Not Connectable
        Data length: 31
        Company: Microsoft (6)
          Data: 010920026f90f903c7c9df219159df0def42aaa53da07feee3f5e9
@ MGMT Event: Device Found (0x0012) plen 45            {0x0001} [hci0] 7.835405
        LE Address: 7A:A0:FC:B5:07:16 (Resolvable)
        RSSI: -93 dBm (0xa3)
        Flags: 0x00000004
          Not Connectable
        Data length: 31
        Company: Microsoft (6)
          Data: 010920026f90f903c7c9df219159df0def42aaa53da07feee3f5e9
> HCI Event: LE Meta Event (0x3e) plen 47                   #25 [hci0] 7.929109
      LE Extended Advertising Report (0x0d)
        Num reports: 1
        Entry 0
          Event type: 0x0013
            Props: 0x0013
              Connectable
              Scannable
              Use legacy advertising PDUs
            Data status: [0;32mComplete[0m
          Legacy PDU Type: ADV_IND (0x0013)
          Address type: Public (0x00)
          Address: A4:C1:38:75:8A:D6 (Telink Semiconductor (Taipei) Co. Ltd.)
          Primary PHY: LE 1M
          Secondary PHY: No packets
          SID: no ADI field (0xff)
          TX power: 127 dBm
          RSSI: -83 dBm (0xad)
          Periodic advertising interval: 0.00 msec (0x0000)
          Direct address type: Public (0x00)
          Direct address: 00:00:00:00:00:00 (OUI 00-00-00)
          Data length: 0x15
        02 01 06 11 16 95 fe 30 58 5b 05 01 d6 8a 75 38  .......0X[....u8
        c1 a4 28 01 00                                   ..(..           
        Flags: 0x06
          LE General Discoverable Mode
          BR/EDR Not Supported
        Service Data: Xiaomi Inc. (0xfe95)
          Data: 30585b0501d68a7538c1a4280100
> HCI Event: LE Meta Event (0x3e) plen 38                   #26 [hci0] 7.930001
      LE Extended Advertising Report (0x0d)
        Num reports: 1
        Entry 0
          Event type: 0x001b
            Props: 0x001b
              Connectable
              Scannable
              Scan response
              Use legacy advertising PDUs
            Data status: [0;32mComplete[0m
          Legacy PDU Type: SCAN_RSP to an ADV_SCAN_IND (0x001b)
          Address type: Public (0x00)
          Address: A4:C1:38:75:8A:D6 (Telink Semiconductor (Taipei) Co. Ltd.)
          Primary PHY: LE 1M
          Secondary PHY: No packets
          SID: no ADI field (0xff)
          TX power: 127 dBm
          RSSI: -83 dBm (0xad)
          Periodic advertising interval: 0.00 msec (0x0000)
          Direct address type: Public (0x00)
          Direct address: 00:00:00:00:00:00 (OUI 00-00-00)
          Data length: 0x0c
        0b 09 4c 59 57 53 44 30 33 4d 4d 43              ..LYWSD03MMC    
        Name (complete): LYWSD03MMC
@ MGMT Event: Device Found (0x0012) plen 47            {0x0002} [hci0] 7.930012
        LE Address: A4:C1:38:75:8A:D6 (Telink Semiconductor (Taipei) Co. Ltd.)
        RSSI: -83 dBm (0xad)
        Flags: 0x00000000
        Data length: 33
        Flags: 0x06
          LE General Discoverable Mode
          BR/EDR Not Supported
        Service Data: Xiaomi Inc. (0xfe95)
          Data: 30585b0501d68a7538c1a4280100
        Name (complete): LYWSD03MMC
@ MGMT Event: Device Found (0x0012) plen 47            {0x0001} [hci0] 7.930012
        LE Address: A4:C1:38:75:8A:D6 (Telink Semiconductor (Taipei) Co. Ltd.)
        RSSI: -83 dBm (0xad)
        Flags: 0x00000000
        Data length: 33
        Flags: 0x06
          LE General Discoverable Mode
          BR/EDR Not Supported
        Service Data: Xiaomi Inc. (0xfe95)
          Data: 30585b0501d68a7538c1a4280100
        Name (complete): LYWSD03MMC
> HCI Event: LE Meta Event (0x3e) plen 43                   #27 [hci0] 8.327138
      LE Extended Advertising Report (0x0d)
        Num reports: 1
        Entry 0
          Event type: 0x0013
            Props: 0x0013
              Connectable
              Scannable
              Use legacy advertising PDUs
            Data status: [0;32mComplete[0m
          Legacy PDU Type: ADV_IND (0x0013)
          Address type: Random (0x01)
          Address: 4B:21:C2:20:D7:B3 (Resolvable)
          Primary PHY: LE 1M
          Secondary PHY: No packets
          SID: no ADI field (0xff)
          TX power: 127 dBm
          RSSI: -85 dBm (0xab)
          Periodic advertising interval: 0.00 msec (0x0000)
          Direct address type: Public (0x00)
          Direct address: 00:00:00:00:00:00 (OUI 00-00-00)
          Data length: 0x11
        02 01 1a 02 0a 0c 0a ff 4c 00 10 05 37 1c 3c ea  ........L...7.<.
        4b                                               K               
        Flags: 0x1a
          LE General Discoverable Mode
          Simultaneous LE and BR/EDR (Controller)
          Simultaneous LE and BR/EDR (Host)
        TX power: 12 dBm
        Company: Apple, Inc. (76)
          Type: Unknown (16)
          Data: 371c3cea4b
> HCI Event: LE Meta Event (0x3e) plen 26                   #28 [hci0] 8.328016
      LE Extended Advertising Report (0x0d)
        Num reports: 1
        Entry 0
          Event type: 0x001b
            Props: 0x001b
              Connectable
              Scannable
              Scan response
              Use legacy advertising PDUs
            Data status: [0;32mComplete[0m
          Legacy PDU Type: SCAN_RSP to an ADV_SCAN_IND (0x001b)
          Address type: Random (0x01)
          Address: 4B:21:C2:20:D7:B3 (Resolvable)
          Primary PHY: LE 1M
          Secondary PHY: No packets
          SID: no ADI field (0xff)
          TX power: 127 dBm
          RSSI: -85 dBm (0xab)
          Periodic advertising interval: 0.00 msec (0x0000)
          Direct address type: Public (0x00)
          Direct address: 00:00:00:00:00:00 (OUI 00-00-00)
          Data length: 0x00
@ MGMT Event: Device Found (0x0012) plen 31            {0x0002} [hci0] 8.328030
        LE Address: 4B:21:C2:20:D7:B3 (Resolvable)
        RSSI: -85 dBm (0xab)
        Flags: 0x00000000
        Data length: 17
        Flags: 0x1a
          LE General Discoverable Mode
          Simultaneous LE and BR/EDR (Controller)
          Simultaneous LE and BR/EDR (Host)
        TX power: 12 dBm
        Company: Apple, Inc. (76)
          Type: Unknown (16)
          Data: 371c3cea4b
@ MGMT Event: Device Found (0x0012) plen 31            {0x0001} [hci0] 8.328030
        LE Address: 4B:21:C2:20:D7:B3 (Resolvable)
        RSSI: -85 dBm (0xab)
        Flags: 0x00000000
        Data length: 17
        Flags: 0x1a
          LE General Discoverable Mode
          Simultaneous LE and BR/EDR (Controller)
          Simultaneous LE and BR/EDR (Host)
        TX power: 12 dBm
        Company: Apple, Inc. (76)
          Type: Unknown (16)
          Data: 371c3cea4b
> HCI Event: LE Meta Event (0x3e) plen 57                  #29 [hci0] 11.286188
      LE Extended Advertising Report (0x0d)
        Num reports: 1
        Entry 0
          Event type: 0x0010
            Props: 0x0010
              Use legacy advertising PDUs
            Data status: [0;32mComplete[0m
          Legacy PDU Type: ADV_NONCONN_IND (0x0010)
          Address type: Random (0x01)
          Address: 7A:A0:FC:B5:07:16 (Resolvable)
          Primary PHY: LE 1M
          Secondary PHY: No packets
          SID: no ADI field (0xff)
          TX power: 127 dBm
          RSSI: -93 dBm (0xa3)
          Periodic advertising interval: 0.00 msec (0x0000)
          Direct address type: Public (0x00)
          Direct address: 00:00:00:00:00:00 (OUI 00-00-00)
          Data length: 0x1f
        1e ff 06 00 01 09 20 02 6f 90 f9 03 c7 c9 df 21  ...... .o......!
        91 59 df 0d ef 42 aa a5 3d a0 7f ee e3 f5 e9     .Y...B..=...... 
        Company: Microsoft (6)
          Data: 010920026f90f903c7c9df219159df0def42aaa53da07feee3f5e9
@ MGMT Event: Device Found (0x0012) plen 45           {0x0002} [hci0] 11.286218
        LE Address: 7A:A0:FC:B5:07:16 (Resolvable)
        RSSI: -93 dBm (0xa3)
        Flags: 0x00000004
          Not Connectable
        Data length: 31
        Company: Microsoft (6)
          Data: 010920026f90f903c7c9df219159df0def42aaa53da07feee3f5e9
@ MGMT Event: Device Found (0x0012) plen 45           {0x0001} [hci0] 11.286218
        LE Address: 7A:A0:FC:B5:07:16 (Resolvable)
        RSSI: -93 dBm (0xa3)
        Flags: 0x00000004
          Not Connectable
        Data length: 31
        Company: Microsoft (6)
          Data: 010920026f90f903c7c9df219159df0def42aaa53da07feee3f5e9
> HCI Event: LE Meta Event (0x3e) plen 57                  #30 [hci0] 12.992257
      LE Extended Advertising Report (0x0d)
        Num reports: 1
        Entry 0
          Event type: 0x0010
            Props: 0x0010
              Use legacy advertising PDUs
            Data status: [0;32mComplete[0m
          Legacy PDU Type: ADV_NONCONN_IND (0x0010)
          Address type: Random (0x01)
          Address: 7A:A0:FC:B5:07:16 (Resolvable)
          Primary PHY: LE 1M
          Secondary PHY: No packets
          SID: no ADI field (0xff)
          TX power: 127 dBm
          RSSI: -96 dBm (0xa0)
          Periodic advertising interval: 0.00 msec (0x0000)
          Direct address type: Public (0x00)
          Direct address: 00:00:00:00:00:00 (OUI 00-00-00)
          Data length: 0x1f
        1e ff 06 00 01 09 20 02 6f 90 f9 03 c7 c9 df 21  ...... .o......!
        91 59 df 0d ef 42 aa a5 3d a0 7f ee e3 f5 e9     .Y...B..=...... 
        Company: Microsoft (6)
          Data: 010920026f90f903c7c9df219159df0def42aaa53da07feee3f5e9
@ MGMT Event: Device Found (0x0012) plen 45           {0x0002} [hci0] 12.992345
        LE Address: 7A:A0:FC:B5:07:16 (Resolvable)
        RSSI: -96 dBm (0xa0)
        Flags: 0x00000004
          Not Connectable
        Data length: 31
        Company: Microsoft (6)
          Data: 010920026f90f903c7c9df219159df0def42aaa53da07feee3f5e9
@ MGMT Event: Device Found (0x0012) plen 45           {0x0001} [hci0] 12.992345
        LE Address: 7A:A0:FC:B5:07:16 (Resolvable)
        RSSI: -96 dBm (0xa0)
        Flags: 0x00000004
          Not Connectable
        Data length: 31
        Company: Microsoft (6)
          Data: 010920026f90f903c7c9df219159df0def42aaa53da07feee3f5e9
bluetoothctl[1036867]: @ MGMT Close: bluetoothctl            {0x0002} 13.039303
bluetoothd[2915165]: @ MGMT Comman.. (0x0024) plen 1  {0x0001} [hci0] 13.044504
        Address type: 0x07
          BR/EDR
          LE Public
          LE Random
< HCI Command: Inquiry Cancel (0x01|0x0002) plen 0         #31 [hci0] 13.044532
> HCI Event: Command Complete (0x0e) plen 4                #32 [hci0] 13.046219
      Inquiry Cancel (0x01|0x0002) ncmd 1
        Status: Success (0x00)
< HCI Command: LE Set Extended Sca.. (0x08|0x0042) plen 6  #33 [hci0] 13.046335
        Extended scan: Disabled (0x00)
        Filter duplicates: Disabled (0x00)
        Duration: 0 msec (0x0000)
        Period: 0.00 sec (0x0000)
bluetoothctl[1037772]: @ MGMT O..n (privileged) version 1.23  {0x0002} 13.057364
> HCI Event: Command Complete (0x0e) plen 4                #34 [hci0] 13.058267
      LE Set Extended Scan Enable (0x08|0x0042) ncmd 1
        Status: Success (0x00)
@ MGMT Event: Discovering (0x0013) plen 2             {0x0002} [hci0] 13.058341
        Address type: 0x07
          BR/EDR
          LE Public
          LE Random
        Discovery: Disabled (0x00)
@ MGMT Event: Discovering (0x0013) plen 2             {0x0001} [hci0] 13.058341
        Address type: 0x07
          BR/EDR
          LE Public
          LE Random
        Discovery: Disabled (0x00)
@ MGMT Event: Command Complete (0x0001) plen 4        {0x0001} [hci0] 13.058471
      Stop Discovery (0x0024) plen 1
        Status: Success (0x00)
        Address type: 0x07
          BR/EDR
          LE Public
          LE Random
bluetoothd[2915165]: @ MGMT Comman.. (0x003a) plen 4  {0x0001} [hci0] 13.058575
        Address type: 0x01
          BR/EDR
        RSSI: invalid (0x7f)
        UUIDs: 0
< HCI Command: Inquiry (0x01|0x0001) plen 5                #35 [hci0] 13.058611
        Access code: 0x9e8b33 (General Inquiry)
        Length: 10.24s (0x08)
        Num responses: 0
> HCI Event: Command Status (0x0f) plen 4                  #36 [hci0] 13.059251
      Inquiry (0x01|0x0001) ncmd 1
        Status: Success (0x00)
@ MGMT Event: Command Complete (0x0001) plen 4        {0x0001} [hci0] 13.059476
      Start Service Discovery (0x003a) plen 1
        Status: Success (0x00)
        Address type: 0x01
          BR/EDR
@ MGMT Event: Discovering (0x0013) plen 2             {0x0002} [hci0] 13.059479
        Address type: 0x01
          BR/EDR
        Discovery: Enabled (0x01)
@ MGMT Event: Discovering (0x0013) plen 2             {0x0001} [hci0] 13.059479
        Address type: 0x01
          BR/EDR
        Discovery: Enabled (0x01)
bluetoothctl[1037772]: @ MGMT Close: bluetoothctl            {0x0002} 19.065242
bluetoothctl[1038320]: @ MGMT O..n (privileged) version 1.23  {0x0002} 19.086137
> HCI Event: Inquiry Complete (0x01) plen 1                #37 [hci0] 23.364442
        Status: Success (0x00)
@ MGMT Event: Discovering (0x0013) plen 2             {0x0002} [hci0] 23.364540
        Address type: 0x01
          BR/EDR
        Discovery: Disabled (0x00)
@ MGMT Event: Discovering (0x0013) plen 2             {0x0001} [hci0] 23.364540
        Address type: 0x01
          BR/EDR
        Discovery: Disabled (0x00)
bluetoothd[2915165]: @ MGMT Comman.. (0x003a) plen 4  {0x0001} [hci0] 23.364765
        Address type: 0x01
          BR/EDR
        RSSI: invalid (0x7f)
        UUIDs: 0
< HCI Command: Inquiry (0x01|0x0001) plen 5                #38 [hci0] 23.365020
        Access code: 0x9e8b33 (General Inquiry)
        Length: 10.24s (0x08)
        Num responses: 0
> HCI Event: Command Status (0x0f) plen 4                  #39 [hci0] 23.366430
      Inquiry (0x01|0x0001) ncmd 1
        Status: Success (0x00)
@ MGMT Event: Command Complete (0x0001) plen 4        {0x0001} [hci0] 23.366563
      Start Service Discovery (0x003a) plen 1
        Status: Success (0x00)
        Address type: 0x01
          BR/EDR
@ MGMT Event: Discovering (0x0013) plen 2             {0x0002} [hci0] 23.366571
        Address type: 0x01
          BR/EDR
        Discovery: Enabled (0x01)
@ MGMT Event: Discovering (0x0013) plen 2             {0x0001} [hci0] 23.366571
        Address type: 0x01
          BR/EDR
        Discovery: Enabled (0x01)
bluetoothctl[1038320]: @ MGMT Close: bluetoothctl            {0x0002} 27.095129
bluetoothctl[1039049]: @ MGMT O..n (privileged) version 1.23  {0x0002} 27.112785
> HCI Event: Inquiry Complete (0x01) plen 1                #40 [hci0] 33.670750
        Status: Success (0x00)
@ MGMT Event: Discovering (0x0013) plen 2             {0x0002} [hci0] 33.670766
        Address type: 0x01
          BR/EDR
        Discovery: Disabled (0x00)
@ MGMT Event: Discovering (0x0013) plen 2             {0x0001} [hci0] 33.670766
        Address type: 0x01
          BR/EDR
        Discovery: Disabled (0x00)
bluetoothd[2915165]: @ MGMT Comman.. (0x003a) plen 4  {0x0001} [hci0] 33.670957
        Address type: 0x01
          BR/EDR
        RSSI: invalid (0x7f)
        UUIDs: 0
< HCI Command: Inquiry (0x01|0x0001) plen 5                #41 [hci0] 33.670980
        Access code: 0x9e8b33 (General Inquiry)
        Length: 10.24s (0x08)
        Num responses: 0
> HCI Event: Command Status (0x0f) plen 4                  #42 [hci0] 33.671738
      Inquiry (0x01|0x0001) ncmd 1
        Status: Success (0x00)
@ MGMT Event: Command Complete (0x0001) plen 4        {0x0001} [hci0] 33.671825
      Start Service Discovery (0x003a) plen 1
        Status: Success (0x00)
        Address type: 0x01
          BR/EDR
@ MGMT Event: Discovering (0x0013) plen 2             {0x0002} [hci0] 33.671828
        Address type: 0x01
          BR/EDR
        Discovery: Enabled (0x01)
@ MGMT Event: Discovering (0x0013) plen 2             {0x0001} [hci0] 33.671828
        Address type: 0x01
          BR/EDR
        Discovery: Enabled (0x01)
bluetoothctl[1039049]: @ MGMT Close: bluetoothctl            {0x0002} 37.120299
bluetoothctl[1039939]: @ MGMT O..n (privileged) version 1.23  {0x0002} 37.138667
> HCI Event: Inquiry Complete (0x01) plen 1                #43 [hci0] 43.976166
        Status: Success (0x00)
@ MGMT Event: Discovering (0x0013) plen 2             {0x0002} [hci0] 43.976294
        Address type: 0x01
          BR/EDR
        Discovery: Disabled (0x00)
@ MGMT Event: Discovering (0x0013) plen 2             {0x0001} [hci0] 43.976294
        Address type: 0x01
          BR/EDR
        Discovery: Disabled (0x00)
bluetoothd[2915165]: @ MGMT Comman.. (0x003a) plen 4  {0x0001} [hci0] 43.976482
        Address type: 0x01
          BR/EDR
        RSSI: invalid (0x7f)
        UUIDs: 0
< HCI Command: Inquiry (0x01|0x0001) plen 5                #44 [hci0] 43.976584
        Access code: 0x9e8b33 (General Inquiry)
        Length: 10.24s (0x08)
        Num responses: 0
> HCI Event: Command Status (0x0f) plen 4                  #45 [hci0] 43.978035
      Inquiry (0x01|0x0001) ncmd 1
        Status: Success (0x00)
@ MGMT Event: Command Complete (0x0001) plen 4        {0x0001} [hci0] 43.978204
      Start Service Discovery (0x003a) plen 1
        Status: Success (0x00)
        Address type: 0x01
          BR/EDR
@ MGMT Event: Discovering (0x0013) plen 2             {0x0002} [hci0] 43.978217
        Address type: 0x01
          BR/EDR
        Discovery: Enabled (0x01)
@ MGMT Event: Discovering (0x0013) plen 2             {0x0001} [hci0] 43.978217
        Address type: 0x01
          BR/EDR
        Discovery: Enabled (0x01)
> HCI Event: Inquiry Complete (0x01) plen 1                #46 [hci0] 54.282476
        Status: Success (0x00)
@ MGMT Event: Discovering (0x0013) plen 2             {0x0002} [hci0] 54.282612
        Address type: 0x01
          BR/EDR
        Discovery: Disabled (0x00)
@ MGMT Event: Discovering (0x0013) plen 2             {0x0001} [hci0] 54.282612
        Address type: 0x01
          BR/EDR
        Discovery: Disabled (0x00)
bluetoothd[2915165]: @ MGMT Comman.. (0x003a) plen 4  {0x0001} [hci0] 54.282852
        Address type: 0x01
          BR/EDR
        RSSI: invalid (0x7f)
        UUIDs: 0
< HCI Command: Inquiry (0x01|0x0001) plen 5                #47 [hci0] 54.283148
        Access code: 0x9e8b33 (General Inquiry)
        Length: 10.24s (0x08)
        Num responses: 0
> HCI Event: Command Status (0x0f) plen 4                  #48 [hci0] 54.284343
      Inquiry (0x01|0x0001) ncmd 1
        Status: Success (0x00)
@ MGMT Event: Command Complete (0x0001) plen 4        {0x0001} [hci0] 54.284612
      Start Service Discovery (0x003a) plen 1
        Status: Success (0x00)
        Address type: 0x01
          BR/EDR
@ MGMT Event: Discovering (0x0013) plen 2             {0x0002} [hci0] 54.284627
        Address type: 0x01
          BR/EDR
        Discovery: Enabled (0x01)
@ MGMT Event: Discovering (0x0013) plen 2             {0x0001} [hci0] 54.284627
        Address type: 0x01
          BR/EDR
        Discovery: Enabled (0x01)
bluetoothctl[1039939]: @ MGMT Close: bluetoothctl            {0x0002} 55.148278
bluetoothctl[1041626]: @ MGMT O..n (privileged) version 1.23  {0x0002} 55.193411
bluetoothctl[1041626]: @ MGMT Close: bluetoothctl            {0x0002} 63.198172
bluetoothctl[1042307]: @ MGMT O..n (privileged) version 1.23  {0x0002} 63.214906
> HCI Event: Inquiry Complete (0x01) plen 1                #49 [hci0] 64.588747
        Status: Success (0x00)
@ MGMT Event: Discovering (0x0013) plen 2             {0x0002} [hci0] 64.588776
        Address type: 0x01
          BR/EDR
        Discovery: Disabled (0x00)
@ MGMT Event: Discovering (0x0013) plen 2             {0x0001} [hci0] 64.588776
        Address type: 0x01
          BR/EDR
        Discovery: Disabled (0x00)
bluetoothd[2915165]: @ MGMT Comman.. (0x003a) plen 4  {0x0001} [hci0] 64.589023
        Address type: 0x01
          BR/EDR
        RSSI: invalid (0x7f)
        UUIDs: 0
< HCI Command: Inquiry (0x01|0x0001) plen 5                #50 [hci0] 64.589164
        Access code: 0x9e8b33 (General Inquiry)
        Length: 10.24s (0x08)
        Num responses: 0
> HCI Event: Command Status (0x0f) plen 4                  #51 [hci0] 64.589648
      Inquiry (0x01|0x0001) ncmd 1
        Status: Success (0x00)
@ MGMT Event: Command Complete (0x0001) plen 4        {0x0001} [hci0] 64.589807
      Start Service Discovery (0x003a) plen 1
        Status: Success (0x00)
        Address type: 0x01
          BR/EDR
@ MGMT Event: Discovering (0x0013) plen 2             {0x0002} [hci0] 64.589819
        Address type: 0x01
          BR/EDR
        Discovery: Enabled (0x01)
@ MGMT Event: Discovering (0x0013) plen 2             {0x0001} [hci0] 64.589819
        Address type: 0x01
          BR/EDR
        Discovery: Enabled (0x01)
bluetoothctl[1042307]: @ MGMT Close: bluetoothctl            {0x0002} 69.225242
