Bluetooth monitor ver 5.72
btmon[3064387]: = Note: Linux version 6.17.0-14-generic (x86_64)       0.588976
btmon[3064387]: = Note: Bluetooth subsystem version 2.22               0.588978
= New Index: 68:34:21:E5:84:DF (Primary,USB,hci0)               [hci0] 0.588979
= Open Index: 68:34:21:E5:84:DF                                 [hci0] 0.588979
= Index Info: 68:34:21:E5:84:DF (Intel Corp.)                   [hci0] 0.588979
bluetoothd[2915165]: @ MGMT Open.. (privileged) version 1.23  {0x0001} 0.588980
bluetoothctl[3064442]: @ MGMT Open: bluetooth.. version 1.23  {0x0002} 1.592485
> HCI Event: Inquiry Complete (0x01) plen 1                  #1 [hci0] 4.999991
        Status: Success (0x00)
@ MGMT Event: Discovering (0x0013) plen 2              {0x0001} [hci0] 5.000082
        Address type: 0x01
          BR/EDR
        Discovery: Disabled (0x00)
bluetoothd[2915165]: @ MGMT Command.. (0x003a) plen 4  {0x0001} [hci0] 5.000377
        Address type: 0x01
          BR/EDR
        RSSI: invalid (0x7f)
        UUIDs: 0
< HCI Command: Inquiry (0x01|0x0001) plen 5                  #2 [hci0] 5.000626
        Access code: 0x9e8b33 (General Inquiry)
        Length: 10.24s (0x08)
        Num responses: 0
> HCI Event: Command Status (0x0f) plen 4                    #3 [hci0] 5.001893
      Inquiry (0x01|0x0001) ncmd 1
        Status: Success (0x00)
@ MGMT Event: Command Complete (0x0001) plen 4         {0x0001} [hci0] 5.002093
      Start Service Discovery (0x003a) plen 1
        Status: Success (0x00)
        Address type: 0x01
          BR/EDR
@ MGMT Event: Discovering (0x0013) plen 2              {0x0001} [hci0] 5.002103
        Address type: 0x01
          BR/EDR
        Discovery: Enabled (0x01)
bluetoothctl[3064442]: @ MGMT Close: bluetoothctl             {0x0002} 9.603174
bluetoothctl[3065189]: @ MGMT Open: bluetooth.. version 1.23  {0x0002} 9.613616
bluetoothd[2915165]: @ MGMT Command.. (0x0024) plen 1  {0x0001} [hci0] 9.618152
        Address type: 0x01
          BR/EDR
< HCI Command: Inquiry Cancel (0x01|0x0002) plen 0           #4 [hci0] 9.618455
> HCI Event: Command Complete (0x0e) plen 4                  #5 [hci0] 9.713032
      Inquiry Cancel (0x01|0x0002) ncmd 1
        Status: Success (0x00)
@ MGMT Event: Discovering (0x0013) plen 2              {0x0001} [hci0] 9.713142
        Address type: 0x01
          BR/EDR
        Discovery: Disabled (0x00)
@ MGMT Event: Command Complete (0x0001) plen 4         {0x0001} [hci0] 9.713157
      Stop Discovery (0x0024) plen 1
        Status: Success (0x00)
        Address type: 0x01
          BR/EDR
bluetoothd[2915165]: @ MGMT Command.. (0x003a) plen 4  {0x0001} [hci0] 9.713381
        Address type: 0x07
          BR/EDR
          LE Public
          LE Random
        RSSI: invalid (0x7f)
        UUIDs: 0
< HCI Command: LE Set Address Resolu.. (0x08|0x002d) plen 1  #6 [hci0] 9.713501
        Address resolution: Disabled (0x00)
> HCI Event: Command Complete (0x0e) plen 4                  #7 [hci0] 9.714020
      LE Set Address Resolution Enable (0x08|0x002d) ncmd 1
        Status: Success (0x00)
< HCI Command: LE Set Random Address (0x08|0x0005) plen 6    #8 [hci0] 9.714141
        Address: 36:E9:7B:D8:21:B9 (Non-Resolvable)
> HCI Event: Command Complete (0x0e) plen 4                  #9 [hci0] 9.715022
      LE Set Random Address (0x08|0x0005) ncmd 1
        Status: Success (0x00)
< HCI Command: LE Set Extended Sca.. (0x08|0x0041) plen 13  #10 [hci0] 9.715222
        Own address type: Random (0x01)
        Filter policy: Accept all advertisement (0x00)
        PHYs: 0x05
        Entry 0: LE 1M
          Type: Active (0x01)
          Interval: 22.500 msec (0x0024)
          Window: 11.250 msec (0x0012)
        Entry 1: LE Coded
          Type: Active (0x01)
          Interval: 67.500 msec (0x006c)
          Window: 33.750 msec (0x0036)
> HCI Event: Command Complete (0x0e) plen 4                 #11 [hci0] 9.716173
      LE Set Extended Scan Parameters (0x08|0x0041) ncmd 1
        Status: Success (0x00)
< HCI Command: LE Set Extended Scan.. (0x08|0x0042) plen 6  #12 [hci0] 9.716554
        Extended scan: Enabled (0x01)
        Filter duplicates: Disabled (0x00)
        Duration: 0 msec (0x0000)
        Period: 0.00 sec (0x0000)
> HCI Event: Command Complete (0x0e) plen 4                 #13 [hci0] 9.717106
      LE Set Extended Scan Enable (0x08|0x0042) ncmd 1
        Status: Success (0x00)
@ MGMT Event: Discovering (0x0013) plen 2              {0x0001} [hci0] 9.717217
        Address type: 0x07
          BR/EDR
          LE Public
          LE Random
        Discovery: Enabled (0x01)
< HCI Command: Inquiry (0x01|0x0001) plen 5                 #14 [hci0] 9.717235
        Access code: 0x9e8b33 (General Inquiry)
        Length: 10.24s (0x08)
        Num responses: 0
> HCI Event: Command Status (0x0f) plen 4                   #15 [hci0] 9.730122
      Inquiry (0x01|0x0001) ncmd 1
        Status: Success (0x00)
@ MGMT Event: Command Complete (0x0001) plen 4         {0x0001} [hci0] 9.730337
      Start Service Discovery (0x003a) plen 1
        Status: Success (0x00)
        Address type: 0x07
          BR/EDR
          LE Public
          LE Random
> HCI Event: LE Meta Event (0x3e) plen 26                  #16 [hci0] 10.262126
      LE Extended Advertising Report (0x0d)
        Num reports: 1
        Entry 0
          Event type: 0x0013
            Props: 0x0013
              Connectable
              Scannable
              Use legacy advertising PDUs
            Data status: [0;32mComplete[0m
          Legacy PDU Type: ADV_IND (0x0013)
          Address type: Public (0x00)
          Address: 00:00:00:00:00:00 (OUI 00-00-00)
          Primary PHY: LE 1M
          Secondary PHY: No packets
          SID: no ADI field (0xff)
          TX power: 127 dBm
          RSSI: -81 dBm (0xaf)
          Periodic advertising interval: 0.00 msec (0x0000)
          Direct address type: Public (0x00)
          Direct address: 00:00:00:00:00:00 (OUI 00-00-00)
          Data length: 0x00
> HCI Event: LE Meta Event (0x3e) plen 39                  #17 [hci0] 10.804168
      LE Extended Advertising Report (0x0d)
        Num reports: 1
        Entry 0
          Event type: 0x0013
            Props: 0x0013
              Connectable
              Scannable
              Use legacy advertising PDUs
            Data status: [0;32mComplete[0m
          Legacy PDU Type: ADV_IND (0x0013)
          Address type: Random (0x01)
          Address: C0:DE:54:15:00:51 (Static)
          Primary PHY: LE 1M
          Secondary PHY: No packets
          SID: no ADI field (0xff)
          TX power: 127 dBm
          RSSI: -81 dBm (0xaf)
          Periodic advertising interval: 0.00 msec (0x0000)
          Direct address type: Public (0x00)
          Direct address: 00:00:00:00:00:00 (OUI 00-00-00)
          Data length: 0x0d
        02 01 06 09 09 58 35 34 2d 50 41 49 52           .....X54-PAIR   
        Flags: 0x06
          LE General Discoverable Mode
          BR/EDR Not Supported
        Name (complete): X54-PAIR
> HCI Event: LE Meta Event (0x3e) plen 26                  #18 [hci0] 13.638248
      LE Extended Advertising Report (0x0d)
        Num reports: 1
        Entry 0
          Event type: 0x0013
            Props: 0x0013
              Connectable
              Scannable
              Use legacy advertising PDUs
            Data status: [0;32mComplete[0m
          Legacy PDU Type: ADV_IND (0x0013)
          Address type: Public (0x00)
          Address: C0:DE:54:15:00:51 (OUI C0-DE-54)
          Primary PHY: LE 1M
          Secondary PHY: No packets
          SID: no ADI field (0xff)
          TX power: 127 dBm
          RSSI: -81 dBm (0xaf)
          Periodic advertising interval: 0.00 msec (0x0000)
          Direct address type: Public (0x00)
          Direct address: 00:00:00:00:00:00 (OUI 00-00-00)
          Data length: 0x00
@ MGMT Event: Device Found (0x0012) plen 27           {0x0001} [hci0] 13.638360
        LE Address: C0:DE:54:15:00:51 (Static)
        RSSI: -81 dBm (0xaf)
        Flags: 0x00000000
        Data length: 13
        Flags: 0x06
          LE General Discoverable Mode
          BR/EDR Not Supported
        Name (complete): X54-PAIR
> HCI Event: LE Meta Event (0x3e) plen 34                  #19 [hci0] 14.583275
      LE Extended Advertising Report (0x0d)
        Num reports: 1
        Entry 0
          Event type: 0x0010
            Props: 0x0010
              Use legacy advertising PDUs
            Data status: [0;32mComplete[0m
          Legacy PDU Type: ADV_NONCONN_IND (0x0010)
          Address type: Random (0x01)
          Address: DD:1A:95:AB:9D:E1 (Static)
          Primary PHY: LE 1M
          Secondary PHY: No packets
          SID: no ADI field (0xff)
          TX power: 127 dBm
          RSSI: -93 dBm (0xa3)
          Periodic advertising interval: 0.00 msec (0x0000)
          Direct address type: Public (0x00)
          Direct address: 00:00:00:00:00:00 (OUI 00-00-00)
          Data length: 0x08
        07 ff 4c 00 12 02 00 03                          ..L.....        
        Company: Apple, Inc. (76)
          Type: Unknown (18)
          Data: 0003
@ MGMT Event: Device Found (0x0012) plen 14           {0x0001} [hci0] 14.583401
        LE Address: C0:DE:54:15:00:51 (OUI C0-DE-54)
        RSSI: -81 dBm (0xaf)
        Flags: 0x00000000
        Data length: 0
@ MGMT Event: Device Found (0x0012) plen 22           {0x0001} [hci0] 14.583406
        LE Address: DD:1A:95:AB:9D:E1 (Static)
        RSSI: -93 dBm (0xa3)
        Flags: 0x00000004
          Not Connectable
        Data length: 8
        Company: Apple, Inc. (76)
          Type: Unknown (18)
          Data: 0003
bluetoothd[2915165]: = src/device.c:device_new() Unable to regist..   14.583614
bluetoothd[2915165]: = Unable to create object for found d..   [hci0] 14.583628
> HCI Event: LE Meta Event (0x3e) plen 43                  #20 [hci0] 14.881273
      LE Extended Advertising Report (0x0d)
        Num reports: 1
        Entry 0
          Event type: 0x0013
            Props: 0x0013
              Connectable
              Scannable
              Use legacy advertising PDUs
            Data status: [0;32mComplete[0m
          Legacy PDU Type: ADV_IND (0x0013)
          Address type: Public (0x00)
          Address: A4:C1:38:26:4E:DA (Telink Semiconductor (Taipei) Co. Ltd.)
          Primary PHY: LE 1M
          Secondary PHY: No packets
          SID: no ADI field (0xff)
          TX power: 127 dBm
          RSSI: -59 dBm (0xc5)
          Periodic advertising interval: 0.00 msec (0x0000)
          Direct address type: Public (0x00)
          Direct address: 00:00:00:00:00:00 (OUI 00-00-00)
          Data length: 0x11
        10 16 1a 18 a4 c1 38 26 4e da 00 d6 30 25 0a 05  ......8&N...0%..
        dd                                               .               
        Service Data: Environmental Sensing (0x181a)
          Data: a4c138264eda00d630250a05dd
> HCI Event: LE Meta Event (0x3e) plen 38                  #21 [hci0] 14.882275
      LE Extended Advertising Report (0x0d)
        Num reports: 1
        Entry 0
          Event type: 0x001b
            Props: 0x001b
              Connectable
              Scannable
              Scan response
              Use legacy advertising PDUs
            Data status: [0;32mComplete[0m
          Legacy PDU Type: SCAN_RSP to an ADV_SCAN_IND (0x001b)
          Address type: Public (0x00)
          Address: A4:C1:38:26:4E:DA (Telink Semiconductor (Taipei) Co. Ltd.)
          Primary PHY: LE 1M
          Secondary PHY: No packets
          SID: no ADI field (0xff)
          TX power: 127 dBm
          RSSI: -59 dBm (0xc5)
          Periodic advertising interval: 0.00 msec (0x0000)
          Direct address type: Public (0x00)
          Direct address: 00:00:00:00:00:00 (OUI 00-00-00)
          Data length: 0x0c
        0b 09 41 54 43 5f 32 36 34 45 44 41              ..ATC_264EDA    
        Name (complete): ATC_264EDA
@ MGMT Event: Device Found (0x0012) plen 43           {0x0001} [hci0] 14.882413
        LE Address: A4:C1:38:26:4E:DA (Telink Semiconductor (Taipei) Co. Ltd.)
        RSSI: -59 dBm (0xc5)
        Flags: 0x00000000
        Data length: 29
        Service Data: Environmental Sensing (0x181a)
          Data: a4c138264eda00d630250a05dd
        Name (complete): ATC_264EDA
> HCI Event: LE Meta Event (0x3e) plen 47                  #22 [hci0] 17.135325
      LE Extended Advertising Report (0x0d)
        Num reports: 1
        Entry 0
          Event type: 0x0013
            Props: 0x0013
              Connectable
              Scannable
              Use legacy advertising PDUs
            Data status: [0;32mComplete[0m
          Legacy PDU Type: ADV_IND (0x0013)
          Address type: Public (0x00)
          Address: A4:C1:38:75:8A:D6 (Telink Semiconductor (Taipei) Co. Ltd.)
          Primary PHY: LE 1M
          Secondary PHY: No packets
          SID: no ADI field (0xff)
          TX power: 127 dBm
          RSSI: -79 dBm (0xb1)
          Periodic advertising interval: 0.00 msec (0x0000)
          Direct address type: Public (0x00)
          Direct address: 00:00:00:00:00:00 (OUI 00-00-00)
          Data length: 0x15
        02 01 06 11 16 95 fe 30 58 5b 05 01 d6 8a 75 38  .......0X[....u8
        c1 a4 28 01 00                                   ..(..           
        Flags: 0x06
          LE General Discoverable Mode
          BR/EDR Not Supported
        Service Data: Xiaomi Inc. (0xfe95)
          Data: 30585b0501d68a7538c1a4280100
> HCI Event: LE Meta Event (0x3e) plen 38                  #23 [hci0] 17.136251
      LE Extended Advertising Report (0x0d)
        Num reports: 1
        Entry 0
          Event type: 0x001b
            Props: 0x001b
              Connectable
              Scannable
              Scan response
              Use legacy advertising PDUs
            Data status: [0;32mComplete[0m
          Legacy PDU Type: SCAN_RSP to an ADV_SCAN_IND (0x001b)
          Address type: Public (0x00)
          Address: A4:C1:38:75:8A:D6 (Telink Semiconductor (Taipei) Co. Ltd.)
          Primary PHY: LE 1M
          Secondary PHY: No packets
          SID: no ADI field (0xff)
          TX power: 127 dBm
          RSSI: -79 dBm (0xb1)
          Periodic advertising interval: 0.00 msec (0x0000)
          Direct address type: Public (0x00)
          Direct address: 00:00:00:00:00:00 (OUI 00-00-00)
          Data length: 0x0c
        0b 09 4c 59 57 53 44 30 33 4d 4d 43              ..LYWSD03MMC    
        Name (complete): LYWSD03MMC
@ MGMT Event: Device Found (0x0012) plen 47           {0x0001} [hci0] 17.136362
        LE Address: A4:C1:38:75:8A:D6 (Telink Semiconductor (Taipei) Co. Ltd.)
        RSSI: -79 dBm (0xb1)
        Flags: 0x00000000
        Data length: 33
        Flags: 0x06
          LE General Discoverable Mode
          BR/EDR Not Supported
        Service Data: Xiaomi Inc. (0xfe95)
          Data: 30585b0501d68a7538c1a4280100
        Name (complete): LYWSD03MMC
> HCI Event: LE Meta Event (0x3e) plen 39                  #24 [hci0] 17.314347
      LE Extended Advertising Report (0x0d)
        Num reports: 1
        Entry 0
          Event type: 0x0013
            Props: 0x0013
              Connectable
              Scannable
              Use legacy advertising PDUs
            Data status: [0;32mComplete[0m
          Legacy PDU Type: ADV_IND (0x0013)
          Address type: Random (0x01)
          Address: C0:DE:54:15:00:51 (Static)
          Primary PHY: LE 1M
          Secondary PHY: No packets
          SID: no ADI field (0xff)
          TX power: 127 dBm
          RSSI: -80 dBm (0xb0)
          Periodic advertising interval: 0.00 msec (0x0000)
          Direct address type: Public (0x00)
          Direct address: 00:00:00:00:00:00 (OUI 00-00-00)
          Data length: 0x0d
        02 01 06 09 09 58 35 34 2d 50 41 49 52           .....X54-PAIR   
        Flags: 0x06
          LE General Discoverable Mode
          BR/EDR Not Supported
        Name (complete): X54-PAIR
> HCI Event: LE Meta Event (0x3e) plen 43                  #25 [hci0] 17.610392
      LE Extended Advertising Report (0x0d)
        Num reports: 1
        Entry 0
          Event type: 0x0013
            Props: 0x0013
              Connectable
              Scannable
              Use legacy advertising PDUs
            Data status: [0;32mComplete[0m
          Legacy PDU Type: ADV_IND (0x0013)
          Address type: Public (0x00)
          Address: A4:C1:38:D0:E4:84 (Telink Semiconductor (Taipei) Co. Ltd.)
          Primary PHY: LE 1M
          Secondary PHY: No packets
          SID: no ADI field (0xff)
          TX power: 127 dBm
          RSSI: -77 dBm (0xb3)
          Periodic advertising interval: 0.00 msec (0x0000)
          Direct address type: Public (0x00)
          Direct address: 00:00:00:00:00:00 (OUI 00-00-00)
          Data length: 0x11
        10 16 1a 18 a4 c1 38 d0 e4 84 00 ce 37 50 0b 72  ......8.....7P.r
        dc                                               .               
        Service Data: Environmental Sensing (0x181a)
          Data: a4c138d0e48400ce37500b72dc
@ MGMT Event: Device Found (0x0012) plen 27           {0x0001} [hci0] 17.610537
        LE Address: C0:DE:54:15:00:51 (Static)
        RSSI: -80 dBm (0xb0)
        Flags: 0x00000000
        Data length: 13
        Flags: 0x06
          LE General Discoverable Mode
          BR/EDR Not Supported
        Name (complete): X54-PAIR
bluetoothctl[3065189]: @ MGMT Close: bluetoothctl            {0x0002} 19.619970
bluetoothd[2915165]: @ MGMT Comman.. (0x0024) plen 1  {0x0001} [hci0] 19.623749
        Address type: 0x07
          BR/EDR
          LE Public
          LE Random
< HCI Command: Inquiry Cancel (0x01|0x0002) plen 0         #26 [hci0] 19.624005
> HCI Event: Command Complete (0x0e) plen 4                #27 [hci0] 19.625307
      Inquiry Cancel (0x01|0x0002) ncmd 1
        Status: Success (0x00)
< HCI Command: LE Set Extended Sca.. (0x08|0x0042) plen 6  #28 [hci0] 19.625492
        Extended scan: Disabled (0x00)
        Filter duplicates: Disabled (0x00)
        Duration: 0 msec (0x0000)
        Period: 0.00 sec (0x0000)
bluetoothctl[3066080]: @ MGMT Open: bluetoot.. version 1.23  {0x0002} 19.631435
> HCI Event: Command Complete (0x0e) plen 4                #29 [hci0] 19.638389
      LE Set Extended Scan Enable (0x08|0x0042) ncmd 1
        Status: Success (0x00)
@ MGMT Event: Discovering (0x0013) plen 2             {0x0001} [hci0] 19.638500
        Address type: 0x07
          BR/EDR
          LE Public
          LE Random
        Discovery: Disabled (0x00)
@ MGMT Event: Command Complete (0x0001) plen 4        {0x0001} [hci0] 19.638610
      Stop Discovery (0x0024) plen 1
        Status: Success (0x00)
        Address type: 0x07
          BR/EDR
          LE Public
          LE Random
bluetoothd[2915165]: @ MGMT Comman.. (0x003a) plen 4  {0x0001} [hci0] 19.638681
        Address type: 0x01
          BR/EDR
        RSSI: invalid (0x7f)
        UUIDs: 0
< HCI Command: LE Set Address Reso.. (0x08|0x002d) plen 1  #30 [hci0] 19.638736
        Address resolution: Enabled (0x01)
> HCI Event: Command Complete (0x0e) plen 4                #31 [hci0] 19.639302
      LE Set Address Resolution Enable (0x08|0x002d) ncmd 1
        Status: Success (0x00)
< HCI Command: LE Set Extended Sc.. (0x08|0x0041) plen 13  #32 [hci0] 19.639387
        Own address type: Public (0x00)
        Filter policy: Ignore not in accept list (0x01)
        PHYs: 0x05
        Entry 0: LE 1M
          Type: Passive (0x00)
          Interval: 60.000 msec (0x0060)
          Window: 60.000 msec (0x0060)
        Entry 1: LE Coded
          Type: Passive (0x00)
          Interval: 180.000 msec (0x0120)
          Window: 180.000 msec (0x0120)
> HCI Event: Command Complete (0x0e) plen 4                #33 [hci0] 19.640295
      LE Set Extended Scan Parameters (0x08|0x0041) ncmd 1
        Status: Success (0x00)
< HCI Command: LE Set Extended Sca.. (0x08|0x0042) plen 6  #34 [hci0] 19.640407
        Extended scan: Enabled (0x01)
        Filter duplicates: Enabled (0x01)
        Duration: 0 msec (0x0000)
        Period: 0.00 sec (0x0000)
> HCI Event: Command Complete (0x0e) plen 4                #35 [hci0] 19.641296
      LE Set Extended Scan Enable (0x08|0x0042) ncmd 1
        Status: Success (0x00)
< HCI Command: Inquiry (0x01|0x0001) plen 5                #36 [hci0] 19.641416
        Access code: 0x9e8b33 (General Inquiry)
        Length: 10.24s (0x08)
        Num responses: 0
> HCI Event: Command Status (0x0f) plen 4                  #37 [hci0] 19.742391
      Inquiry (0x01|0x0001) ncmd 1
        Status: Success (0x00)
@ MGMT Event: Command Complete (0x0001) plen 4        {0x0001} [hci0] 19.742689
      Start Service Discovery (0x003a) plen 1
        Status: Success (0x00)
        Address type: 0x01
          BR/EDR
@ MGMT Event: Discovering (0x0013) plen 2             {0x0001} [hci0] 19.742698
        Address type: 0x01
          BR/EDR
        Discovery: Enabled (0x01)
> HCI Event: LE Meta Event (0x3e) plen 39                  #38 [hci0] 23.067490
      LE Extended Advertising Report (0x0d)
        Num reports: 1
        Entry 0
          Event type: 0x0013
            Props: 0x0013
              Connectable
              Scannable
              Use legacy advertising PDUs
            Data status: [0;32mComplete[0m
          Legacy PDU Type: ADV_IND (0x0013)
          Address type: Random (0x01)
          Address: C0:DE:54:15:00:51 (Static)
          Primary PHY: LE 1M
          Secondary PHY: No packets
          SID: no ADI field (0xff)
          TX power: 127 dBm
          RSSI: -80 dBm (0xb0)
          Periodic advertising interval: 0.00 msec (0x0000)
          Direct address type: Public (0x00)
          Direct address: 00:00:00:00:00:00 (OUI 00-00-00)
          Data length: 0x0d
        02 01 06 09 09 58 35 34 2d 50 41 49 52           .....X54-PAIR   
        Flags: 0x06
          LE General Discoverable Mode
          BR/EDR Not Supported
        Name (complete): X54-PAIR
< HCI Command: LE Set Extended Sca.. (0x08|0x0042) plen 6  #39 [hci0] 23.067644
        Extended scan: Disabled (0x00)
        Filter duplicates: Disabled (0x00)
        Duration: 0 msec (0x0000)
        Period: 0.00 sec (0x0000)
> HCI Event: Command Complete (0x0e) plen 4                #40 [hci0] 23.068517
      LE Set Extended Scan Enable (0x08|0x0042) ncmd 1
        Status: Success (0x00)
@ MGMT Event: Device Found (0x0012) plen 31           {0x0001} [hci0] 23.068653
        LE Address: A4:C1:38:D0:E4:84 (Telink Semiconductor (Taipei) Co. Ltd.)
        RSSI: -77 dBm (0xb3)
        Flags: 0x00000000
        Data length: 17
        Service Data: Environmental Sensing (0x181a)
          Data: a4c138d0e48400ce37500b72dc
< HCI Command: LE Extended Create.. (0x08|0x0043) plen 26  #41 [hci0] 23.068672
        Filter policy: Accept list is not used (0x00)
        Own address type: Public (0x00)
        Peer address type: Random (0x01)
        Peer address: C0:DE:54:15:00:51 (Static)
        Initiating PHYs: 0x01
        Entry 0: LE 1M
          Scan interval: 60.000 msec (0x0060)
          Scan window: 60.000 msec (0x0060)
          Min connection interval: 30.00 msec (0x0018)
          Max connection interval: 50.00 msec (0x0028)
          Connection latency: 0 (0x0000)
          Supervision timeout: 420 msec (0x002a)
          Min connection length: 0.000 msec (0x0000)
          Max connection length: 0.000 msec (0x0000)
> HCI Event: Command Status (0x0f) plen 4                  #42 [hci0] 23.070393
      LE Extended Create Connection (0x08|0x0043) ncmd 1
        Status: Success (0x00)
> HCI Event: LE Meta Event (0x3e) plen 31                  #43 [hci0] 23.852521
      LE Enhanced Connection Complete (0x0a)
        Status: Success (0x00)
        Handle: 2048
        Role: Central (0x00)
        Peer address type: Random (0x01)
        Peer address: C0:DE:54:15:00:51 (Static)
        Local resolvable private address: 00:00:00:00:00:00 (Non-Resolvable)
        Peer resolvable private address: 00:00:00:00:00:00 (Non-Resolvable)
        Connection interval: 45.00 msec (0x0024)
        Connection latency: 0 (0x0000)
        Supervision timeout: 420 msec (0x002a)
        Central clock accuracy: 0x00
@ MGMT Event: Device Connected (0x000b) plen 26       {0x0001} [hci0] 23.852709
        LE Address: C0:DE:54:15:00:51 (Static)
        Flags: 0x00000008
          Connection Locally Initiated
        Data length: 13
        Flags: 0x06
          LE General Discoverable Mode
          BR/EDR Not Supported
        Name (complete): X54-PAIR
btmon[3064387]: @ RAW Open: btmon (privileged) version 2.22  {0x0003} 23.853932
btmon[3064387]: @ RAW Close: btmon                           {0x0003} 23.853935
> HCI Event: LE Meta Event (0x3e) plen 4                   #44 [hci0] 23.853413
      LE Channel Selection Algorithm (0x14)
        Handle: 2048 Address: C0:DE:54:15:00:51 (Static)
        Algorithm: #2 (0x01)
< HCI Command: LE Read Remote Used.. (0x08|0x0016) plen 2  #45 [hci0] 23.862825
        Handle: 2048 Address: C0:DE:54:15:00:51 (Static)
> HCI Event: Command Status (0x0f) plen 4                  #46 [hci0] 23.863415
      LE Read Remote Used Features (0x08|0x0016) ncmd 1
        Status: Success (0x00)
> HCI Event: LE Meta Event (0x3e) plen 12                  #47 [hci0] 23.933503
      LE Read Remote Used Features (0x04)
        Status: Success (0x00)
        Handle: 2048 Address: C0:DE:54:15:00:51 (Static)
        Features: 0x1f 0x00 0x00 0x00 0x00 0x00 0x00 0x00
          LE Encryption
          Connection Parameter Request Procedure
          Extended Reject Indication
          Peripheral-initiated Features Exchange
          LE Ping
bluetoothd[2915165]: < ACL Data TX: H.. flags 0x00 dlen 7  #48 [hci0] 23.933968
      ATT: Exchange MTU Request (0x02) len 2
        Client RX MTU: 517
> HCI Event: Number of Completed Packets (0x13) plen 5     #49 [hci0] 24.023498
        Num handles: 1
        Handle: 2048 Address: C0:DE:54:15:00:51 (Static)
        Count: 1
        #48: len 7 (0 Kb/s)
        Latency: 89 msec (89-89 msec ~89 msec)
> ACL Data RX: Handle 2048 flags 0x02 dlen 7               #50 [hci0] 24.070853
      ATT: Exchange MTU Response (0x03) len 2
        Server RX MTU: 23
bluetoothd[2915165]: < ACL Data TX:... flags 0x00 dlen 11  #51 [hci0] 24.071233
      ATT: Read By Type Request (0x08) len 6
        Handle range: 0x0001-0xffff
        Attribute type: Server Supported Features (0x2b3a)
> HCI Event: Number of Completed Packets (0x13) plen 5     #52 [hci0] 24.113539
        Num handles: 1
        Handle: 2048 Address: C0:DE:54:15:00:51 (Static)
        Count: 1
        #51: len 11 (2 Kb/s)
        Latency: 42 msec (42-89 msec ~65 msec)
> ACL Data RX: Handle 2048 flags 0x02 dlen 9               #53 [hci0] 24.159803
      ATT: Error Response (0x01) len 4
        Read By Type Request (0x08)
        Handle: 0x0001
        Error: Attribute Not Found (0x0a)
bluetoothd[2915165]: < ACL Data TX:... flags 0x00 dlen 11  #54 [hci0] 24.160128
      ATT: Read By Group Type Request (0x10) len 6
        Handle range: 0x0001-0xffff
        Attribute group type: Primary Service (0x2800)
> HCI Event: Number of Completed Packets (0x13) plen 5     #55 [hci0] 24.203527
        Num handles: 1
        Handle: 2048 Address: C0:DE:54:15:00:51 (Static)
        Count: 1
        #54: len 11 (2 Kb/s)
        Latency: 43 msec (42-89 msec ~54 msec)
> ACL Data RX: Handle 2048 flags 0x02 dlen 24              #56 [hci0] 24.250918
      ATT: Read By Group Type Response (0x11) len 19
        Attribute data length: 6
        Attribute group list: 3 entries
        Handle range: 0x0001-0x0007
        UUID: Generic Access Profile (0x1800)
        Handle range: 0x0008-0x000b
        UUID: Generic Attribute Profile (0x1801)
        Handle range: 0x0010-0x0013
        UUID: Battery Service (0x180f)
bluetoothd[2915165]: < ACL Data TX:... flags 0x00 dlen 11  #57 [hci0] 24.251348
      ATT: Read By Group Type Request (0x10) len 6
        Handle range: 0x0014-0xffff
        Attribute group type: Primary Service (0x2800)
> HCI Event: Number of Completed Packets (0x13) plen 5     #58 [hci0] 24.293539
        Num handles: 1
        Handle: 2048 Address: C0:DE:54:15:00:51 (Static)
        Count: 1
        #57: len 11 (2 Kb/s)
        Latency: 42 msec (42-89 msec ~48 msec)
> ACL Data RX: Handle 2048 flags 0x02 dlen 9               #59 [hci0] 24.384754
      ATT: Error Response (0x01) len 4
        Read By Group Type Request (0x10)
        Handle: 0x0014
        Error: Attribute Not Found (0x0a)
bluetoothd[2915165]: < ACL Data TX:... flags 0x00 dlen 11  #60 [hci0] 24.385269
      ATT: Read By Group Type Request (0x10) len 6
        Handle range: 0x0001-0xffff
        Attribute group type: Secondary Service (0x2801)
> HCI Event: Number of Completed Packets (0x13) plen 5     #61 [hci0] 24.428533
        Num handles: 1
        Handle: 2048 Address: C0:DE:54:15:00:51 (Static)
        Count: 1
        #60: len 11 (2 Kb/s)
        Latency: 43 msec (42-89 msec ~45 msec)
> ACL Data RX: Handle 2048 flags 0x02 dlen 9               #62 [hci0] 24.474805
      ATT: Error Response (0x01) len 4
        Read By Group Type Request (0x10)
        Handle: 0x0001
        Error: Unsupported Group Type (0x10)
bluetoothd[2915165]: < ACL Data TX:... flags 0x00 dlen 11  #63 [hci0] 24.475209
      ATT: Read By Type Request (0x08) len 6
        Handle range: 0x0001-0x0013
        Attribute type: Include (0x2802)
> HCI Event: Number of Completed Packets (0x13) plen 5     #64 [hci0] 24.518522
        Num handles: 1
        Handle: 2048 Address: C0:DE:54:15:00:51 (Static)
        Count: 1
        #63: len 11 (2 Kb/s)
        Latency: 43 msec (42-89 msec ~44 msec)
> ACL Data RX: Handle 2048 flags 0x02 dlen 9               #65 [hci0] 24.564889
      ATT: Error Response (0x01) len 4
        Read By Type Request (0x08)
        Handle: 0x0001
        Error: Attribute Not Found (0x0a)
bluetoothd[2915165]: < ACL Data TX:... flags 0x00 dlen 11  #66 [hci0] 24.565228
      ATT: Read By Type Request (0x08) len 6
        Handle range: 0x0001-0x0013
        Attribute type: Characteristic (0x2803)
> HCI Event: Number of Completed Packets (0x13) plen 5     #67 [hci0] 24.608524
        Num handles: 1
        Handle: 2048 Address: C0:DE:54:15:00:51 (Static)
        Count: 1
        #66: len 11 (2 Kb/s)
        Latency: 43 msec (42-89 msec ~43 msec)
> ACL Data RX: Handle 2048 flags 0x02 dlen 27              #68 [hci0] 24.655094
      ATT: Read By Type Response (0x09) len 22
        Attribute data length: 7
        Attribute data list: 3 entries
        Handle: 0x0002
        Value: 020300002a
            Properties: 0x02
              Read (0x02)
            Value Handle: 0x0003
            Value UUID: Device Name (0x2a00)
        Handle: 0x0004
        Value: 020500012a
            Properties: 0x02
              Read (0x02)
            Value Handle: 0x0005
            Value UUID: Appearance (0x2a01)
        Handle: 0x0006
        Value: 020700042a
            Properties: 0x02
              Read (0x02)
            Value Handle: 0x0007
            Value UUID: Peripheral Preferred Connection Parameters (0x2a04)
bluetoothd[2915165]: < ACL Data TX:... flags 0x00 dlen 11  #69 [hci0] 24.655576
      ATT: Read By Type Request (0x08) len 6
        Handle range: 0x0007-0x0013
        Attribute type: Characteristic (0x2803)
> HCI Event: Number of Completed Packets (0x13) plen 5     #70 [hci0] 24.698541
        Num handles: 1
        Handle: 2048 Address: C0:DE:54:15:00:51 (Static)
        Count: 1
        #69: len 11 (2 Kb/s)
        Latency: 42 msec (42-89 msec ~43 msec)
> ACL Data RX: Handle 2048 flags 0x02 dlen 20              #71 [hci0] 24.744818
      ATT: Read By Type Response (0x09) len 15
        Attribute data length: 7
        Attribute data list: 2 entries
        Handle: 0x0009
        Value: 200a00052a
            Properties: 0x20
              Indicate (0x20)
            Value Handle: 0x000a
            Value UUID: Service Changed (0x2a05)
        Handle: 0x0011
        Value: 121200192a
            Properties: 0x12
              Read (0x02)
              Notify (0x10)
            Value Handle: 0x0012
            Value UUID: Battery Level (0x2a19)
bluetoothd[2915165]: < ACL Data TX:... flags 0x00 dlen 11  #72 [hci0] 24.745244
      ATT: Read By Type Request (0x08) len 6
        Handle range: 0x0012-0x0013
        Attribute type: Characteristic (0x2803)
> HCI Event: Number of Completed Packets (0x13) plen 5     #73 [hci0] 24.788534
        Num handles: 1
        Handle: 2048 Address: C0:DE:54:15:00:51 (Static)
        Count: 1
        #72: len 11 (2 Kb/s)
        Latency: 43 msec (42-89 msec ~43 msec)
> ACL Data RX: Handle 2048 flags 0x02 dlen 9               #74 [hci0] 24.835788
      ATT: Error Response (0x01) len 4
        Read By Type Request (0x08)
        Handle: 0x0012
        Error: Attribute Not Found (0x0a)
bluetoothd[2915165]: < ACL Data TX: H.. flags 0x00 dlen 9  #75 [hci0] 24.843673
      ATT: Write Request (0x12) len 4
        Handle: 0x000b Type: Client Characteristic Configuration (0x2902)
        Value Handle: 0x000a Type: Service Changed (0x2a05)
          Data: 0200
            Indication (0x02)
> HCI Event: Number of Completed Packets (0x13) plen 5     #76 [hci0] 24.878542
        Num handles: 1
        Handle: 2048 Address: C0:DE:54:15:00:51 (Static)
        Count: 1
        #75: len 9 (2 Kb/s)
        Latency: 34 msec (34-89 msec ~39 msec)
> ACL Data RX: Handle 2048 flags 0x02 dlen 5               #77 [hci0] 24.926723
      ATT: Write Response (0x13) len 0
bluetoothd[2915165]: < ACL Data TX: H.. flags 0x00 dlen 7  #78 [hci0] 24.927127
      ATT: Read Request (0x0a) len 2
        Handle: 0x0003 Type: Device Name (0x2a00)
> HCI Event: Number of Completed Packets (0x13) plen 5     #79 [hci0] 25.013448
        Num handles: 1
        Handle: 2048 Address: C0:DE:54:15:00:51 (Static)
        Count: 1
        #78: len 7 (0 Kb/s)
        Latency: 86 msec (34-89 msec ~62 msec)
> ACL Data RX: Handle 2048 flags 0x02 dlen 11              #80 [hci0] 25.016726
      ATT: Handle Value Indication (0x1d) len 6
        Handle: 0x000a Type: Service Changed (0x2a05)
          Data: 0100ffff
bluetoothd[2915165]: < ACL Data TX: H.. flags 0x00 dlen 5  #81 [hci0] 25.017092
      ATT: Handle Value Confirmation (0x1e) len 0
> HCI Event: Number of Completed Packets (0x13) plen 5     #82 [hci0] 25.058533
        Num handles: 1
        Handle: 2048 Address: C0:DE:54:15:00:51 (Static)
        Count: 1
        #81: len 5 (0 Kb/s)
        Latency: 41 msec (34-89 msec ~52 msec)
> ACL Data RX: Handle 2048 flags 0x02 dlen 22              #83 [hci0] 25.060730
      ATT: Read Response (0x0b) len 17
bluetoothd[2915165]: < ACL Data TX: H.. flags 0x00 dlen 7  #84 [hci0] 25.061185
      ATT: Read Request (0x0a) len 2
        Handle: 0x0005 Type: Appearance (0x2a01)
> HCI Event: Number of Completed Packets (0x13) plen 5     #85 [hci0] 25.103457
        Num handles: 1
        Handle: 2048 Address: C0:DE:54:15:00:51 (Static)
        Count: 1
        #84: len 7 (1 Kb/s)
        Latency: 42 msec (34-89 msec ~47 msec)
> ACL Data RX: Handle 2048 flags 0x02 dlen 7               #86 [hci0] 25.149729
      ATT: Read Response (0x0b) len 2
bluetoothd[2915165]: < ACL Data TX: H.. flags 0x00 dlen 7  #87 [hci0] 25.150148
      ATT: Read Request (0x0a) len 2
        Handle: 0x0012 Type: Battery Level (0x2a19)
> HCI Event: Number of Completed Packets (0x13) plen 5     #88 [hci0] 25.193568
        Num handles: 1
        Handle: 2048 Address: C0:DE:54:15:00:51 (Static)
        Count: 1
        #87: len 7 (1 Kb/s)
        Latency: 43 msec (34-89 msec ~45 msec)
> ACL Data RX: Handle 2048 flags 0x02 dlen 6               #89 [hci0] 25.239801
      ATT: Read Response (0x0b) len 1
bluetoothd[2915165]: < ACL Data TX:... flags 0x00 dlen 11  #90 [hci0] 25.240185
      ATT: Read By Group Type Request (0x10) len 6
        Handle range: 0x0001-0xffff
        Attribute group type: Primary Service (0x2800)
> HCI Event: Number of Completed Packets (0x13) plen 5     #91 [hci0] 25.283537
        Num handles: 1
        Handle: 2048 Address: C0:DE:54:15:00:51 (Static)
        Count: 1
        #90: len 11 (2 Kb/s)
        Latency: 43 msec (34-89 msec ~44 msec)
> ACL Data RX: Handle 2048 flags 0x02 dlen 24              #92 [hci0] 25.329802
      ATT: Read By Group Type Response (0x11) len 19
        Attribute data length: 6
        Attribute group list: 3 entries
        Handle range: 0x0001-0x0007
        UUID: Generic Access Profile (0x1800)
        Handle range: 0x0008-0x000b
        UUID: Generic Attribute Profile (0x1801)
        Handle range: 0x0010-0x0013
        UUID: Battery Service (0x180f)
bluetoothd[2915165]: < ACL Data TX: H.. flags 0x00 dlen 9  #93 [hci0] 25.330177
      ATT: Write Request (0x12) len 4
        Handle: 0x0013 Type: Client Characteristic Configuration (0x2902)
        Value Handle: 0x0012 Type: Battery Level (0x2a19)
          Data: 0100
            Notification (0x01)
> HCI Event: Number of Completed Packets (0x13) plen 5     #94 [hci0] 25.373539
        Num handles: 1
        Handle: 2048 Address: C0:DE:54:15:00:51 (Static)
        Count: 1
        #93: len 9 (1 Kb/s)
        Latency: 43 msec (34-89 msec ~43 msec)
> ACL Data RX: Handle 2048 flags 0x02 dlen 5               #95 [hci0] 25.420832
      ATT: Write Response (0x13) len 0
bluetoothd[2915165]: < ACL Data TX:... flags 0x00 dlen 11  #96 [hci0] 25.421267
      ATT: Read By Group Type Request (0x10) len 6
        Handle range: 0x0014-0xffff
        Attribute group type: Primary Service (0x2800)
> HCI Event: Number of Completed Packets (0x13) plen 5     #97 [hci0] 25.463536
        Num handles: 1
        Handle: 2048 Address: C0:DE:54:15:00:51 (Static)
        Count: 1
        #96: len 11 (2 Kb/s)
        Latency: 42 msec (34-89 msec ~43 msec)
> ACL Data RX: Handle 2048 flags 0x02 dlen 8               #98 [hci0] 25.465014
      ATT: Handle Value Notification (0x1b) len 3
        Handle: 0x0012 Type: Battery Level (0x2a19)
          Data: 60
> ACL Data RX: Handle 2048 flags 0x02 dlen 9               #99 [hci0] 25.509819
      ATT: Error Response (0x01) len 4
        Read By Group Type Request (0x10)
        Handle: 0x0014
        Error: Attribute Not Found (0x0a)
> HCI Event: Inquiry Complete (0x01) plen 1               #100 [hci0] 29.983677
        Status: Success (0x00)
@ MGMT Event: Discovering (0x0013) plen 2             {0x0001} [hci0] 29.983919
        Address type: 0x01
          BR/EDR
        Discovery: Disabled (0x00)
bluetoothd[2915165]: @ MGMT Comman.. (0x003a) plen 4  {0x0001} [hci0] 29.984079
        Address type: 0x01
          BR/EDR
        RSSI: invalid (0x7f)
        UUIDs: 0
< HCI Command: Inquiry (0x01|0x0001) plen 5               #101 [hci0] 29.984307
        Access code: 0x9e8b33 (General Inquiry)
        Length: 10.24s (0x08)
        Num responses: 0
> HCI Event: Command Status (0x0f) plen 4                 #102 [hci0] 29.985605
      Inquiry (0x01|0x0001) ncmd 1
        Status: Success (0x00)
@ MGMT Event: Command Complete (0x0001) plen 4        {0x0001} [hci0] 29.985920
      Start Service Discovery (0x003a) plen 1
        Status: Success (0x00)
        Address type: 0x01
          BR/EDR
@ MGMT Event: Discovering (0x0013) plen 2             {0x0001} [hci0] 29.985927
        Address type: 0x01
          BR/EDR
        Discovery: Enabled (0x01)
bluetoothctl[3066080]: @ MGMT Close: bluetoothctl            {0x0002} 39.649051
bluetoothctl[3068113]: @ MGMT Open: bluetoot.. version 1.23  {0x0002} 39.662374
bluetoothd[2915165]: @ MGMT Comman.. (0x0024) plen 1  {0x0001} [hci0] 39.667335
        Address type: 0x01
          BR/EDR
< HCI Command: Inquiry Cancel (0x01|0x0002) plen 0        #103 [hci0] 39.667552
> HCI Event: Command Complete (0x0e) plen 4               #104 [hci0] 39.668862
      Inquiry Cancel (0x01|0x0002) ncmd 1
        Status: Success (0x00)
@ MGMT Event: Discovering (0x0013) plen 2             {0x0001} [hci0] 39.669036
        Address type: 0x01
          BR/EDR
        Discovery: Disabled (0x00)
@ MGMT Event: Command Complete (0x0001) plen 4        {0x0001} [hci0] 39.669145
      Stop Discovery (0x0024) plen 1
        Status: Success (0x00)
        Address type: 0x01
          BR/EDR
bluetoothd[2915165]: @ MGMT Comman.. (0x0019) plen 8  {0x0001} [hci0] 39.669172
        LE Address: C0:DE:54:15:00:51 (Static)
        Capability: DisplayYesNo (0x01)
< ACL Data TX: Handle 2048 flags 0x00 dlen 11             #105 [hci0] 39.669198
      SMP: Pairing Request (0x01) len 6
        IO capability: DisplayYesNo (0x01)
        OOB data: Authentication data not present (0x00)
        Authentication requirement: Bonding, MITM, SC, No Keypresses, CT2 (0x2d)
        Max encryption key size: 16
        Initiator key distribution: EncKey Sign LinkKey (0x0d)
        Responder key distribution: EncKey IdKey Sign LinkKey (0x0f)
> HCI Event: Number of Completed Packets (0x13) plen 5    #106 [hci0] 39.683968
        Num handles: 1
        Handle: 2048 Address: C0:DE:54:15:00:51 (Static)
        Count: 1
        #105: len 11 (6 Kb/s)
        Latency: 14 msec (14-89 msec ~28 msec)
> ACL Data RX: Handle 2048 flags 0x02 dlen 11             #107 [hci0] 39.774863
      SMP: Pairing Response (0x02) len 6
        IO capability: NoInputNoOutput (0x03)
        OOB data: Authentication data not present (0x00)
        Authentication requirement: Bonding, No MITM, Legacy, No Keypresses (0x01)
        Max encryption key size: 16
        Initiator key distribution: EncKey (0x01)
        Responder key distribution: <none> (0x00)
@ MGMT Event: User Confirmation R.. (0x000f) plen 12  {0x0001} [hci0] 39.774974
        LE Address: C0:DE:54:15:00:51 (Static)
        Confirm hint: 0x01
        Value: 0x00000000
bluetoothd[2915165]: @ MGMT Comman.. (0x001c) plen 7  {0x0001} [hci0] 39.775046
        LE Address: C0:DE:54:15:00:51 (Static)
@ MGMT Event: Command Complete (0x0001) plen 10       {0x0001} [hci0] 39.775056
      User Confirmation Reply (0x001c) plen 7
        Status: Success (0x00)
        LE Address: C0:DE:54:15:00:51 (Static)
< ACL Data TX: Handle 2048 flags 0x00 dlen 21             #108 [hci0] 39.775177
      SMP: Pairing Confirm (0x03) len 16
        Confim value: c7d646c2bda750d67db81512cfab869e
> HCI Event: Number of Completed Packets (0x13) plen 5    #109 [hci0] 39.818970
        Num handles: 1
        Handle: 2048 Address: C0:DE:54:15:00:51 (Static)
        Count: 1
        #108: len 21 (3 Kb/s)
        Latency: 43 msec (14-89 msec ~36 msec)
> ACL Data RX: Handle 2048 flags 0x02 dlen 21             #110 [hci0] 39.864826
      SMP: Pairing Confirm (0x03) len 16
        Confim value: c04902461f22b102b6d6d7ac4d6257a0
< ACL Data TX: Handle 2048 flags 0x00 dlen 21             #111 [hci0] 39.865062
      SMP: Pairing Random (0x04) len 16
        Random value: a7035d5fdf511e8b616ca8100480d1b5
> HCI Event: Number of Completed Packets (0x13) plen 5    #112 [hci0] 39.908975
        Num handles: 1
        Handle: 2048 Address: C0:DE:54:15:00:51 (Static)
        Count: 1
        #111: len 21 (3 Kb/s)
        Latency: 43 msec (14-89 msec ~40 msec)
> ACL Data RX: Handle 2048 flags 0x02 dlen 21             #113 [hci0] 39.955148
      SMP: Pairing Random (0x04) len 16
        Random value: f9dcca6987d55add88e95ff1c94d61c1
< HCI Command: LE Start Encryption (0x08|0x0019) plen 28  #114 [hci0] 39.955267
        Handle: 2048 Address: C0:DE:54:15:00:51 (Static)
        Random number: 0x0000000000000000
        Encrypted diversifier: 0x0000
        Long term key: 6a2d6d3466a9e83174e6bf421fc4b74e
> HCI Event: Command Status (0x0f) plen 4                 #115 [hci0] 39.956915
      LE Start Encryption (0x08|0x0019) ncmd 1
        Status: Success (0x00)
< HCI Command: Disconnect (0x01|0x0006) plen 3            #116 [hci0] 70.076094
        Handle: 2048 Address: C0:DE:54:15:00:51 (Static)
        Reason: Authentication Failure (0x05)
> HCI Event: Command Status (0x0f) plen 4                 #117 [hci0] 70.077701
      Disconnect (0x01|0x0006) ncmd 1
        Status: Success (0x00)
> HCI Event: Encryption Change (0x08) plen 4              #118 [hci0] 70.103822
        Status: Connection Terminated By Local Host (0x16)
        Handle: 2048 Address: C0:DE:54:15:00:51 (Static)
        Encryption: Disabled (0x00)
@ MGMT Event: Command Complete (0x0001) plen 10       {0x0001} [hci0] 70.103997
      Pair Device (0x0019) plen 7
        Status: Disconnected (0x0e)
        LE Address: C0:DE:54:15:00:51 (Static)
> HCI Event: Disconnect Complete (0x05) plen 4            #119 [hci0] 70.104699
        Status: Success (0x00)
        Handle: 2048 Address: C0:DE:54:15:00:51 (Static)
        Reason: Connection Terminated By Local Host (0x16)
@ MGMT Event: Device Disconnected (0x000c) plen 8     {0x0001} [hci0] 70.104789
        LE Address: C0:DE:54:15:00:51 (Static)
        Reason: Connection terminated by local host (0x02)
bluetoothd[2915165]: @ MGMT Comman.. (0x003a) plen 4  {0x0001} [hci0] 75.722314
        Address type: 0x01
          BR/EDR
        RSSI: invalid (0x7f)
        UUIDs: 0
< HCI Command: Inquiry (0x01|0x0001) plen 5               #120 [hci0] 75.722518
        Access code: 0x9e8b33 (General Inquiry)
        Length: 10.24s (0x08)
        Num responses: 0
> HCI Event: Command Status (0x0f) plen 4                 #121 [hci0] 75.816859
      Inquiry (0x01|0x0001) ncmd 1
        Status: Success (0x00)
@ MGMT Event: Command Complete (0x0001) plen 4        {0x0001} [hci0] 75.817110
      Start Service Discovery (0x003a) plen 1
        Status: Success (0x00)
        Address type: 0x01
          BR/EDR
@ MGMT Event: Discovering (0x0013) plen 2             {0x0001} [hci0] 75.817117
        Address type: 0x01
          BR/EDR
        Discovery: Enabled (0x01)
> HCI Event: Inquiry Complete (0x01) plen 1               #122 [hci0] 86.123161
        Status: Success (0x00)
@ MGMT Event: Discovering (0x0013) plen 2             {0x0001} [hci0] 86.123187
        Address type: 0x01
          BR/EDR
        Discovery: Disabled (0x00)
bluetoothd[2915165]: @ MGMT Comman.. (0x003a) plen 4  {0x0001} [hci0] 86.123286
        Address type: 0x01
          BR/EDR
        RSSI: invalid (0x7f)
        UUIDs: 0
< HCI Command: Inquiry (0x01|0x0001) plen 5               #123 [hci0] 86.123341
        Access code: 0x9e8b33 (General Inquiry)
        Length: 10.24s (0x08)
        Num responses: 0
> HCI Event: Command Status (0x0f) plen 4                 #124 [hci0] 86.124141
      Inquiry (0x01|0x0001) ncmd 1
        Status: Success (0x00)
@ MGMT Event: Command Complete (0x0001) plen 4        {0x0001} [hci0] 86.124232
      Start Service Discovery (0x003a) plen 1
        Status: Success (0x00)
        Address type: 0x01
          BR/EDR
@ MGMT Event: Discovering (0x0013) plen 2             {0x0001} [hci0] 86.124238
        Address type: 0x01
          BR/EDR
        Discovery: Enabled (0x01)
> HCI Event: Inquiry Complete (0x01) plen 1               #125 [hci0] 96.429436
        Status: Success (0x00)
@ MGMT Event: Discovering (0x0013) plen 2             {0x0001} [hci0] 96.429533
        Address type: 0x01
          BR/EDR
        Discovery: Disabled (0x00)
bluetoothd[2915165]: @ MGMT Comman.. (0x003a) plen 4  {0x0001} [hci0] 96.429605
        Address type: 0x01
          BR/EDR
        RSSI: invalid (0x7f)
        UUIDs: 0
< HCI Command: Inquiry (0x01|0x0001) plen 5               #126 [hci0] 96.429681
        Access code: 0x9e8b33 (General Inquiry)
        Length: 10.24s (0x08)
        Num responses: 0
> HCI Event: Command Status (0x0f) plen 4                 #127 [hci0] 96.430422
      Inquiry (0x01|0x0001) ncmd 1
        Status: Success (0x00)
@ MGMT Event: Command Complete (0x0001) plen 4        {0x0001} [hci0] 96.430612
      Start Service Discovery (0x003a) plen 1
        Status: Success (0x00)
        Address type: 0x01
          BR/EDR
@ MGMT Event: Discovering (0x0013) plen 2             {0x0001} [hci0] 96.430615
        Address type: 0x01
          BR/EDR
        Discovery: Enabled (0x01)
> HCI Event: Inquiry Complete (0x01) plen 1              #128 [hci0] 106.734738
        Status: Success (0x00)
@ MGMT Event: Discovering (0x0013) plen 2            {0x0001} [hci0] 106.734881
        Address type: 0x01
          BR/EDR
        Discovery: Disabled (0x00)
bluetoothd[2915165]: @ MGMT Comma.. (0x003a) plen 4  {0x0001} [hci0] 106.735165
        Address type: 0x01
          BR/EDR
        RSSI: invalid (0x7f)
        UUIDs: 0
< HCI Command: Inquiry (0x01|0x0001) plen 5              #129 [hci0] 106.735326
        Access code: 0x9e8b33 (General Inquiry)
        Length: 10.24s (0x08)
        Num responses: 0
> HCI Event: Command Status (0x0f) plen 4                #130 [hci0] 106.736822
      Inquiry (0x01|0x0001) ncmd 1
        Status: Success (0x00)
@ MGMT Event: Command Complete (0x0001) plen 4       {0x0001} [hci0] 106.737101
      Start Service Discovery (0x003a) plen 1
        Status: Success (0x00)
        Address type: 0x01
          BR/EDR
@ MGMT Event: Discovering (0x0013) plen 2            {0x0001} [hci0] 106.737111
        Address type: 0x01
          BR/EDR
        Discovery: Enabled (0x01)
