Bluetooth monitor ver 5.72
btmon[2926585]: = Note: Linux version 6.17.0-14-generic (x86_64)       0.865796
btmon[2926585]: = Note: Bluetooth subsystem version 2.22               0.865798
= New Index: 68:34:21:E5:84:DF (Primary,USB,hci0)               [hci0] 0.865799
= Open Index: 68:34:21:E5:84:DF                                 [hci0] 0.865799
= Index Info: 68:34:21:E5:84:DF (Intel Corp.)                   [hci0] 0.865799
bluetoothd[2915165]: @ MGMT Open.. (privileged) version 1.23  {0x0001} 0.865800
bluetoothctl[2926743]: @ MGMT Op.. (privileged) version 1.23  {0x0002} 2.870218
bluetoothctl[2926743]: @ MGMT Close: bluetoothctl             {0x0002} 2.885246
bluetoothctl[2926746]: @ MGMT Op.. (privileged) version 1.23  {0x0002} 2.895682
bluetoothd[2915165]: @ MGMT Command.. (0x0024) plen 1  {0x0001} [hci0] 2.898154
        Address type: 0x01
          BR/EDR
< HCI Command: Inquiry Cancel (0x01|0x0002) plen 0           #1 [hci0] 2.898245
> HCI Event: Command Complete (0x0e) plen 4                  #2 [hci0] 2.992752
      Inquiry Cancel (0x01|0x0002) ncmd 1
        Status: Success (0x00)
@ MGMT Event: Discovering (0x0013) plen 2              {0x0002} [hci0] 2.992766
        Address type: 0x01
          BR/EDR
        Discovery: Disabled (0x00)
@ MGMT Event: Discovering (0x0013) plen 2              {0x0001} [hci0] 2.992766
        Address type: 0x01
          BR/EDR
        Discovery: Disabled (0x00)
@ MGMT Event: Command Complete (0x0001) plen 4         {0x0001} [hci0] 2.992877
      Stop Discovery (0x0024) plen 1
        Status: Success (0x00)
        Address type: 0x01
          BR/EDR
bluetoothd[2915165]: @ MGMT Command.. (0x003a) plen 4  {0x0001} [hci0] 2.993041
        Address type: 0x07
          BR/EDR
          LE Public
          LE Random
        RSSI: invalid (0x7f)
        UUIDs: 0
< HCI Command: LE Set Address Resolu.. (0x08|0x002d) plen 1  #3 [hci0] 2.993118
        Address resolution: Disabled (0x00)
> HCI Event: Command Complete (0x0e) plen 4                  #4 [hci0] 2.993674
      LE Set Address Resolution Enable (0x08|0x002d) ncmd 1
        Status: Success (0x00)
< HCI Command: LE Set Random Address (0x08|0x0005) plen 6    #5 [hci0] 2.993803
        Address: 0F:D6:0C:35:2E:E4 (Non-Resolvable)
> HCI Event: Command Complete (0x0e) plen 4                  #6 [hci0] 2.994675
      LE Set Random Address (0x08|0x0005) ncmd 1
        Status: Success (0x00)
< HCI Command: LE Set Extended Scan.. (0x08|0x0041) plen 13  #7 [hci0] 2.994795
        Own address type: Random (0x01)
        Filter policy: Accept all advertisement (0x00)
        PHYs: 0x05
        Entry 0: LE 1M
          Type: Active (0x01)
          Interval: 22.500 msec (0x0024)
          Window: 11.250 msec (0x0012)
        Entry 1: LE Coded
          Type: Active (0x01)
          Interval: 67.500 msec (0x006c)
          Window: 33.750 msec (0x0036)
> HCI Event: Command Complete (0x0e) plen 4                  #8 [hci0] 2.995674
      LE Set Extended Scan Parameters (0x08|0x0041) ncmd 1
        Status: Success (0x00)
< HCI Command: LE Set Extended Scan... (0x08|0x0042) plen 6  #9 [hci0] 2.995776
        Extended scan: Enabled (0x01)
        Filter duplicates: Disabled (0x00)
        Duration: 0 msec (0x0000)
        Period: 0.00 sec (0x0000)
> HCI Event: Command Complete (0x0e) plen 4                 #10 [hci0] 2.996675
      LE Set Extended Scan Enable (0x08|0x0042) ncmd 1
        Status: Success (0x00)
@ MGMT Event: Discovering (0x0013) plen 2              {0x0002} [hci0] 2.996683
        Address type: 0x07
          BR/EDR
          LE Public
          LE Random
        Discovery: Enabled (0x01)
@ MGMT Event: Discovering (0x0013) plen 2              {0x0001} [hci0] 2.996683
        Address type: 0x07
          BR/EDR
          LE Public
          LE Random
        Discovery: Enabled (0x01)
< HCI Command: Inquiry (0x01|0x0001) plen 5                 #11 [hci0] 2.996855
        Access code: 0x9e8b33 (General Inquiry)
        Length: 10.24s (0x08)
        Num responses: 0
> HCI Event: LE Meta Event (0x3e) plen 57                   #12 [hci0] 3.001796
      LE Extended Advertising Report (0x0d)
        Num reports: 1
        Entry 0
          Event type: 0x0010
            Props: 0x0010
              Use legacy advertising PDUs
            Data status: [0;32mComplete[0m
          Legacy PDU Type: ADV_NONCONN_IND (0x0010)
          Address type: Random (0x01)
          Address: 6F:08:D4:A0:CE:84 (Resolvable)
          Primary PHY: LE 1M
          Secondary PHY: No packets
          SID: no ADI field (0xff)
          TX power: 127 dBm
          RSSI: -88 dBm (0xa8)
          Periodic advertising interval: 0.00 msec (0x0000)
          Direct address type: Public (0x00)
          Direct address: 00:00:00:00:00:00 (OUI 00-00-00)
          Data length: 0x1f
        1e ff 06 00 01 09 20 02 cf 80 78 a0 f4 55 24 5f  ...... ...x..U$_
        5a 26 bc 07 d2 7a 3f 46 5c 8f 81 b2 b8 3c 64     Z&...z?F\....<d 
        Company: Microsoft (6)
          Data: 01092002cf8078a0f455245f5a26bc07d27a3f465c8f81b2b83c64
@ MGMT Event: Device Found (0x0012) plen 45            {0x0002} [hci0] 3.001811
        LE Address: 6F:08:D4:A0:CE:84 (Resolvable)
        RSSI: -88 dBm (0xa8)
        Flags: 0x00000004
          Not Connectable
        Data length: 31
        Company: Microsoft (6)
          Data: 01092002cf8078a0f455245f5a26bc07d27a3f465c8f81b2b83c64
@ MGMT Event: Device Found (0x0012) plen 45            {0x0001} [hci0] 3.001811
        LE Address: 6F:08:D4:A0:CE:84 (Resolvable)
        RSSI: -88 dBm (0xa8)
        Flags: 0x00000004
          Not Connectable
        Data length: 31
        Company: Microsoft (6)
          Data: 01092002cf8078a0f455245f5a26bc07d27a3f465c8f81b2b83c64
> HCI Event: Command Status (0x0f) plen 4                   #13 [hci0] 3.002675
      Inquiry (0x01|0x0001) ncmd 1
        Status: Success (0x00)
@ MGMT Event: Command Complete (0x0001) plen 4         {0x0001} [hci0] 3.002796
      Start Service Discovery (0x003a) plen 1
        Status: Success (0x00)
        Address type: 0x07
          BR/EDR
          LE Public
          LE Random
> HCI Event: LE Meta Event (0x3e) plen 57                   #14 [hci0] 3.637803
      LE Extended Advertising Report (0x0d)
        Num reports: 1
        Entry 0
          Event type: 0x0010
            Props: 0x0010
              Use legacy advertising PDUs
            Data status: [0;32mComplete[0m
          Legacy PDU Type: ADV_NONCONN_IND (0x0010)
          Address type: Random (0x01)
          Address: 6F:08:D4:A0:CE:84 (Resolvable)
          Primary PHY: LE 1M
          Secondary PHY: No packets
          SID: no ADI field (0xff)
          TX power: 127 dBm
          RSSI: -91 dBm (0xa5)
          Periodic advertising interval: 0.00 msec (0x0000)
          Direct address type: Public (0x00)
          Direct address: 00:00:00:00:00:00 (OUI 00-00-00)
          Data length: 0x1f
        1e ff 06 00 01 09 20 02 cf 80 78 a0 f4 55 24 5f  ...... ...x..U$_
        5a 26 bc 07 d2 7a 3f 46 5c 8f 81 b2 b8 3c 64     Z&...z?F\....<d 
        Company: Microsoft (6)
          Data: 01092002cf8078a0f455245f5a26bc07d27a3f465c8f81b2b83c64
@ MGMT Event: Device Found (0x0012) plen 45            {0x0002} [hci0] 3.637924
        LE Address: 6F:08:D4:A0:CE:84 (Resolvable)
        RSSI: -91 dBm (0xa5)
        Flags: 0x00000004
          Not Connectable
        Data length: 31
        Company: Microsoft (6)
          Data: 01092002cf8078a0f455245f5a26bc07d27a3f465c8f81b2b83c64
@ MGMT Event: Device Found (0x0012) plen 45            {0x0001} [hci0] 3.637924
        LE Address: 6F:08:D4:A0:CE:84 (Resolvable)
        RSSI: -91 dBm (0xa5)
        Flags: 0x00000004
          Not Connectable
        Data length: 31
        Company: Microsoft (6)
          Data: 01092002cf8078a0f455245f5a26bc07d27a3f465c8f81b2b83c64
> HCI Event: LE Meta Event (0x3e) plen 57                   #15 [hci0] 5.609834
      LE Extended Advertising Report (0x0d)
        Num reports: 1
        Entry 0
          Event type: 0x0010
            Props: 0x0010
              Use legacy advertising PDUs
            Data status: [0;32mComplete[0m
          Legacy PDU Type: ADV_NONCONN_IND (0x0010)
          Address type: Random (0x01)
          Address: 6F:08:D4:A0:CE:84 (Resolvable)
          Primary PHY: LE 1M
          Secondary PHY: No packets
          SID: no ADI field (0xff)
          TX power: 127 dBm
          RSSI: -91 dBm (0xa5)
          Periodic advertising interval: 0.00 msec (0x0000)
          Direct address type: Public (0x00)
          Direct address: 00:00:00:00:00:00 (OUI 00-00-00)
          Data length: 0x1f
        1e ff 06 00 01 09 20 02 cf 80 78 a0 f4 55 24 5f  ...... ...x..U$_
        5a 26 bc 07 d2 7a 3f 46 5c 8f 81 b2 b8 3c 64     Z&...z?F\....<d 
        Company: Microsoft (6)
          Data: 01092002cf8078a0f455245f5a26bc07d27a3f465c8f81b2b83c64
@ MGMT Event: Device Found (0x0012) plen 45            {0x0002} [hci0] 5.609944
        LE Address: 6F:08:D4:A0:CE:84 (Resolvable)
        RSSI: -91 dBm (0xa5)
        Flags: 0x00000004
          Not Connectable
        Data length: 31
        Company: Microsoft (6)
          Data: 01092002cf8078a0f455245f5a26bc07d27a3f465c8f81b2b83c64
@ MGMT Event: Device Found (0x0012) plen 45            {0x0001} [hci0] 5.609944
        LE Address: 6F:08:D4:A0:CE:84 (Resolvable)
        RSSI: -91 dBm (0xa5)
        Flags: 0x00000004
          Not Connectable
        Data length: 31
        Company: Microsoft (6)
          Data: 01092002cf8078a0f455245f5a26bc07d27a3f465c8f81b2b83c64
> HCI Event: LE Meta Event (0x3e) plen 43                   #16 [hci0] 7.047818
      LE Extended Advertising Report (0x0d)
        Num reports: 1
        Entry 0
          Event type: 0x0013
            Props: 0x0013
              Connectable
              Scannable
              Use legacy advertising PDUs
            Data status: [0;32mComplete[0m
          Legacy PDU Type: ADV_IND (0x0013)
          Address type: Random (0x01)
          Address: 73:01:16:B1:70:95 (Resolvable)
          Primary PHY: LE 1M
          Secondary PHY: No packets
          SID: no ADI field (0xff)
          TX power: 127 dBm
          RSSI: -85 dBm (0xab)
          Periodic advertising interval: 0.00 msec (0x0000)
          Direct address type: Public (0x00)
          Direct address: 00:00:00:00:00:00 (OUI 00-00-00)
          Data length: 0x11
        02 01 1a 02 0a 0c 0a ff 4c 00 10 05 34 1c 05 a6  ........L...4...
        69                                               i               
        Flags: 0x1a
          LE General Discoverable Mode
          Simultaneous LE and BR/EDR (Controller)
          Simultaneous LE and BR/EDR (Host)
        TX power: 12 dBm
        Company: Apple, Inc. (76)
          Type: Unknown (16)
          Data: 341c05a669
> HCI Event: LE Meta Event (0x3e) plen 26                   #17 [hci0] 7.048847
      LE Extended Advertising Report (0x0d)
        Num reports: 1
        Entry 0
          Event type: 0x001b
            Props: 0x001b
              Connectable
              Scannable
              Scan response
              Use legacy advertising PDUs
            Data status: [0;32mComplete[0m
          Legacy PDU Type: SCAN_RSP to an ADV_SCAN_IND (0x001b)
          Address type: Random (0x01)
          Address: 73:01:16:B1:70:95 (Resolvable)
          Primary PHY: LE 1M
          Secondary PHY: No packets
          SID: no ADI field (0xff)
          TX power: 127 dBm
          RSSI: -84 dBm (0xac)
          Periodic advertising interval: 0.00 msec (0x0000)
          Direct address type: Public (0x00)
          Direct address: 00:00:00:00:00:00 (OUI 00-00-00)
          Data length: 0x00
@ MGMT Event: Device Found (0x0012) plen 31            {0x0002} [hci0] 7.048999
        LE Address: 73:01:16:B1:70:95 (Resolvable)
        RSSI: -84 dBm (0xac)
        Flags: 0x00000000
        Data length: 17
        Flags: 0x1a
          LE General Discoverable Mode
          Simultaneous LE and BR/EDR (Controller)
          Simultaneous LE and BR/EDR (Host)
        TX power: 12 dBm
        Company: Apple, Inc. (76)
          Type: Unknown (16)
          Data: 341c05a669
@ MGMT Event: Device Found (0x0012) plen 31            {0x0001} [hci0] 7.048999
        LE Address: 73:01:16:B1:70:95 (Resolvable)
        RSSI: -84 dBm (0xac)
        Flags: 0x00000000
        Data length: 17
        Flags: 0x1a
          LE General Discoverable Mode
          Simultaneous LE and BR/EDR (Controller)
          Simultaneous LE and BR/EDR (Host)
        TX power: 12 dBm
        Company: Apple, Inc. (76)
          Type: Unknown (16)
          Data: 341c05a669
> HCI Event: LE Meta Event (0x3e) plen 57                   #18 [hci0] 8.348844
      LE Extended Advertising Report (0x0d)
        Num reports: 1
        Entry 0
          Event type: 0x0010
            Props: 0x0010
              Use legacy advertising PDUs
            Data status: [0;32mComplete[0m
          Legacy PDU Type: ADV_NONCONN_IND (0x0010)
          Address type: Random (0x01)
          Address: 6F:08:D4:A0:CE:84 (Resolvable)
          Primary PHY: LE 1M
          Secondary PHY: No packets
          SID: no ADI field (0xff)
          TX power: 127 dBm
          RSSI: -91 dBm (0xa5)
          Periodic advertising interval: 0.00 msec (0x0000)
          Direct address type: Public (0x00)
          Direct address: 00:00:00:00:00:00 (OUI 00-00-00)
          Data length: 0x1f
        1e ff 06 00 01 09 20 02 cf 80 78 a0 f4 55 24 5f  ...... ...x..U$_
        5a 26 bc 07 d2 7a 3f 46 5c 8f 81 b2 b8 3c 64     Z&...z?F\....<d 
        Company: Microsoft (6)
          Data: 01092002cf8078a0f455245f5a26bc07d27a3f465c8f81b2b83c64
@ MGMT Event: Device Found (0x0012) plen 45            {0x0002} [hci0] 8.348948
        LE Address: 6F:08:D4:A0:CE:84 (Resolvable)
        RSSI: -91 dBm (0xa5)
        Flags: 0x00000004
          Not Connectable
        Data length: 31
        Company: Microsoft (6)
          Data: 01092002cf8078a0f455245f5a26bc07d27a3f465c8f81b2b83c64
@ MGMT Event: Device Found (0x0012) plen 45            {0x0001} [hci0] 8.348948
        LE Address: 6F:08:D4:A0:CE:84 (Resolvable)
        RSSI: -91 dBm (0xa5)
        Flags: 0x00000004
          Not Connectable
        Data length: 31
        Company: Microsoft (6)
          Data: 01092002cf8078a0f455245f5a26bc07d27a3f465c8f81b2b83c64
> HCI Event: LE Meta Event (0x3e) plen 57                   #19 [hci0] 9.622821
      LE Extended Advertising Report (0x0d)
        Num reports: 1
        Entry 0
          Event type: 0x0010
            Props: 0x0010
              Use legacy advertising PDUs
            Data status: [0;32mComplete[0m
          Legacy PDU Type: ADV_NONCONN_IND (0x0010)
          Address type: Random (0x01)
          Address: 6F:08:D4:A0:CE:84 (Resolvable)
          Primary PHY: LE 1M
          Secondary PHY: No packets
          SID: no ADI field (0xff)
          TX power: 127 dBm
          RSSI: -89 dBm (0xa7)
          Periodic advertising interval: 0.00 msec (0x0000)
          Direct address type: Public (0x00)
          Direct address: 00:00:00:00:00:00 (OUI 00-00-00)
          Data length: 0x1f
        1e ff 06 00 01 09 20 02 cf 80 78 a0 f4 55 24 5f  ...... ...x..U$_
        5a 26 bc 07 d2 7a 3f 46 5c 8f 81 b2 b8 3c 64     Z&...z?F\....<d 
        Company: Microsoft (6)
          Data: 01092002cf8078a0f455245f5a26bc07d27a3f465c8f81b2b83c64
@ MGMT Event: Device Found (0x0012) plen 45            {0x0002} [hci0] 9.622970
        LE Address: 6F:08:D4:A0:CE:84 (Resolvable)
        RSSI: -89 dBm (0xa7)
        Flags: 0x00000004
          Not Connectable
        Data length: 31
        Company: Microsoft (6)
          Data: 01092002cf8078a0f455245f5a26bc07d27a3f465c8f81b2b83c64
@ MGMT Event: Device Found (0x0012) plen 45            {0x0001} [hci0] 9.622970
        LE Address: 6F:08:D4:A0:CE:84 (Resolvable)
        RSSI: -89 dBm (0xa7)
        Flags: 0x00000004
          Not Connectable
        Data length: 31
        Company: Microsoft (6)
          Data: 01092002cf8078a0f455245f5a26bc07d27a3f465c8f81b2b83c64
> HCI Event: LE Meta Event (0x3e) plen 39                  #20 [hci0] 11.218844
      LE Extended Advertising Report (0x0d)
        Num reports: 1
        Entry 0
          Event type: 0x0013
            Props: 0x0013
              Connectable
              Scannable
              Use legacy advertising PDUs
            Data status: [0;32mComplete[0m
          Legacy PDU Type: ADV_IND (0x0013)
          Address type: Random (0x01)
          Address: C0:DE:54:15:00:61 (Static)
          Primary PHY: LE 1M
          Secondary PHY: No packets
          SID: no ADI field (0xff)
          TX power: 127 dBm
          RSSI: -80 dBm (0xb0)
          Periodic advertising interval: 0.00 msec (0x0000)
          Direct address type: Public (0x00)
          Direct address: 00:00:00:00:00:00 (OUI 00-00-00)
          Data length: 0x0d
        02 01 06 09 09 58 35 34 2d 42 4f 4e 44           .....X54-BOND   
        Flags: 0x06
          LE General Discoverable Mode
          BR/EDR Not Supported
        Name (complete): X54-BOND
> HCI Event: LE Meta Event (0x3e) plen 57                  #21 [hci0] 11.403853
      LE Extended Advertising Report (0x0d)
        Num reports: 1
        Entry 0
          Event type: 0x0010
            Props: 0x0010
              Use legacy advertising PDUs
            Data status: [0;32mComplete[0m
          Legacy PDU Type: ADV_NONCONN_IND (0x0010)
          Address type: Random (0x01)
          Address: 6F:08:D4:A0:CE:84 (Resolvable)
          Primary PHY: LE 1M
          Secondary PHY: No packets
          SID: no ADI field (0xff)
          TX power: 127 dBm
          RSSI: -91 dBm (0xa5)
          Periodic advertising interval: 0.00 msec (0x0000)
          Direct address type: Public (0x00)
          Direct address: 00:00:00:00:00:00 (OUI 00-00-00)
          Data length: 0x1f
        1e ff 06 00 01 09 20 02 cf 80 78 a0 f4 55 24 5f  ...... ...x..U$_
        5a 26 bc 07 d2 7a 3f 46 5c 8f 81 b2 b8 3c 64     Z&...z?F\....<d 
        Company: Microsoft (6)
          Data: 01092002cf8078a0f455245f5a26bc07d27a3f465c8f81b2b83c64
@ MGMT Event: Device Found (0x0012) plen 27           {0x0002} [hci0] 11.403881
        LE Address: C0:DE:54:15:00:61 (Static)
        RSSI: -80 dBm (0xb0)
        Flags: 0x00000000
        Data length: 13
        Flags: 0x06
          LE General Discoverable Mode
          BR/EDR Not Supported
        Name (complete): X54-BOND
@ MGMT Event: Device Found (0x0012) plen 27           {0x0001} [hci0] 11.403881
        LE Address: C0:DE:54:15:00:61 (Static)
        RSSI: -80 dBm (0xb0)
        Flags: 0x00000000
        Data length: 13
        Flags: 0x06
          LE General Discoverable Mode
          BR/EDR Not Supported
        Name (complete): X54-BOND
@ MGMT Event: Device Found (0x0012) plen 45           {0x0002} [hci0] 11.403890
        LE Address: 6F:08:D4:A0:CE:84 (Resolvable)
        RSSI: -91 dBm (0xa5)
        Flags: 0x00000004
          Not Connectable
        Data length: 31
        Company: Microsoft (6)
          Data: 01092002cf8078a0f455245f5a26bc07d27a3f465c8f81b2b83c64
@ MGMT Event: Device Found (0x0012) plen 45           {0x0001} [hci0] 11.403890
        LE Address: 6F:08:D4:A0:CE:84 (Resolvable)
        RSSI: -91 dBm (0xa5)
        Flags: 0x00000004
          Not Connectable
        Data length: 31
        Company: Microsoft (6)
          Data: 01092002cf8078a0f455245f5a26bc07d27a3f465c8f81b2b83c64
> HCI Event: LE Meta Event (0x3e) plen 57                  #22 [hci0] 12.665871
      LE Extended Advertising Report (0x0d)
        Num reports: 1
        Entry 0
          Event type: 0x0010
            Props: 0x0010
              Use legacy advertising PDUs
            Data status: [0;32mComplete[0m
          Legacy PDU Type: ADV_NONCONN_IND (0x0010)
          Address type: Random (0x01)
          Address: 6F:08:D4:A0:CE:84 (Resolvable)
          Primary PHY: LE 1M
          Secondary PHY: No packets
          SID: no ADI field (0xff)
          TX power: 127 dBm
          RSSI: -90 dBm (0xa6)
          Periodic advertising interval: 0.00 msec (0x0000)
          Direct address type: Public (0x00)
          Direct address: 00:00:00:00:00:00 (OUI 00-00-00)
          Data length: 0x1f
        1e ff 06 00 01 09 20 02 cf 80 78 a0 f4 55 24 5f  ...... ...x..U$_
        5a 26 bc 07 d2 7a 3f 46 5c 8f 81 b2 b8 3c 64     Z&...z?F\....<d 
        Company: Microsoft (6)
          Data: 01092002cf8078a0f455245f5a26bc07d27a3f465c8f81b2b83c64
@ MGMT Event: Device Found (0x0012) plen 45           {0x0002} [hci0] 12.666004
        LE Address: 6F:08:D4:A0:CE:84 (Resolvable)
        RSSI: -90 dBm (0xa6)
        Flags: 0x00000004
          Not Connectable
        Data length: 31
        Company: Microsoft (6)
          Data: 01092002cf8078a0f455245f5a26bc07d27a3f465c8f81b2b83c64
@ MGMT Event: Device Found (0x0012) plen 45           {0x0001} [hci0] 12.666004
        LE Address: 6F:08:D4:A0:CE:84 (Resolvable)
        RSSI: -90 dBm (0xa6)
        Flags: 0x00000004
          Not Connectable
        Data length: 31
        Company: Microsoft (6)
          Data: 01092002cf8078a0f455245f5a26bc07d27a3f465c8f81b2b83c64
bluetoothctl[2926746]: @ MGMT Close: bluetoothctl            {0x0002} 12.898918
bluetoothd[2915165]: @ MGMT Comman.. (0x0024) plen 1  {0x0001} [hci0] 12.907923
        Address type: 0x07
          BR/EDR
          LE Public
          LE Random
< HCI Command: Inquiry Cancel (0x01|0x0002) plen 0         #23 [hci0] 12.908174
> HCI Event: Command Complete (0x0e) plen 4                #24 [hci0] 12.909733
      Inquiry Cancel (0x01|0x0002) ncmd 1
        Status: Success (0x00)
< HCI Command: LE Set Extended Sca.. (0x08|0x0042) plen 6  #25 [hci0] 12.909889
        Extended scan: Disabled (0x00)
        Filter duplicates: Disabled (0x00)
        Duration: 0 msec (0x0000)
        Period: 0.00 sec (0x0000)
bluetoothctl[2927660]: @ MGMT O..n (privileged) version 1.23  {0x0002} 12.915366
> HCI Event: Command Complete (0x0e) plen 4                #26 [hci0] 12.921869
      LE Set Extended Scan Enable (0x08|0x0042) ncmd 1
        Status: Success (0x00)
@ MGMT Event: Discovering (0x0013) plen 2             {0x0002} [hci0] 12.922021
        Address type: 0x07
          BR/EDR
          LE Public
          LE Random
        Discovery: Disabled (0x00)
@ MGMT Event: Discovering (0x0013) plen 2             {0x0001} [hci0] 12.922021
        Address type: 0x07
          BR/EDR
          LE Public
          LE Random
        Discovery: Disabled (0x00)
@ MGMT Event: Command Complete (0x0001) plen 4        {0x0001} [hci0] 12.922151
      Stop Discovery (0x0024) plen 1
        Status: Success (0x00)
        Address type: 0x07
          BR/EDR
          LE Public
          LE Random
bluetoothd[2915165]: @ MGMT Comman.. (0x003a) plen 4  {0x0001} [hci0] 12.922176
        Address type: 0x01
          BR/EDR
        RSSI: invalid (0x7f)
        UUIDs: 0
< HCI Command: Inquiry (0x01|0x0001) plen 5                #27 [hci0] 12.922469
        Access code: 0x9e8b33 (General Inquiry)
        Length: 10.24s (0x08)
        Num responses: 0
> HCI Event: Command Status (0x0f) plen 4                  #28 [hci0] 12.923723
      Inquiry (0x01|0x0001) ncmd 1
        Status: Success (0x00)
@ MGMT Event: Command Complete (0x0001) plen 4        {0x0001} [hci0] 12.923884
      Start Service Discovery (0x003a) plen 1
        Status: Success (0x00)
        Address type: 0x01
          BR/EDR
@ MGMT Event: Discovering (0x0013) plen 2             {0x0002} [hci0] 12.923887
        Address type: 0x01
          BR/EDR
        Discovery: Enabled (0x01)
@ MGMT Event: Discovering (0x0013) plen 2             {0x0001} [hci0] 12.923887
        Address type: 0x01
          BR/EDR
        Discovery: Enabled (0x01)
bluetoothctl[2927660]: @ MGMT Close: bluetoothctl            {0x0002} 20.927307
bluetoothctl[2928435]: @ MGMT O..n (privileged) version 1.23  {0x0002} 20.941624
> HCI Event: Inquiry Complete (0x01) plen 1                #29 [hci0] 23.227861
        Status: Success (0x00)
@ MGMT Event: Discovering (0x0013) plen 2             {0x0002} [hci0] 23.227988
        Address type: 0x01
          BR/EDR
        Discovery: Disabled (0x00)
@ MGMT Event: Discovering (0x0013) plen 2             {0x0001} [hci0] 23.227988
        Address type: 0x01
          BR/EDR
        Discovery: Disabled (0x00)
bluetoothd[2915165]: @ MGMT Comman.. (0x003a) plen 4  {0x0001} [hci0] 23.228090
        Address type: 0x01
          BR/EDR
        RSSI: invalid (0x7f)
        UUIDs: 0
< HCI Command: Inquiry (0x01|0x0001) plen 5                #30 [hci0] 23.228274
        Access code: 0x9e8b33 (General Inquiry)
        Length: 10.24s (0x08)
        Num responses: 0
> HCI Event: Command Status (0x0f) plen 4                  #31 [hci0] 23.228782
      Inquiry (0x01|0x0001) ncmd 1
        Status: Success (0x00)
@ MGMT Event: Command Complete (0x0001) plen 4        {0x0001} [hci0] 23.228986
      Start Service Discovery (0x003a) plen 1
        Status: Success (0x00)
        Address type: 0x01
          BR/EDR
@ MGMT Event: Discovering (0x0013) plen 2             {0x0002} [hci0] 23.228995
        Address type: 0x01
          BR/EDR
        Discovery: Enabled (0x01)
@ MGMT Event: Discovering (0x0013) plen 2             {0x0001} [hci0] 23.228995
        Address type: 0x01
          BR/EDR
        Discovery: Enabled (0x01)
bluetoothctl[2928435]: @ MGMT Close: bluetoothctl            {0x0002} 28.951346
bluetoothctl[2929194]: @ MGMT O..n (privileged) version 1.23  {0x0002} 28.968511
> HCI Event: Inquiry Complete (0x01) plen 1                #32 [hci0] 33.532955
        Status: Success (0x00)
@ MGMT Event: Discovering (0x0013) plen 2             {0x0002} [hci0] 33.533060
        Address type: 0x01
          BR/EDR
        Discovery: Disabled (0x00)
@ MGMT Event: Discovering (0x0013) plen 2             {0x0001} [hci0] 33.533060
        Address type: 0x01
          BR/EDR
        Discovery: Disabled (0x00)
< HCI Command: LE Set Address Reso.. (0x08|0x002d) plen 1  #33 [hci0] 33.533084
        Address resolution: Enabled (0x01)
bluetoothd[2915165]: @ MGMT Comman.. (0x003a) plen 4  {0x0001} [hci0] 33.533201
        Address type: 0x01
          BR/EDR
        RSSI: invalid (0x7f)
        UUIDs: 0
> HCI Event: Command Complete (0x0e) plen 4                #34 [hci0] 33.533848
      LE Set Address Resolution Enable (0x08|0x002d) ncmd 1
        Status: Success (0x00)
< HCI Command: LE Set Extended Sc.. (0x08|0x0041) plen 13  #35 [hci0] 33.533948
        Own address type: Public (0x00)
        Filter policy: Ignore not in accept list (0x01)
        PHYs: 0x05
        Entry 0: LE 1M
          Type: Passive (0x00)
          Interval: 60.000 msec (0x0060)
          Window: 60.000 msec (0x0060)
        Entry 1: LE Coded
          Type: Passive (0x00)
          Interval: 180.000 msec (0x0120)
          Window: 180.000 msec (0x0120)
> HCI Event: Command Complete (0x0e) plen 4                #36 [hci0] 33.534848
      LE Set Extended Scan Parameters (0x08|0x0041) ncmd 1
        Status: Success (0x00)
< HCI Command: LE Set Extended Sca.. (0x08|0x0042) plen 6  #37 [hci0] 33.534961
        Extended scan: Enabled (0x01)
        Filter duplicates: Enabled (0x01)
        Duration: 0 msec (0x0000)
        Period: 0.00 sec (0x0000)
> HCI Event: Command Complete (0x0e) plen 4                #38 [hci0] 33.535849
      LE Set Extended Scan Enable (0x08|0x0042) ncmd 1
        Status: Success (0x00)
< HCI Command: Inquiry (0x01|0x0001) plen 5                #39 [hci0] 33.535901
        Access code: 0x9e8b33 (General Inquiry)
        Length: 10.24s (0x08)
        Num responses: 0
> HCI Event: Command Status (0x0f) plen 4                  #40 [hci0] 33.550968
      Inquiry (0x01|0x0001) ncmd 1
        Status: Success (0x00)
@ MGMT Event: Command Complete (0x0001) plen 4        {0x0001} [hci0] 33.551183
      Start Service Discovery (0x003a) plen 1
        Status: Success (0x00)
        Address type: 0x01
          BR/EDR
@ MGMT Event: Discovering (0x0013) plen 2             {0x0002} [hci0] 33.551190
        Address type: 0x01
          BR/EDR
        Discovery: Enabled (0x01)
@ MGMT Event: Discovering (0x0013) plen 2             {0x0001} [hci0] 33.551190
        Address type: 0x01
          BR/EDR
        Discovery: Enabled (0x01)
> HCI Event: LE Meta Event (0x3e) plen 39                  #41 [hci0] 34.250973
      LE Extended Advertising Report (0x0d)
        Num reports: 1
        Entry 0
          Event type: 0x0013
            Props: 0x0013
              Connectable
              Scannable
              Use legacy advertising PDUs
            Data status: [0;32mComplete[0m
          Legacy PDU Type: ADV_IND (0x0013)
          Address type: Random (0x01)
          Address: C0:DE:54:15:00:61 (Static)
          Primary PHY: LE 1M
          Secondary PHY: No packets
          SID: no ADI field (0xff)
          TX power: 127 dBm
          RSSI: -72 dBm (0xb8)
          Periodic advertising interval: 0.00 msec (0x0000)
          Direct address type: Public (0x00)
          Direct address: 00:00:00:00:00:00 (OUI 00-00-00)
          Data length: 0x0d
        02 01 06 09 09 58 35 34 2d 42 4f 4e 44           .....X54-BOND   
        Flags: 0x06
          LE General Discoverable Mode
          BR/EDR Not Supported
        Name (complete): X54-BOND
< HCI Command: LE Set Extended Sca.. (0x08|0x0042) plen 6  #42 [hci0] 34.251202
        Extended scan: Disabled (0x00)
        Filter duplicates: Disabled (0x00)
        Duration: 0 msec (0x0000)
        Period: 0.00 sec (0x0000)
> HCI Event: Command Complete (0x0e) plen 4                #43 [hci0] 34.252850
      LE Set Extended Scan Enable (0x08|0x0042) ncmd 1
        Status: Success (0x00)
< HCI Command: LE Extended Create.. (0x08|0x0043) plen 26  #44 [hci0] 34.253277
        Filter policy: Accept list is not used (0x00)
        Own address type: Public (0x00)
        Peer address type: Random (0x01)
        Peer address: C0:DE:54:15:00:61 (Static)
        Initiating PHYs: 0x01
        Entry 0: LE 1M
          Scan interval: 60.000 msec (0x0060)
          Scan window: 60.000 msec (0x0060)
          Min connection interval: 30.00 msec (0x0018)
          Max connection interval: 50.00 msec (0x0028)
          Connection latency: 0 (0x0000)
          Supervision timeout: 420 msec (0x002a)
          Min connection length: 0.000 msec (0x0000)
          Max connection length: 0.000 msec (0x0000)
> HCI Event: Command Status (0x0f) plen 4                  #45 [hci0] 34.255048
      LE Extended Create Connection (0x08|0x0043) ncmd 1
        Status: Success (0x00)
> HCI Event: LE Meta Event (0x3e) plen 31                  #46 [hci0] 36.387030
      LE Enhanced Connection Complete (0x0a)
        Status: Success (0x00)
        Handle: 2048
        Role: Central (0x00)
        Peer address type: Random (0x01)
        Peer address: C0:DE:54:15:00:61 (Static)
        Local resolvable private address: 00:00:00:00:00:00 (Non-Resolvable)
        Peer resolvable private address: 00:00:00:00:00:00 (Non-Resolvable)
        Connection interval: 45.00 msec (0x0024)
        Connection latency: 0 (0x0000)
        Supervision timeout: 420 msec (0x002a)
        Central clock accuracy: 0x00
@ MGMT Event: Device Connected (0x000b) plen 26       {0x0002} [hci0] 36.387197
        LE Address: C0:DE:54:15:00:61 (Static)
        Flags: 0x00000008
          Connection Locally Initiated
        Data length: 13
        Flags: 0x06
          LE General Discoverable Mode
          BR/EDR Not Supported
        Name (complete): X54-BOND
@ MGMT Event: Device Connected (0x000b) plen 26       {0x0001} [hci0] 36.387197
        LE Address: C0:DE:54:15:00:61 (Static)
        Flags: 0x00000008
          Connection Locally Initiated
        Data length: 13
        Flags: 0x06
          LE General Discoverable Mode
          BR/EDR Not Supported
        Name (complete): X54-BOND
btmon[2926585]: @ RAW Open: btmon (privileged) version 2.22  {0x0003} 36.387463
btmon[2926585]: @ RAW Close: btmon                           {0x0003} 36.387466
> HCI Event: LE Meta Event (0x3e) plen 4                   #47 [hci0] 36.387936
      LE Channel Selection Algorithm (0x14)
        Handle: 2048 Address: C0:DE:54:15:00:61 (Static)
        Algorithm: #2 (0x01)
< HCI Command: LE Read Remote Used.. (0x08|0x0016) plen 2  #48 [hci0] 36.403905
        Handle: 2048 Address: C0:DE:54:15:00:61 (Static)
> HCI Event: Command Status (0x0f) plen 4                  #49 [hci0] 36.404864
      LE Read Remote Used Features (0x08|0x0016) ncmd 1
        Status: Success (0x00)
> HCI Event: LE Meta Event (0x3e) plen 12                  #50 [hci0] 36.499987
      LE Read Remote Used Features (0x04)
        Status: Success (0x00)
        Handle: 2048 Address: C0:DE:54:15:00:61 (Static)
        Features: 0x1f 0x00 0x00 0x00 0x00 0x00 0x00 0x00
          LE Encryption
          Connection Parameter Request Procedure
          Extended Reject Indication
          Peripheral-initiated Features Exchange
          LE Ping
bluetoothd[2915165]: < ACL Data TX: H.. flags 0x00 dlen 7  #51 [hci0] 36.500222
      ATT: Exchange MTU Request (0x02) len 2
        Client RX MTU: 517
> HCI Event: Number of Completed Packets (0x13) plen 5     #52 [hci0] 36.589896
        Num handles: 1
        Handle: 2048 Address: C0:DE:54:15:00:61 (Static)
        Count: 1
        #51: len 7 (0 Kb/s)
        Latency: 89 msec (89-89 msec ~89 msec)
> ACL Data RX: Handle 2048 flags 0x02 dlen 7               #53 [hci0] 36.635753
      ATT: Exchange MTU Response (0x03) len 2
        Server RX MTU: 23
bluetoothd[2915165]: < ACL Data TX:... flags 0x00 dlen 11  #54 [hci0] 36.635978
      ATT: Read By Type Request (0x08) len 6
        Handle range: 0x0001-0xffff
        Attribute type: Server Supported Features (0x2b3a)
> HCI Event: Number of Completed Packets (0x13) plen 5     #55 [hci0] 36.678990
        Num handles: 1
        Handle: 2048 Address: C0:DE:54:15:00:61 (Static)
        Count: 1
        #54: len 11 (2 Kb/s)
        Latency: 43 msec (43-89 msec ~66 msec)
> ACL Data RX: Handle 2048 flags 0x02 dlen 9               #56 [hci0] 36.725824
      ATT: Error Response (0x01) len 4
        Read By Type Request (0x08)
        Handle: 0x0001
        Error: Attribute Not Found (0x0a)
bluetoothd[2915165]: < ACL Data TX:... flags 0x00 dlen 11  #57 [hci0] 36.725944
      ATT: Read By Group Type Request (0x10) len 6
        Handle range: 0x0001-0xffff
        Attribute group type: Primary Service (0x2800)
> HCI Event: Number of Completed Packets (0x13) plen 5     #58 [hci0] 36.768956
        Num handles: 1
        Handle: 2048 Address: C0:DE:54:15:00:61 (Static)
        Count: 1
        #57: len 11 (2 Kb/s)
        Latency: 43 msec (43-89 msec ~54 msec)
> ACL Data RX: Handle 2048 flags 0x02 dlen 24              #59 [hci0] 36.815825
      ATT: Read By Group Type Response (0x11) len 19
        Attribute data length: 6
        Attribute group list: 3 entries
        Handle range: 0x0001-0x0007
        UUID: Generic Access Profile (0x1800)
        Handle range: 0x0008-0x000b
        UUID: Generic Attribute Profile (0x1801)
        Handle range: 0x0010-0x0013
        UUID: Battery Service (0x180f)
bluetoothd[2915165]: < ACL Data TX:... flags 0x00 dlen 11  #60 [hci0] 36.816148
      ATT: Read By Group Type Request (0x10) len 6
        Handle range: 0x0014-0xffff
        Attribute group type: Primary Service (0x2800)
> HCI Event: Number of Completed Packets (0x13) plen 5     #61 [hci0] 36.858949
        Num handles: 1
        Handle: 2048 Address: C0:DE:54:15:00:61 (Static)
        Count: 1
        #60: len 11 (2 Kb/s)
        Latency: 42 msec (42-89 msec ~48 msec)
> ACL Data RX: Handle 2048 flags 0x02 dlen 9               #62 [hci0] 36.905822
      ATT: Error Response (0x01) len 4
        Read By Group Type Request (0x10)
        Handle: 0x0014
        Error: Attribute Not Found (0x0a)
bluetoothd[2915165]: < ACL Data TX:... flags 0x00 dlen 11  #63 [hci0] 36.906220
      ATT: Read By Group Type Request (0x10) len 6
        Handle range: 0x0001-0xffff
        Attribute group type: Secondary Service (0x2801)
> HCI Event: Number of Completed Packets (0x13) plen 5     #64 [hci0] 36.949057
        Num handles: 1
        Handle: 2048 Address: C0:DE:54:15:00:61 (Static)
        Count: 1
        #63: len 11 (2 Kb/s)
        Latency: 42 msec (42-89 msec ~45 msec)
> ACL Data RX: Handle 2048 flags 0x02 dlen 9               #65 [hci0] 36.995817
      ATT: Error Response (0x01) len 4
        Read By Group Type Request (0x10)
        Handle: 0x0001
        Error: Unsupported Group Type (0x10)
bluetoothd[2915165]: < ACL Data TX:... flags 0x00 dlen 11  #66 [hci0] 36.995980
      ATT: Read By Type Request (0x08) len 6
        Handle range: 0x0001-0x0013
        Attribute type: Include (0x2802)
> HCI Event: Number of Completed Packets (0x13) plen 5     #67 [hci0] 37.039005
        Num handles: 1
        Handle: 2048 Address: C0:DE:54:15:00:61 (Static)
        Count: 1
        #66: len 11 (2 Kb/s)
        Latency: 43 msec (42-89 msec ~44 msec)
> ACL Data RX: Handle 2048 flags 0x02 dlen 9               #68 [hci0] 37.086815
      ATT: Error Response (0x01) len 4
        Read By Type Request (0x08)
        Handle: 0x0001
        Error: Attribute Not Found (0x0a)
bluetoothd[2915165]: < ACL Data TX:... flags 0x00 dlen 11  #69 [hci0] 37.087080
      ATT: Read By Type Request (0x08) len 6
        Handle range: 0x0001-0x0013
        Attribute type: Characteristic (0x2803)
> HCI Event: Number of Completed Packets (0x13) plen 5     #70 [hci0] 37.128951
        Num handles: 1
        Handle: 2048 Address: C0:DE:54:15:00:61 (Static)
        Count: 1
        #69: len 11 (2 Kb/s)
        Latency: 41 msec (41-89 msec ~43 msec)
> ACL Data RX: Handle 2048 flags 0x02 dlen 27              #71 [hci0] 37.175829
      ATT: Read By Type Response (0x09) len 22
        Attribute data length: 7
        Attribute data list: 3 entries
        Handle: 0x0002
        Value: 020300002a
            Properties: 0x02
              Read (0x02)
            Value Handle: 0x0003
            Value UUID: Device Name (0x2a00)
        Handle: 0x0004
        Value: 020500012a
            Properties: 0x02
              Read (0x02)
            Value Handle: 0x0005
            Value UUID: Appearance (0x2a01)
        Handle: 0x0006
        Value: 020700042a
            Properties: 0x02
              Read (0x02)
            Value Handle: 0x0007
            Value UUID: Peripheral Preferred Connection Parameters (0x2a04)
bluetoothd[2915165]: < ACL Data TX:... flags 0x00 dlen 11  #72 [hci0] 37.176220
      ATT: Read By Type Request (0x08) len 6
        Handle range: 0x0007-0x0013
        Attribute type: Characteristic (0x2803)
> HCI Event: Number of Completed Packets (0x13) plen 5     #73 [hci0] 37.218970
        Num handles: 1
        Handle: 2048 Address: C0:DE:54:15:00:61 (Static)
        Count: 1
        #72: len 11 (2 Kb/s)
        Latency: 42 msec (41-89 msec ~42 msec)
> ACL Data RX: Handle 2048 flags 0x02 dlen 20              #74 [hci0] 37.265824
      ATT: Read By Type Response (0x09) len 15
        Attribute data length: 7
        Attribute data list: 2 entries
        Handle: 0x0009
        Value: 200a00052a
            Properties: 0x20
              Indicate (0x20)
            Value Handle: 0x000a
            Value UUID: Service Changed (0x2a05)
        Handle: 0x0011
        Value: 121200192a
            Properties: 0x12
              Read (0x02)
              Notify (0x10)
            Value Handle: 0x0012
            Value UUID: Battery Level (0x2a19)
bluetoothd[2915165]: < ACL Data TX:... flags 0x00 dlen 11  #75 [hci0] 37.266237
      ATT: Read By Type Request (0x08) len 6
        Handle range: 0x0012-0x0013
        Attribute type: Characteristic (0x2803)
> HCI Event: Number of Completed Packets (0x13) plen 5     #76 [hci0] 37.308955
        Num handles: 1
        Handle: 2048 Address: C0:DE:54:15:00:61 (Static)
        Count: 1
        #75: len 11 (2 Kb/s)
        Latency: 42 msec (41-89 msec ~42 msec)
> ACL Data RX: Handle 2048 flags 0x02 dlen 9               #77 [hci0] 37.355811
      ATT: Error Response (0x01) len 4
        Read By Type Request (0x08)
        Handle: 0x0012
        Error: Attribute Not Found (0x0a)
bluetoothd[2915165]: < ACL Data TX: H.. flags 0x00 dlen 9  #78 [hci0] 37.364649
      ATT: Write Request (0x12) len 4
        Handle: 0x000b Type: Client Characteristic Configuration (0x2902)
        Value Handle: 0x000a Type: Service Changed (0x2a05)
          Data: 0200
            Indication (0x02)
> HCI Event: Number of Completed Packets (0x13) plen 5     #79 [hci0] 37.399005
        Num handles: 1
        Handle: 2048 Address: C0:DE:54:15:00:61 (Static)
        Count: 1
        #78: len 9 (2 Kb/s)
        Latency: 34 msec (34-89 msec ~38 msec)
> ACL Data RX: Handle 2048 flags 0x02 dlen 5               #80 [hci0] 37.445812
      ATT: Write Response (0x13) len 0
bluetoothd[2915165]: < ACL Data TX: H.. flags 0x00 dlen 7  #81 [hci0] 37.446338
      ATT: Read Request (0x0a) len 2
        Handle: 0x0003 Type: Device Name (0x2a00)
> HCI Event: Number of Completed Packets (0x13) plen 5     #82 [hci0] 37.490035
        Num handles: 1
        Handle: 2048 Address: C0:DE:54:15:00:61 (Static)
        Count: 1
        #81: len 7 (1 Kb/s)
        Latency: 43 msec (34-89 msec ~41 msec)
> ACL Data RX: Handle 2048 flags 0x02 dlen 11              #83 [hci0] 37.490752
      ATT: Handle Value Indication (0x1d) len 6
        Handle: 0x000a Type: Service Changed (0x2a05)
          Data: 0100ffff
bluetoothd[2915165]: < ACL Data TX: H.. flags 0x00 dlen 5  #84 [hci0] 37.491100
      ATT: Handle Value Confirmation (0x1e) len 0
> HCI Event: Number of Completed Packets (0x13) plen 5     #85 [hci0] 37.534884
        Num handles: 1
        Handle: 2048 Address: C0:DE:54:15:00:61 (Static)
        Count: 1
        #84: len 5 (0 Kb/s)
        Latency: 43 msec (34-89 msec ~42 msec)
> ACL Data RX: Handle 2048 flags 0x02 dlen 19              #86 [hci0] 37.535736
      ATT: Read Response (0x0b) len 14
bluetoothd[2915165]: < ACL Data TX: H.. flags 0x00 dlen 7  #87 [hci0] 37.536074
      ATT: Read Request (0x0a) len 2
        Handle: 0x0005 Type: Appearance (0x2a01)
> HCI Event: Number of Completed Packets (0x13) plen 5     #88 [hci0] 37.578951
        Num handles: 1
        Handle: 2048 Address: C0:DE:54:15:00:61 (Static)
        Count: 1
        #87: len 7 (1 Kb/s)
        Latency: 42 msec (34-89 msec ~42 msec)
> ACL Data RX: Handle 2048 flags 0x02 dlen 7               #89 [hci0] 37.625735
      ATT: Read Response (0x0b) len 2
bluetoothd[2915165]: < ACL Data TX: H.. flags 0x00 dlen 7  #90 [hci0] 37.626114
      ATT: Read Request (0x0a) len 2
        Handle: 0x0012 Type: Battery Level (0x2a19)
> HCI Event: Number of Completed Packets (0x13) plen 5     #91 [hci0] 37.668886
        Num handles: 1
        Handle: 2048 Address: C0:DE:54:15:00:61 (Static)
        Count: 1
        #90: len 7 (1 Kb/s)
        Latency: 42 msec (34-89 msec ~42 msec)
> ACL Data RX: Handle 2048 flags 0x02 dlen 6               #92 [hci0] 37.716641
      ATT: Read Response (0x0b) len 1
bluetoothd[2915165]: < ACL Data TX:... flags 0x00 dlen 11  #93 [hci0] 37.716989
      ATT: Read By Group Type Request (0x10) len 6
        Handle range: 0x0001-0xffff
        Attribute group type: Primary Service (0x2800)
> HCI Event: Number of Completed Packets (0x13) plen 5     #94 [hci0] 37.758954
        Num handles: 1
        Handle: 2048 Address: C0:DE:54:15:00:61 (Static)
        Count: 1
        #93: len 11 (2 Kb/s)
        Latency: 41 msec (34-89 msec ~42 msec)
> ACL Data RX: Handle 2048 flags 0x02 dlen 24              #95 [hci0] 37.805875
      ATT: Read By Group Type Response (0x11) len 19
        Attribute data length: 6
        Attribute group list: 3 entries
        Handle range: 0x0001-0x0007
        UUID: Generic Access Profile (0x1800)
        Handle range: 0x0008-0x000b
        UUID: Generic Attribute Profile (0x1801)
        Handle range: 0x0010-0x0013
        UUID: Battery Service (0x180f)
bluetoothd[2915165]: < ACL Data TX: H.. flags 0x00 dlen 9  #96 [hci0] 37.806137
      ATT: Write Request (0x12) len 4
        Handle: 0x0013 Type: Client Characteristic Configuration (0x2902)
        Value Handle: 0x0012 Type: Battery Level (0x2a19)
          Data: 0100
            Notification (0x01)
> HCI Event: Number of Completed Packets (0x13) plen 5     #97 [hci0] 37.848968
        Num handles: 1
        Handle: 2048 Address: C0:DE:54:15:00:61 (Static)
        Count: 1
        #96: len 9 (1 Kb/s)
        Latency: 42 msec (34-89 msec ~42 msec)
> ACL Data RX: Handle 2048 flags 0x02 dlen 5               #98 [hci0] 37.896835
      ATT: Write Response (0x13) len 0
bluetoothd[2915165]: < ACL Data TX:... flags 0x00 dlen 11  #99 [hci0] 37.897273
      ATT: Read By Group Type Request (0x10) len 6
        Handle range: 0x0014-0xffff
        Attribute group type: Primary Service (0x2800)
> HCI Event: Number of Completed Packets (0x13) plen 5    #100 [hci0] 37.939873
        Num handles: 1
        Handle: 2048 Address: C0:DE:54:15:00:61 (Static)
        Count: 1
        #99: len 11 (2 Kb/s)
        Latency: 42 msec (34-89 msec ~42 msec)
> ACL Data RX: Handle 2048 flags 0x02 dlen 8              #101 [hci0] 37.940739
      ATT: Handle Value Notification (0x1b) len 3
        Handle: 0x0012 Type: Battery Level (0x2a19)
          Data: 5f
> ACL Data RX: Handle 2048 flags 0x02 dlen 9              #102 [hci0] 37.985808
      ATT: Error Response (0x01) len 4
        Read By Group Type Request (0x10)
        Handle: 0x0014
        Error: Attribute Not Found (0x0a)
bluetoothctl[2929194]: @ MGMT Close: bluetoothctl            {0x0002} 38.973790
bluetoothctl[2930083]: @ MGMT O..n (privileged) version 1.23  {0x0002} 38.987697
bluetoothd[2915165]: @ MGMT Comman.. (0x0024) plen 1  {0x0001} [hci0] 38.992053
        Address type: 0x01
          BR/EDR
< HCI Command: Inquiry Cancel (0x01|0x0002) plen 0        #103 [hci0] 38.992266
> HCI Event: Command Complete (0x0e) plen 4               #104 [hci0] 38.993954
      Inquiry Cancel (0x01|0x0002) ncmd 1
        Status: Success (0x00)
@ MGMT Event: Discovering (0x0013) plen 2             {0x0002} [hci0] 38.994084
        Address type: 0x01
          BR/EDR
        Discovery: Disabled (0x00)
@ MGMT Event: Discovering (0x0013) plen 2             {0x0001} [hci0] 38.994084
        Address type: 0x01
          BR/EDR
        Discovery: Disabled (0x00)
@ MGMT Event: Command Complete (0x0001) plen 4        {0x0001} [hci0] 38.994204
      Stop Discovery (0x0024) plen 1
        Status: Success (0x00)
        Address type: 0x01
          BR/EDR
bluetoothd[2915165]: @ MGMT Comman.. (0x0019) plen 8  {0x0001} [hci0] 38.994291
        LE Address: C0:DE:54:15:00:61 (Static)
        Capability: DisplayYesNo (0x01)
< ACL Data TX: Handle 2048 flags 0x00 dlen 11             #105 [hci0] 38.994430
      SMP: Pairing Request (0x01) len 6
        IO capability: DisplayYesNo (0x01)
        OOB data: Authentication data not present (0x00)
        Authentication requirement: Bonding, MITM, SC, No Keypresses, CT2 (0x2d)
        Max encryption key size: 16
        Initiator key distribution: EncKey Sign LinkKey (0x0d)
        Responder key distribution: EncKey IdKey Sign LinkKey (0x0f)
> HCI Event: Number of Completed Packets (0x13) plen 5    #106 [hci0] 39.064977
        Num handles: 1
        Handle: 2048 Address: C0:DE:54:15:00:61 (Static)
        Count: 1
        #105: len 11 (1 Kb/s)
        Latency: 70 msec (34-89 msec ~56 msec)
> ACL Data RX: Handle 2048 flags 0x02 dlen 11             #107 [hci0] 39.110811
      SMP: Pairing Response (0x02) len 6
        IO capability: NoInputNoOutput (0x03)
        OOB data: Authentication data not present (0x00)
        Authentication requirement: Bonding, No MITM, Legacy, No Keypresses (0x01)
        Max encryption key size: 16
        Initiator key distribution: EncKey (0x01)
        Responder key distribution: <none> (0x00)
@ MGMT Event: User Confirmation R.. (0x000f) plen 12  {0x0002} [hci0] 39.110831
        LE Address: C0:DE:54:15:00:61 (Static)
        Confirm hint: 0x01
        Value: 0x00000000
@ MGMT Event: User Confirmation R.. (0x000f) plen 12  {0x0001} [hci0] 39.110831
        LE Address: C0:DE:54:15:00:61 (Static)
        Confirm hint: 0x01
        Value: 0x00000000
bluetoothd[2915165]: @ MGMT Comman.. (0x001c) plen 7  {0x0001} [hci0] 39.111017
        LE Address: C0:DE:54:15:00:61 (Static)
@ MGMT Event: Command Complete (0x0001) plen 10       {0x0001} [hci0] 39.111026
      User Confirmation Reply (0x001c) plen 7
        Status: Success (0x00)
        LE Address: C0:DE:54:15:00:61 (Static)
< ACL Data TX: Handle 2048 flags 0x00 dlen 21             #108 [hci0] 39.111161
      SMP: Pairing Confirm (0x03) len 16
        Confim value: 386f0861a6b0bbb36e83e64eaf32a0b8
> HCI Event: Number of Completed Packets (0x13) plen 5    #109 [hci0] 39.155037
        Num handles: 1
        Handle: 2048 Address: C0:DE:54:15:00:61 (Static)
        Count: 1
        #108: len 21 (3 Kb/s)
        Latency: 43 msec (34-89 msec ~50 msec)
> ACL Data RX: Handle 2048 flags 0x02 dlen 21             #110 [hci0] 39.200892
      SMP: Pairing Confirm (0x03) len 16
        Confim value: 5bd84aa9e2998aea1d6629ffa6565b61
< ACL Data TX: Handle 2048 flags 0x00 dlen 21             #111 [hci0] 39.201044
      SMP: Pairing Random (0x04) len 16
        Random value: b32d64da6dbfea0ea0245950f8ca01f2
> HCI Event: Number of Completed Packets (0x13) plen 5    #112 [hci0] 39.244899
        Num handles: 1
        Handle: 2048 Address: C0:DE:54:15:00:61 (Static)
        Count: 1
        #111: len 21 (3 Kb/s)
        Latency: 43 msec (34-89 msec ~47 msec)
> ACL Data RX: Handle 2048 flags 0x02 dlen 21             #113 [hci0] 39.290830
      SMP: Pairing Random (0x04) len 16
        Random value: 94836d60a0e2542a7f47343e94b7220a
< HCI Command: LE Start Encryption (0x08|0x0019) plen 28  #114 [hci0] 39.290863
        Handle: 2048 Address: C0:DE:54:15:00:61 (Static)
        Random number: 0x0000000000000000
        Encrypted diversifier: 0x0000
        Long term key: 57443b386ce02e3931f38d26dd9e8d24
> HCI Event: Command Status (0x0f) plen 4                 #115 [hci0] 39.291888
      LE Start Encryption (0x08|0x0019) ncmd 1
        Status: Success (0x00)
> HCI Event: Encryption Change (0x08) plen 4              #116 [hci0] 39.558983
        Status: Connection Terminated due to MIC Failure (0x3d)
        Handle: 2048 Address: C0:DE:54:15:00:61 (Static)
        Encryption: Disabled (0x00)
@ MGMT Event: Command Complete (0x0001) plen 10       {0x0001} [hci0] 39.559094
      Pair Device (0x0019) plen 7
        Status: Authentication Failed (0x05)
        LE Address: C0:DE:54:15:00:61 (Static)
< HCI Command: Disconnect (0x01|0x0006) plen 3            #117 [hci0] 39.559211
        Handle: 2048 Address: C0:DE:54:15:00:61 (Static)
        Reason: Authentication Failure (0x05)
> HCI Event: Disconnect Complete (0x05) plen 4            #118 [hci0] 39.559889
        Status: Success (0x00)
        Handle: 2048 Address: C0:DE:54:15:00:61 (Static)
        Reason: Connection Terminated due to MIC Failure (0x3d)
@ MGMT Event: Device Disconnected (0x000c) plen 8     {0x0002} [hci0] 39.559974
        LE Address: C0:DE:54:15:00:61 (Static)
        Reason: Unspecified (0x00)
@ MGMT Event: Device Disconnected (0x000c) plen 8     {0x0001} [hci0] 39.559974
        LE Address: C0:DE:54:15:00:61 (Static)
        Reason: Unspecified (0x00)
> HCI Event: Command Status (0x0f) plen 4                 #119 [hci0] 39.560887
      Disconnect (0x01|0x0006) ncmd 1
        Status: Unknown Connection Identifier (0x02)
bluetoothd[2915165]: @ MGMT Comman.. (0x003a) plen 4  {0x0001} [hci0] 44.721881
        Address type: 0x01
          BR/EDR
        RSSI: invalid (0x7f)
        UUIDs: 0
< HCI Command: Inquiry (0x01|0x0001) plen 5               #120 [hci0] 44.722127
        Access code: 0x9e8b33 (General Inquiry)
        Length: 10.24s (0x08)
        Num responses: 0
> HCI Event: Command Status (0x0f) plen 4                 #121 [hci0] 44.816919
      Inquiry (0x01|0x0001) ncmd 1
        Status: Success (0x00)
@ MGMT Event: Command Complete (0x0001) plen 4        {0x0001} [hci0] 44.817111
      Start Service Discovery (0x003a) plen 1
        Status: Success (0x00)
        Address type: 0x01
          BR/EDR
@ MGMT Event: Discovering (0x0013) plen 2             {0x0002} [hci0] 44.817117
        Address type: 0x01
          BR/EDR
        Discovery: Enabled (0x01)
@ MGMT Event: Discovering (0x0013) plen 2             {0x0001} [hci0] 44.817117
        Address type: 0x01
          BR/EDR
        Discovery: Enabled (0x01)
> HCI Event: Inquiry Complete (0x01) plen 1               #122 [hci0] 55.120003
        Status: Success (0x00)
@ MGMT Event: Discovering (0x0013) plen 2             {0x0002} [hci0] 55.120027
        Address type: 0x01
          BR/EDR
        Discovery: Disabled (0x00)
@ MGMT Event: Discovering (0x0013) plen 2             {0x0001} [hci0] 55.120027
        Address type: 0x01
          BR/EDR
        Discovery: Disabled (0x00)
bluetoothd[2915165]: @ MGMT Comman.. (0x003a) plen 4  {0x0001} [hci0] 55.120285
        Address type: 0x01
          BR/EDR
        RSSI: invalid (0x7f)
        UUIDs: 0
< HCI Command: Inquiry (0x01|0x0001) plen 5               #123 [hci0] 55.120399
        Access code: 0x9e8b33 (General Inquiry)
        Length: 10.24s (0x08)
        Num responses: 0
> HCI Event: Command Status (0x0f) plen 4                 #124 [hci0] 55.120990
      Inquiry (0x01|0x0001) ncmd 1
        Status: Success (0x00)
@ MGMT Event: Command Complete (0x0001) plen 4        {0x0001} [hci0] 55.121095
      Start Service Discovery (0x003a) plen 1
        Status: Success (0x00)
        Address type: 0x01
          BR/EDR
@ MGMT Event: Discovering (0x0013) plen 2             {0x0002} [hci0] 55.121101
        Address type: 0x01
          BR/EDR
        Discovery: Enabled (0x01)
@ MGMT Event: Discovering (0x0013) plen 2             {0x0001} [hci0] 55.121101
        Address type: 0x01
          BR/EDR
        Discovery: Enabled (0x01)
bluetoothctl[2930083]: @ MGMT Close: bluetoothctl            {0x0002} 58.996188
bluetoothctl[2931894]: @ MGMT O..n (privileged) version 1.23  {0x0002} 59.009702
> HCI Event: Inquiry Complete (0x01) plen 1               #125 [hci0] 65.425076
        Status: Success (0x00)
@ MGMT Event: Discovering (0x0013) plen 2             {0x0002} [hci0] 65.425187
        Address type: 0x01
          BR/EDR
        Discovery: Disabled (0x00)
@ MGMT Event: Discovering (0x0013) plen 2             {0x0001} [hci0] 65.425187
        Address type: 0x01
          BR/EDR
        Discovery: Disabled (0x00)
bluetoothd[2915165]: @ MGMT Comman.. (0x003a) plen 4  {0x0001} [hci0] 65.425490
        Address type: 0x01
          BR/EDR
        RSSI: invalid (0x7f)
        UUIDs: 0
< HCI Command: Inquiry (0x01|0x0001) plen 5               #126 [hci0] 65.425646
        Access code: 0x9e8b33 (General Inquiry)
        Length: 10.24s (0x08)
        Num responses: 0
> HCI Event: Command Status (0x0f) plen 4                 #127 [hci0] 65.427068
      Inquiry (0x01|0x0001) ncmd 1
        Status: Success (0x00)
@ MGMT Event: Command Complete (0x0001) plen 4        {0x0001} [hci0] 65.427217
      Start Service Discovery (0x003a) plen 1
        Status: Success (0x00)
        Address type: 0x01
          BR/EDR
@ MGMT Event: Discovering (0x0013) plen 2             {0x0002} [hci0] 65.427226
        Address type: 0x01
          BR/EDR
        Discovery: Enabled (0x01)
@ MGMT Event: Discovering (0x0013) plen 2             {0x0001} [hci0] 65.427226
        Address type: 0x01
          BR/EDR
        Discovery: Enabled (0x01)
bluetoothctl[2931894]: @ MGMT Close: bluetoothctl            {0x0002} 67.016493
bluetoothctl[2932615]: @ MGMT O..n (privileged) version 1.23  {0x0002} 67.031400
bluetoothctl[2932615]: @ MGMT Close: bluetoothctl            {0x0002} 75.044142
> HCI Event: Inquiry Complete (0x01) plen 1               #128 [hci0] 75.732244
        Status: Success (0x00)
@ MGMT Event: Discovering (0x0013) plen 2             {0x0001} [hci0] 75.732348
        Address type: 0x01
          BR/EDR
        Discovery: Disabled (0x00)
bluetoothd[2915165]: @ MGMT Comman.. (0x003a) plen 4  {0x0001} [hci0] 75.732448
        Address type: 0x01
          BR/EDR
        RSSI: invalid (0x7f)
        UUIDs: 0
< HCI Command: Inquiry (0x01|0x0001) plen 5               #129 [hci0] 75.732505
        Access code: 0x9e8b33 (General Inquiry)
        Length: 10.24s (0x08)
        Num responses: 0
> HCI Event: Command Status (0x0f) plen 4                 #130 [hci0] 75.733145
      Inquiry (0x01|0x0001) ncmd 1
        Status: Success (0x00)
@ MGMT Event: Command Complete (0x0001) plen 4        {0x0001} [hci0] 75.733312
      Start Service Discovery (0x003a) plen 1
        Status: Success (0x00)
        Address type: 0x01
          BR/EDR
@ MGMT Event: Discovering (0x0013) plen 2             {0x0001} [hci0] 75.733327
        Address type: 0x01
          BR/EDR
        Discovery: Enabled (0x01)
