Bluetooth monitor ver 5.72
btmon[884504]: = Note: Linux version 6.17.0-14-generic (x86_64)        0.534707
btmon[884504]: = Note: Bluetooth subsystem version 2.22                0.534709
= New Index: 68:34:21:E5:84:DF (Primary,USB,hci0)               [hci0] 0.534710
= Open Index: 68:34:21:E5:84:DF                                 [hci0] 0.534710
= Index Info: 68:34:21:E5:84:DF (Intel Corp.)                   [hci0] 0.534710
bluetoothctl[748339]: @ MGMT Open: bluetoothctl version 1.23  {0x0005} 0.534711
bluetoothctl[669496]: @ MGMT Open: bluetoothctl version 1.23  {0x0004} 0.534712
btmgmt[662289]: @ MGMT Open: btmgmt version 1.23              {0x0003} 0.534712
bluetoothd[3155986]: @ MGMT Open.. (privileged) version 1.23  {0x0001} 0.534713
btmgmt[2437324]: @ MGMT Open: btmgmt version 1.23             {0x0002} 0.534714
bluetoothctl[884611]: @ MGMT Ope.. (privileged) version 1.23  {0x0006} 1.539044
> HCI Event: Inquiry Complete (0x01) plen 1                  #1 [hci0] 1.997994
        Status: Success (0x00)
> HCI Event: LE Meta Event (0x3e) plen 43                    #2 [hci0] 2.001867
      LE Extended Advertising Report (0x0d)
        Num reports: 1
        Entry 0
          Event type: 0x0013
            Props: 0x0013
              Connectable
              Scannable
              Use legacy advertising PDUs
            Data status: [0;32mComplete[0m
          Legacy PDU Type: ADV_IND (0x0013)
          Address type: Random (0x01)
          Address: 59:E1:5E:2D:DD:C3 (Resolvable)
          Primary PHY: LE 1M
          Secondary PHY: No packets
          SID: no ADI field (0xff)
          TX power: 127 dBm
          RSSI: -98 dBm (0x9e)
          Periodic advertising interval: 0.00 msec (0x0000)
          Direct address type: Public (0x00)
          Direct address: 00:00:00:00:00:00 (OUI 00-00-00)
          Data length: 0x11
        02 01 1a 02 0a 0c 0a ff 4c 00 10 05 3b 1c 32 db  ........L...;.2.
        2a                                               *               
        Flags: 0x1a
          LE General Discoverable Mode
          Simultaneous LE and BR/EDR (Controller)
          Simultaneous LE and BR/EDR (Host)
        TX power: 12 dBm
        Company: Apple, Inc. (76)
          Type: Unknown (16)
          Data: 3b1c32db2a
> HCI Event: LE Meta Event (0x3e) plen 26                    #3 [hci0] 2.002849
      LE Extended Advertising Report (0x0d)
        Num reports: 1
        Entry 0
          Event type: 0x001b
            Props: 0x001b
              Connectable
              Scannable
              Scan response
              Use legacy advertising PDUs
            Data status: [0;32mComplete[0m
          Legacy PDU Type: SCAN_RSP to an ADV_SCAN_IND (0x001b)
          Address type: Random (0x01)
          Address: 59:E1:5E:2D:DD:C3 (Resolvable)
          Primary PHY: LE 1M
          Secondary PHY: No packets
          SID: no ADI field (0xff)
          TX power: 127 dBm
          RSSI: -95 dBm (0xa1)
          Periodic advertising interval: 0.00 msec (0x0000)
          Direct address type: Public (0x00)
          Direct address: 00:00:00:00:00:00 (OUI 00-00-00)
          Data length: 0x00
@ MGMT Event: Device Found (0x0012) plen 31            {0x0006} [hci0] 2.003029
        LE Address: 59:E1:5E:2D:DD:C3 (Resolvable)
        RSSI: -95 dBm (0xa1)
        Flags: 0x00000000
        Data length: 17
        Flags: 0x1a
          LE General Discoverable Mode
          Simultaneous LE and BR/EDR (Controller)
          Simultaneous LE and BR/EDR (Host)
        TX power: 12 dBm
        Company: Apple, Inc. (76)
          Type: Unknown (16)
          Data: 3b1c32db2a
@ MGMT Event: Device Found (0x0012) plen 31            {0x0001} [hci0] 2.003029
        LE Address: 59:E1:5E:2D:DD:C3 (Resolvable)
        RSSI: -95 dBm (0xa1)
        Flags: 0x00000000
        Data length: 17
        Flags: 0x1a
          LE General Discoverable Mode
          Simultaneous LE and BR/EDR (Controller)
          Simultaneous LE and BR/EDR (Host)
        TX power: 12 dBm
        Company: Apple, Inc. (76)
          Type: Unknown (16)
          Data: 3b1c32db2a
> HCI Event: LE Meta Event (0x3e) plen 43                    #4 [hci0] 2.239976
      LE Extended Advertising Report (0x0d)
        Num reports: 1
        Entry 0
          Event type: 0x0013
            Props: 0x0013
              Connectable
              Scannable
              Use legacy advertising PDUs
            Data status: [0;32mComplete[0m
          Legacy PDU Type: ADV_IND (0x0013)
          Address type: Public (0x00)
          Address: A4:C1:38:8D:7D:4F (Telink Semiconductor (Taipei) Co. Ltd.)
          Primary PHY: LE 1M
          Secondary PHY: No packets
          SID: no ADI field (0xff)
          TX power: 127 dBm
          RSSI: -94 dBm (0xa2)
          Periodic advertising interval: 0.00 msec (0x0000)
          Direct address type: Public (0x00)
          Direct address: 00:00:00:00:00:00 (OUI 00-00-00)
          Data length: 0x11
        10 16 1a 18 a4 c1 38 8d 7d 4f 00 bf 3a 51 0b 75  ......8.}O..:Q.u
        fb                                               .               
        Service Data: Environmental Sensing (0x181a)
          Data: a4c1388d7d4f00bf3a510b75fb
> HCI Event: LE Meta Event (0x3e) plen 38                    #5 [hci0] 2.240875
      LE Extended Advertising Report (0x0d)
        Num reports: 1
        Entry 0
          Event type: 0x001b
            Props: 0x001b
              Connectable
              Scannable
              Scan response
              Use legacy advertising PDUs
            Data status: [0;32mComplete[0m
          Legacy PDU Type: SCAN_RSP to an ADV_SCAN_IND (0x001b)
          Address type: Public (0x00)
          Address: A4:C1:38:8D:7D:4F (Telink Semiconductor (Taipei) Co. Ltd.)
          Primary PHY: LE 1M
          Secondary PHY: No packets
          SID: no ADI field (0xff)
          TX power: 127 dBm
          RSSI: -93 dBm (0xa3)
          Periodic advertising interval: 0.00 msec (0x0000)
          Direct address type: Public (0x00)
          Direct address: 00:00:00:00:00:00 (OUI 00-00-00)
          Data length: 0x0c
        0b 09 41 54 43 5f 38 44 37 44 34 46              ..ATC_8D7D4F    
        Name (complete): ATC_8D7D4F
@ MGMT Event: Device Found (0x0012) plen 43            {0x0006} [hci0] 2.240955
        LE Address: A4:C1:38:8D:7D:4F (Telink Semiconductor (Taipei) Co. Ltd.)
        RSSI: -93 dBm (0xa3)
        Flags: 0x00000000
        Data length: 29
        Service Data: Environmental Sensing (0x181a)
          Data: a4c1388d7d4f00bf3a510b75fb
        Name (complete): ATC_8D7D4F
@ MGMT Event: Device Found (0x0012) plen 43            {0x0001} [hci0] 2.240955
        LE Address: A4:C1:38:8D:7D:4F (Telink Semiconductor (Taipei) Co. Ltd.)
        RSSI: -93 dBm (0xa3)
        Flags: 0x00000000
        Data length: 29
        Service Data: Environmental Sensing (0x181a)
          Data: a4c1388d7d4f00bf3a510b75fb
        Name (complete): ATC_8D7D4F
> HCI Event: LE Meta Event (0x3e) plen 26                    #6 [hci0] 2.275025
      LE Extended Advertising Report (0x0d)
        Num reports: 1
        Entry 0
          Event type: 0x0013
            Props: 0x0013
              Connectable
              Scannable
              Use legacy advertising PDUs
            Data status: [0;32mComplete[0m
          Legacy PDU Type: ADV_IND (0x0013)
          Address type: Public (0x00)
          Address: A4:C1:38:8D:7D:4F (Telink Semiconductor (Taipei) Co. Ltd.)
          Primary PHY: LE 1M
          Secondary PHY: No packets
          SID: no ADI field (0xff)
          TX power: 127 dBm
          RSSI: -94 dBm (0xa2)
          Periodic advertising interval: 0.00 msec (0x0000)
          Direct address type: Public (0x00)
          Direct address: 00:00:00:00:00:00 (OUI 00-00-00)
          Data length: 0x00
@ MGMT Event: Discovering (0x0013) plen 2              {0x0006} [hci0] 2.324055
        Address type: 0x07
          BR/EDR
          LE Public
          LE Random
        Discovery: Disabled (0x00)
@ MGMT Event: Discovering (0x0013) plen 2              {0x0001} [hci0] 2.324055
        Address type: 0x07
          BR/EDR
          LE Public
          LE Random
        Discovery: Disabled (0x00)
< HCI Command: LE Set Extended Scan... (0x08|0x0042) plen 6  #7 [hci0] 2.324204
        Extended scan: Disabled (0x00)
        Filter duplicates: Disabled (0x00)
        Duration: 0 msec (0x0000)
        Period: 0.00 sec (0x0000)
bluetoothd[3155986]: @ MGMT Command.. (0x003a) plen 4  {0x0001} [hci0] 2.324305
        Address type: 0x07
          BR/EDR
          LE Public
          LE Random
        RSSI: invalid (0x7f)
        UUIDs: 0
> HCI Event: Command Complete (0x0e) plen 4                  #8 [hci0] 2.330890
      LE Set Extended Scan Enable (0x08|0x0042) ncmd 1
        Status: Success (0x00)
< HCI Command: LE Set Random Address (0x08|0x0005) plen 6    #9 [hci0] 2.331202
        Address: 24:3A:CB:AE:DF:38 (Non-Resolvable)
> HCI Event: Command Complete (0x0e) plen 4                 #10 [hci0] 2.331846
      LE Set Random Address (0x08|0x0005) ncmd 1
        Status: Success (0x00)
< HCI Command: LE Set Extended Sca.. (0x08|0x0041) plen 13  #11 [hci0] 2.332223
        Own address type: Random (0x01)
        Filter policy: Accept all advertisement (0x00)
        PHYs: 0x05
        Entry 0: LE 1M
          Type: Active (0x01)
          Interval: 22.500 msec (0x0024)
          Window: 11.250 msec (0x0012)
        Entry 1: LE Coded
          Type: Active (0x01)
          Interval: 67.500 msec (0x006c)
          Window: 33.750 msec (0x0036)
> HCI Event: Command Complete (0x0e) plen 4                 #12 [hci0] 2.332843
      LE Set Extended Scan Parameters (0x08|0x0041) ncmd 1
        Status: Success (0x00)
< HCI Command: LE Set Extended Scan.. (0x08|0x0042) plen 6  #13 [hci0] 2.333136
        Extended scan: Enabled (0x01)
        Filter duplicates: Disabled (0x00)
        Duration: 0 msec (0x0000)
        Period: 0.00 sec (0x0000)
> HCI Event: Command Complete (0x0e) plen 4                 #14 [hci0] 2.333843
      LE Set Extended Scan Enable (0x08|0x0042) ncmd 1
        Status: Success (0x00)
@ MGMT Event: Discovering (0x0013) plen 2              {0x0006} [hci0] 2.333951
        Address type: 0x07
          BR/EDR
          LE Public
          LE Random
        Discovery: Enabled (0x01)
@ MGMT Event: Discovering (0x0013) plen 2              {0x0001} [hci0] 2.333951
        Address type: 0x07
          BR/EDR
          LE Public
          LE Random
        Discovery: Enabled (0x01)
< HCI Command: Inquiry (0x01|0x0001) plen 5                 #15 [hci0] 2.334137
        Access code: 0x9e8b33 (General Inquiry)
        Length: 10.24s (0x08)
        Num responses: 0
> HCI Event: Command Status (0x0f) plen 4                   #16 [hci0] 2.346870
      Inquiry (0x01|0x0001) ncmd 1
        Status: Success (0x00)
@ MGMT Event: Command Complete (0x0001) plen 4         {0x0001} [hci0] 2.347145
      Start Service Discovery (0x003a) plen 1
        Status: Success (0x00)
        Address type: 0x07
          BR/EDR
          LE Public
          LE Random
> HCI Event: LE Meta Event (0x3e) plen 42                   #17 [hci0] 6.537080
      LE Extended Advertising Report (0x0d)
        Num reports: 1
        Entry 0
          Event type: 0x0013
            Props: 0x0013
              Connectable
              Scannable
              Use legacy advertising PDUs
            Data status: [0;32mComplete[0m
          Legacy PDU Type: ADV_IND (0x0013)
          Address type: Random (0x01)
          Address: C0:DE:54:15:00:21 (Static)
          Primary PHY: LE 1M
          Secondary PHY: No packets
          SID: no ADI field (0xff)
          TX power: 127 dBm
          RSSI: -94 dBm (0xa2)
          Periodic advertising interval: 0.00 msec (0x0000)
          Direct address type: Public (0x00)
          Direct address: 00:00:00:00:00:00 (OUI 00-00-00)
          Data length: 0x10
        02 01 06 0c 09 58 49 41 4f 35 34 2d 4c 49 4e 4b  .....XIAO54-LINK
        Flags: 0x06
          LE General Discoverable Mode
          BR/EDR Not Supported
        Name (complete): XIAO54-LINK
< HCI Command: LE Set Extended Scan.. (0x08|0x0042) plen 6  #18 [hci0] 6.537362
        Extended scan: Disabled (0x00)
        Filter duplicates: Disabled (0x00)
        Duration: 0 msec (0x0000)
        Period: 0.00 sec (0x0000)
> HCI Event: Command Complete (0x0e) plen 4                 #19 [hci0] 6.546202
      LE Set Extended Scan Enable (0x08|0x0042) ncmd 1
        Status: Success (0x00)
@ MGMT Event: Device Found (0x0012) plen 30            {0x0006} [hci0] 6.546293
        LE Address: C0:DE:54:15:00:21 (Static)
        RSSI: -94 dBm (0xa2)
        Flags: 0x00000000
        Data length: 16
        Flags: 0x06
          LE General Discoverable Mode
          BR/EDR Not Supported
        Name (complete): XIAO54-LINK
@ MGMT Event: Device Found (0x0012) plen 30            {0x0001} [hci0] 6.546293
        LE Address: C0:DE:54:15:00:21 (Static)
        RSSI: -94 dBm (0xa2)
        Flags: 0x00000000
        Data length: 16
        Flags: 0x06
          LE General Discoverable Mode
          BR/EDR Not Supported
        Name (complete): XIAO54-LINK
< HCI Command: LE Extended Create... (0x08|0x0043) plen 26  #20 [hci0] 6.546479
        Filter policy: Accept list is not used (0x00)
        Own address type: Public (0x00)
        Peer address type: Random (0x01)
        Peer address: C0:DE:54:15:00:21 (Static)
        Initiating PHYs: 0x01
        Entry 0: LE 1M
          Scan interval: 60.000 msec (0x0060)
          Scan window: 60.000 msec (0x0060)
          Min connection interval: 30.00 msec (0x0018)
          Max connection interval: 50.00 msec (0x0028)
          Connection latency: 0 (0x0000)
          Supervision timeout: 420 msec (0x002a)
          Min connection length: 0.000 msec (0x0000)
          Max connection length: 0.000 msec (0x0000)
> HCI Event: Command Status (0x0f) plen 4                   #21 [hci0] 6.548963
      LE Extended Create Connection (0x08|0x0043) ncmd 1
        Status: Success (0x00)
> HCI Event: LE Meta Event (0x3e) plen 31                   #22 [hci0] 7.824142
      LE Enhanced Connection Complete (0x0a)
        Status: Success (0x00)
        Handle: 2048
        Role: Central (0x00)
        Peer address type: Random (0x01)
        Peer address: C0:DE:54:15:00:21 (Static)
        Local resolvable private address: 00:00:00:00:00:00 (Non-Resolvable)
        Peer resolvable private address: 00:00:00:00:00:00 (Non-Resolvable)
        Connection interval: 45.00 msec (0x0024)
        Connection latency: 0 (0x0000)
        Supervision timeout: 420 msec (0x002a)
        Central clock accuracy: 0x00
@ MGMT Event: Device Connected (0x000b) plen 29        {0x0006} [hci0] 7.824173
        LE Address: C0:DE:54:15:00:21 (Static)
        Flags: 0x00000008
          Connection Locally Initiated
        Data length: 16
        Flags: 0x06
          LE General Discoverable Mode
          BR/EDR Not Supported
        Name (complete): XIAO54-LINK
@ MGMT Event: Device Connected (0x000b) plen 29        {0x0001} [hci0] 7.824173
        LE Address: C0:DE:54:15:00:21 (Static)
        Flags: 0x00000008
          Connection Locally Initiated
        Data length: 16
        Flags: 0x06
          LE General Discoverable Mode
          BR/EDR Not Supported
        Name (complete): XIAO54-LINK
btmon[884504]: @ RAW Open: btmon (privileged) version 2.22    {0x0007} 7.824230
btmon[884504]: @ RAW Close: btmon                             {0x0007} 7.824232
> HCI Event: LE Meta Event (0x3e) plen 4                    #23 [hci0] 7.825007
      LE Channel Selection Algorithm (0x14)
        Handle: 2048 Address: C0:DE:54:15:00:21 (Static)
        Algorithm: #1 (0x00)
< HCI Command: LE Read Remote Used... (0x08|0x0016) plen 2  #24 [hci0] 7.835753
        Handle: 2048 Address: C0:DE:54:15:00:21 (Static)
> HCI Event: Command Status (0x0f) plen 4                   #25 [hci0] 7.836085
      LE Read Remote Used Features (0x08|0x0016) ncmd 1
        Status: Success (0x00)
> HCI Event: LE Meta Event (0x3e) plen 12                   #26 [hci0] 7.898122
      LE Read Remote Used Features (0x04)
        Status: Success (0x00)
        Handle: 2048 Address: C0:DE:54:15:00:21 (Static)
        Features: 0x1f 0x00 0x00 0x00 0x00 0x00 0x00 0x00
          LE Encryption
          Connection Parameter Request Procedure
          Extended Reject Indication
          Peripheral-initiated Features Exchange
          LE Ping
bluetoothd[3155986]: < ACL Data TX: Ha.. flags 0x00 dlen 7  #27 [hci0] 7.898677
      ATT: Exchange MTU Request (0x02) len 2
        Client RX MTU: 517
> HCI Event: Number of Completed Packets (0x13) plen 5      #28 [hci0] 8.033101
        Num handles: 1
        Handle: 2048 Address: C0:DE:54:15:00:21 (Static)
        Count: 1
        #27: len 7 (0 Kb/s)
        Latency: 134 msec (134-134 msec ~134 msec)
> ACL Data RX: Handle 2048 flags 0x02 dlen 7                #29 [hci0] 8.123869
      ATT: Exchange MTU Response (0x03) len 2
        Server RX MTU: 23
bluetoothd[3155986]: < ACL Data TX: H.. flags 0x00 dlen 11  #30 [hci0] 8.124260
      ATT: Read By Type Request (0x08) len 6
        Handle range: 0x0001-0xffff
        Attribute type: Server Supported Features (0x2b3a)
> HCI Event: Number of Completed Packets (0x13) plen 5      #31 [hci0] 8.168106
        Num handles: 1
        Handle: 2048 Address: C0:DE:54:15:00:21 (Static)
        Count: 1
        #30: len 11 (2 Kb/s)
        Latency: 43 msec (43-134 msec ~89 msec)
> ACL Data RX: Handle 2048 flags 0x02 dlen 9                #32 [hci0] 8.213853
      ATT: Error Response (0x01) len 4
        Read By Type Request (0x08)
        Handle: 0x0001
        Error: Attribute Not Found (0x0a)
bluetoothd[3155986]: < ACL Data TX: H.. flags 0x00 dlen 11  #33 [hci0] 8.214104
      ATT: Read By Group Type Request (0x10) len 6
        Handle range: 0x0001-0xffff
        Attribute group type: Primary Service (0x2800)
> HCI Event: Number of Completed Packets (0x13) plen 5      #34 [hci0] 8.258132
        Num handles: 1
        Handle: 2048 Address: C0:DE:54:15:00:21 (Static)
        Count: 1
        #33: len 11 (2 Kb/s)
        Latency: 44 msec (43-134 msec ~66 msec)
> ACL Data RX: Handle 2048 flags 0x02 dlen 24               #35 [hci0] 8.304848
      ATT: Read By Group Type Response (0x11) len 19
        Attribute data length: 6
        Attribute group list: 3 entries
        Handle range: 0x0001-0x0007
        UUID: Generic Access Profile (0x1800)
        Handle range: 0x0008-0x000b
        UUID: Generic Attribute Profile (0x1801)
        Handle range: 0x0010-0x0013
        UUID: Battery Service (0x180f)
bluetoothd[3155986]: < ACL Data TX: H.. flags 0x00 dlen 11  #36 [hci0] 8.305357
      ATT: Read By Group Type Request (0x10) len 6
        Handle range: 0x0014-0xffff
        Attribute group type: Primary Service (0x2800)
> HCI Event: Number of Completed Packets (0x13) plen 5      #37 [hci0] 8.348114
        Num handles: 1
        Handle: 2048 Address: C0:DE:54:15:00:21 (Static)
        Count: 1
        #36: len 11 (2 Kb/s)
        Latency: 42 msec (42-134 msec ~54 msec)
> ACL Data RX: Handle 2048 flags 0x02 dlen 9                #38 [hci0] 8.393863
      ATT: Error Response (0x01) len 4
        Read By Group Type Request (0x10)
        Handle: 0x0014
        Error: Attribute Not Found (0x0a)
bluetoothd[3155986]: < ACL Data TX: H.. flags 0x00 dlen 11  #39 [hci0] 8.394252
      ATT: Read By Group Type Request (0x10) len 6
        Handle range: 0x0001-0xffff
        Attribute group type: Secondary Service (0x2801)
> HCI Event: Number of Completed Packets (0x13) plen 5      #40 [hci0] 8.438100
        Num handles: 1
        Handle: 2048 Address: C0:DE:54:15:00:21 (Static)
        Count: 1
        #39: len 11 (2 Kb/s)
        Latency: 43 msec (42-134 msec ~49 msec)
> ACL Data RX: Handle 2048 flags 0x02 dlen 9                #41 [hci0] 8.483878
      ATT: Error Response (0x01) len 4
        Read By Group Type Request (0x10)
        Handle: 0x0001
        Error: Unsupported Group Type (0x10)
bluetoothd[3155986]: < ACL Data TX: H.. flags 0x00 dlen 11  #42 [hci0] 8.484016
      ATT: Read By Type Request (0x08) len 6
        Handle range: 0x0001-0x0013
        Attribute type: Include (0x2802)
> HCI Event: Number of Completed Packets (0x13) plen 5      #43 [hci0] 8.528107
        Num handles: 1
        Handle: 2048 Address: C0:DE:54:15:00:21 (Static)
        Count: 1
        #42: len 11 (2 Kb/s)
        Latency: 44 msec (42-134 msec ~46 msec)
> ACL Data RX: Handle 2048 flags 0x02 dlen 9                #44 [hci0] 8.573730
      ATT: Error Response (0x01) len 4
        Read By Type Request (0x08)
        Handle: 0x0001
        Error: Attribute Not Found (0x0a)
bluetoothd[3155986]: < ACL Data TX: H.. flags 0x00 dlen 11  #45 [hci0] 8.573964
      ATT: Read By Type Request (0x08) len 6
        Handle range: 0x0001-0x0013
        Attribute type: Characteristic (0x2803)
> HCI Event: Number of Completed Packets (0x13) plen 5      #46 [hci0] 8.618126
        Num handles: 1
        Handle: 2048 Address: C0:DE:54:15:00:21 (Static)
        Count: 1
        #45: len 11 (2 Kb/s)
        Latency: 44 msec (42-134 msec ~45 msec)
> ACL Data RX: Handle 2048 flags 0x02 dlen 27               #47 [hci0] 8.663810
      ATT: Read By Type Response (0x09) len 22
        Attribute data length: 7
        Attribute data list: 3 entries
        Handle: 0x0002
        Value: 020300002a
            Properties: 0x02
              Read (0x02)
            Value Handle: 0x0003
            Value UUID: Device Name (0x2a00)
        Handle: 0x0004
        Value: 020500012a
            Properties: 0x02
              Read (0x02)
            Value Handle: 0x0005
            Value UUID: Appearance (0x2a01)
        Handle: 0x0006
        Value: 020700042a
            Properties: 0x02
              Read (0x02)
            Value Handle: 0x0007
            Value UUID: Peripheral Preferred Connection Parameters (0x2a04)
bluetoothd[3155986]: < ACL Data TX: H.. flags 0x00 dlen 11  #48 [hci0] 8.664131
      ATT: Read By Type Request (0x08) len 6
        Handle range: 0x0007-0x0013
        Attribute type: Characteristic (0x2803)
> HCI Event: Number of Completed Packets (0x13) plen 5      #49 [hci0] 8.708106
        Num handles: 1
        Handle: 2048 Address: C0:DE:54:15:00:21 (Static)
        Count: 1
        #48: len 11 (2 Kb/s)
        Latency: 43 msec (42-134 msec ~44 msec)
> ACL Data RX: Handle 2048 flags 0x02 dlen 20               #50 [hci0] 8.753863
      ATT: Read By Type Response (0x09) len 15
        Attribute data length: 7
        Attribute data list: 2 entries
        Handle: 0x0009
        Value: 200a00052a
            Properties: 0x20
              Indicate (0x20)
            Value Handle: 0x000a
            Value UUID: Service Changed (0x2a05)
        Handle: 0x0011
        Value: 121200192a
            Properties: 0x12
              Read (0x02)
              Notify (0x10)
            Value Handle: 0x0012
            Value UUID: Battery Level (0x2a19)
bluetoothd[3155986]: < ACL Data TX: H.. flags 0x00 dlen 11  #51 [hci0] 8.754165
      ATT: Read By Type Request (0x08) len 6
        Handle range: 0x0012-0x0013
        Attribute type: Characteristic (0x2803)
> HCI Event: Number of Completed Packets (0x13) plen 5      #52 [hci0] 8.798121
        Num handles: 1
        Handle: 2048 Address: C0:DE:54:15:00:21 (Static)
        Count: 1
        #51: len 11 (2 Kb/s)
        Latency: 43 msec (42-134 msec ~44 msec)
> ACL Data RX: Handle 2048 flags 0x02 dlen 9                #53 [hci0] 8.843865
      ATT: Error Response (0x01) len 4
        Read By Type Request (0x08)
        Handle: 0x0012
        Error: Attribute Not Found (0x0a)
bluetoothd[3155986]: < ACL Data TX: Ha.. flags 0x00 dlen 9  #54 [hci0] 8.881716
      ATT: Write Request (0x12) len 4
        Handle: 0x000b Type: Client Characteristic Configuration (0x2902)
        Value Handle: 0x000a Type: Service Changed (0x2a05)
          Data: 0200
            Indication (0x02)
> HCI Event: Number of Completed Packets (0x13) plen 5      #55 [hci0] 8.888043
        Num handles: 1
        Handle: 2048 Address: C0:DE:54:15:00:21 (Static)
        Count: 1
        #54: len 9 (12 Kb/s)
        Latency: 6 msec (6-134 msec ~25 msec)
> ACL Data RX: Handle 2048 flags 0x02 dlen 5                #56 [hci0] 8.933803
      ATT: Write Response (0x13) len 0
bluetoothd[3155986]: < ACL Data TX: Ha.. flags 0x00 dlen 7  #57 [hci0] 8.934001
      ATT: Read Request (0x0a) len 2
        Handle: 0x0003 Type: Device Name (0x2a00)
> HCI Event: Number of Completed Packets (0x13) plen 5      #58 [hci0] 9.023112
        Num handles: 1
        Handle: 2048 Address: C0:DE:54:15:00:21 (Static)
        Count: 1
        #57: len 7 (0 Kb/s)
        Latency: 89 msec (6-134 msec ~57 msec)
> ACL Data RX: Handle 2048 flags 0x02 dlen 11               #59 [hci0] 9.023841
> ACL Data RX: Handle 2048 flags 0x02 dlen 16               #60 [hci0] 9.070731
        unexpected start frame
        0c 00 04 00 0b 58 49 41 4f 35 34 2d 4c 49 4e 4b  .....XIAO54-LINK
bluetoothd[3155986]: < ACL Data TX: Ha.. flags 0x00 dlen 7  #61 [hci0] 9.071056
      ATT: Read Request (0x0a) len 2
        Handle: 0x0005 Type: Appearance (0x2a01)
> HCI Event: Number of Completed Packets (0x13) plen 5      #62 [hci0] 9.113050
        Num handles: 1
        Handle: 2048 Address: C0:DE:54:15:00:21 (Static)
        Count: 1
        #61: len 7 (1 Kb/s)
        Latency: 41 msec (6-134 msec ~49 msec)
> ACL Data RX: Handle 2048 flags 0x02 dlen 7                #63 [hci0] 9.158739
      ATT: Read Response (0x0b) len 2
bluetoothd[3155986]: < ACL Data TX: Ha.. flags 0x00 dlen 7  #64 [hci0] 9.159165
      ATT: Read Request (0x0a) len 2
        Handle: 0x0012 Type: Battery Level (0x2a19)
> HCI Event: Number of Completed Packets (0x13) plen 5      #65 [hci0] 9.203138
        Num handles: 1
        Handle: 2048 Address: C0:DE:54:15:00:21 (Static)
        Count: 1
        #64: len 7 (1 Kb/s)
        Latency: 43 msec (6-134 msec ~46 msec)
> ACL Data RX: Handle 2048 flags 0x02 dlen 6                #66 [hci0] 9.248848
      ATT: Read Response (0x0b) len 1
bluetoothd[3155986]: < ACL Data TX: Ha.. flags 0x00 dlen 9  #67 [hci0] 9.249151
      ATT: Write Request (0x12) len 4
        Handle: 0x0013 Type: Client Characteristic Configuration (0x2902)
        Value Handle: 0x0012 Type: Battery Level (0x2a19)
          Data: 0100
            Notification (0x01)
> HCI Event: Number of Completed Packets (0x13) plen 5      #68 [hci0] 9.293168
        Num handles: 1
        Handle: 2048 Address: C0:DE:54:15:00:21 (Static)
        Count: 1
        #67: len 9 (1 Kb/s)
        Latency: 44 msec (6-134 msec ~45 msec)
> ACL Data RX: Handle 2048 flags 0x02 dlen 5                #69 [hci0] 9.338736
      ATT: Write Response (0x13) len 0
> ACL Data RX: Handle 2048 flags 0x02 dlen 8                #70 [hci0] 9.473762
      ATT: Handle Value Notification (0x1b) len 3
        Handle: 0x0012 Type: Battery Level (0x2a19)
          Data: 64
bluetoothctl[884611]: @ MGMT Close: bluetoothctl              {0x0006} 9.542604
bluetoothctl[885627]: @ MGMT Op.. (privileged) version 1.23  {0x0006} 12.553968
> HCI Event: Inquiry Complete (0x01) plen 1                #71 [hci0] 12.587240
        Status: Success (0x00)
@ MGMT Event: Discovering (0x0013) plen 2             {0x0006} [hci0] 12.587256
        Address type: 0x07
          BR/EDR
          LE Public
          LE Random
        Discovery: Disabled (0x00)
@ MGMT Event: Discovering (0x0013) plen 2             {0x0001} [hci0] 12.587256
        Address type: 0x07
          BR/EDR
          LE Public
          LE Random
        Discovery: Disabled (0x00)
bluetoothd[3155986]: @ MGMT Comman.. (0x003a) plen 4  {0x0001} [hci0] 12.587523
        Address type: 0x07
          BR/EDR
          LE Public
          LE Random
        RSSI: invalid (0x7f)
        UUIDs: 0
< HCI Command: LE Set Random Address (0x08|0x0005) plen 6  #72 [hci0] 12.587659
        Address: 37:4F:CE:7B:E6:19 (Non-Resolvable)
> HCI Event: Command Complete (0x0e) plen 4                #73 [hci0] 12.588245
      LE Set Random Address (0x08|0x0005) ncmd 1
        Status: Success (0x00)
< HCI Command: LE Set Extended Sc.. (0x08|0x0041) plen 13  #74 [hci0] 12.588328
        Own address type: Random (0x01)
        Filter policy: Accept all advertisement (0x00)
        PHYs: 0x05
        Entry 0: LE 1M
          Type: Active (0x01)
          Interval: 22.500 msec (0x0024)
          Window: 11.250 msec (0x0012)
        Entry 1: LE Coded
          Type: Active (0x01)
          Interval: 67.500 msec (0x006c)
          Window: 33.750 msec (0x0036)
> HCI Event: Command Complete (0x0e) plen 4                #75 [hci0] 12.589141
      LE Set Extended Scan Parameters (0x08|0x0041) ncmd 1
        Status: Success (0x00)
< HCI Command: LE Set Extended Sca.. (0x08|0x0042) plen 6  #76 [hci0] 12.589290
        Extended scan: Enabled (0x01)
        Filter duplicates: Disabled (0x00)
        Duration: 0 msec (0x0000)
        Period: 0.00 sec (0x0000)
> HCI Event: Command Complete (0x0e) plen 4                #77 [hci0] 12.590142
      LE Set Extended Scan Enable (0x08|0x0042) ncmd 1
        Status: Success (0x00)
@ MGMT Event: Discovering (0x0013) plen 2             {0x0006} [hci0] 12.590148
        Address type: 0x07
          BR/EDR
          LE Public
          LE Random
        Discovery: Enabled (0x01)
@ MGMT Event: Discovering (0x0013) plen 2             {0x0001} [hci0] 12.590148
        Address type: 0x07
          BR/EDR
          LE Public
          LE Random
        Discovery: Enabled (0x01)
< HCI Command: Inquiry (0x01|0x0001) plen 5                #78 [hci0] 12.590511
        Access code: 0x9e8b33 (General Inquiry)
        Length: 10.24s (0x08)
        Num responses: 0
> HCI Event: Command Status (0x0f) plen 4                  #79 [hci0] 12.603225
      Inquiry (0x01|0x0001) ncmd 1
        Status: Success (0x00)
@ MGMT Event: Command Complete (0x0001) plen 4        {0x0001} [hci0] 12.603365
      Start Service Discovery (0x003a) plen 1
        Status: Success (0x00)
        Address type: 0x07
          BR/EDR
          LE Public
          LE Random
> HCI Event: LE Meta Event (0x3e) plen 43                  #80 [hci0] 12.912264
      LE Extended Advertising Report (0x0d)
        Num reports: 1
        Entry 0
          Event type: 0x0013
            Props: 0x0013
              Connectable
              Scannable
              Use legacy advertising PDUs
            Data status: [0;32mComplete[0m
          Legacy PDU Type: ADV_IND (0x0013)
          Address type: Public (0x00)
          Address: A4:C1:38:26:4E:DA (Telink Semiconductor (Taipei) Co. Ltd.)
          Primary PHY: LE 1M
          Secondary PHY: No packets
          SID: no ADI field (0xff)
          TX power: 127 dBm
          RSSI: -58 dBm (0xc6)
          Periodic advertising interval: 0.00 msec (0x0000)
          Direct address type: Public (0x00)
          Direct address: 00:00:00:00:00:00 (OUI 00-00-00)
          Data length: 0x11
        10 16 1a 18 a4 c1 38 26 4e da 00 d7 32 25 0a 06  ......8&N...2%..
        12                                               .               
        Service Data: Environmental Sensing (0x181a)
          Data: a4c138264eda00d732250a0612
> HCI Event: LE Meta Event (0x3e) plen 38                  #81 [hci0] 12.913189
      LE Extended Advertising Report (0x0d)
        Num reports: 1
        Entry 0
          Event type: 0x001b
            Props: 0x001b
              Connectable
              Scannable
              Scan response
              Use legacy advertising PDUs
            Data status: [0;32mComplete[0m
          Legacy PDU Type: SCAN_RSP to an ADV_SCAN_IND (0x001b)
          Address type: Public (0x00)
          Address: A4:C1:38:26:4E:DA (Telink Semiconductor (Taipei) Co. Ltd.)
          Primary PHY: LE 1M
          Secondary PHY: No packets
          SID: no ADI field (0xff)
          TX power: 127 dBm
          RSSI: -58 dBm (0xc6)
          Periodic advertising interval: 0.00 msec (0x0000)
          Direct address type: Public (0x00)
          Direct address: 00:00:00:00:00:00 (OUI 00-00-00)
          Data length: 0x0c
        0b 09 41 54 43 5f 32 36 34 45 44 41              ..ATC_264EDA    
        Name (complete): ATC_264EDA
@ MGMT Event: Device Found (0x0012) plen 43           {0x0006} [hci0] 12.913262
        LE Address: A4:C1:38:26:4E:DA (Telink Semiconductor (Taipei) Co. Ltd.)
        RSSI: -58 dBm (0xc6)
        Flags: 0x00000000
        Data length: 29
        Service Data: Environmental Sensing (0x181a)
          Data: a4c138264eda00d732250a0612
        Name (complete): ATC_264EDA
@ MGMT Event: Device Found (0x0012) plen 43           {0x0001} [hci0] 12.913262
        LE Address: A4:C1:38:26:4E:DA (Telink Semiconductor (Taipei) Co. Ltd.)
        RSSI: -58 dBm (0xc6)
        Flags: 0x00000000
        Data length: 29
        Service Data: Environmental Sensing (0x181a)
          Data: a4c138264eda00d732250a0612
        Name (complete): ATC_264EDA
> HCI Event: LE Meta Event (0x3e) plen 57                  #82 [hci0] 13.528322
      LE Extended Advertising Report (0x0d)
        Num reports: 1
        Entry 0
          Event type: 0x0010
            Props: 0x0010
              Use legacy advertising PDUs
            Data status: [0;32mComplete[0m
          Legacy PDU Type: ADV_NONCONN_IND (0x0010)
          Address type: Random (0x01)
          Address: C0:13:1A:B3:49:E3 (Static)
          Primary PHY: LE 1M
          Secondary PHY: No packets
          SID: no ADI field (0xff)
          TX power: 127 dBm
          RSSI: -82 dBm (0xae)
          Periodic advertising interval: 0.00 msec (0x0000)
          Direct address type: Public (0x00)
          Direct address: 00:00:00:00:00:00 (OUI 00-00-00)
          Data length: 0x1f
        1e ff 4c 00 12 19 00 26 3b 28 08 e3 76 fa 74 fc  ..L....&;(..v.t.
        5c 70 2c 6e 1e 6f 14 21 59 67 7d 04 e2 02 00     \p,n.o.!Yg}.... 
        Company: Apple, Inc. (76)
          Type: Unknown (18)
          Data: 00263b2808e376fa74fc5c702c6e1e6f142159677d04e20200
@ MGMT Event: Device Found (0x0012) plen 45           {0x0006} [hci0] 13.528352
        LE Address: C0:13:1A:B3:49:E3 (Static)
        RSSI: -82 dBm (0xae)
        Flags: 0x00000004
          Not Connectable
        Data length: 31
        Company: Apple, Inc. (76)
          Type: Unknown (18)
          Data: 00263b2808e376fa74fc5c702c6e1e6f142159677d04e20200
@ MGMT Event: Device Found (0x0012) plen 45           {0x0001} [hci0] 13.528352
        LE Address: C0:13:1A:B3:49:E3 (Static)
        RSSI: -82 dBm (0xae)
        Flags: 0x00000004
          Not Connectable
        Data length: 31
        Company: Apple, Inc. (76)
          Type: Unknown (18)
          Data: 00263b2808e376fa74fc5c702c6e1e6f142159677d04e20200
bluetoothd[3155986]: @ MGMT Comman.. (0x0014) plen 7  {0x0001} [hci0] 14.721121
        LE Address: C0:DE:54:15:00:21 (Static)
< HCI Command: Disconnect (0x01|0x0006) plen 3             #83 [hci0] 14.721297
        Handle: 2048 Address: C0:DE:54:15:00:21 (Static)
        Reason: Remote User Terminated Connection (0x13)
> HCI Event: Command Status (0x0f) plen 4                  #84 [hci0] 14.722209
      Disconnect (0x01|0x0006) ncmd 1
        Status: Success (0x00)
> HCI Event: Disconnect Complete (0x05) plen 4             #85 [hci0] 14.738294
        Status: Success (0x00)
        Handle: 2048 Address: C0:DE:54:15:00:21 (Static)
        Reason: Connection Terminated By Local Host (0x16)
@ MGMT Event: Device Disconnected (0x000c) plen 8     {0x0006} [hci0] 14.738379
        LE Address: C0:DE:54:15:00:21 (Static)
        Reason: Connection terminated by local host (0x02)
@ MGMT Event: Device Disconnected (0x000c) plen 8     {0x0001} [hci0] 14.738379
        LE Address: C0:DE:54:15:00:21 (Static)
        Reason: Connection terminated by local host (0x02)
@ MGMT Event: Command Complete (0x0001) plen 10       {0x0001} [hci0] 14.764884
      Disconnect (0x0014) plen 7
        Status: Success (0x00)
        LE Address: C0:DE:54:15:00:21 (Static)
bluetoothd[3155986]: = No matching connection for device       [hci0] 14.765047
> HCI Event: LE Meta Event (0x3e) plen 43                  #86 [hci0] 15.736359
      LE Extended Advertising Report (0x0d)
        Num reports: 1
        Entry 0
          Event type: 0x0013
            Props: 0x0013
              Connectable
              Scannable
              Use legacy advertising PDUs
            Data status: [0;32mComplete[0m
          Legacy PDU Type: ADV_IND (0x0013)
          Address type: Random (0x01)
          Address: 59:E1:5E:2D:DD:C3 (Resolvable)
          Primary PHY: LE 1M
          Secondary PHY: No packets
          SID: no ADI field (0xff)
          TX power: 127 dBm
          RSSI: -83 dBm (0xad)
          Periodic advertising interval: 0.00 msec (0x0000)
          Direct address type: Public (0x00)
          Direct address: 00:00:00:00:00:00 (OUI 00-00-00)
          Data length: 0x11
        02 01 1a 02 0a 0c 0a ff 4c 00 10 05 3b 1c 32 db  ........L...;.2.
        2a                                               *               
        Flags: 0x1a
          LE General Discoverable Mode
          Simultaneous LE and BR/EDR (Controller)
          Simultaneous LE and BR/EDR (Host)
        TX power: 12 dBm
        Company: Apple, Inc. (76)
          Type: Unknown (16)
          Data: 3b1c32db2a
> HCI Event: LE Meta Event (0x3e) plen 26                  #87 [hci0] 15.737252
      LE Extended Advertising Report (0x0d)
        Num reports: 1
        Entry 0
          Event type: 0x001b
            Props: 0x001b
              Connectable
              Scannable
              Scan response
              Use legacy advertising PDUs
            Data status: [0;32mComplete[0m
          Legacy PDU Type: SCAN_RSP to an ADV_SCAN_IND (0x001b)
          Address type: Random (0x01)
          Address: 59:E1:5E:2D:DD:C3 (Resolvable)
          Primary PHY: LE 1M
          Secondary PHY: No packets
          SID: no ADI field (0xff)
          TX power: 127 dBm
          RSSI: -84 dBm (0xac)
          Periodic advertising interval: 0.00 msec (0x0000)
          Direct address type: Public (0x00)
          Direct address: 00:00:00:00:00:00 (OUI 00-00-00)
          Data length: 0x00
@ MGMT Event: Device Found (0x0012) plen 31           {0x0006} [hci0] 15.737326
        LE Address: 59:E1:5E:2D:DD:C3 (Resolvable)
        RSSI: -84 dBm (0xac)
        Flags: 0x00000000
        Data length: 17
        Flags: 0x1a
          LE General Discoverable Mode
          Simultaneous LE and BR/EDR (Controller)
          Simultaneous LE and BR/EDR (Host)
        TX power: 12 dBm
        Company: Apple, Inc. (76)
          Type: Unknown (16)
          Data: 3b1c32db2a
@ MGMT Event: Device Found (0x0012) plen 31           {0x0001} [hci0] 15.737326
        LE Address: 59:E1:5E:2D:DD:C3 (Resolvable)
        RSSI: -84 dBm (0xac)
        Flags: 0x00000000
        Data length: 17
        Flags: 0x1a
          LE General Discoverable Mode
          Simultaneous LE and BR/EDR (Controller)
          Simultaneous LE and BR/EDR (Host)
        TX power: 12 dBm
        Company: Apple, Inc. (76)
          Type: Unknown (16)
          Data: 3b1c32db2a
bluetoothctl[885627]: @ MGMT Close: bluetoothctl             {0x0006} 18.559030
bluetoothd[3155986]: @ MGMT Comman.. (0x0024) plen 1  {0x0001} [hci0] 19.723171
        Address type: 0x07
          BR/EDR
          LE Public
          LE Random
< HCI Command: Inquiry Cancel (0x01|0x0002) plen 0         #88 [hci0] 19.723439
> HCI Event: Command Complete (0x0e) plen 4                #89 [hci0] 19.817366
      Inquiry Cancel (0x01|0x0002) ncmd 1
        Status: Success (0x00)
< HCI Command: LE Set Extended Sca.. (0x08|0x0042) plen 6  #90 [hci0] 19.817734
        Extended scan: Disabled (0x00)
        Filter duplicates: Disabled (0x00)
        Duration: 0 msec (0x0000)
        Period: 0.00 sec (0x0000)
> HCI Event: Command Complete (0x0e) plen 4                #91 [hci0] 19.830434
      LE Set Extended Scan Enable (0x08|0x0042) ncmd 1
        Status: Success (0x00)
@ MGMT Event: Discovering (0x0013) plen 2             {0x0001} [hci0] 19.830548
        Address type: 0x07
          BR/EDR
          LE Public
          LE Random
        Discovery: Disabled (0x00)
@ MGMT Event: Command Complete (0x0001) plen 4        {0x0001} [hci0] 19.830674
      Stop Discovery (0x0024) plen 1
        Status: Success (0x00)
        Address type: 0x07
          BR/EDR
          LE Public
          LE Random
bluetoothd[3155986]: @ MGMT Comman.. (0x003a) plen 4  {0x0001} [hci0] 19.830910
        Address type: 0x07
          BR/EDR
          LE Public
          LE Random
        RSSI: invalid (0x7f)
        UUIDs: 0
< HCI Command: LE Set Random Address (0x08|0x0005) plen 6  #92 [hci0] 19.831033
        Address: 05:55:7B:CA:3A:5E (Non-Resolvable)
> HCI Event: Command Complete (0x0e) plen 4                #93 [hci0] 19.831352
      LE Set Random Address (0x08|0x0005) ncmd 1
        Status: Success (0x00)
< HCI Command: LE Set Extended Sc.. (0x08|0x0041) plen 13  #94 [hci0] 19.831662
        Own address type: Random (0x01)
        Filter policy: Accept all advertisement (0x00)
        PHYs: 0x05
        Entry 0: LE 1M
          Type: Active (0x01)
          Interval: 22.500 msec (0x0024)
          Window: 11.250 msec (0x0012)
        Entry 1: LE Coded
          Type: Active (0x01)
          Interval: 67.500 msec (0x006c)
          Window: 33.750 msec (0x0036)
> HCI Event: Command Complete (0x0e) plen 4                #95 [hci0] 19.832452
      LE Set Extended Scan Parameters (0x08|0x0041) ncmd 1
        Status: Success (0x00)
< HCI Command: LE Set Extended Sca.. (0x08|0x0042) plen 6  #96 [hci0] 19.832788
        Extended scan: Enabled (0x01)
        Filter duplicates: Disabled (0x00)
        Duration: 0 msec (0x0000)
        Period: 0.00 sec (0x0000)
> HCI Event: Command Complete (0x0e) plen 4                #97 [hci0] 19.833361
      LE Set Extended Scan Enable (0x08|0x0042) ncmd 1
        Status: Success (0x00)
@ MGMT Event: Discovering (0x0013) plen 2             {0x0001} [hci0] 19.833466
        Address type: 0x07
          BR/EDR
          LE Public
          LE Random
        Discovery: Enabled (0x01)
< HCI Command: Inquiry (0x01|0x0001) plen 5                #98 [hci0] 19.833628
        Access code: 0x9e8b33 (General Inquiry)
        Length: 10.24s (0x08)
        Num responses: 0
> HCI Event: Command Status (0x0f) plen 4                  #99 [hci0] 19.845444
      Inquiry (0x01|0x0001) ncmd 1
        Status: Success (0x00)
@ MGMT Event: Command Complete (0x0001) plen 4        {0x0001} [hci0] 19.845686
      Start Service Discovery (0x003a) plen 1
        Status: Success (0x00)
        Address type: 0x07
          BR/EDR
          LE Public
          LE Random
