Bluetooth monitor ver 5.72
btmon[2953291]: = Note: Linux version 6.17.0-14-generic (x86_64)       0.976216
btmon[2953291]: = Note: Bluetooth subsystem version 2.22               0.976217
= New Index: 68:34:21:E5:84:DF (Primary,USB,hci0)               [hci0] 0.976218
= Open Index: 68:34:21:E5:84:DF                                 [hci0] 0.976218
= Index Info: 68:34:21:E5:84:DF (Intel Corp.)                   [hci0] 0.976219
bluetoothd[2915165]: @ MGMT Open.. (privileged) version 1.23  {0x0001} 0.976219
bluetoothctl[2953474]: @ MGMT Op.. (privileged) version 1.23  {0x0002} 2.979710
bluetoothctl[2953474]: @ MGMT Close: bluetoothctl             {0x0002} 2.983588
bluetoothctl[2953477]: @ MGMT Op.. (privileged) version 1.23  {0x0002} 2.992070
bluetoothd[2915165]: @ MGMT Command.. (0x0023) plen 1  {0x0001} [hci0] 3.028646
        Address type: 0x07
          BR/EDR
          LE Public
          LE Random
< HCI Command: LE Set Address Resolu.. (0x08|0x002d) plen 1  #1 [hci0] 3.028759
        Address resolution: Disabled (0x00)
> HCI Event: Command Complete (0x0e) plen 4                  #2 [hci0] 3.123580
      LE Set Address Resolution Enable (0x08|0x002d) ncmd 1
        Status: Success (0x00)
< HCI Command: LE Set Random Address (0x08|0x0005) plen 6    #3 [hci0] 3.123994
        Address: 36:F6:92:ED:C5:C1 (Non-Resolvable)
> HCI Event: Command Complete (0x0e) plen 4                  #4 [hci0] 3.124566
      LE Set Random Address (0x08|0x0005) ncmd 1
        Status: Success (0x00)
< HCI Command: LE Set Extended Scan.. (0x08|0x0041) plen 13  #5 [hci0] 3.124954
        Own address type: Random (0x01)
        Filter policy: Accept all advertisement (0x00)
        PHYs: 0x05
        Entry 0: LE 1M
          Type: Active (0x01)
          Interval: 22.500 msec (0x0024)
          Window: 11.250 msec (0x0012)
        Entry 1: LE Coded
          Type: Active (0x01)
          Interval: 67.500 msec (0x006c)
          Window: 33.750 msec (0x0036)
> HCI Event: Command Complete (0x0e) plen 4                  #6 [hci0] 3.125566
      LE Set Extended Scan Parameters (0x08|0x0041) ncmd 1
        Status: Success (0x00)
< HCI Command: LE Set Extended Scan... (0x08|0x0042) plen 6  #7 [hci0] 3.125677
        Extended scan: Enabled (0x01)
        Filter duplicates: Enabled (0x01)
        Duration: 0 msec (0x0000)
        Period: 0.00 sec (0x0000)
> HCI Event: Command Complete (0x0e) plen 4                  #8 [hci0] 3.126566
      LE Set Extended Scan Enable (0x08|0x0042) ncmd 1
        Status: Success (0x00)
@ MGMT Event: Discovering (0x0013) plen 2              {0x0002} [hci0] 3.126679
        Address type: 0x07
          BR/EDR
          LE Public
          LE Random
        Discovery: Enabled (0x01)
@ MGMT Event: Discovering (0x0013) plen 2              {0x0001} [hci0] 3.126679
        Address type: 0x07
          BR/EDR
          LE Public
          LE Random
        Discovery: Enabled (0x01)
< HCI Command: Inquiry (0x01|0x0001) plen 5                  #9 [hci0] 3.126698
        Access code: 0x9e8b33 (General Inquiry)
        Length: 10.24s (0x08)
        Num responses: 0
> HCI Event: Command Status (0x0f) plen 4                   #10 [hci0] 3.138592
      Inquiry (0x01|0x0001) ncmd 1
        Status: Success (0x00)
@ MGMT Event: Command Complete (0x0001) plen 4         {0x0001} [hci0] 3.138724
      Start Discovery (0x0023) plen 1
        Status: Success (0x00)
        Address type: 0x07
          BR/EDR
          LE Public
          LE Random
> HCI Event: LE Meta Event (0x3e) plen 39                   #11 [hci0] 4.977703
      LE Extended Advertising Report (0x0d)
        Num reports: 1
        Entry 0
          Event type: 0x0013
            Props: 0x0013
              Connectable
              Scannable
              Use legacy advertising PDUs
            Data status: [0;32mComplete[0m
          Legacy PDU Type: ADV_IND (0x0013)
          Address type: Random (0x01)
          Address: C0:DE:54:15:00:61 (Static)
          Primary PHY: LE 1M
          Secondary PHY: No packets
          SID: no ADI field (0xff)
          TX power: 127 dBm
          RSSI: -72 dBm (0xb8)
          Periodic advertising interval: 0.00 msec (0x0000)
          Direct address type: Public (0x00)
          Direct address: 00:00:00:00:00:00 (OUI 00-00-00)
          Data length: 0x0d
        02 01 06 09 09 58 35 34 2d 42 4f 4e 44           .....X54-BOND   
        Flags: 0x06
          LE General Discoverable Mode
          BR/EDR Not Supported
        Name (complete): X54-BOND
> HCI Event: LE Meta Event (0x3e) plen 43                   #12 [hci0] 4.988732
      LE Extended Advertising Report (0x0d)
        Num reports: 1
        Entry 0
          Event type: 0x0013
            Props: 0x0013
              Connectable
              Scannable
              Use legacy advertising PDUs
            Data status: [0;32mComplete[0m
          Legacy PDU Type: ADV_IND (0x0013)
          Address type: Random (0x01)
          Address: 73:01:16:B1:70:95 (Resolvable)
          Primary PHY: LE 1M
          Secondary PHY: No packets
          SID: no ADI field (0xff)
          TX power: 127 dBm
          RSSI: -84 dBm (0xac)
          Periodic advertising interval: 0.00 msec (0x0000)
          Direct address type: Public (0x00)
          Direct address: 00:00:00:00:00:00 (OUI 00-00-00)
          Data length: 0x11
        02 01 1a 02 0a 0c 0a ff 4c 00 10 05 34 1c 05 a6  ........L...4...
        69                                               i               
        Flags: 0x1a
          LE General Discoverable Mode
          Simultaneous LE and BR/EDR (Controller)
          Simultaneous LE and BR/EDR (Host)
        TX power: 12 dBm
        Company: Apple, Inc. (76)
          Type: Unknown (16)
          Data: 341c05a669
@ MGMT Event: Device Found (0x0012) plen 27            {0x0002} [hci0] 4.988873
        LE Address: C0:DE:54:15:00:61 (Static)
        RSSI: -72 dBm (0xb8)
        Flags: 0x00000000
        Data length: 13
        Flags: 0x06
          LE General Discoverable Mode
          BR/EDR Not Supported
        Name (complete): X54-BOND
@ MGMT Event: Device Found (0x0012) plen 27            {0x0001} [hci0] 4.988873
        LE Address: C0:DE:54:15:00:61 (Static)
        RSSI: -72 dBm (0xb8)
        Flags: 0x00000000
        Data length: 13
        Flags: 0x06
          LE General Discoverable Mode
          BR/EDR Not Supported
        Name (complete): X54-BOND
> HCI Event: LE Meta Event (0x3e) plen 26                   #13 [hci0] 4.989611
      LE Extended Advertising Report (0x0d)
        Num reports: 1
        Entry 0
          Event type: 0x001b
            Props: 0x001b
              Connectable
              Scannable
              Scan response
              Use legacy advertising PDUs
            Data status: [0;32mComplete[0m
          Legacy PDU Type: SCAN_RSP to an ADV_SCAN_IND (0x001b)
          Address type: Random (0x01)
          Address: 73:01:16:B1:70:95 (Resolvable)
          Primary PHY: LE 1M
          Secondary PHY: No packets
          SID: no ADI field (0xff)
          TX power: 127 dBm
          RSSI: -84 dBm (0xac)
          Periodic advertising interval: 0.00 msec (0x0000)
          Direct address type: Public (0x00)
          Direct address: 00:00:00:00:00:00 (OUI 00-00-00)
          Data length: 0x00
@ MGMT Event: Device Found (0x0012) plen 31            {0x0002} [hci0] 4.989756
        LE Address: 73:01:16:B1:70:95 (Resolvable)
        RSSI: -84 dBm (0xac)
        Flags: 0x00000000
        Data length: 17
        Flags: 0x1a
          LE General Discoverable Mode
          Simultaneous LE and BR/EDR (Controller)
          Simultaneous LE and BR/EDR (Host)
        TX power: 12 dBm
        Company: Apple, Inc. (76)
          Type: Unknown (16)
          Data: 341c05a669
@ MGMT Event: Device Found (0x0012) plen 31            {0x0001} [hci0] 4.989756
        LE Address: 73:01:16:B1:70:95 (Resolvable)
        RSSI: -84 dBm (0xac)
        Flags: 0x00000000
        Data length: 17
        Flags: 0x1a
          LE General Discoverable Mode
          Simultaneous LE and BR/EDR (Controller)
          Simultaneous LE and BR/EDR (Host)
        TX power: 12 dBm
        Company: Apple, Inc. (76)
          Type: Unknown (16)
          Data: 341c05a669
> HCI Event: LE Meta Event (0x3e) plen 57                   #14 [hci0] 5.005690
      LE Extended Advertising Report (0x0d)
        Num reports: 1
        Entry 0
          Event type: 0x0010
            Props: 0x0010
              Use legacy advertising PDUs
            Data status: [0;32mComplete[0m
          Legacy PDU Type: ADV_NONCONN_IND (0x0010)
          Address type: Random (0x01)
          Address: 58:4B:27:38:45:ED (Resolvable)
          Primary PHY: LE 1M
          Secondary PHY: No packets
          SID: no ADI field (0xff)
          TX power: 127 dBm
          RSSI: -91 dBm (0xa5)
          Periodic advertising interval: 0.00 msec (0x0000)
          Direct address type: Public (0x00)
          Direct address: 00:00:00:00:00:00 (OUI 00-00-00)
          Data length: 0x1f
        1e ff 06 00 01 09 20 02 33 50 05 51 8a af 1b 9c  ...... .3P.Q....
        e3 ff c6 7d ce 04 6d 1e b6 9f 37 c7 5d da 42     ...}..m...7.].B 
        Company: Microsoft (6)
          Data: 01092002335005518aaf1b9ce3ffc67dce046d1eb69f37c75dda42
@ MGMT Event: Device Found (0x0012) plen 45            {0x0002} [hci0] 5.005796
        LE Address: 58:4B:27:38:45:ED (Resolvable)
        RSSI: -91 dBm (0xa5)
        Flags: 0x00000004
          Not Connectable
        Data length: 31
        Company: Microsoft (6)
          Data: 01092002335005518aaf1b9ce3ffc67dce046d1eb69f37c75dda42
@ MGMT Event: Device Found (0x0012) plen 45            {0x0001} [hci0] 5.005796
        LE Address: 58:4B:27:38:45:ED (Resolvable)
        RSSI: -91 dBm (0xa5)
        Flags: 0x00000004
          Not Connectable
        Data length: 31
        Company: Microsoft (6)
          Data: 01092002335005518aaf1b9ce3ffc67dce046d1eb69f37c75dda42
bluetoothctl[2953477]: @ MGMT Close: bluetoothctl            {0x0002} 13.035641
bluetoothd[2915165]: @ MGMT Comman.. (0x0024) plen 1  {0x0001} [hci0] 13.043081
        Address type: 0x07
          BR/EDR
          LE Public
          LE Random
< HCI Command: Inquiry Cancel (0x01|0x0002) plen 0         #15 [hci0] 13.043127
bluetoothctl[2954417]: @ MGMT O..n (privileged) version 1.23  {0x0002} 13.048649
> HCI Event: Command Complete (0x0e) plen 4                #16 [hci0] 13.137819
      Inquiry Cancel (0x01|0x0002) ncmd 1
        Status: Success (0x00)
< HCI Command: LE Set Extended Sca.. (0x08|0x0042) plen 6  #17 [hci0] 13.138221
        Extended scan: Disabled (0x00)
        Filter duplicates: Disabled (0x00)
        Duration: 0 msec (0x0000)
        Period: 0.00 sec (0x0000)
> HCI Event: Command Complete (0x0e) plen 4                #18 [hci0] 13.150792
      LE Set Extended Scan Enable (0x08|0x0042) ncmd 1
        Status: Success (0x00)
@ MGMT Event: Discovering (0x0013) plen 2             {0x0002} [hci0] 13.150830
        Address type: 0x07
          BR/EDR
          LE Public
          LE Random
        Discovery: Disabled (0x00)
@ MGMT Event: Discovering (0x0013) plen 2             {0x0001} [hci0] 13.150830
        Address type: 0x07
          BR/EDR
          LE Public
          LE Random
        Discovery: Disabled (0x00)
@ MGMT Event: Command Complete (0x0001) plen 4        {0x0001} [hci0] 13.150997
      Stop Discovery (0x0024) plen 1
        Status: Success (0x00)
        Address type: 0x07
          BR/EDR
          LE Public
          LE Random
bluetoothd[2915165]: @ MGMT Comman.. (0x003a) plen 4  {0x0001} [hci0] 13.153158
        Address type: 0x01
          BR/EDR
        RSSI: invalid (0x7f)
        UUIDs: 0
< HCI Command: Inquiry (0x01|0x0001) plen 5                #19 [hci0] 13.153363
        Access code: 0x9e8b33 (General Inquiry)
        Length: 10.24s (0x08)
        Num responses: 0
> HCI Event: Command Status (0x0f) plen 4                  #20 [hci0] 13.154714
      Inquiry (0x01|0x0001) ncmd 1
        Status: Success (0x00)
@ MGMT Event: Command Complete (0x0001) plen 4        {0x0001} [hci0] 13.155017
      Start Service Discovery (0x003a) plen 1
        Status: Success (0x00)
        Address type: 0x01
          BR/EDR
@ MGMT Event: Discovering (0x0013) plen 2             {0x0002} [hci0] 13.155027
        Address type: 0x01
          BR/EDR
        Discovery: Enabled (0x01)
@ MGMT Event: Discovering (0x0013) plen 2             {0x0001} [hci0] 13.155027
        Address type: 0x01
          BR/EDR
        Discovery: Enabled (0x01)
bluetoothctl[2954417]: @ MGMT Close: bluetoothctl            {0x0002} 21.061175
bluetoothctl[2955146]: @ MGMT O..n (privileged) version 1.23  {0x0002} 21.077893
> HCI Event: Inquiry Complete (0x01) plen 1                #21 [hci0] 23.457876
        Status: Success (0x00)
@ MGMT Event: Discovering (0x0013) plen 2             {0x0002} [hci0] 23.458061
        Address type: 0x01
          BR/EDR
        Discovery: Disabled (0x00)
@ MGMT Event: Discovering (0x0013) plen 2             {0x0001} [hci0] 23.458061
        Address type: 0x01
          BR/EDR
        Discovery: Disabled (0x00)
bluetoothd[2915165]: @ MGMT Comman.. (0x003a) plen 4  {0x0001} [hci0] 23.458301
        Address type: 0x01
          BR/EDR
        RSSI: invalid (0x7f)
        UUIDs: 0
< HCI Command: Inquiry (0x01|0x0001) plen 5                #22 [hci0] 23.458459
        Access code: 0x9e8b33 (General Inquiry)
        Length: 10.24s (0x08)
        Num responses: 0
> HCI Event: Command Status (0x0f) plen 4                  #23 [hci0] 23.459858
      Inquiry (0x01|0x0001) ncmd 1
        Status: Success (0x00)
@ MGMT Event: Command Complete (0x0001) plen 4        {0x0001} [hci0] 23.460037
      Start Service Discovery (0x003a) plen 1
        Status: Success (0x00)
        Address type: 0x01
          BR/EDR
@ MGMT Event: Discovering (0x0013) plen 2             {0x0002} [hci0] 23.460041
        Address type: 0x01
          BR/EDR
        Discovery: Enabled (0x01)
@ MGMT Event: Discovering (0x0013) plen 2             {0x0001} [hci0] 23.460041
        Address type: 0x01
          BR/EDR
        Discovery: Enabled (0x01)
bluetoothctl[2955146]: @ MGMT Close: bluetoothctl            {0x0002} 29.083575
bluetoothctl[2955875]: @ MGMT O..n (privileged) version 1.23  {0x0002} 29.101639
> HCI Event: Inquiry Complete (0x01) plen 1                #24 [hci0] 33.763018
        Status: Success (0x00)
@ MGMT Event: Discovering (0x0013) plen 2             {0x0002} [hci0] 33.763119
        Address type: 0x01
          BR/EDR
        Discovery: Disabled (0x00)
@ MGMT Event: Discovering (0x0013) plen 2             {0x0001} [hci0] 33.763119
        Address type: 0x01
          BR/EDR
        Discovery: Disabled (0x00)
< HCI Command: LE Add Device To Ac.. (0x08|0x0011) plen 7  #25 [hci0] 33.763236
        Address type: Random (0x01)
        Address: C0:DE:54:15:00:61 (Static)
bluetoothd[2915165]: @ MGMT Comman.. (0x003a) plen 4  {0x0001} [hci0] 33.763338
        Address type: 0x01
          BR/EDR
        RSSI: invalid (0x7f)
        UUIDs: 0
> HCI Event: Command Complete (0x0e) plen 4                #26 [hci0] 33.764012
      LE Add Device To Accept List (0x08|0x0011) ncmd 1
        Status: Success (0x00)
< HCI Command: LE Set Address Reso.. (0x08|0x002d) plen 1  #27 [hci0] 33.764330
        Address resolution: Enabled (0x01)
> HCI Event: Command Complete (0x0e) plen 4                #28 [hci0] 33.765013
      LE Set Address Resolution Enable (0x08|0x002d) ncmd 1
        Status: Success (0x00)
< HCI Command: LE Set Extended Sc.. (0x08|0x0041) plen 13  #29 [hci0] 33.765334
        Own address type: Public (0x00)
        Filter policy: Ignore not in accept list (0x01)
        PHYs: 0x05
        Entry 0: LE 1M
          Type: Passive (0x00)
          Interval: 60.000 msec (0x0060)
          Window: 60.000 msec (0x0060)
        Entry 1: LE Coded
          Type: Passive (0x00)
          Interval: 180.000 msec (0x0120)
          Window: 180.000 msec (0x0120)
> HCI Event: Command Complete (0x0e) plen 4                #30 [hci0] 33.766197
      LE Set Extended Scan Parameters (0x08|0x0041) ncmd 1
        Status: Success (0x00)
< HCI Command: LE Set Extended Sca.. (0x08|0x0042) plen 6  #31 [hci0] 33.766498
        Extended scan: Enabled (0x01)
        Filter duplicates: Enabled (0x01)
        Duration: 0 msec (0x0000)
        Period: 0.00 sec (0x0000)
> HCI Event: Command Complete (0x0e) plen 4                #32 [hci0] 33.767013
      LE Set Extended Scan Enable (0x08|0x0042) ncmd 1
        Status: Success (0x00)
< HCI Command: Inquiry (0x01|0x0001) plen 5                #33 [hci0] 33.767287
        Access code: 0x9e8b33 (General Inquiry)
        Length: 10.24s (0x08)
        Num responses: 0
> HCI Event: Command Status (0x0f) plen 4                  #34 [hci0] 33.840132
      Inquiry (0x01|0x0001) ncmd 1
        Status: Success (0x00)
@ MGMT Event: Command Complete (0x0001) plen 4        {0x0001} [hci0] 33.840365
      Start Service Discovery (0x003a) plen 1
        Status: Success (0x00)
        Address type: 0x01
          BR/EDR
@ MGMT Event: Discovering (0x0013) plen 2             {0x0002} [hci0] 33.840380
        Address type: 0x01
          BR/EDR
        Discovery: Enabled (0x01)
@ MGMT Event: Discovering (0x0013) plen 2             {0x0001} [hci0] 33.840380
        Address type: 0x01
          BR/EDR
        Discovery: Enabled (0x01)
> HCI Event: LE Meta Event (0x3e) plen 39                  #35 [hci0] 34.670150
      LE Extended Advertising Report (0x0d)
        Num reports: 1
        Entry 0
          Event type: 0x0013
            Props: 0x0013
              Connectable
              Scannable
              Use legacy advertising PDUs
            Data status: [0;32mComplete[0m
          Legacy PDU Type: ADV_IND (0x0013)
          Address type: Random (0x01)
          Address: C0:DE:54:15:00:61 (Static)
          Primary PHY: LE 1M
          Secondary PHY: No packets
          SID: no ADI field (0xff)
          TX power: 127 dBm
          RSSI: -75 dBm (0xb5)
          Periodic advertising interval: 0.00 msec (0x0000)
          Direct address type: Public (0x00)
          Direct address: 00:00:00:00:00:00 (OUI 00-00-00)
          Data length: 0x0d
        02 01 06 09 09 58 35 34 2d 42 4f 4e 44           .....X54-BOND   
        Flags: 0x06
          LE General Discoverable Mode
          BR/EDR Not Supported
        Name (complete): X54-BOND
< HCI Command: LE Set Extended Sca.. (0x08|0x0042) plen 6  #36 [hci0] 34.670432
        Extended scan: Disabled (0x00)
        Filter duplicates: Disabled (0x00)
        Duration: 0 msec (0x0000)
        Period: 0.00 sec (0x0000)
> HCI Event: Command Complete (0x0e) plen 4                #37 [hci0] 34.671122
      LE Set Extended Scan Enable (0x08|0x0042) ncmd 1
        Status: Success (0x00)
< HCI Command: LE Extended Create.. (0x08|0x0043) plen 26  #38 [hci0] 34.671503
        Filter policy: Accept list is not used (0x00)
        Own address type: Public (0x00)
        Peer address type: Random (0x01)
        Peer address: C0:DE:54:15:00:61 (Static)
        Initiating PHYs: 0x01
        Entry 0: LE 1M
          Scan interval: 60.000 msec (0x0060)
          Scan window: 60.000 msec (0x0060)
          Min connection interval: 30.00 msec (0x0018)
          Max connection interval: 50.00 msec (0x0028)
          Connection latency: 0 (0x0000)
          Supervision timeout: 420 msec (0x002a)
          Min connection length: 0.000 msec (0x0000)
          Max connection length: 0.000 msec (0x0000)
> HCI Event: Command Status (0x0f) plen 4                  #39 [hci0] 34.673020
      LE Extended Create Connection (0x08|0x0043) ncmd 1
        Status: Success (0x00)
> HCI Event: LE Meta Event (0x3e) plen 31                  #40 [hci0] 34.969129
      LE Enhanced Connection Complete (0x0a)
        Status: Success (0x00)
        Handle: 2048
        Role: Central (0x00)
        Peer address type: Random (0x01)
        Peer address: C0:DE:54:15:00:61 (Static)
        Local resolvable private address: 00:00:00:00:00:00 (Non-Resolvable)
        Peer resolvable private address: 00:00:00:00:00:00 (Non-Resolvable)
        Connection interval: 45.00 msec (0x0024)
        Connection latency: 0 (0x0000)
        Supervision timeout: 420 msec (0x002a)
        Central clock accuracy: 0x00
@ MGMT Event: Device Connected (0x000b) plen 26       {0x0002} [hci0] 34.969236
        LE Address: C0:DE:54:15:00:61 (Static)
        Flags: 0x00000008
          Connection Locally Initiated
        Data length: 13
        Flags: 0x06
          LE General Discoverable Mode
          BR/EDR Not Supported
        Name (complete): X54-BOND
@ MGMT Event: Device Connected (0x000b) plen 26       {0x0001} [hci0] 34.969236
        LE Address: C0:DE:54:15:00:61 (Static)
        Flags: 0x00000008
          Connection Locally Initiated
        Data length: 13
        Flags: 0x06
          LE General Discoverable Mode
          BR/EDR Not Supported
        Name (complete): X54-BOND
btmon[2953291]: @ RAW Open: btmon (privileged) version 2.22  {0x0003} 34.969466
btmon[2953291]: @ RAW Close: btmon                           {0x0003} 34.969470
> HCI Event: LE Meta Event (0x3e) plen 4                   #41 [hci0] 34.970132
      LE Channel Selection Algorithm (0x14)
        Handle: 2048 Address: C0:DE:54:15:00:61 (Static)
        Algorithm: #2 (0x01)
< HCI Command: LE Read Remote Used.. (0x08|0x0016) plen 2  #42 [hci0] 34.975822
        Handle: 2048 Address: C0:DE:54:15:00:61 (Static)
> HCI Event: Command Status (0x0f) plen 4                  #43 [hci0] 34.977112
      LE Read Remote Used Features (0x08|0x0016) ncmd 1
        Status: Success (0x00)
> HCI Event: LE Meta Event (0x3e) plen 12                  #44 [hci0] 35.101114
      LE Read Remote Used Features (0x04)
        Status: Success (0x00)
        Handle: 2048 Address: C0:DE:54:15:00:61 (Static)
        Features: 0x1f 0x00 0x00 0x00 0x00 0x00 0x00 0x00
          LE Encryption
          Connection Parameter Request Procedure
          Extended Reject Indication
          Peripheral-initiated Features Exchange
          LE Ping
bluetoothd[2915165]: < ACL Data TX: H.. flags 0x00 dlen 7  #45 [hci0] 35.101406
      ATT: Exchange MTU Request (0x02) len 2
        Client RX MTU: 517
> HCI Event: Number of Completed Packets (0x13) plen 5     #46 [hci0] 35.236116
        Num handles: 1
        Handle: 2048 Address: C0:DE:54:15:00:61 (Static)
        Count: 1
        #45: len 7 (0 Kb/s)
        Latency: 134 msec (134-134 msec ~134 msec)
> ACL Data RX: Handle 2048 flags 0x02 dlen 7               #47 [hci0] 35.281833
      ATT: Exchange MTU Response (0x03) len 2
        Server RX MTU: 23
bluetoothd[2915165]: < ACL Data TX:... flags 0x00 dlen 11  #48 [hci0] 35.282121
      ATT: Read By Type Request (0x08) len 6
        Handle range: 0x0001-0xffff
        Attribute type: Server Supported Features (0x2b3a)
> HCI Event: Number of Completed Packets (0x13) plen 5     #49 [hci0] 35.326131
        Num handles: 1
        Handle: 2048 Address: C0:DE:54:15:00:61 (Static)
        Count: 1
        #48: len 11 (2 Kb/s)
        Latency: 44 msec (44-134 msec ~89 msec)
> ACL Data RX: Handle 2048 flags 0x02 dlen 9               #50 [hci0] 35.371867
      ATT: Error Response (0x01) len 4
        Read By Type Request (0x08)
        Handle: 0x0001
        Error: Attribute Not Found (0x0a)
bluetoothd[2915165]: < ACL Data TX:... flags 0x00 dlen 11  #51 [hci0] 35.372334
      ATT: Read By Group Type Request (0x10) len 6
        Handle range: 0x0001-0xffff
        Attribute group type: Primary Service (0x2800)
> HCI Event: Number of Completed Packets (0x13) plen 5     #52 [hci0] 35.416158
        Num handles: 1
        Handle: 2048 Address: C0:DE:54:15:00:61 (Static)
        Count: 1
        #51: len 11 (2 Kb/s)
        Latency: 43 msec (43-134 msec ~66 msec)
> ACL Data RX: Handle 2048 flags 0x02 dlen 24              #53 [hci0] 35.461891
      ATT: Read By Group Type Response (0x11) len 19
        Attribute data length: 6
        Attribute group list: 3 entries
        Handle range: 0x0001-0x0007
        UUID: Generic Access Profile (0x1800)
        Handle range: 0x0008-0x000b
        UUID: Generic Attribute Profile (0x1801)
        Handle range: 0x0010-0x0013
        UUID: Battery Service (0x180f)
bluetoothd[2915165]: < ACL Data TX:... flags 0x00 dlen 11  #54 [hci0] 35.462338
      ATT: Read By Group Type Request (0x10) len 6
        Handle range: 0x0014-0xffff
        Attribute group type: Primary Service (0x2800)
> HCI Event: Number of Completed Packets (0x13) plen 5     #55 [hci0] 35.506201
        Num handles: 1
        Handle: 2048 Address: C0:DE:54:15:00:61 (Static)
        Count: 1
        #54: len 11 (2 Kb/s)
        Latency: 43 msec (43-134 msec ~55 msec)
> ACL Data RX: Handle 2048 flags 0x02 dlen 9               #56 [hci0] 35.551847
      ATT: Error Response (0x01) len 4
        Read By Group Type Request (0x10)
        Handle: 0x0014
        Error: Attribute Not Found (0x0a)
bluetoothd[2915165]: < ACL Data TX:... flags 0x00 dlen 11  #57 [hci0] 35.552299
      ATT: Read By Group Type Request (0x10) len 6
        Handle range: 0x0001-0xffff
        Attribute group type: Secondary Service (0x2801)
> HCI Event: Number of Completed Packets (0x13) plen 5     #58 [hci0] 35.596104
        Num handles: 1
        Handle: 2048 Address: C0:DE:54:15:00:61 (Static)
        Count: 1
        #57: len 11 (2 Kb/s)
        Latency: 43 msec (43-134 msec ~49 msec)
> ACL Data RX: Handle 2048 flags 0x02 dlen 9               #59 [hci0] 35.641733
      ATT: Error Response (0x01) len 4
        Read By Group Type Request (0x10)
        Handle: 0x0001
        Error: Unsupported Group Type (0x10)
bluetoothd[2915165]: < ACL Data TX:... flags 0x00 dlen 11  #60 [hci0] 35.641905
      ATT: Read By Type Request (0x08) len 6
        Handle range: 0x0001-0x0013
        Attribute type: Include (0x2802)
> HCI Event: Number of Completed Packets (0x13) plen 5     #61 [hci0] 35.686132
        Num handles: 1
        Handle: 2048 Address: C0:DE:54:15:00:61 (Static)
        Count: 1
        #60: len 11 (2 Kb/s)
        Latency: 44 msec (43-134 msec ~46 msec)
> ACL Data RX: Handle 2048 flags 0x02 dlen 9               #62 [hci0] 35.732734
      ATT: Error Response (0x01) len 4
        Read By Type Request (0x08)
        Handle: 0x0001
        Error: Attribute Not Found (0x0a)
bluetoothd[2915165]: < ACL Data TX:... flags 0x00 dlen 11  #63 [hci0] 35.732844
      ATT: Read By Type Request (0x08) len 6
        Handle range: 0x0001-0x0013
        Attribute type: Characteristic (0x2803)
> HCI Event: Number of Completed Packets (0x13) plen 5     #64 [hci0] 35.776163
        Num handles: 1
        Handle: 2048 Address: C0:DE:54:15:00:61 (Static)
        Count: 1
        #63: len 11 (2 Kb/s)
        Latency: 43 msec (43-134 msec ~45 msec)
> ACL Data RX: Handle 2048 flags 0x02 dlen 27              #65 [hci0] 35.821817
      ATT: Read By Type Response (0x09) len 22
        Attribute data length: 7
        Attribute data list: 3 entries
        Handle: 0x0002
        Value: 020300002a
            Properties: 0x02
              Read (0x02)
            Value Handle: 0x0003
            Value UUID: Device Name (0x2a00)
        Handle: 0x0004
        Value: 020500012a
            Properties: 0x02
              Read (0x02)
            Value Handle: 0x0005
            Value UUID: Appearance (0x2a01)
        Handle: 0x0006
        Value: 020700042a
            Properties: 0x02
              Read (0x02)
            Value Handle: 0x0007
            Value UUID: Peripheral Preferred Connection Parameters (0x2a04)
bluetoothd[2915165]: < ACL Data TX:... flags 0x00 dlen 11  #66 [hci0] 35.822132
      ATT: Read By Type Request (0x08) len 6
        Handle range: 0x0007-0x0013
        Attribute type: Characteristic (0x2803)
> HCI Event: Number of Completed Packets (0x13) plen 5     #67 [hci0] 35.866124
        Num handles: 1
        Handle: 2048 Address: C0:DE:54:15:00:61 (Static)
        Count: 1
        #66: len 11 (2 Kb/s)
        Latency: 43 msec (43-134 msec ~44 msec)
> ACL Data RX: Handle 2048 flags 0x02 dlen 20              #68 [hci0] 35.956808
      ATT: Read By Type Response (0x09) len 15
        Attribute data length: 7
        Attribute data list: 2 entries
        Handle: 0x0009
        Value: 200a00052a
            Properties: 0x20
              Indicate (0x20)
            Value Handle: 0x000a
            Value UUID: Service Changed (0x2a05)
        Handle: 0x0011
        Value: 121200192a
            Properties: 0x12
              Read (0x02)
              Notify (0x10)
            Value Handle: 0x0012
            Value UUID: Battery Level (0x2a19)
bluetoothd[2915165]: < ACL Data TX:... flags 0x00 dlen 11  #69 [hci0] 35.957346
      ATT: Read By Type Request (0x08) len 6
        Handle range: 0x0012-0x0013
        Attribute type: Characteristic (0x2803)
> HCI Event: Number of Completed Packets (0x13) plen 5     #70 [hci0] 36.001153
        Num handles: 1
        Handle: 2048 Address: C0:DE:54:15:00:61 (Static)
        Count: 1
        #69: len 11 (2 Kb/s)
        Latency: 43 msec (43-134 msec ~44 msec)
> ACL Data RX: Handle 2048 flags 0x02 dlen 9               #71 [hci0] 36.046801
      ATT: Error Response (0x01) len 4
        Read By Type Request (0x08)
        Handle: 0x0012
        Error: Attribute Not Found (0x0a)
bluetoothd[2915165]: < ACL Data TX: H.. flags 0x00 dlen 9  #72 [hci0] 36.054759
      ATT: Write Request (0x12) len 4
        Handle: 0x000b Type: Client Characteristic Configuration (0x2902)
        Value Handle: 0x000a Type: Service Changed (0x2a05)
          Data: 0200
            Indication (0x02)
> HCI Event: Number of Completed Packets (0x13) plen 5     #73 [hci0] 36.091141
        Num handles: 1
        Handle: 2048 Address: C0:DE:54:15:00:61 (Static)
        Count: 1
        #72: len 9 (2 Kb/s)
        Latency: 36 msec (36-134 msec ~40 msec)
> ACL Data RX: Handle 2048 flags 0x02 dlen 5               #74 [hci0] 36.136835
      ATT: Write Response (0x13) len 0
bluetoothd[2915165]: < ACL Data TX: H.. flags 0x00 dlen 7  #75 [hci0] 36.137261
      ATT: Read Request (0x0a) len 2
        Handle: 0x0003 Type: Device Name (0x2a00)
> HCI Event: Number of Completed Packets (0x13) plen 5     #76 [hci0] 36.181049
        Num handles: 1
        Handle: 2048 Address: C0:DE:54:15:00:61 (Static)
        Count: 1
        #75: len 7 (1 Kb/s)
        Latency: 43 msec (36-134 msec ~42 msec)
> ACL Data RX: Handle 2048 flags 0x02 dlen 11              #77 [hci0] 36.181728
      ATT: Handle Value Indication (0x1d) len 6
        Handle: 0x000a Type: Service Changed (0x2a05)
          Data: 0100ffff
bluetoothd[2915165]: < ACL Data TX: H.. flags 0x00 dlen 5  #78 [hci0] 36.182157
      ATT: Handle Value Confirmation (0x1e) len 0
> HCI Event: Number of Completed Packets (0x13) plen 5     #79 [hci0] 36.226114
        Num handles: 1
        Handle: 2048 Address: C0:DE:54:15:00:61 (Static)
        Count: 1
        #78: len 5 (0 Kb/s)
        Latency: 43 msec (36-134 msec ~42 msec)
> ACL Data RX: Handle 2048 flags 0x02 dlen 19              #80 [hci0] 36.226736
      ATT: Read Response (0x0b) len 14
bluetoothd[2915165]: < ACL Data TX: H.. flags 0x00 dlen 7  #81 [hci0] 36.227200
      ATT: Read Request (0x0a) len 2
        Handle: 0x0005 Type: Appearance (0x2a01)
> HCI Event: Number of Completed Packets (0x13) plen 5     #82 [hci0] 36.271142
        Num handles: 1
        Handle: 2048 Address: C0:DE:54:15:00:61 (Static)
        Count: 1
        #81: len 7 (1 Kb/s)
        Latency: 43 msec (36-134 msec ~43 msec)
> ACL Data RX: Handle 2048 flags 0x02 dlen 7               #83 [hci0] 36.316834
      ATT: Read Response (0x0b) len 2
bluetoothd[2915165]: < ACL Data TX: H.. flags 0x00 dlen 7  #84 [hci0] 36.317249
      ATT: Read Request (0x0a) len 2
        Handle: 0x0012 Type: Battery Level (0x2a19)
> HCI Event: Number of Completed Packets (0x13) plen 5     #85 [hci0] 36.361124
        Num handles: 1
        Handle: 2048 Address: C0:DE:54:15:00:61 (Static)
        Count: 1
        #84: len 7 (1 Kb/s)
        Latency: 43 msec (36-134 msec ~43 msec)
> ACL Data RX: Handle 2048 flags 0x02 dlen 6               #86 [hci0] 36.406736
      ATT: Read Response (0x0b) len 1
bluetoothd[2915165]: < ACL Data TX:... flags 0x00 dlen 11  #87 [hci0] 36.407288
      ATT: Read By Group Type Request (0x10) len 6
        Handle range: 0x0001-0xffff
        Attribute group type: Primary Service (0x2800)
> HCI Event: Number of Completed Packets (0x13) plen 5     #88 [hci0] 36.451147
        Num handles: 1
        Handle: 2048 Address: C0:DE:54:15:00:61 (Static)
        Count: 1
        #87: len 11 (2 Kb/s)
        Latency: 43 msec (36-134 msec ~43 msec)
> ACL Data RX: Handle 2048 flags 0x02 dlen 24              #89 [hci0] 36.496738
      ATT: Read By Group Type Response (0x11) len 19
        Attribute data length: 6
        Attribute group list: 3 entries
        Handle range: 0x0001-0x0007
        UUID: Generic Access Profile (0x1800)
        Handle range: 0x0008-0x000b
        UUID: Generic Attribute Profile (0x1801)
        Handle range: 0x0010-0x0013
        UUID: Battery Service (0x180f)
bluetoothd[2915165]: < ACL Data TX: H.. flags 0x00 dlen 9  #90 [hci0] 36.497142
      ATT: Write Request (0x12) len 4
        Handle: 0x0013 Type: Client Characteristic Configuration (0x2902)
        Value Handle: 0x0012 Type: Battery Level (0x2a19)
          Data: 0100
            Notification (0x01)
> HCI Event: Number of Completed Packets (0x13) plen 5     #91 [hci0] 36.541139
        Num handles: 1
        Handle: 2048 Address: C0:DE:54:15:00:61 (Static)
        Count: 1
        #90: len 9 (1 Kb/s)
        Latency: 43 msec (36-134 msec ~43 msec)
> ACL Data RX: Handle 2048 flags 0x02 dlen 5               #92 [hci0] 36.586805
      ATT: Write Response (0x13) len 0
bluetoothd[2915165]: < ACL Data TX:... flags 0x00 dlen 11  #93 [hci0] 36.587241
      ATT: Read By Group Type Request (0x10) len 6
        Handle range: 0x0014-0xffff
        Attribute group type: Primary Service (0x2800)
> HCI Event: Number of Completed Packets (0x13) plen 5     #94 [hci0] 36.631141
        Num handles: 1
        Handle: 2048 Address: C0:DE:54:15:00:61 (Static)
        Count: 1
        #93: len 11 (2 Kb/s)
        Latency: 43 msec (36-134 msec ~43 msec)
> ACL Data RX: Handle 2048 flags 0x02 dlen 8               #95 [hci0] 36.631748
      ATT: Handle Value Notification (0x1b) len 3
        Handle: 0x0012 Type: Battery Level (0x2a19)
          Data: 5f
> ACL Data RX: Handle 2048 flags 0x02 dlen 9               #96 [hci0] 36.676789
      ATT: Error Response (0x01) len 4
        Read By Group Type Request (0x10)
        Handle: 0x0014
        Error: Attribute Not Found (0x0a)
bluetoothctl[2955875]: @ MGMT Close: bluetoothctl            {0x0002} 39.110979
bluetoothctl[2956830]: @ MGMT O..n (privileged) version 1.23  {0x0002} 39.119444
bluetoothd[2915165]: @ MGMT Comman.. (0x0024) plen 1  {0x0001} [hci0] 39.127338
        Address type: 0x01
          BR/EDR
< HCI Command: Inquiry Cancel (0x01|0x0002) plen 0         #97 [hci0] 39.127354
> HCI Event: Command Complete (0x0e) plen 4                #98 [hci0] 39.129100
      Inquiry Cancel (0x01|0x0002) ncmd 1
        Status: Success (0x00)
@ MGMT Event: Discovering (0x0013) plen 2             {0x0002} [hci0] 39.129175
        Address type: 0x01
          BR/EDR
        Discovery: Disabled (0x00)
@ MGMT Event: Discovering (0x0013) plen 2             {0x0001} [hci0] 39.129175
        Address type: 0x01
          BR/EDR
        Discovery: Disabled (0x00)
@ MGMT Event: Command Complete (0x0001) plen 4        {0x0001} [hci0] 39.129184
      Stop Discovery (0x0024) plen 1
        Status: Success (0x00)
        Address type: 0x01
          BR/EDR
bluetoothd[2915165]: @ MGMT Comman.. (0x0019) plen 8  {0x0001} [hci0] 39.129380
        LE Address: C0:DE:54:15:00:61 (Static)
        Capability: DisplayYesNo (0x01)
< ACL Data TX: Handle 2048 flags 0x00 dlen 11              #99 [hci0] 39.129406
      SMP: Pairing Request (0x01) len 6
        IO capability: DisplayYesNo (0x01)
        OOB data: Authentication data not present (0x00)
        Authentication requirement: Bonding, MITM, SC, No Keypresses, CT2 (0x2d)
        Max encryption key size: 16
        Initiator key distribution: EncKey Sign LinkKey (0x0d)
        Responder key distribution: EncKey IdKey Sign LinkKey (0x0f)
> HCI Event: Number of Completed Packets (0x13) plen 5    #100 [hci0] 39.151164
        Num handles: 1
        Handle: 2048 Address: C0:DE:54:15:00:61 (Static)
        Count: 1
        #99: len 11 (4 Kb/s)
        Latency: 21 msec (21-134 msec ~32 msec)
> ACL Data RX: Handle 2048 flags 0x02 dlen 11             #101 [hci0] 39.196814
      SMP: Pairing Response (0x02) len 6
        IO capability: NoInputNoOutput (0x03)
        OOB data: Authentication data not present (0x00)
        Authentication requirement: Bonding, No MITM, Legacy, No Keypresses (0x01)
        Max encryption key size: 16
        Initiator key distribution: EncKey (0x01)
        Responder key distribution: <none> (0x00)
@ MGMT Event: User Confirmation R.. (0x000f) plen 12  {0x0002} [hci0] 39.196831
        LE Address: C0:DE:54:15:00:61 (Static)
        Confirm hint: 0x01
        Value: 0x00000000
@ MGMT Event: User Confirmation R.. (0x000f) plen 12  {0x0001} [hci0] 39.196831
        LE Address: C0:DE:54:15:00:61 (Static)
        Confirm hint: 0x01
        Value: 0x00000000
bluetoothd[2915165]: @ MGMT Comman.. (0x001c) plen 7  {0x0001} [hci0] 39.196910
        LE Address: C0:DE:54:15:00:61 (Static)
@ MGMT Event: Command Complete (0x0001) plen 10       {0x0001} [hci0] 39.196921
      User Confirmation Reply (0x001c) plen 7
        Status: Success (0x00)
        LE Address: C0:DE:54:15:00:61 (Static)
< ACL Data TX: Handle 2048 flags 0x00 dlen 21             #102 [hci0] 39.196922
      SMP: Pairing Confirm (0x03) len 16
        Confim value: f2a9b063fec5aa0db70a27215bb013e9
> HCI Event: Number of Completed Packets (0x13) plen 5    #103 [hci0] 39.241172
        Num handles: 1
        Handle: 2048 Address: C0:DE:54:15:00:61 (Static)
        Count: 1
        #102: len 21 (3 Kb/s)
        Latency: 44 msec (21-134 msec ~38 msec)
> ACL Data RX: Handle 2048 flags 0x02 dlen 21             #104 [hci0] 39.331800
      SMP: Pairing Confirm (0x03) len 16
        Confim value: cfcca920b322be821a153c8dd224b30b
< ACL Data TX: Handle 2048 flags 0x00 dlen 21             #105 [hci0] 39.331960
      SMP: Pairing Random (0x04) len 16
        Random value: ae09dfb9f0fce57a0cc7728e6df2aa05
> HCI Event: Number of Completed Packets (0x13) plen 5    #106 [hci0] 39.376174
        Num handles: 1
        Handle: 2048 Address: C0:DE:54:15:00:61 (Static)
        Count: 1
        #105: len 21 (3 Kb/s)
        Latency: 44 msec (21-134 msec ~41 msec)
> ACL Data RX: Handle 2048 flags 0x02 dlen 21             #107 [hci0] 39.421875
      SMP: Pairing Random (0x04) len 16
        Random value: 7d9d4212b56e66c8851e7de4f62398d7
< HCI Command: LE Start Encryption (0x08|0x0019) plen 28  #108 [hci0] 39.421885
        Handle: 2048 Address: C0:DE:54:15:00:61 (Static)
        Random number: 0x0000000000000000
        Encrypted diversifier: 0x0000
        Long term key: 338858a90007e6049b72fb956a89da09
> HCI Event: Command Status (0x0f) plen 4                 #109 [hci0] 39.423177
      LE Start Encryption (0x08|0x0019) ncmd 1
        Status: Success (0x00)
> HCI Event: Encryption Change (0x08) plen 4              #110 [hci0] 39.781183
        Status: Connection Terminated due to MIC Failure (0x3d)
        Handle: 2048 Address: C0:DE:54:15:00:61 (Static)
        Encryption: Disabled (0x00)
@ MGMT Event: Command Complete (0x0001) plen 10       {0x0001} [hci0] 39.781209
      Pair Device (0x0019) plen 7
        Status: Authentication Failed (0x05)
        LE Address: C0:DE:54:15:00:61 (Static)
< HCI Command: Disconnect (0x01|0x0006) plen 3            #111 [hci0] 39.781345
        Handle: 2048 Address: C0:DE:54:15:00:61 (Static)
        Reason: Authentication Failure (0x05)
> HCI Event: Disconnect Complete (0x05) plen 4            #112 [hci0] 39.782101
        Status: Success (0x00)
        Handle: 2048 Address: C0:DE:54:15:00:61 (Static)
        Reason: Connection Terminated due to MIC Failure (0x3d)
@ MGMT Event: Device Disconnected (0x000c) plen 8     {0x0002} [hci0] 39.782190
        LE Address: C0:DE:54:15:00:61 (Static)
        Reason: Unspecified (0x00)
@ MGMT Event: Device Disconnected (0x000c) plen 8     {0x0001} [hci0] 39.782190
        LE Address: C0:DE:54:15:00:61 (Static)
        Reason: Unspecified (0x00)
> HCI Event: Command Status (0x0f) plen 4                 #113 [hci0] 39.783101
      Disconnect (0x01|0x0006) ncmd 1
        Status: Unknown Connection Identifier (0x02)
bluetoothd[2915165]: @ MGMT Comman.. (0x003a) plen 4  {0x0001} [hci0] 44.725858
        Address type: 0x01
          BR/EDR
        RSSI: invalid (0x7f)
        UUIDs: 0
< HCI Command: Inquiry (0x01|0x0001) plen 5               #114 [hci0] 44.726078
        Access code: 0x9e8b33 (General Inquiry)
        Length: 10.24s (0x08)
        Num responses: 0
> HCI Event: Command Status (0x0f) plen 4                 #115 [hci0] 44.820279
      Inquiry (0x01|0x0001) ncmd 1
        Status: Success (0x00)
@ MGMT Event: Command Complete (0x0001) plen 4        {0x0001} [hci0] 44.820393
      Start Service Discovery (0x003a) plen 1
        Status: Success (0x00)
        Address type: 0x01
          BR/EDR
@ MGMT Event: Discovering (0x0013) plen 2             {0x0002} [hci0] 44.820402
        Address type: 0x01
          BR/EDR
        Discovery: Enabled (0x01)
@ MGMT Event: Discovering (0x0013) plen 2             {0x0001} [hci0] 44.820402
        Address type: 0x01
          BR/EDR
        Discovery: Enabled (0x01)
> HCI Event: Inquiry Complete (0x01) plen 1               #116 [hci0] 55.125350
        Status: Success (0x00)
@ MGMT Event: Discovering (0x0013) plen 2             {0x0002} [hci0] 55.125467
        Address type: 0x01
          BR/EDR
        Discovery: Disabled (0x00)
@ MGMT Event: Discovering (0x0013) plen 2             {0x0001} [hci0] 55.125467
        Address type: 0x01
          BR/EDR
        Discovery: Disabled (0x00)
bluetoothd[2915165]: @ MGMT Comman.. (0x003a) plen 4  {0x0001} [hci0] 55.125713
        Address type: 0x01
          BR/EDR
        RSSI: invalid (0x7f)
        UUIDs: 0
< HCI Command: Inquiry (0x01|0x0001) plen 5               #117 [hci0] 55.125979
        Access code: 0x9e8b33 (General Inquiry)
        Length: 10.24s (0x08)
        Num responses: 0
> HCI Event: Command Status (0x0f) plen 4                 #118 [hci0] 55.127405
      Inquiry (0x01|0x0001) ncmd 1
        Status: Success (0x00)
@ MGMT Event: Command Complete (0x0001) plen 4        {0x0001} [hci0] 55.127668
      Start Service Discovery (0x003a) plen 1
        Status: Success (0x00)
        Address type: 0x01
          BR/EDR
@ MGMT Event: Discovering (0x0013) plen 2             {0x0002} [hci0] 55.127678
        Address type: 0x01
          BR/EDR
        Discovery: Enabled (0x01)
@ MGMT Event: Discovering (0x0013) plen 2             {0x0001} [hci0] 55.127678
        Address type: 0x01
          BR/EDR
        Discovery: Enabled (0x01)
bluetoothctl[2956830]: @ MGMT Close: bluetoothctl            {0x0002} 59.131364
bluetoothctl[2958637]: @ MGMT O..n (privileged) version 1.23  {0x0002} 59.147876
> HCI Event: Inquiry Complete (0x01) plen 1               #119 [hci0] 65.430592
        Status: Success (0x00)
@ MGMT Event: Discovering (0x0013) plen 2             {0x0002} [hci0] 65.430755
        Address type: 0x01
          BR/EDR
        Discovery: Disabled (0x00)
@ MGMT Event: Discovering (0x0013) plen 2             {0x0001} [hci0] 65.430755
        Address type: 0x01
          BR/EDR
        Discovery: Disabled (0x00)
bluetoothd[2915165]: @ MGMT Comman.. (0x003a) plen 4  {0x0001} [hci0] 65.430981
        Address type: 0x01
          BR/EDR
        RSSI: invalid (0x7f)
        UUIDs: 0
< HCI Command: Inquiry (0x01|0x0001) plen 5               #120 [hci0] 65.431132
        Access code: 0x9e8b33 (General Inquiry)
        Length: 10.24s (0x08)
        Num responses: 0
> HCI Event: Command Status (0x0f) plen 4                 #121 [hci0] 65.432495
      Inquiry (0x01|0x0001) ncmd 1
        Status: Success (0x00)
@ MGMT Event: Command Complete (0x0001) plen 4        {0x0001} [hci0] 65.432647
      Start Service Discovery (0x003a) plen 1
        Status: Success (0x00)
        Address type: 0x01
          BR/EDR
@ MGMT Event: Discovering (0x0013) plen 2             {0x0002} [hci0] 65.432650
        Address type: 0x01
          BR/EDR
        Discovery: Enabled (0x01)
@ MGMT Event: Discovering (0x0013) plen 2             {0x0001} [hci0] 65.432650
        Address type: 0x01
          BR/EDR
        Discovery: Enabled (0x01)
bluetoothctl[2958637]: @ MGMT Close: bluetoothctl            {0x0002} 67.153765
bluetoothctl[2959367]: @ MGMT O..n (privileged) version 1.23  {0x0002} 67.170623
bluetoothctl[2959367]: @ MGMT Close: bluetoothctl            {0x0002} 75.185039
> HCI Event: Inquiry Complete (0x01) plen 1               #122 [hci0] 75.736671
        Status: Success (0x00)
@ MGMT Event: Discovering (0x0013) plen 2             {0x0001} [hci0] 75.736709
        Address type: 0x01
          BR/EDR
        Discovery: Disabled (0x00)
bluetoothd[2915165]: @ MGMT Comman.. (0x003a) plen 4  {0x0001} [hci0] 75.736985
        Address type: 0x01
          BR/EDR
        RSSI: invalid (0x7f)
        UUIDs: 0
< HCI Command: Inquiry (0x01|0x0001) plen 5               #123 [hci0] 75.737019
        Access code: 0x9e8b33 (General Inquiry)
        Length: 10.24s (0x08)
        Num responses: 0
> HCI Event: Command Status (0x0f) plen 4                 #124 [hci0] 75.737657
      Inquiry (0x01|0x0001) ncmd 1
        Status: Success (0x00)
@ MGMT Event: Command Complete (0x0001) plen 4        {0x0001} [hci0] 75.737830
      Start Service Discovery (0x003a) plen 1
        Status: Success (0x00)
        Address type: 0x01
          BR/EDR
@ MGMT Event: Discovering (0x0013) plen 2             {0x0001} [hci0] 75.737845
        Address type: 0x01
          BR/EDR
        Discovery: Enabled (0x01)
