Bluetooth monitor ver 5.72
btmon[2964384]: = Note: Linux version 6.17.0-14-generic (x86_64)       0.775479
btmon[2964384]: = Note: Bluetooth subsystem version 2.22               0.775480
= New Index: 68:34:21:E5:84:DF (Primary,USB,hci0)               [hci0] 0.775481
= Open Index: 68:34:21:E5:84:DF                                 [hci0] 0.775481
= Index Info: 68:34:21:E5:84:DF (Intel Corp.)                   [hci0] 0.775481
bluetoothd[2915165]: @ MGMT Open.. (privileged) version 1.23  {0x0001} 0.775482
bluetoothctl[2964619]: @ MGMT Op.. (privileged) version 1.23  {0x0002} 2.783030
bluetoothctl[2964619]: @ MGMT Close: bluetoothctl             {0x0002} 2.788714
bluetoothctl[2964622]: @ MGMT Op.. (privileged) version 1.23  {0x0002} 2.797840
bluetoothd[2915165]: @ MGMT Command.. (0x001b) plen 8  {0x0001} [hci0] 2.825915
        LE Address: C0:DE:54:15:00:51 (Static)
        Disconnect: Enabled (0x01)
@ MGMT Event: Command Complete (0x0001) plen 10        {0x0001} [hci0] 2.825926
      Unpair Device (0x001b) plen 7
        Status: Success (0x00)
        LE Address: C0:DE:54:15:00:51 (Static)
@ MGMT Event: Device Unpaired (0x0016) plen 7          {0x0002} [hci0] 2.825927
        LE Address: C0:DE:54:15:00:51 (Static)
bluetoothd[2915165]: @ MGMT Command.. (0x0024) plen 1  {0x0001} [hci0] 2.836046
        Address type: 0x01
          BR/EDR
< HCI Command: Inquiry Cancel (0x01|0x0002) plen 0           #1 [hci0] 2.836065
> HCI Event: Command Complete (0x0e) plen 4                  #2 [hci0] 2.930438
      Inquiry Cancel (0x01|0x0002) ncmd 1
        Status: Success (0x00)
@ MGMT Event: Discovering (0x0013) plen 2              {0x0002} [hci0] 2.930545
        Address type: 0x01
          BR/EDR
        Discovery: Disabled (0x00)
@ MGMT Event: Discovering (0x0013) plen 2              {0x0001} [hci0] 2.930545
        Address type: 0x01
          BR/EDR
        Discovery: Disabled (0x00)
@ MGMT Event: Command Complete (0x0001) plen 4         {0x0001} [hci0] 2.930680
      Stop Discovery (0x0024) plen 1
        Status: Success (0x00)
        Address type: 0x01
          BR/EDR
bluetoothd[2915165]: @ MGMT Command.. (0x003a) plen 4  {0x0001} [hci0] 2.930870
        Address type: 0x07
          BR/EDR
          LE Public
          LE Random
        RSSI: invalid (0x7f)
        UUIDs: 0
< HCI Command: LE Set Address Resolu.. (0x08|0x002d) plen 1  #3 [hci0] 2.930964
        Address resolution: Disabled (0x00)
> HCI Event: Command Complete (0x0e) plen 4                  #4 [hci0] 2.931424
      LE Set Address Resolution Enable (0x08|0x002d) ncmd 1
        Status: Success (0x00)
< HCI Command: LE Set Random Address (0x08|0x0005) plen 6    #5 [hci0] 2.931444
        Address: 3C:BD:2D:7D:82:0B (Non-Resolvable)
> HCI Event: Command Complete (0x0e) plen 4                  #6 [hci0] 2.932423
      LE Set Random Address (0x08|0x0005) ncmd 1
        Status: Success (0x00)
< HCI Command: LE Set Extended Scan.. (0x08|0x0041) plen 13  #7 [hci0] 2.932441
        Own address type: Random (0x01)
        Filter policy: Accept all advertisement (0x00)
        PHYs: 0x05
        Entry 0: LE 1M
          Type: Active (0x01)
          Interval: 22.500 msec (0x0024)
          Window: 11.250 msec (0x0012)
        Entry 1: LE Coded
          Type: Active (0x01)
          Interval: 67.500 msec (0x006c)
          Window: 33.750 msec (0x0036)
> HCI Event: Command Complete (0x0e) plen 4                  #8 [hci0] 2.933423
      LE Set Extended Scan Parameters (0x08|0x0041) ncmd 1
        Status: Success (0x00)
< HCI Command: LE Set Extended Scan... (0x08|0x0042) plen 6  #9 [hci0] 2.933542
        Extended scan: Enabled (0x01)
        Filter duplicates: Disabled (0x00)
        Duration: 0 msec (0x0000)
        Period: 0.00 sec (0x0000)
> HCI Event: Command Complete (0x0e) plen 4                 #10 [hci0] 2.934422
      LE Set Extended Scan Enable (0x08|0x0042) ncmd 1
        Status: Success (0x00)
@ MGMT Event: Discovering (0x0013) plen 2              {0x0002} [hci0] 2.934430
        Address type: 0x07
          BR/EDR
          LE Public
          LE Random
        Discovery: Enabled (0x01)
@ MGMT Event: Discovering (0x0013) plen 2              {0x0001} [hci0] 2.934430
        Address type: 0x07
          BR/EDR
          LE Public
          LE Random
        Discovery: Enabled (0x01)
< HCI Command: Inquiry (0x01|0x0001) plen 5                 #11 [hci0] 2.934547
        Access code: 0x9e8b33 (General Inquiry)
        Length: 10.24s (0x08)
        Num responses: 0
> HCI Event: Command Status (0x0f) plen 4                   #12 [hci0] 2.937422
      Inquiry (0x01|0x0001) ncmd 1
        Status: Success (0x00)
@ MGMT Event: Command Complete (0x0001) plen 4         {0x0001} [hci0] 2.937520
      Start Service Discovery (0x003a) plen 1
        Status: Success (0x00)
        Address type: 0x07
          BR/EDR
          LE Public
          LE Random
> HCI Event: LE Meta Event (0x3e) plen 57                   #13 [hci0] 3.073554
      LE Extended Advertising Report (0x0d)
        Num reports: 1
        Entry 0
          Event type: 0x0010
            Props: 0x0010
              Use legacy advertising PDUs
            Data status: [0;32mComplete[0m
          Legacy PDU Type: ADV_NONCONN_IND (0x0010)
          Address type: Random (0x01)
          Address: 58:4B:27:38:45:ED (Resolvable)
          Primary PHY: LE 1M
          Secondary PHY: No packets
          SID: no ADI field (0xff)
          TX power: 127 dBm
          RSSI: -89 dBm (0xa7)
          Periodic advertising interval: 0.00 msec (0x0000)
          Direct address type: Public (0x00)
          Direct address: 00:00:00:00:00:00 (OUI 00-00-00)
          Data length: 0x1f
        1e ff 06 00 01 09 20 02 33 50 05 51 8a af 1b 9c  ...... .3P.Q....
        e3 ff c6 7d ce 04 6d 1e b6 9f 37 c7 5d da 42     ...}..m...7.].B 
        Company: Microsoft (6)
          Data: 01092002335005518aaf1b9ce3ffc67dce046d1eb69f37c75dda42
@ MGMT Event: Device Found (0x0012) plen 45            {0x0002} [hci0] 3.073653
        LE Address: 58:4B:27:38:45:ED (Resolvable)
        RSSI: -89 dBm (0xa7)
        Flags: 0x00000004
          Not Connectable
        Data length: 31
        Company: Microsoft (6)
          Data: 01092002335005518aaf1b9ce3ffc67dce046d1eb69f37c75dda42
@ MGMT Event: Device Found (0x0012) plen 45            {0x0001} [hci0] 3.073653
        LE Address: 58:4B:27:38:45:ED (Resolvable)
        RSSI: -89 dBm (0xa7)
        Flags: 0x00000004
          Not Connectable
        Data length: 31
        Company: Microsoft (6)
          Data: 01092002335005518aaf1b9ce3ffc67dce046d1eb69f37c75dda42
> HCI Event: LE Meta Event (0x3e) plen 57                   #14 [hci0] 3.493559
      LE Extended Advertising Report (0x0d)
        Num reports: 1
        Entry 0
          Event type: 0x0010
            Props: 0x0010
              Use legacy advertising PDUs
            Data status: [0;32mComplete[0m
          Legacy PDU Type: ADV_NONCONN_IND (0x0010)
          Address type: Random (0x01)
          Address: 58:4B:27:38:45:ED (Resolvable)
          Primary PHY: LE 1M
          Secondary PHY: No packets
          SID: no ADI field (0xff)
          TX power: 127 dBm
          RSSI: -87 dBm (0xa9)
          Periodic advertising interval: 0.00 msec (0x0000)
          Direct address type: Public (0x00)
          Direct address: 00:00:00:00:00:00 (OUI 00-00-00)
          Data length: 0x1f
        1e ff 06 00 01 09 20 02 33 50 05 51 8a af 1b 9c  ...... .3P.Q....
        e3 ff c6 7d ce 04 6d 1e b6 9f 37 c7 5d da 42     ...}..m...7.].B 
        Company: Microsoft (6)
          Data: 01092002335005518aaf1b9ce3ffc67dce046d1eb69f37c75dda42
@ MGMT Event: Device Found (0x0012) plen 45            {0x0002} [hci0] 3.493677
        LE Address: 58:4B:27:38:45:ED (Resolvable)
        RSSI: -87 dBm (0xa9)
        Flags: 0x00000004
          Not Connectable
        Data length: 31
        Company: Microsoft (6)
          Data: 01092002335005518aaf1b9ce3ffc67dce046d1eb69f37c75dda42
@ MGMT Event: Device Found (0x0012) plen 45            {0x0001} [hci0] 3.493677
        LE Address: 58:4B:27:38:45:ED (Resolvable)
        RSSI: -87 dBm (0xa9)
        Flags: 0x00000004
          Not Connectable
        Data length: 31
        Company: Microsoft (6)
          Data: 01092002335005518aaf1b9ce3ffc67dce046d1eb69f37c75dda42
> HCI Event: LE Meta Event (0x3e) plen 57                   #15 [hci0] 7.452627
      LE Extended Advertising Report (0x0d)
        Num reports: 1
        Entry 0
          Event type: 0x0010
            Props: 0x0010
              Use legacy advertising PDUs
            Data status: [0;32mComplete[0m
          Legacy PDU Type: ADV_NONCONN_IND (0x0010)
          Address type: Random (0x01)
          Address: 58:4B:27:38:45:ED (Resolvable)
          Primary PHY: LE 1M
          Secondary PHY: No packets
          SID: no ADI field (0xff)
          TX power: 127 dBm
          RSSI: -88 dBm (0xa8)
          Periodic advertising interval: 0.00 msec (0x0000)
          Direct address type: Public (0x00)
          Direct address: 00:00:00:00:00:00 (OUI 00-00-00)
          Data length: 0x1f
        1e ff 06 00 01 09 20 02 33 50 05 51 8a af 1b 9c  ...... .3P.Q....
        e3 ff c6 7d ce 04 6d 1e b6 9f 37 c7 5d da 42     ...}..m...7.].B 
        Company: Microsoft (6)
          Data: 01092002335005518aaf1b9ce3ffc67dce046d1eb69f37c75dda42
@ MGMT Event: Device Found (0x0012) plen 45            {0x0002} [hci0] 7.452757
        LE Address: 58:4B:27:38:45:ED (Resolvable)
        RSSI: -88 dBm (0xa8)
        Flags: 0x00000004
          Not Connectable
        Data length: 31
        Company: Microsoft (6)
          Data: 01092002335005518aaf1b9ce3ffc67dce046d1eb69f37c75dda42
@ MGMT Event: Device Found (0x0012) plen 45            {0x0001} [hci0] 7.452757
        LE Address: 58:4B:27:38:45:ED (Resolvable)
        RSSI: -88 dBm (0xa8)
        Flags: 0x00000004
          Not Connectable
        Data length: 31
        Company: Microsoft (6)
          Data: 01092002335005518aaf1b9ce3ffc67dce046d1eb69f37c75dda42
> HCI Event: LE Meta Event (0x3e) plen 39                   #16 [hci0] 8.248646
      LE Extended Advertising Report (0x0d)
        Num reports: 1
        Entry 0
          Event type: 0x0013
            Props: 0x0013
              Connectable
              Scannable
              Use legacy advertising PDUs
            Data status: [0;32mComplete[0m
          Legacy PDU Type: ADV_IND (0x0013)
          Address type: Random (0x01)
          Address: C0:DE:54:15:00:51 (Static)
          Primary PHY: LE 1M
          Secondary PHY: No packets
          SID: no ADI field (0xff)
          TX power: 127 dBm
          RSSI: -80 dBm (0xb0)
          Periodic advertising interval: 0.00 msec (0x0000)
          Direct address type: Public (0x00)
          Direct address: 00:00:00:00:00:00 (OUI 00-00-00)
          Data length: 0x0d
        02 01 06 09 09 58 35 34 2d 50 41 49 52           .....X54-PAIR   
        Flags: 0x06
          LE General Discoverable Mode
          BR/EDR Not Supported
        Name (complete): X54-PAIR
> HCI Event: LE Meta Event (0x3e) plen 57                   #17 [hci0] 8.338666
      LE Extended Advertising Report (0x0d)
        Num reports: 1
        Entry 0
          Event type: 0x0010
            Props: 0x0010
              Use legacy advertising PDUs
            Data status: [0;32mComplete[0m
          Legacy PDU Type: ADV_NONCONN_IND (0x0010)
          Address type: Random (0x01)
          Address: 58:4B:27:38:45:ED (Resolvable)
          Primary PHY: LE 1M
          Secondary PHY: No packets
          SID: no ADI field (0xff)
          TX power: 127 dBm
          RSSI: -87 dBm (0xa9)
          Periodic advertising interval: 0.00 msec (0x0000)
          Direct address type: Public (0x00)
          Direct address: 00:00:00:00:00:00 (OUI 00-00-00)
          Data length: 0x1f
        1e ff 06 00 01 09 20 02 33 50 05 51 8a af 1b 9c  ...... .3P.Q....
        e3 ff c6 7d ce 04 6d 1e b6 9f 37 c7 5d da 42     ...}..m...7.].B 
        Company: Microsoft (6)
          Data: 01092002335005518aaf1b9ce3ffc67dce046d1eb69f37c75dda42
@ MGMT Event: Device Found (0x0012) plen 27            {0x0002} [hci0] 8.338834
        LE Address: C0:DE:54:15:00:51 (Static)
        RSSI: -80 dBm (0xb0)
        Flags: 0x00000000
        Data length: 13
        Flags: 0x06
          LE General Discoverable Mode
          BR/EDR Not Supported
        Name (complete): X54-PAIR
@ MGMT Event: Device Found (0x0012) plen 27            {0x0001} [hci0] 8.338834
        LE Address: C0:DE:54:15:00:51 (Static)
        RSSI: -80 dBm (0xb0)
        Flags: 0x00000000
        Data length: 13
        Flags: 0x06
          LE General Discoverable Mode
          BR/EDR Not Supported
        Name (complete): X54-PAIR
@ MGMT Event: Device Found (0x0012) plen 45            {0x0002} [hci0] 8.338841
        LE Address: 58:4B:27:38:45:ED (Resolvable)
        RSSI: -87 dBm (0xa9)
        Flags: 0x00000004
          Not Connectable
        Data length: 31
        Company: Microsoft (6)
          Data: 01092002335005518aaf1b9ce3ffc67dce046d1eb69f37c75dda42
@ MGMT Event: Device Found (0x0012) plen 45            {0x0001} [hci0] 8.338841
        LE Address: 58:4B:27:38:45:ED (Resolvable)
        RSSI: -87 dBm (0xa9)
        Flags: 0x00000004
          Not Connectable
        Data length: 31
        Company: Microsoft (6)
          Data: 01092002335005518aaf1b9ce3ffc67dce046d1eb69f37c75dda42
> HCI Event: LE Meta Event (0x3e) plen 57                   #18 [hci0] 8.438680
      LE Extended Advertising Report (0x0d)
        Num reports: 1
        Entry 0
          Event type: 0x0010
            Props: 0x0010
              Use legacy advertising PDUs
            Data status: [0;32mComplete[0m
          Legacy PDU Type: ADV_NONCONN_IND (0x0010)
          Address type: Random (0x01)
          Address: 58:4B:27:38:45:ED (Resolvable)
          Primary PHY: LE 1M
          Secondary PHY: No packets
          SID: no ADI field (0xff)
          TX power: 127 dBm
          RSSI: -89 dBm (0xa7)
          Periodic advertising interval: 0.00 msec (0x0000)
          Direct address type: Public (0x00)
          Direct address: 00:00:00:00:00:00 (OUI 00-00-00)
          Data length: 0x1f
        1e ff 06 00 01 09 20 02 33 50 05 51 8a af 1b 9c  ...... .3P.Q....
        e3 ff c6 7d ce 04 6d 1e b6 9f 37 c7 5d da 42     ...}..m...7.].B 
        Company: Microsoft (6)
          Data: 01092002335005518aaf1b9ce3ffc67dce046d1eb69f37c75dda42
@ MGMT Event: Device Found (0x0012) plen 45            {0x0002} [hci0] 8.438697
        LE Address: 58:4B:27:38:45:ED (Resolvable)
        RSSI: -89 dBm (0xa7)
        Flags: 0x00000004
          Not Connectable
        Data length: 31
        Company: Microsoft (6)
          Data: 01092002335005518aaf1b9ce3ffc67dce046d1eb69f37c75dda42
@ MGMT Event: Device Found (0x0012) plen 45            {0x0001} [hci0] 8.438697
        LE Address: 58:4B:27:38:45:ED (Resolvable)
        RSSI: -89 dBm (0xa7)
        Flags: 0x00000004
          Not Connectable
        Data length: 31
        Company: Microsoft (6)
          Data: 01092002335005518aaf1b9ce3ffc67dce046d1eb69f37c75dda42
> HCI Event: LE Meta Event (0x3e) plen 57                   #19 [hci0] 8.543662
      LE Extended Advertising Report (0x0d)
        Num reports: 1
        Entry 0
          Event type: 0x0010
            Props: 0x0010
              Use legacy advertising PDUs
            Data status: [0;32mComplete[0m
          Legacy PDU Type: ADV_NONCONN_IND (0x0010)
          Address type: Random (0x01)
          Address: 58:4B:27:38:45:ED (Resolvable)
          Primary PHY: LE 1M
          Secondary PHY: No packets
          SID: no ADI field (0xff)
          TX power: 127 dBm
          RSSI: -91 dBm (0xa5)
          Periodic advertising interval: 0.00 msec (0x0000)
          Direct address type: Public (0x00)
          Direct address: 00:00:00:00:00:00 (OUI 00-00-00)
          Data length: 0x1f
        1e ff 06 00 01 09 20 02 33 50 05 51 8a af 1b 9c  ...... .3P.Q....
        e3 ff c6 7d ce 04 6d 1e b6 9f 37 c7 5d da 42     ...}..m...7.].B 
        Company: Microsoft (6)
          Data: 01092002335005518aaf1b9ce3ffc67dce046d1eb69f37c75dda42
@ MGMT Event: Device Found (0x0012) plen 45            {0x0002} [hci0] 8.543680
        LE Address: 58:4B:27:38:45:ED (Resolvable)
        RSSI: -91 dBm (0xa5)
        Flags: 0x00000004
          Not Connectable
        Data length: 31
        Company: Microsoft (6)
          Data: 01092002335005518aaf1b9ce3ffc67dce046d1eb69f37c75dda42
@ MGMT Event: Device Found (0x0012) plen 45            {0x0001} [hci0] 8.543680
        LE Address: 58:4B:27:38:45:ED (Resolvable)
        RSSI: -91 dBm (0xa5)
        Flags: 0x00000004
          Not Connectable
        Data length: 31
        Company: Microsoft (6)
          Data: 01092002335005518aaf1b9ce3ffc67dce046d1eb69f37c75dda42
> HCI Event: LE Meta Event (0x3e) plen 57                  #20 [hci0] 10.003703
      LE Extended Advertising Report (0x0d)
        Num reports: 1
        Entry 0
          Event type: 0x0010
            Props: 0x0010
              Use legacy advertising PDUs
            Data status: [0;32mComplete[0m
          Legacy PDU Type: ADV_NONCONN_IND (0x0010)
          Address type: Random (0x01)
          Address: 58:4B:27:38:45:ED (Resolvable)
          Primary PHY: LE 1M
          Secondary PHY: No packets
          SID: no ADI field (0xff)
          TX power: 127 dBm
          RSSI: -88 dBm (0xa8)
          Periodic advertising interval: 0.00 msec (0x0000)
          Direct address type: Public (0x00)
          Direct address: 00:00:00:00:00:00 (OUI 00-00-00)
          Data length: 0x1f
        1e ff 06 00 01 09 20 02 33 50 05 51 8a af 1b 9c  ...... .3P.Q....
        e3 ff c6 7d ce 04 6d 1e b6 9f 37 c7 5d da 42     ...}..m...7.].B 
        Company: Microsoft (6)
          Data: 01092002335005518aaf1b9ce3ffc67dce046d1eb69f37c75dda42
@ MGMT Event: Device Found (0x0012) plen 45           {0x0002} [hci0] 10.003861
        LE Address: 58:4B:27:38:45:ED (Resolvable)
        RSSI: -88 dBm (0xa8)
        Flags: 0x00000004
          Not Connectable
        Data length: 31
        Company: Microsoft (6)
          Data: 01092002335005518aaf1b9ce3ffc67dce046d1eb69f37c75dda42
@ MGMT Event: Device Found (0x0012) plen 45           {0x0001} [hci0] 10.003861
        LE Address: 58:4B:27:38:45:ED (Resolvable)
        RSSI: -88 dBm (0xa8)
        Flags: 0x00000004
          Not Connectable
        Data length: 31
        Company: Microsoft (6)
          Data: 01092002335005518aaf1b9ce3ffc67dce046d1eb69f37c75dda42
> HCI Event: LE Meta Event (0x3e) plen 57                  #21 [hci0] 11.166713
      LE Extended Advertising Report (0x0d)
        Num reports: 1
        Entry 0
          Event type: 0x0010
            Props: 0x0010
              Use legacy advertising PDUs
            Data status: [0;32mComplete[0m
          Legacy PDU Type: ADV_NONCONN_IND (0x0010)
          Address type: Random (0x01)
          Address: 58:4B:27:38:45:ED (Resolvable)
          Primary PHY: LE 1M
          Secondary PHY: No packets
          SID: no ADI field (0xff)
          TX power: 127 dBm
          RSSI: -90 dBm (0xa6)
          Periodic advertising interval: 0.00 msec (0x0000)
          Direct address type: Public (0x00)
          Direct address: 00:00:00:00:00:00 (OUI 00-00-00)
          Data length: 0x1f
        1e ff 06 00 01 09 20 02 33 50 05 51 8a af 1b 9c  ...... .3P.Q....
        e3 ff c6 7d ce 04 6d 1e b6 9f 37 c7 5d da 42     ...}..m...7.].B 
        Company: Microsoft (6)
          Data: 01092002335005518aaf1b9ce3ffc67dce046d1eb69f37c75dda42
@ MGMT Event: Device Found (0x0012) plen 45           {0x0002} [hci0] 11.166813
        LE Address: 58:4B:27:38:45:ED (Resolvable)
        RSSI: -90 dBm (0xa6)
        Flags: 0x00000004
          Not Connectable
        Data length: 31
        Company: Microsoft (6)
          Data: 01092002335005518aaf1b9ce3ffc67dce046d1eb69f37c75dda42
@ MGMT Event: Device Found (0x0012) plen 45           {0x0001} [hci0] 11.166813
        LE Address: 58:4B:27:38:45:ED (Resolvable)
        RSSI: -90 dBm (0xa6)
        Flags: 0x00000004
          Not Connectable
        Data length: 31
        Company: Microsoft (6)
          Data: 01092002335005518aaf1b9ce3ffc67dce046d1eb69f37c75dda42
> HCI Event: LE Meta Event (0x3e) plen 39                  #22 [hci0] 12.178717
      LE Extended Advertising Report (0x0d)
        Num reports: 1
        Entry 0
          Event type: 0x0013
            Props: 0x0013
              Connectable
              Scannable
              Use legacy advertising PDUs
            Data status: [0;32mComplete[0m
          Legacy PDU Type: ADV_IND (0x0013)
          Address type: Random (0x01)
          Address: C0:DE:54:15:00:51 (Static)
          Primary PHY: LE 1M
          Secondary PHY: No packets
          SID: no ADI field (0xff)
          TX power: 127 dBm
          RSSI: -72 dBm (0xb8)
          Periodic advertising interval: 0.00 msec (0x0000)
          Direct address type: Public (0x00)
          Direct address: 00:00:00:00:00:00 (OUI 00-00-00)
          Data length: 0x0d
        02 01 06 09 09 58 35 34 2d 50 41 49 52           .....X54-PAIR   
        Flags: 0x06
          LE General Discoverable Mode
          BR/EDR Not Supported
        Name (complete): X54-PAIR
> HCI Event: LE Meta Event (0x3e) plen 43                  #23 [hci0] 12.376684
      LE Extended Advertising Report (0x0d)
        Num reports: 1
        Entry 0
          Event type: 0x0013
            Props: 0x0013
              Connectable
              Scannable
              Use legacy advertising PDUs
            Data status: [0;32mComplete[0m
          Legacy PDU Type: ADV_IND (0x0013)
          Address type: Random (0x01)
          Address: 73:01:16:B1:70:95 (Resolvable)
          Primary PHY: LE 1M
          Secondary PHY: No packets
          SID: no ADI field (0xff)
          TX power: 127 dBm
          RSSI: -82 dBm (0xae)
          Periodic advertising interval: 0.00 msec (0x0000)
          Direct address type: Public (0x00)
          Direct address: 00:00:00:00:00:00 (OUI 00-00-00)
          Data length: 0x11
        02 01 1a 02 0a 0c 0a ff 4c 00 10 05 34 1c 05 a6  ........L...4...
        69                                               i               
        Flags: 0x1a
          LE General Discoverable Mode
          Simultaneous LE and BR/EDR (Controller)
          Simultaneous LE and BR/EDR (Host)
        TX power: 12 dBm
        Company: Apple, Inc. (76)
          Type: Unknown (16)
          Data: 341c05a669
@ MGMT Event: Device Found (0x0012) plen 27           {0x0002} [hci0] 12.376705
        LE Address: C0:DE:54:15:00:51 (Static)
        RSSI: -72 dBm (0xb8)
        Flags: 0x00000000
        Data length: 13
        Flags: 0x06
          LE General Discoverable Mode
          BR/EDR Not Supported
        Name (complete): X54-PAIR
@ MGMT Event: Device Found (0x0012) plen 27           {0x0001} [hci0] 12.376705
        LE Address: C0:DE:54:15:00:51 (Static)
        RSSI: -72 dBm (0xb8)
        Flags: 0x00000000
        Data length: 13
        Flags: 0x06
          LE General Discoverable Mode
          BR/EDR Not Supported
        Name (complete): X54-PAIR
> HCI Event: LE Meta Event (0x3e) plen 26                  #24 [hci0] 12.377594
      LE Extended Advertising Report (0x0d)
        Num reports: 1
        Entry 0
          Event type: 0x001b
            Props: 0x001b
              Connectable
              Scannable
              Scan response
              Use legacy advertising PDUs
            Data status: [0;32mComplete[0m
          Legacy PDU Type: SCAN_RSP to an ADV_SCAN_IND (0x001b)
          Address type: Random (0x01)
          Address: 73:01:16:B1:70:95 (Resolvable)
          Primary PHY: LE 1M
          Secondary PHY: No packets
          SID: no ADI field (0xff)
          TX power: 127 dBm
          RSSI: -81 dBm (0xaf)
          Periodic advertising interval: 0.00 msec (0x0000)
          Direct address type: Public (0x00)
          Direct address: 00:00:00:00:00:00 (OUI 00-00-00)
          Data length: 0x00
@ MGMT Event: Device Found (0x0012) plen 31           {0x0002} [hci0] 12.377601
        LE Address: 73:01:16:B1:70:95 (Resolvable)
        RSSI: -81 dBm (0xaf)
        Flags: 0x00000000
        Data length: 17
        Flags: 0x1a
          LE General Discoverable Mode
          Simultaneous LE and BR/EDR (Controller)
          Simultaneous LE and BR/EDR (Host)
        TX power: 12 dBm
        Company: Apple, Inc. (76)
          Type: Unknown (16)
          Data: 341c05a669
@ MGMT Event: Device Found (0x0012) plen 31           {0x0001} [hci0] 12.377601
        LE Address: 73:01:16:B1:70:95 (Resolvable)
        RSSI: -81 dBm (0xaf)
        Flags: 0x00000000
        Data length: 17
        Flags: 0x1a
          LE General Discoverable Mode
          Simultaneous LE and BR/EDR (Controller)
          Simultaneous LE and BR/EDR (Host)
        TX power: 12 dBm
        Company: Apple, Inc. (76)
          Type: Unknown (16)
          Data: 341c05a669
> HCI Event: LE Meta Event (0x3e) plen 57                  #25 [hci0] 12.554699
      LE Extended Advertising Report (0x0d)
        Num reports: 1
        Entry 0
          Event type: 0x0010
            Props: 0x0010
              Use legacy advertising PDUs
            Data status: [0;32mComplete[0m
          Legacy PDU Type: ADV_NONCONN_IND (0x0010)
          Address type: Random (0x01)
          Address: 58:4B:27:38:45:ED (Resolvable)
          Primary PHY: LE 1M
          Secondary PHY: No packets
          SID: no ADI field (0xff)
          TX power: 127 dBm
          RSSI: -89 dBm (0xa7)
          Periodic advertising interval: 0.00 msec (0x0000)
          Direct address type: Public (0x00)
          Direct address: 00:00:00:00:00:00 (OUI 00-00-00)
          Data length: 0x1f
        1e ff 06 00 01 09 20 02 33 50 05 51 8a af 1b 9c  ...... .3P.Q....
        e3 ff c6 7d ce 04 6d 1e b6 9f 37 c7 5d da 42     ...}..m...7.].B 
        Company: Microsoft (6)
          Data: 01092002335005518aaf1b9ce3ffc67dce046d1eb69f37c75dda42
@ MGMT Event: Device Found (0x0012) plen 45           {0x0002} [hci0] 12.554812
        LE Address: 58:4B:27:38:45:ED (Resolvable)
        RSSI: -89 dBm (0xa7)
        Flags: 0x00000004
          Not Connectable
        Data length: 31
        Company: Microsoft (6)
          Data: 01092002335005518aaf1b9ce3ffc67dce046d1eb69f37c75dda42
@ MGMT Event: Device Found (0x0012) plen 45           {0x0001} [hci0] 12.554812
        LE Address: 58:4B:27:38:45:ED (Resolvable)
        RSSI: -89 dBm (0xa7)
        Flags: 0x00000004
          Not Connectable
        Data length: 31
        Company: Microsoft (6)
          Data: 01092002335005518aaf1b9ce3ffc67dce046d1eb69f37c75dda42
> HCI Event: LE Meta Event (0x3e) plen 43                  #26 [hci0] 12.654617
      LE Extended Advertising Report (0x0d)
        Num reports: 1
        Entry 0
          Event type: 0x0013
            Props: 0x0013
              Connectable
              Scannable
              Use legacy advertising PDUs
            Data status: [0;32mComplete[0m
          Legacy PDU Type: ADV_IND (0x0013)
          Address type: Random (0x01)
          Address: 73:01:16:B1:70:95 (Resolvable)
          Primary PHY: LE 1M
          Secondary PHY: No packets
          SID: no ADI field (0xff)
          TX power: 127 dBm
          RSSI: -82 dBm (0xae)
          Periodic advertising interval: 0.00 msec (0x0000)
          Direct address type: Public (0x00)
          Direct address: 00:00:00:00:00:00 (OUI 00-00-00)
          Data length: 0x11
        02 01 1a 02 0a 0c 0a ff 4c 00 10 05 34 1c 05 a6  ........L...4...
        69                                               i               
        Flags: 0x1a
          LE General Discoverable Mode
          Simultaneous LE and BR/EDR (Controller)
          Simultaneous LE and BR/EDR (Host)
        TX power: 12 dBm
        Company: Apple, Inc. (76)
          Type: Unknown (16)
          Data: 341c05a669
> HCI Event: LE Meta Event (0x3e) plen 26                  #27 [hci0] 12.655604
      LE Extended Advertising Report (0x0d)
        Num reports: 1
        Entry 0
          Event type: 0x001b
            Props: 0x001b
              Connectable
              Scannable
              Scan response
              Use legacy advertising PDUs
            Data status: [0;32mComplete[0m
          Legacy PDU Type: SCAN_RSP to an ADV_SCAN_IND (0x001b)
          Address type: Random (0x01)
          Address: 73:01:16:B1:70:95 (Resolvable)
          Primary PHY: LE 1M
          Secondary PHY: No packets
          SID: no ADI field (0xff)
          TX power: 127 dBm
          RSSI: -81 dBm (0xaf)
          Periodic advertising interval: 0.00 msec (0x0000)
          Direct address type: Public (0x00)
          Direct address: 00:00:00:00:00:00 (OUI 00-00-00)
          Data length: 0x00
@ MGMT Event: Device Found (0x0012) plen 31           {0x0002} [hci0] 12.655716
        LE Address: 73:01:16:B1:70:95 (Resolvable)
        RSSI: -81 dBm (0xaf)
        Flags: 0x00000000
        Data length: 17
        Flags: 0x1a
          LE General Discoverable Mode
          Simultaneous LE and BR/EDR (Controller)
          Simultaneous LE and BR/EDR (Host)
        TX power: 12 dBm
        Company: Apple, Inc. (76)
          Type: Unknown (16)
          Data: 341c05a669
@ MGMT Event: Device Found (0x0012) plen 31           {0x0001} [hci0] 12.655716
        LE Address: 73:01:16:B1:70:95 (Resolvable)
        RSSI: -81 dBm (0xaf)
        Flags: 0x00000000
        Data length: 17
        Flags: 0x1a
          LE General Discoverable Mode
          Simultaneous LE and BR/EDR (Controller)
          Simultaneous LE and BR/EDR (Host)
        TX power: 12 dBm
        Company: Apple, Inc. (76)
          Type: Unknown (16)
          Data: 341c05a669
> HCI Event: LE Meta Event (0x3e) plen 57                  #28 [hci0] 12.657621
      LE Extended Advertising Report (0x0d)
        Num reports: 1
        Entry 0
          Event type: 0x0010
            Props: 0x0010
              Use legacy advertising PDUs
            Data status: [0;32mComplete[0m
          Legacy PDU Type: ADV_NONCONN_IND (0x0010)
          Address type: Random (0x01)
          Address: 58:4B:27:38:45:ED (Resolvable)
          Primary PHY: LE 1M
          Secondary PHY: No packets
          SID: no ADI field (0xff)
          TX power: 127 dBm
          RSSI: -91 dBm (0xa5)
          Periodic advertising interval: 0.00 msec (0x0000)
          Direct address type: Public (0x00)
          Direct address: 00:00:00:00:00:00 (OUI 00-00-00)
          Data length: 0x1f
        1e ff 06 00 01 09 20 02 33 50 05 51 8a af 1b 9c  ...... .3P.Q....
        e3 ff c6 7d ce 04 6d 1e b6 9f 37 c7 5d da 42     ...}..m...7.].B 
        Company: Microsoft (6)
          Data: 01092002335005518aaf1b9ce3ffc67dce046d1eb69f37c75dda42
@ MGMT Event: Device Found (0x0012) plen 45           {0x0002} [hci0] 12.657737
        LE Address: 58:4B:27:38:45:ED (Resolvable)
        RSSI: -91 dBm (0xa5)
        Flags: 0x00000004
          Not Connectable
        Data length: 31
        Company: Microsoft (6)
          Data: 01092002335005518aaf1b9ce3ffc67dce046d1eb69f37c75dda42
@ MGMT Event: Device Found (0x0012) plen 45           {0x0001} [hci0] 12.657737
        LE Address: 58:4B:27:38:45:ED (Resolvable)
        RSSI: -91 dBm (0xa5)
        Flags: 0x00000004
          Not Connectable
        Data length: 31
        Company: Microsoft (6)
          Data: 01092002335005518aaf1b9ce3ffc67dce046d1eb69f37c75dda42
bluetoothctl[2964622]: @ MGMT Close: bluetoothctl            {0x0002} 12.836377
bluetoothd[2915165]: @ MGMT Comman.. (0x0024) plen 1  {0x0001} [hci0] 12.848917
        Address type: 0x07
          BR/EDR
          LE Public
          LE Random
< HCI Command: Inquiry Cancel (0x01|0x0002) plen 0         #29 [hci0] 12.848942
> HCI Event: Command Complete (0x0e) plen 4                #30 [hci0] 12.855671
      Inquiry Cancel (0x01|0x0002) ncmd 1
        Status: Success (0x00)
< HCI Command: LE Set Extended Sca.. (0x08|0x0042) plen 6  #31 [hci0] 12.856009
        Extended scan: Disabled (0x00)
        Filter duplicates: Disabled (0x00)
        Duration: 0 msec (0x0000)
        Period: 0.00 sec (0x0000)
> HCI Event: Command Complete (0x0e) plen 4                #32 [hci0] 12.856594
      LE Set Extended Scan Enable (0x08|0x0042) ncmd 1
        Status: Success (0x00)
@ MGMT Event: Discovering (0x0013) plen 2             {0x0001} [hci0] 12.856745
        Address type: 0x07
          BR/EDR
          LE Public
          LE Random
        Discovery: Disabled (0x00)
@ MGMT Event: Command Complete (0x0001) plen 4        {0x0001} [hci0] 12.856843
      Stop Discovery (0x0024) plen 1
        Status: Success (0x00)
        Address type: 0x07
          BR/EDR
          LE Public
          LE Random
bluetoothd[2915165]: @ MGMT Comman.. (0x003a) plen 4  {0x0001} [hci0] 12.856924
        Address type: 0x01
          BR/EDR
        RSSI: invalid (0x7f)
        UUIDs: 0
< HCI Command: Inquiry (0x01|0x0001) plen 5                #33 [hci0] 12.857059
        Access code: 0x9e8b33 (General Inquiry)
        Length: 10.24s (0x08)
        Num responses: 0
> HCI Event: Command Status (0x0f) plen 4                  #34 [hci0] 12.857587
      Inquiry (0x01|0x0001) ncmd 1
        Status: Success (0x00)
@ MGMT Event: Command Complete (0x0001) plen 4        {0x0001} [hci0] 12.857828
      Start Service Discovery (0x003a) plen 1
        Status: Success (0x00)
        Address type: 0x01
          BR/EDR
@ MGMT Event: Discovering (0x0013) plen 2             {0x0001} [hci0] 12.857834
        Address type: 0x01
          BR/EDR
        Discovery: Enabled (0x01)
bluetoothctl[2965535]: @ MGMT O..n (privileged) version 1.23  {0x0002} 12.858073
bluetoothctl[2965535]: @ MGMT Close: bluetoothctl            {0x0002} 20.872309
bluetoothctl[2966266]: @ MGMT O..n (privileged) version 1.23  {0x0002} 20.888809
> HCI Event: Inquiry Complete (0x01) plen 1                #35 [hci0] 23.165776
        Status: Success (0x00)
@ MGMT Event: Discovering (0x0013) plen 2             {0x0002} [hci0] 23.165799
        Address type: 0x01
          BR/EDR
        Discovery: Disabled (0x00)
@ MGMT Event: Discovering (0x0013) plen 2             {0x0001} [hci0] 23.165799
        Address type: 0x01
          BR/EDR
        Discovery: Disabled (0x00)
bluetoothd[2915165]: @ MGMT Comman.. (0x003a) plen 4  {0x0001} [hci0] 23.165877
        Address type: 0x01
          BR/EDR
        RSSI: invalid (0x7f)
        UUIDs: 0
< HCI Command: Inquiry (0x01|0x0001) plen 5                #36 [hci0] 23.165903
        Access code: 0x9e8b33 (General Inquiry)
        Length: 10.24s (0x08)
        Num responses: 0
> HCI Event: Command Status (0x0f) plen 4                  #37 [hci0] 23.166762
      Inquiry (0x01|0x0001) ncmd 1
        Status: Success (0x00)
@ MGMT Event: Command Complete (0x0001) plen 4        {0x0001} [hci0] 23.166825
      Start Service Discovery (0x003a) plen 1
        Status: Success (0x00)
        Address type: 0x01
          BR/EDR
@ MGMT Event: Discovering (0x0013) plen 2             {0x0002} [hci0] 23.166829
        Address type: 0x01
          BR/EDR
        Discovery: Enabled (0x01)
@ MGMT Event: Discovering (0x0013) plen 2             {0x0001} [hci0] 23.166829
        Address type: 0x01
          BR/EDR
        Discovery: Enabled (0x01)
bluetoothctl[2966266]: @ MGMT Close: bluetoothctl            {0x0002} 28.902307
bluetoothctl[2966996]: @ MGMT O..n (privileged) version 1.23  {0x0002} 28.916750
> HCI Event: Inquiry Complete (0x01) plen 1                #38 [hci0] 33.471038
        Status: Success (0x00)
@ MGMT Event: Discovering (0x0013) plen 2             {0x0002} [hci0] 33.471068
        Address type: 0x01
          BR/EDR
        Discovery: Disabled (0x00)
@ MGMT Event: Discovering (0x0013) plen 2             {0x0001} [hci0] 33.471068
        Address type: 0x01
          BR/EDR
        Discovery: Disabled (0x00)
< HCI Command: LE Remove Device Fr.. (0x08|0x0012) plen 7  #39 [hci0] 33.471200
        Address type: Random (0x01)
        Address: C0:DE:54:15:00:61 (Static)
bluetoothd[2915165]: @ MGMT Comman.. (0x003a) plen 4  {0x0001} [hci0] 33.471350
        Address type: 0x01
          BR/EDR
        RSSI: invalid (0x7f)
        UUIDs: 0
> HCI Event: Command Complete (0x0e) plen 4                #40 [hci0] 33.471940
      LE Remove Device From Accept List (0x08|0x0012) ncmd 1
        Status: Success (0x00)
< HCI Command: LE Add Device To Ac.. (0x08|0x0011) plen 7  #41 [hci0] 33.472049
        Address type: Random (0x01)
        Address: C0:DE:54:15:00:51 (Static)
> HCI Event: Command Complete (0x0e) plen 4                #42 [hci0] 33.472942
      LE Add Device To Accept List (0x08|0x0011) ncmd 1
        Status: Success (0x00)
< HCI Command: LE Set Address Reso.. (0x08|0x002d) plen 1  #43 [hci0] 33.473034
        Address resolution: Enabled (0x01)
> HCI Event: Command Complete (0x0e) plen 4                #44 [hci0] 33.473942
      LE Set Address Resolution Enable (0x08|0x002d) ncmd 1
        Status: Success (0x00)
< HCI Command: LE Set Extended Sc.. (0x08|0x0041) plen 13  #45 [hci0] 33.474056
        Own address type: Public (0x00)
        Filter policy: Ignore not in accept list (0x01)
        PHYs: 0x05
        Entry 0: LE 1M
          Type: Passive (0x00)
          Interval: 60.000 msec (0x0060)
          Window: 60.000 msec (0x0060)
        Entry 1: LE Coded
          Type: Passive (0x00)
          Interval: 180.000 msec (0x0120)
          Window: 180.000 msec (0x0120)
> HCI Event: Command Complete (0x0e) plen 4                #46 [hci0] 33.474942
      LE Set Extended Scan Parameters (0x08|0x0041) ncmd 1
        Status: Success (0x00)
< HCI Command: LE Set Extended Sca.. (0x08|0x0042) plen 6  #47 [hci0] 33.475049
        Extended scan: Enabled (0x01)
        Filter duplicates: Enabled (0x01)
        Duration: 0 msec (0x0000)
        Period: 0.00 sec (0x0000)
> HCI Event: Command Complete (0x0e) plen 4                #48 [hci0] 33.475942
      LE Set Extended Scan Enable (0x08|0x0042) ncmd 1
        Status: Success (0x00)
< HCI Command: Inquiry (0x01|0x0001) plen 5                #49 [hci0] 33.476054
        Access code: 0x9e8b33 (General Inquiry)
        Length: 10.24s (0x08)
        Num responses: 0
> HCI Event: Command Status (0x0f) plen 4                  #50 [hci0] 33.577028
      Inquiry (0x01|0x0001) ncmd 1
        Status: Success (0x00)
@ MGMT Event: Command Complete (0x0001) plen 4        {0x0001} [hci0] 33.577147
      Start Service Discovery (0x003a) plen 1
        Status: Success (0x00)
        Address type: 0x01
          BR/EDR
@ MGMT Event: Discovering (0x0013) plen 2             {0x0002} [hci0] 33.577154
        Address type: 0x01
          BR/EDR
        Discovery: Enabled (0x01)
@ MGMT Event: Discovering (0x0013) plen 2             {0x0001} [hci0] 33.577154
        Address type: 0x01
          BR/EDR
        Discovery: Enabled (0x01)
> HCI Event: LE Meta Event (0x3e) plen 39                  #51 [hci0] 33.781055
      LE Extended Advertising Report (0x0d)
        Num reports: 1
        Entry 0
          Event type: 0x0013
            Props: 0x0013
              Connectable
              Scannable
              Use legacy advertising PDUs
            Data status: [0;32mComplete[0m
          Legacy PDU Type: ADV_IND (0x0013)
          Address type: Random (0x01)
          Address: C0:DE:54:15:00:51 (Static)
          Primary PHY: LE 1M
          Secondary PHY: No packets
          SID: no ADI field (0xff)
          TX power: 127 dBm
          RSSI: -81 dBm (0xaf)
          Periodic advertising interval: 0.00 msec (0x0000)
          Direct address type: Public (0x00)
          Direct address: 00:00:00:00:00:00 (OUI 00-00-00)
          Data length: 0x0d
        02 01 06 09 09 58 35 34 2d 50 41 49 52           .....X54-PAIR   
        Flags: 0x06
          LE General Discoverable Mode
          BR/EDR Not Supported
        Name (complete): X54-PAIR
< HCI Command: LE Set Extended Sca.. (0x08|0x0042) plen 6  #52 [hci0] 33.781204
        Extended scan: Disabled (0x00)
        Filter duplicates: Disabled (0x00)
        Duration: 0 msec (0x0000)
        Period: 0.00 sec (0x0000)
> HCI Event: Command Complete (0x0e) plen 4                #53 [hci0] 33.801066
      LE Set Extended Scan Enable (0x08|0x0042) ncmd 1
        Status: Success (0x00)
< HCI Command: LE Extended Create.. (0x08|0x0043) plen 26  #54 [hci0] 33.801196
        Filter policy: Accept list is not used (0x00)
        Own address type: Public (0x00)
        Peer address type: Random (0x01)
        Peer address: C0:DE:54:15:00:51 (Static)
        Initiating PHYs: 0x01
        Entry 0: LE 1M
          Scan interval: 60.000 msec (0x0060)
          Scan window: 60.000 msec (0x0060)
          Min connection interval: 30.00 msec (0x0018)
          Max connection interval: 50.00 msec (0x0028)
          Connection latency: 0 (0x0000)
          Supervision timeout: 420 msec (0x002a)
          Min connection length: 0.000 msec (0x0000)
          Max connection length: 0.000 msec (0x0000)
> HCI Event: Command Status (0x0f) plen 4                  #55 [hci0] 33.803062
      LE Extended Create Connection (0x08|0x0043) ncmd 1
        Status: Success (0x00)
> HCI Event: LE Meta Event (0x3e) plen 31                  #56 [hci0] 35.763087
      LE Enhanced Connection Complete (0x0a)
        Status: Success (0x00)
        Handle: 2048
        Role: Central (0x00)
        Peer address type: Random (0x01)
        Peer address: C0:DE:54:15:00:51 (Static)
        Local resolvable private address: 00:00:00:00:00:00 (Non-Resolvable)
        Peer resolvable private address: 00:00:00:00:00:00 (Non-Resolvable)
        Connection interval: 45.00 msec (0x0024)
        Connection latency: 0 (0x0000)
        Supervision timeout: 420 msec (0x002a)
        Central clock accuracy: 0x00
@ MGMT Event: Device Connected (0x000b) plen 26       {0x0002} [hci0] 35.763176
        LE Address: C0:DE:54:15:00:51 (Static)
        Flags: 0x00000008
          Connection Locally Initiated
        Data length: 13
        Flags: 0x06
          LE General Discoverable Mode
          BR/EDR Not Supported
        Name (complete): X54-PAIR
@ MGMT Event: Device Connected (0x000b) plen 26       {0x0001} [hci0] 35.763176
        LE Address: C0:DE:54:15:00:51 (Static)
        Flags: 0x00000008
          Connection Locally Initiated
        Data length: 13
        Flags: 0x06
          LE General Discoverable Mode
          BR/EDR Not Supported
        Name (complete): X54-PAIR
btmon[2964384]: @ RAW Open: btmon (privileged) version 2.22  {0x0003} 35.763213
btmon[2964384]: @ RAW Close: btmon                           {0x0003} 35.763217
> HCI Event: LE Meta Event (0x3e) plen 4                   #57 [hci0] 35.763985
      LE Channel Selection Algorithm (0x14)
        Handle: 2048 Address: C0:DE:54:15:00:51 (Static)
        Algorithm: #2 (0x01)
< HCI Command: LE Read Remote Used.. (0x08|0x0016) plen 2  #58 [hci0] 35.773843
        Handle: 2048 Address: C0:DE:54:15:00:51 (Static)
> HCI Event: Command Status (0x0f) plen 4                  #59 [hci0] 35.774986
      LE Read Remote Used Features (0x08|0x0016) ncmd 1
        Status: Success (0x00)
> HCI Event: LE Meta Event (0x3e) plen 12                  #60 [hci0] 35.879133
      LE Read Remote Used Features (0x04)
        Status: Success (0x00)
        Handle: 2048 Address: C0:DE:54:15:00:51 (Static)
        Features: 0x1f 0x00 0x00 0x00 0x00 0x00 0x00 0x00
          LE Encryption
          Connection Parameter Request Procedure
          Extended Reject Indication
          Peripheral-initiated Features Exchange
          LE Ping
bluetoothd[2915165]: < ACL Data TX: H.. flags 0x00 dlen 7  #61 [hci0] 35.879467
      ATT: Exchange MTU Request (0x02) len 2
        Client RX MTU: 517
> HCI Event: Number of Completed Packets (0x13) plen 5     #62 [hci0] 35.969075
        Num handles: 1
        Handle: 2048 Address: C0:DE:54:15:00:51 (Static)
        Count: 1
        #61: len 7 (0 Kb/s)
        Latency: 89 msec (89-89 msec ~89 msec)
> ACL Data RX: Handle 2048 flags 0x02 dlen 7               #63 [hci0] 36.016734
      ATT: Exchange MTU Response (0x03) len 2
        Server RX MTU: 23
bluetoothd[2915165]: < ACL Data TX:... flags 0x00 dlen 11  #64 [hci0] 36.017239
      ATT: Read By Type Request (0x08) len 6
        Handle range: 0x0001-0xffff
        Attribute type: Server Supported Features (0x2b3a)
> HCI Event: Number of Completed Packets (0x13) plen 5     #65 [hci0] 36.059062
        Num handles: 1
        Handle: 2048 Address: C0:DE:54:15:00:51 (Static)
        Count: 1
        #64: len 11 (2 Kb/s)
        Latency: 41 msec (41-89 msec ~65 msec)
> ACL Data RX: Handle 2048 flags 0x02 dlen 9               #66 [hci0] 36.105837
      ATT: Error Response (0x01) len 4
        Read By Type Request (0x08)
        Handle: 0x0001
        Error: Attribute Not Found (0x0a)
bluetoothd[2915165]: < ACL Data TX:... flags 0x00 dlen 11  #67 [hci0] 36.106311
      ATT: Read By Group Type Request (0x10) len 6
        Handle range: 0x0001-0xffff
        Attribute group type: Primary Service (0x2800)
> HCI Event: Number of Completed Packets (0x13) plen 5     #68 [hci0] 36.149079
        Num handles: 1
        Handle: 2048 Address: C0:DE:54:15:00:51 (Static)
        Count: 1
        #67: len 11 (2 Kb/s)
        Latency: 42 msec (41-89 msec ~54 msec)
> ACL Data RX: Handle 2048 flags 0x02 dlen 24              #69 [hci0] 36.195941
      ATT: Read By Group Type Response (0x11) len 19
        Attribute data length: 6
        Attribute group list: 3 entries
        Handle range: 0x0001-0x0007
        UUID: Generic Access Profile (0x1800)
        Handle range: 0x0008-0x000b
        UUID: Generic Attribute Profile (0x1801)
        Handle range: 0x0010-0x0013
        UUID: Battery Service (0x180f)
bluetoothd[2915165]: < ACL Data TX:... flags 0x00 dlen 11  #70 [hci0] 36.196459
      ATT: Read By Group Type Request (0x10) len 6
        Handle range: 0x0014-0xffff
        Attribute group type: Primary Service (0x2800)
> HCI Event: Number of Completed Packets (0x13) plen 5     #71 [hci0] 36.239075
        Num handles: 1
        Handle: 2048 Address: C0:DE:54:15:00:51 (Static)
        Count: 1
        #70: len 11 (2 Kb/s)
        Latency: 42 msec (41-89 msec ~48 msec)
> ACL Data RX: Handle 2048 flags 0x02 dlen 9               #72 [hci0] 36.285878
      ATT: Error Response (0x01) len 4
        Read By Group Type Request (0x10)
        Handle: 0x0014
        Error: Attribute Not Found (0x0a)
bluetoothd[2915165]: < ACL Data TX:... flags 0x00 dlen 11  #73 [hci0] 36.286262
      ATT: Read By Group Type Request (0x10) len 6
        Handle range: 0x0001-0xffff
        Attribute group type: Secondary Service (0x2801)
> HCI Event: Number of Completed Packets (0x13) plen 5     #74 [hci0] 36.329109
        Num handles: 1
        Handle: 2048 Address: C0:DE:54:15:00:51 (Static)
        Count: 1
        #73: len 11 (2 Kb/s)
        Latency: 42 msec (41-89 msec ~45 msec)
> ACL Data RX: Handle 2048 flags 0x02 dlen 9               #75 [hci0] 36.375738
      ATT: Error Response (0x01) len 4
        Read By Group Type Request (0x10)
        Handle: 0x0001
        Error: Unsupported Group Type (0x10)
bluetoothd[2915165]: < ACL Data TX:... flags 0x00 dlen 11  #76 [hci0] 36.375860
      ATT: Read By Type Request (0x08) len 6
        Handle range: 0x0001-0x0013
        Attribute type: Include (0x2802)
> HCI Event: Number of Completed Packets (0x13) plen 5     #77 [hci0] 36.419090
        Num handles: 1
        Handle: 2048 Address: C0:DE:54:15:00:51 (Static)
        Count: 1
        #76: len 11 (2 Kb/s)
        Latency: 43 msec (41-89 msec ~44 msec)
> ACL Data RX: Handle 2048 flags 0x02 dlen 9               #78 [hci0] 36.465793
      ATT: Error Response (0x01) len 4
        Read By Type Request (0x08)
        Handle: 0x0001
        Error: Attribute Not Found (0x0a)
bluetoothd[2915165]: < ACL Data TX:... flags 0x00 dlen 11  #79 [hci0] 36.466232
      ATT: Read By Type Request (0x08) len 6
        Handle range: 0x0001-0x0013
        Attribute type: Characteristic (0x2803)
> HCI Event: Number of Completed Packets (0x13) plen 5     #80 [hci0] 36.509089
        Num handles: 1
        Handle: 2048 Address: C0:DE:54:15:00:51 (Static)
        Count: 1
        #79: len 11 (2 Kb/s)
        Latency: 42 msec (41-89 msec ~43 msec)
> ACL Data RX: Handle 2048 flags 0x02 dlen 27              #81 [hci0] 36.555832
      ATT: Read By Type Response (0x09) len 22
        Attribute data length: 7
        Attribute data list: 3 entries
        Handle: 0x0002
        Value: 020300002a
            Properties: 0x02
              Read (0x02)
            Value Handle: 0x0003
            Value UUID: Device Name (0x2a00)
        Handle: 0x0004
        Value: 020500012a
            Properties: 0x02
              Read (0x02)
            Value Handle: 0x0005
            Value UUID: Appearance (0x2a01)
        Handle: 0x0006
        Value: 020700042a
            Properties: 0x02
              Read (0x02)
            Value Handle: 0x0007
            Value UUID: Peripheral Preferred Connection Parameters (0x2a04)
bluetoothd[2915165]: < ACL Data TX:... flags 0x00 dlen 11  #82 [hci0] 36.556401
      ATT: Read By Type Request (0x08) len 6
        Handle range: 0x0007-0x0013
        Attribute type: Characteristic (0x2803)
> HCI Event: Number of Completed Packets (0x13) plen 5     #83 [hci0] 36.599149
        Num handles: 1
        Handle: 2048 Address: C0:DE:54:15:00:51 (Static)
        Count: 1
        #82: len 11 (2 Kb/s)
        Latency: 42 msec (41-89 msec ~43 msec)
> ACL Data RX: Handle 2048 flags 0x02 dlen 20              #84 [hci0] 36.645843
      ATT: Read By Type Response (0x09) len 15
        Attribute data length: 7
        Attribute data list: 2 entries
        Handle: 0x0009
        Value: 200a00052a
            Properties: 0x20
              Indicate (0x20)
            Value Handle: 0x000a
            Value UUID: Service Changed (0x2a05)
        Handle: 0x0011
        Value: 121200192a
            Properties: 0x12
              Read (0x02)
              Notify (0x10)
            Value Handle: 0x0012
            Value UUID: Battery Level (0x2a19)
bluetoothd[2915165]: < ACL Data TX:... flags 0x00 dlen 11  #85 [hci0] 36.646315
      ATT: Read By Type Request (0x08) len 6
        Handle range: 0x0012-0x0013
        Attribute type: Characteristic (0x2803)
> HCI Event: Number of Completed Packets (0x13) plen 5     #86 [hci0] 36.689080
        Num handles: 1
        Handle: 2048 Address: C0:DE:54:15:00:51 (Static)
        Count: 1
        #85: len 11 (2 Kb/s)
        Latency: 42 msec (41-89 msec ~42 msec)
> ACL Data RX: Handle 2048 flags 0x02 dlen 9               #87 [hci0] 36.735852
      ATT: Error Response (0x01) len 4
        Read By Type Request (0x08)
        Handle: 0x0012
        Error: Attribute Not Found (0x0a)
bluetoothd[2915165]: < ACL Data TX: H.. flags 0x00 dlen 9  #88 [hci0] 36.836272
      ATT: Write Request (0x12) len 4
        Handle: 0x000b Type: Client Characteristic Configuration (0x2902)
        Value Handle: 0x000a Type: Service Changed (0x2a05)
          Data: 0200
            Indication (0x02)
> HCI Event: Number of Completed Packets (0x13) plen 5     #89 [hci0] 36.869067
        Num handles: 1
        Handle: 2048 Address: C0:DE:54:15:00:51 (Static)
        Count: 1
        #88: len 9 (2 Kb/s)
        Latency: 32 msec (32-89 msec ~37 msec)
> ACL Data RX: Handle 2048 flags 0x02 dlen 5               #90 [hci0] 36.915736
      ATT: Write Response (0x13) len 0
bluetoothd[2915165]: < ACL Data TX: H.. flags 0x00 dlen 7  #91 [hci0] 36.915859
      ATT: Read Request (0x0a) len 2
        Handle: 0x0003 Type: Device Name (0x2a00)
> HCI Event: Number of Completed Packets (0x13) plen 5     #92 [hci0] 36.960011
        Num handles: 1
        Handle: 2048 Address: C0:DE:54:15:00:51 (Static)
        Count: 1
        #91: len 7 (1 Kb/s)
        Latency: 44 msec (32-89 msec ~41 msec)
> ACL Data RX: Handle 2048 flags 0x02 dlen 11              #93 [hci0] 36.960732
      ATT: Handle Value Indication (0x1d) len 6
        Handle: 0x000a Type: Service Changed (0x2a05)
          Data: 0100ffff
bluetoothd[2915165]: < ACL Data TX: H.. flags 0x00 dlen 5  #94 [hci0] 36.961011
      ATT: Handle Value Confirmation (0x1e) len 0
> HCI Event: Number of Completed Packets (0x13) plen 5     #95 [hci0] 37.005115
        Num handles: 1
        Handle: 2048 Address: C0:DE:54:15:00:51 (Static)
        Count: 1
        #94: len 5 (0 Kb/s)
        Latency: 44 msec (32-89 msec ~42 msec)
> ACL Data RX: Handle 2048 flags 0x02 dlen 22              #96 [hci0] 37.005739
      ATT: Read Response (0x0b) len 17
bluetoothd[2915165]: < ACL Data TX: H.. flags 0x00 dlen 7  #97 [hci0] 37.006165
      ATT: Read Request (0x0a) len 2
        Handle: 0x0005 Type: Appearance (0x2a01)
> HCI Event: Number of Completed Packets (0x13) plen 5     #98 [hci0] 37.049078
        Num handles: 1
        Handle: 2048 Address: C0:DE:54:15:00:51 (Static)
        Count: 1
        #97: len 7 (1 Kb/s)
        Latency: 42 msec (32-89 msec ~42 msec)
> ACL Data RX: Handle 2048 flags 0x02 dlen 7               #99 [hci0] 37.095827
      ATT: Read Response (0x0b) len 2
bluetoothd[2915165]: < ACL Data TX:... flags 0x00 dlen 7  #100 [hci0] 37.096275
      ATT: Read Request (0x0a) len 2
        Handle: 0x0012 Type: Battery Level (0x2a19)
> HCI Event: Number of Completed Packets (0x13) plen 5    #101 [hci0] 37.139106
        Num handles: 1
        Handle: 2048 Address: C0:DE:54:15:00:51 (Static)
        Count: 1
        #100: len 7 (1 Kb/s)
        Latency: 42 msec (32-89 msec ~42 msec)
> ACL Data RX: Handle 2048 flags 0x02 dlen 6              #102 [hci0] 37.186733
      ATT: Read Response (0x0b) len 1
bluetoothd[2915165]: < ACL Data TX:.. flags 0x00 dlen 11  #103 [hci0] 37.187220
      ATT: Read By Group Type Request (0x10) len 6
        Handle range: 0x0001-0xffff
        Attribute group type: Primary Service (0x2800)
> HCI Event: Number of Completed Packets (0x13) plen 5    #104 [hci0] 37.229101
        Num handles: 1
        Handle: 2048 Address: C0:DE:54:15:00:51 (Static)
        Count: 1
        #103: len 11 (2 Kb/s)
        Latency: 41 msec (32-89 msec ~42 msec)
> ACL Data RX: Handle 2048 flags 0x02 dlen 24             #105 [hci0] 37.275862
      ATT: Read By Group Type Response (0x11) len 19
        Attribute data length: 6
        Attribute group list: 3 entries
        Handle range: 0x0001-0x0007
        UUID: Generic Access Profile (0x1800)
        Handle range: 0x0008-0x000b
        UUID: Generic Attribute Profile (0x1801)
        Handle range: 0x0010-0x0013
        UUID: Battery Service (0x180f)
bluetoothd[2915165]: < ACL Data TX:... flags 0x00 dlen 9  #106 [hci0] 37.276438
      ATT: Write Request (0x12) len 4
        Handle: 0x0013 Type: Client Characteristic Configuration (0x2902)
        Value Handle: 0x0012 Type: Battery Level (0x2a19)
          Data: 0100
            Notification (0x01)
> HCI Event: Number of Completed Packets (0x13) plen 5    #107 [hci0] 37.319153
        Num handles: 1
        Handle: 2048 Address: C0:DE:54:15:00:51 (Static)
        Count: 1
        #106: len 9 (1 Kb/s)
        Latency: 42 msec (32-89 msec ~42 msec)
> ACL Data RX: Handle 2048 flags 0x02 dlen 5              #108 [hci0] 37.365731
      ATT: Write Response (0x13) len 0
bluetoothd[2915165]: < ACL Data TX:.. flags 0x00 dlen 11  #109 [hci0] 37.366264
      ATT: Read By Group Type Request (0x10) len 6
        Handle range: 0x0014-0xffff
        Attribute group type: Primary Service (0x2800)
> HCI Event: Number of Completed Packets (0x13) plen 5    #110 [hci0] 37.409091
        Num handles: 1
        Handle: 2048 Address: C0:DE:54:15:00:51 (Static)
        Count: 1
        #109: len 11 (2 Kb/s)
        Latency: 42 msec (32-89 msec ~42 msec)
> ACL Data RX: Handle 2048 flags 0x02 dlen 8              #111 [hci0] 37.409117
      ATT: Handle Value Notification (0x1b) len 3
        Handle: 0x0012 Type: Battery Level (0x2a19)
          Data: 60
> ACL Data RX: Handle 2048 flags 0x02 dlen 9              #112 [hci0] 37.455828
      ATT: Error Response (0x01) len 4
        Read By Group Type Request (0x10)
        Handle: 0x0014
        Error: Attribute Not Found (0x0a)
bluetoothctl[2966996]: @ MGMT Close: bluetoothctl            {0x0002} 38.922234
bluetoothctl[2967900]: @ MGMT O..n (privileged) version 1.23  {0x0002} 38.934924
bluetoothd[2915165]: @ MGMT Comman.. (0x0024) plen 1  {0x0001} [hci0] 38.939012
        Address type: 0x01
          BR/EDR
< HCI Command: Inquiry Cancel (0x01|0x0002) plen 0        #113 [hci0] 38.939232
> HCI Event: Command Complete (0x0e) plen 4               #114 [hci0] 38.940149
      Inquiry Cancel (0x01|0x0002) ncmd 1
        Status: Success (0x00)
@ MGMT Event: Discovering (0x0013) plen 2             {0x0002} [hci0] 38.940230
        Address type: 0x01
          BR/EDR
        Discovery: Disabled (0x00)
@ MGMT Event: Discovering (0x0013) plen 2             {0x0001} [hci0] 38.940230
        Address type: 0x01
          BR/EDR
        Discovery: Disabled (0x00)
@ MGMT Event: Command Complete (0x0001) plen 4        {0x0001} [hci0] 38.940371
      Stop Discovery (0x0024) plen 1
        Status: Success (0x00)
        Address type: 0x01
          BR/EDR
bluetoothd[2915165]: @ MGMT Comman.. (0x0019) plen 8  {0x0001} [hci0] 38.940431
        LE Address: C0:DE:54:15:00:51 (Static)
        Capability: DisplayYesNo (0x01)
< ACL Data TX: Handle 2048 flags 0x00 dlen 11             #115 [hci0] 38.940485
      SMP: Pairing Request (0x01) len 6
        IO capability: DisplayYesNo (0x01)
        OOB data: Authentication data not present (0x00)
        Authentication requirement: Bonding, MITM, SC, No Keypresses, CT2 (0x2d)
        Max encryption key size: 16
        Initiator key distribution: EncKey Sign LinkKey (0x0d)
        Responder key distribution: EncKey IdKey Sign LinkKey (0x0f)
> HCI Event: Number of Completed Packets (0x13) plen 5    #116 [hci0] 38.984128
        Num handles: 1
        Handle: 2048 Address: C0:DE:54:15:00:51 (Static)
        Count: 1
        #115: len 11 (2 Kb/s)
        Latency: 43 msec (32-89 msec ~43 msec)
> ACL Data RX: Handle 2048 flags 0x02 dlen 11             #117 [hci0] 39.030861
      SMP: Pairing Response (0x02) len 6
        IO capability: NoInputNoOutput (0x03)
        OOB data: Authentication data not present (0x00)
        Authentication requirement: Bonding, No MITM, Legacy, No Keypresses (0x01)
        Max encryption key size: 16
        Initiator key distribution: EncKey (0x01)
        Responder key distribution: <none> (0x00)
@ MGMT Event: User Confirmation R.. (0x000f) plen 12  {0x0002} [hci0] 39.030979
        LE Address: C0:DE:54:15:00:51 (Static)
        Confirm hint: 0x01
        Value: 0x00000000
@ MGMT Event: User Confirmation R.. (0x000f) plen 12  {0x0001} [hci0] 39.030979
        LE Address: C0:DE:54:15:00:51 (Static)
        Confirm hint: 0x01
        Value: 0x00000000
bluetoothd[2915165]: @ MGMT Comman.. (0x001c) plen 7  {0x0001} [hci0] 39.031213
        LE Address: C0:DE:54:15:00:51 (Static)
@ MGMT Event: Command Complete (0x0001) plen 10       {0x0001} [hci0] 39.031237
      User Confirmation Reply (0x001c) plen 7
        Status: Success (0x00)
        LE Address: C0:DE:54:15:00:51 (Static)
< ACL Data TX: Handle 2048 flags 0x00 dlen 21             #118 [hci0] 39.031342
      SMP: Pairing Confirm (0x03) len 16
        Confim value: e7fa8d09fd80a2475b4e4066bb211fef
> HCI Event: Number of Completed Packets (0x13) plen 5    #119 [hci0] 39.075136
        Num handles: 1
        Handle: 2048 Address: C0:DE:54:15:00:51 (Static)
        Count: 1
        #118: len 21 (3 Kb/s)
        Latency: 43 msec (32-89 msec ~43 msec)
> ACL Data RX: Handle 2048 flags 0x02 dlen 21             #120 [hci0] 39.120811
      SMP: Pairing Confirm (0x03) len 16
        Confim value: 0956595d08b66dbdf0f91f728a9a4fb4
< ACL Data TX: Handle 2048 flags 0x00 dlen 21             #121 [hci0] 39.120932
      SMP: Pairing Random (0x04) len 16
        Random value: 6088726554a1bfaf21000d78d7435a9d
> HCI Event: Number of Completed Packets (0x13) plen 5    #122 [hci0] 39.165123
        Num handles: 1
        Handle: 2048 Address: C0:DE:54:15:00:51 (Static)
        Count: 1
        #121: len 21 (3 Kb/s)
        Latency: 44 msec (32-89 msec ~43 msec)
> ACL Data RX: Handle 2048 flags 0x02 dlen 21             #123 [hci0] 39.211730
      SMP: Pairing Random (0x04) len 16
        Random value: dac63896c0fc0fdb7ba2e3c0e55ee317
< HCI Command: LE Start Encryption (0x08|0x0019) plen 28  #124 [hci0] 39.211758
        Handle: 2048 Address: C0:DE:54:15:00:51 (Static)
        Random number: 0x0000000000000000
        Encrypted diversifier: 0x0000
        Long term key: 882e19e0223c0c720fb4a3266b215fd3
> HCI Event: Command Status (0x0f) plen 4                 #125 [hci0] 39.213147
      LE Start Encryption (0x08|0x0019) ncmd 1
        Status: Success (0x00)
> HCI Event: Encryption Change (0x08) plen 4              #126 [hci0] 39.434126
        Status: Connection Terminated due to MIC Failure (0x3d)
        Handle: 2048 Address: C0:DE:54:15:00:51 (Static)
        Encryption: Disabled (0x00)
@ MGMT Event: Command Complete (0x0001) plen 10       {0x0001} [hci0] 39.434268
      Pair Device (0x0019) plen 7
        Status: Authentication Failed (0x05)
        LE Address: C0:DE:54:15:00:51 (Static)
< HCI Command: Disconnect (0x01|0x0006) plen 3            #127 [hci0] 39.434375
        Handle: 2048 Address: C0:DE:54:15:00:51 (Static)
        Reason: Authentication Failure (0x05)
> HCI Event: Disconnect Complete (0x05) plen 4            #128 [hci0] 39.435054
        Status: Success (0x00)
        Handle: 2048 Address: C0:DE:54:15:00:51 (Static)
        Reason: Connection Terminated due to MIC Failure (0x3d)
@ MGMT Event: Device Disconnected (0x000c) plen 8     {0x0002} [hci0] 39.435187
        LE Address: C0:DE:54:15:00:51 (Static)
        Reason: Unspecified (0x00)
@ MGMT Event: Device Disconnected (0x000c) plen 8     {0x0001} [hci0] 39.435187
        LE Address: C0:DE:54:15:00:51 (Static)
        Reason: Unspecified (0x00)
> HCI Event: Command Status (0x0f) plen 4                 #129 [hci0] 39.436047
      Disconnect (0x01|0x0006) ncmd 1
        Status: Unknown Connection Identifier (0x02)
bluetoothd[2915165]: @ MGMT Comman.. (0x003a) plen 4  {0x0001} [hci0] 44.722966
        Address type: 0x01
          BR/EDR
        RSSI: invalid (0x7f)
        UUIDs: 0
< HCI Command: Inquiry (0x01|0x0001) plen 5               #130 [hci0] 44.723207
        Access code: 0x9e8b33 (General Inquiry)
        Length: 10.24s (0x08)
        Num responses: 0
> HCI Event: Command Status (0x0f) plen 4                 #131 [hci0] 44.817156
      Inquiry (0x01|0x0001) ncmd 1
        Status: Success (0x00)
@ MGMT Event: Command Complete (0x0001) plen 4        {0x0001} [hci0] 44.817358
      Start Service Discovery (0x003a) plen 1
        Status: Success (0x00)
        Address type: 0x01
          BR/EDR
@ MGMT Event: Discovering (0x0013) plen 2             {0x0002} [hci0] 44.817369
        Address type: 0x01
          BR/EDR
        Discovery: Enabled (0x01)
@ MGMT Event: Discovering (0x0013) plen 2             {0x0001} [hci0] 44.817369
        Address type: 0x01
          BR/EDR
        Discovery: Enabled (0x01)
> HCI Event: Inquiry Complete (0x01) plen 1               #132 [hci0] 55.122433
        Status: Success (0x00)
@ MGMT Event: Discovering (0x0013) plen 2             {0x0002} [hci0] 55.122544
        Address type: 0x01
          BR/EDR
        Discovery: Disabled (0x00)
@ MGMT Event: Discovering (0x0013) plen 2             {0x0001} [hci0] 55.122544
        Address type: 0x01
          BR/EDR
        Discovery: Disabled (0x00)
bluetoothd[2915165]: @ MGMT Comman.. (0x003a) plen 4  {0x0001} [hci0] 55.122828
        Address type: 0x01
          BR/EDR
        RSSI: invalid (0x7f)
        UUIDs: 0
< HCI Command: Inquiry (0x01|0x0001) plen 5               #133 [hci0] 55.123045
        Access code: 0x9e8b33 (General Inquiry)
        Length: 10.24s (0x08)
        Num responses: 0
> HCI Event: Command Status (0x0f) plen 4                 #134 [hci0] 55.124322
      Inquiry (0x01|0x0001) ncmd 1
        Status: Success (0x00)
@ MGMT Event: Command Complete (0x0001) plen 4        {0x0001} [hci0] 55.124545
      Start Service Discovery (0x003a) plen 1
        Status: Success (0x00)
        Address type: 0x01
          BR/EDR
@ MGMT Event: Discovering (0x0013) plen 2             {0x0002} [hci0] 55.124555
        Address type: 0x01
          BR/EDR
        Discovery: Enabled (0x01)
@ MGMT Event: Discovering (0x0013) plen 2             {0x0001} [hci0] 55.124555
        Address type: 0x01
          BR/EDR
        Discovery: Enabled (0x01)
bluetoothctl[2967900]: @ MGMT Close: bluetoothctl            {0x0002} 58.942280
bluetoothctl[2969709]: @ MGMT O..n (privileged) version 1.23  {0x0002} 58.957790
> HCI Event: Inquiry Complete (0x01) plen 1               #135 [hci0] 65.428615
        Status: Success (0x00)
@ MGMT Event: Discovering (0x0013) plen 2             {0x0002} [hci0] 65.428731
        Address type: 0x01
          BR/EDR
        Discovery: Disabled (0x00)
@ MGMT Event: Discovering (0x0013) plen 2             {0x0001} [hci0] 65.428731
        Address type: 0x01
          BR/EDR
        Discovery: Disabled (0x00)
bluetoothd[2915165]: @ MGMT Comman.. (0x003a) plen 4  {0x0001} [hci0] 65.428852
        Address type: 0x01
          BR/EDR
        RSSI: invalid (0x7f)
        UUIDs: 0
< HCI Command: Inquiry (0x01|0x0001) plen 5               #136 [hci0] 65.428961
        Access code: 0x9e8b33 (General Inquiry)
        Length: 10.24s (0x08)
        Num responses: 0
> HCI Event: Command Status (0x0f) plen 4                 #137 [hci0] 65.429505
      Inquiry (0x01|0x0001) ncmd 1
        Status: Success (0x00)
@ MGMT Event: Command Complete (0x0001) plen 4        {0x0001} [hci0] 65.429680
      Start Service Discovery (0x003a) plen 1
        Status: Success (0x00)
        Address type: 0x01
          BR/EDR
@ MGMT Event: Discovering (0x0013) plen 2             {0x0002} [hci0] 65.429690
        Address type: 0x01
          BR/EDR
        Discovery: Enabled (0x01)
@ MGMT Event: Discovering (0x0013) plen 2             {0x0001} [hci0] 65.429690
        Address type: 0x01
          BR/EDR
        Discovery: Enabled (0x01)
bluetoothctl[2969709]: @ MGMT Close: bluetoothctl            {0x0002} 66.963246
bluetoothctl[2970436]: @ MGMT O..n (privileged) version 1.23  {0x0002} 66.977651
bluetoothctl[2970436]: @ MGMT Close: bluetoothctl            {0x0002} 74.991330
> HCI Event: Inquiry Complete (0x01) plen 1               #138 [hci0] 75.736704
        Status: Success (0x00)
@ MGMT Event: Discovering (0x0013) plen 2             {0x0001} [hci0] 75.736875
        Address type: 0x01
          BR/EDR
        Discovery: Disabled (0x00)
bluetoothd[2915165]: @ MGMT Comman.. (0x003a) plen 4  {0x0001} [hci0] 75.737039
        Address type: 0x01
          BR/EDR
        RSSI: invalid (0x7f)
        UUIDs: 0
< HCI Command: Inquiry (0x01|0x0001) plen 5               #139 [hci0] 75.737197
        Access code: 0x9e8b33 (General Inquiry)
        Length: 10.24s (0x08)
        Num responses: 0
> HCI Event: Command Status (0x0f) plen 4                 #140 [hci0] 75.737688
      Inquiry (0x01|0x0001) ncmd 1
        Status: Success (0x00)
@ MGMT Event: Command Complete (0x0001) plen 4        {0x0001} [hci0] 75.737953
      Start Service Discovery (0x003a) plen 1
        Status: Success (0x00)
        Address type: 0x01
          BR/EDR
@ MGMT Event: Discovering (0x0013) plen 2             {0x0001} [hci0] 75.737961
        Address type: 0x01
          BR/EDR
        Discovery: Enabled (0x01)
