Bluetooth monitor ver 5.72
btmon[1072211]: = Note: Linux version 6.17.0-14-generic (x86_64)       0.208568
btmon[1072211]: = Note: Bluetooth subsystem version 2.22               0.208570
= New Index: 68:34:21:E5:84:DF (Primary,USB,hci0)               [hci0] 0.208571
= Open Index: 68:34:21:E5:84:DF                                 [hci0] 0.208571
= Index Info: 68:34:21:E5:84:DF (Intel Corp.)                   [hci0] 0.208571
bluetoothd[2915165]: @ MGMT Open.. (privileged) version 1.23  {0x0001} 0.208572
bluetoothctl[1072370]: @ MGMT Op.. (privileged) version 1.23  {0x0002} 2.216010
bluetoothctl[1072370]: @ MGMT Close: bluetoothctl             {0x0002} 2.221914
bluetoothd[2915165]: @ MGMT Command.. (0x001b) plen 8  {0x0001} [hci0] 2.227920
        LE Address: C0:DE:54:15:00:51 (Static)
        Disconnect: Enabled (0x01)
@ MGMT Event: Command Complete (0x0001) plen 10        {0x0001} [hci0] 2.227926
      Unpair Device (0x001b) plen 7
        Status: Success (0x00)
        LE Address: C0:DE:54:15:00:51 (Static)
bluetoothctl[1072373]: @ MGMT Op.. (privileged) version 1.23  {0x0002} 2.231651
bluetoothd[2915165]: @ MGMT Command.. (0x0024) plen 1  {0x0001} [hci0] 2.237805
        Address type: 0x01
          BR/EDR
< HCI Command: Inquiry Cancel (0x01|0x0002) plen 0           #1 [hci0] 2.238002
> HCI Event: Command Complete (0x0e) plen 4                  #2 [hci0] 2.335996
      Inquiry Cancel (0x01|0x0002) ncmd 1
        Status: Success (0x00)
@ MGMT Event: Discovering (0x0013) plen 2              {0x0002} [hci0] 2.336022
        Address type: 0x01
          BR/EDR
        Discovery: Disabled (0x00)
@ MGMT Event: Discovering (0x0013) plen 2              {0x0001} [hci0] 2.336022
        Address type: 0x01
          BR/EDR
        Discovery: Disabled (0x00)
@ MGMT Event: Command Complete (0x0001) plen 4         {0x0001} [hci0] 2.336157
      Stop Discovery (0x0024) plen 1
        Status: Success (0x00)
        Address type: 0x01
          BR/EDR
bluetoothd[2915165]: @ MGMT Command.. (0x003a) plen 4  {0x0001} [hci0] 2.336192
        Address type: 0x07
          BR/EDR
          LE Public
          LE Random
        RSSI: invalid (0x7f)
        UUIDs: 0
< HCI Command: LE Set Address Resolu.. (0x08|0x002d) plen 1  #3 [hci0] 2.336350
        Address resolution: Disabled (0x00)
> HCI Event: Command Complete (0x0e) plen 4                  #4 [hci0] 2.336992
      LE Set Address Resolution Enable (0x08|0x002d) ncmd 1
        Status: Success (0x00)
< HCI Command: LE Set Random Address (0x08|0x0005) plen 6    #5 [hci0] 2.337104
        Address: 31:17:67:9D:E5:A7 (Non-Resolvable)
> HCI Event: Command Complete (0x0e) plen 4                  #6 [hci0] 2.337991
      LE Set Random Address (0x08|0x0005) ncmd 1
        Status: Success (0x00)
< HCI Command: LE Set Extended Scan.. (0x08|0x0041) plen 13  #7 [hci0] 2.338097
        Own address type: Random (0x01)
        Filter policy: Accept all advertisement (0x00)
        PHYs: 0x05
        Entry 0: LE 1M
          Type: Active (0x01)
          Interval: 22.500 msec (0x0024)
          Window: 11.250 msec (0x0012)
        Entry 1: LE Coded
          Type: Active (0x01)
          Interval: 67.500 msec (0x006c)
          Window: 33.750 msec (0x0036)
> HCI Event: Command Complete (0x0e) plen 4                  #8 [hci0] 2.338991
      LE Set Extended Scan Parameters (0x08|0x0041) ncmd 1
        Status: Success (0x00)
< HCI Command: LE Set Extended Scan... (0x08|0x0042) plen 6  #9 [hci0] 2.339104
        Extended scan: Enabled (0x01)
        Filter duplicates: Disabled (0x00)
        Duration: 0 msec (0x0000)
        Period: 0.00 sec (0x0000)
> HCI Event: Command Complete (0x0e) plen 4                 #10 [hci0] 2.339991
      LE Set Extended Scan Enable (0x08|0x0042) ncmd 1
        Status: Success (0x00)
@ MGMT Event: Discovering (0x0013) plen 2              {0x0002} [hci0] 2.340000
        Address type: 0x07
          BR/EDR
          LE Public
          LE Random
        Discovery: Enabled (0x01)
@ MGMT Event: Discovering (0x0013) plen 2              {0x0001} [hci0] 2.340000
        Address type: 0x07
          BR/EDR
          LE Public
          LE Random
        Discovery: Enabled (0x01)
< HCI Command: Inquiry (0x01|0x0001) plen 5                 #11 [hci0] 2.340020
        Access code: 0x9e8b33 (General Inquiry)
        Length: 10.24s (0x08)
        Num responses: 0
> HCI Event: Command Status (0x0f) plen 4                   #12 [hci0] 2.346992
      Inquiry (0x01|0x0001) ncmd 1
        Status: Success (0x00)
@ MGMT Event: Command Complete (0x0001) plen 4         {0x0001} [hci0] 2.347143
      Start Service Discovery (0x003a) plen 1
        Status: Success (0x00)
        Address type: 0x07
          BR/EDR
          LE Public
          LE Random
> HCI Event: LE Meta Event (0x3e) plen 43                   #13 [hci0] 2.348018
      LE Extended Advertising Report (0x0d)
        Num reports: 1
        Entry 0
          Event type: 0x0013
            Props: 0x0013
              Connectable
              Scannable
              Use legacy advertising PDUs
            Data status: [0;32mComplete[0m
          Legacy PDU Type: ADV_IND (0x0013)
          Address type: Random (0x01)
          Address: 46:34:B5:FF:67:F4 (Resolvable)
          Primary PHY: LE 1M
          Secondary PHY: No packets
          SID: no ADI field (0xff)
          TX power: 127 dBm
          RSSI: -98 dBm (0x9e)
          Periodic advertising interval: 0.00 msec (0x0000)
          Direct address type: Public (0x00)
          Direct address: 00:00:00:00:00:00 (OUI 00-00-00)
          Data length: 0x11
        02 01 1a 02 0a 0c 0a ff 4c 00 10 05 36 1c d8 68  ........L...6..h
        54                                               T               
        Flags: 0x1a
          LE General Discoverable Mode
          Simultaneous LE and BR/EDR (Controller)
          Simultaneous LE and BR/EDR (Host)
        TX power: 12 dBm
        Company: Apple, Inc. (76)
          Type: Unknown (16)
          Data: 361cd86854
> HCI Event: LE Meta Event (0x3e) plen 26                   #14 [hci0] 2.349007
      LE Extended Advertising Report (0x0d)
        Num reports: 1
        Entry 0
          Event type: 0x001b
            Props: 0x001b
              Connectable
              Scannable
              Scan response
              Use legacy advertising PDUs
            Data status: [0;32mComplete[0m
          Legacy PDU Type: SCAN_RSP to an ADV_SCAN_IND (0x001b)
          Address type: Random (0x01)
          Address: 46:34:B5:FF:67:F4 (Resolvable)
          Primary PHY: LE 1M
          Secondary PHY: No packets
          SID: no ADI field (0xff)
          TX power: 127 dBm
          RSSI: -98 dBm (0x9e)
          Periodic advertising interval: 0.00 msec (0x0000)
          Direct address type: Public (0x00)
          Direct address: 00:00:00:00:00:00 (OUI 00-00-00)
          Data length: 0x00
@ MGMT Event: Device Found (0x0012) plen 31            {0x0002} [hci0] 2.349022
        LE Address: 46:34:B5:FF:67:F4 (Resolvable)
        RSSI: -98 dBm (0x9e)
        Flags: 0x00000000
        Data length: 17
        Flags: 0x1a
          LE General Discoverable Mode
          Simultaneous LE and BR/EDR (Controller)
          Simultaneous LE and BR/EDR (Host)
        TX power: 12 dBm
        Company: Apple, Inc. (76)
          Type: Unknown (16)
          Data: 361cd86854
@ MGMT Event: Device Found (0x0012) plen 31            {0x0001} [hci0] 2.349022
        LE Address: 46:34:B5:FF:67:F4 (Resolvable)
        RSSI: -98 dBm (0x9e)
        Flags: 0x00000000
        Data length: 17
        Flags: 0x1a
          LE General Discoverable Mode
          Simultaneous LE and BR/EDR (Controller)
          Simultaneous LE and BR/EDR (Host)
        TX power: 12 dBm
        Company: Apple, Inc. (76)
          Type: Unknown (16)
          Data: 361cd86854
> HCI Event: LE Meta Event (0x3e) plen 57                   #15 [hci0] 3.108144
      LE Extended Advertising Report (0x0d)
        Num reports: 1
        Entry 0
          Event type: 0x0010
            Props: 0x0010
              Use legacy advertising PDUs
            Data status: [0;32mComplete[0m
          Legacy PDU Type: ADV_NONCONN_IND (0x0010)
          Address type: Random (0x01)
          Address: 7B:D9:E9:4E:3A:35 (Resolvable)
          Primary PHY: LE 1M
          Secondary PHY: No packets
          SID: no ADI field (0xff)
          TX power: 127 dBm
          RSSI: -89 dBm (0xa7)
          Periodic advertising interval: 0.00 msec (0x0000)
          Direct address type: Public (0x00)
          Direct address: 00:00:00:00:00:00 (OUI 00-00-00)
          Data length: 0x1f
        1e ff 06 00 01 09 20 02 15 5e f2 b7 e2 64 7b 27  ...... ..^...d{'
        c9 f3 e6 ea c8 b3 69 08 2f 7a 1b ea 0d f8 ee     ......i./z..... 
        Company: Microsoft (6)
          Data: 01092002155ef2b7e2647b27c9f3e6eac8b369082f7a1bea0df8ee
@ MGMT Event: Device Found (0x0012) plen 45            {0x0002} [hci0] 3.108176
        LE Address: 7B:D9:E9:4E:3A:35 (Resolvable)
        RSSI: -89 dBm (0xa7)
        Flags: 0x00000004
          Not Connectable
        Data length: 31
        Company: Microsoft (6)
          Data: 01092002155ef2b7e2647b27c9f3e6eac8b369082f7a1bea0df8ee
@ MGMT Event: Device Found (0x0012) plen 45            {0x0001} [hci0] 3.108176
        LE Address: 7B:D9:E9:4E:3A:35 (Resolvable)
        RSSI: -89 dBm (0xa7)
        Flags: 0x00000004
          Not Connectable
        Data length: 31
        Company: Microsoft (6)
          Data: 01092002155ef2b7e2647b27c9f3e6eac8b369082f7a1bea0df8ee
bluetoothd[2915165]: @ MGMT Command.. (0x0024) plen 1  {0x0001} [hci0] 3.722212
        Address type: 0x07
          BR/EDR
          LE Public
          LE Random
< HCI Command: Inquiry Cancel (0x01|0x0002) plen 0          #16 [hci0] 3.722251
> HCI Event: Command Complete (0x0e) plen 4                 #17 [hci0] 3.724185
      Inquiry Cancel (0x01|0x0002) ncmd 1
        Status: Success (0x00)
< HCI Command: LE Set Extended Scan.. (0x08|0x0042) plen 6  #18 [hci0] 3.724222
        Extended scan: Disabled (0x00)
        Filter duplicates: Disabled (0x00)
        Duration: 0 msec (0x0000)
        Period: 0.00 sec (0x0000)
> HCI Event: Command Complete (0x0e) plen 4                 #19 [hci0] 3.736138
      LE Set Extended Scan Enable (0x08|0x0042) ncmd 1
        Status: Success (0x00)
@ MGMT Event: Discovering (0x0013) plen 2              {0x0002} [hci0] 3.736154
        Address type: 0x07
          BR/EDR
          LE Public
          LE Random
        Discovery: Disabled (0x00)
@ MGMT Event: Discovering (0x0013) plen 2              {0x0001} [hci0] 3.736154
        Address type: 0x07
          BR/EDR
          LE Public
          LE Random
        Discovery: Disabled (0x00)
@ MGMT Event: Command Complete (0x0001) plen 4         {0x0001} [hci0] 3.736310
      Stop Discovery (0x0024) plen 1
        Status: Success (0x00)
        Address type: 0x07
          BR/EDR
          LE Public
          LE Random
bluetoothd[2915165]: @ MGMT Command.. (0x0023) plen 1  {0x0001} [hci0] 8.724902
        Address type: 0x07
          BR/EDR
          LE Public
          LE Random
< HCI Command: LE Set Random Address (0x08|0x0005) plen 6   #20 [hci0] 8.725041
        Address: 27:35:DB:57:27:92 (Non-Resolvable)
> HCI Event: Command Complete (0x0e) plen 4                 #21 [hci0] 8.819197
      LE Set Random Address (0x08|0x0005) ncmd 1
        Status: Success (0x00)
< HCI Command: LE Set Extended Sca.. (0x08|0x0041) plen 13  #22 [hci0] 8.819531
        Own address type: Random (0x01)
        Filter policy: Accept all advertisement (0x00)
        PHYs: 0x05
        Entry 0: LE 1M
          Type: Active (0x01)
          Interval: 22.500 msec (0x0024)
          Window: 11.250 msec (0x0012)
        Entry 1: LE Coded
          Type: Active (0x01)
          Interval: 67.500 msec (0x006c)
          Window: 33.750 msec (0x0036)
> HCI Event: Command Complete (0x0e) plen 4                 #23 [hci0] 8.820179
      LE Set Extended Scan Parameters (0x08|0x0041) ncmd 1
        Status: Success (0x00)
< HCI Command: LE Set Extended Scan.. (0x08|0x0042) plen 6  #24 [hci0] 8.820357
        Extended scan: Enabled (0x01)
        Filter duplicates: Enabled (0x01)
        Duration: 0 msec (0x0000)
        Period: 0.00 sec (0x0000)
> HCI Event: Command Complete (0x0e) plen 4                 #25 [hci0] 8.821178
      LE Set Extended Scan Enable (0x08|0x0042) ncmd 1
        Status: Success (0x00)
@ MGMT Event: Discovering (0x0013) plen 2              {0x0002} [hci0] 8.821271
        Address type: 0x07
          BR/EDR
          LE Public
          LE Random
        Discovery: Enabled (0x01)
@ MGMT Event: Discovering (0x0013) plen 2              {0x0001} [hci0] 8.821271
        Address type: 0x07
          BR/EDR
          LE Public
          LE Random
        Discovery: Enabled (0x01)
< HCI Command: Inquiry (0x01|0x0001) plen 5                 #26 [hci0] 8.821537
        Access code: 0x9e8b33 (General Inquiry)
        Length: 10.24s (0x08)
        Num responses: 0
> HCI Event: Command Status (0x0f) plen 4                   #27 [hci0] 8.833263
      Inquiry (0x01|0x0001) ncmd 1
        Status: Success (0x00)
@ MGMT Event: Command Complete (0x0001) plen 4         {0x0001} [hci0] 8.833515
      Start Discovery (0x0023) plen 1
        Status: Success (0x00)
        Address type: 0x07
          BR/EDR
          LE Public
          LE Random
> HCI Event: LE Meta Event (0x3e) plen 39                  #28 [hci0] 10.576419
      LE Extended Advertising Report (0x0d)
        Num reports: 1
        Entry 0
          Event type: 0x0013
            Props: 0x0013
              Connectable
              Scannable
              Use legacy advertising PDUs
            Data status: [0;32mComplete[0m
          Legacy PDU Type: ADV_IND (0x0013)
          Address type: Random (0x01)
          Address: C0:DE:54:15:00:51 (Static)
          Primary PHY: LE 1M
          Secondary PHY: No packets
          SID: no ADI field (0xff)
          TX power: 127 dBm
          RSSI: -80 dBm (0xb0)
          Periodic advertising interval: 0.00 msec (0x0000)
          Direct address type: Public (0x00)
          Direct address: 00:00:00:00:00:00 (OUI 00-00-00)
          Data length: 0x0d
        02 01 06 09 09 58 35 34 2d 50 41 49 52           .....X54-PAIR   
        Flags: 0x06
          LE General Discoverable Mode
          BR/EDR Not Supported
        Name (complete): X54-PAIR
> HCI Event: LE Meta Event (0x3e) plen 57                  #29 [hci0] 11.446384
      LE Extended Advertising Report (0x0d)
        Num reports: 1
        Entry 0
          Event type: 0x0010
            Props: 0x0010
              Use legacy advertising PDUs
            Data status: [0;32mComplete[0m
          Legacy PDU Type: ADV_NONCONN_IND (0x0010)
          Address type: Random (0x01)
          Address: 7B:D9:E9:4E:3A:35 (Resolvable)
          Primary PHY: LE 1M
          Secondary PHY: No packets
          SID: no ADI field (0xff)
          TX power: 127 dBm
          RSSI: -89 dBm (0xa7)
          Periodic advertising interval: 0.00 msec (0x0000)
          Direct address type: Public (0x00)
          Direct address: 00:00:00:00:00:00 (OUI 00-00-00)
          Data length: 0x1f
        1e ff 06 00 01 09 20 02 15 5e f2 b7 e2 64 7b 27  ...... ..^...d{'
        c9 f3 e6 ea c8 b3 69 08 2f 7a 1b ea 0d f8 ee     ......i./z..... 
        Company: Microsoft (6)
          Data: 01092002155ef2b7e2647b27c9f3e6eac8b369082f7a1bea0df8ee
@ MGMT Event: Device Found (0x0012) plen 27           {0x0002} [hci0] 11.446511
        LE Address: C0:DE:54:15:00:51 (Static)
        RSSI: -80 dBm (0xb0)
        Flags: 0x00000000
        Data length: 13
        Flags: 0x06
          LE General Discoverable Mode
          BR/EDR Not Supported
        Name (complete): X54-PAIR
@ MGMT Event: Device Found (0x0012) plen 27           {0x0001} [hci0] 11.446511
        LE Address: C0:DE:54:15:00:51 (Static)
        RSSI: -80 dBm (0xb0)
        Flags: 0x00000000
        Data length: 13
        Flags: 0x06
          LE General Discoverable Mode
          BR/EDR Not Supported
        Name (complete): X54-PAIR
@ MGMT Event: Device Found (0x0012) plen 45           {0x0002} [hci0] 11.446517
        LE Address: 7B:D9:E9:4E:3A:35 (Resolvable)
        RSSI: -89 dBm (0xa7)
        Flags: 0x00000004
          Not Connectable
        Data length: 31
        Company: Microsoft (6)
          Data: 01092002155ef2b7e2647b27c9f3e6eac8b369082f7a1bea0df8ee
@ MGMT Event: Device Found (0x0012) plen 45           {0x0001} [hci0] 11.446517
        LE Address: 7B:D9:E9:4E:3A:35 (Resolvable)
        RSSI: -89 dBm (0xa7)
        Flags: 0x00000004
          Not Connectable
        Data length: 31
        Company: Microsoft (6)
          Data: 01092002155ef2b7e2647b27c9f3e6eac8b369082f7a1bea0df8ee
bluetoothctl[1072373]: @ MGMT Close: bluetoothctl            {0x0002} 12.238814
bluetoothd[2915165]: @ MGMT Comman.. (0x0024) plen 1  {0x0001} [hci0] 12.241509
        Address type: 0x07
          BR/EDR
          LE Public
          LE Random
< HCI Command: Inquiry Cancel (0x01|0x0002) plen 0         #30 [hci0] 12.241525
> HCI Event: Command Complete (0x0e) plen 4                #31 [hci0] 12.242366
      Inquiry Cancel (0x01|0x0002) ncmd 1
        Status: Success (0x00)
< HCI Command: LE Set Extended Sca.. (0x08|0x0042) plen 6  #32 [hci0] 12.242380
        Extended scan: Disabled (0x00)
        Filter duplicates: Disabled (0x00)
        Duration: 0 msec (0x0000)
        Period: 0.00 sec (0x0000)
bluetoothctl[1073313]: @ MGMT O..n (privileged) version 1.23  {0x0002} 12.247239
> HCI Event: Command Complete (0x0e) plen 4                #33 [hci0] 12.255371
      LE Set Extended Scan Enable (0x08|0x0042) ncmd 1
        Status: Success (0x00)
@ MGMT Event: Command Complete (0x0001) plen 4        {0x0001} [hci0] 12.255460
      Stop Discovery (0x0024) plen 1
        Status: Success (0x00)
        Address type: 0x07
          BR/EDR
          LE Public
          LE Random
@ MGMT Event: Discovering (0x0013) plen 2             {0x0002} [hci0] 12.255463
        Address type: 0x07
          BR/EDR
          LE Public
          LE Random
        Discovery: Disabled (0x00)
@ MGMT Event: Discovering (0x0013) plen 2             {0x0001} [hci0] 12.255463
        Address type: 0x07
          BR/EDR
          LE Public
          LE Random
        Discovery: Disabled (0x00)
bluetoothctl[1073313]: @ MGMT Close: bluetoothctl            {0x0002} 18.257283
bluetoothctl[1073836]: @ MGMT O..n (privileged) version 1.23  {0x0002} 18.276218
bluetoothd[2915165]: @ MGMT Comman.. (0x003a) plen 4  {0x0001} [hci0] 23.728861
        Address type: 0x01
          BR/EDR
        RSSI: invalid (0x7f)
        UUIDs: 0
< HCI Command: Inquiry (0x01|0x0001) plen 5                #34 [hci0] 23.729051
        Access code: 0x9e8b33 (General Inquiry)
        Length: 10.24s (0x08)
        Num responses: 0
> HCI Event: Command Status (0x0f) plen 4                  #35 [hci0] 23.824696
      Inquiry (0x01|0x0001) ncmd 1
        Status: Success (0x00)
@ MGMT Event: Command Complete (0x0001) plen 4        {0x0001} [hci0] 23.825012
      Start Service Discovery (0x003a) plen 1
        Status: Success (0x00)
        Address type: 0x01
          BR/EDR
@ MGMT Event: Discovering (0x0013) plen 2             {0x0002} [hci0] 23.825029
        Address type: 0x01
          BR/EDR
        Discovery: Enabled (0x01)
@ MGMT Event: Discovering (0x0013) plen 2             {0x0001} [hci0] 23.825029
        Address type: 0x01
          BR/EDR
        Discovery: Enabled (0x01)
bluetoothctl[1073836]: @ MGMT Close: bluetoothctl            {0x0002} 26.280867
bluetoothctl[1074593]: @ MGMT O..n (privileged) version 1.23  {0x0002} 26.300475
> HCI Event: Inquiry Complete (0x01) plen 1                #36 [hci0] 34.130017
        Status: Success (0x00)
@ MGMT Event: Discovering (0x0013) plen 2             {0x0002} [hci0] 34.130114
        Address type: 0x01
          BR/EDR
        Discovery: Disabled (0x00)
@ MGMT Event: Discovering (0x0013) plen 2             {0x0001} [hci0] 34.130114
        Address type: 0x01
          BR/EDR
        Discovery: Disabled (0x00)
< HCI Command: LE Add Device To Ac.. (0x08|0x0011) plen 7  #37 [hci0] 34.130248
        Address type: Random (0x01)
        Address: C0:DE:54:15:00:51 (Static)
bluetoothd[2915165]: @ MGMT Comman.. (0x003a) plen 4  {0x0001} [hci0] 34.130414
        Address type: 0x01
          BR/EDR
        RSSI: invalid (0x7f)
        UUIDs: 0
> HCI Event: Command Complete (0x0e) plen 4                #38 [hci0] 34.130906
      LE Add Device To Accept List (0x08|0x0011) ncmd 1
        Status: Success (0x00)
< HCI Command: LE Set Address Reso.. (0x08|0x002d) plen 1  #39 [hci0] 34.131265
        Address resolution: Enabled (0x01)
> HCI Event: Command Complete (0x0e) plen 4                #40 [hci0] 34.131909
      LE Set Address Resolution Enable (0x08|0x002d) ncmd 1
        Status: Success (0x00)
< HCI Command: LE Set Extended Sc.. (0x08|0x0041) plen 13  #41 [hci0] 34.132311
        Own address type: Public (0x00)
        Filter policy: Ignore not in accept list (0x01)
        PHYs: 0x05
        Entry 0: LE 1M
          Type: Passive (0x00)
          Interval: 60.000 msec (0x0060)
          Window: 60.000 msec (0x0060)
        Entry 1: LE Coded
          Type: Passive (0x00)
          Interval: 180.000 msec (0x0120)
          Window: 180.000 msec (0x0120)
> HCI Event: Command Complete (0x0e) plen 4                #42 [hci0] 34.132986
      LE Set Extended Scan Parameters (0x08|0x0041) ncmd 1
        Status: Success (0x00)
< HCI Command: LE Set Extended Sca.. (0x08|0x0042) plen 6  #43 [hci0] 34.133267
        Extended scan: Enabled (0x01)
        Filter duplicates: Enabled (0x01)
        Duration: 0 msec (0x0000)
        Period: 0.00 sec (0x0000)
> HCI Event: Command Complete (0x0e) plen 4                #44 [hci0] 34.133914
      LE Set Extended Scan Enable (0x08|0x0042) ncmd 1
        Status: Success (0x00)
< HCI Command: Inquiry (0x01|0x0001) plen 5                #45 [hci0] 34.134234
        Access code: 0x9e8b33 (General Inquiry)
        Length: 10.24s (0x08)
        Num responses: 0
> HCI Event: Command Status (0x0f) plen 4                  #46 [hci0] 34.178019
      Inquiry (0x01|0x0001) ncmd 1
        Status: Success (0x00)
@ MGMT Event: Command Complete (0x0001) plen 4        {0x0001} [hci0] 34.178240
      Start Service Discovery (0x003a) plen 1
        Status: Success (0x00)
        Address type: 0x01
          BR/EDR
@ MGMT Event: Discovering (0x0013) plen 2             {0x0002} [hci0] 34.178247
        Address type: 0x01
          BR/EDR
        Discovery: Enabled (0x01)
@ MGMT Event: Discovering (0x0013) plen 2             {0x0001} [hci0] 34.178247
        Address type: 0x01
          BR/EDR
        Discovery: Enabled (0x01)
> HCI Event: LE Meta Event (0x3e) plen 39                  #47 [hci0] 34.952091
      LE Extended Advertising Report (0x0d)
        Num reports: 1
        Entry 0
          Event type: 0x0013
            Props: 0x0013
              Connectable
              Scannable
              Use legacy advertising PDUs
            Data status: [0;32mComplete[0m
          Legacy PDU Type: ADV_IND (0x0013)
          Address type: Random (0x01)
          Address: C0:DE:54:15:00:51 (Static)
          Primary PHY: LE 1M
          Secondary PHY: No packets
          SID: no ADI field (0xff)
          TX power: 127 dBm
          RSSI: -80 dBm (0xb0)
          Periodic advertising interval: 0.00 msec (0x0000)
          Direct address type: Public (0x00)
          Direct address: 00:00:00:00:00:00 (OUI 00-00-00)
          Data length: 0x0d
        02 01 06 09 09 58 35 34 2d 50 41 49 52           .....X54-PAIR   
        Flags: 0x06
          LE General Discoverable Mode
          BR/EDR Not Supported
        Name (complete): X54-PAIR
< HCI Command: LE Set Extended Sca.. (0x08|0x0042) plen 6  #48 [hci0] 34.952411
        Extended scan: Disabled (0x00)
        Filter duplicates: Disabled (0x00)
        Duration: 0 msec (0x0000)
        Period: 0.00 sec (0x0000)
> HCI Event: Command Complete (0x0e) plen 4                #49 [hci0] 34.953054
      LE Set Extended Scan Enable (0x08|0x0042) ncmd 1
        Status: Success (0x00)
< HCI Command: LE Extended Create.. (0x08|0x0043) plen 26  #50 [hci0] 34.953156
        Filter policy: Accept list is not used (0x00)
        Own address type: Public (0x00)
        Peer address type: Random (0x01)
        Peer address: C0:DE:54:15:00:51 (Static)
        Initiating PHYs: 0x01
        Entry 0: LE 1M
          Scan interval: 60.000 msec (0x0060)
          Scan window: 60.000 msec (0x0060)
          Min connection interval: 30.00 msec (0x0018)
          Max connection interval: 50.00 msec (0x0028)
          Connection latency: 0 (0x0000)
          Supervision timeout: 420 msec (0x002a)
          Min connection length: 0.000 msec (0x0000)
          Max connection length: 0.000 msec (0x0000)
> HCI Event: Command Status (0x0f) plen 4                  #51 [hci0] 34.954931
      LE Extended Create Connection (0x08|0x0043) ncmd 1
        Status: Success (0x00)
> HCI Event: LE Meta Event (0x3e) plen 31                  #52 [hci0] 35.783086
      LE Enhanced Connection Complete (0x0a)
        Status: Success (0x00)
        Handle: 2048
        Role: Central (0x00)
        Peer address type: Random (0x01)
        Peer address: C0:DE:54:15:00:51 (Static)
        Local resolvable private address: 00:00:00:00:00:00 (Non-Resolvable)
        Peer resolvable private address: 00:00:00:00:00:00 (Non-Resolvable)
        Connection interval: 45.00 msec (0x0024)
        Connection latency: 0 (0x0000)
        Supervision timeout: 420 msec (0x002a)
        Central clock accuracy: 0x00
@ MGMT Event: Device Connected (0x000b) plen 26       {0x0002} [hci0] 35.783185
        LE Address: C0:DE:54:15:00:51 (Static)
        Flags: 0x00000008
          Connection Locally Initiated
        Data length: 13
        Flags: 0x06
          LE General Discoverable Mode
          BR/EDR Not Supported
        Name (complete): X54-PAIR
@ MGMT Event: Device Connected (0x000b) plen 26       {0x0001} [hci0] 35.783185
        LE Address: C0:DE:54:15:00:51 (Static)
        Flags: 0x00000008
          Connection Locally Initiated
        Data length: 13
        Flags: 0x06
          LE General Discoverable Mode
          BR/EDR Not Supported
        Name (complete): X54-PAIR
btmon[1072211]: @ RAW Open: btmon (privileged) version 2.22  {0x0003} 35.783368
btmon[1072211]: @ RAW Close: btmon                           {0x0003} 35.783375
> HCI Event: LE Meta Event (0x3e) plen 4                   #53 [hci0] 35.783955
      LE Channel Selection Algorithm (0x14)
        Handle: 2048 Address: C0:DE:54:15:00:51 (Static)
        Algorithm: #2 (0x01)
< HCI Command: LE Read Remote Used.. (0x08|0x0016) plen 2  #54 [hci0] 35.789761
        Handle: 2048 Address: C0:DE:54:15:00:51 (Static)
> HCI Event: Command Status (0x0f) plen 4                  #55 [hci0] 35.790965
      LE Read Remote Used Features (0x08|0x0016) ncmd 1
        Status: Success (0x00)
> HCI Event: LE Meta Event (0x3e) plen 12                  #56 [hci0] 35.889083
      LE Read Remote Used Features (0x04)
        Status: Success (0x00)
        Handle: 2048 Address: C0:DE:54:15:00:51 (Static)
        Features: 0x1f 0x00 0x00 0x00 0x00 0x00 0x00 0x00
          LE Encryption
          Connection Parameter Request Procedure
          Extended Reject Indication
          Peripheral-initiated Features Exchange
          LE Ping
bluetoothd[2915165]: < ACL Data TX: H.. flags 0x00 dlen 7  #57 [hci0] 35.889462
      ATT: Exchange MTU Request (0x02) len 2
        Client RX MTU: 517
> HCI Event: Number of Completed Packets (0x13) plen 5     #58 [hci0] 35.979032
        Num handles: 1
        Handle: 2048 Address: C0:DE:54:15:00:51 (Static)
        Count: 1
        #57: len 7 (0 Kb/s)
        Latency: 89 msec (89-89 msec ~89 msec)
> ACL Data RX: Handle 2048 flags 0x02 dlen 7               #59 [hci0] 36.024831
      ATT: Exchange MTU Response (0x03) len 2
        Server RX MTU: 23
bluetoothd[2915165]: < ACL Data TX:... flags 0x00 dlen 11  #60 [hci0] 36.025144
      ATT: Read By Type Request (0x08) len 6
        Handle range: 0x0001-0xffff
        Attribute type: Server Supported Features (0x2b3a)
> HCI Event: Number of Completed Packets (0x13) plen 5     #61 [hci0] 36.069087
        Num handles: 1
        Handle: 2048 Address: C0:DE:54:15:00:51 (Static)
        Count: 1
        #60: len 11 (2 Kb/s)
        Latency: 43 msec (43-89 msec ~66 msec)
> ACL Data RX: Handle 2048 flags 0x02 dlen 9               #62 [hci0] 36.114848
      ATT: Error Response (0x01) len 4
        Read By Type Request (0x08)
        Handle: 0x0001
        Error: Attribute Not Found (0x0a)
bluetoothd[2915165]: < ACL Data TX:... flags 0x00 dlen 11  #63 [hci0] 36.115147
      ATT: Read By Group Type Request (0x10) len 6
        Handle range: 0x0001-0xffff
        Attribute group type: Primary Service (0x2800)
> HCI Event: Number of Completed Packets (0x13) plen 5     #64 [hci0] 36.159071
        Num handles: 1
        Handle: 2048 Address: C0:DE:54:15:00:51 (Static)
        Count: 1
        #63: len 11 (2 Kb/s)
        Latency: 43 msec (43-89 msec ~55 msec)
> ACL Data RX: Handle 2048 flags 0x02 dlen 24              #65 [hci0] 36.205885
      ATT: Read By Group Type Response (0x11) len 19
        Attribute data length: 6
        Attribute group list: 3 entries
        Handle range: 0x0001-0x0007
        UUID: Generic Access Profile (0x1800)
        Handle range: 0x0008-0x000b
        UUID: Generic Attribute Profile (0x1801)
        Handle range: 0x0010-0x0013
        UUID: Battery Service (0x180f)
bluetoothd[2915165]: < ACL Data TX:... flags 0x00 dlen 11  #66 [hci0] 36.206189
      ATT: Read By Group Type Request (0x10) len 6
        Handle range: 0x0014-0xffff
        Attribute group type: Primary Service (0x2800)
> HCI Event: Number of Completed Packets (0x13) plen 5     #67 [hci0] 36.249055
        Num handles: 1
        Handle: 2048 Address: C0:DE:54:15:00:51 (Static)
        Count: 1
        #66: len 11 (2 Kb/s)
        Latency: 42 msec (42-89 msec ~49 msec)
> ACL Data RX: Handle 2048 flags 0x02 dlen 9               #68 [hci0] 36.294806
      ATT: Error Response (0x01) len 4
        Read By Group Type Request (0x10)
        Handle: 0x0014
        Error: Attribute Not Found (0x0a)
bluetoothd[2915165]: < ACL Data TX:... flags 0x00 dlen 11  #69 [hci0] 36.295106
      ATT: Read By Group Type Request (0x10) len 6
        Handle range: 0x0001-0xffff
        Attribute group type: Secondary Service (0x2801)
bluetoothctl[1074593]: @ MGMT Close: bluetoothctl            {0x0002} 36.306396
bluetoothctl[1075481]: @ MGMT O..n (privileged) version 1.23  {0x0002} 36.320376
bluetoothd[2915165]: @ MGMT Comman.. (0x0024) plen 1  {0x0001} [hci0] 36.324877
        Address type: 0x01
          BR/EDR
< HCI Command: Inquiry Cancel (0x01|0x0002) plen 0         #70 [hci0] 36.325106
> HCI Event: Command Complete (0x0e) plen 4                #71 [hci0] 36.327030
      Inquiry Cancel (0x01|0x0002) ncmd 1
        Status: Success (0x00)
@ MGMT Event: Discovering (0x0013) plen 2             {0x0002} [hci0] 36.327143
        Address type: 0x01
          BR/EDR
        Discovery: Disabled (0x00)
@ MGMT Event: Discovering (0x0013) plen 2             {0x0001} [hci0] 36.327143
        Address type: 0x01
          BR/EDR
        Discovery: Disabled (0x00)
@ MGMT Event: Command Complete (0x0001) plen 4        {0x0001} [hci0] 36.327253
      Stop Discovery (0x0024) plen 1
        Status: Success (0x00)
        Address type: 0x01
          BR/EDR
bluetoothd[2915165]: @ MGMT Comman.. (0x0019) plen 8  {0x0001} [hci0] 36.327320
        LE Address: C0:DE:54:15:00:51 (Static)
        Capability: DisplayYesNo (0x01)
< ACL Data TX: Handle 2048 flags 0x00 dlen 11              #72 [hci0] 36.327445
      SMP: Pairing Request (0x01) len 6
        IO capability: DisplayYesNo (0x01)
        OOB data: Authentication data not present (0x00)
        Authentication requirement: Bonding, MITM, SC, No Keypresses, CT2 (0x2d)
        Max encryption key size: 16
        Initiator key distribution: EncKey Sign LinkKey (0x0d)
        Responder key distribution: EncKey IdKey Sign LinkKey (0x0f)
> HCI Event: Number of Completed Packets (0x13) plen 5     #73 [hci0] 36.384096
        Num handles: 1
        Handle: 2048 Address: C0:DE:54:15:00:51 (Static)
        Count: 1
        #69: len 11 (1 Kb/s)
        Latency: 88 msec (42-89 msec ~69 msec)
> HCI Event: Number of Completed Packets (0x13) plen 5     #74 [hci0] 36.429053
        Num handles: 1
        Handle: 2048 Address: C0:DE:54:15:00:51 (Static)
        Count: 1
        #72: len 11 (0 Kb/s)
        Latency: 101 msec (42-101 msec ~85 msec)
> ACL Data RX: Handle 2048 flags 0x02 dlen 9               #75 [hci0] 36.429836
      ATT: Error Response (0x01) len 4
        Read By Group Type Request (0x10)
        Handle: 0x0001
        Error: Unsupported Group Type (0x10)
bluetoothd[2915165]: < ACL Data TX:... flags 0x00 dlen 11  #76 [hci0] 36.430193
      ATT: Read By Type Request (0x08) len 6
        Handle range: 0x0001-0x0013
        Attribute type: Include (0x2802)
> HCI Event: Number of Completed Packets (0x13) plen 5     #77 [hci0] 36.474036
        Num handles: 1
        Handle: 2048 Address: C0:DE:54:15:00:51 (Static)
        Count: 1
        #76: len 11 (2 Kb/s)
        Latency: 43 msec (42-101 msec ~64 msec)
> ACL Data RX: Handle 2048 flags 0x02 dlen 11              #78 [hci0] 36.474736
      SMP: Pairing Response (0x02) len 6
        IO capability: NoInputNoOutput (0x03)
        OOB data: Authentication data not present (0x00)
        Authentication requirement: Bonding, No MITM, Legacy, No Keypresses (0x01)
        Max encryption key size: 16
        Initiator key distribution: EncKey (0x01)
        Responder key distribution: <none> (0x00)
@ MGMT Event: User Confirmation R.. (0x000f) plen 12  {0x0002} [hci0] 36.475116
        LE Address: C0:DE:54:15:00:51 (Static)
        Confirm hint: 0x01
        Value: 0x00000000
@ MGMT Event: User Confirmation R.. (0x000f) plen 12  {0x0001} [hci0] 36.475116
        LE Address: C0:DE:54:15:00:51 (Static)
        Confirm hint: 0x01
        Value: 0x00000000
bluetoothd[2915165]: @ MGMT Comman.. (0x001c) plen 7  {0x0001} [hci0] 36.475312
        LE Address: C0:DE:54:15:00:51 (Static)
@ MGMT Event: Command Complete (0x0001) plen 10       {0x0001} [hci0] 36.475323
      User Confirmation Reply (0x001c) plen 7
        Status: Success (0x00)
        LE Address: C0:DE:54:15:00:51 (Static)
< ACL Data TX: Handle 2048 flags 0x00 dlen 21              #79 [hci0] 36.475425
      SMP: Pairing Confirm (0x03) len 16
        Confim value: b396c7bdf5a6b90e38dbdf0ea12126ba
> HCI Event: Number of Completed Packets (0x13) plen 5     #80 [hci0] 36.519071
        Num handles: 1
        Handle: 2048 Address: C0:DE:54:15:00:51 (Static)
        Count: 1
        #79: len 21 (3 Kb/s)
        Latency: 43 msec (42-101 msec ~54 msec)
> ACL Data RX: Handle 2048 flags 0x02 dlen 9               #81 [hci0] 36.520731
      ATT: Error Response (0x01) len 4
        Read By Type Request (0x08)
        Handle: 0x0001
        Error: Attribute Not Found (0x0a)
bluetoothd[2915165]: < ACL Data TX:... flags 0x00 dlen 11  #82 [hci0] 36.521072
      ATT: Read By Type Request (0x08) len 6
        Handle range: 0x0001-0x0013
        Attribute type: Characteristic (0x2803)
> HCI Event: Number of Completed Packets (0x13) plen 5     #83 [hci0] 36.564058
        Num handles: 1
        Handle: 2048 Address: C0:DE:54:15:00:51 (Static)
        Count: 1
        #82: len 11 (2 Kb/s)
        Latency: 42 msec (42-101 msec ~48 msec)
> ACL Data RX: Handle 2048 flags 0x02 dlen 21              #84 [hci0] 36.565732
      SMP: Pairing Confirm (0x03) len 16
        Confim value: fc85842a542bff5ec518902d9b7655a8
< ACL Data TX: Handle 2048 flags 0x00 dlen 21              #85 [hci0] 36.565825
      SMP: Pairing Random (0x04) len 16
        Random value: 5c4045cc9cefec895c086af808853938
> HCI Event: Number of Completed Packets (0x13) plen 5     #86 [hci0] 36.609066
        Num handles: 1
        Handle: 2048 Address: C0:DE:54:15:00:51 (Static)
        Count: 1
        #85: len 21 (3 Kb/s)
        Latency: 43 msec (42-101 msec ~45 msec)
> ACL Data RX: Handle 2048 flags 0x02 dlen 27              #87 [hci0] 36.611723
      ATT: Read By Type Response (0x09) len 22
        Attribute data length: 7
        Attribute data list: 3 entries
        Handle: 0x0002
        Value: 020300002a
            Properties: 0x02
              Read (0x02)
            Value Handle: 0x0003
            Value UUID: Device Name (0x2a00)
        Handle: 0x0004
        Value: 020500012a
            Properties: 0x02
              Read (0x02)
            Value Handle: 0x0005
            Value UUID: Appearance (0x2a01)
        Handle: 0x0006
        Value: 020700042a
            Properties: 0x02
              Read (0x02)
            Value Handle: 0x0007
            Value UUID: Peripheral Preferred Connection Parameters (0x2a04)
bluetoothd[2915165]: < ACL Data TX:... flags 0x00 dlen 11  #88 [hci0] 36.611971
      ATT: Read By Type Request (0x08) len 6
        Handle range: 0x0007-0x0013
        Attribute type: Characteristic (0x2803)
> HCI Event: Number of Completed Packets (0x13) plen 5     #89 [hci0] 36.654982
        Num handles: 1
        Handle: 2048 Address: C0:DE:54:15:00:51 (Static)
        Count: 1
        #88: len 11 (2 Kb/s)
        Latency: 43 msec (42-101 msec ~44 msec)
> ACL Data RX: Handle 2048 flags 0x02 dlen 21              #90 [hci0] 36.655729
      SMP: Pairing Random (0x04) len 16
        Random value: b06cf8c672773e592ef2905a423c85e7
< HCI Command: LE Start Encryption (0x08|0x0019) plen 28   #91 [hci0] 36.655875
        Handle: 2048 Address: C0:DE:54:15:00:51 (Static)
        Random number: 0x0000000000000000
        Encrypted diversifier: 0x0000
        Long term key: ff3d3491972077af0363c9304f1b631e
> HCI Event: Command Status (0x0f) plen 4                  #92 [hci0] 36.656990
      LE Start Encryption (0x08|0x0019) ncmd 1
        Status: Success (0x00)
> HCI Event: Encryption Change (0x08) plen 4               #93 [hci0] 36.924018
        Status: Success (0x00)
        Handle: 2048 Address: C0:DE:54:15:00:51 (Static)
        Encryption: Enabled with AES-CCM (0x01)
@ MGMT Event: New Long Term Key (0x000a) plen 37      {0x0002} [hci0] 36.924144
        Store hint: Yes (0x01)
        LE Address: C0:DE:54:15:00:51 (Static)
        Key type: Unauthenticated legacy key (0x00)
        Central: 0x00
        Encryption size: 16
        Diversifier: e5b8
        Randomizer: 37a2af2dc6f4add3
        Key: 8351a0f239c4c71730eccac93f204d55
@ MGMT Event: New Long Term Key (0x000a) plen 37      {0x0001} [hci0] 36.924144
        Store hint: Yes (0x01)
        LE Address: C0:DE:54:15:00:51 (Static)
        Key type: Unauthenticated legacy key (0x00)
        Central: 0x00
        Encryption size: 16
        Diversifier: e5b8
        Randomizer: 37a2af2dc6f4add3
        Key: 8351a0f239c4c71730eccac93f204d55
@ MGMT Event: Command Complete (0x0001) plen 10       {0x0001} [hci0] 36.924152
      Pair Device (0x0019) plen 7
        Status: Success (0x00)
        LE Address: C0:DE:54:15:00:51 (Static)
< HCI Command: Write Authenticated.. (0x03|0x007c) plen 4  #94 [hci0] 36.924162
        Handle: 2048 Address: C0:DE:54:15:00:51 (Static)
        Timeout: 30000 msec (0x0bb8)
< ACL Data TX: Handle 2048 flags 0x00 dlen 21              #95 [hci0] 36.924179
      SMP: Encryption Information (0x06) len 16
        Long term key: 8351a0f239c4c71730eccac93f204d55
< ACL Data TX: Handle 2048 flags 0x00 dlen 15              #96 [hci0] 36.924186
      SMP: Central Identification (0x07) len 10
        EDIV: 0xb8e5
        Rand: 0xd3adf4c62dafa237
> HCI Event: Command Complete (0x0e) plen 6                #97 [hci0] 36.924987
      Write Authenticated Payload Timeout (0x03|0x007c) ncmd 1
        Status: Success (0x00)
        Handle: 2048 Address: C0:DE:54:15:00:51 (Static)
> HCI Event: Vendor (0xff) plen 7                          #98 [hci0] 37.019094
      Intel Bootup (0x02)
        Zero: 0x00
        Number of packets: 1
        Source: Operational firmware (0x01)
        Reset type: Soft software reset (0x02)
        Reset reason: System exception (0x05)
        DDC status: Persistent RAM (0x02)
> HCI Event: Vendor (0xff) plen 85                         #99 [hci0] 37.021099
        Vendor Prefix (0x8780)
      Intel Extended Telemetry (0x03)
        Extended event type (0x01): System Exception (0x00)
        Unknown extended subevent 0x07
        06                                               .               
        Unknown extended subevent 0x06
        0c 7a 1d 00 1e 46 08 80 04 02 06 00 00 00 00 00  .z...F..........
        00 00 00 00 00 00 00 00 00 02 06 00              ............    
        Unknown extended subevent 0x05
        2e 79 1d 00 80 84 1d 00 e0 7f 11 00 62 7e 1d 00  .y..........b~..
        0e 80 1d 00                                      ....            
        Unknown extended subevent 0xfa
        08 01 00 00                                      ....            
        Unknown extended subevent 0x43
        e0 66 14 00 80 00 00 00 19 20 7c 0c 01 00 00 00  .f....... |.....
= Vendor Diagnostic (len 214)                                  [hci0] 37.021201
        42 6c 75 65 74 6f 6f 74 68 20 64 65 76 63 6f 72  Bluetooth devcor
        65 64 75 6d 70 0a 53 74 61 74 65 3a 20 32 0a 00  edump.State: 2..
        43 6f 6e 74 72 6f 6c 6c 65 72 20 4e 61 6d 65 3a  Controller Name:
        20 30 78 31 43 0a 46 69 72 6d 77 61 72 65 20 56   0x1C.Firmware V
        65 72 73 69 6f 6e 3a 20 30 78 31 32 42 39 35 0a  ersion: 0x12B95.
        44 72 69 76 65 72 3a 20 62 74 75 73 62 0a 56 65  Driver: btusb.Ve
        6e 64 6f 72 3a 20 49 6e 74 65 6c 0a 2d 2d 2d 20  ndor: Intel.--- 
        53 74 61 72 74 20 64 75 6d 70 20 2d 2d 2d 0a ff  Start dump ---..
        55 87 80 03 01 01 00 07 01 06 06 1c 0c 7a 1d 00  U............z..
        1e 46 08 80 04 02 06 00 00 00 00 00 00 00 00 00  .F..............
        00 00 00 00 00 02 06 00 05 14 2e 79 1d 00 80 84  ...........y....
        1d 00 e0 7f 11 00 62 7e 1d 00 0e 80 1d 00 fa 04  ......b~........
        08 01 00 00 43 10 e0 66 14 00 80 00 00 00 19 20  ....C..f....... 
        7c 0c 01 00 00 00                                |.....          
> HCI Event: Hardware Error (0x10) plen 1                 #100 [hci0] 37.021996
        Code: 0x0c
< HCI Command: Reset (0x03|0x0003) plen 0                 #101 [hci0] 37.022182
> HCI Event: Command Complete (0x0e) plen 4               #102 [hci0] 37.073104
      Reset (0x03|0x0003) ncmd 1
        Status: Success (0x00)
< HCI Command: Intel Get Exceptio.. (0x3f|0x0022) plen 1  #103 [hci0] 37.073463
        00                                               .               
> HCI Event: Command Status (0x0f) plen 4                 #104 [hci0] 37.073991
      Intel Get Exception Info (0x3f|0x0022) ncmd 1
        Status: Command Disallowed (0x0c)
< HCI Command: Reset (0x03|0x0003) plen 0                 #105 [hci0] 37.074325
> HCI Event: Command Complete (0x0e) plen 4               #106 [hci0] 37.125162
      Reset (0x03|0x0003) ncmd 1
        Status: Success (0x00)
@ MGMT Event: Class Of Device Chan.. (0x0007) plen 3  {0x0002} [hci0] 37.125401
        Class: 0x000000
          Major class: Miscellaneous
          Minor class: 0x00
@ MGMT Event: Class Of Device Chan.. (0x0007) plen 3  {0x0001} [hci0] 37.125401
        Class: 0x000000
          Major class: Miscellaneous
          Minor class: 0x00
@ MGMT Event: New Settings (0x0006) plen 4            {0x0002} [hci0] 37.125412
        Current settings: 0x004c0ad0
          Bondable
          Secure Simple Pairing
          BR/EDR
          Low Energy
          Secure Connections
          CIS Central
          CIS Peripheral
          Unknown settings (0x00400000)
@ MGMT Event: New Settings (0x0006) plen 4            {0x0001} [hci0] 37.125412
        Current settings: 0x004c0ad0
          Bondable
          Secure Simple Pairing
          BR/EDR
          Low Energy
          Secure Connections
          CIS Central
          CIS Peripheral
          Unknown settings (0x00400000)
= Close Index: 68:34:21:E5:84:DF                               [hci0] 37.143965
= Open Index: 68:34:21:E5:84:DF                                [hci0] 37.144469
< HCI Command: Reset (0x03|0x0003) plen 0                 #107 [hci0] 37.144593
> HCI Event: Command Complete (0x0e) plen 4               #108 [hci0] 37.195002
      Reset (0x03|0x0003) ncmd 1
        Status: Success (0x00)
< HCI Command: Read Local Support.. (0x04|0x0003) plen 0  #109 [hci0] 37.195131
> HCI Event: Command Complete (0x0e) plen 12              #110 [hci0] 37.196002
      Read Local Supported Features (0x04|0x0003) ncmd 1
        Status: Success (0x00)
        Features: 0xbf 0xfe 0x0f 0xfe 0xdb 0xff 0x7b 0x87
          3 slot packets
          5 slot packets
          Encryption
          Slot offset
          Timing accuracy
          Role switch
          Sniff mode
          Power control requests
          Channel quality driven data rate (CQDDR)
          SCO link
          HV2 packets
          HV3 packets
          u-law log synchronous data
          A-law log synchronous data
          CVSD synchronous data
          Paging parameter negotiation
          Power control
          Transparent synchronous data
          Enhanced Data Rate ACL 2 Mbps mode
          Enhanced Data Rate ACL 3 Mbps mode
          Enhanced inquiry scan
          Interlaced inquiry scan
          Interlaced page scan
          RSSI with inquiry results
          Extended SCO link (EV3 packets)
          EV4 packets
          EV5 packets
          AFH capable peripheral
          AFH classification peripheral
          LE Supported (Controller)
          3-slot Enhanced Data Rate ACL packets
          5-slot Enhanced Data Rate ACL packets
          Sniff subrating
          Pause encryption
          AFH capable central
          AFH classification central
          Enhanced Data Rate eSCO 2 Mbps mode
          Enhanced Data Rate eSCO 3 Mbps mode
          3-slot Enhanced Data Rate eSCO packets
          Extended Inquiry Response
          Simultaneous LE and BR/EDR (Controller)
          Secure Simple Pairing
          Encapsulated PDU
          Erroneous Data Reporting
          Non-flushable Packet Boundary Flag
          Link Supervision Timeout Changed Event
          Inquiry TX Power Level
          Enhanced Power Control
          Extended features
< HCI Command: Read Local Version.. (0x04|0x0001) plen 0  #111 [hci0] 37.196145
> HCI Event: Command Complete (0x0e) plen 12              #112 [hci0] 37.196999
      Read Local Version Information (0x04|0x0001) ncmd 1
        Status: Success (0x00)
        HCI version: Bluetooth 5.4 (0x0d) - Revision 17301 (0x4395)
        LMP version: Bluetooth 5.4 (0x0d) - Subversion 17301 (0x4395)
        Manufacturer: Intel Corp. (2)
< HCI Command: Read BD ADDR (0x04|0x0009) plen 0          #113 [hci0] 37.197207
> HCI Event: Command Complete (0x0e) plen 10              #114 [hci0] 37.197999
      Read BD ADDR (0x04|0x0009) ncmd 1
        Status: Success (0x00)
        Address: 68:34:21:E5:84:DF (OUI 68-34-21)
< HCI Command: Read Local Support.. (0x04|0x0002) plen 0  #115 [hci0] 37.198224
> HCI Event: Command Complete (0x0e) plen 68              #116 [hci0] 37.199996
      Read Local Supported Commands (0x04|0x0002) ncmd 1
        Status: Success (0x00)
        Commands: 237 entries
          Inquiry (Octet 0 - Bit 0)
          Inquiry Cancel (Octet 0 - Bit 1)
          Periodic Inquiry Mode (Octet 0 - Bit 2)
          Exit Periodic Inquiry Mode (Octet 0 - Bit 3)
          Create Connection (Octet 0 - Bit 4)
          Disconnect (Octet 0 - Bit 5)
          Create Connection Cancel (Octet 0 - Bit 7)
          Accept Connection Request (Octet 1 - Bit 0)
          Reject Connection Request (Octet 1 - Bit 1)
          Link Key Request Reply (Octet 1 - Bit 2)
          Link Key Request Negative Reply (Octet 1 - Bit 3)
          PIN Code Request Reply (Octet 1 - Bit 4)
          PIN Code Request Negative Reply (Octet 1 - Bit 5)
          Change Connection Packet Type (Octet 1 - Bit 6)
          Authentication Requested (Octet 1 - Bit 7)
          Set Connection Encryption (Octet 2 - Bit 0)
          Change Connection Link Key (Octet 2 - Bit 1)
          Remote Name Request (Octet 2 - Bit 3)
          Remote Name Request Cancel (Octet 2 - Bit 4)
          Read Remote Supported Features (Octet 2 - Bit 5)
          Read Remote Extended Features (Octet 2 - Bit 6)
          Read Remote Version Information (Octet 2 - Bit 7)
          Read Clock Offset (Octet 3 - Bit 0)
          Read LMP Handle (Octet 3 - Bit 1)
          Sniff Mode (Octet 4 - Bit 2)
          Exit Sniff Mode (Octet 4 - Bit 3)
          QoS Setup (Octet 4 - Bit 6)
          Role Discovery (Octet 4 - Bit 7)
          Switch Role (Octet 5 - Bit 0)
          Read Link Policy Settings (Octet 5 - Bit 1)
          Write Link Policy Settings (Octet 5 - Bit 2)
          Read Default Link Policy Settings (Octet 5 - Bit 3)
          Write Default Link Policy Settings (Octet 5 - Bit 4)
          Flow Specification (Octet 5 - Bit 5)
          Set Event Mask (Octet 5 - Bit 6)
          Reset (Octet 5 - Bit 7)
          Set Event Filter (Octet 6 - Bit 0)
          Flush (Octet 6 - Bit 1)
          Read PIN Type (Octet 6 - Bit 2)
          Write PIN Type (Octet 6 - Bit 3)
          Write Local Name (Octet 7 - Bit 0)
          Read Local Name (Octet 7 - Bit 1)
          Read Connection Accept Timeout (Octet 7 - Bit 2)
          Write Connection Accept Timeout (Octet 7 - Bit 3)
          Read Page Timeout (Octet 7 - Bit 4)
          Write Page Timeout (Octet 7 - Bit 5)
          Read Scan Enable (Octet 7 - Bit 6)
          Write Scan Enable (Octet 7 - Bit 7)
          Read Page Scan Activity (Octet 8 - Bit 0)
          Write Page Scan Activity (Octet 8 - Bit 1)
          Read Inquiry Scan Activity (Octet 8 - Bit 2)
          Write Inquiry Scan Activity (Octet 8 - Bit 3)
          Read Authentication Enable (Octet 8 - Bit 4)
          Write Authentication Enable (Octet 8 - Bit 5)
          Write Encryption Mode (Octet 8 - Bit 7)
          Read Class of Device (Octet 9 - Bit 0)
          Write Class of Device (Octet 9 - Bit 1)
          Read Voice Setting (Octet 9 - Bit 2)
          Write Voice Setting (Octet 9 - Bit 3)
          Read Automatic Flush Timeout (Octet 9 - Bit 4)
          Write Automatic Flush Timeout (Octet 9 - Bit 5)
          Read Num Broadcast Retransmissions (Octet 9 - Bit 6)
          Write Num Broadcast Retransmissions (Octet 9 - Bit 7)
          Read Transmit Power Level (Octet 10 - Bit 2)
          Read Sync Flow Control Enable (Octet 10 - Bit 3)
          Write Sync Flow Control Enable (Octet 10 - Bit 4)
          Set Controller To Host Flow Control (Octet 10 - Bit 5)
          Host Buffer Size (Octet 10 - Bit 6)
          Host Number of Completed Packets (Octet 10 - Bit 7)
          Read Link Supervision Timeout (Octet 11 - Bit 0)
          Write Link Supervision Timeout (Octet 11 - Bit 1)
          Read Number of Supported IAC (Octet 11 - Bit 2)
          Read Current IAC LAP (Octet 11 - Bit 3)
          Write Current IAC LAP (Octet 11 - Bit 4)
          Set AFH Host Channel Classification (Octet 12 - Bit 1)
          Read Inquiry Scan Type (Octet 12 - Bit 4)
          Write Inquiry Scan Type (Octet 12 - Bit 5)
          Read Inquiry Mode (Octet 12 - Bit 6)
          Write Inquiry Mode (Octet 12 - Bit 7)
          Read Page Scan Type (Octet 13 - Bit 0)
          Write Page Scan Type (Octet 13 - Bit 1)
          Read AFH Channel Assessment Mode (Octet 13 - Bit 2)
          Write AFH Channel Assessment Mode (Octet 13 - Bit 3)
          Read Local Version Information (Octet 14 - Bit 3)
          Read Local Supported Features (Octet 14 - Bit 5)
          Read Local Extended Features (Octet 14 - Bit 6)
          Read Buffer Size (Octet 14 - Bit 7)
          Read BD ADDR (Octet 15 - Bit 1)
          Read Failed Contact Counter (Octet 15 - Bit 2)
          Reset Failed Contact Counter (Octet 15 - Bit 3)
          Read Link Quality (Octet 15 - Bit 4)
          Read RSSI (Octet 15 - Bit 5)
          Read AFH Channel Map (Octet 15 - Bit 6)
          Read Clock (Octet 15 - Bit 7)
          Read Loopback Mode (Octet 16 - Bit 0)
          Write Loopback Mode (Octet 16 - Bit 1)
          Enable Device Under Test Mode (Octet 16 - Bit 2)
          Setup Synchronous Connection (Octet 16 - Bit 3)
          Accept Synchronous Connection Request (Octet 16 - Bit 4)
          Reject Synchronous Connection Request (Octet 16 - Bit 5)
          Read Extended Inquiry Response (Octet 17 - Bit 0)
          Write Extended Inquiry Response (Octet 17 - Bit 1)
          Refresh Encryption Key (Octet 17 - Bit 2)
          Sniff Subrating (Octet 17 - Bit 4)
          Read Simple Pairing Mode (Octet 17 - Bit 5)
          Write Simple Pairing Mode (Octet 17 - Bit 6)
          Read Local OOB Data (Octet 17 - Bit 7)
          Read Inquiry Response TX Power Level (Octet 18 - Bit 0)
          Write Inquiry Transmit Power Level (Octet 18 - Bit 1)
          Read Default Erroneous Data Reporting (Octet 18 - Bit 2)
          Write Default Erroneous Data Reporting (Octet 18 - Bit 3)
          IO Capability Request Reply (Octet 18 - Bit 7)
          User Confirmation Request Reply (Octet 19 - Bit 0)
          User Confirmation Request Neg Reply (Octet 19 - Bit 1)
          User Passkey Request Reply (Octet 19 - Bit 2)
          User Passkey Request Negative Reply (Octet 19 - Bit 3)
          Remote OOB Data Request Reply (Octet 19 - Bit 4)
          Write Simple Pairing Debug Mode (Octet 19 - Bit 5)
          Enhanced Flush (Octet 19 - Bit 6)
          Remote OOB Data Request Neg Reply (Octet 19 - Bit 7)
          Send Keypress Notification (Octet 20 - Bit 2)
          IO Capability Request Negative Reply (Octet 20 - Bit 3)
          Read Encryption Key Size (Octet 20 - Bit 4)
          Set Event Mask Page 2 (Octet 22 - Bit 2)
          Read Enhanced Transmit Power Level (Octet 24 - Bit 0)
          Read LE Host Supported (Octet 24 - Bit 5)
          Write LE Host Supported (Octet 24 - Bit 6)
          LE Set Event Mask (Octet 25 - Bit 0)
          LE Read Buffer Size (Octet 25 - Bit 1)
          LE Read Local Supported Features (Octet 25 - Bit 2)
          LE Set Random Address (Octet 25 - Bit 4)
          LE Set Advertising Parameters (Octet 25 - Bit 5)
          LE Read Advertising Channel TX Power (Octet 25 - Bit 6)
          LE Set Advertising Data (Octet 25 - Bit 7)
          LE Set Scan Response Data (Octet 26 - Bit 0)
          LE Set Advertise Enable (Octet 26 - Bit 1)
          LE Set Scan Parameters (Octet 26 - Bit 2)
          LE Set Scan Enable (Octet 26 - Bit 3)
          LE Create Connection (Octet 26 - Bit 4)
          LE Create Connection Cancel (Octet 26 - Bit 5)
          LE Read Accept List Size (Octet 26 - Bit 6)
          LE Clear Accept List (Octet 26 - Bit 7)
          LE Add Device To Accept List (Octet 27 - Bit 0)
          LE Remove Device From Accept List (Octet 27 - Bit 1)
          LE Connection Update (Octet 27 - Bit 2)
          LE Set Host Channel Classification (Octet 27 - Bit 3)
          LE Read Channel Map (Octet 27 - Bit 4)
          LE Read Remote Used Features (Octet 27 - Bit 5)
          LE Encrypt (Octet 27 - Bit 6)
          LE Rand (Octet 27 - Bit 7)
          LE Start Encryption (Octet 28 - Bit 0)
          LE Long Term Key Request Reply (Octet 28 - Bit 1)
          LE Long Term Key Request Neg Reply (Octet 28 - Bit 2)
          LE Read Supported States (Octet 28 - Bit 3)
          LE Receiver Test (Octet 28 - Bit 4)
          LE Transmitter Test (Octet 28 - Bit 5)
          LE Test End (Octet 28 - Bit 6)
          Enhanced Setup Synchronous Connection (Octet 29 - Bit 3)
          Enhanced Accept Synchronous Connection Request (Octet 29 - Bit 4)
          Read Local Supported Codecs (Octet 29 - Bit 5)
          Remote OOB Extended Data Request Reply (Octet 32 - Bit 1)
          Read Secure Connections Host Support (Octet 32 - Bit 2)
          Write Secure Connections Host Support (Octet 32 - Bit 3)
          Read Authenticated Payload Timeout (Octet 32 - Bit 4)
          Write Authenticated Payload Timeout (Octet 32 - Bit 5)
          Read Local OOB Extended Data (Octet 32 - Bit 6)
          Write Secure Connections Test Mode (Octet 32 - Bit 7)
          LE Remote Connection Parameter Request Reply (Octet 33 - Bit 4)
          LE Remote Connection Parameter Request Negative Reply (Octet 33 - Bit 5)
          LE Set Data Length (Octet 33 - Bit 6)
          LE Read Suggested Default Data Length (Octet 33 - Bit 7)
          LE Write Suggested Default Data Length (Octet 34 - Bit 0)
          LE Read Local P-256 Public Key (Octet 34 - Bit 1)
          LE Generate DHKey (Octet 34 - Bit 2)
          LE Add Device To Resolving List (Octet 34 - Bit 3)
          LE Remove Device From Resolving List (Octet 34 - Bit 4)
          LE Clear Resolving List (Octet 34 - Bit 5)
          LE Read Resolving List Size (Octet 34 - Bit 6)
          LE Read Peer Resolvable Address (Octet 34 - Bit 7)
          LE Read Local Resolvable Address (Octet 35 - Bit 0)
          LE Set Address Resolution Enable (Octet 35 - Bit 1)
          LE Set Resolvable Private Address Timeout (Octet 35 - Bit 2)
          LE Read Maximum Data Length (Octet 35 - Bit 3)
          LE Read PHY (Octet 35 - Bit 4)
          LE Set Default PHY (Octet 35 - Bit 5)
          LE Set PHY (Octet 35 - Bit 6)
          LE Enhanced Receiver Test (Octet 35 - Bit 7)
          LE Enhanced Transmitter Test (Octet 36 - Bit 0)
          LE Set Advertising Set Random Address (Octet 36 - Bit 1)
          LE Set Extended Advertising Parameters (Octet 36 - Bit 2)
          LE Set Extended Advertising Data (Octet 36 - Bit 3)
          LE Set Extended Scan Response Data (Octet 36 - Bit 4)
          LE Set Extended Advertising Enable (Octet 36 - Bit 5)
          LE Read Maximum Advertising Data Length (Octet 36 - Bit 6)
          LE Read Number of Supported Advertising Sets (Octet 36 - Bit 7)
          LE Remove Advertising Set (Octet 37 - Bit 0)
          LE Clear Advertising Sets (Octet 37 - Bit 1)
          LE Set Extended Scan Parameters (Octet 37 - Bit 5)
          LE Set Extended Scan Enable (Octet 37 - Bit 6)
          LE Extended Create Connection (Octet 37 - Bit 7)
          LE Read Transmit Power (Octet 38 - Bit 7)
          LE Read RF Path Compensation (Octet 39 - Bit 0)
          LE Write RF Path Compensation (Octet 39 - Bit 1)
          LE Set Privacy Mode (Octet 39 - Bit 2)
          Read Local Simple Pairing Options (Octet 41 - Bit 3)
          LE Read Buffer v2 (Octet 41 - Bit 5)
          LE Read ISO TX Sync (Octet 41 - Bit 6)
          LE Set Connected Isochronous Group Parameters (Octet 41 - Bit 7)
          LE Set Connected Isochronous Group Parameters Test (Octet 42 - Bit 0)
          LE Create Connected Isochronous Stream (Octet 42 - Bit 1)
          LE Remove Connected Isochronous Group (Octet 42 - Bit 2)
          LE Accept Connected Isochronous Stream Request (Octet 42 - Bit 3)
          LE Reject Connected Isochronous Stream Request (Octet 42 - Bit 4)
          LE Request Peer SCA (Octet 43 - Bit 2)
          LE Setup Isochronous Data Path (Octet 43 - Bit 3)
          LE Remove Isochronous Data Path (Octet 43 - Bit 4)
          LE Isochronous Transmit Test (Octet 43 - Bit 5)
          LE Isochronous Receive Test (Octet 43 - Bit 6)
          LE Isochronous Read Test Counters (Octet 43 - Bit 7)
          LE Isochronous Read Test Counters (Octet 44 - Bit 0)
          LE Set Host Feature (Octet 44 - Bit 1)
          Octet 44 - Bit 2 
          Octet 44 - Bit 3 
          Octet 44 - Bit 4 
          Octet 44 - Bit 5 
          Octet 44 - Bit 6 
          Octet 44 - Bit 7 
          Octet 45 - Bit 0 
          LE Read ISO link quality (Octet 45 - Bit 1)
          Read Local Supported Codecs V2 (Octet 45 - Bit 2)
          Read Local Supported Codec Capabilities (Octet 45 - Bit 3)
          Read Local Supported Controller Delay (Octet 45 - Bit 4)
          Configure Data Path (Octet 45 - Bit 5)
          Octet 45 - Bit 6 
          Octet 45 - Bit 7 
          Octet 46 - Bit 0 
          Octet 46 - Bit 1 
< HCI Command: Write Simple Pairi.. (0x03|0x0056) plen 1  #117 [hci0] 37.200208
        Mode: Enabled (0x01)
> HCI Event: Command Complete (0x0e) plen 4               #118 [hci0] 37.200996
      Write Simple Pairing Mode (0x03|0x0056) ncmd 1
        Status: Success (0x00)
< HCI Command: Write Inquiry Mode (0x03|0x0045) plen 1    #119 [hci0] 37.201151
        Mode: Inquiry Result with RSSI or Extended Inquiry Result (0x02)
> HCI Event: Command Complete (0x0e) plen 4               #120 [hci0] 37.201996
      Write Inquiry Mode (0x03|0x0045) ncmd 1
        Status: Success (0x00)
< HCI Command: Read Inquiry Respo.. (0x03|0x0058) plen 0  #121 [hci0] 37.202137
> HCI Event: Command Complete (0x0e) plen 5               #122 [hci0] 37.202997
      Read Inquiry Response TX Power Level (0x03|0x0058) ncmd 1
        Status: Success (0x00)
        TX power: 12 dbm (0x0c)
< HCI Command: Read Local Extende.. (0x04|0x0004) plen 1  #123 [hci0] 37.203222
        Page: 1
> HCI Event: Command Complete (0x0e) plen 14              #124 [hci0] 37.204002
      Read Local Extended Features (0x04|0x0004) ncmd 1
        Status: Success (0x00)
        Page: 1/2
        Features: 0x01 0x00 0x00 0x00 0x00 0x00 0x00 0x00
          Secure Simple Pairing (Host Support)
< HCI Command: Read Buffer Size (0x04|0x0005) plen 0      #125 [hci0] 37.204281
> HCI Event: Command Complete (0x0e) plen 11              #126 [hci0] 37.205001
      Read Buffer Size (0x04|0x0005) ncmd 1
        Status: Success (0x00)
        ACL MTU: 1021 ACL max packet: 4
        SCO MTU: 96   SCO max packet: 6
< HCI Command: Read Class of Device (0x03|0x0023) plen 0  #127 [hci0] 37.205017
> HCI Event: Command Complete (0x0e) plen 7               #128 [hci0] 37.205999
      Read Class of Device (0x03|0x0023) ncmd 1
        Status: Success (0x00)
        Class: 0x000000
          Major class: Miscellaneous
          Minor class: 0x00
< HCI Command: Read Local Name (0x03|0x0014) plen 0       #129 [hci0] 37.206125
> HCI Event: Command Complete (0x0e) plen 252             #130 [hci0] 37.210033
      Read Local Name (0x03|0x0014) ncmd 1
        Status: Success (0x00)
        Name: 
< HCI Command: Read Voice Setting (0x03|0x0025) plen 0    #131 [hci0] 37.210291
> HCI Event: Command Complete (0x0e) plen 6               #132 [hci0] 37.210997
      Read Voice Setting (0x03|0x0025) ncmd 1
        Status: Success (0x00)
        Setting: 0x0060
          Input Coding: Linear
          Input Data Format: 2's complement
          Input Sample Size: 16-bit
          # of bits padding at MSB: 0
          Air Coding Format: CVSD
< HCI Command: Read Number of Sup.. (0x03|0x0038) plen 0  #133 [hci0] 37.211277
> HCI Event: Command Complete (0x0e) plen 5               #134 [hci0] 37.211997
      Read Number of Supported IAC (0x03|0x0038) ncmd 1
        Status: Success (0x00)
        Number of IAC: 2
< HCI Command: Read Current IAC LAP (0x03|0x0039) plen 0  #135 [hci0] 37.212165
> HCI Event: Command Complete (0x0e) plen 8               #136 [hci0] 37.212998
      Read Current IAC LAP (0x03|0x0039) ncmd 1
        Status: Success (0x00)
        Number of IAC: 1
        Access code: 0x9e8b33 (General Inquiry)
< HCI Command: Write Connection A.. (0x03|0x0016) plen 2  #137 [hci0] 37.213345
        Timeout: 20000.000 msec (0x7d00)
> HCI Event: Command Complete (0x0e) plen 4               #138 [hci0] 37.213995
      Write Connection Accept Timeout (0x03|0x0016) ncmd 1
        Status: Success (0x00)
< HCI Command: LE Read Local Supp.. (0x08|0x0003) plen 0  #139 [hci0] 37.214084
> HCI Event: Command Complete (0x0e) plen 12              #140 [hci0] 37.214998
      LE Read Local Supported Features (0x08|0x0003) ncmd 1
        Status: Success (0x00)
        Features: 0xff 0xd9 0x01 0x3c 0xae 0x00 0x00 0x00
          LE Encryption
          Connection Parameter Request Procedure
          Extended Reject Indication
          Peripheral-initiated Features Exchange
          LE Ping
          LE Data Packet Length Extension
          LL Privacy
          Extended Scanner Filter Policies
          LE 2M PHY
          LE Coded PHY
          LE Extended Advertising
          Channel Selection Algorithm #2
          LE Power Class 1
          Minimum Number of Used Channels Procedure
          Sleep Clock Accuracy Updates
          Remote Public Key Validation
          Connected Isochronous Stream - Central
          Connected Isochronous Stream - Peripheral
          LE Power Control Request
          LE Power Control Request
          LE Path Loss Monitoring
          Connection Subrating
          Channel Classification
< HCI Command: LE Read Buffer v2 (0x08|0x0060) plen 0     #141 [hci0] 37.215284
> HCI Event: Command Complete (0x0e) plen 10              #142 [hci0] 37.216000
      LE Read Buffer v2 (0x08|0x0060) ncmd 1
        Status: Success (0x00)
        ACL MTU: 251
        ACL max packet: 6
        ISO MTU: 248
        ISO max packet: 8
< HCI Command: LE Read Supported... (0x08|0x001c) plen 0  #143 [hci0] 37.216306
> HCI Event: Command Complete (0x0e) plen 12              #144 [hci0] 37.217002
      LE Read Supported States (0x08|0x001c) ncmd 1
        Status: Success (0x00)
        States: 0x000003ffffffffff
          Non-connectable Advertising State
          Scannable Advertising State
          Connectable Advertising State
          High Duty Cycle Directed Advertising State
          Passive Scanning State
          Active Scanning State
          Initiating State
            and Connection State (Central Role)
          Connection State (Peripheral Role)
          Non-connectable Advertising State
            and Passive Scanning State
          Scannable Advertising State
            and Passive Scanning State
          Connectable Advertising State
            and Passive Scanning State
          High Duty Cycle Directed Advertising State
            and Passive Scanning State
          Non-connectable Advertising State
            and Active Scanning State
          Scannable Advertising State
            and Active Scanning State
          Connectable Advertising State
            and Active Scanning State
          High Duty Cycle Directed Advertising State
            and Active Scanning State
          Non-connectable Advertising State
            and Initiating State
          Scannable Advertising State
            and Initiating State
          Non-connectable Advertising State
            and Connection State (Central Role)
          Scannable Advertising State
            and Connection State (Central Role)
          Non-connectable Advertising State
            and Connection State (Peripheral Role)
          Scannable Advertising State
            and Connection State (Peripheral Role)
          Passive Scanning State
            and Initiating State
          Active Scanning State
            and Initiating State
          Passive Scanning State
            and Connection State (Central Role)
          Active Scanning State
            and Connection State (Central Role)
          Passive Scanning State
            and Connection State (Peripheral Role)
          Active Scanning State
            and Connection State (Peripheral Role)
          Initiating State
            and Connection State (Central Role)
            and Central Role & Central Role
          Low Duty Cycle Directed Advertising State
          Low Duty Cycle Directed Advertising State
            and Passive Scanning State
          Low Duty Cycle Directed Advertising State
            and Active Scanning State
          Connectable Advertising State
            and Initiating State
            and Central Role & Peripheral Role
          High Duty Cycle Directed Advertising State
            and Initiating State
            and Central Role & Peripheral Role
          Low Duty Cycle Directed Advertising State
            and Initiating State
            and Central Role & Peripheral Role
          Connectable Advertising State
            and Connection State (Central Role)
            and Central Role & Peripheral Role
          High Duty Cycle Directed Advertising State
            and Connection State (Central Role)
            and Central Role & Peripheral Role
          Low Duty Cycle Directed Advertising State
            and Connection State (Central Role)
            and Central Role & Peripheral Role
          Connectable Advertising State
            and Connection State (Peripheral Role)
            and Central Role & Peripheral Role
          High Duty Cycle Directed Advertising State
            and Connection State (Peripheral Role)
            and Peripheral Role & Peripheral Role
          Low Duty Cycle Directed Advertising State
            and Connection State (Peripheral Role)
            and Peripheral Role & Peripheral Role
          Initiating State
            and Connection State (Peripheral Role)
            and Central Role & Peripheral Role
< HCI Command: Set Event Mask (0x03|0x0001) plen 8        #145 [hci0] 37.217304
        Mask: 0x3dbff807fffbffff
          Inquiry Complete
          Inquiry Result
          Connection Complete
          Connection Request
          Disconnection Complete
          Authentication Complete
          Remote Name Request Complete
          Encryption Change
          Change Connection Link Key Complete
          Link Key Type Changed
          Read Remote Supported Features Complete
          Read Remote Version Information Complete
          QoS Setup Complete
          Command Complete
          Command Status
          Hardware Error
          Flush Occurred
          Role Change
          Mode Change
          Return Link Keys
          PIN Code Request
          Link Key Request
          Link Key Notification
          Loopback Command
          Data Buffer Overflow
          Max Slots Change
          Read Clock Offset Complete
          Connection Packet Type Changed
          QoS Violation
          Page Scan Mode Change
          Page Scan Repetition Mode Change
          Flow Specification Complete
          Inquiry Result with RSSI
          Read Remote Extended Features Complete
          Synchronous Connection Complete
          Synchronous Connection Changed
          Sniff Subrating
          Extended Inquiry Result
          Encryption Key Refresh Complete
          IO Capability Request
          IO Capability Request Reply
          User Confirmation Request
          User Passkey Request
          Remote OOB Data Request
          Simple Pairing Complete
          Link Supervision Timeout Changed
          Enhanced Flush Complete
          User Passkey Notification
          Keypress Notification
          Remote Host Supported Features Notification
          LE Meta
> HCI Event: Command Complete (0x0e) plen 4               #146 [hci0] 37.217997
      Set Event Mask (0x03|0x0001) ncmd 1
        Status: Success (0x00)
< HCI Command: Write Default Link.. (0x02|0x000f) plen 2  #147 [hci0] 37.218285
        Link policy: 0x0005
          Enable Role Switch
          Enable Sniff Mode
> HCI Event: Command Complete (0x0e) plen 4               #148 [hci0] 37.218997
      Write Default Link Policy Settings (0x02|0x000f) ncmd 1
        Status: Success (0x00)
< HCI Command: Read Page Scan Act.. (0x03|0x001b) plen 0  #149 [hci0] 37.219356
> HCI Event: Command Complete (0x0e) plen 8               #150 [hci0] 37.220000
      Read Page Scan Activity (0x03|0x001b) ncmd 1
        Status: Success (0x00)
        Interval: 1280.000 msec (0x0800)
        Window: 11.250 msec (0x0012)
< HCI Command: Read Default Erron.. (0x03|0x005a) plen 0  #151 [hci0] 37.220096
> HCI Event: Command Complete (0x0e) plen 5               #152 [hci0] 37.220997
      Read Default Erroneous Data Reporting (0x03|0x005a) ncmd 1
        Status: Success (0x00)
        Mode: Disabled (0x00)
< HCI Command: Read Page Scan Type (0x03|0x0046) plen 0   #153 [hci0] 37.221226
> HCI Event: Command Complete (0x0e) plen 5               #154 [hci0] 37.221997
      Read Page Scan Type (0x03|0x0046) ncmd 1
        Status: Success (0x00)
        Type: Standard Scan (0x00)
< HCI Command: Read Local Extende.. (0x04|0x0004) plen 1  #155 [hci0] 37.222201
        Page: 2
> HCI Event: Command Complete (0x0e) plen 14              #156 [hci0] 37.223003
      Read Local Extended Features (0x04|0x0004) ncmd 1
        Status: Success (0x00)
        Page: 2/2
        Features: 0x00 0x03 0x00 0x00 0x00 0x00 0x00 0x00
          Secure Connections (Controller Support)
          Ping
< HCI Command: LE Set Event Mask (0x08|0x0001) plen 8     #157 [hci0] 37.223190
        Mask: 0x00000000030a1fff
          LE Connection Complete
          LE Advertising Report
          LE Connection Update Complete
          LE Read Remote Used Features Complete
          LE Long Term Key Request
          LE Remote Connection Parameter Request
          LE Data Length Change
          LE Read Local P-256 Public Key Complete
          LE Generate DHKey Complete
          LE Enhanced Connection Complete
          LE Direct Advertising Report
          LE PHY Update Complete
          LE Extended Advertising Report
          LE Extended Advertising Set Terminated
          LE Channel Selection Algorithm
          LE CIS Established
          LE CIS Request
> HCI Event: Command Complete (0x0e) plen 4               #158 [hci0] 37.223996
      LE Set Event Mask (0x08|0x0001) ncmd 1
        Status: Success (0x00)
< HCI Command: LE Read Transmit P.. (0x08|0x004b) plen 0  #159 [hci0] 37.224160
> HCI Event: Command Complete (0x0e) plen 6               #160 [hci0] 37.224994
      LE Read Transmit Power (0x08|0x004b) ncmd 1
        Status: Success (0x00)
        Min Tx power: -64 dBm
        Max Tx power: 120 dBm
< HCI Command: LE Read Accept Lis.. (0x08|0x000f) plen 0  #161 [hci0] 37.225105
> HCI Event: Command Complete (0x0e) plen 5               #162 [hci0] 37.225997
      LE Read Accept List Size (0x08|0x000f) ncmd 1
        Status: Success (0x00)
        Size: 64
< HCI Command: LE Clear Accept List (0x08|0x0010) plen 0  #163 [hci0] 37.226142
> HCI Event: Command Complete (0x0e) plen 4               #164 [hci0] 37.226996
      LE Clear Accept List (0x08|0x0010) ncmd 1
        Status: Success (0x00)
< HCI Command: LE Read Resolving... (0x08|0x002a) plen 0  #165 [hci0] 37.227162
> HCI Event: Command Complete (0x0e) plen 5               #166 [hci0] 37.227997
      LE Read Resolving List Size (0x08|0x002a) ncmd 1
        Status: Success (0x00)
        Size: 64
< HCI Command: LE Clear Resolving.. (0x08|0x0029) plen 0  #167 [hci0] 37.228250
> HCI Event: Command Complete (0x0e) plen 4               #168 [hci0] 37.228997
      LE Clear Resolving List (0x08|0x0029) ncmd 1
        Status: Success (0x00)
< HCI Command: LE Set Resolvable... (0x08|0x002e) plen 2  #169 [hci0] 37.229233
        Timeout: 900 seconds
> HCI Event: Command Complete (0x0e) plen 4               #170 [hci0] 37.229997
      LE Set Resolvable Private Address Timeout (0x08|0x002e) ncmd 1
        Status: Success (0x00)
< HCI Command: LE Read Maximum Da.. (0x08|0x002f) plen 0  #171 [hci0] 37.230243
> HCI Event: Command Complete (0x0e) plen 12              #172 [hci0] 37.231001
      LE Read Maximum Data Length (0x08|0x002f) ncmd 1
        Status: Success (0x00)
        Max TX octets: 251
        Max TX time: 2704
        Max RX octets: 251
        Max RX time: 2704
< HCI Command: LE Read Suggested... (0x08|0x0023) plen 0  #173 [hci0] 37.231349
> HCI Event: Command Complete (0x0e) plen 8               #174 [hci0] 37.232104
      LE Read Suggested Default Data Length (0x08|0x0023) ncmd 1
        Status: Success (0x00)
        TX octets: 27
        TX time: 328
< HCI Command: LE Read Number of... (0x08|0x003b) plen 0  #175 [hci0] 37.232392
> HCI Event: Command Complete (0x0e) plen 5               #176 [hci0] 37.232999
      LE Read Number of Supported Advertising Sets (0x08|0x003b) ncmd 1
        Status: Success (0x00)
        Num supported adv sets: 12
< HCI Command: Write LE Host Supp.. (0x03|0x006d) plen 2  #177 [hci0] 37.233297
        Supported: 0x01
        Simultaneous: 0x00
> HCI Event: Command Complete (0x0e) plen 4               #178 [hci0] 37.233997
      Write LE Host Supported (0x03|0x006d) ncmd 1
        Status: Success (0x00)
< HCI Command: LE Set Host Feature (0x08|0x0074) plen 2   #179 [hci0] 37.234105
        Bit Number: 32
          Connected Isochronous Stream (Host Support)
        Bit Value: 1
> HCI Event: Command Complete (0x0e) plen 4               #180 [hci0] 37.234997
      LE Set Host Feature (0x08|0x0074) ncmd 1
        Status: Success (0x00)
< HCI Command: Set Event Mask Pag.. (0x03|0x0063) plen 8  #181 [hci0] 37.235085
        Mask: 0x0000000000800000
          Authenticated Payload Timeout Expired
> HCI Event: Command Complete (0x0e) plen 4               #182 [hci0] 37.235997
      Set Event Mask Page 2 (0x03|0x0063) ncmd 1
        Status: Success (0x00)
< HCI Command: Read Local Support.. (0x04|0x000d) plen 0  #183 [hci0] 37.236012
> HCI Event: Command Complete (0x0e) plen 35              #184 [hci0] 37.237018
      Read Local Supported Codecs V2 (0x04|0x000d) ncmd 1
        Status: Success (0x00)
        Number of supported codecs: 7
          Codec: u-law log (0x00)
          Logical Transport Type: 0x02
            Codec supported over BR/EDR SCO and eSCO
          Codec: A-law log (0x01)
          Logical Transport Type: 0x02
            Codec supported over BR/EDR SCO and eSCO
          Codec: CVSD (0x02)
          Logical Transport Type: 0x02
            Codec supported over BR/EDR SCO and eSCO
          Codec: Transparent (0x03)
          Logical Transport Type: 0x0e
            Codec supported over BR/EDR SCO and eSCO
            Codec supported over LE CIS
            Codec supported over LE BIS
          Codec: Linear PCM (0x04)
          Logical Transport Type: 0x02
            Codec supported over BR/EDR SCO and eSCO
          Codec: mSBC (0x05)
          Logical Transport Type: 0x02
            Codec supported over BR/EDR SCO and eSCO
          Codec: LC3 (0x06)
          Logical Transport Type: 0x0c
            Codec supported over LE CIS
            Codec supported over LE BIS
        Number of vendor codecs: 3
          Company ID: Ericsson Technology Licensing (0)
          Vendor Codec ID: 0x0100
          Logical Transport Type: 0x02
            Codec supported over BR/EDR SCO and eSCO
          Company ID: Verifone Systems Pte Ltd. Taiwan Branch (512)
          Vendor Codec ID: 0x0100
          Logical Transport Type: 0x06
            Codec supported over BR/EDR SCO and eSCO
            Codec supported over LE CIS
          Company ID: iRobot Corporation (1536)
          Vendor Codec ID: 0x0400
          Logical Transport Type: 0x00
< HCI Command: Read Local Support.. (0x04|0x000e) plen 7  #185 [hci0] 37.237025
        Codec: u-law log (0x00)
        Logical Transport Type: 0x01
          Codec supported over BR/EDR ACL
        Direction: Input (Host to Controller) (0x00)
> HCI Event: Command Complete (0x0e) plen 5               #186 [hci0] 37.237998
      Read Local Supported Codec Capabilities (0x04|0x000e) ncmd 1
        Status: Success (0x00)
        Number of codec capabilities: 0
< HCI Command: Read Local Support.. (0x04|0x000e) plen 7  #187 [hci0] 37.238015
        Codec: A-law log (0x01)
        Logical Transport Type: 0x01
          Codec supported over BR/EDR ACL
        Direction: Input (Host to Controller) (0x00)
> HCI Event: Command Complete (0x0e) plen 5               #188 [hci0] 37.238998
      Read Local Supported Codec Capabilities (0x04|0x000e) ncmd 1
        Status: Success (0x00)
        Number of codec capabilities: 0
< HCI Command: Read Local Support.. (0x04|0x000e) plen 7  #189 [hci0] 37.239017
        Codec: CVSD (0x02)
        Logical Transport Type: 0x01
          Codec supported over BR/EDR ACL
        Direction: Input (Host to Controller) (0x00)
> HCI Event: Command Complete (0x0e) plen 5               #190 [hci0] 37.239997
      Read Local Supported Codec Capabilities (0x04|0x000e) ncmd 1
        Status: Success (0x00)
        Number of codec capabilities: 0
< HCI Command: Read Local Support.. (0x04|0x000e) plen 7  #191 [hci0] 37.240014
        Codec: Transparent (0x03)
        Logical Transport Type: 0x01
          Codec supported over BR/EDR ACL
        Direction: Input (Host to Controller) (0x00)
> HCI Event: Command Complete (0x0e) plen 5               #192 [hci0] 37.240997
      Read Local Supported Codec Capabilities (0x04|0x000e) ncmd 1
        Status: Success (0x00)
        Number of codec capabilities: 0
< HCI Command: Read Local Support.. (0x04|0x000e) plen 7  #193 [hci0] 37.241019
        Codec: Transparent (0x03)
        Logical Transport Type: 0x02
          Codec supported over BR/EDR SCO and eSCO
        Direction: Input (Host to Controller) (0x00)
> HCI Event: Command Complete (0x0e) plen 5               #194 [hci0] 37.241998
      Read Local Supported Codec Capabilities (0x04|0x000e) ncmd 1
        Status: Success (0x00)
        Number of codec capabilities: 0
< HCI Command: Read Local Support.. (0x04|0x000e) plen 7  #195 [hci0] 37.242019
        Codec: Transparent (0x03)
        Logical Transport Type: 0x03
          Codec supported over BR/EDR ACL
          Codec supported over BR/EDR SCO and eSCO
        Direction: Input (Host to Controller) (0x00)
> HCI Event: Command Complete (0x0e) plen 4               #196 [hci0] 37.242997
      Read Local Supported Codec Capabilities (0x04|0x000e) ncmd 1
        Status: Unsupported Feature or Parameter Value (0x11)
< HCI Command: Read Local Support.. (0x04|0x000e) plen 7  #197 [hci0] 37.243030
        Codec: Linear PCM (0x04)
        Logical Transport Type: 0x01
          Codec supported over BR/EDR ACL
        Direction: Input (Host to Controller) (0x00)
> HCI Event: Command Complete (0x0e) plen 5               #198 [hci0] 37.243997
      Read Local Supported Codec Capabilities (0x04|0x000e) ncmd 1
        Status: Success (0x00)
        Number of codec capabilities: 0
< HCI Command: Read Local Support.. (0x04|0x000e) plen 7  #199 [hci0] 37.244016
        Codec: mSBC (0x05)
        Logical Transport Type: 0x01
          Codec supported over BR/EDR ACL
        Direction: Input (Host to Controller) (0x00)
> HCI Event: Command Complete (0x0e) plen 5               #200 [hci0] 37.244998
      Read Local Supported Codec Capabilities (0x04|0x000e) ncmd 1
        Status: Success (0x00)
        Number of codec capabilities: 0
< HCI Command: Read Local Support.. (0x04|0x000e) plen 7  #201 [hci0] 37.245005
        Codec: LC3 (0x06)
        Logical Transport Type: 0x02
          Codec supported over BR/EDR SCO and eSCO
        Direction: Input (Host to Controller) (0x00)
> HCI Event: Command Complete (0x0e) plen 25              #202 [hci0] 37.246011
      Read Local Supported Codec Capabilities (0x04|0x000e) ncmd 1
        Status: Success (0x00)
        Number of codec capabilities: 1
         Capabilities #0:
        03 01 b4 00 02 02 13 02 03 03 05 04 1e 00 78 00  ..............x.
        02 05 02                                         ...             
< HCI Command: Read Local Support.. (0x04|0x000e) plen 7  #203 [hci0] 37.246024
        Codec: LC3 (0x06)
        Logical Transport Type: 0x03
          Codec supported over BR/EDR ACL
          Codec supported over BR/EDR SCO and eSCO
        Direction: Input (Host to Controller) (0x00)
> HCI Event: Command Complete (0x0e) plen 4               #204 [hci0] 37.246998
      Read Local Supported Codec Capabilities (0x04|0x000e) ncmd 1
        Status: Unsupported Feature or Parameter Value (0x11)
< HCI Command: Read Local Support.. (0x04|0x000e) plen 7  #205 [hci0] 37.247141
        Codec: Vendor specific (0xff)
        Company Codec ID: Intel Corp. (2)
        Vendor Codec ID: 0
        Logical Transport Type: 0x00
        Direction: Input (Host to Controller) (0x00)
> HCI Event: Command Complete (0x0e) plen 10              #206 [hci0] 37.248001
      Read Local Supported Codec Capabilities (0x04|0x000e) ncmd 1
        Status: Success (0x00)
        Number of codec capabilities: 1
         Capabilities #0:
        11 15 02 33                                      ...3            
< HCI Command: Read Local Support.. (0x04|0x000e) plen 7  #207 [hci0] 37.248128
        Codec: Vendor specific (0xff)
        Company Codec ID: Intel Corp. (2)
        Vendor Codec ID: 2
        Logical Transport Type: 0x00
        Direction: Input (Host to Controller) (0x00)
> HCI Event: Command Complete (0x0e) plen 12              #208 [hci0] 37.249002
      Read Local Supported Codec Capabilities (0x04|0x000e) ncmd 1
        Status: Success (0x00)
        Number of codec capabilities: 1
         Capabilities #0:
        80 00 84 03 a9 80                                ......          
< HCI Command: Read Local Support.. (0x04|0x000e) plen 7  #209 [hci0] 37.249137
        Codec: Vendor specific (0xff)
        Company Codec ID: Microsoft (6)
        Vendor Codec ID: 6
        Logical Transport Type: 0x02
          Codec supported over BR/EDR SCO and eSCO
        Direction: Input (Host to Controller) (0x00)
> HCI Event: Command Complete (0x0e) plen 13              #210 [hci0] 37.250003
      Read Local Supported Codec Capabilities (0x04|0x000e) ncmd 1
        Status: Success (0x00)
        Number of codec capabilities: 1
         Capabilities #0:
        00 01 0f 01 03 04 0c                             .......         
< HCI Command: Read Local Simple... (0x04|0x000c) plen 0  #211 [hci0] 37.250026
> HCI Event: Command Complete (0x0e) plen 6               #212 [hci0] 37.251005
      Read Local Simple Pairing Options (0x04|0x000c) ncmd 1
        Status: Success (0x00)
        Pairing options: 0x01
        Max encryption key size: 16 octets
< HCI Command: Write Secure Conne.. (0x03|0x007a) plen 1  #213 [hci0] 37.251026
        Support: Enabled (0x01)
> HCI Event: Command Complete (0x0e) plen 4               #214 [hci0] 37.252002
      Write Secure Connections Host Support (0x03|0x007a) ncmd 1
        Status: Success (0x00)
< HCI Command: LE Write Suggested.. (0x08|0x0024) plen 4  #215 [hci0] 37.252016
        TX octets: 251
        TX time: 2704
> HCI Event: Command Complete (0x0e) plen 4               #216 [hci0] 37.252999
      LE Write Suggested Default Data Length (0x08|0x0024) ncmd 1
        Status: Success (0x00)
< HCI Command: LE Set Default PHY (0x08|0x0031) plen 3    #217 [hci0] 37.253015
        All PHYs preference: 0x00
        TX PHYs preference: 0x07
          LE 1M
          LE 2M
          LE Coded
        RX PHYs preference: 0x07
          LE 1M
          LE 2M
          LE Coded
> HCI Event: Command Complete (0x0e) plen 4               #218 [hci0] 37.254009
      LE Set Default PHY (0x08|0x0031) ncmd 1
        Status: Success (0x00)
< HCI Command: Microsoft Extension (0x3f|0x001e) plen 1   #219 [hci0] 37.254021
      Read Supported Features (0x00)
> HCI Event: Command Complete (0x0e) plen 16              #220 [hci0] 37.255006
      Microsoft Extension (0x3f|0x001e) ncmd 1
      Read Supported Features (0x00)
        Status: Success (0x00)
        Features: 0x7f 0x04 0x00 0x00 0x00 0x00 0x00 0x00
          RSSI Monitoring feature for BR/EDR
          RSSI Monitoring feature for LE connections
          RSSI Monitoring of LE advertisements
          Advertising Monitoring of LE advertisements
          Verifying the validity of P-192 and P-256 keys
          Continuous Advertising Monitoring
          Unknown features (0x0000000000000440)
        Event prefix length: 2
        Event prefix:
        87 80                                            ..              
< HCI Command: Microsoft Extension (0x3f|0x001e) plen 2   #221 [hci0] 37.255020
      LE Set Advertisement Filter Enable (0x05)
        Enable: All filter conditions (0x01)
> HCI Event: Command Complete (0x0e) plen 5               #222 [hci0] 37.255998
      Microsoft Extension (0x3f|0x001e) ncmd 1
      LE Set Advertisement Filter Enable (0x05)
        Status: Success (0x00)
= Index Info: 68:34:21:E5:84:DF (Intel Corp.)                  [hci0] 37.256011
< HCI Command: LE Set Address Res.. (0x08|0x002d) plen 1  #223 [hci0] 37.256037
        Address resolution: Enabled (0x01)
> HCI Event: Command Complete (0x0e) plen 4               #224 [hci0] 37.256997
      LE Set Address Resolution Enable (0x08|0x002d) ncmd 1
        Status: Success (0x00)
< HCI Command: Write Scan Enable (0x03|0x001a) plen 1     #225 [hci0] 37.257016
        Scan enable: Page Scan (0x02)
> HCI Event: Command Complete (0x0e) plen 4               #226 [hci0] 37.257998
      Write Scan Enable (0x03|0x001a) ncmd 1
        Status: Success (0x00)
< HCI Command: Write Class of Dev.. (0x03|0x0024) plen 3  #227 [hci0] 37.258118
        Class: 0x7c0104
          Major class: Computer (desktop, notebook, PDA, organizers)
          Minor class: Desktop workstation
          Rendering (Printing, Speaker)
          Capturing (Scanner, Microphone)
          Object Transfer (v-Inbox, v-Folder)
          Audio (Speaker, Microphone, Headset)
          Telephony (Cordless telephony, Modem, Headset)
> HCI Event: Command Complete (0x0e) plen 4               #228 [hci0] 37.258998
      Write Class of Device (0x03|0x0024) ncmd 1
        Status: Success (0x00)
@ MGMT Event: Class Of Device Chan.. (0x0007) plen 3  {0x0002} [hci0] 37.259081
        Class: 0x7c0104
          Major class: Computer (desktop, notebook, PDA, organizers)
          Minor class: Desktop workstation
          Rendering (Printing, Speaker)
          Capturing (Scanner, Microphone)
          Object Transfer (v-Inbox, v-Folder)
          Audio (Speaker, Microphone, Headset)
          Telephony (Cordless telephony, Modem, Headset)
@ MGMT Event: Class Of Device Chan.. (0x0007) plen 3  {0x0001} [hci0] 37.259081
        Class: 0x7c0104
          Major class: Computer (desktop, notebook, PDA, organizers)
          Minor class: Desktop workstation
          Rendering (Printing, Speaker)
          Capturing (Scanner, Microphone)
          Object Transfer (v-Inbox, v-Folder)
          Audio (Speaker, Microphone, Headset)
          Telephony (Cordless telephony, Modem, Headset)
< HCI Command: Write Local Name (0x03|0x0013) plen 248    #229 [hci0] 37.259093
        Name: lolren-ms7e34
> HCI Event: Command Complete (0x0e) plen 4               #230 [hci0] 37.259998
      Write Local Name (0x03|0x0013) ncmd 1
        Status: Success (0x00)
@ MGMT Event: Local Name Changed (0x0008) plen 260    {0x0002} [hci0] 37.260011
        Name: lolren-ms7e34
        Short name: 
@ MGMT Event: Local Name Changed (0x0008) plen 260    {0x0001} [hci0] 37.260011
        Name: lolren-ms7e34
        Short name: 
< HCI Command: Write Extended I.. (0x03|0x0052) plen 241  #231 [hci0] 37.260024
        FEC: Not required (0x00)
        Name (complete): lolren-ms7e34
        TX power: 12 dBm
        Device ID: USB Implementer's Forum assigned (0x0002)
          Vendor: Linux Foundation (0x1d6b)
          Product: 0x0246
          Version: 5.4.8 (0x0548)
        16-bit Service UUIDs (complete): 15 entries
          Generic Access Profile (0x1800)
          Generic Attribute Profile (0x1801)
          Device Information (0x180a)
          A/V Remote Control (0x110e)
          A/V Remote Control Target (0x110c)
          Message Notification Server (0x1133)
          Message Access Server (0x1132)
          Phonebook Access Server (0x112f)
          IrMC Sync (0x1104)
          OBEX File Transfer (0x1106)
          OBEX Object Push (0x1105)
          Handsfree Audio Gateway (0x111f)
          Handsfree (0x111e)
          Audio Source (0x110a)
          Audio Sink (0x110b)
        128-bit Service UUIDs (complete): 2 entries
          Vendor specific
          Vendor specific
> HCI Event: Command Complete (0x0e) plen 4               #232 [hci0] 37.260998
      Write Extended Inquiry Response (0x03|0x0052) ncmd 1
        Status: Success (0x00)
@ MGMT Event: New Settings (0x0006) plen 4            {0x0002} [hci0] 37.261016
        Current settings: 0x004c0ad1
          Powered
          Bondable
          Secure Simple Pairing
          BR/EDR
          Low Energy
          Secure Connections
          CIS Central
          CIS Peripheral
          Unknown settings (0x00400000)
@ MGMT Event: New Settings (0x0006) plen 4            {0x0001} [hci0] 37.261016
        Current settings: 0x004c0ad1
          Powered
          Bondable
          Secure Simple Pairing
          BR/EDR
          Low Energy
          Secure Connections
          CIS Central
          CIS Peripheral
          Unknown settings (0x00400000)
bluetoothctl[1075481]: @ MGMT Close: bluetoothctl            {0x0002} 54.330601
bluetoothctl[1077115]: @ MGMT O..n (privileged) version 1.23  {0x0002} 54.354731
bluetoothctl[1077115]: @ MGMT Close: bluetoothctl            {0x0002} 62.366637
bluetoothctl[1077869]: @ MGMT O..n (privileged) version 1.23  {0x0002} 62.376302
bluetoothctl[1077869]: @ MGMT Close: bluetoothctl            {0x0002} 68.386022
