Bluetooth monitor ver 5.72
btmon[1668370]: = Note: Linux version 6.17.0-14-generic (x86_64)       0.901407
btmon[1668370]: = Note: Bluetooth subsystem version 2.22               0.901409
= New Index: 68:34:21:E5:84:DF (Primary,USB,hci0)               [hci0] 0.901410
= Open Index: 68:34:21:E5:84:DF                                 [hci0] 0.901410
= Index Info: 68:34:21:E5:84:DF (Intel Corp.)                   [hci0] 0.901410
bluetoothd[2915165]: @ MGMT Open.. (privileged) version 1.23  {0x0001} 0.901411
bluetoothctl[1668527]: @ MGMT Open: bluetooth.. version 1.23  {0x0002} 2.903666
bluetoothctl[1668527]: @ MGMT Close: bluetoothctl             {0x0002} 2.914826
bluetoothctl[1668528]: @ MGMT Open: bluetooth.. version 1.23  {0x0002} 2.924083
bluetoothd[2915165]: @ MGMT Command.. (0x0023) plen 1  {0x0001} [hci0] 2.997684
        Address type: 0x07
          BR/EDR
          LE Public
          LE Random
< HCI Command: LE Set Address Resolu.. (0x08|0x002d) plen 1  #1 [hci0] 2.997960
        Address resolution: Disabled (0x00)
> HCI Event: Command Complete (0x0e) plen 4                  #2 [hci0] 3.094734
      LE Set Address Resolution Enable (0x08|0x002d) ncmd 1
        Status: Success (0x00)
< HCI Command: LE Set Random Address (0x08|0x0005) plen 6    #3 [hci0] 3.094881
        Address: 1E:FE:FA:EC:6E:D3 (Non-Resolvable)
> HCI Event: Command Complete (0x0e) plen 4                  #4 [hci0] 3.095716
      LE Set Random Address (0x08|0x0005) ncmd 1
        Status: Success (0x00)
< HCI Command: LE Set Extended Scan.. (0x08|0x0041) plen 13  #5 [hci0] 3.095857
        Own address type: Random (0x01)
        Filter policy: Accept all advertisement (0x00)
        PHYs: 0x05
        Entry 0: LE 1M
          Type: Active (0x01)
          Interval: 22.500 msec (0x0024)
          Window: 11.250 msec (0x0012)
        Entry 1: LE Coded
          Type: Active (0x01)
          Interval: 67.500 msec (0x006c)
          Window: 33.750 msec (0x0036)
> HCI Event: Command Complete (0x0e) plen 4                  #6 [hci0] 3.096716
      LE Set Extended Scan Parameters (0x08|0x0041) ncmd 1
        Status: Success (0x00)
< HCI Command: LE Set Extended Scan... (0x08|0x0042) plen 6  #7 [hci0] 3.096737
        Extended scan: Enabled (0x01)
        Filter duplicates: Enabled (0x01)
        Duration: 0 msec (0x0000)
        Period: 0.00 sec (0x0000)
> HCI Event: Command Complete (0x0e) plen 4                  #8 [hci0] 3.097716
      LE Set Extended Scan Enable (0x08|0x0042) ncmd 1
        Status: Success (0x00)
@ MGMT Event: Discovering (0x0013) plen 2              {0x0001} [hci0] 3.097726
        Address type: 0x07
          BR/EDR
          LE Public
          LE Random
        Discovery: Enabled (0x01)
< HCI Command: Inquiry (0x01|0x0001) plen 5                  #9 [hci0] 3.097840
        Access code: 0x9e8b33 (General Inquiry)
        Length: 10.24s (0x08)
        Num responses: 0
> HCI Event: LE Meta Event (0x3e) plen 57                   #10 [hci0] 3.103752
      LE Extended Advertising Report (0x0d)
        Num reports: 1
        Entry 0
          Event type: 0x0010
            Props: 0x0010
              Use legacy advertising PDUs
            Data status: [0;32mComplete[0m
          Legacy PDU Type: ADV_NONCONN_IND (0x0010)
          Address type: Random (0x01)
          Address: 63:47:C1:F8:E8:E8 (Resolvable)
          Primary PHY: LE 1M
          Secondary PHY: No packets
          SID: no ADI field (0xff)
          TX power: 127 dBm
          RSSI: -94 dBm (0xa2)
          Periodic advertising interval: 0.00 msec (0x0000)
          Direct address type: Public (0x00)
          Direct address: 00:00:00:00:00:00 (OUI 00-00-00)
          Data length: 0x1f
        1e ff 06 00 01 09 20 02 b7 c2 be 15 67 59 4d 76  ...... .....gYMv
        24 55 73 8f f9 94 d7 f4 92 47 cf f1 ff 4b 67     $Us......G...Kg 
        Company: Microsoft (6)
          Data: 01092002b7c2be1567594d762455738ff994d7f49247cff1ff4b67
@ MGMT Event: Device Found (0x0012) plen 45            {0x0001} [hci0] 3.103761
        LE Address: 63:47:C1:F8:E8:E8 (Resolvable)
        RSSI: -94 dBm (0xa2)
        Flags: 0x00000004
          Not Connectable
        Data length: 31
        Company: Microsoft (6)
          Data: 01092002b7c2be1567594d762455738ff994d7f49247cff1ff4b67
> HCI Event: Command Status (0x0f) plen 4                   #11 [hci0] 3.104716
      Inquiry (0x01|0x0001) ncmd 1
        Status: Success (0x00)
@ MGMT Event: Command Complete (0x0001) plen 4         {0x0001} [hci0] 3.104882
      Start Discovery (0x0023) plen 1
        Status: Success (0x00)
        Address type: 0x07
          BR/EDR
          LE Public
          LE Random
> HCI Event: LE Meta Event (0x3e) plen 43                   #12 [hci0] 5.354955
      LE Extended Advertising Report (0x0d)
        Num reports: 1
        Entry 0
          Event type: 0x0013
            Props: 0x0013
              Connectable
              Scannable
              Use legacy advertising PDUs
            Data status: [0;32mComplete[0m
          Legacy PDU Type: ADV_IND (0x0013)
          Address type: Public (0x00)
          Address: A4:C1:38:26:4E:DA (Telink Semiconductor (Taipei) Co. Ltd.)
          Primary PHY: LE 1M
          Secondary PHY: No packets
          SID: no ADI field (0xff)
          TX power: 127 dBm
          RSSI: -59 dBm (0xc5)
          Periodic advertising interval: 0.00 msec (0x0000)
          Direct address type: Public (0x00)
          Direct address: 00:00:00:00:00:00 (OUI 00-00-00)
          Data length: 0x11
        10 16 1a 18 a4 c1 38 26 4e da 00 cd 37 25 0a 01  ......8&N...7%..
        2a                                               *               
        Service Data: Environmental Sensing (0x181a)
          Data: a4c138264eda00cd37250a012a
> HCI Event: LE Meta Event (0x3e) plen 38                   #13 [hci0] 5.355828
      LE Extended Advertising Report (0x0d)
        Num reports: 1
        Entry 0
          Event type: 0x001b
            Props: 0x001b
              Connectable
              Scannable
              Scan response
              Use legacy advertising PDUs
            Data status: [0;32mComplete[0m
          Legacy PDU Type: SCAN_RSP to an ADV_SCAN_IND (0x001b)
          Address type: Public (0x00)
          Address: A4:C1:38:26:4E:DA (Telink Semiconductor (Taipei) Co. Ltd.)
          Primary PHY: LE 1M
          Secondary PHY: No packets
          SID: no ADI field (0xff)
          TX power: 127 dBm
          RSSI: -61 dBm (0xc3)
          Periodic advertising interval: 0.00 msec (0x0000)
          Direct address type: Public (0x00)
          Direct address: 00:00:00:00:00:00 (OUI 00-00-00)
          Data length: 0x0c
        0b 09 41 54 43 5f 32 36 34 45 44 41              ..ATC_264EDA    
        Name (complete): ATC_264EDA
@ MGMT Event: Device Found (0x0012) plen 43            {0x0001} [hci0] 5.355898
        LE Address: A4:C1:38:26:4E:DA (Telink Semiconductor (Taipei) Co. Ltd.)
        RSSI: -61 dBm (0xc3)
        Flags: 0x00000000
        Data length: 29
        Service Data: Environmental Sensing (0x181a)
          Data: a4c138264eda00cd37250a012a
        Name (complete): ATC_264EDA
> HCI Event: LE Meta Event (0x3e) plen 43                   #14 [hci0] 9.690089
      LE Extended Advertising Report (0x0d)
        Num reports: 1
        Entry 0
          Event type: 0x0013
            Props: 0x0013
              Connectable
              Scannable
              Use legacy advertising PDUs
            Data status: [0;32mComplete[0m
          Legacy PDU Type: ADV_IND (0x0013)
          Address type: Random (0x01)
          Address: 58:BB:A9:61:00:85 (Resolvable)
          Primary PHY: LE 1M
          Secondary PHY: No packets
          SID: no ADI field (0xff)
          TX power: 127 dBm
          RSSI: -84 dBm (0xac)
          Periodic advertising interval: 0.00 msec (0x0000)
          Direct address type: Public (0x00)
          Direct address: 00:00:00:00:00:00 (OUI 00-00-00)
          Data length: 0x11
        02 01 1a 02 0a 0c 0a ff 4c 00 10 05 3f 1c 07 f0  ........L...?...
        ad                                               .               
        Flags: 0x1a
          LE General Discoverable Mode
          Simultaneous LE and BR/EDR (Controller)
          Simultaneous LE and BR/EDR (Host)
        TX power: 12 dBm
        Company: Apple, Inc. (76)
          Type: Unknown (16)
          Data: 3f1c07f0ad
> HCI Event: LE Meta Event (0x3e) plen 26                   #15 [hci0] 9.690998
      LE Extended Advertising Report (0x0d)
        Num reports: 1
        Entry 0
          Event type: 0x001b
            Props: 0x001b
              Connectable
              Scannable
              Scan response
              Use legacy advertising PDUs
            Data status: [0;32mComplete[0m
          Legacy PDU Type: SCAN_RSP to an ADV_SCAN_IND (0x001b)
          Address type: Random (0x01)
          Address: 58:BB:A9:61:00:85 (Resolvable)
          Primary PHY: LE 1M
          Secondary PHY: No packets
          SID: no ADI field (0xff)
          TX power: 127 dBm
          RSSI: -84 dBm (0xac)
          Periodic advertising interval: 0.00 msec (0x0000)
          Direct address type: Public (0x00)
          Direct address: 00:00:00:00:00:00 (OUI 00-00-00)
          Data length: 0x00
@ MGMT Event: Device Found (0x0012) plen 31            {0x0001} [hci0] 9.691105
        LE Address: 58:BB:A9:61:00:85 (Resolvable)
        RSSI: -84 dBm (0xac)
        Flags: 0x00000000
        Data length: 17
        Flags: 0x1a
          LE General Discoverable Mode
          Simultaneous LE and BR/EDR (Controller)
          Simultaneous LE and BR/EDR (Host)
        TX power: 12 dBm
        Company: Apple, Inc. (76)
          Type: Unknown (16)
          Data: 3f1c07f0ad
> HCI Event: LE Meta Event (0x3e) plen 34                  #16 [hci0] 10.070194
      LE Extended Advertising Report (0x0d)
        Num reports: 1
        Entry 0
          Event type: 0x0010
            Props: 0x0010
              Use legacy advertising PDUs
            Data status: [0;32mComplete[0m
          Legacy PDU Type: ADV_NONCONN_IND (0x0010)
          Address type: Random (0x01)
          Address: EB:77:C7:03:BC:F3 (Static)
          Primary PHY: LE 1M
          Secondary PHY: No packets
          SID: no ADI field (0xff)
          TX power: 127 dBm
          RSSI: -87 dBm (0xa9)
          Periodic advertising interval: 0.00 msec (0x0000)
          Direct address type: Public (0x00)
          Direct address: 00:00:00:00:00:00 (OUI 00-00-00)
          Data length: 0x08
        07 ff 4c 00 12 02 00 03                          ..L.....        
        Company: Apple, Inc. (76)
          Type: Unknown (18)
          Data: 0003
@ MGMT Event: Device Found (0x0012) plen 22           {0x0001} [hci0] 10.070332
        LE Address: EB:77:C7:03:BC:F3 (Static)
        RSSI: -87 dBm (0xa9)
        Flags: 0x00000004
          Not Connectable
        Data length: 8
        Company: Apple, Inc. (76)
          Type: Unknown (18)
          Data: 0003
> HCI Event: LE Meta Event (0x3e) plen 43                  #17 [hci0] 10.256127
      LE Extended Advertising Report (0x0d)
        Num reports: 1
        Entry 0
          Event type: 0x0013
            Props: 0x0013
              Connectable
              Scannable
              Use legacy advertising PDUs
            Data status: [0;32mComplete[0m
          Legacy PDU Type: ADV_IND (0x0013)
          Address type: Public (0x00)
          Address: A4:C1:38:9D:41:32 (Telink Semiconductor (Taipei) Co. Ltd.)
          Primary PHY: LE 1M
          Secondary PHY: No packets
          SID: no ADI field (0xff)
          TX power: 127 dBm
          RSSI: -89 dBm (0xa7)
          Periodic advertising interval: 0.00 msec (0x0000)
          Direct address type: Public (0x00)
          Direct address: 00:00:00:00:00:00 (OUI 00-00-00)
          Data length: 0x11
        10 16 1a 18 a4 c1 38 9d 41 32 00 c4 3a 53 0b 84  ......8.A2..:S..
        11                                               .               
        Service Data: Environmental Sensing (0x181a)
          Data: a4c1389d413200c43a530b8411
> HCI Event: LE Meta Event (0x3e) plen 38                  #18 [hci0] 10.257088
      LE Extended Advertising Report (0x0d)
        Num reports: 1
        Entry 0
          Event type: 0x001b
            Props: 0x001b
              Connectable
              Scannable
              Scan response
              Use legacy advertising PDUs
            Data status: [0;32mComplete[0m
          Legacy PDU Type: SCAN_RSP to an ADV_SCAN_IND (0x001b)
          Address type: Public (0x00)
          Address: A4:C1:38:9D:41:32 (Telink Semiconductor (Taipei) Co. Ltd.)
          Primary PHY: LE 1M
          Secondary PHY: No packets
          SID: no ADI field (0xff)
          TX power: 127 dBm
          RSSI: -89 dBm (0xa7)
          Periodic advertising interval: 0.00 msec (0x0000)
          Direct address type: Public (0x00)
          Direct address: 00:00:00:00:00:00 (OUI 00-00-00)
          Data length: 0x0c
        0b 09 41 54 43 5f 39 44 34 31 33 32              ..ATC_9D4132    
        Name (complete): ATC_9D4132
@ MGMT Event: Device Found (0x0012) plen 43           {0x0001} [hci0] 10.257171
        LE Address: A4:C1:38:9D:41:32 (Telink Semiconductor (Taipei) Co. Ltd.)
        RSSI: -89 dBm (0xa7)
        Flags: 0x00000000
        Data length: 29
        Service Data: Environmental Sensing (0x181a)
          Data: a4c1389d413200c43a530b8411
        Name (complete): ATC_9D4132
> HCI Event: Inquiry Complete (0x01) plen 1                #19 [hci0] 13.408266
        Status: Success (0x00)
> HCI Event: LE Meta Event (0x3e) plen 39                  #20 [hci0] 13.420242
      LE Extended Advertising Report (0x0d)
        Num reports: 1
        Entry 0
          Event type: 0x0013
            Props: 0x0013
              Connectable
              Scannable
              Use legacy advertising PDUs
            Data status: [0;32mComplete[0m
          Legacy PDU Type: ADV_IND (0x0013)
          Address type: Random (0x01)
          Address: C0:DE:54:15:00:51 (Static)
          Primary PHY: LE 1M
          Secondary PHY: No packets
          SID: no ADI field (0xff)
          TX power: 127 dBm
          RSSI: -83 dBm (0xad)
          Periodic advertising interval: 0.00 msec (0x0000)
          Direct address type: Public (0x00)
          Direct address: 00:00:00:00:00:00 (OUI 00-00-00)
          Data length: 0x0d
        02 01 06 09 09 58 35 34 2d 50 41 49 52           .....X54-PAIR   
        Flags: 0x06
          LE General Discoverable Mode
          BR/EDR Not Supported
        Name (complete): X54-PAIR
@ MGMT Event: Discovering (0x0013) plen 2             {0x0001} [hci0] 13.523876
        Address type: 0x07
          BR/EDR
          LE Public
          LE Random
        Discovery: Disabled (0x00)
< HCI Command: LE Set Extended Sca.. (0x08|0x0042) plen 6  #21 [hci0] 13.523981
        Extended scan: Disabled (0x00)
        Filter duplicates: Disabled (0x00)
        Duration: 0 msec (0x0000)
        Period: 0.00 sec (0x0000)
> HCI Event: Command Complete (0x0e) plen 4                #22 [hci0] 13.527143
      LE Set Extended Scan Enable (0x08|0x0042) ncmd 1
        Status: Success (0x00)
bluetoothctl[1668528]: @ MGMT Close: bluetoothctl            {0x0002} 17.005105
bluetoothd[2915165]: @ MGMT Comman.. (0x003a) plen 4  {0x0001} [hci0] 17.012704
        Address type: 0x01
          BR/EDR
        RSSI: invalid (0x7f)
        UUIDs: 0
< HCI Command: Inquiry (0x01|0x0001) plen 5                #23 [hci0] 17.012877
        Access code: 0x9e8b33 (General Inquiry)
        Length: 10.24s (0x08)
        Num responses: 0
bluetoothctl[1669781]: @ MGMT Open: bluetoot.. version 1.23  {0x0002} 17.015563
> HCI Event: Command Status (0x0f) plen 4                  #24 [hci0] 17.108302
      Inquiry (0x01|0x0001) ncmd 1
        Status: Success (0x00)
@ MGMT Event: Command Complete (0x0001) plen 4        {0x0001} [hci0] 17.108501
      Start Service Discovery (0x003a) plen 1
        Status: Success (0x00)
        Address type: 0x01
          BR/EDR
@ MGMT Event: Discovering (0x0013) plen 2             {0x0001} [hci0] 17.108509
        Address type: 0x01
          BR/EDR
        Discovery: Enabled (0x01)
bluetoothctl[1669781]: @ MGMT Close: bluetoothctl            {0x0002} 25.027298
bluetoothctl[1670530]: @ MGMT Open: bluetoot.. version 1.23  {0x0002} 25.034330
bluetoothctl[1670530]: @ MGMT Close: bluetoothctl            {0x0002} 25.038200
bluetoothctl[1670531]: @ MGMT Open: bluetoot.. version 1.23  {0x0002} 25.041479
> HCI Event: Inquiry Complete (0x01) plen 1                #25 [hci0] 27.411730
        Status: Success (0x00)
@ MGMT Event: Discovering (0x0013) plen 2             {0x0001} [hci0] 27.411864
        Address type: 0x01
          BR/EDR
        Discovery: Disabled (0x00)
bluetoothd[2915165]: @ MGMT Comman.. (0x003a) plen 4  {0x0001} [hci0] 27.412100
        Address type: 0x01
          BR/EDR
        RSSI: invalid (0x7f)
        UUIDs: 0
< HCI Command: Inquiry (0x01|0x0001) plen 5                #26 [hci0] 27.412387
        Access code: 0x9e8b33 (General Inquiry)
        Length: 10.24s (0x08)
        Num responses: 0
> HCI Event: Command Status (0x0f) plen 4                  #27 [hci0] 27.413709
      Inquiry (0x01|0x0001) ncmd 1
        Status: Success (0x00)
@ MGMT Event: Command Complete (0x0001) plen 4        {0x0001} [hci0] 27.413962
      Start Service Discovery (0x003a) plen 1
        Status: Success (0x00)
        Address type: 0x01
          BR/EDR
@ MGMT Event: Discovering (0x0013) plen 2             {0x0001} [hci0] 27.413972
        Address type: 0x01
          BR/EDR
        Discovery: Enabled (0x01)
bluetoothctl[1670531]: @ MGMT Close: bluetoothctl            {0x0002} 37.056513
bluetoothctl[1671588]: @ MGMT Open: bluetoot.. version 1.23  {0x0002} 37.064554
> HCI Event: Inquiry Complete (0x01) plen 1                #28 [hci0] 37.719243
        Status: Success (0x00)
@ MGMT Event: Discovering (0x0013) plen 2             {0x0001} [hci0] 37.719363
        Address type: 0x01
          BR/EDR
        Discovery: Disabled (0x00)
bluetoothd[2915165]: @ MGMT Comman.. (0x003a) plen 4  {0x0001} [hci0] 37.719629
        Address type: 0x01
          BR/EDR
        RSSI: invalid (0x7f)
        UUIDs: 0
< HCI Command: Inquiry (0x01|0x0001) plen 5                #29 [hci0] 37.719779
        Access code: 0x9e8b33 (General Inquiry)
        Length: 10.24s (0x08)
        Num responses: 0
> HCI Event: Command Status (0x0f) plen 4                  #30 [hci0] 37.721132
      Inquiry (0x01|0x0001) ncmd 1
        Status: Success (0x00)
@ MGMT Event: Command Complete (0x0001) plen 4        {0x0001} [hci0] 37.721245
      Start Service Discovery (0x003a) plen 1
        Status: Success (0x00)
        Address type: 0x01
          BR/EDR
@ MGMT Event: Discovering (0x0013) plen 2             {0x0001} [hci0] 37.721251
        Address type: 0x01
          BR/EDR
        Discovery: Enabled (0x01)
> HCI Event: Inquiry Complete (0x01) plen 1                #31 [hci0] 48.025554
        Status: Success (0x00)
@ MGMT Event: Discovering (0x0013) plen 2             {0x0001} [hci0] 48.025644
        Address type: 0x01
          BR/EDR
        Discovery: Disabled (0x00)
bluetoothd[2915165]: @ MGMT Comman.. (0x003a) plen 4  {0x0001} [hci0] 48.025837
        Address type: 0x01
          BR/EDR
        RSSI: invalid (0x7f)
        UUIDs: 0
< HCI Command: Inquiry (0x01|0x0001) plen 5                #32 [hci0] 48.026119
        Access code: 0x9e8b33 (General Inquiry)
        Length: 10.24s (0x08)
        Num responses: 0
> HCI Event: Command Status (0x0f) plen 4                  #33 [hci0] 48.027548
      Inquiry (0x01|0x0001) ncmd 1
        Status: Success (0x00)
@ MGMT Event: Command Complete (0x0001) plen 4        {0x0001} [hci0] 48.027864
      Start Service Discovery (0x003a) plen 1
        Status: Success (0x00)
        Address type: 0x01
          BR/EDR
@ MGMT Event: Discovering (0x0013) plen 2             {0x0001} [hci0] 48.027871
        Address type: 0x01
          BR/EDR
        Discovery: Enabled (0x01)
bluetoothctl[1671588]: @ MGMT Close: bluetoothctl            {0x0002} 49.077046
bluetoothctl[1672636]: @ MGMT Open: bluetoot.. version 1.23  {0x0002} 49.082613
> HCI Event: Inquiry Complete (0x01) plen 1                #34 [hci0] 58.332057
        Status: Success (0x00)
@ MGMT Event: Discovering (0x0013) plen 2             {0x0001} [hci0] 58.332085
        Address type: 0x01
          BR/EDR
        Discovery: Disabled (0x00)
bluetoothd[2915165]: @ MGMT Comman.. (0x003a) plen 4  {0x0001} [hci0] 58.332318
        Address type: 0x01
          BR/EDR
        RSSI: invalid (0x7f)
        UUIDs: 0
< HCI Command: Inquiry (0x01|0x0001) plen 5                #35 [hci0] 58.332452
        Access code: 0x9e8b33 (General Inquiry)
        Length: 10.24s (0x08)
        Num responses: 0
> HCI Event: Command Status (0x0f) plen 4                  #36 [hci0] 58.332965
      Inquiry (0x01|0x0001) ncmd 1
        Status: Success (0x00)
@ MGMT Event: Command Complete (0x0001) plen 4        {0x0001} [hci0] 58.333091
      Start Service Discovery (0x003a) plen 1
        Status: Success (0x00)
        Address type: 0x01
          BR/EDR
@ MGMT Event: Discovering (0x0013) plen 2             {0x0001} [hci0] 58.333099
        Address type: 0x01
          BR/EDR
        Discovery: Enabled (0x01)
bluetoothctl[1672636]: @ MGMT Close: bluetoothctl            {0x0002} 59.097254
> HCI Event: Inquiry Complete (0x01) plen 1                #37 [hci0] 68.638508
        Status: Success (0x00)
@ MGMT Event: Discovering (0x0013) plen 2             {0x0001} [hci0] 68.638526
        Address type: 0x01
          BR/EDR
        Discovery: Disabled (0x00)
bluetoothd[2915165]: @ MGMT Comman.. (0x003a) plen 4  {0x0001} [hci0] 68.638778
        Address type: 0x01
          BR/EDR
        RSSI: invalid (0x7f)
        UUIDs: 0
< HCI Command: Inquiry (0x01|0x0001) plen 5                #38 [hci0] 68.638983
        Access code: 0x9e8b33 (General Inquiry)
        Length: 10.24s (0x08)
        Num responses: 0
> HCI Event: Command Status (0x0f) plen 4                  #39 [hci0] 68.640383
      Inquiry (0x01|0x0001) ncmd 1
        Status: Success (0x00)
@ MGMT Event: Command Complete (0x0001) plen 4        {0x0001} [hci0] 68.640520
      Start Service Discovery (0x003a) plen 1
        Status: Success (0x00)
        Address type: 0x01
          BR/EDR
@ MGMT Event: Discovering (0x0013) plen 2             {0x0001} [hci0] 68.640536
        Address type: 0x01
          BR/EDR
        Discovery: Enabled (0x01)
bluetoothctl[1674421]: @ MGMT Open: bluetoot.. version 1.23  {0x0002} 69.109599
bluetoothctl[1674421]: @ MGMT Close: bluetoothctl            {0x0002} 77.131131
> HCI Event: Inquiry Complete (0x01) plen 1                #40 [hci0] 78.943872
        Status: Success (0x00)
@ MGMT Event: Discovering (0x0013) plen 2             {0x0001} [hci0] 78.943975
        Address type: 0x01
          BR/EDR
        Discovery: Disabled (0x00)
bluetoothd[2915165]: @ MGMT Comman.. (0x003a) plen 4  {0x0001} [hci0] 78.944182
        Address type: 0x01
          BR/EDR
        RSSI: invalid (0x7f)
        UUIDs: 0
< HCI Command: Inquiry (0x01|0x0001) plen 5                #41 [hci0] 78.944434
        Access code: 0x9e8b33 (General Inquiry)
        Length: 10.24s (0x08)
        Num responses: 0
> HCI Event: Command Status (0x0f) plen 4                  #42 [hci0] 78.945801
      Inquiry (0x01|0x0001) ncmd 1
        Status: Success (0x00)
@ MGMT Event: Command Complete (0x0001) plen 4        {0x0001} [hci0] 78.946028
      Start Service Discovery (0x003a) plen 1
        Status: Success (0x00)
        Address type: 0x01
          BR/EDR
@ MGMT Event: Discovering (0x0013) plen 2             {0x0001} [hci0] 78.946036
        Address type: 0x01
          BR/EDR
        Discovery: Enabled (0x01)
