Bluetooth monitor ver 5.72
btmon[2997443]: = Note: Linux version 6.17.0-14-generic (x86_64)       0.415548
btmon[2997443]: = Note: Bluetooth subsystem version 2.22               0.415549
= New Index: 68:34:21:E5:84:DF (Primary,USB,hci0)               [hci0] 0.415550
= Open Index: 68:34:21:E5:84:DF                                 [hci0] 0.415551
= Index Info: 68:34:21:E5:84:DF (Intel Corp.)                   [hci0] 0.415551
bluetoothd[2915165]: @ MGMT Open.. (privileged) version 1.23  {0x0001} 0.415552
bluetoothctl[2997497]: @ MGMT Open: bluetooth.. version 1.23  {0x0002} 1.421846
> HCI Event: Inquiry Complete (0x01) plen 1                  #1 [hci0] 4.038934
        Status: Success (0x00)
@ MGMT Event: Discovering (0x0013) plen 2              {0x0001} [hci0] 4.038964
        Address type: 0x01
          BR/EDR
        Discovery: Disabled (0x00)
bluetoothd[2915165]: @ MGMT Command.. (0x003a) plen 4  {0x0001} [hci0] 4.039275
        Address type: 0x01
          BR/EDR
        RSSI: invalid (0x7f)
        UUIDs: 0
< HCI Command: Inquiry (0x01|0x0001) plen 5                  #2 [hci0] 4.039403
        Access code: 0x9e8b33 (General Inquiry)
        Length: 10.24s (0x08)
        Num responses: 0
> HCI Event: Command Status (0x0f) plen 4                    #3 [hci0] 4.040818
      Inquiry (0x01|0x0001) ncmd 1
        Status: Success (0x00)
@ MGMT Event: Command Complete (0x0001) plen 4         {0x0001} [hci0] 4.040956
      Start Service Discovery (0x003a) plen 1
        Status: Success (0x00)
        Address type: 0x01
          BR/EDR
@ MGMT Event: Discovering (0x0013) plen 2              {0x0001} [hci0] 4.040965
        Address type: 0x01
          BR/EDR
        Discovery: Enabled (0x01)
bluetoothctl[2997497]: @ MGMT Close: bluetoothctl             {0x0002} 9.431985
bluetoothctl[2998227]: @ MGMT Open: bluetooth.. version 1.23  {0x0002} 9.445942
bluetoothd[2915165]: @ MGMT Command.. (0x0024) plen 1  {0x0001} [hci0] 9.450094
        Address type: 0x01
          BR/EDR
< HCI Command: Inquiry Cancel (0x01|0x0002) plen 0           #4 [hci0] 9.450195
> HCI Event: Command Complete (0x0e) plen 4                  #5 [hci0] 9.545066
      Inquiry Cancel (0x01|0x0002) ncmd 1
        Status: Success (0x00)
@ MGMT Event: Discovering (0x0013) plen 2              {0x0001} [hci0] 9.545089
        Address type: 0x01
          BR/EDR
        Discovery: Disabled (0x00)
@ MGMT Event: Command Complete (0x0001) plen 4         {0x0001} [hci0] 9.545305
      Stop Discovery (0x0024) plen 1
        Status: Success (0x00)
        Address type: 0x01
          BR/EDR
bluetoothd[2915165]: @ MGMT Command.. (0x003a) plen 4  {0x0001} [hci0] 9.545434
        Address type: 0x07
          BR/EDR
          LE Public
          LE Random
        RSSI: invalid (0x7f)
        UUIDs: 0
< HCI Command: LE Set Random Address (0x08|0x0005) plen 6    #6 [hci0] 9.545526
        Address: 30:7F:2C:0F:0E:B1 (Non-Resolvable)
> HCI Event: Command Complete (0x0e) plen 4                  #7 [hci0] 9.545970
      LE Set Random Address (0x08|0x0005) ncmd 1
        Status: Success (0x00)
< HCI Command: LE Set Extended Scan.. (0x08|0x0041) plen 13  #8 [hci0] 9.546070
        Own address type: Random (0x01)
        Filter policy: Accept all advertisement (0x00)
        PHYs: 0x05
        Entry 0: LE 1M
          Type: Active (0x01)
          Interval: 22.500 msec (0x0024)
          Window: 11.250 msec (0x0012)
        Entry 1: LE Coded
          Type: Active (0x01)
          Interval: 67.500 msec (0x006c)
          Window: 33.750 msec (0x0036)
> HCI Event: Command Complete (0x0e) plen 4                  #9 [hci0] 9.546974
      LE Set Extended Scan Parameters (0x08|0x0041) ncmd 1
        Status: Success (0x00)
< HCI Command: LE Set Extended Scan.. (0x08|0x0042) plen 6  #10 [hci0] 9.547080
        Extended scan: Enabled (0x01)
        Filter duplicates: Disabled (0x00)
        Duration: 0 msec (0x0000)
        Period: 0.00 sec (0x0000)
> HCI Event: Command Complete (0x0e) plen 4                 #11 [hci0] 9.547973
      LE Set Extended Scan Enable (0x08|0x0042) ncmd 1
        Status: Success (0x00)
@ MGMT Event: Discovering (0x0013) plen 2              {0x0001} [hci0] 9.547981
        Address type: 0x07
          BR/EDR
          LE Public
          LE Random
        Discovery: Enabled (0x01)
< HCI Command: Inquiry (0x01|0x0001) plen 5                 #12 [hci0] 9.548082
        Access code: 0x9e8b33 (General Inquiry)
        Length: 10.24s (0x08)
        Num responses: 0
> HCI Event: Command Status (0x0f) plen 4                   #13 [hci0] 9.560076
      Inquiry (0x01|0x0001) ncmd 1
        Status: Success (0x00)
@ MGMT Event: Command Complete (0x0001) plen 4         {0x0001} [hci0] 9.560212
      Start Service Discovery (0x003a) plen 1
        Status: Success (0x00)
        Address type: 0x07
          BR/EDR
          LE Public
          LE Random
> HCI Event: LE Meta Event (0x3e) plen 26                   #14 [hci0] 9.646081
      LE Extended Advertising Report (0x0d)
        Num reports: 1
        Entry 0
          Event type: 0x0013
            Props: 0x0013
              Connectable
              Scannable
              Use legacy advertising PDUs
            Data status: [0;32mComplete[0m
          Legacy PDU Type: ADV_IND (0x0013)
          Address type: Public (0x00)
          Address: 00:00:00:00:00:00 (OUI 00-00-00)
          Primary PHY: LE 1M
          Secondary PHY: No packets
          SID: no ADI field (0xff)
          TX power: 127 dBm
          RSSI: -81 dBm (0xaf)
          Periodic advertising interval: 0.00 msec (0x0000)
          Direct address type: Public (0x00)
          Direct address: 00:00:00:00:00:00 (OUI 00-00-00)
          Data length: 0x00
> HCI Event: LE Meta Event (0x3e) plen 39                   #15 [hci0] 9.949160
      LE Extended Advertising Report (0x0d)
        Num reports: 1
        Entry 0
          Event type: 0x0013
            Props: 0x0013
              Connectable
              Scannable
              Use legacy advertising PDUs
            Data status: [0;32mComplete[0m
          Legacy PDU Type: ADV_IND (0x0013)
          Address type: Random (0x01)
          Address: C0:DE:54:15:00:51 (Static)
          Primary PHY: LE 1M
          Secondary PHY: No packets
          SID: no ADI field (0xff)
          TX power: 127 dBm
          RSSI: -80 dBm (0xb0)
          Periodic advertising interval: 0.00 msec (0x0000)
          Direct address type: Public (0x00)
          Direct address: 00:00:00:00:00:00 (OUI 00-00-00)
          Data length: 0x0d
        02 01 06 09 09 58 35 34 2d 50 41 49 52           .....X54-PAIR   
        Flags: 0x06
          LE General Discoverable Mode
          BR/EDR Not Supported
        Name (complete): X54-PAIR
> HCI Event: LE Meta Event (0x3e) plen 43                  #16 [hci0] 10.128112
      LE Extended Advertising Report (0x0d)
        Num reports: 1
        Entry 0
          Event type: 0x0013
            Props: 0x0013
              Connectable
              Scannable
              Use legacy advertising PDUs
            Data status: [0;32mComplete[0m
          Legacy PDU Type: ADV_IND (0x0013)
          Address type: Public (0x00)
          Address: A4:C1:38:9D:41:32 (Telink Semiconductor (Taipei) Co. Ltd.)
          Primary PHY: LE 1M
          Secondary PHY: No packets
          SID: no ADI field (0xff)
          TX power: 127 dBm
          RSSI: -86 dBm (0xaa)
          Periodic advertising interval: 0.00 msec (0x0000)
          Direct address type: Public (0x00)
          Direct address: 00:00:00:00:00:00 (OUI 00-00-00)
          Data length: 0x11
        10 16 1a 18 a4 c1 38 9d 41 32 00 dc 3a 53 0b 8d  ......8.A2..:S..
        b7                                               .               
        Service Data: Environmental Sensing (0x181a)
          Data: a4c1389d413200dc3a530b8db7
@ MGMT Event: Device Found (0x0012) plen 27           {0x0001} [hci0] 10.128219
        LE Address: C0:DE:54:15:00:51 (Static)
        RSSI: -80 dBm (0xb0)
        Flags: 0x00000000
        Data length: 13
        Flags: 0x06
          LE General Discoverable Mode
          BR/EDR Not Supported
        Name (complete): X54-PAIR
> HCI Event: LE Meta Event (0x3e) plen 38                  #17 [hci0] 10.129030
      LE Extended Advertising Report (0x0d)
        Num reports: 1
        Entry 0
          Event type: 0x001b
            Props: 0x001b
              Connectable
              Scannable
              Scan response
              Use legacy advertising PDUs
            Data status: [0;32mComplete[0m
          Legacy PDU Type: SCAN_RSP to an ADV_SCAN_IND (0x001b)
          Address type: Public (0x00)
          Address: A4:C1:38:9D:41:32 (Telink Semiconductor (Taipei) Co. Ltd.)
          Primary PHY: LE 1M
          Secondary PHY: No packets
          SID: no ADI field (0xff)
          TX power: 127 dBm
          RSSI: -87 dBm (0xa9)
          Periodic advertising interval: 0.00 msec (0x0000)
          Direct address type: Public (0x00)
          Direct address: 00:00:00:00:00:00 (OUI 00-00-00)
          Data length: 0x0c
        0b 09 41 54 43 5f 39 44 34 31 33 32              ..ATC_9D4132    
        Name (complete): ATC_9D4132
@ MGMT Event: Device Found (0x0012) plen 43           {0x0001} [hci0] 10.129143
        LE Address: A4:C1:38:9D:41:32 (Telink Semiconductor (Taipei) Co. Ltd.)
        RSSI: -87 dBm (0xa9)
        Flags: 0x00000000
        Data length: 29
        Service Data: Environmental Sensing (0x181a)
          Data: a4c1389d413200dc3a530b8db7
        Name (complete): ATC_9D4132
> HCI Event: LE Meta Event (0x3e) plen 57                  #18 [hci0] 10.922112
      LE Extended Advertising Report (0x0d)
        Num reports: 1
        Entry 0
          Event type: 0x0010
            Props: 0x0010
              Use legacy advertising PDUs
            Data status: [0;32mComplete[0m
          Legacy PDU Type: ADV_NONCONN_IND (0x0010)
          Address type: Random (0x01)
          Address: 41:7D:F8:94:74:11 (Resolvable)
          Primary PHY: LE 1M
          Secondary PHY: No packets
          SID: no ADI field (0xff)
          TX power: 127 dBm
          RSSI: -90 dBm (0xa6)
          Periodic advertising interval: 0.00 msec (0x0000)
          Direct address type: Public (0x00)
          Direct address: 00:00:00:00:00:00 (OUI 00-00-00)
          Data length: 0x1f
        1e ff 06 00 01 09 20 02 b9 3b 7b c1 18 e0 63 e4  ...... ..;{...c.
        d5 77 78 5c 29 59 9a d1 71 74 22 4a 1d 02 96     .wx\)Y..qt"J... 
        Company: Microsoft (6)
          Data: 01092002b93b7bc118e063e4d577785c29599ad17174224a1d0296
@ MGMT Event: Device Found (0x0012) plen 45           {0x0001} [hci0] 10.922219
        LE Address: 41:7D:F8:94:74:11 (Resolvable)
        RSSI: -90 dBm (0xa6)
        Flags: 0x00000004
          Not Connectable
        Data length: 31
        Company: Microsoft (6)
          Data: 01092002b93b7bc118e063e4d577785c29599ad17174224a1d0296
> HCI Event: LE Meta Event (0x3e) plen 43                  #19 [hci0] 11.672123
      LE Extended Advertising Report (0x0d)
        Num reports: 1
        Entry 0
          Event type: 0x0013
            Props: 0x0013
              Connectable
              Scannable
              Use legacy advertising PDUs
            Data status: [0;32mComplete[0m
          Legacy PDU Type: ADV_IND (0x0013)
          Address type: Random (0x01)
          Address: 75:C1:7B:0E:AC:14 (Resolvable)
          Primary PHY: LE 1M
          Secondary PHY: No packets
          SID: no ADI field (0xff)
          TX power: 127 dBm
          RSSI: -94 dBm (0xa2)
          Periodic advertising interval: 0.00 msec (0x0000)
          Direct address type: Public (0x00)
          Direct address: 00:00:00:00:00:00 (OUI 00-00-00)
          Data length: 0x11
        02 01 1a 02 0a 0c 0a ff 4c 00 10 05 3b 1c 8f e6  ........L...;...
        df                                               .               
        Flags: 0x1a
          LE General Discoverable Mode
          Simultaneous LE and BR/EDR (Controller)
          Simultaneous LE and BR/EDR (Host)
        TX power: 12 dBm
        Company: Apple, Inc. (76)
          Type: Unknown (16)
          Data: 3b1c8fe6df
> HCI Event: LE Meta Event (0x3e) plen 26                  #20 [hci0] 11.673128
      LE Extended Advertising Report (0x0d)
        Num reports: 1
        Entry 0
          Event type: 0x001b
            Props: 0x001b
              Connectable
              Scannable
              Scan response
              Use legacy advertising PDUs
            Data status: [0;32mComplete[0m
          Legacy PDU Type: SCAN_RSP to an ADV_SCAN_IND (0x001b)
          Address type: Random (0x01)
          Address: 75:C1:7B:0E:AC:14 (Resolvable)
          Primary PHY: LE 1M
          Secondary PHY: No packets
          SID: no ADI field (0xff)
          TX power: 127 dBm
          RSSI: -95 dBm (0xa1)
          Periodic advertising interval: 0.00 msec (0x0000)
          Direct address type: Public (0x00)
          Direct address: 00:00:00:00:00:00 (OUI 00-00-00)
          Data length: 0x00
@ MGMT Event: Device Found (0x0012) plen 31           {0x0001} [hci0] 11.673280
        LE Address: 75:C1:7B:0E:AC:14 (Resolvable)
        RSSI: -95 dBm (0xa1)
        Flags: 0x00000000
        Data length: 17
        Flags: 0x1a
          LE General Discoverable Mode
          Simultaneous LE and BR/EDR (Controller)
          Simultaneous LE and BR/EDR (Host)
        TX power: 12 dBm
        Company: Apple, Inc. (76)
          Type: Unknown (16)
          Data: 3b1c8fe6df
> HCI Event: LE Meta Event (0x3e) plen 57                  #21 [hci0] 11.758166
      LE Extended Advertising Report (0x0d)
        Num reports: 1
        Entry 0
          Event type: 0x0010
            Props: 0x0010
              Use legacy advertising PDUs
            Data status: [0;32mComplete[0m
          Legacy PDU Type: ADV_NONCONN_IND (0x0010)
          Address type: Random (0x01)
          Address: 41:7D:F8:94:74:11 (Resolvable)
          Primary PHY: LE 1M
          Secondary PHY: No packets
          SID: no ADI field (0xff)
          TX power: 127 dBm
          RSSI: -90 dBm (0xa6)
          Periodic advertising interval: 0.00 msec (0x0000)
          Direct address type: Public (0x00)
          Direct address: 00:00:00:00:00:00 (OUI 00-00-00)
          Data length: 0x1f
        1e ff 06 00 01 09 20 02 b9 3b 7b c1 18 e0 63 e4  ...... ..;{...c.
        d5 77 78 5c 29 59 9a d1 71 74 22 4a 1d 02 96     .wx\)Y..qt"J... 
        Company: Microsoft (6)
          Data: 01092002b93b7bc118e063e4d577785c29599ad17174224a1d0296
@ MGMT Event: Device Found (0x0012) plen 45           {0x0001} [hci0] 11.758310
        LE Address: 41:7D:F8:94:74:11 (Resolvable)
        RSSI: -90 dBm (0xa6)
        Flags: 0x00000004
          Not Connectable
        Data length: 31
        Company: Microsoft (6)
          Data: 01092002b93b7bc118e063e4d577785c29599ad17174224a1d0296
> HCI Event: LE Meta Event (0x3e) plen 39                  #22 [hci0] 12.136154
      LE Extended Advertising Report (0x0d)
        Num reports: 1
        Entry 0
          Event type: 0x0013
            Props: 0x0013
              Connectable
              Scannable
              Use legacy advertising PDUs
            Data status: [0;32mComplete[0m
          Legacy PDU Type: ADV_IND (0x0013)
          Address type: Random (0x01)
          Address: C0:DE:54:15:00:51 (Static)
          Primary PHY: LE 1M
          Secondary PHY: No packets
          SID: no ADI field (0xff)
          TX power: 127 dBm
          RSSI: -80 dBm (0xb0)
          Periodic advertising interval: 0.00 msec (0x0000)
          Direct address type: Public (0x00)
          Direct address: 00:00:00:00:00:00 (OUI 00-00-00)
          Data length: 0x0d
        02 01 06 09 09 58 35 34 2d 50 41 49 52           .....X54-PAIR   
        Flags: 0x06
          LE General Discoverable Mode
          BR/EDR Not Supported
        Name (complete): X54-PAIR
> HCI Event: LE Meta Event (0x3e) plen 39                  #23 [hci0] 14.102219
      LE Extended Advertising Report (0x0d)
        Num reports: 1
        Entry 0
          Event type: 0x0013
            Props: 0x0013
              Connectable
              Scannable
              Use legacy advertising PDUs
            Data status: [0;32mComplete[0m
          Legacy PDU Type: ADV_IND (0x0013)
          Address type: Random (0x01)
          Address: C0:DE:54:15:00:51 (Static)
          Primary PHY: LE 1M
          Secondary PHY: No packets
          SID: no ADI field (0xff)
          TX power: 127 dBm
          RSSI: -81 dBm (0xaf)
          Periodic advertising interval: 0.00 msec (0x0000)
          Direct address type: Public (0x00)
          Direct address: 00:00:00:00:00:00 (OUI 00-00-00)
          Data length: 0x0d
        02 01 06 09 09 58 35 34 2d 50 41 49 52           .....X54-PAIR   
        Flags: 0x06
          LE General Discoverable Mode
          BR/EDR Not Supported
        Name (complete): X54-PAIR
> HCI Event: LE Meta Event (0x3e) plen 26                  #24 [hci0] 14.948265
      LE Extended Advertising Report (0x0d)
        Num reports: 1
        Entry 0
          Event type: 0x0013
            Props: 0x0013
              Connectable
              Scannable
              Use legacy advertising PDUs
            Data status: [0;32mComplete[0m
          Legacy PDU Type: ADV_IND (0x0013)
          Address type: Random (0x01)
          Address: C0:DE:54:15:00:51 (Static)
          Primary PHY: LE 1M
          Secondary PHY: No packets
          SID: no ADI field (0xff)
          TX power: 127 dBm
          RSSI: -81 dBm (0xaf)
          Periodic advertising interval: 0.00 msec (0x0000)
          Direct address type: Public (0x00)
          Direct address: 00:00:00:00:00:00 (OUI 00-00-00)
          Data length: 0x00
> HCI Event: LE Meta Event (0x3e) plen 43                  #25 [hci0] 15.308307
      LE Extended Advertising Report (0x0d)
        Num reports: 1
        Entry 0
          Event type: 0x0013
            Props: 0x0013
              Connectable
              Scannable
              Use legacy advertising PDUs
            Data status: [0;32mComplete[0m
          Legacy PDU Type: ADV_IND (0x0013)
          Address type: Public (0x00)
          Address: A4:C1:38:26:4E:DA (Telink Semiconductor (Taipei) Co. Ltd.)
          Primary PHY: LE 1M
          Secondary PHY: No packets
          SID: no ADI field (0xff)
          TX power: 127 dBm
          RSSI: -59 dBm (0xc5)
          Periodic advertising interval: 0.00 msec (0x0000)
          Direct address type: Public (0x00)
          Direct address: 00:00:00:00:00:00 (OUI 00-00-00)
          Data length: 0x11
        10 16 1a 18 a4 c1 38 26 4e da 00 d5 30 25 0a 03  ......8&N...0%..
        cf                                               .               
        Service Data: Environmental Sensing (0x181a)
          Data: a4c138264eda00d530250a03cf
@ MGMT Event: Device Found (0x0012) plen 14           {0x0001} [hci0] 15.308386
        LE Address: C0:DE:54:15:00:51 (Static)
        RSSI: -81 dBm (0xaf)
        Flags: 0x00000000
        Data length: 0
> HCI Event: LE Meta Event (0x3e) plen 38                  #26 [hci0] 15.309160
      LE Extended Advertising Report (0x0d)
        Num reports: 1
        Entry 0
          Event type: 0x001b
            Props: 0x001b
              Connectable
              Scannable
              Scan response
              Use legacy advertising PDUs
            Data status: [0;32mComplete[0m
          Legacy PDU Type: SCAN_RSP to an ADV_SCAN_IND (0x001b)
          Address type: Public (0x00)
          Address: A4:C1:38:26:4E:DA (Telink Semiconductor (Taipei) Co. Ltd.)
          Primary PHY: LE 1M
          Secondary PHY: No packets
          SID: no ADI field (0xff)
          TX power: 127 dBm
          RSSI: -59 dBm (0xc5)
          Periodic advertising interval: 0.00 msec (0x0000)
          Direct address type: Public (0x00)
          Direct address: 00:00:00:00:00:00 (OUI 00-00-00)
          Data length: 0x0c
        0b 09 41 54 43 5f 32 36 34 45 44 41              ..ATC_264EDA    
        Name (complete): ATC_264EDA
@ MGMT Event: Device Found (0x0012) plen 43           {0x0001} [hci0] 15.309291
        LE Address: A4:C1:38:26:4E:DA (Telink Semiconductor (Taipei) Co. Ltd.)
        RSSI: -59 dBm (0xc5)
        Flags: 0x00000000
        Data length: 29
        Service Data: Environmental Sensing (0x181a)
          Data: a4c138264eda00d530250a03cf
        Name (complete): ATC_264EDA
> HCI Event: LE Meta Event (0x3e) plen 43                  #27 [hci0] 15.824283
      LE Extended Advertising Report (0x0d)
        Num reports: 1
        Entry 0
          Event type: 0x0013
            Props: 0x0013
              Connectable
              Scannable
              Use legacy advertising PDUs
            Data status: [0;32mComplete[0m
          Legacy PDU Type: ADV_IND (0x0013)
          Address type: Public (0x00)
          Address: A4:C1:38:9D:41:32 (Telink Semiconductor (Taipei) Co. Ltd.)
          Primary PHY: LE 1M
          Secondary PHY: No packets
          SID: no ADI field (0xff)
          TX power: 127 dBm
          RSSI: -95 dBm (0xa1)
          Periodic advertising interval: 0.00 msec (0x0000)
          Direct address type: Public (0x00)
          Direct address: 00:00:00:00:00:00 (OUI 00-00-00)
          Data length: 0x11
        10 16 1a 18 a4 c1 38 9d 41 32 00 dc 3a 53 0b 8d  ......8.A2..:S..
        b7                                               .               
        Service Data: Environmental Sensing (0x181a)
          Data: a4c1389d413200dc3a530b8db7
> HCI Event: LE Meta Event (0x3e) plen 57                  #28 [hci0] 16.857316
      LE Extended Advertising Report (0x0d)
        Num reports: 1
        Entry 0
          Event type: 0x0010
            Props: 0x0010
              Use legacy advertising PDUs
            Data status: [0;32mComplete[0m
          Legacy PDU Type: ADV_NONCONN_IND (0x0010)
          Address type: Random (0x01)
          Address: 41:7D:F8:94:74:11 (Resolvable)
          Primary PHY: LE 1M
          Secondary PHY: No packets
          SID: no ADI field (0xff)
          TX power: 127 dBm
          RSSI: -96 dBm (0xa0)
          Periodic advertising interval: 0.00 msec (0x0000)
          Direct address type: Public (0x00)
          Direct address: 00:00:00:00:00:00 (OUI 00-00-00)
          Data length: 0x1f
        1e ff 06 00 01 09 20 02 b9 3b 7b c1 18 e0 63 e4  ...... ..;{...c.
        d5 77 78 5c 29 59 9a d1 71 74 22 4a 1d 02 96     .wx\)Y..qt"J... 
        Company: Microsoft (6)
          Data: 01092002b93b7bc118e063e4d577785c29599ad17174224a1d0296
@ MGMT Event: Device Found (0x0012) plen 31           {0x0001} [hci0] 16.857501
        LE Address: A4:C1:38:9D:41:32 (Telink Semiconductor (Taipei) Co. Ltd.)
        RSSI: -95 dBm (0xa1)
        Flags: 0x00000000
        Data length: 17
        Service Data: Environmental Sensing (0x181a)
          Data: a4c1389d413200dc3a530b8db7
@ MGMT Event: Device Found (0x0012) plen 45           {0x0001} [hci0] 16.857507
        LE Address: 41:7D:F8:94:74:11 (Resolvable)
        RSSI: -96 dBm (0xa0)
        Flags: 0x00000004
          Not Connectable
        Data length: 31
        Company: Microsoft (6)
          Data: 01092002b93b7bc118e063e4d577785c29599ad17174224a1d0296
> HCI Event: LE Meta Event (0x3e) plen 57                  #29 [hci0] 19.033373
      LE Extended Advertising Report (0x0d)
        Num reports: 1
        Entry 0
          Event type: 0x0010
            Props: 0x0010
              Use legacy advertising PDUs
            Data status: [0;32mComplete[0m
          Legacy PDU Type: ADV_NONCONN_IND (0x0010)
          Address type: Random (0x01)
          Address: 41:7D:F8:94:74:11 (Resolvable)
          Primary PHY: LE 1M
          Secondary PHY: No packets
          SID: no ADI field (0xff)
          TX power: 127 dBm
          RSSI: -89 dBm (0xa7)
          Periodic advertising interval: 0.00 msec (0x0000)
          Direct address type: Public (0x00)
          Direct address: 00:00:00:00:00:00 (OUI 00-00-00)
          Data length: 0x1f
        1e ff 06 00 01 09 20 02 b9 3b 7b c1 18 e0 63 e4  ...... ..;{...c.
        d5 77 78 5c 29 59 9a d1 71 74 22 4a 1d 02 96     .wx\)Y..qt"J... 
        Company: Microsoft (6)
          Data: 01092002b93b7bc118e063e4d577785c29599ad17174224a1d0296
@ MGMT Event: Device Found (0x0012) plen 45           {0x0001} [hci0] 19.033399
        LE Address: 41:7D:F8:94:74:11 (Resolvable)
        RSSI: -89 dBm (0xa7)
        Flags: 0x00000004
          Not Connectable
        Data length: 31
        Company: Microsoft (6)
          Data: 01092002b93b7bc118e063e4d577785c29599ad17174224a1d0296
> HCI Event: LE Meta Event (0x3e) plen 43                  #30 [hci0] 19.406379
      LE Extended Advertising Report (0x0d)
        Num reports: 1
        Entry 0
          Event type: 0x0013
            Props: 0x0013
              Connectable
              Scannable
              Use legacy advertising PDUs
            Data status: [0;32mComplete[0m
          Legacy PDU Type: ADV_IND (0x0013)
          Address type: Random (0x01)
          Address: 75:C1:7B:0E:AC:14 (Resolvable)
          Primary PHY: LE 1M
          Secondary PHY: No packets
          SID: no ADI field (0xff)
          TX power: 127 dBm
          RSSI: -99 dBm (0x9d)
          Periodic advertising interval: 0.00 msec (0x0000)
          Direct address type: Public (0x00)
          Direct address: 00:00:00:00:00:00 (OUI 00-00-00)
          Data length: 0x11
        02 01 1a 02 0a 0c 0a ff 4c 00 10 05 3b 1c 8f e6  ........L...;...
        df                                               .               
        Flags: 0x1a
          LE General Discoverable Mode
          Simultaneous LE and BR/EDR (Controller)
          Simultaneous LE and BR/EDR (Host)
        TX power: 12 dBm
        Company: Apple, Inc. (76)
          Type: Unknown (16)
          Data: 3b1c8fe6df
> HCI Event: LE Meta Event (0x3e) plen 26                  #31 [hci0] 19.407345
      LE Extended Advertising Report (0x0d)
        Num reports: 1
        Entry 0
          Event type: 0x001b
            Props: 0x001b
              Connectable
              Scannable
              Scan response
              Use legacy advertising PDUs
            Data status: [0;32mComplete[0m
          Legacy PDU Type: SCAN_RSP to an ADV_SCAN_IND (0x001b)
          Address type: Random (0x01)
          Address: 75:C1:7B:0E:AC:14 (Resolvable)
          Primary PHY: LE 1M
          Secondary PHY: No packets
          SID: no ADI field (0xff)
          TX power: 127 dBm
          RSSI: -97 dBm (0x9f)
          Periodic advertising interval: 0.00 msec (0x0000)
          Direct address type: Public (0x00)
          Direct address: 00:00:00:00:00:00 (OUI 00-00-00)
          Data length: 0x00
@ MGMT Event: Device Found (0x0012) plen 31           {0x0001} [hci0] 19.407482
        LE Address: 75:C1:7B:0E:AC:14 (Resolvable)
        RSSI: -97 dBm (0x9f)
        Flags: 0x00000000
        Data length: 17
        Flags: 0x1a
          LE General Discoverable Mode
          Simultaneous LE and BR/EDR (Controller)
          Simultaneous LE and BR/EDR (Host)
        TX power: 12 dBm
        Company: Apple, Inc. (76)
          Type: Unknown (16)
          Data: 3b1c8fe6df
bluetoothctl[2998227]: @ MGMT Close: bluetoothctl            {0x0002} 19.449938
bluetoothd[2915165]: @ MGMT Comman.. (0x0024) plen 1  {0x0001} [hci0] 19.451707
        Address type: 0x07
          BR/EDR
          LE Public
          LE Random
< HCI Command: Inquiry Cancel (0x01|0x0002) plen 0         #32 [hci0] 19.451728
> HCI Event: Command Complete (0x0e) plen 4                #33 [hci0] 19.453274
      Inquiry Cancel (0x01|0x0002) ncmd 1
        Status: Success (0x00)
< HCI Command: LE Set Extended Sca.. (0x08|0x0042) plen 6  #34 [hci0] 19.453452
        Extended scan: Disabled (0x00)
        Filter duplicates: Disabled (0x00)
        Duration: 0 msec (0x0000)
        Period: 0.00 sec (0x0000)
bluetoothctl[2999076]: @ MGMT Open: bluetoot.. version 1.23  {0x0002} 19.455155
> HCI Event: Command Complete (0x0e) plen 4                #35 [hci0] 19.455258
      LE Set Extended Scan Enable (0x08|0x0042) ncmd 1
        Status: Success (0x00)
@ MGMT Event: Command Complete (0x0001) plen 4        {0x0001} [hci0] 19.455273
      Stop Discovery (0x0024) plen 1
        Status: Success (0x00)
        Address type: 0x07
          BR/EDR
          LE Public
          LE Random
@ MGMT Event: Discovering (0x0013) plen 2             {0x0001} [hci0] 19.455284
        Address type: 0x07
          BR/EDR
          LE Public
          LE Random
        Discovery: Disabled (0x00)
bluetoothd[2915165]: @ MGMT Comman.. (0x003a) plen 4  {0x0001} [hci0] 19.455577
        Address type: 0x01
          BR/EDR
        RSSI: invalid (0x7f)
        UUIDs: 0
< HCI Command: Inquiry (0x01|0x0001) plen 5                #36 [hci0] 19.455713
        Access code: 0x9e8b33 (General Inquiry)
        Length: 10.24s (0x08)
        Num responses: 0
> HCI Event: Command Status (0x0f) plen 4                  #37 [hci0] 19.456257
      Inquiry (0x01|0x0001) ncmd 1
        Status: Success (0x00)
@ MGMT Event: Command Complete (0x0001) plen 4        {0x0001} [hci0] 19.456472
      Start Service Discovery (0x003a) plen 1
        Status: Success (0x00)
        Address type: 0x01
          BR/EDR
@ MGMT Event: Discovering (0x0013) plen 2             {0x0001} [hci0] 19.456478
        Address type: 0x01
          BR/EDR
        Discovery: Enabled (0x01)
> HCI Event: Inquiry Complete (0x01) plen 1                #38 [hci0] 29.697630
        Status: Success (0x00)
@ MGMT Event: Discovering (0x0013) plen 2             {0x0001} [hci0] 29.697745
        Address type: 0x01
          BR/EDR
        Discovery: Disabled (0x00)
< HCI Command: LE Set Address Reso.. (0x08|0x002d) plen 1  #39 [hci0] 29.697903
        Address resolution: Enabled (0x01)
bluetoothd[2915165]: @ MGMT Comman.. (0x003a) plen 4  {0x0001} [hci0] 29.698036
        Address type: 0x01
          BR/EDR
        RSSI: invalid (0x7f)
        UUIDs: 0
> HCI Event: Command Complete (0x0e) plen 4                #40 [hci0] 29.698551
      LE Set Address Resolution Enable (0x08|0x002d) ncmd 1
        Status: Success (0x00)
< HCI Command: LE Set Extended Sc.. (0x08|0x0041) plen 13  #41 [hci0] 29.698863
        Own address type: Public (0x00)
        Filter policy: Ignore not in accept list (0x01)
        PHYs: 0x05
        Entry 0: LE 1M
          Type: Passive (0x00)
          Interval: 60.000 msec (0x0060)
          Window: 60.000 msec (0x0060)
        Entry 1: LE Coded
          Type: Passive (0x00)
          Interval: 180.000 msec (0x0120)
          Window: 180.000 msec (0x0120)
> HCI Event: Command Complete (0x0e) plen 4                #42 [hci0] 29.699546
      LE Set Extended Scan Parameters (0x08|0x0041) ncmd 1
        Status: Success (0x00)
< HCI Command: LE Set Extended Sca.. (0x08|0x0042) plen 6  #43 [hci0] 29.699899
        Extended scan: Enabled (0x01)
        Filter duplicates: Enabled (0x01)
        Duration: 0 msec (0x0000)
        Period: 0.00 sec (0x0000)
> HCI Event: Command Complete (0x0e) plen 4                #44 [hci0] 29.700547
      LE Set Extended Scan Enable (0x08|0x0042) ncmd 1
        Status: Success (0x00)
< HCI Command: Inquiry (0x01|0x0001) plen 5                #45 [hci0] 29.700865
        Access code: 0x9e8b33 (General Inquiry)
        Length: 10.24s (0x08)
        Num responses: 0
> HCI Event: Command Status (0x0f) plen 4                  #46 [hci0] 29.717636
      Inquiry (0x01|0x0001) ncmd 1
        Status: Success (0x00)
@ MGMT Event: Command Complete (0x0001) plen 4        {0x0001} [hci0] 29.717837
      Start Service Discovery (0x003a) plen 1
        Status: Success (0x00)
        Address type: 0x01
          BR/EDR
@ MGMT Event: Discovering (0x0013) plen 2             {0x0001} [hci0] 29.717843
        Address type: 0x01
          BR/EDR
        Discovery: Enabled (0x01)
> HCI Event: LE Meta Event (0x3e) plen 39                  #47 [hci0] 29.827666
      LE Extended Advertising Report (0x0d)
        Num reports: 1
        Entry 0
          Event type: 0x0013
            Props: 0x0013
              Connectable
              Scannable
              Use legacy advertising PDUs
            Data status: [0;32mComplete[0m
          Legacy PDU Type: ADV_IND (0x0013)
          Address type: Random (0x01)
          Address: C0:DE:54:15:00:51 (Static)
          Primary PHY: LE 1M
          Secondary PHY: No packets
          SID: no ADI field (0xff)
          TX power: 127 dBm
          RSSI: -81 dBm (0xaf)
          Periodic advertising interval: 0.00 msec (0x0000)
          Direct address type: Public (0x00)
          Direct address: 00:00:00:00:00:00 (OUI 00-00-00)
          Data length: 0x0d
        02 01 06 09 09 58 35 34 2d 50 41 49 52           .....X54-PAIR   
        Flags: 0x06
          LE General Discoverable Mode
          BR/EDR Not Supported
        Name (complete): X54-PAIR
< HCI Command: LE Set Extended Sca.. (0x08|0x0042) plen 6  #48 [hci0] 29.827879
        Extended scan: Disabled (0x00)
        Filter duplicates: Disabled (0x00)
        Duration: 0 msec (0x0000)
        Period: 0.00 sec (0x0000)
> HCI Event: Command Complete (0x0e) plen 4                #49 [hci0] 29.829646
      LE Set Extended Scan Enable (0x08|0x0042) ncmd 1
        Status: Success (0x00)
< HCI Command: LE Extended Create.. (0x08|0x0043) plen 26  #50 [hci0] 29.829971
        Filter policy: Accept list is not used (0x00)
        Own address type: Public (0x00)
        Peer address type: Random (0x01)
        Peer address: C0:DE:54:15:00:51 (Static)
        Initiating PHYs: 0x01
        Entry 0: LE 1M
          Scan interval: 60.000 msec (0x0060)
          Scan window: 60.000 msec (0x0060)
          Min connection interval: 30.00 msec (0x0018)
          Max connection interval: 50.00 msec (0x0028)
          Connection latency: 0 (0x0000)
          Supervision timeout: 420 msec (0x002a)
          Min connection length: 0.000 msec (0x0000)
          Max connection length: 0.000 msec (0x0000)
> HCI Event: Command Status (0x0f) plen 4                  #51 [hci0] 29.832648
      LE Extended Create Connection (0x08|0x0043) ncmd 1
        Status: Success (0x00)
> HCI Event: LE Meta Event (0x3e) plen 31                  #52 [hci0] 31.170688
      LE Enhanced Connection Complete (0x0a)
        Status: Success (0x00)
        Handle: 2048
        Role: Central (0x00)
        Peer address type: Random (0x01)
        Peer address: C0:DE:54:15:00:51 (Static)
        Local resolvable private address: 00:00:00:00:00:00 (Non-Resolvable)
        Peer resolvable private address: 00:00:00:00:00:00 (Non-Resolvable)
        Connection interval: 45.00 msec (0x0024)
        Connection latency: 0 (0x0000)
        Supervision timeout: 420 msec (0x002a)
        Central clock accuracy: 0x00
@ MGMT Event: Device Connected (0x000b) plen 26       {0x0001} [hci0] 31.170851
        LE Address: C0:DE:54:15:00:51 (Static)
        Flags: 0x00000008
          Connection Locally Initiated
        Data length: 13
        Flags: 0x06
          LE General Discoverable Mode
          BR/EDR Not Supported
        Name (complete): X54-PAIR
btmon[2997443]: @ RAW Open: btmon (privileged) version 2.22  {0x0003} 31.170992
btmon[2997443]: @ RAW Close: btmon                           {0x0003} 31.170996
> HCI Event: LE Meta Event (0x3e) plen 4                   #53 [hci0] 31.171590
      LE Channel Selection Algorithm (0x14)
        Handle: 2048 Address: C0:DE:54:15:00:51 (Static)
        Algorithm: #2 (0x01)
< HCI Command: LE Read Remote Used.. (0x08|0x0016) plen 2  #54 [hci0] 31.180840
        Handle: 2048 Address: C0:DE:54:15:00:51 (Static)
> HCI Event: Command Status (0x0f) plen 4                  #55 [hci0] 31.181718
      LE Read Remote Used Features (0x08|0x0016) ncmd 1
        Status: Success (0x00)
> HCI Event: LE Meta Event (0x3e) plen 12                  #56 [hci0] 31.218691
      LE Read Remote Used Features (0x04)
        Status: Success (0x00)
        Handle: 2048 Address: C0:DE:54:15:00:51 (Static)
        Features: 0x1f 0x00 0x00 0x00 0x00 0x00 0x00 0x00
          LE Encryption
          Connection Parameter Request Procedure
          Extended Reject Indication
          Peripheral-initiated Features Exchange
          LE Ping
bluetoothd[2915165]: < ACL Data TX: H.. flags 0x00 dlen 7  #57 [hci0] 31.219295
      ATT: Exchange MTU Request (0x02) len 2
        Client RX MTU: 517
> HCI Event: Number of Completed Packets (0x13) plen 5     #58 [hci0] 31.353687
        Num handles: 1
        Handle: 2048 Address: C0:DE:54:15:00:51 (Static)
        Count: 1
        #57: len 7 (0 Kb/s)
        Latency: 134 msec (134-134 msec ~134 msec)
> ACL Data RX: Handle 2048 flags 0x02 dlen 7               #59 [hci0] 31.399901
      ATT: Exchange MTU Response (0x03) len 2
        Server RX MTU: 23
bluetoothd[2915165]: < ACL Data TX:... flags 0x00 dlen 11  #60 [hci0] 31.400377
      ATT: Read By Type Request (0x08) len 6
        Handle range: 0x0001-0xffff
        Attribute type: Server Supported Features (0x2b3a)
> HCI Event: Number of Completed Packets (0x13) plen 5     #61 [hci0] 31.443791
        Num handles: 1
        Handle: 2048 Address: C0:DE:54:15:00:51 (Static)
        Count: 1
        #60: len 11 (2 Kb/s)
        Latency: 43 msec (43-134 msec ~88 msec)
> ACL Data RX: Handle 2048 flags 0x02 dlen 9               #62 [hci0] 31.489750
      ATT: Error Response (0x01) len 4
        Read By Type Request (0x08)
        Handle: 0x0001
        Error: Attribute Not Found (0x0a)
bluetoothd[2915165]: < ACL Data TX:... flags 0x00 dlen 11  #63 [hci0] 31.490235
      ATT: Read By Group Type Request (0x10) len 6
        Handle range: 0x0001-0xffff
        Attribute group type: Primary Service (0x2800)
> HCI Event: Number of Completed Packets (0x13) plen 5     #64 [hci0] 31.533681
        Num handles: 1
        Handle: 2048 Address: C0:DE:54:15:00:51 (Static)
        Count: 1
        #63: len 11 (2 Kb/s)
        Latency: 43 msec (43-134 msec ~66 msec)
> ACL Data RX: Handle 2048 flags 0x02 dlen 24              #65 [hci0] 31.579733
      ATT: Read By Group Type Response (0x11) len 19
        Attribute data length: 6
        Attribute group list: 3 entries
        Handle range: 0x0001-0x0007
        UUID: Generic Access Profile (0x1800)
        Handle range: 0x0008-0x000b
        UUID: Generic Attribute Profile (0x1801)
        Handle range: 0x0010-0x0013
        UUID: Battery Service (0x180f)
bluetoothd[2915165]: < ACL Data TX:... flags 0x00 dlen 11  #66 [hci0] 31.580129
      ATT: Read By Group Type Request (0x10) len 6
        Handle range: 0x0014-0xffff
        Attribute group type: Primary Service (0x2800)
> HCI Event: Number of Completed Packets (0x13) plen 5     #67 [hci0] 31.623611
        Num handles: 1
        Handle: 2048 Address: C0:DE:54:15:00:51 (Static)
        Count: 1
        #66: len 11 (2 Kb/s)
        Latency: 43 msec (43-134 msec ~54 msec)
> ACL Data RX: Handle 2048 flags 0x02 dlen 9               #68 [hci0] 31.669816
      ATT: Error Response (0x01) len 4
        Read By Group Type Request (0x10)
        Handle: 0x0014
        Error: Attribute Not Found (0x0a)
bluetoothd[2915165]: < ACL Data TX:... flags 0x00 dlen 11  #69 [hci0] 31.670164
      ATT: Read By Group Type Request (0x10) len 6
        Handle range: 0x0001-0xffff
        Attribute group type: Secondary Service (0x2801)
> HCI Event: Number of Completed Packets (0x13) plen 5     #70 [hci0] 31.713720
        Num handles: 1
        Handle: 2048 Address: C0:DE:54:15:00:51 (Static)
        Count: 1
        #69: len 11 (2 Kb/s)
        Latency: 43 msec (43-134 msec ~49 msec)
> ACL Data RX: Handle 2048 flags 0x02 dlen 9               #71 [hci0] 31.759789
      ATT: Error Response (0x01) len 4
        Read By Group Type Request (0x10)
        Handle: 0x0001
        Error: Unsupported Group Type (0x10)
bluetoothd[2915165]: < ACL Data TX:... flags 0x00 dlen 11  #72 [hci0] 31.760206
      ATT: Read By Type Request (0x08) len 6
        Handle range: 0x0001-0x0013
        Attribute type: Include (0x2802)
> HCI Event: Number of Completed Packets (0x13) plen 5     #73 [hci0] 31.803699
        Num handles: 1
        Handle: 2048 Address: C0:DE:54:15:00:51 (Static)
        Count: 1
        #72: len 11 (2 Kb/s)
        Latency: 43 msec (43-134 msec ~46 msec)
> ACL Data RX: Handle 2048 flags 0x02 dlen 9               #74 [hci0] 31.849861
      ATT: Error Response (0x01) len 4
        Read By Type Request (0x08)
        Handle: 0x0001
        Error: Attribute Not Found (0x0a)
bluetoothd[2915165]: < ACL Data TX:... flags 0x00 dlen 11  #75 [hci0] 31.850274
      ATT: Read By Type Request (0x08) len 6
        Handle range: 0x0001-0x0013
        Attribute type: Characteristic (0x2803)
> HCI Event: Number of Completed Packets (0x13) plen 5     #76 [hci0] 31.893736
        Num handles: 1
        Handle: 2048 Address: C0:DE:54:15:00:51 (Static)
        Count: 1
        #75: len 11 (2 Kb/s)
        Latency: 43 msec (43-134 msec ~44 msec)
> ACL Data RX: Handle 2048 flags 0x02 dlen 27              #77 [hci0] 31.940726
      ATT: Read By Type Response (0x09) len 22
        Attribute data length: 7
        Attribute data list: 3 entries
        Handle: 0x0002
        Value: 020300002a
            Properties: 0x02
              Read (0x02)
            Value Handle: 0x0003
            Value UUID: Device Name (0x2a00)
        Handle: 0x0004
        Value: 020500012a
            Properties: 0x02
              Read (0x02)
            Value Handle: 0x0005
            Value UUID: Appearance (0x2a01)
        Handle: 0x0006
        Value: 020700042a
            Properties: 0x02
              Read (0x02)
            Value Handle: 0x0007
            Value UUID: Peripheral Preferred Connection Parameters (0x2a04)
bluetoothd[2915165]: < ACL Data TX:... flags 0x00 dlen 11  #78 [hci0] 31.941121
      ATT: Read By Type Request (0x08) len 6
        Handle range: 0x0007-0x0013
        Attribute type: Characteristic (0x2803)
> HCI Event: Number of Completed Packets (0x13) plen 5     #79 [hci0] 31.983745
        Num handles: 1
        Handle: 2048 Address: C0:DE:54:15:00:51 (Static)
        Count: 1
        #78: len 11 (2 Kb/s)
        Latency: 42 msec (42-134 msec ~43 msec)
> ACL Data RX: Handle 2048 flags 0x02 dlen 20              #80 [hci0] 32.029908
      ATT: Read By Type Response (0x09) len 15
        Attribute data length: 7
        Attribute data list: 2 entries
        Handle: 0x0009
        Value: 200a00052a
            Properties: 0x20
              Indicate (0x20)
            Value Handle: 0x000a
            Value UUID: Service Changed (0x2a05)
        Handle: 0x0011
        Value: 121200192a
            Properties: 0x12
              Read (0x02)
              Notify (0x10)
            Value Handle: 0x0012
            Value UUID: Battery Level (0x2a19)
bluetoothd[2915165]: < ACL Data TX:... flags 0x00 dlen 11  #81 [hci0] 32.030309
      ATT: Read By Type Request (0x08) len 6
        Handle range: 0x0012-0x0013
        Attribute type: Characteristic (0x2803)
> HCI Event: Number of Completed Packets (0x13) plen 5     #82 [hci0] 32.073752
        Num handles: 1
        Handle: 2048 Address: C0:DE:54:15:00:51 (Static)
        Count: 1
        #81: len 11 (2 Kb/s)
        Latency: 43 msec (42-134 msec ~43 msec)
> ACL Data RX: Handle 2048 flags 0x02 dlen 9               #83 [hci0] 32.119807
      ATT: Error Response (0x01) len 4
        Read By Type Request (0x08)
        Handle: 0x0012
        Error: Attribute Not Found (0x0a)
bluetoothd[2915165]: < ACL Data TX: H.. flags 0x00 dlen 9  #84 [hci0] 32.127958
      ATT: Write Request (0x12) len 4
        Handle: 0x000b Type: Client Characteristic Configuration (0x2902)
        Value Handle: 0x000a Type: Service Changed (0x2a05)
          Data: 0200
            Indication (0x02)
> HCI Event: Number of Completed Packets (0x13) plen 5     #85 [hci0] 32.163696
        Num handles: 1
        Handle: 2048 Address: C0:DE:54:15:00:51 (Static)
        Count: 1
        #84: len 9 (2 Kb/s)
        Latency: 35 msec (35-134 msec ~39 msec)
> ACL Data RX: Handle 2048 flags 0x02 dlen 5               #86 [hci0] 32.209811
      ATT: Write Response (0x13) len 0
bluetoothd[2915165]: < ACL Data TX: H.. flags 0x00 dlen 7  #87 [hci0] 32.210243
      ATT: Read Request (0x0a) len 2
        Handle: 0x0003 Type: Device Name (0x2a00)
> HCI Event: Number of Completed Packets (0x13) plen 5     #88 [hci0] 32.253722
        Num handles: 1
        Handle: 2048 Address: C0:DE:54:15:00:51 (Static)
        Count: 1
        #87: len 7 (1 Kb/s)
        Latency: 43 msec (35-134 msec ~41 msec)
> ACL Data RX: Handle 2048 flags 0x02 dlen 11              #89 [hci0] 32.255730
      ATT: Handle Value Indication (0x1d) len 6
        Handle: 0x000a Type: Service Changed (0x2a05)
          Data: 0100ffff
bluetoothd[2915165]: < ACL Data TX: H.. flags 0x00 dlen 5  #90 [hci0] 32.256115
      ATT: Handle Value Confirmation (0x1e) len 0
> HCI Event: Number of Completed Packets (0x13) plen 5     #91 [hci0] 32.298621
        Num handles: 1
        Handle: 2048 Address: C0:DE:54:15:00:51 (Static)
        Count: 1
        #90: len 5 (0 Kb/s)
        Latency: 42 msec (35-134 msec ~42 msec)
> ACL Data RX: Handle 2048 flags 0x02 dlen 22              #92 [hci0] 32.299794
      ATT: Read Response (0x0b) len 17
bluetoothd[2915165]: < ACL Data TX: H.. flags 0x00 dlen 7  #93 [hci0] 32.300158
      ATT: Read Request (0x0a) len 2
        Handle: 0x0005 Type: Appearance (0x2a01)
> HCI Event: Number of Completed Packets (0x13) plen 5     #94 [hci0] 32.343713
        Num handles: 1
        Handle: 2048 Address: C0:DE:54:15:00:51 (Static)
        Count: 1
        #93: len 7 (1 Kb/s)
        Latency: 43 msec (35-134 msec ~42 msec)
> ACL Data RX: Handle 2048 flags 0x02 dlen 7               #95 [hci0] 32.389798
      ATT: Read Response (0x0b) len 2
bluetoothd[2915165]: < ACL Data TX: H.. flags 0x00 dlen 7  #96 [hci0] 32.390204
      ATT: Read Request (0x0a) len 2
        Handle: 0x0012 Type: Battery Level (0x2a19)
> HCI Event: Number of Completed Packets (0x13) plen 5     #97 [hci0] 32.433715
        Num handles: 1
        Handle: 2048 Address: C0:DE:54:15:00:51 (Static)
        Count: 1
        #96: len 7 (1 Kb/s)
        Latency: 43 msec (35-134 msec ~43 msec)
> ACL Data RX: Handle 2048 flags 0x02 dlen 6               #98 [hci0] 32.479787
      ATT: Read Response (0x0b) len 1
bluetoothd[2915165]: < ACL Data TX:... flags 0x00 dlen 11  #99 [hci0] 32.480219
      ATT: Read By Group Type Request (0x10) len 6
        Handle range: 0x0001-0xffff
        Attribute group type: Primary Service (0x2800)
> HCI Event: Number of Completed Packets (0x13) plen 5    #100 [hci0] 32.523731
        Num handles: 1
        Handle: 2048 Address: C0:DE:54:15:00:51 (Static)
        Count: 1
        #99: len 11 (2 Kb/s)
        Latency: 43 msec (35-134 msec ~43 msec)
> ACL Data RX: Handle 2048 flags 0x02 dlen 24             #101 [hci0] 32.570732
      ATT: Read By Group Type Response (0x11) len 19
        Attribute data length: 6
        Attribute group list: 3 entries
        Handle range: 0x0001-0x0007
        UUID: Generic Access Profile (0x1800)
        Handle range: 0x0008-0x000b
        UUID: Generic Attribute Profile (0x1801)
        Handle range: 0x0010-0x0013
        UUID: Battery Service (0x180f)
bluetoothd[2915165]: < ACL Data TX:... flags 0x00 dlen 9  #102 [hci0] 32.571126
      ATT: Write Request (0x12) len 4
        Handle: 0x0013 Type: Client Characteristic Configuration (0x2902)
        Value Handle: 0x0012 Type: Battery Level (0x2a19)
          Data: 0100
            Notification (0x01)
> HCI Event: Number of Completed Packets (0x13) plen 5    #103 [hci0] 32.613705
        Num handles: 1
        Handle: 2048 Address: C0:DE:54:15:00:51 (Static)
        Count: 1
        #102: len 9 (1 Kb/s)
        Latency: 42 msec (35-134 msec ~42 msec)
> ACL Data RX: Handle 2048 flags 0x02 dlen 5              #104 [hci0] 32.659821
      ATT: Write Response (0x13) len 0
bluetoothd[2915165]: < ACL Data TX:.. flags 0x00 dlen 11  #105 [hci0] 32.660252
      ATT: Read By Group Type Request (0x10) len 6
        Handle range: 0x0014-0xffff
        Attribute group type: Primary Service (0x2800)
> HCI Event: Number of Completed Packets (0x13) plen 5    #106 [hci0] 32.703729
        Num handles: 1
        Handle: 2048 Address: C0:DE:54:15:00:51 (Static)
        Count: 1
        #105: len 11 (2 Kb/s)
        Latency: 43 msec (35-134 msec ~43 msec)
> ACL Data RX: Handle 2048 flags 0x02 dlen 8              #107 [hci0] 32.704728
      ATT: Handle Value Notification (0x1b) len 3
        Handle: 0x0012 Type: Battery Level (0x2a19)
          Data: 60
> ACL Data RX: Handle 2048 flags 0x02 dlen 9              #108 [hci0] 32.749800
      ATT: Error Response (0x01) len 4
        Read By Group Type Request (0x10)
        Handle: 0x0014
        Error: Attribute Not Found (0x0a)
bluetoothctl[2999076]: @ MGMT Close: bluetoothctl            {0x0002} 39.459344
bluetoothctl[3000871]: @ MGMT Open: bluetoot.. version 1.23  {0x0002} 39.468623
bluetoothd[2915165]: @ MGMT Comman.. (0x0024) plen 1  {0x0001} [hci0] 39.473741
        Address type: 0x01
          BR/EDR
< HCI Command: Inquiry Cancel (0x01|0x0002) plen 0        #109 [hci0] 39.473911
> HCI Event: Command Complete (0x0e) plen 4               #110 [hci0] 39.475836
      Inquiry Cancel (0x01|0x0002) ncmd 1
        Status: Success (0x00)
@ MGMT Event: Discovering (0x0013) plen 2             {0x0001} [hci0] 39.475991
        Address type: 0x01
          BR/EDR
        Discovery: Disabled (0x00)
@ MGMT Event: Command Complete (0x0001) plen 4        {0x0001} [hci0] 39.476003
      Stop Discovery (0x0024) plen 1
        Status: Success (0x00)
        Address type: 0x01
          BR/EDR
bluetoothd[2915165]: @ MGMT Comman.. (0x0019) plen 8  {0x0001} [hci0] 39.476184
        LE Address: C0:DE:54:15:00:51 (Static)
        Capability: DisplayYesNo (0x01)
< ACL Data TX: Handle 2048 flags 0x00 dlen 11             #111 [hci0] 39.476214
      SMP: Pairing Request (0x01) len 6
        IO capability: DisplayYesNo (0x01)
        OOB data: Authentication data not present (0x00)
        Authentication requirement: Bonding, MITM, SC, No Keypresses, CT2 (0x2d)
        Max encryption key size: 16
        Initiator key distribution: EncKey Sign LinkKey (0x0d)
        Responder key distribution: EncKey IdKey Sign LinkKey (0x0f)
> HCI Event: Number of Completed Packets (0x13) plen 5    #112 [hci0] 39.498969
        Num handles: 1
        Handle: 2048 Address: C0:DE:54:15:00:51 (Static)
        Count: 1
        #111: len 11 (4 Kb/s)
        Latency: 22 msec (22-134 msec ~32 msec)
> ACL Data RX: Handle 2048 flags 0x02 dlen 11             #113 [hci0] 39.544809
      SMP: Pairing Response (0x02) len 6
        IO capability: NoInputNoOutput (0x03)
        OOB data: Authentication data not present (0x00)
        Authentication requirement: Bonding, No MITM, Legacy, No Keypresses (0x01)
        Max encryption key size: 16
        Initiator key distribution: EncKey (0x01)
        Responder key distribution: <none> (0x00)
@ MGMT Event: User Confirmation R.. (0x000f) plen 12  {0x0001} [hci0] 39.544824
        LE Address: C0:DE:54:15:00:51 (Static)
        Confirm hint: 0x01
        Value: 0x00000000
bluetoothd[2915165]: @ MGMT Comman.. (0x001c) plen 7  {0x0001} [hci0] 39.544985
        LE Address: C0:DE:54:15:00:51 (Static)
@ MGMT Event: Command Complete (0x0001) plen 10       {0x0001} [hci0] 39.544999
      User Confirmation Reply (0x001c) plen 7
        Status: Success (0x00)
        LE Address: C0:DE:54:15:00:51 (Static)
< ACL Data TX: Handle 2048 flags 0x00 dlen 21             #114 [hci0] 39.545000
      SMP: Pairing Confirm (0x03) len 16
        Confim value: a860b1495edb80416f827760229001f6
> HCI Event: Number of Completed Packets (0x13) plen 5    #115 [hci0] 39.588954
        Num handles: 1
        Handle: 2048 Address: C0:DE:54:15:00:51 (Static)
        Count: 1
        #114: len 21 (3 Kb/s)
        Latency: 43 msec (22-134 msec ~38 msec)
> ACL Data RX: Handle 2048 flags 0x02 dlen 21             #116 [hci0] 39.634843
      SMP: Pairing Confirm (0x03) len 16
        Confim value: f809483deae7aa9b38794170e8b04da8
< ACL Data TX: Handle 2048 flags 0x00 dlen 21             #117 [hci0] 39.634874
      SMP: Pairing Random (0x04) len 16
        Random value: 02a465c126f200690add12c9af98e0e7
> HCI Event: Number of Completed Packets (0x13) plen 5    #118 [hci0] 39.678915
        Num handles: 1
        Handle: 2048 Address: C0:DE:54:15:00:51 (Static)
        Count: 1
        #117: len 21 (3 Kb/s)
        Latency: 44 msec (22-134 msec ~41 msec)
> ACL Data RX: Handle 2048 flags 0x02 dlen 21             #119 [hci0] 39.725733
      SMP: Pairing Random (0x04) len 16
        Random value: fe7ab8eceb1bc746aac7a1b2bb1ca4b8
< HCI Command: LE Start Encryption (0x08|0x0019) plen 28  #120 [hci0] 39.725754
        Handle: 2048 Address: C0:DE:54:15:00:51 (Static)
        Random number: 0x0000000000000000
        Encrypted diversifier: 0x0000
        Long term key: 8c3038b89143e4f4075a79f63079a4b6
> HCI Event: Command Status (0x0f) plen 4                 #121 [hci0] 39.726834
      LE Start Encryption (0x08|0x0019) ncmd 1
        Status: Success (0x00)
< HCI Command: Disconnect (0x01|0x0006) plen 3            #122 [hci0] 69.972870
        Handle: 2048 Address: C0:DE:54:15:00:51 (Static)
        Reason: Authentication Failure (0x05)
> HCI Event: Command Status (0x0f) plen 4                 #123 [hci0] 69.973772
      Disconnect (0x01|0x0006) ncmd 1
        Status: Success (0x00)
> HCI Event: Encryption Change (0x08) plen 4              #124 [hci0] 70.053853
        Status: Connection Terminated By Local Host (0x16)
        Handle: 2048 Address: C0:DE:54:15:00:51 (Static)
        Encryption: Disabled (0x00)
@ MGMT Event: Command Complete (0x0001) plen 10       {0x0001} [hci0] 70.053901
      Pair Device (0x0019) plen 7
        Status: Disconnected (0x0e)
        LE Address: C0:DE:54:15:00:51 (Static)
> HCI Event: Disconnect Complete (0x05) plen 4            #125 [hci0] 70.054698
        Status: Success (0x00)
        Handle: 2048 Address: C0:DE:54:15:00:51 (Static)
        Reason: Connection Terminated By Local Host (0x16)
@ MGMT Event: Device Disconnected (0x000c) plen 8     {0x0001} [hci0] 70.054826
        LE Address: C0:DE:54:15:00:51 (Static)
        Reason: Connection terminated by local host (0x02)
bluetoothd[2915165]: @ MGMT Comman.. (0x003a) plen 4  {0x0001} [hci0] 75.726576
        Address type: 0x01
          BR/EDR
        RSSI: invalid (0x7f)
        UUIDs: 0
< HCI Command: Inquiry (0x01|0x0001) plen 5               #126 [hci0] 75.726860
        Access code: 0x9e8b33 (General Inquiry)
        Length: 10.24s (0x08)
        Num responses: 0
> HCI Event: Command Status (0x0f) plen 4                 #127 [hci0] 75.822861
      Inquiry (0x01|0x0001) ncmd 1
        Status: Success (0x00)
@ MGMT Event: Command Complete (0x0001) plen 4        {0x0001} [hci0] 75.822968
      Start Service Discovery (0x003a) plen 1
        Status: Success (0x00)
        Address type: 0x01
          BR/EDR
@ MGMT Event: Discovering (0x0013) plen 2             {0x0001} [hci0] 75.822975
        Address type: 0x01
          BR/EDR
        Discovery: Enabled (0x01)
> HCI Event: Inquiry Complete (0x01) plen 1               #128 [hci0] 86.127165
        Status: Success (0x00)
@ MGMT Event: Discovering (0x0013) plen 2             {0x0001} [hci0] 86.127264
        Address type: 0x01
          BR/EDR
        Discovery: Disabled (0x00)
bluetoothd[2915165]: @ MGMT Comman.. (0x003a) plen 4  {0x0001} [hci0] 86.127392
        Address type: 0x01
          BR/EDR
        RSSI: invalid (0x7f)
        UUIDs: 0
< HCI Command: Inquiry (0x01|0x0001) plen 5               #129 [hci0] 86.127476
        Access code: 0x9e8b33 (General Inquiry)
        Length: 10.24s (0x08)
        Num responses: 0
> HCI Event: Command Status (0x0f) plen 4                 #130 [hci0] 86.128151
      Inquiry (0x01|0x0001) ncmd 1
        Status: Success (0x00)
@ MGMT Event: Command Complete (0x0001) plen 4        {0x0001} [hci0] 86.128301
      Start Service Discovery (0x003a) plen 1
        Status: Success (0x00)
        Address type: 0x01
          BR/EDR
@ MGMT Event: Discovering (0x0013) plen 2             {0x0001} [hci0] 86.128308
        Address type: 0x01
          BR/EDR
        Discovery: Enabled (0x01)
> HCI Event: Inquiry Complete (0x01) plen 1               #131 [hci0] 96.432530
        Status: Success (0x00)
@ MGMT Event: Discovering (0x0013) plen 2             {0x0001} [hci0] 96.432556
        Address type: 0x01
          BR/EDR
        Discovery: Disabled (0x00)
bluetoothd[2915165]: @ MGMT Comman.. (0x003a) plen 4  {0x0001} [hci0] 96.432661
        Address type: 0x01
          BR/EDR
        RSSI: invalid (0x7f)
        UUIDs: 0
< HCI Command: Inquiry (0x01|0x0001) plen 5               #132 [hci0] 96.432691
        Access code: 0x9e8b33 (General Inquiry)
        Length: 10.24s (0x08)
        Num responses: 0
> HCI Event: Command Status (0x0f) plen 4                 #133 [hci0] 96.433448
      Inquiry (0x01|0x0001) ncmd 1
        Status: Success (0x00)
@ MGMT Event: Command Complete (0x0001) plen 4        {0x0001} [hci0] 96.433572
      Start Service Discovery (0x003a) plen 1
        Status: Success (0x00)
        Address type: 0x01
          BR/EDR
@ MGMT Event: Discovering (0x0013) plen 2             {0x0001} [hci0] 96.433581
        Address type: 0x01
          BR/EDR
        Discovery: Enabled (0x01)
bluetoothctl[3000871]: @ MGMT Close: bluetoothctl           {0x0002} 103.475962
bluetoothctl[3006584]: @ MGMT Open: bluetoo.. version 1.23  {0x0002} 103.483092
> HCI Event: Inquiry Complete (0x01) plen 1              #134 [hci0] 106.737825
        Status: Success (0x00)
@ MGMT Event: Discovering (0x0013) plen 2            {0x0001} [hci0] 106.737915
        Address type: 0x01
          BR/EDR
        Discovery: Disabled (0x00)
bluetoothd[2915165]: @ MGMT Comma.. (0x003a) plen 4  {0x0001} [hci0] 106.737997
        Address type: 0x01
          BR/EDR
        RSSI: invalid (0x7f)
        UUIDs: 0
< HCI Command: Inquiry (0x01|0x0001) plen 5              #135 [hci0] 106.738111
        Access code: 0x9e8b33 (General Inquiry)
        Length: 10.24s (0x08)
        Num responses: 0
> HCI Event: Command Status (0x0f) plen 4                #136 [hci0] 106.738730
      Inquiry (0x01|0x0001) ncmd 1
        Status: Success (0x00)
@ MGMT Event: Command Complete (0x0001) plen 4       {0x0001} [hci0] 106.738951
      Start Service Discovery (0x003a) plen 1
        Status: Success (0x00)
        Address type: 0x01
          BR/EDR
@ MGMT Event: Discovering (0x0013) plen 2            {0x0001} [hci0] 106.738963
        Address type: 0x01
          BR/EDR
        Discovery: Enabled (0x01)
bluetoothctl[3006584]: @ MGMT Close: bluetoothctl           {0x0002} 111.493915
bluetoothctl[3007262]: @ MGMT Open: bluetoo.. version 1.23  {0x0002} 111.506763
> HCI Event: Inquiry Complete (0x01) plen 1              #137 [hci0] 117.043050
        Status: Success (0x00)
@ MGMT Event: Discovering (0x0013) plen 2            {0x0001} [hci0] 117.043081
        Address type: 0x01
          BR/EDR
        Discovery: Disabled (0x00)
bluetoothd[2915165]: @ MGMT Comma.. (0x003a) plen 4  {0x0001} [hci0] 117.043336
        Address type: 0x01
          BR/EDR
        RSSI: invalid (0x7f)
        UUIDs: 0
< HCI Command: Inquiry (0x01|0x0001) plen 5              #138 [hci0] 117.043446
        Access code: 0x9e8b33 (General Inquiry)
        Length: 10.24s (0x08)
        Num responses: 0
> HCI Event: Command Status (0x0f) plen 4                #139 [hci0] 117.044027
      Inquiry (0x01|0x0001) ncmd 1
        Status: Success (0x00)
@ MGMT Event: Command Complete (0x0001) plen 4       {0x0001} [hci0] 117.044158
      Start Service Discovery (0x003a) plen 1
        Status: Success (0x00)
        Address type: 0x01
          BR/EDR
@ MGMT Event: Discovering (0x0013) plen 2            {0x0001} [hci0] 117.044165
        Address type: 0x01
          BR/EDR
        Discovery: Enabled (0x01)
bluetoothctl[3007262]: @ MGMT Close: bluetoothctl           {0x0002} 119.519244
