Bluetooth monitor ver 5.72
btmon[1371738]: = Note: Linux version 6.17.0-14-generic (x86_64)       0.351762
btmon[1371738]: = Note: Bluetooth subsystem version 2.22               0.351764
= New Index: 68:34:21:E5:84:DF (Primary,USB,hci0)               [hci0] 0.351765
= Open Index: 68:34:21:E5:84:DF                                 [hci0] 0.351765
= Index Info: 68:34:21:E5:84:DF (Intel Corp.)                   [hci0] 0.351765
btmgmt[609008]: @ MGMT Open: btmgmt version 1.23              {0x0002} 0.351766
bluetoothd[2915165]: @ MGMT Open.. (privileged) version 1.23  {0x0001} 0.351767
bluetoothctl[1371840]: @ MGMT Open: bluetooth.. version 1.23  {0x0003} 1.354139
> HCI Event: Inquiry Complete (0x01) plen 1                  #1 [hci0] 3.306753
        Status: Success (0x00)
@ MGMT Event: Discovering (0x0013) plen 2              {0x0001} [hci0] 3.306778
        Address type: 0x01
          BR/EDR
        Discovery: Disabled (0x00)
bluetoothd[2915165]: @ MGMT Command.. (0x003a) plen 4  {0x0001} [hci0] 3.306867
        Address type: 0x01
          BR/EDR
        RSSI: invalid (0x7f)
        UUIDs: 0
< HCI Command: Inquiry (0x01|0x0001) plen 5                  #2 [hci0] 3.306878
        Access code: 0x9e8b33 (General Inquiry)
        Length: 10.24s (0x08)
        Num responses: 0
> HCI Event: Command Status (0x0f) plen 4                    #3 [hci0] 3.307750
      Inquiry (0x01|0x0001) ncmd 1
        Status: Success (0x00)
@ MGMT Event: Command Complete (0x0001) plen 4         {0x0001} [hci0] 3.307908
      Start Service Discovery (0x003a) plen 1
        Status: Success (0x00)
        Address type: 0x01
          BR/EDR
@ MGMT Event: Discovering (0x0013) plen 2              {0x0001} [hci0] 3.307910
        Address type: 0x01
          BR/EDR
        Discovery: Enabled (0x01)
bluetoothctl[1371840]: @ MGMT Close: bluetoothctl             {0x0003} 9.368214
bluetoothctl[1372590]: @ MGMT Open: bluetooth.. version 1.23  {0x0003} 9.379855
bluetoothd[2915165]: @ MGMT Command.. (0x0024) plen 1  {0x0001} [hci0] 9.393625
        Address type: 0x01
          BR/EDR
< HCI Command: Inquiry Cancel (0x01|0x0002) plen 0           #4 [hci0] 9.393735
> HCI Event: Command Complete (0x0e) plen 4                  #5 [hci0] 9.488939
      Inquiry Cancel (0x01|0x0002) ncmd 1
        Status: Success (0x00)
@ MGMT Event: Discovering (0x0013) plen 2              {0x0001} [hci0] 9.489067
        Address type: 0x01
          BR/EDR
        Discovery: Disabled (0x00)
@ MGMT Event: Command Complete (0x0001) plen 4         {0x0001} [hci0] 9.489179
      Stop Discovery (0x0024) plen 1
        Status: Success (0x00)
        Address type: 0x01
          BR/EDR
bluetoothd[2915165]: @ MGMT Command.. (0x003a) plen 4  {0x0001} [hci0] 9.489274
        Address type: 0x07
          BR/EDR
          LE Public
          LE Random
        RSSI: invalid (0x7f)
        UUIDs: 0
< HCI Command: LE Set Address Resolu.. (0x08|0x002d) plen 1  #6 [hci0] 9.489504
        Address resolution: Disabled (0x00)
> HCI Event: Command Complete (0x0e) plen 4                  #7 [hci0] 9.489876
      LE Set Address Resolution Enable (0x08|0x002d) ncmd 1
        Status: Success (0x00)
< HCI Command: LE Set Random Address (0x08|0x0005) plen 6    #8 [hci0] 9.490171
        Address: 05:AE:55:C3:FA:FE (Non-Resolvable)
> HCI Event: Command Complete (0x0e) plen 4                  #9 [hci0] 9.490875
      LE Set Random Address (0x08|0x0005) ncmd 1
        Status: Success (0x00)
< HCI Command: LE Set Extended Sca.. (0x08|0x0041) plen 13  #10 [hci0] 9.491246
        Own address type: Random (0x01)
        Filter policy: Accept all advertisement (0x00)
        PHYs: 0x05
        Entry 0: LE 1M
          Type: Active (0x01)
          Interval: 22.500 msec (0x0024)
          Window: 11.250 msec (0x0012)
        Entry 1: LE Coded
          Type: Active (0x01)
          Interval: 67.500 msec (0x006c)
          Window: 33.750 msec (0x0036)
> HCI Event: Command Complete (0x0e) plen 4                 #11 [hci0] 9.491873
      LE Set Extended Scan Parameters (0x08|0x0041) ncmd 1
        Status: Success (0x00)
< HCI Command: LE Set Extended Scan.. (0x08|0x0042) plen 6  #12 [hci0] 9.492009
        Extended scan: Enabled (0x01)
        Filter duplicates: Disabled (0x00)
        Duration: 0 msec (0x0000)
        Period: 0.00 sec (0x0000)
> HCI Event: Command Complete (0x0e) plen 4                 #13 [hci0] 9.492878
      LE Set Extended Scan Enable (0x08|0x0042) ncmd 1
        Status: Success (0x00)
@ MGMT Event: Discovering (0x0013) plen 2              {0x0001} [hci0] 9.492882
        Address type: 0x07
          BR/EDR
          LE Public
          LE Random
        Discovery: Enabled (0x01)
< HCI Command: Inquiry (0x01|0x0001) plen 5                 #14 [hci0] 9.492957
        Access code: 0x9e8b33 (General Inquiry)
        Length: 10.24s (0x08)
        Num responses: 0
> HCI Event: Command Status (0x0f) plen 4                   #15 [hci0] 9.504976
      Inquiry (0x01|0x0001) ncmd 1
        Status: Success (0x00)
@ MGMT Event: Command Complete (0x0001) plen 4         {0x0001} [hci0] 9.505142
      Start Service Discovery (0x003a) plen 1
        Status: Success (0x00)
        Address type: 0x07
          BR/EDR
          LE Public
          LE Random
> HCI Event: LE Meta Event (0x3e) plen 57                  #16 [hci0] 10.752941
      LE Extended Advertising Report (0x0d)
        Num reports: 1
        Entry 0
          Event type: 0x0010
            Props: 0x0010
              Use legacy advertising PDUs
            Data status: [0;32mComplete[0m
          Legacy PDU Type: ADV_NONCONN_IND (0x0010)
          Address type: Random (0x01)
          Address: 61:79:7B:D8:24:5C (Resolvable)
          Primary PHY: LE 1M
          Secondary PHY: No packets
          SID: no ADI field (0xff)
          TX power: 127 dBm
          RSSI: -93 dBm (0xa3)
          Periodic advertising interval: 0.00 msec (0x0000)
          Direct address type: Public (0x00)
          Direct address: 00:00:00:00:00:00 (OUI 00-00-00)
          Data length: 0x1f
        1e ff 06 00 01 09 20 02 66 c8 e2 81 e5 2f 70 f4  ...... .f..../p.
        ba 0d 70 29 d9 30 cd 21 52 02 14 2f db 21 9e     ..p).0.!R../.!. 
        Company: Microsoft (6)
          Data: 0109200266c8e281e52f70f4ba0d7029d930cd215202142fdb219e
@ MGMT Event: Device Found (0x0012) plen 45           {0x0001} [hci0] 10.753032
        LE Address: 61:79:7B:D8:24:5C (Resolvable)
        RSSI: -93 dBm (0xa3)
        Flags: 0x00000004
          Not Connectable
        Data length: 31
        Company: Microsoft (6)
          Data: 0109200266c8e281e52f70f4ba0d7029d930cd215202142fdb219e
> HCI Event: LE Meta Event (0x3e) plen 57                  #17 [hci0] 10.856948
      LE Extended Advertising Report (0x0d)
        Num reports: 1
        Entry 0
          Event type: 0x0010
            Props: 0x0010
              Use legacy advertising PDUs
            Data status: [0;32mComplete[0m
          Legacy PDU Type: ADV_NONCONN_IND (0x0010)
          Address type: Random (0x01)
          Address: 61:79:7B:D8:24:5C (Resolvable)
          Primary PHY: LE 1M
          Secondary PHY: No packets
          SID: no ADI field (0xff)
          TX power: 127 dBm
          RSSI: -98 dBm (0x9e)
          Periodic advertising interval: 0.00 msec (0x0000)
          Direct address type: Public (0x00)
          Direct address: 00:00:00:00:00:00 (OUI 00-00-00)
          Data length: 0x1f
        1e ff 06 00 01 09 20 02 66 c8 e2 81 e5 2f 70 f4  ...... .f..../p.
        ba 0d 70 29 d9 30 cd 21 52 02 14 2f db 21 9e     ..p).0.!R../.!. 
        Company: Microsoft (6)
          Data: 0109200266c8e281e52f70f4ba0d7029d930cd215202142fdb219e
@ MGMT Event: Device Found (0x0012) plen 45           {0x0001} [hci0] 10.857046
        LE Address: 61:79:7B:D8:24:5C (Resolvable)
        RSSI: -98 dBm (0x9e)
        Flags: 0x00000004
          Not Connectable
        Data length: 31
        Company: Microsoft (6)
          Data: 0109200266c8e281e52f70f4ba0d7029d930cd215202142fdb219e
> HCI Event: LE Meta Event (0x3e) plen 43                  #18 [hci0] 11.048029
      LE Extended Advertising Report (0x0d)
        Num reports: 1
        Entry 0
          Event type: 0x0013
            Props: 0x0013
              Connectable
              Scannable
              Use legacy advertising PDUs
            Data status: [0;32mComplete[0m
          Legacy PDU Type: ADV_IND (0x0013)
          Address type: Public (0x00)
          Address: A4:C1:38:D0:E4:84 (Telink Semiconductor (Taipei) Co. Ltd.)
          Primary PHY: LE 1M
          Secondary PHY: No packets
          SID: no ADI field (0xff)
          TX power: 127 dBm
          RSSI: -81 dBm (0xaf)
          Periodic advertising interval: 0.00 msec (0x0000)
          Direct address type: Public (0x00)
          Direct address: 00:00:00:00:00:00 (OUI 00-00-00)
          Data length: 0x11
        10 16 1a 18 a4 c1 38 d0 e4 84 00 cb 3a 50 0b 70  ......8.....:P.p
        ec                                               .               
        Service Data: Environmental Sensing (0x181a)
          Data: a4c138d0e48400cb3a500b70ec
> HCI Event: LE Meta Event (0x3e) plen 43                  #19 [hci0] 12.283064
      LE Extended Advertising Report (0x0d)
        Num reports: 1
        Entry 0
          Event type: 0x0013
            Props: 0x0013
              Connectable
              Scannable
              Use legacy advertising PDUs
            Data status: [0;32mComplete[0m
          Legacy PDU Type: ADV_IND (0x0013)
          Address type: Public (0x00)
          Address: A4:C1:38:26:4E:DA (Telink Semiconductor (Taipei) Co. Ltd.)
          Primary PHY: LE 1M
          Secondary PHY: No packets
          SID: no ADI field (0xff)
          TX power: 127 dBm
          RSSI: -61 dBm (0xc3)
          Periodic advertising interval: 0.00 msec (0x0000)
          Direct address type: Public (0x00)
          Direct address: 00:00:00:00:00:00 (OUI 00-00-00)
          Data length: 0x11
        10 16 1a 18 a4 c1 38 26 4e da 00 cf 35 25 0a 00  ......8&N...5%..
        ee                                               .               
        Service Data: Environmental Sensing (0x181a)
          Data: a4c138264eda00cf35250a00ee
@ MGMT Event: Device Found (0x0012) plen 31           {0x0001} [hci0] 12.283092
        LE Address: A4:C1:38:D0:E4:84 (Telink Semiconductor (Taipei) Co. Ltd.)
        RSSI: -81 dBm (0xaf)
        Flags: 0x00000000
        Data length: 17
        Service Data: Environmental Sensing (0x181a)
          Data: a4c138d0e48400cb3a500b70ec
> HCI Event: LE Meta Event (0x3e) plen 38                  #20 [hci0] 12.283973
      LE Extended Advertising Report (0x0d)
        Num reports: 1
        Entry 0
          Event type: 0x001b
            Props: 0x001b
              Connectable
              Scannable
              Scan response
              Use legacy advertising PDUs
            Data status: [0;32mComplete[0m
          Legacy PDU Type: SCAN_RSP to an ADV_SCAN_IND (0x001b)
          Address type: Public (0x00)
          Address: A4:C1:38:26:4E:DA (Telink Semiconductor (Taipei) Co. Ltd.)
          Primary PHY: LE 1M
          Secondary PHY: No packets
          SID: no ADI field (0xff)
          TX power: 127 dBm
          RSSI: -61 dBm (0xc3)
          Periodic advertising interval: 0.00 msec (0x0000)
          Direct address type: Public (0x00)
          Direct address: 00:00:00:00:00:00 (OUI 00-00-00)
          Data length: 0x0c
        0b 09 41 54 43 5f 32 36 34 45 44 41              ..ATC_264EDA    
        Name (complete): ATC_264EDA
@ MGMT Event: Device Found (0x0012) plen 43           {0x0001} [hci0] 12.283981
        LE Address: A4:C1:38:26:4E:DA (Telink Semiconductor (Taipei) Co. Ltd.)
        RSSI: -61 dBm (0xc3)
        Flags: 0x00000000
        Data length: 29
        Service Data: Environmental Sensing (0x181a)
          Data: a4c138264eda00cf35250a00ee
        Name (complete): ATC_264EDA
> HCI Event: LE Meta Event (0x3e) plen 34                  #21 [hci0] 13.546108
      LE Extended Advertising Report (0x0d)
        Num reports: 1
        Entry 0
          Event type: 0x0010
            Props: 0x0010
              Use legacy advertising PDUs
            Data status: [0;32mComplete[0m
          Legacy PDU Type: ADV_NONCONN_IND (0x0010)
          Address type: Random (0x01)
          Address: DD:52:7E:02:43:C4 (Static)
          Primary PHY: LE 1M
          Secondary PHY: No packets
          SID: no ADI field (0xff)
          TX power: 127 dBm
          RSSI: -94 dBm (0xa2)
          Periodic advertising interval: 0.00 msec (0x0000)
          Direct address type: Public (0x00)
          Direct address: 00:00:00:00:00:00 (OUI 00-00-00)
          Data length: 0x08
        07 ff 4c 00 12 02 00 01                          ..L.....        
        Company: Apple, Inc. (76)
          Type: Unknown (18)
          Data: 0001
@ MGMT Event: Device Found (0x0012) plen 22           {0x0001} [hci0] 13.546267
        LE Address: DD:52:7E:02:43:C4 (Static)
        RSSI: -94 dBm (0xa2)
        Flags: 0x00000004
          Not Connectable
        Data length: 8
        Company: Apple, Inc. (76)
          Type: Unknown (18)
          Data: 0001
> HCI Event: LE Meta Event (0x3e) plen 57                  #22 [hci0] 14.634117
      LE Extended Advertising Report (0x0d)
        Num reports: 1
        Entry 0
          Event type: 0x0010
            Props: 0x0010
              Use legacy advertising PDUs
            Data status: [0;32mComplete[0m
          Legacy PDU Type: ADV_NONCONN_IND (0x0010)
          Address type: Random (0x01)
          Address: 61:79:7B:D8:24:5C (Resolvable)
          Primary PHY: LE 1M
          Secondary PHY: No packets
          SID: no ADI field (0xff)
          TX power: 127 dBm
          RSSI: -92 dBm (0xa4)
          Periodic advertising interval: 0.00 msec (0x0000)
          Direct address type: Public (0x00)
          Direct address: 00:00:00:00:00:00 (OUI 00-00-00)
          Data length: 0x1f
        1e ff 06 00 01 09 20 02 66 c8 e2 81 e5 2f 70 f4  ...... .f..../p.
        ba 0d 70 29 d9 30 cd 21 52 02 14 2f db 21 9e     ..p).0.!R../.!. 
        Company: Microsoft (6)
          Data: 0109200266c8e281e52f70f4ba0d7029d930cd215202142fdb219e
@ MGMT Event: Device Found (0x0012) plen 45           {0x0001} [hci0] 14.634143
        LE Address: 61:79:7B:D8:24:5C (Resolvable)
        RSSI: -92 dBm (0xa4)
        Flags: 0x00000004
          Not Connectable
        Data length: 31
        Company: Microsoft (6)
          Data: 0109200266c8e281e52f70f4ba0d7029d930cd215202142fdb219e
bluetoothctl[1372590]: @ MGMT Close: bluetoothctl            {0x0003} 15.394093
bluetoothd[2915165]: @ MGMT Comman.. (0x0024) plen 1  {0x0001} [hci0] 15.396224
        Address type: 0x07
          BR/EDR
          LE Public
          LE Random
< HCI Command: Inquiry Cancel (0x01|0x0002) plen 0         #23 [hci0] 15.396349
> HCI Event: Command Complete (0x0e) plen 4                #24 [hci0] 15.398005
      Inquiry Cancel (0x01|0x0002) ncmd 1
        Status: Success (0x00)
< HCI Command: LE Set Extended Sca.. (0x08|0x0042) plen 6  #25 [hci0] 15.398315
        Extended scan: Disabled (0x00)
        Filter duplicates: Disabled (0x00)
        Duration: 0 msec (0x0000)
        Period: 0.00 sec (0x0000)
bluetoothctl[1373120]: @ MGMT Open: bluetoot.. version 1.23  {0x0003} 15.398391
> HCI Event: Command Complete (0x0e) plen 4                #26 [hci0] 15.410067
      LE Set Extended Scan Enable (0x08|0x0042) ncmd 1
        Status: Success (0x00)
@ MGMT Event: Discovering (0x0013) plen 2             {0x0001} [hci0] 15.410151
        Address type: 0x07
          BR/EDR
          LE Public
          LE Random
        Discovery: Disabled (0x00)
@ MGMT Event: Command Complete (0x0001) plen 4        {0x0001} [hci0] 15.410253
      Stop Discovery (0x0024) plen 1
        Status: Success (0x00)
        Address type: 0x07
          BR/EDR
          LE Public
          LE Random
bluetoothd[2915165]: @ MGMT Comman.. (0x003a) plen 4  {0x0001} [hci0] 15.410287
        Address type: 0x01
          BR/EDR
        RSSI: invalid (0x7f)
        UUIDs: 0
< HCI Command: Inquiry (0x01|0x0001) plen 5                #27 [hci0] 15.410314
        Access code: 0x9e8b33 (General Inquiry)
        Length: 10.24s (0x08)
        Num responses: 0
> HCI Event: Command Status (0x0f) plen 4                  #28 [hci0] 15.411002
      Inquiry (0x01|0x0001) ncmd 1
        Status: Success (0x00)
@ MGMT Event: Command Complete (0x0001) plen 4        {0x0001} [hci0] 15.411196
      Start Service Discovery (0x003a) plen 1
        Status: Success (0x00)
        Address type: 0x01
          BR/EDR
@ MGMT Event: Discovering (0x0013) plen 2             {0x0001} [hci0] 15.411200
        Address type: 0x01
          BR/EDR
        Discovery: Enabled (0x01)
bluetoothctl[1373120]: @ MGMT Close: bluetoothctl            {0x0003} 23.409193
bluetoothctl[1373851]: @ MGMT Open: bluetoot.. version 1.23  {0x0003} 23.416565
> HCI Event: Inquiry Complete (0x01) plen 1                #29 [hci0] 25.716218
        Status: Success (0x00)
@ MGMT Event: Discovering (0x0013) plen 2             {0x0001} [hci0] 25.716235
        Address type: 0x01
          BR/EDR
        Discovery: Disabled (0x00)
bluetoothd[2915165]: @ MGMT Comman.. (0x003a) plen 4  {0x0001} [hci0] 25.716306
        Address type: 0x01
          BR/EDR
        RSSI: invalid (0x7f)
        UUIDs: 0
< HCI Command: Inquiry (0x01|0x0001) plen 5                #30 [hci0] 25.716314
        Access code: 0x9e8b33 (General Inquiry)
        Length: 10.24s (0x08)
        Num responses: 0
> HCI Event: Command Status (0x0f) plen 4                  #31 [hci0] 25.717207
      Inquiry (0x01|0x0001) ncmd 1
        Status: Success (0x00)
@ MGMT Event: Command Complete (0x0001) plen 4        {0x0001} [hci0] 25.717215
      Start Service Discovery (0x003a) plen 1
        Status: Success (0x00)
        Address type: 0x01
          BR/EDR
@ MGMT Event: Discovering (0x0013) plen 2             {0x0001} [hci0] 25.717217
        Address type: 0x01
          BR/EDR
        Discovery: Enabled (0x01)
bluetoothctl[1373851]: @ MGMT Close: bluetoothctl            {0x0003} 31.424451
bluetoothctl[1374635]: @ MGMT Open: bluetoot.. version 1.23  {0x0003} 32.438472
bluetoothd[2915165]: @ MGMT Comman.. (0x0024) plen 1  {0x0001} [hci0] 32.447241
        Address type: 0x01
          BR/EDR
< HCI Command: Inquiry Cancel (0x01|0x0002) plen 0         #32 [hci0] 32.447368
> HCI Event: Command Complete (0x0e) plen 4                #33 [hci0] 32.542362
      Inquiry Cancel (0x01|0x0002) ncmd 1
        Status: Success (0x00)
@ MGMT Event: Discovering (0x0013) plen 2             {0x0001} [hci0] 32.542464
        Address type: 0x01
          BR/EDR
        Discovery: Disabled (0x00)
@ MGMT Event: Command Complete (0x0001) plen 4        {0x0001} [hci0] 32.542481
      Stop Discovery (0x0024) plen 1
        Status: Success (0x00)
        Address type: 0x01
          BR/EDR
bluetoothd[2915165]: @ MGMT Comman.. (0x003a) plen 4  {0x0001} [hci0] 32.542650
        Address type: 0x07
          BR/EDR
          LE Public
          LE Random
        RSSI: invalid (0x7f)
        UUIDs: 0
< HCI Command: LE Set Random Address (0x08|0x0005) plen 6  #34 [hci0] 32.542813
        Address: 28:8B:43:39:CF:A0 (Non-Resolvable)
> HCI Event: Command Complete (0x0e) plen 4                #35 [hci0] 32.543360
      LE Set Random Address (0x08|0x0005) ncmd 1
        Status: Success (0x00)
< HCI Command: LE Set Extended Sc.. (0x08|0x0041) plen 13  #36 [hci0] 32.543495
        Own address type: Random (0x01)
        Filter policy: Accept all advertisement (0x00)
        PHYs: 0x05
        Entry 0: LE 1M
          Type: Active (0x01)
          Interval: 22.500 msec (0x0024)
          Window: 11.250 msec (0x0012)
        Entry 1: LE Coded
          Type: Active (0x01)
          Interval: 67.500 msec (0x006c)
          Window: 33.750 msec (0x0036)
> HCI Event: Command Complete (0x0e) plen 4                #37 [hci0] 32.544358
      LE Set Extended Scan Parameters (0x08|0x0041) ncmd 1
        Status: Success (0x00)
< HCI Command: LE Set Extended Sca.. (0x08|0x0042) plen 6  #38 [hci0] 32.544519
        Extended scan: Enabled (0x01)
        Filter duplicates: Disabled (0x00)
        Duration: 0 msec (0x0000)
        Period: 0.00 sec (0x0000)
> HCI Event: Command Complete (0x0e) plen 4                #39 [hci0] 32.545358
      LE Set Extended Scan Enable (0x08|0x0042) ncmd 1
        Status: Success (0x00)
@ MGMT Event: Discovering (0x0013) plen 2             {0x0001} [hci0] 32.545509
        Address type: 0x07
          BR/EDR
          LE Public
          LE Random
        Discovery: Enabled (0x01)
< HCI Command: Inquiry (0x01|0x0001) plen 5                #40 [hci0] 32.545529
        Access code: 0x9e8b33 (General Inquiry)
        Length: 10.24s (0x08)
        Num responses: 0
> HCI Event: Command Status (0x0f) plen 4                  #41 [hci0] 32.551363
      Inquiry (0x01|0x0001) ncmd 1
        Status: Success (0x00)
@ MGMT Event: Command Complete (0x0001) plen 4        {0x0001} [hci0] 32.551379
      Start Service Discovery (0x003a) plen 1
        Status: Success (0x00)
        Address type: 0x07
          BR/EDR
          LE Public
          LE Random
> HCI Event: LE Meta Event (0x3e) plen 43                  #42 [hci0] 32.552384
      LE Extended Advertising Report (0x0d)
        Num reports: 1
        Entry 0
          Event type: 0x0013
            Props: 0x0013
              Connectable
              Scannable
              Use legacy advertising PDUs
            Data status: [0;32mComplete[0m
          Legacy PDU Type: ADV_IND (0x0013)
          Address type: Random (0x01)
          Address: 5C:E1:65:05:9E:7C (Resolvable)
          Primary PHY: LE 1M
          Secondary PHY: No packets
          SID: no ADI field (0xff)
          TX power: 127 dBm
          RSSI: -81 dBm (0xaf)
          Periodic advertising interval: 0.00 msec (0x0000)
          Direct address type: Public (0x00)
          Direct address: 00:00:00:00:00:00 (OUI 00-00-00)
          Data length: 0x11
        02 01 1a 02 0a 0c 0a ff 4c 00 10 05 35 1c a9 da  ........L...5...
        90                                               .               
        Flags: 0x1a
          LE General Discoverable Mode
          Simultaneous LE and BR/EDR (Controller)
          Simultaneous LE and BR/EDR (Host)
        TX power: 12 dBm
        Company: Apple, Inc. (76)
          Type: Unknown (16)
          Data: 351ca9da90
> HCI Event: LE Meta Event (0x3e) plen 26                  #43 [hci0] 32.553369
      LE Extended Advertising Report (0x0d)
        Num reports: 1
        Entry 0
          Event type: 0x001b
            Props: 0x001b
              Connectable
              Scannable
              Scan response
              Use legacy advertising PDUs
            Data status: [0;32mComplete[0m
          Legacy PDU Type: SCAN_RSP to an ADV_SCAN_IND (0x001b)
          Address type: Random (0x01)
          Address: 5C:E1:65:05:9E:7C (Resolvable)
          Primary PHY: LE 1M
          Secondary PHY: No packets
          SID: no ADI field (0xff)
          TX power: 127 dBm
          RSSI: -82 dBm (0xae)
          Periodic advertising interval: 0.00 msec (0x0000)
          Direct address type: Public (0x00)
          Direct address: 00:00:00:00:00:00 (OUI 00-00-00)
          Data length: 0x00
@ MGMT Event: Device Found (0x0012) plen 31           {0x0001} [hci0] 32.553376
        LE Address: 5C:E1:65:05:9E:7C (Resolvable)
        RSSI: -82 dBm (0xae)
        Flags: 0x00000000
        Data length: 17
        Flags: 0x1a
          LE General Discoverable Mode
          Simultaneous LE and BR/EDR (Controller)
          Simultaneous LE and BR/EDR (Host)
        TX power: 12 dBm
        Company: Apple, Inc. (76)
          Type: Unknown (16)
          Data: 351ca9da90
> HCI Event: LE Meta Event (0x3e) plen 43                  #44 [hci0] 33.090403
      LE Extended Advertising Report (0x0d)
        Num reports: 1
        Entry 0
          Event type: 0x0013
            Props: 0x0013
              Connectable
              Scannable
              Use legacy advertising PDUs
            Data status: [0;32mComplete[0m
          Legacy PDU Type: ADV_IND (0x0013)
          Address type: Public (0x00)
          Address: A4:C1:38:8D:7D:4F (Telink Semiconductor (Taipei) Co. Ltd.)
          Primary PHY: LE 1M
          Secondary PHY: No packets
          SID: no ADI field (0xff)
          TX power: 127 dBm
          RSSI: -91 dBm (0xa5)
          Periodic advertising interval: 0.00 msec (0x0000)
          Direct address type: Public (0x00)
          Direct address: 00:00:00:00:00:00 (OUI 00-00-00)
          Data length: 0x11
        10 16 1a 18 a4 c1 38 8d 7d 4f 00 bc 3c 51 0b 75  ......8.}O..<Q.u
        d6                                               .               
        Service Data: Environmental Sensing (0x181a)
          Data: a4c1388d7d4f00bc3c510b75d6
> HCI Event: LE Meta Event (0x3e) plen 38                  #45 [hci0] 33.091393
      LE Extended Advertising Report (0x0d)
        Num reports: 1
        Entry 0
          Event type: 0x001b
            Props: 0x001b
              Connectable
              Scannable
              Scan response
              Use legacy advertising PDUs
            Data status: [0;32mComplete[0m
          Legacy PDU Type: SCAN_RSP to an ADV_SCAN_IND (0x001b)
          Address type: Public (0x00)
          Address: A4:C1:38:8D:7D:4F (Telink Semiconductor (Taipei) Co. Ltd.)
          Primary PHY: LE 1M
          Secondary PHY: No packets
          SID: no ADI field (0xff)
          TX power: 127 dBm
          RSSI: -92 dBm (0xa4)
          Periodic advertising interval: 0.00 msec (0x0000)
          Direct address type: Public (0x00)
          Direct address: 00:00:00:00:00:00 (OUI 00-00-00)
          Data length: 0x0c
        0b 09 41 54 43 5f 38 44 37 44 34 46              ..ATC_8D7D4F    
        Name (complete): ATC_8D7D4F
@ MGMT Event: Device Found (0x0012) plen 43           {0x0001} [hci0] 33.091495
        LE Address: A4:C1:38:8D:7D:4F (Telink Semiconductor (Taipei) Co. Ltd.)
        RSSI: -92 dBm (0xa4)
        Flags: 0x00000000
        Data length: 29
        Service Data: Environmental Sensing (0x181a)
          Data: a4c1388d7d4f00bc3c510b75d6
        Name (complete): ATC_8D7D4F
> HCI Event: LE Meta Event (0x3e) plen 39                  #46 [hci0] 33.965491
      LE Extended Advertising Report (0x0d)
        Num reports: 1
        Entry 0
          Event type: 0x0013
            Props: 0x0013
              Connectable
              Scannable
              Use legacy advertising PDUs
            Data status: [0;32mComplete[0m
          Legacy PDU Type: ADV_IND (0x0013)
          Address type: Random (0x01)
          Address: C0:DE:54:15:00:51 (Static)
          Primary PHY: LE 1M
          Secondary PHY: No packets
          SID: no ADI field (0xff)
          TX power: 127 dBm
          RSSI: -83 dBm (0xad)
          Periodic advertising interval: 0.00 msec (0x0000)
          Direct address type: Public (0x00)
          Direct address: 00:00:00:00:00:00 (OUI 00-00-00)
          Data length: 0x0d
        02 01 06 09 09 58 35 34 2d 50 41 49 52           .....X54-PAIR   
        Flags: 0x06
          LE General Discoverable Mode
          BR/EDR Not Supported
        Name (complete): X54-PAIR
> HCI Event: LE Meta Event (0x3e) plen 39                  #47 [hci0] 36.146552
      LE Extended Advertising Report (0x0d)
        Num reports: 1
        Entry 0
          Event type: 0x0013
            Props: 0x0013
              Connectable
              Scannable
              Use legacy advertising PDUs
            Data status: [0;32mComplete[0m
          Legacy PDU Type: ADV_IND (0x0013)
          Address type: Random (0x01)
          Address: C0:DE:54:15:00:51 (Static)
          Primary PHY: LE 1M
          Secondary PHY: No packets
          SID: no ADI field (0xff)
          TX power: 127 dBm
          RSSI: -82 dBm (0xae)
          Periodic advertising interval: 0.00 msec (0x0000)
          Direct address type: Public (0x00)
          Direct address: 00:00:00:00:00:00 (OUI 00-00-00)
          Data length: 0x0d
        02 01 06 09 09 58 35 34 2d 50 41 49 52           .....X54-PAIR   
        Flags: 0x06
          LE General Discoverable Mode
          BR/EDR Not Supported
        Name (complete): X54-PAIR
> HCI Event: LE Meta Event (0x3e) plen 26                  #48 [hci0] 37.922492
      LE Extended Advertising Report (0x0d)
        Num reports: 1
        Entry 0
          Event type: 0x0013
            Props: 0x0013
              Connectable
              Scannable
              Use legacy advertising PDUs
            Data status: [0;32mComplete[0m
          Legacy PDU Type: ADV_IND (0x0013)
          Address type: Public (0x00)
          Address: C0:DE:54:15:00:51 (OUI C0-DE-54)
          Primary PHY: LE 1M
          Secondary PHY: No packets
          SID: no ADI field (0xff)
          TX power: 127 dBm
          RSSI: -82 dBm (0xae)
          Periodic advertising interval: 0.00 msec (0x0000)
          Direct address type: Public (0x00)
          Direct address: 00:00:00:00:00:00 (OUI 00-00-00)
          Data length: 0x00
@ MGMT Event: Device Found (0x0012) plen 27           {0x0001} [hci0] 37.922617
        LE Address: C0:DE:54:15:00:51 (Static)
        RSSI: -82 dBm (0xae)
        Flags: 0x00000000
        Data length: 13
        Flags: 0x06
          LE General Discoverable Mode
          BR/EDR Not Supported
        Name (complete): X54-PAIR
> HCI Event: LE Meta Event (0x3e) plen 57                  #49 [hci0] 38.299635
      LE Extended Advertising Report (0x0d)
        Num reports: 1
        Entry 0
          Event type: 0x0010
            Props: 0x0010
              Use legacy advertising PDUs
            Data status: [0;32mComplete[0m
          Legacy PDU Type: ADV_NONCONN_IND (0x0010)
          Address type: Random (0x01)
          Address: C7:F9:6F:16:65:0A (Static)
          Primary PHY: LE 1M
          Secondary PHY: No packets
          SID: no ADI field (0xff)
          TX power: 127 dBm
          RSSI: -74 dBm (0xb6)
          Periodic advertising interval: 0.00 msec (0x0000)
          Direct address type: Public (0x00)
          Direct address: 00:00:00:00:00:00 (OUI 00-00-00)
          Data length: 0x1f
        1e ff 4c 00 12 19 00 a4 5c a2 9d fd a7 95 89 e3  ..L.....\.......
        a4 83 b2 fd 10 c7 c6 3f 26 36 9b 2e 6c 00 00     .......?&6..l.. 
        Company: Apple, Inc. (76)
          Type: Unknown (18)
          Data: 00a45ca29dfda79589e3a483b2fd10c7c63f26369b2e6c0000
@ MGMT Event: Device Found (0x0012) plen 14           {0x0001} [hci0] 38.299657
        LE Address: C0:DE:54:15:00:51 (OUI C0-DE-54)
        RSSI: -82 dBm (0xae)
        Flags: 0x00000000
        Data length: 0
@ MGMT Event: Device Found (0x0012) plen 45           {0x0001} [hci0] 38.299663
        LE Address: C7:F9:6F:16:65:0A (Static)
        RSSI: -74 dBm (0xb6)
        Flags: 0x00000004
          Not Connectable
        Data length: 31
        Company: Apple, Inc. (76)
          Type: Unknown (18)
          Data: 00a45ca29dfda79589e3a483b2fd10c7c63f26369b2e6c0000
bluetoothd[2915165]: = src/device.c:device_new() Unable to regist..   38.299981
bluetoothd[2915165]: = Unable to create object for found d..   [hci0] 38.300009
bluetoothctl[1374635]: @ MGMT Close: bluetoothctl            {0x0003} 38.447205
bluetoothd[2915165]: @ MGMT Comman.. (0x0024) plen 1  {0x0001} [hci0] 38.449436
        Address type: 0x07
          BR/EDR
          LE Public
          LE Random
< HCI Command: Inquiry Cancel (0x01|0x0002) plen 0         #50 [hci0] 38.449454
> HCI Event: Command Complete (0x0e) plen 4                #51 [hci0] 38.451574
      Inquiry Cancel (0x01|0x0002) ncmd 1
        Status: Success (0x00)
< HCI Command: LE Set Extended Sca.. (0x08|0x0042) plen 6  #52 [hci0] 38.451602
        Extended scan: Disabled (0x00)
        Filter duplicates: Disabled (0x00)
        Duration: 0 msec (0x0000)
        Period: 0.00 sec (0x0000)
bluetoothctl[1375177]: @ MGMT Open: bluetoot.. version 1.23  {0x0003} 38.454471
> HCI Event: Command Complete (0x0e) plen 4                #53 [hci0] 38.463594
      LE Set Extended Scan Enable (0x08|0x0042) ncmd 1
        Status: Success (0x00)
@ MGMT Event: Command Complete (0x0001) plen 4        {0x0001} [hci0] 38.463715
      Stop Discovery (0x0024) plen 1
        Status: Success (0x00)
        Address type: 0x07
          BR/EDR
          LE Public
          LE Random
@ MGMT Event: Discovering (0x0013) plen 2             {0x0001} [hci0] 38.463733
        Address type: 0x07
          BR/EDR
          LE Public
          LE Random
        Discovery: Disabled (0x00)
< HCI Command: LE Set Address Reso.. (0x08|0x002d) plen 1  #54 [hci0] 38.463769
        Address resolution: Enabled (0x01)
bluetoothd[2915165]: @ MGMT Comman.. (0x003a) plen 4  {0x0001} [hci0] 38.464009
        Address type: 0x01
          BR/EDR
        RSSI: invalid (0x7f)
        UUIDs: 0
> HCI Event: Command Complete (0x0e) plen 4                #55 [hci0] 38.464585
      LE Set Address Resolution Enable (0x08|0x002d) ncmd 1
        Status: Success (0x00)
< HCI Command: LE Set Extended Sc.. (0x08|0x0041) plen 13  #56 [hci0] 38.464600
        Own address type: Public (0x00)
        Filter policy: Ignore not in accept list (0x01)
        PHYs: 0x05
        Entry 0: LE 1M
          Type: Passive (0x00)
          Interval: 60.000 msec (0x0060)
          Window: 60.000 msec (0x0060)
        Entry 1: LE Coded
          Type: Passive (0x00)
          Interval: 180.000 msec (0x0120)
          Window: 180.000 msec (0x0120)
> HCI Event: Command Complete (0x0e) plen 4                #57 [hci0] 38.465488
      LE Set Extended Scan Parameters (0x08|0x0041) ncmd 1
        Status: Success (0x00)
< HCI Command: LE Set Extended Sca.. (0x08|0x0042) plen 6  #58 [hci0] 38.465572
        Extended scan: Enabled (0x01)
        Filter duplicates: Enabled (0x01)
        Duration: 0 msec (0x0000)
        Period: 0.00 sec (0x0000)
> HCI Event: Command Complete (0x0e) plen 4                #59 [hci0] 38.466482
      LE Set Extended Scan Enable (0x08|0x0042) ncmd 1
        Status: Success (0x00)
< HCI Command: Inquiry (0x01|0x0001) plen 5                #60 [hci0] 38.466569
        Access code: 0x9e8b33 (General Inquiry)
        Length: 10.24s (0x08)
        Num responses: 0
> HCI Event: Command Status (0x0f) plen 4                  #61 [hci0] 38.568601
      Inquiry (0x01|0x0001) ncmd 1
        Status: Success (0x00)
@ MGMT Event: Command Complete (0x0001) plen 4        {0x0001} [hci0] 38.568842
      Start Service Discovery (0x003a) plen 1
        Status: Success (0x00)
        Address type: 0x01
          BR/EDR
@ MGMT Event: Discovering (0x0013) plen 2             {0x0001} [hci0] 38.568855
        Address type: 0x01
          BR/EDR
        Discovery: Enabled (0x01)
> HCI Event: LE Meta Event (0x3e) plen 39                  #62 [hci0] 38.835639
      LE Extended Advertising Report (0x0d)
        Num reports: 1
        Entry 0
          Event type: 0x0013
            Props: 0x0013
              Connectable
              Scannable
              Use legacy advertising PDUs
            Data status: [0;32mComplete[0m
          Legacy PDU Type: ADV_IND (0x0013)
          Address type: Random (0x01)
          Address: C0:DE:54:15:00:51 (Static)
          Primary PHY: LE 1M
          Secondary PHY: No packets
          SID: no ADI field (0xff)
          TX power: 127 dBm
          RSSI: -89 dBm (0xa7)
          Periodic advertising interval: 0.00 msec (0x0000)
          Direct address type: Public (0x00)
          Direct address: 00:00:00:00:00:00 (OUI 00-00-00)
          Data length: 0x0d
        02 01 06 09 09 58 35 34 2d 50 41 49 52           .....X54-PAIR   
        Flags: 0x06
          LE General Discoverable Mode
          BR/EDR Not Supported
        Name (complete): X54-PAIR
< HCI Command: LE Set Extended Sca.. (0x08|0x0042) plen 6  #63 [hci0] 38.835912
        Extended scan: Disabled (0x00)
        Filter duplicates: Disabled (0x00)
        Duration: 0 msec (0x0000)
        Period: 0.00 sec (0x0000)
> HCI Event: Command Complete (0x0e) plen 4                #64 [hci0] 38.839495
      LE Set Extended Scan Enable (0x08|0x0042) ncmd 1
        Status: Success (0x00)
< HCI Command: LE Extended Create.. (0x08|0x0043) plen 26  #65 [hci0] 38.839728
        Filter policy: Accept list is not used (0x00)
        Own address type: Public (0x00)
        Peer address type: Random (0x01)
        Peer address: C0:DE:54:15:00:51 (Static)
        Initiating PHYs: 0x01
        Entry 0: LE 1M
          Scan interval: 60.000 msec (0x0060)
          Scan window: 60.000 msec (0x0060)
          Min connection interval: 30.00 msec (0x0018)
          Max connection interval: 50.00 msec (0x0028)
          Connection latency: 0 (0x0000)
          Supervision timeout: 420 msec (0x002a)
          Min connection length: 0.000 msec (0x0000)
          Max connection length: 0.000 msec (0x0000)
> HCI Event: Command Status (0x0f) plen 4                  #66 [hci0] 38.841494
      LE Extended Create Connection (0x08|0x0043) ncmd 1
        Status: Success (0x00)
> HCI Event: LE Meta Event (0x3e) plen 31                  #67 [hci0] 40.155638
      LE Enhanced Connection Complete (0x0a)
        Status: Success (0x00)
        Handle: 2048
        Role: Central (0x00)
        Peer address type: Random (0x01)
        Peer address: C0:DE:54:15:00:51 (Static)
        Local resolvable private address: 00:00:00:00:00:00 (Non-Resolvable)
        Peer resolvable private address: 00:00:00:00:00:00 (Non-Resolvable)
        Connection interval: 45.00 msec (0x0024)
        Connection latency: 0 (0x0000)
        Supervision timeout: 420 msec (0x002a)
        Central clock accuracy: 0x00
@ MGMT Event: Device Connected (0x000b) plen 26       {0x0001} [hci0] 40.155666
        LE Address: C0:DE:54:15:00:51 (Static)
        Flags: 0x00000008
          Connection Locally Initiated
        Data length: 13
        Flags: 0x06
          LE General Discoverable Mode
          BR/EDR Not Supported
        Name (complete): X54-PAIR
btmon[1371738]: @ RAW Open: btmon (privileged) version 2.22  {0x0004} 40.155760
btmon[1371738]: @ RAW Close: btmon                           {0x0004} 40.155766
> HCI Event: LE Meta Event (0x3e) plen 4                   #68 [hci0] 40.156521
      LE Channel Selection Algorithm (0x14)
        Handle: 2048 Address: C0:DE:54:15:00:51 (Static)
        Algorithm: #2 (0x01)
< HCI Command: LE Read Remote Used.. (0x08|0x0016) plen 2  #69 [hci0] 40.164737
        Handle: 2048 Address: C0:DE:54:15:00:51 (Static)
> HCI Event: Command Status (0x0f) plen 4                  #70 [hci0] 40.165512
      LE Read Remote Used Features (0x08|0x0016) ncmd 1
        Status: Success (0x00)
> HCI Event: LE Meta Event (0x3e) plen 12                  #71 [hci0] 40.232526
      LE Read Remote Used Features (0x04)
        Status: Success (0x00)
        Handle: 2048 Address: C0:DE:54:15:00:51 (Static)
        Features: 0x1f 0x00 0x00 0x00 0x00 0x00 0x00 0x00
          LE Encryption
          Connection Parameter Request Procedure
          Extended Reject Indication
          Peripheral-initiated Features Exchange
          LE Ping
bluetoothd[2915165]: < ACL Data TX: H.. flags 0x00 dlen 7  #72 [hci0] 40.232707
      ATT: Exchange MTU Request (0x02) len 2
        Client RX MTU: 517
> HCI Event: Number of Completed Packets (0x13) plen 5     #73 [hci0] 40.322520
        Num handles: 1
        Handle: 2048 Address: C0:DE:54:15:00:51 (Static)
        Count: 1
        #72: len 7 (0 Kb/s)
        Latency: 89 msec (89-89 msec ~89 msec)
> ACL Data RX: Handle 2048 flags 0x02 dlen 7               #74 [hci0] 40.368738
      ATT: Exchange MTU Response (0x03) len 2
        Server RX MTU: 23
bluetoothd[2915165]: < ACL Data TX:... flags 0x00 dlen 11  #75 [hci0] 40.369013
      ATT: Read By Type Request (0x08) len 6
        Handle range: 0x0001-0xffff
        Attribute type: Server Supported Features (0x2b3a)
> HCI Event: Number of Completed Packets (0x13) plen 5     #76 [hci0] 40.412557
        Num handles: 1
        Handle: 2048 Address: C0:DE:54:15:00:51 (Static)
        Count: 1
        #75: len 11 (2 Kb/s)
        Latency: 43 msec (43-89 msec ~66 msec)
> ACL Data RX: Handle 2048 flags 0x02 dlen 9               #77 [hci0] 40.458839
      ATT: Error Response (0x01) len 4
        Read By Type Request (0x08)
        Handle: 0x0001
        Error: Attribute Not Found (0x0a)
bluetoothd[2915165]: < ACL Data TX:... flags 0x00 dlen 11  #78 [hci0] 40.459081
      ATT: Read By Group Type Request (0x10) len 6
        Handle range: 0x0001-0xffff
        Attribute group type: Primary Service (0x2800)
> HCI Event: Number of Completed Packets (0x13) plen 5     #79 [hci0] 40.502530
        Num handles: 1
        Handle: 2048 Address: C0:DE:54:15:00:51 (Static)
        Count: 1
        #78: len 11 (2 Kb/s)
        Latency: 43 msec (43-89 msec ~55 msec)
> ACL Data RX: Handle 2048 flags 0x02 dlen 24              #80 [hci0] 40.549737
      ATT: Read By Group Type Response (0x11) len 19
        Attribute data length: 6
        Attribute group list: 3 entries
        Handle range: 0x0001-0x0007
        UUID: Generic Access Profile (0x1800)
        Handle range: 0x0008-0x000b
        UUID: Generic Attribute Profile (0x1801)
        Handle range: 0x0010-0x0013
        UUID: Battery Service (0x180f)
bluetoothd[2915165]: < ACL Data TX:... flags 0x00 dlen 11  #81 [hci0] 40.549848
      ATT: Read By Group Type Request (0x10) len 6
        Handle range: 0x0014-0xffff
        Attribute group type: Primary Service (0x2800)
> HCI Event: Number of Completed Packets (0x13) plen 5     #82 [hci0] 40.592529
        Num handles: 1
        Handle: 2048 Address: C0:DE:54:15:00:51 (Static)
        Count: 1
        #81: len 11 (2 Kb/s)
        Latency: 42 msec (42-89 msec ~48 msec)
> ACL Data RX: Handle 2048 flags 0x02 dlen 9               #83 [hci0] 40.638736
      ATT: Error Response (0x01) len 4
        Read By Group Type Request (0x10)
        Handle: 0x0014
        Error: Attribute Not Found (0x0a)
bluetoothd[2915165]: < ACL Data TX:... flags 0x00 dlen 11  #84 [hci0] 40.639998
      ATT: Read By Group Type Request (0x10) len 6
        Handle range: 0x0001-0xffff
        Attribute group type: Secondary Service (0x2801)
> HCI Event: Number of Completed Packets (0x13) plen 5     #85 [hci0] 40.682535
        Num handles: 1
        Handle: 2048 Address: C0:DE:54:15:00:51 (Static)
        Count: 1
        #84: len 11 (2 Kb/s)
        Latency: 42 msec (42-89 msec ~45 msec)
> ACL Data RX: Handle 2048 flags 0x02 dlen 9               #86 [hci0] 40.729732
      ATT: Error Response (0x01) len 4
        Read By Group Type Request (0x10)
        Handle: 0x0001
        Error: Unsupported Group Type (0x10)
bluetoothd[2915165]: < ACL Data TX:... flags 0x00 dlen 11  #87 [hci0] 40.730053
      ATT: Read By Type Request (0x08) len 6
        Handle range: 0x0001-0x0013
        Attribute type: Include (0x2802)
> HCI Event: Number of Completed Packets (0x13) plen 5     #88 [hci0] 40.772535
        Num handles: 1
        Handle: 2048 Address: C0:DE:54:15:00:51 (Static)
        Count: 1
        #87: len 11 (2 Kb/s)
        Latency: 42 msec (42-89 msec ~44 msec)
> ACL Data RX: Handle 2048 flags 0x02 dlen 9               #89 [hci0] 40.863734
      ATT: Error Response (0x01) len 4
        Read By Type Request (0x08)
        Handle: 0x0001
        Error: Attribute Not Found (0x0a)
bluetoothd[2915165]: < ACL Data TX:... flags 0x00 dlen 11  #90 [hci0] 40.863878
      ATT: Read By Type Request (0x08) len 6
        Handle range: 0x0001-0x0013
        Attribute type: Characteristic (0x2803)
> HCI Event: Number of Completed Packets (0x13) plen 5     #91 [hci0] 40.907604
        Num handles: 1
        Handle: 2048 Address: C0:DE:54:15:00:51 (Static)
        Count: 1
        #90: len 11 (2 Kb/s)
        Latency: 43 msec (42-89 msec ~43 msec)
> ACL Data RX: Handle 2048 flags 0x02 dlen 27              #92 [hci0] 40.953800
      ATT: Read By Type Response (0x09) len 22
        Attribute data length: 7
        Attribute data list: 3 entries
        Handle: 0x0002
        Value: 020300002a
            Properties: 0x02
              Read (0x02)
            Value Handle: 0x0003
            Value UUID: Device Name (0x2a00)
        Handle: 0x0004
        Value: 020500012a
            Properties: 0x02
              Read (0x02)
            Value Handle: 0x0005
            Value UUID: Appearance (0x2a01)
        Handle: 0x0006
        Value: 020700042a
            Properties: 0x02
              Read (0x02)
            Value Handle: 0x0007
            Value UUID: Peripheral Preferred Connection Parameters (0x2a04)
bluetoothd[2915165]: < ACL Data TX:... flags 0x00 dlen 11  #93 [hci0] 40.954101
      ATT: Read By Type Request (0x08) len 6
        Handle range: 0x0007-0x0013
        Attribute type: Characteristic (0x2803)
> HCI Event: Number of Completed Packets (0x13) plen 5     #94 [hci0] 40.997652
        Num handles: 1
        Handle: 2048 Address: C0:DE:54:15:00:51 (Static)
        Count: 1
        #93: len 11 (2 Kb/s)
        Latency: 43 msec (42-89 msec ~43 msec)
> ACL Data RX: Handle 2048 flags 0x02 dlen 20              #95 [hci0] 41.043889
      ATT: Read By Type Response (0x09) len 15
        Attribute data length: 7
        Attribute data list: 2 entries
        Handle: 0x0009
        Value: 200a00052a
            Properties: 0x20
              Indicate (0x20)
            Value Handle: 0x000a
            Value UUID: Service Changed (0x2a05)
        Handle: 0x0011
        Value: 121200192a
            Properties: 0x12
              Read (0x02)
              Notify (0x10)
            Value Handle: 0x0012
            Value UUID: Battery Level (0x2a19)
bluetoothd[2915165]: < ACL Data TX:... flags 0x00 dlen 11  #96 [hci0] 41.044045
      ATT: Read By Type Request (0x08) len 6
        Handle range: 0x0012-0x0013
        Attribute type: Characteristic (0x2803)
> HCI Event: Number of Completed Packets (0x13) plen 5     #97 [hci0] 41.087547
        Num handles: 1
        Handle: 2048 Address: C0:DE:54:15:00:51 (Static)
        Count: 1
        #96: len 11 (2 Kb/s)
        Latency: 43 msec (42-89 msec ~43 msec)
> ACL Data RX: Handle 2048 flags 0x02 dlen 9               #98 [hci0] 41.133731
      ATT: Error Response (0x01) len 4
        Read By Type Request (0x08)
        Handle: 0x0012
        Error: Attribute Not Found (0x0a)
bluetoothd[2915165]: < ACL Data TX: H.. flags 0x00 dlen 9  #99 [hci0] 41.137567
      ATT: Write Request (0x12) len 4
        Handle: 0x000b Type: Client Characteristic Configuration (0x2902)
        Value Handle: 0x000a Type: Service Changed (0x2a05)
          Data: 0200
            Indication (0x02)
> HCI Event: Number of Completed Packets (0x13) plen 5    #100 [hci0] 41.177728
        Num handles: 1
        Handle: 2048 Address: C0:DE:54:15:00:51 (Static)
        Count: 1
        #99: len 9 (1 Kb/s)
        Latency: 40 msec (40-89 msec ~41 msec)
> ACL Data RX: Handle 2048 flags 0x02 dlen 5              #101 [hci0] 41.268735
      ATT: Write Response (0x13) len 0
bluetoothd[2915165]: < ACL Data TX:... flags 0x00 dlen 7  #102 [hci0] 41.268985
      ATT: Read Request (0x0a) len 2
        Handle: 0x0003 Type: Device Name (0x2a00)
> HCI Event: Number of Completed Packets (0x13) plen 5    #103 [hci0] 41.312540
        Num handles: 1
        Handle: 2048 Address: C0:DE:54:15:00:51 (Static)
        Count: 1
        #102: len 7 (1 Kb/s)
        Latency: 43 msec (40-89 msec ~42 msec)
> ACL Data RX: Handle 2048 flags 0x02 dlen 11             #104 [hci0] 41.313731
      ATT: Handle Value Indication (0x1d) len 6
        Handle: 0x000a Type: Service Changed (0x2a05)
          Data: 0100ffff
bluetoothd[2915165]: < ACL Data TX:... flags 0x00 dlen 5  #105 [hci0] 41.313845
      ATT: Handle Value Confirmation (0x1e) len 0
> HCI Event: Number of Completed Packets (0x13) plen 5    #106 [hci0] 41.357545
        Num handles: 1
        Handle: 2048 Address: C0:DE:54:15:00:51 (Static)
        Count: 1
        #105: len 5 (0 Kb/s)
        Latency: 43 msec (40-89 msec ~43 msec)
> ACL Data RX: Handle 2048 flags 0x02 dlen 22             #107 [hci0] 41.358729
      ATT: Read Response (0x0b) len 17
bluetoothd[2915165]: < ACL Data TX:... flags 0x00 dlen 7  #108 [hci0] 41.358911
      ATT: Read Request (0x0a) len 2
        Handle: 0x0005 Type: Appearance (0x2a01)
> HCI Event: Number of Completed Packets (0x13) plen 5    #109 [hci0] 41.402550
        Num handles: 1
        Handle: 2048 Address: C0:DE:54:15:00:51 (Static)
        Count: 1
        #108: len 7 (1 Kb/s)
        Latency: 43 msec (40-89 msec ~43 msec)
> ACL Data RX: Handle 2048 flags 0x02 dlen 7              #110 [hci0] 41.449731
      ATT: Read Response (0x0b) len 2
bluetoothd[2915165]: < ACL Data TX:... flags 0x00 dlen 7  #111 [hci0] 41.450196
      ATT: Read Request (0x0a) len 2
        Handle: 0x0012 Type: Battery Level (0x2a19)
> HCI Event: Number of Completed Packets (0x13) plen 5    #112 [hci0] 41.492630
        Num handles: 1
        Handle: 2048 Address: C0:DE:54:15:00:51 (Static)
        Count: 1
        #111: len 7 (1 Kb/s)
        Latency: 42 msec (40-89 msec ~42 msec)
> ACL Data RX: Handle 2048 flags 0x02 dlen 6              #113 [hci0] 41.538850
      ATT: Read Response (0x0b) len 1
bluetoothd[2915165]: < ACL Data TX:.. flags 0x00 dlen 11  #114 [hci0] 41.539064
      ATT: Read By Group Type Request (0x10) len 6
        Handle range: 0x0001-0xffff
        Attribute group type: Primary Service (0x2800)
> HCI Event: Number of Completed Packets (0x13) plen 5    #115 [hci0] 41.582554
        Num handles: 1
        Handle: 2048 Address: C0:DE:54:15:00:51 (Static)
        Count: 1
        #114: len 11 (2 Kb/s)
        Latency: 43 msec (40-89 msec ~43 msec)
> ACL Data RX: Handle 2048 flags 0x02 dlen 24             #116 [hci0] 41.629737
      ATT: Read By Group Type Response (0x11) len 19
        Attribute data length: 6
        Attribute group list: 3 entries
        Handle range: 0x0001-0x0007
        UUID: Generic Access Profile (0x1800)
        Handle range: 0x0008-0x000b
        UUID: Generic Attribute Profile (0x1801)
        Handle range: 0x0010-0x0013
        UUID: Battery Service (0x180f)
bluetoothd[2915165]: < ACL Data TX:... flags 0x00 dlen 9  #117 [hci0] 41.630050
      ATT: Write Request (0x12) len 4
        Handle: 0x0013 Type: Client Characteristic Configuration (0x2902)
        Value Handle: 0x0012 Type: Battery Level (0x2a19)
          Data: 0100
            Notification (0x01)
> HCI Event: Number of Completed Packets (0x13) plen 5    #118 [hci0] 41.672546
        Num handles: 1
        Handle: 2048 Address: C0:DE:54:15:00:51 (Static)
        Count: 1
        #117: len 9 (1 Kb/s)
        Latency: 42 msec (40-89 msec ~42 msec)
> ACL Data RX: Handle 2048 flags 0x02 dlen 5              #119 [hci0] 41.719735
      ATT: Write Response (0x13) len 0
bluetoothd[2915165]: < ACL Data TX:.. flags 0x00 dlen 11  #120 [hci0] 41.719987
      ATT: Read By Group Type Request (0x10) len 6
        Handle range: 0x0014-0xffff
        Attribute group type: Primary Service (0x2800)
> HCI Event: Number of Completed Packets (0x13) plen 5    #121 [hci0] 41.762553
        Num handles: 1
        Handle: 2048 Address: C0:DE:54:15:00:51 (Static)
        Count: 1
        #120: len 11 (2 Kb/s)
        Latency: 42 msec (40-89 msec ~42 msec)
> ACL Data RX: Handle 2048 flags 0x02 dlen 8              #122 [hci0] 41.763745
      ATT: Handle Value Notification (0x1b) len 3
        Handle: 0x0012 Type: Battery Level (0x2a19)
          Data: 60
> ACL Data RX: Handle 2048 flags 0x02 dlen 9              #123 [hci0] 41.809730
      ATT: Error Response (0x01) len 4
        Read By Group Type Request (0x10)
        Handle: 0x0014
        Error: Attribute Not Found (0x0a)
bluetoothctl[1375177]: @ MGMT Close: bluetoothctl            {0x0003} 46.460431
bluetoothctl[1375957]: @ MGMT Open: bluetoot.. version 1.23  {0x0003} 46.471624
> HCI Event: Inquiry Complete (0x01) plen 1               #124 [hci0] 48.809808
        Status: Success (0x00)
@ MGMT Event: Discovering (0x0013) plen 2             {0x0001} [hci0] 48.809844
        Address type: 0x01
          BR/EDR
        Discovery: Disabled (0x00)
bluetoothd[2915165]: @ MGMT Comman.. (0x003a) plen 4  {0x0001} [hci0] 48.810155
        Address type: 0x01
          BR/EDR
        RSSI: invalid (0x7f)
        UUIDs: 0
< HCI Command: Inquiry (0x01|0x0001) plen 5               #125 [hci0] 48.810344
        Access code: 0x9e8b33 (General Inquiry)
        Length: 10.24s (0x08)
        Num responses: 0
> HCI Event: Command Status (0x0f) plen 4                 #126 [hci0] 48.811704
      Inquiry (0x01|0x0001) ncmd 1
        Status: Success (0x00)
@ MGMT Event: Command Complete (0x0001) plen 4        {0x0001} [hci0] 48.811994
      Start Service Discovery (0x003a) plen 1
        Status: Success (0x00)
        Address type: 0x01
          BR/EDR
@ MGMT Event: Discovering (0x0013) plen 2             {0x0001} [hci0] 48.812005
        Address type: 0x01
          BR/EDR
        Discovery: Enabled (0x01)
bluetoothctl[1375957]: @ MGMT Close: bluetoothctl            {0x0003} 54.486426
bluetoothctl[1376635]: @ MGMT Open: bluetoot.. version 1.23  {0x0003} 54.500374
bluetoothd[2915165]: @ MGMT Comman.. (0x0024) plen 1  {0x0001} [hci0] 54.504179
        Address type: 0x01
          BR/EDR
< HCI Command: Inquiry Cancel (0x01|0x0002) plen 0        #127 [hci0] 54.504193
> HCI Event: Command Complete (0x0e) plen 4               #128 [hci0] 54.505825
      Inquiry Cancel (0x01|0x0002) ncmd 1
        Status: Success (0x00)
@ MGMT Event: Discovering (0x0013) plen 2             {0x0001} [hci0] 54.505833
        Address type: 0x01
          BR/EDR
        Discovery: Disabled (0x00)
@ MGMT Event: Command Complete (0x0001) plen 4        {0x0001} [hci0] 54.505838
      Stop Discovery (0x0024) plen 1
        Status: Success (0x00)
        Address type: 0x01
          BR/EDR
bluetoothd[2915165]: @ MGMT Comman.. (0x0019) plen 8  {0x0001} [hci0] 54.505898
        LE Address: C0:DE:54:15:00:51 (Static)
        Capability: DisplayYesNo (0x01)
< ACL Data TX: Handle 2048 flags 0x00 dlen 11             #129 [hci0] 54.505921
      SMP: Pairing Request (0x01) len 6
        IO capability: DisplayYesNo (0x01)
        OOB data: Authentication data not present (0x00)
        Authentication requirement: Bonding, MITM, SC, No Keypresses, CT2 (0x2d)
        Max encryption key size: 16
        Initiator key distribution: EncKey Sign LinkKey (0x0d)
        Responder key distribution: EncKey IdKey Sign LinkKey (0x0f)
> HCI Event: Number of Completed Packets (0x13) plen 5    #130 [hci0] 54.542831
        Num handles: 1
        Handle: 2048 Address: C0:DE:54:15:00:51 (Static)
        Count: 1
        #129: len 11 (2 Kb/s)
        Latency: 36 msec (36-89 msec ~39 msec)
> ACL Data RX: Handle 2048 flags 0x02 dlen 11             #131 [hci0] 54.589733
      SMP: Pairing Response (0x02) len 6
        IO capability: NoInputNoOutput (0x03)
        OOB data: Authentication data not present (0x00)
        Authentication requirement: Bonding, No MITM, Legacy, No Keypresses (0x01)
        Max encryption key size: 16
        Initiator key distribution: EncKey (0x01)
        Responder key distribution: <none> (0x00)
@ MGMT Event: User Confirmation R.. (0x000f) plen 12  {0x0001} [hci0] 54.589755
        LE Address: C0:DE:54:15:00:51 (Static)
        Confirm hint: 0x01
        Value: 0x00000000
bluetoothd[2915165]: @ MGMT Comman.. (0x001c) plen 7  {0x0001} [hci0] 54.589858
        LE Address: C0:DE:54:15:00:51 (Static)
@ MGMT Event: Command Complete (0x0001) plen 10       {0x0001} [hci0] 54.589867
      User Confirmation Reply (0x001c) plen 7
        Status: Success (0x00)
        LE Address: C0:DE:54:15:00:51 (Static)
< ACL Data TX: Handle 2048 flags 0x00 dlen 21             #132 [hci0] 54.589868
      SMP: Pairing Confirm (0x03) len 16
        Confim value: 57e4c5342a54ff7975b9de2de0424cb2
> HCI Event: Number of Completed Packets (0x13) plen 5    #133 [hci0] 54.632839
        Num handles: 1
        Handle: 2048 Address: C0:DE:54:15:00:51 (Static)
        Count: 1
        #132: len 21 (4 Kb/s)
        Latency: 42 msec (36-89 msec ~41 msec)
> ACL Data RX: Handle 2048 flags 0x02 dlen 21             #134 [hci0] 54.723733
      SMP: Pairing Confirm (0x03) len 16
        Confim value: eaca110752f4b4e78f0c7444c112f857
< ACL Data TX: Handle 2048 flags 0x00 dlen 21             #135 [hci0] 54.723759
      SMP: Pairing Random (0x04) len 16
        Random value: f42fa51800c66803c75eee26a119828b
> HCI Event: Number of Completed Packets (0x13) plen 5    #136 [hci0] 54.857939
        Num handles: 1
        Handle: 2048 Address: C0:DE:54:15:00:51 (Static)
        Count: 1
        #135: len 21 (1 Kb/s)
        Latency: 134 msec (36-134 msec ~87 msec)
> ACL Data RX: Handle 2048 flags 0x02 dlen 21             #137 [hci0] 54.903736
      SMP: Pairing Random (0x04) len 16
        Random value: 2673ec274a231d53d69d62769469e214
< HCI Command: LE Start Encryption (0x08|0x0019) plen 28  #138 [hci0] 54.903753
        Handle: 2048 Address: C0:DE:54:15:00:51 (Static)
        Random number: 0x0000000000000000
        Encrypted diversifier: 0x0000
        Long term key: 808a46cc92007c8646c33199069bbfdd
> HCI Event: Command Status (0x0f) plen 4                 #139 [hci0] 54.904829
      LE Start Encryption (0x08|0x0019) ncmd 1
        Status: Success (0x00)
> HCI Event: Encryption Change (0x08) plen 4              #140 [hci0] 55.307849
        Status: Connection Timeout (0x08)
        Handle: 2048 Address: C0:DE:54:15:00:51 (Static)
        Encryption: Disabled (0x00)
@ MGMT Event: Command Complete (0x0001) plen 10       {0x0001} [hci0] 55.308038
      Pair Device (0x0019) plen 7
        Status: Timeout (0x08)
        LE Address: C0:DE:54:15:00:51 (Static)
< HCI Command: Disconnect (0x01|0x0006) plen 3            #141 [hci0] 55.308273
        Handle: 2048 Address: C0:DE:54:15:00:51 (Static)
        Reason: Authentication Failure (0x05)
> HCI Event: Disconnect Complete (0x05) plen 4            #142 [hci0] 55.308836
        Status: Success (0x00)
        Handle: 2048 Address: C0:DE:54:15:00:51 (Static)
        Reason: Connection Timeout (0x08)
@ MGMT Event: Device Disconnected (0x000c) plen 8     {0x0001} [hci0] 55.308984
        LE Address: C0:DE:54:15:00:51 (Static)
        Reason: Connection timeout (0x01)
> HCI Event: Command Status (0x0f) plen 4                 #143 [hci0] 55.309837
      Disconnect (0x01|0x0006) ncmd 1
        Status: Unknown Connection Identifier (0x02)
bluetoothd[2915165]: @ MGMT Comman.. (0x003a) plen 4  {0x0001} [hci0] 60.725965
        Address type: 0x01
          BR/EDR
        RSSI: invalid (0x7f)
        UUIDs: 0
< HCI Command: Inquiry (0x01|0x0001) plen 5               #144 [hci0] 60.726121
        Access code: 0x9e8b33 (General Inquiry)
        Length: 10.24s (0x08)
        Num responses: 0
> HCI Event: Command Status (0x0f) plen 4                 #145 [hci0] 60.820960
      Inquiry (0x01|0x0001) ncmd 1
        Status: Success (0x00)
@ MGMT Event: Command Complete (0x0001) plen 4        {0x0001} [hci0] 60.820989
      Start Service Discovery (0x003a) plen 1
        Status: Success (0x00)
        Address type: 0x01
          BR/EDR
@ MGMT Event: Discovering (0x0013) plen 2             {0x0001} [hci0] 60.820998
        Address type: 0x01
          BR/EDR
        Discovery: Enabled (0x01)
bluetoothctl[1376635]: @ MGMT Close: bluetoothctl            {0x0003} 66.506932
bluetoothctl[1377776]: @ MGMT Open: bluetoot.. version 1.23  {0x0003} 66.512880
> HCI Event: Inquiry Complete (0x01) plen 1               #146 [hci0] 71.127182
        Status: Success (0x00)
@ MGMT Event: Discovering (0x0013) plen 2             {0x0001} [hci0] 71.127291
        Address type: 0x01
          BR/EDR
        Discovery: Disabled (0x00)
bluetoothd[2915165]: @ MGMT Comman.. (0x003a) plen 4  {0x0001} [hci0] 71.127539
        Address type: 0x01
          BR/EDR
        RSSI: invalid (0x7f)
        UUIDs: 0
< HCI Command: Inquiry (0x01|0x0001) plen 5               #147 [hci0] 71.127551
        Access code: 0x9e8b33 (General Inquiry)
        Length: 10.24s (0x08)
        Num responses: 0
> HCI Event: Command Status (0x0f) plen 4                 #148 [hci0] 71.128170
      Inquiry (0x01|0x0001) ncmd 1
        Status: Success (0x00)
@ MGMT Event: Command Complete (0x0001) plen 4        {0x0001} [hci0] 71.128282
      Start Service Discovery (0x003a) plen 1
        Status: Success (0x00)
        Address type: 0x01
          BR/EDR
@ MGMT Event: Discovering (0x0013) plen 2             {0x0001} [hci0] 71.128286
        Address type: 0x01
          BR/EDR
        Discovery: Enabled (0x01)
bluetoothctl[1377776]: @ MGMT Close: bluetoothctl            {0x0003} 74.522215
> HCI Event: Inquiry Complete (0x01) plen 1               #149 [hci0] 81.433410
        Status: Success (0x00)
@ MGMT Event: Discovering (0x0013) plen 2             {0x0001} [hci0] 81.433560
        Address type: 0x01
          BR/EDR
        Discovery: Disabled (0x00)
bluetoothd[2915165]: @ MGMT Comman.. (0x003a) plen 4  {0x0001} [hci0] 81.433870
        Address type: 0x01
          BR/EDR
        RSSI: invalid (0x7f)
        UUIDs: 0
< HCI Command: Inquiry (0x01|0x0001) plen 5               #150 [hci0] 81.433986
        Access code: 0x9e8b33 (General Inquiry)
        Length: 10.24s (0x08)
        Num responses: 0
> HCI Event: Command Status (0x0f) plen 4                 #151 [hci0] 81.435386
      Inquiry (0x01|0x0001) ncmd 1
        Status: Success (0x00)
@ MGMT Event: Command Complete (0x0001) plen 4        {0x0001} [hci0] 81.435539
      Start Service Discovery (0x003a) plen 1
        Status: Success (0x00)
        Address type: 0x01
          BR/EDR
@ MGMT Event: Discovering (0x0013) plen 2             {0x0001} [hci0] 81.435547
        Address type: 0x01
          BR/EDR
        Discovery: Enabled (0x01)
bluetoothctl[1379234]: @ MGMT Open: bluetoot.. version 1.23  {0x0003} 82.537581
bluetoothctl[1379234]: @ MGMT Close: bluetoothctl            {0x0003} 90.556897
bluetoothctl[1379969]: @ MGMT Open: bluetoot.. version 1.23  {0x0003} 90.561506
> HCI Event: Inquiry Complete (0x01) plen 1               #152 [hci0] 91.738608
        Status: Success (0x00)
@ MGMT Event: Discovering (0x0013) plen 2             {0x0001} [hci0] 91.738737
        Address type: 0x01
          BR/EDR
        Discovery: Disabled (0x00)
bluetoothd[2915165]: @ MGMT Comman.. (0x003a) plen 4  {0x0001} [hci0] 91.738939
        Address type: 0x01
          BR/EDR
        RSSI: invalid (0x7f)
        UUIDs: 0
< HCI Command: Inquiry (0x01|0x0001) plen 5               #153 [hci0] 91.739074
        Access code: 0x9e8b33 (General Inquiry)
        Length: 10.24s (0x08)
        Num responses: 0
> HCI Event: Command Status (0x0f) plen 4                 #154 [hci0] 91.739601
      Inquiry (0x01|0x0001) ncmd 1
        Status: Success (0x00)
@ MGMT Event: Command Complete (0x0001) plen 4        {0x0001} [hci0] 91.739733
      Start Service Discovery (0x003a) plen 1
        Status: Success (0x00)
        Address type: 0x01
          BR/EDR
@ MGMT Event: Discovering (0x0013) plen 2             {0x0001} [hci0] 91.739744
        Address type: 0x01
          BR/EDR
        Discovery: Enabled (0x01)
