Bluetooth monitor ver 5.72
btmon[2388796]: = Note: Linux version 6.17.0-14-generic (x86_64)       0.483899
btmon[2388796]: = Note: Bluetooth subsystem version 2.22               0.483901
= New Index: 68:34:21:E5:84:DF (Primary,USB,hci0)               [hci0] 0.483902
= Open Index: 68:34:21:E5:84:DF                                 [hci0] 0.483903
= Index Info: 68:34:21:E5:84:DF (Intel Corp.)                   [hci0] 0.483903
bluetoothd[2915165]: @ MGMT Open.. (privileged) version 1.23  {0x0001} 0.483903
bluetoothctl[2388953]: @ MGMT Open: bluetooth.. version 1.23  {0x0002} 2.485695
bluetoothctl[2388953]: @ MGMT Close: bluetoothctl             {0x0002} 2.493410
bluetoothctl[2388954]: @ MGMT Open: bluetooth.. version 1.23  {0x0002} 2.499000
bluetoothd[2915165]: @ MGMT Command.. (0x0024) plen 1  {0x0001} [hci0] 2.502309
        Address type: 0x01
          BR/EDR
< HCI Command: Inquiry Cancel (0x01|0x0002) plen 0           #1 [hci0] 2.502324
> HCI Event: Command Complete (0x0e) plen 4                  #2 [hci0] 2.597038
      Inquiry Cancel (0x01|0x0002) ncmd 1
        Status: Success (0x00)
@ MGMT Event: Discovering (0x0013) plen 2              {0x0001} [hci0] 2.597060
        Address type: 0x01
          BR/EDR
        Discovery: Disabled (0x00)
@ MGMT Event: Command Complete (0x0001) plen 4         {0x0001} [hci0] 2.597182
      Stop Discovery (0x0024) plen 1
        Status: Success (0x00)
        Address type: 0x01
          BR/EDR
bluetoothd[2915165]: @ MGMT Command.. (0x003a) plen 4  {0x0001} [hci0] 2.597199
        Address type: 0x07
          BR/EDR
          LE Public
          LE Random
        RSSI: invalid (0x7f)
        UUIDs: 0
< HCI Command: LE Set Address Resolu.. (0x08|0x002d) plen 1  #3 [hci0] 2.597226
        Address resolution: Disabled (0x00)
> HCI Event: Command Complete (0x0e) plen 4                  #4 [hci0] 2.598018
      LE Set Address Resolution Enable (0x08|0x002d) ncmd 1
        Status: Success (0x00)
< HCI Command: LE Set Random Address (0x08|0x0005) plen 6    #5 [hci0] 2.598114
        Address: 02:4C:C2:E7:46:3F (Non-Resolvable)
> HCI Event: Command Complete (0x0e) plen 4                  #6 [hci0] 2.599022
      LE Set Random Address (0x08|0x0005) ncmd 1
        Status: Success (0x00)
< HCI Command: LE Set Extended Scan.. (0x08|0x0041) plen 13  #7 [hci0] 2.599120
        Own address type: Random (0x01)
        Filter policy: Accept all advertisement (0x00)
        PHYs: 0x05
        Entry 0: LE 1M
          Type: Active (0x01)
          Interval: 22.500 msec (0x0024)
          Window: 11.250 msec (0x0012)
        Entry 1: LE Coded
          Type: Active (0x01)
          Interval: 67.500 msec (0x006c)
          Window: 33.750 msec (0x0036)
> HCI Event: Command Complete (0x0e) plen 4                  #8 [hci0] 2.600022
      LE Set Extended Scan Parameters (0x08|0x0041) ncmd 1
        Status: Success (0x00)
< HCI Command: LE Set Extended Scan... (0x08|0x0042) plen 6  #9 [hci0] 2.600158
        Extended scan: Enabled (0x01)
        Filter duplicates: Disabled (0x00)
        Duration: 0 msec (0x0000)
        Period: 0.00 sec (0x0000)
> HCI Event: Command Complete (0x0e) plen 4                 #10 [hci0] 2.601022
      LE Set Extended Scan Enable (0x08|0x0042) ncmd 1
        Status: Success (0x00)
@ MGMT Event: Discovering (0x0013) plen 2              {0x0001} [hci0] 2.601031
        Address type: 0x07
          BR/EDR
          LE Public
          LE Random
        Discovery: Enabled (0x01)
< HCI Command: Inquiry (0x01|0x0001) plen 5                 #11 [hci0] 2.601153
        Access code: 0x9e8b33 (General Inquiry)
        Length: 10.24s (0x08)
        Num responses: 0
> HCI Event: Command Status (0x0f) plen 4                   #12 [hci0] 2.613115
      Inquiry (0x01|0x0001) ncmd 1
        Status: Success (0x00)
@ MGMT Event: Command Complete (0x0001) plen 4         {0x0001} [hci0] 2.613364
      Start Service Discovery (0x003a) plen 1
        Status: Success (0x00)
        Address type: 0x07
          BR/EDR
          LE Public
          LE Random
> HCI Event: LE Meta Event (0x3e) plen 34                   #13 [hci0] 3.854179
      LE Extended Advertising Report (0x0d)
        Num reports: 1
        Entry 0
          Event type: 0x0010
            Props: 0x0010
              Use legacy advertising PDUs
            Data status: [0;32mComplete[0m
          Legacy PDU Type: ADV_NONCONN_IND (0x0010)
          Address type: Random (0x01)
          Address: ED:33:C9:77:FB:26 (Static)
          Primary PHY: LE 1M
          Secondary PHY: No packets
          SID: no ADI field (0xff)
          TX power: 127 dBm
          RSSI: -85 dBm (0xab)
          Periodic advertising interval: 0.00 msec (0x0000)
          Direct address type: Public (0x00)
          Direct address: 00:00:00:00:00:00 (OUI 00-00-00)
          Data length: 0x08
        07 ff 4c 00 12 02 00 01                          ..L.....        
        Company: Apple, Inc. (76)
          Type: Unknown (18)
          Data: 0001
@ MGMT Event: Device Found (0x0012) plen 22            {0x0001} [hci0] 3.854278
        LE Address: ED:33:C9:77:FB:26 (Static)
        RSSI: -85 dBm (0xab)
        Flags: 0x00000004
          Not Connectable
        Data length: 8
        Company: Apple, Inc. (76)
          Type: Unknown (18)
          Data: 0001
> HCI Event: LE Meta Event (0x3e) plen 39                   #14 [hci0] 4.320196
      LE Extended Advertising Report (0x0d)
        Num reports: 1
        Entry 0
          Event type: 0x0013
            Props: 0x0013
              Connectable
              Scannable
              Use legacy advertising PDUs
            Data status: [0;32mComplete[0m
          Legacy PDU Type: ADV_IND (0x0013)
          Address type: Random (0x01)
          Address: C0:DE:54:15:00:51 (Static)
          Primary PHY: LE 1M
          Secondary PHY: No packets
          SID: no ADI field (0xff)
          TX power: 127 dBm
          RSSI: -82 dBm (0xae)
          Periodic advertising interval: 0.00 msec (0x0000)
          Direct address type: Public (0x00)
          Direct address: 00:00:00:00:00:00 (OUI 00-00-00)
          Data length: 0x0d
        02 01 06 09 09 58 35 34 2d 50 41 49 52           .....X54-PAIR   
        Flags: 0x06
          LE General Discoverable Mode
          BR/EDR Not Supported
        Name (complete): X54-PAIR
> HCI Event: LE Meta Event (0x3e) plen 57                   #15 [hci0] 4.501196
      LE Extended Advertising Report (0x0d)
        Num reports: 1
        Entry 0
          Event type: 0x0010
            Props: 0x0010
              Use legacy advertising PDUs
            Data status: [0;32mComplete[0m
          Legacy PDU Type: ADV_NONCONN_IND (0x0010)
          Address type: Random (0x01)
          Address: 5F:B1:D6:AA:D5:5B (Resolvable)
          Primary PHY: LE 1M
          Secondary PHY: No packets
          SID: no ADI field (0xff)
          TX power: 127 dBm
          RSSI: -90 dBm (0xa6)
          Periodic advertising interval: 0.00 msec (0x0000)
          Direct address type: Public (0x00)
          Direct address: 00:00:00:00:00:00 (OUI 00-00-00)
          Data length: 0x1f
        1e ff 06 00 01 09 20 02 0d 51 ad 90 ff 56 23 ff  ...... ..Q...V#.
        9c 41 0c e4 53 42 f3 e7 97 7c 51 a9 c3 68 1a     .A..SB...|Q..h. 
        Company: Microsoft (6)
          Data: 010920020d51ad90ff5623ff9c410ce45342f3e7977c51a9c3681a
@ MGMT Event: Device Found (0x0012) plen 27            {0x0001} [hci0] 4.501217
        LE Address: C0:DE:54:15:00:51 (Static)
        RSSI: -82 dBm (0xae)
        Flags: 0x00000000
        Data length: 13
        Flags: 0x06
          LE General Discoverable Mode
          BR/EDR Not Supported
        Name (complete): X54-PAIR
@ MGMT Event: Device Found (0x0012) plen 45            {0x0001} [hci0] 4.501223
        LE Address: 5F:B1:D6:AA:D5:5B (Resolvable)
        RSSI: -90 dBm (0xa6)
        Flags: 0x00000004
          Not Connectable
        Data length: 31
        Company: Microsoft (6)
          Data: 010920020d51ad90ff5623ff9c410ce45342f3e7977c51a9c3681a
> HCI Event: LE Meta Event (0x3e) plen 57                   #16 [hci0] 5.123236
      LE Extended Advertising Report (0x0d)
        Num reports: 1
        Entry 0
          Event type: 0x0010
            Props: 0x0010
              Use legacy advertising PDUs
            Data status: [0;32mComplete[0m
          Legacy PDU Type: ADV_NONCONN_IND (0x0010)
          Address type: Random (0x01)
          Address: 5F:B1:D6:AA:D5:5B (Resolvable)
          Primary PHY: LE 1M
          Secondary PHY: No packets
          SID: no ADI field (0xff)
          TX power: 127 dBm
          RSSI: -95 dBm (0xa1)
          Periodic advertising interval: 0.00 msec (0x0000)
          Direct address type: Public (0x00)
          Direct address: 00:00:00:00:00:00 (OUI 00-00-00)
          Data length: 0x1f
        1e ff 06 00 01 09 20 02 0d 51 ad 90 ff 56 23 ff  ...... ..Q...V#.
        9c 41 0c e4 53 42 f3 e7 97 7c 51 a9 c3 68 1a     .A..SB...|Q..h. 
        Company: Microsoft (6)
          Data: 010920020d51ad90ff5623ff9c410ce45342f3e7977c51a9c3681a
@ MGMT Event: Device Found (0x0012) plen 45            {0x0001} [hci0] 5.123391
        LE Address: 5F:B1:D6:AA:D5:5B (Resolvable)
        RSSI: -95 dBm (0xa1)
        Flags: 0x00000004
          Not Connectable
        Data length: 31
        Company: Microsoft (6)
          Data: 010920020d51ad90ff5623ff9c410ce45342f3e7977c51a9c3681a
> HCI Event: LE Meta Event (0x3e) plen 57                   #17 [hci0] 6.056255
      LE Extended Advertising Report (0x0d)
        Num reports: 1
        Entry 0
          Event type: 0x0010
            Props: 0x0010
              Use legacy advertising PDUs
            Data status: [0;32mComplete[0m
          Legacy PDU Type: ADV_NONCONN_IND (0x0010)
          Address type: Random (0x01)
          Address: 5F:B1:D6:AA:D5:5B (Resolvable)
          Primary PHY: LE 1M
          Secondary PHY: No packets
          SID: no ADI field (0xff)
          TX power: 127 dBm
          RSSI: -92 dBm (0xa4)
          Periodic advertising interval: 0.00 msec (0x0000)
          Direct address type: Public (0x00)
          Direct address: 00:00:00:00:00:00 (OUI 00-00-00)
          Data length: 0x1f
        1e ff 06 00 01 09 20 02 0d 51 ad 90 ff 56 23 ff  ...... ..Q...V#.
        9c 41 0c e4 53 42 f3 e7 97 7c 51 a9 c3 68 1a     .A..SB...|Q..h. 
        Company: Microsoft (6)
          Data: 010920020d51ad90ff5623ff9c410ce45342f3e7977c51a9c3681a
@ MGMT Event: Device Found (0x0012) plen 45            {0x0001} [hci0] 6.056284
        LE Address: 5F:B1:D6:AA:D5:5B (Resolvable)
        RSSI: -92 dBm (0xa4)
        Flags: 0x00000004
          Not Connectable
        Data length: 31
        Company: Microsoft (6)
          Data: 010920020d51ad90ff5623ff9c410ce45342f3e7977c51a9c3681a
> HCI Event: LE Meta Event (0x3e) plen 39                   #18 [hci0] 6.529288
      LE Extended Advertising Report (0x0d)
        Num reports: 1
        Entry 0
          Event type: 0x0013
            Props: 0x0013
              Connectable
              Scannable
              Use legacy advertising PDUs
            Data status: [0;32mComplete[0m
          Legacy PDU Type: ADV_IND (0x0013)
          Address type: Random (0x01)
          Address: C0:DE:54:15:00:51 (Static)
          Primary PHY: LE 1M
          Secondary PHY: No packets
          SID: no ADI field (0xff)
          TX power: 127 dBm
          RSSI: -82 dBm (0xae)
          Periodic advertising interval: 0.00 msec (0x0000)
          Direct address type: Public (0x00)
          Direct address: 00:00:00:00:00:00 (OUI 00-00-00)
          Data length: 0x0d
        02 01 06 09 09 58 35 34 2d 50 41 49 52           .....X54-PAIR   
        Flags: 0x06
          LE General Discoverable Mode
          BR/EDR Not Supported
        Name (complete): X54-PAIR
> HCI Event: LE Meta Event (0x3e) plen 57                   #19 [hci0] 7.091314
      LE Extended Advertising Report (0x0d)
        Num reports: 1
        Entry 0
          Event type: 0x0010
            Props: 0x0010
              Use legacy advertising PDUs
            Data status: [0;32mComplete[0m
          Legacy PDU Type: ADV_NONCONN_IND (0x0010)
          Address type: Random (0x01)
          Address: D9:08:D5:69:61:41 (Static)
          Primary PHY: LE 1M
          Secondary PHY: No packets
          SID: no ADI field (0xff)
          TX power: 127 dBm
          RSSI: -87 dBm (0xa9)
          Periodic advertising interval: 0.00 msec (0x0000)
          Direct address type: Public (0x00)
          Direct address: 00:00:00:00:00:00 (OUI 00-00-00)
          Data length: 0x1f
        1e ff 4c 00 12 19 00 24 33 7a cb 50 39 c8 a0 b4  ..L....$3z.P9...
        b2 f2 de 88 5e ac 5a 2f d9 ef 26 0b 45 00 00     ....^.Z/..&.E.. 
        Company: Apple, Inc. (76)
          Type: Unknown (18)
          Data: 0024337acb5039c8a0b4b2f2de885eac5a2fd9ef260b450000
@ MGMT Event: Device Found (0x0012) plen 27            {0x0001} [hci0] 7.091342
        LE Address: C0:DE:54:15:00:51 (Static)
        RSSI: -82 dBm (0xae)
        Flags: 0x00000000
        Data length: 13
        Flags: 0x06
          LE General Discoverable Mode
          BR/EDR Not Supported
        Name (complete): X54-PAIR
@ MGMT Event: Device Found (0x0012) plen 45            {0x0001} [hci0] 7.091349
        LE Address: D9:08:D5:69:61:41 (Static)
        RSSI: -87 dBm (0xa9)
        Flags: 0x00000004
          Not Connectable
        Data length: 31
        Company: Apple, Inc. (76)
          Type: Unknown (18)
          Data: 0024337acb5039c8a0b4b2f2de885eac5a2fd9ef260b450000
> HCI Event: LE Meta Event (0x3e) plen 57                   #20 [hci0] 7.727383
      LE Extended Advertising Report (0x0d)
        Num reports: 1
        Entry 0
          Event type: 0x0010
            Props: 0x0010
              Use legacy advertising PDUs
            Data status: [0;32mComplete[0m
          Legacy PDU Type: ADV_NONCONN_IND (0x0010)
          Address type: Random (0x01)
          Address: 5F:B1:D6:AA:D5:5B (Resolvable)
          Primary PHY: LE 1M
          Secondary PHY: No packets
          SID: no ADI field (0xff)
          TX power: 127 dBm
          RSSI: -92 dBm (0xa4)
          Periodic advertising interval: 0.00 msec (0x0000)
          Direct address type: Public (0x00)
          Direct address: 00:00:00:00:00:00 (OUI 00-00-00)
          Data length: 0x1f
        1e ff 06 00 01 09 20 02 0d 51 ad 90 ff 56 23 ff  ...... ..Q...V#.
        9c 41 0c e4 53 42 f3 e7 97 7c 51 a9 c3 68 1a     .A..SB...|Q..h. 
        Company: Microsoft (6)
          Data: 010920020d51ad90ff5623ff9c410ce45342f3e7977c51a9c3681a
@ MGMT Event: Device Found (0x0012) plen 45            {0x0001} [hci0] 7.727552
        LE Address: 5F:B1:D6:AA:D5:5B (Resolvable)
        RSSI: -92 dBm (0xa4)
        Flags: 0x00000004
          Not Connectable
        Data length: 31
        Company: Microsoft (6)
          Data: 010920020d51ad90ff5623ff9c410ce45342f3e7977c51a9c3681a
> HCI Event: LE Meta Event (0x3e) plen 43                   #21 [hci0] 7.856301
      LE Extended Advertising Report (0x0d)
        Num reports: 1
        Entry 0
          Event type: 0x0013
            Props: 0x0013
              Connectable
              Scannable
              Use legacy advertising PDUs
            Data status: [0;32mComplete[0m
          Legacy PDU Type: ADV_IND (0x0013)
          Address type: Random (0x01)
          Address: 77:97:32:85:74:A1 (Resolvable)
          Primary PHY: LE 1M
          Secondary PHY: No packets
          SID: no ADI field (0xff)
          TX power: 127 dBm
          RSSI: -97 dBm (0x9f)
          Periodic advertising interval: 0.00 msec (0x0000)
          Direct address type: Public (0x00)
          Direct address: 00:00:00:00:00:00 (OUI 00-00-00)
          Data length: 0x11
        02 01 1a 02 0a 0c 0a ff 4c 00 10 05 3a 1c 19 e3  ........L...:...
        a2                                               .               
        Flags: 0x1a
          LE General Discoverable Mode
          Simultaneous LE and BR/EDR (Controller)
          Simultaneous LE and BR/EDR (Host)
        TX power: 12 dBm
        Company: Apple, Inc. (76)
          Type: Unknown (16)
          Data: 3a1c19e3a2
> HCI Event: LE Meta Event (0x3e) plen 26                   #22 [hci0] 7.857317
      LE Extended Advertising Report (0x0d)
        Num reports: 1
        Entry 0
          Event type: 0x001b
            Props: 0x001b
              Connectable
              Scannable
              Scan response
              Use legacy advertising PDUs
            Data status: [0;32mComplete[0m
          Legacy PDU Type: SCAN_RSP to an ADV_SCAN_IND (0x001b)
          Address type: Random (0x01)
          Address: 77:97:32:85:74:A1 (Resolvable)
          Primary PHY: LE 1M
          Secondary PHY: No packets
          SID: no ADI field (0xff)
          TX power: 127 dBm
          RSSI: -97 dBm (0x9f)
          Periodic advertising interval: 0.00 msec (0x0000)
          Direct address type: Public (0x00)
          Direct address: 00:00:00:00:00:00 (OUI 00-00-00)
          Data length: 0x00
@ MGMT Event: Device Found (0x0012) plen 31            {0x0001} [hci0] 7.857408
        LE Address: 77:97:32:85:74:A1 (Resolvable)
        RSSI: -97 dBm (0x9f)
        Flags: 0x00000000
        Data length: 17
        Flags: 0x1a
          LE General Discoverable Mode
          Simultaneous LE and BR/EDR (Controller)
          Simultaneous LE and BR/EDR (Host)
        TX power: 12 dBm
        Company: Apple, Inc. (76)
          Type: Unknown (16)
          Data: 3a1c19e3a2
> HCI Event: LE Meta Event (0x3e) plen 57                   #23 [hci0] 7.934293
      LE Extended Advertising Report (0x0d)
        Num reports: 1
        Entry 0
          Event type: 0x0010
            Props: 0x0010
              Use legacy advertising PDUs
            Data status: [0;32mComplete[0m
          Legacy PDU Type: ADV_NONCONN_IND (0x0010)
          Address type: Random (0x01)
          Address: 5F:B1:D6:AA:D5:5B (Resolvable)
          Primary PHY: LE 1M
          Secondary PHY: No packets
          SID: no ADI field (0xff)
          TX power: 127 dBm
          RSSI: -92 dBm (0xa4)
          Periodic advertising interval: 0.00 msec (0x0000)
          Direct address type: Public (0x00)
          Direct address: 00:00:00:00:00:00 (OUI 00-00-00)
          Data length: 0x1f
        1e ff 06 00 01 09 20 02 0d 51 ad 90 ff 56 23 ff  ...... ..Q...V#.
        9c 41 0c e4 53 42 f3 e7 97 7c 51 a9 c3 68 1a     .A..SB...|Q..h. 
        Company: Microsoft (6)
          Data: 010920020d51ad90ff5623ff9c410ce45342f3e7977c51a9c3681a
@ MGMT Event: Device Found (0x0012) plen 45            {0x0001} [hci0] 7.934402
        LE Address: 5F:B1:D6:AA:D5:5B (Resolvable)
        RSSI: -92 dBm (0xa4)
        Flags: 0x00000004
          Not Connectable
        Data length: 31
        Company: Microsoft (6)
          Data: 010920020d51ad90ff5623ff9c410ce45342f3e7977c51a9c3681a
> HCI Event: LE Meta Event (0x3e) plen 43                   #24 [hci0] 9.226354
      LE Extended Advertising Report (0x0d)
        Num reports: 1
        Entry 0
          Event type: 0x0013
            Props: 0x0013
              Connectable
              Scannable
              Use legacy advertising PDUs
            Data status: [0;32mComplete[0m
          Legacy PDU Type: ADV_IND (0x0013)
          Address type: Random (0x01)
          Address: 77:97:32:85:74:A1 (Resolvable)
          Primary PHY: LE 1M
          Secondary PHY: No packets
          SID: no ADI field (0xff)
          TX power: 127 dBm
          RSSI: -98 dBm (0x9e)
          Periodic advertising interval: 0.00 msec (0x0000)
          Direct address type: Public (0x00)
          Direct address: 00:00:00:00:00:00 (OUI 00-00-00)
          Data length: 0x11
        02 01 1a 02 0a 0c 0a ff 4c 00 10 05 3a 1c 19 e3  ........L...:...
        a2                                               .               
        Flags: 0x1a
          LE General Discoverable Mode
          Simultaneous LE and BR/EDR (Controller)
          Simultaneous LE and BR/EDR (Host)
        TX power: 12 dBm
        Company: Apple, Inc. (76)
          Type: Unknown (16)
          Data: 3a1c19e3a2
> HCI Event: LE Meta Event (0x3e) plen 26                   #25 [hci0] 9.227230
      LE Extended Advertising Report (0x0d)
        Num reports: 1
        Entry 0
          Event type: 0x001b
            Props: 0x001b
              Connectable
              Scannable
              Scan response
              Use legacy advertising PDUs
            Data status: [0;32mComplete[0m
          Legacy PDU Type: SCAN_RSP to an ADV_SCAN_IND (0x001b)
          Address type: Random (0x01)
          Address: 77:97:32:85:74:A1 (Resolvable)
          Primary PHY: LE 1M
          Secondary PHY: No packets
          SID: no ADI field (0xff)
          TX power: 127 dBm
          RSSI: -96 dBm (0xa0)
          Periodic advertising interval: 0.00 msec (0x0000)
          Direct address type: Public (0x00)
          Direct address: 00:00:00:00:00:00 (OUI 00-00-00)
          Data length: 0x00
@ MGMT Event: Device Found (0x0012) plen 31            {0x0001} [hci0] 9.227237
        LE Address: 77:97:32:85:74:A1 (Resolvable)
        RSSI: -96 dBm (0xa0)
        Flags: 0x00000000
        Data length: 17
        Flags: 0x1a
          LE General Discoverable Mode
          Simultaneous LE and BR/EDR (Controller)
          Simultaneous LE and BR/EDR (Host)
        TX power: 12 dBm
        Company: Apple, Inc. (76)
          Type: Unknown (16)
          Data: 3a1c19e3a2
> HCI Event: LE Meta Event (0x3e) plen 57                   #26 [hci0] 9.312404
      LE Extended Advertising Report (0x0d)
        Num reports: 1
        Entry 0
          Event type: 0x0010
            Props: 0x0010
              Use legacy advertising PDUs
            Data status: [0;32mComplete[0m
          Legacy PDU Type: ADV_NONCONN_IND (0x0010)
          Address type: Random (0x01)
          Address: 5F:B1:D6:AA:D5:5B (Resolvable)
          Primary PHY: LE 1M
          Secondary PHY: No packets
          SID: no ADI field (0xff)
          TX power: 127 dBm
          RSSI: -92 dBm (0xa4)
          Periodic advertising interval: 0.00 msec (0x0000)
          Direct address type: Public (0x00)
          Direct address: 00:00:00:00:00:00 (OUI 00-00-00)
          Data length: 0x1f
        1e ff 06 00 01 09 20 02 0d 51 ad 90 ff 56 23 ff  ...... ..Q...V#.
        9c 41 0c e4 53 42 f3 e7 97 7c 51 a9 c3 68 1a     .A..SB...|Q..h. 
        Company: Microsoft (6)
          Data: 010920020d51ad90ff5623ff9c410ce45342f3e7977c51a9c3681a
@ MGMT Event: Device Found (0x0012) plen 45            {0x0001} [hci0] 9.312418
        LE Address: 5F:B1:D6:AA:D5:5B (Resolvable)
        RSSI: -92 dBm (0xa4)
        Flags: 0x00000004
          Not Connectable
        Data length: 31
        Company: Microsoft (6)
          Data: 010920020d51ad90ff5623ff9c410ce45342f3e7977c51a9c3681a
> HCI Event: LE Meta Event (0x3e) plen 57                   #27 [hci0] 9.612360
      LE Extended Advertising Report (0x0d)
        Num reports: 1
        Entry 0
          Event type: 0x0010
            Props: 0x0010
              Use legacy advertising PDUs
            Data status: [0;32mComplete[0m
          Legacy PDU Type: ADV_NONCONN_IND (0x0010)
          Address type: Random (0x01)
          Address: 5F:B1:D6:AA:D5:5B (Resolvable)
          Primary PHY: LE 1M
          Secondary PHY: No packets
          SID: no ADI field (0xff)
          TX power: 127 dBm
          RSSI: -93 dBm (0xa3)
          Periodic advertising interval: 0.00 msec (0x0000)
          Direct address type: Public (0x00)
          Direct address: 00:00:00:00:00:00 (OUI 00-00-00)
          Data length: 0x1f
        1e ff 06 00 01 09 20 02 0d 51 ad 90 ff 56 23 ff  ...... ..Q...V#.
        9c 41 0c e4 53 42 f3 e7 97 7c 51 a9 c3 68 1a     .A..SB...|Q..h. 
        Company: Microsoft (6)
          Data: 010920020d51ad90ff5623ff9c410ce45342f3e7977c51a9c3681a
@ MGMT Event: Device Found (0x0012) plen 45            {0x0001} [hci0] 9.612473
        LE Address: 5F:B1:D6:AA:D5:5B (Resolvable)
        RSSI: -93 dBm (0xa3)
        Flags: 0x00000004
          Not Connectable
        Data length: 31
        Company: Microsoft (6)
          Data: 010920020d51ad90ff5623ff9c410ce45342f3e7977c51a9c3681a
> HCI Event: LE Meta Event (0x3e) plen 39                  #28 [hci0] 10.864300
      LE Extended Advertising Report (0x0d)
        Num reports: 1
        Entry 0
          Event type: 0x0013
            Props: 0x0013
              Connectable
              Scannable
              Use legacy advertising PDUs
            Data status: [0;32mComplete[0m
          Legacy PDU Type: ADV_IND (0x0013)
          Address type: Random (0x01)
          Address: C0:DE:54:15:00:51 (Static)
          Primary PHY: LE 1M
          Secondary PHY: No packets
          SID: no ADI field (0xff)
          TX power: 127 dBm
          RSSI: -79 dBm (0xb1)
          Periodic advertising interval: 0.00 msec (0x0000)
          Direct address type: Public (0x00)
          Direct address: 00:00:00:00:00:00 (OUI 00-00-00)
          Data length: 0x0d
        02 01 06 09 09 58 35 34 2d 50 41 49 52           .....X54-PAIR   
        Flags: 0x06
          LE General Discoverable Mode
          BR/EDR Not Supported
        Name (complete): X54-PAIR
> HCI Event: LE Meta Event (0x3e) plen 57                  #29 [hci0] 10.965463
      LE Extended Advertising Report (0x0d)
        Num reports: 1
        Entry 0
          Event type: 0x0010
            Props: 0x0010
              Use legacy advertising PDUs
            Data status: [0;32mComplete[0m
          Legacy PDU Type: ADV_NONCONN_IND (0x0010)
          Address type: Random (0x01)
          Address: 5F:B1:D6:AA:D5:5B (Resolvable)
          Primary PHY: LE 1M
          Secondary PHY: No packets
          SID: no ADI field (0xff)
          TX power: 127 dBm
          RSSI: -91 dBm (0xa5)
          Periodic advertising interval: 0.00 msec (0x0000)
          Direct address type: Public (0x00)
          Direct address: 00:00:00:00:00:00 (OUI 00-00-00)
          Data length: 0x1f
        1e ff 06 00 01 09 20 02 0d 51 ad 90 ff 56 23 ff  ...... ..Q...V#.
        9c 41 0c e4 53 42 f3 e7 97 7c 51 a9 c3 68 1a     .A..SB...|Q..h. 
        Company: Microsoft (6)
          Data: 010920020d51ad90ff5623ff9c410ce45342f3e7977c51a9c3681a
@ MGMT Event: Device Found (0x0012) plen 27           {0x0001} [hci0] 10.965621
        LE Address: C0:DE:54:15:00:51 (Static)
        RSSI: -79 dBm (0xb1)
        Flags: 0x00000000
        Data length: 13
        Flags: 0x06
          LE General Discoverable Mode
          BR/EDR Not Supported
        Name (complete): X54-PAIR
@ MGMT Event: Device Found (0x0012) plen 45           {0x0001} [hci0] 10.965626
        LE Address: 5F:B1:D6:AA:D5:5B (Resolvable)
        RSSI: -91 dBm (0xa5)
        Flags: 0x00000004
          Not Connectable
        Data length: 31
        Company: Microsoft (6)
          Data: 010920020d51ad90ff5623ff9c410ce45342f3e7977c51a9c3681a
> HCI Event: LE Meta Event (0x3e) plen 26                  #30 [hci0] 10.972360
      LE Extended Advertising Report (0x0d)
        Num reports: 1
        Entry 0
          Event type: 0x0013
            Props: 0x0013
              Connectable
              Scannable
              Use legacy advertising PDUs
            Data status: [0;32mComplete[0m
          Legacy PDU Type: ADV_IND (0x0013)
          Address type: Public (0x00)
          Address: 5F:B1:D6:AA:D5:5B (OUI 5F-B1-D6)
          Primary PHY: LE 1M
          Secondary PHY: No packets
          SID: no ADI field (0xff)
          TX power: 127 dBm
          RSSI: -91 dBm (0xa5)
          Periodic advertising interval: 0.00 msec (0x0000)
          Direct address type: Public (0x00)
          Direct address: 00:00:00:00:00:00 (OUI 00-00-00)
          Data length: 0x00
> HCI Event: LE Meta Event (0x3e) plen 47                  #31 [hci0] 12.213340
      LE Extended Advertising Report (0x0d)
        Num reports: 1
        Entry 0
          Event type: 0x0013
            Props: 0x0013
              Connectable
              Scannable
              Use legacy advertising PDUs
            Data status: [0;32mComplete[0m
          Legacy PDU Type: ADV_IND (0x0013)
          Address type: Public (0x00)
          Address: A4:C1:38:75:8A:D6 (Telink Semiconductor (Taipei) Co. Ltd.)
          Primary PHY: LE 1M
          Secondary PHY: No packets
          SID: no ADI field (0xff)
          TX power: 127 dBm
          RSSI: -76 dBm (0xb4)
          Periodic advertising interval: 0.00 msec (0x0000)
          Direct address type: Public (0x00)
          Direct address: 00:00:00:00:00:00 (OUI 00-00-00)
          Data length: 0x15
        02 01 06 11 16 95 fe 30 58 5b 05 01 d6 8a 75 38  .......0X[....u8
        c1 a4 28 01 00                                   ..(..           
        Flags: 0x06
          LE General Discoverable Mode
          BR/EDR Not Supported
        Service Data: Xiaomi Inc. (0xfe95)
          Data: 30585b0501d68a7538c1a4280100
@ MGMT Event: Device Found (0x0012) plen 14           {0x0001} [hci0] 12.213365
        LE Address: 5F:B1:D6:AA:D5:5B (OUI 5F-B1-D6)
        RSSI: -91 dBm (0xa5)
        Flags: 0x00000000
        Data length: 0
bluetoothd[2915165]: = src/device.c:device_new() Unable to regist..   12.213661
bluetoothd[2915165]: = Unable to create object for found d..   [hci0] 12.213669
> HCI Event: LE Meta Event (0x3e) plen 38                  #32 [hci0] 12.214322
      LE Extended Advertising Report (0x0d)
        Num reports: 1
        Entry 0
          Event type: 0x001b
            Props: 0x001b
              Connectable
              Scannable
              Scan response
              Use legacy advertising PDUs
            Data status: [0;32mComplete[0m
          Legacy PDU Type: SCAN_RSP to an ADV_SCAN_IND (0x001b)
          Address type: Public (0x00)
          Address: A4:C1:38:75:8A:D6 (Telink Semiconductor (Taipei) Co. Ltd.)
          Primary PHY: LE 1M
          Secondary PHY: No packets
          SID: no ADI field (0xff)
          TX power: 127 dBm
          RSSI: -76 dBm (0xb4)
          Periodic advertising interval: 0.00 msec (0x0000)
          Direct address type: Public (0x00)
          Direct address: 00:00:00:00:00:00 (OUI 00-00-00)
          Data length: 0x0c
        0b 09 4c 59 57 53 44 30 33 4d 4d 43              ..LYWSD03MMC    
        Name (complete): LYWSD03MMC
@ MGMT Event: Device Found (0x0012) plen 47           {0x0001} [hci0] 12.214330
        LE Address: A4:C1:38:75:8A:D6 (Telink Semiconductor (Taipei) Co. Ltd.)
        RSSI: -76 dBm (0xb4)
        Flags: 0x00000000
        Data length: 33
        Flags: 0x06
          LE General Discoverable Mode
          BR/EDR Not Supported
        Service Data: Xiaomi Inc. (0xfe95)
          Data: 30585b0501d68a7538c1a4280100
        Name (complete): LYWSD03MMC
bluetoothctl[2388954]: @ MGMT Close: bluetoothctl            {0x0002} 12.502463
bluetoothd[2915165]: @ MGMT Comman.. (0x0024) plen 1  {0x0001} [hci0] 12.506959
        Address type: 0x07
          BR/EDR
          LE Public
          LE Random
< HCI Command: Inquiry Cancel (0x01|0x0002) plen 0         #33 [hci0] 12.506984
> HCI Event: Command Complete (0x0e) plen 4                #34 [hci0] 12.508318
      Inquiry Cancel (0x01|0x0002) ncmd 1
        Status: Success (0x00)
< HCI Command: LE Set Extended Sca.. (0x08|0x0042) plen 6  #35 [hci0] 12.508370
        Extended scan: Disabled (0x00)
        Filter duplicates: Disabled (0x00)
        Duration: 0 msec (0x0000)
        Period: 0.00 sec (0x0000)
bluetoothctl[2389839]: @ MGMT Open: bluetoot.. version 1.23  {0x0002} 12.512968
> HCI Event: Command Complete (0x0e) plen 4                #36 [hci0] 12.521370
      LE Set Extended Scan Enable (0x08|0x0042) ncmd 1
        Status: Success (0x00)
@ MGMT Event: Discovering (0x0013) plen 2             {0x0001} [hci0] 12.521384
        Address type: 0x07
          BR/EDR
          LE Public
          LE Random
        Discovery: Disabled (0x00)
@ MGMT Event: Command Complete (0x0001) plen 4        {0x0001} [hci0] 12.521493
      Stop Discovery (0x0024) plen 1
        Status: Success (0x00)
        Address type: 0x07
          BR/EDR
          LE Public
          LE Random
bluetoothd[2915165]: @ MGMT Comman.. (0x003a) plen 4  {0x0001} [hci0] 12.521648
        Address type: 0x01
          BR/EDR
        RSSI: invalid (0x7f)
        UUIDs: 0
< HCI Command: Inquiry (0x01|0x0001) plen 5                #37 [hci0] 12.521665
        Access code: 0x9e8b33 (General Inquiry)
        Length: 10.24s (0x08)
        Num responses: 0
> HCI Event: Command Status (0x0f) plen 4                  #38 [hci0] 12.522313
      Inquiry (0x01|0x0001) ncmd 1
        Status: Success (0x00)
@ MGMT Event: Command Complete (0x0001) plen 4        {0x0001} [hci0] 12.522429
      Start Service Discovery (0x003a) plen 1
        Status: Success (0x00)
        Address type: 0x01
          BR/EDR
@ MGMT Event: Discovering (0x0013) plen 2             {0x0001} [hci0] 12.522434
        Address type: 0x01
          BR/EDR
        Discovery: Enabled (0x01)
bluetoothctl[2389839]: @ MGMT Close: bluetoothctl            {0x0002} 20.528102
bluetoothctl[2390590]: @ MGMT Open: bluetoot.. version 1.23  {0x0002} 20.538452
bluetoothctl[2390590]: @ MGMT Close: bluetoothctl            {0x0002} 20.541659
bluetoothctl[2390591]: @ MGMT Open: bluetoot.. version 1.23  {0x0002} 20.548044
bluetoothd[2915165]: @ MGMT Comman.. (0x0024) plen 1  {0x0001} [hci0] 20.553658
        Address type: 0x01
          BR/EDR
< HCI Command: Inquiry Cancel (0x01|0x0002) plen 0         #39 [hci0] 20.553681
bluetoothctl[2390591]: @ MGMT Close: bluetoothctl            {0x0002} 20.575182
bluetoothd[2915165]: @ MGMT Comman.. (0x001a) plen 7  {0x0001} [hci0] 20.583453
        LE Address: C0:DE:54:15:00:51 (Static)
@ MGMT Event: Command Status (0x0002) plen 3          {0x0001} [hci0] 20.583458
      Cancel Pair Device (0x001a)
        Status: Invalid Parameters (0x0d)
bluetoothctl[2390592]: @ MGMT Open: bluetoot.. version 1.23  {0x0002} 20.586483
> HCI Event: Command Complete (0x0e) plen 4                #40 [hci0] 20.651554
      Inquiry Cancel (0x01|0x0002) ncmd 1
        Status: Success (0x00)
@ MGMT Event: Discovering (0x0013) plen 2             {0x0001} [hci0] 20.651572
        Address type: 0x01
          BR/EDR
        Discovery: Disabled (0x00)
@ MGMT Event: Command Complete (0x0001) plen 4        {0x0001} [hci0] 20.651591
      Stop Discovery (0x0024) plen 1
        Status: Success (0x00)
        Address type: 0x01
          BR/EDR
bluetoothd[2915165]: @ MGMT Comman.. (0x0019) plen 8  {0x0001} [hci0] 20.651750
        LE Address: C0:DE:54:15:00:51 (Static)
        Capability: NoInputNoOutput (0x03)
< HCI Command: LE Set Address Reso.. (0x08|0x002d) plen 1  #41 [hci0] 20.651878
        Address resolution: Enabled (0x01)
> HCI Event: Command Complete (0x0e) plen 4                #42 [hci0] 20.652551
      LE Set Address Resolution Enable (0x08|0x002d) ncmd 1
        Status: Success (0x00)
< HCI Command: LE Set Extended Sc.. (0x08|0x0041) plen 13  #43 [hci0] 20.652714
        Own address type: Public (0x00)
        Filter policy: Ignore not in accept list (0x01)
        PHYs: 0x05
        Entry 0: LE 1M
          Type: Passive (0x00)
          Interval: 60.000 msec (0x0060)
          Window: 60.000 msec (0x0060)
        Entry 1: LE Coded
          Type: Passive (0x00)
          Interval: 180.000 msec (0x0120)
          Window: 180.000 msec (0x0120)
> HCI Event: Command Complete (0x0e) plen 4                #44 [hci0] 20.653550
      LE Set Extended Scan Parameters (0x08|0x0041) ncmd 1
        Status: Success (0x00)
< HCI Command: LE Set Extended Sca.. (0x08|0x0042) plen 6  #45 [hci0] 20.653643
        Extended scan: Enabled (0x01)
        Filter duplicates: Enabled (0x01)
        Duration: 0 msec (0x0000)
        Period: 0.00 sec (0x0000)
> HCI Event: Command Complete (0x0e) plen 4                #46 [hci0] 20.654550
      LE Set Extended Scan Enable (0x08|0x0042) ncmd 1
        Status: Success (0x00)
> HCI Event: LE Meta Event (0x3e) plen 39                  #47 [hci0] 22.665741
      LE Extended Advertising Report (0x0d)
        Num reports: 1
        Entry 0
          Event type: 0x0013
            Props: 0x0013
              Connectable
              Scannable
              Use legacy advertising PDUs
            Data status: [0;32mComplete[0m
          Legacy PDU Type: ADV_IND (0x0013)
          Address type: Random (0x01)
          Address: C0:DE:54:15:00:51 (Static)
          Primary PHY: LE 1M
          Secondary PHY: No packets
          SID: no ADI field (0xff)
          TX power: 127 dBm
          RSSI: -81 dBm (0xaf)
          Periodic advertising interval: 0.00 msec (0x0000)
          Direct address type: Public (0x00)
          Direct address: 00:00:00:00:00:00 (OUI 00-00-00)
          Data length: 0x0d
        02 01 06 09 09 58 35 34 2d 50 41 49 52           .....X54-PAIR   
        Flags: 0x06
          LE General Discoverable Mode
          BR/EDR Not Supported
        Name (complete): X54-PAIR
< HCI Command: LE Set Extended Sca.. (0x08|0x0042) plen 6  #48 [hci0] 22.665783
        Extended scan: Disabled (0x00)
        Filter duplicates: Disabled (0x00)
        Duration: 0 msec (0x0000)
        Period: 0.00 sec (0x0000)
> HCI Event: Command Complete (0x0e) plen 4                #49 [hci0] 22.679618
      LE Set Extended Scan Enable (0x08|0x0042) ncmd 1
        Status: Success (0x00)
< HCI Command: LE Extended Create.. (0x08|0x0043) plen 26  #50 [hci0] 22.679984
        Filter policy: Accept list is not used (0x00)
        Own address type: Public (0x00)
        Peer address type: Random (0x01)
        Peer address: C0:DE:54:15:00:51 (Static)
        Initiating PHYs: 0x01
        Entry 0: LE 1M
          Scan interval: 60.000 msec (0x0060)
          Scan window: 60.000 msec (0x0060)
          Min connection interval: 30.00 msec (0x0018)
          Max connection interval: 50.00 msec (0x0028)
          Connection latency: 0 (0x0000)
          Supervision timeout: 420 msec (0x002a)
          Min connection length: 0.000 msec (0x0000)
          Max connection length: 0.000 msec (0x0000)
> HCI Event: Command Status (0x0f) plen 4                  #51 [hci0] 22.680611
      LE Extended Create Connection (0x08|0x0043) ncmd 1
        Status: Success (0x00)
> HCI Event: LE Meta Event (0x3e) plen 31                  #52 [hci0] 23.471758
      LE Enhanced Connection Complete (0x0a)
        Status: Success (0x00)
        Handle: 2048
        Role: Central (0x00)
        Peer address type: Random (0x01)
        Peer address: C0:DE:54:15:00:51 (Static)
        Local resolvable private address: 00:00:00:00:00:00 (Non-Resolvable)
        Peer resolvable private address: 00:00:00:00:00:00 (Non-Resolvable)
        Connection interval: 45.00 msec (0x0024)
        Connection latency: 0 (0x0000)
        Supervision timeout: 420 msec (0x002a)
        Central clock accuracy: 0x00
@ MGMT Event: Device Connected (0x000b) plen 26       {0x0001} [hci0] 23.471881
        LE Address: C0:DE:54:15:00:51 (Static)
        Flags: 0x00000008
          Connection Locally Initiated
        Data length: 13
        Flags: 0x06
          LE General Discoverable Mode
          BR/EDR Not Supported
        Name (complete): X54-PAIR
btmon[2388796]: @ RAW Open: btmon (privileged) version 2.22  {0x0003} 23.471980
btmon[2388796]: @ RAW Close: btmon                           {0x0003} 23.471992
> HCI Event: LE Meta Event (0x3e) plen 4                   #53 [hci0] 23.472647
      LE Channel Selection Algorithm (0x14)
        Handle: 2048 Address: C0:DE:54:15:00:51 (Static)
        Algorithm: #2 (0x01)
< HCI Command: LE Read Remote Used.. (0x08|0x0016) plen 2  #54 [hci0] 23.478759
        Handle: 2048 Address: C0:DE:54:15:00:51 (Static)
> HCI Event: Command Status (0x0f) plen 4                  #55 [hci0] 23.479635
      LE Read Remote Used Features (0x08|0x0016) ncmd 1
        Status: Success (0x00)
> HCI Event: LE Meta Event (0x3e) plen 12                  #56 [hci0] 23.558746
      LE Read Remote Used Features (0x04)
        Status: Success (0x00)
        Handle: 2048 Address: C0:DE:54:15:00:51 (Static)
        Features: 0x1f 0x00 0x00 0x00 0x00 0x00 0x00 0x00
          LE Encryption
          Connection Parameter Request Procedure
          Extended Reject Indication
          Peripheral-initiated Features Exchange
          LE Ping
< ACL Data TX: Handle 2048 flags 0x00 dlen 11              #57 [hci0] 23.558826
      SMP: Pairing Request (0x01) len 6
        IO capability: NoInputNoOutput (0x03)
        OOB data: Authentication data not present (0x00)
        Authentication requirement: Bonding, No MITM, SC, No Keypresses, CT2 (0x29)
        Max encryption key size: 16
        Initiator key distribution: EncKey Sign LinkKey (0x0d)
        Responder key distribution: EncKey IdKey Sign LinkKey (0x0f)
bluetoothd[2915165]: < ACL Data TX: H.. flags 0x00 dlen 7  #58 [hci0] 23.559149
      ATT: Exchange MTU Request (0x02) len 2
        Client RX MTU: 517
> HCI Event: Number of Completed Packets (0x13) plen 5     #59 [hci0] 23.647645
        Num handles: 1
        Handle: 2048 Address: C0:DE:54:15:00:51 (Static)
        Count: 1
        #57: len 11 (1 Kb/s)
        Latency: 88 msec (88-88 msec ~88 msec)
> HCI Event: Number of Completed Packets (0x13) plen 5     #60 [hci0] 23.737664
        Num handles: 1
        Handle: 2048 Address: C0:DE:54:15:00:51 (Static)
        Count: 1
        #58: len 7 (0 Kb/s)
        Latency: 178 msec (88-178 msec ~133 msec)
> ACL Data RX: Handle 2048 flags 0x02 dlen 11              #61 [hci0] 23.738787
      SMP: Pairing Response (0x02) len 6
        IO capability: NoInputNoOutput (0x03)
        OOB data: Authentication data not present (0x00)
        Authentication requirement: Bonding, No MITM, Legacy, No Keypresses (0x01)
        Max encryption key size: 16
        Initiator key distribution: EncKey (0x01)
        Responder key distribution: <none> (0x00)
@ MGMT Event: User Confirmation R.. (0x000f) plen 12  {0x0001} [hci0] 23.738803
        LE Address: C0:DE:54:15:00:51 (Static)
        Confirm hint: 0x01
        Value: 0x00000000
bluetoothd[2915165]: @ MGMT Comman.. (0x001c) plen 7  {0x0001} [hci0] 23.739060
        LE Address: C0:DE:54:15:00:51 (Static)
@ MGMT Event: Command Complete (0x0001) plen 10       {0x0001} [hci0] 23.739080
      User Confirmation Reply (0x001c) plen 7
        Status: Success (0x00)
        LE Address: C0:DE:54:15:00:51 (Static)
< ACL Data TX: Handle 2048 flags 0x00 dlen 21              #62 [hci0] 23.739083
      SMP: Pairing Confirm (0x03) len 16
        Confim value: cd282e18a00f7cff5610ee9c796a4cb2
> HCI Event: Number of Completed Packets (0x13) plen 5     #63 [hci0] 23.783749
        Num handles: 1
        Handle: 2048 Address: C0:DE:54:15:00:51 (Static)
        Count: 1
        #62: len 21 (3 Kb/s)
        Latency: 44 msec (44-178 msec ~89 msec)
> ACL Data RX: Handle 2048 flags 0x02 dlen 7               #64 [hci0] 23.784732
      ATT: Exchange MTU Response (0x03) len 2
        Server RX MTU: 23
bluetoothd[2915165]: < ACL Data TX:... flags 0x00 dlen 11  #65 [hci0] 23.785067
      ATT: Read By Type Request (0x08) len 6
        Handle range: 0x0001-0xffff
        Attribute type: Server Supported Features (0x2b3a)
> HCI Event: Number of Completed Packets (0x13) plen 5     #66 [hci0] 23.828646
        Num handles: 1
        Handle: 2048 Address: C0:DE:54:15:00:51 (Static)
        Count: 1
        #65: len 11 (2 Kb/s)
        Latency: 43 msec (43-178 msec ~66 msec)
> ACL Data RX: Handle 2048 flags 0x02 dlen 21              #67 [hci0] 23.829729
      SMP: Pairing Confirm (0x03) len 16
        Confim value: c40b0b554d373302eede3893bf8a7c6c
< ACL Data TX: Handle 2048 flags 0x00 dlen 21              #68 [hci0] 23.829740
      SMP: Pairing Random (0x04) len 16
        Random value: 0ca2c1fb30f60afe942855a90bb8748f
> HCI Event: Number of Completed Packets (0x13) plen 5     #69 [hci0] 23.873767
        Num handles: 1
        Handle: 2048 Address: C0:DE:54:15:00:51 (Static)
        Count: 1
        #68: len 21 (3 Kb/s)
        Latency: 44 msec (43-178 msec ~55 msec)
> ACL Data RX: Handle 2048 flags 0x02 dlen 9               #70 [hci0] 23.874728
      ATT: Error Response (0x01) len 4
        Read By Type Request (0x08)
        Handle: 0x0001
        Error: Attribute Not Found (0x0a)
bluetoothd[2915165]: < ACL Data TX:... flags 0x00 dlen 11  #71 [hci0] 23.875049
      ATT: Read By Group Type Request (0x10) len 6
        Handle range: 0x0001-0xffff
        Attribute group type: Primary Service (0x2800)
> HCI Event: Number of Completed Packets (0x13) plen 5     #72 [hci0] 23.918775
        Num handles: 1
        Handle: 2048 Address: C0:DE:54:15:00:51 (Static)
        Count: 1
        #71: len 11 (2 Kb/s)
        Latency: 43 msec (43-178 msec ~49 msec)
> ACL Data RX: Handle 2048 flags 0x02 dlen 21              #73 [hci0] 23.919737
      SMP: Pairing Random (0x04) len 16
        Random value: 5314089086b12c484bdb609c021a4a0a
< HCI Command: LE Start Encryption (0x08|0x0019) plen 28   #74 [hci0] 23.919845
        Handle: 2048 Address: C0:DE:54:15:00:51 (Static)
        Random number: 0x0000000000000000
        Encrypted diversifier: 0x0000
        Long term key: 091af5e88cb014bb5b439e0b78092a24
> HCI Event: Command Status (0x0f) plen 4                  #75 [hci0] 23.920647
      LE Start Encryption (0x08|0x0019) ncmd 1
        Status: Success (0x00)
> HCI Event: Encryption Change (0x08) plen 4               #76 [hci0] 24.052655
        Status: Success (0x00)
        Handle: 2048 Address: C0:DE:54:15:00:51 (Static)
        Encryption: Enabled with AES-CCM (0x01)
@ MGMT Event: New Long Term Key (0x000a) plen 37      {0x0001} [hci0] 24.052817
        Store hint: Yes (0x01)
        LE Address: C0:DE:54:15:00:51 (Static)
        Key type: Unauthenticated legacy key (0x00)
        Central: 0x00
        Encryption size: 16
        Diversifier: d63a
        Randomizer: 301ee1d465657e3c
        Key: 813ec01acb7c88b087e463378b808f95
@ MGMT Event: Command Complete (0x0001) plen 10       {0x0001} [hci0] 24.052825
      Pair Device (0x0019) plen 7
        Status: Success (0x00)
        LE Address: C0:DE:54:15:00:51 (Static)
< HCI Command: Write Authenticated.. (0x03|0x007c) plen 4  #77 [hci0] 24.052839
        Handle: 2048 Address: C0:DE:54:15:00:51 (Static)
        Timeout: 30000 msec (0x0bb8)
< ACL Data TX: Handle 2048 flags 0x00 dlen 21              #78 [hci0] 24.052859
      SMP: Encryption Information (0x06) len 16
        Long term key: 813ec01acb7c88b087e463378b808f95
< ACL Data TX: Handle 2048 flags 0x00 dlen 15              #79 [hci0] 24.052866
      SMP: Central Identification (0x07) len 10
        EDIV: 0x3ad6
        Rand: 0x3c7e6565d4e11e30
> HCI Event: Command Complete (0x0e) plen 6                #80 [hci0] 24.053655
      Write Authenticated Payload Timeout (0x03|0x007c) ncmd 1
        Status: Success (0x00)
        Handle: 2048 Address: C0:DE:54:15:00:51 (Static)
> HCI Event: Disconnect Complete (0x05) plen 4             #81 [hci0] 24.457715
        Status: Success (0x00)
        Handle: 2048 Address: C0:DE:54:15:00:51 (Static)
        Reason: Connection Timeout (0x08)
@ MGMT Event: Device Disconnected (0x000c) plen 8     {0x0001} [hci0] 24.457814
        LE Address: C0:DE:54:15:00:51 (Static)
        Reason: Connection timeout (0x01)
bluetoothctl[2390592]: @ MGMT Close: bluetoothctl            {0x0002} 28.594266
bluetoothd[2915165]: @ MGMT Comman.. (0x003a) plen 4  {0x0001} [hci0] 29.726186
        Address type: 0x01
          BR/EDR
        RSSI: invalid (0x7f)
        UUIDs: 0
< HCI Command: Inquiry (0x01|0x0001) plen 5                #82 [hci0] 29.726483
        Access code: 0x9e8b33 (General Inquiry)
        Length: 10.24s (0x08)
        Num responses: 0
> HCI Event: Command Status (0x0f) plen 4                  #83 [hci0] 29.820820
      Inquiry (0x01|0x0001) ncmd 1
        Status: Success (0x00)
@ MGMT Event: Command Complete (0x0001) plen 4        {0x0001} [hci0] 29.820933
      Start Service Discovery (0x003a) plen 1
        Status: Success (0x00)
        Address type: 0x01
          BR/EDR
@ MGMT Event: Discovering (0x0013) plen 2             {0x0001} [hci0] 29.820938
        Address type: 0x01
          BR/EDR
        Discovery: Enabled (0x01)
> HCI Event: Inquiry Complete (0x01) plen 1                #84 [hci0] 40.124138
        Status: Success (0x00)
@ MGMT Event: Discovering (0x0013) plen 2             {0x0001} [hci0] 40.124166
        Address type: 0x01
          BR/EDR
        Discovery: Disabled (0x00)
bluetoothd[2915165]: @ MGMT Comman.. (0x003a) plen 4  {0x0001} [hci0] 40.124283
        Address type: 0x01
          BR/EDR
        RSSI: invalid (0x7f)
        UUIDs: 0
< HCI Command: Inquiry (0x01|0x0001) plen 5                #85 [hci0] 40.124411
        Access code: 0x9e8b33 (General Inquiry)
        Length: 10.24s (0x08)
        Num responses: 0
> HCI Event: Command Status (0x0f) plen 4                  #86 [hci0] 40.125123
      Inquiry (0x01|0x0001) ncmd 1
        Status: Success (0x00)
@ MGMT Event: Command Complete (0x0001) plen 4        {0x0001} [hci0] 40.125233
      Start Service Discovery (0x003a) plen 1
        Status: Success (0x00)
        Address type: 0x01
          BR/EDR
@ MGMT Event: Discovering (0x0013) plen 2             {0x0001} [hci0] 40.125240
        Address type: 0x01
          BR/EDR
        Discovery: Enabled (0x01)
