Bluetooth monitor ver 5.72
btmon[2375096]: = Note: Linux version 6.17.0-14-generic (x86_64)       0.425172
btmon[2375096]: = Note: Bluetooth subsystem version 2.22               0.425173
= New Index: 68:34:21:E5:84:DF (Primary,USB,hci0)               [hci0] 0.425174
= Open Index: 68:34:21:E5:84:DF                                 [hci0] 0.425174
= Index Info: 68:34:21:E5:84:DF (Intel Corp.)                   [hci0] 0.425175
bluetoothd[2915165]: @ MGMT Open.. (privileged) version 1.23  {0x0001} 0.425175
> HCI Event: Inquiry Complete (0x01) plen 1                  #1 [hci0] 2.340898
        Status: Success (0x00)
@ MGMT Event: Discovering (0x0013) plen 2              {0x0001} [hci0] 2.340957
        Address type: 0x01
          BR/EDR
        Discovery: Disabled (0x00)
bluetoothd[2915165]: @ MGMT Command.. (0x003a) plen 4  {0x0001} [hci0] 2.341071
        Address type: 0x01
          BR/EDR
        RSSI: invalid (0x7f)
        UUIDs: 0
< HCI Command: Inquiry (0x01|0x0001) plen 5                  #2 [hci0] 2.341190
        Access code: 0x9e8b33 (General Inquiry)
        Length: 10.24s (0x08)
        Num responses: 0
> HCI Event: Command Status (0x0f) plen 4                    #3 [hci0] 2.341669
      Inquiry (0x01|0x0001) ncmd 1
        Status: Success (0x00)
@ MGMT Event: Command Complete (0x0001) plen 4         {0x0001} [hci0] 2.341845
      Start Service Discovery (0x003a) plen 1
        Status: Success (0x00)
        Address type: 0x01
          BR/EDR
@ MGMT Event: Discovering (0x0013) plen 2              {0x0001} [hci0] 2.341859
        Address type: 0x01
          BR/EDR
        Discovery: Enabled (0x01)
bluetoothctl[2375323]: @ MGMT Open: bluetooth.. version 1.23  {0x0002} 2.423625
bluetoothctl[2375323]: @ MGMT Close: bluetoothctl             {0x0002} 2.426785
bluetoothctl[2375326]: @ MGMT Open: bluetooth.. version 1.23  {0x0002} 2.430404
bluetoothd[2915165]: @ MGMT Command.. (0x0024) plen 1  {0x0001} [hci0] 2.437230
        Address type: 0x01
          BR/EDR
< HCI Command: Inquiry Cancel (0x01|0x0002) plen 0           #4 [hci0] 2.437387
> HCI Event: Command Complete (0x0e) plen 4                  #5 [hci0] 2.438672
      Inquiry Cancel (0x01|0x0002) ncmd 1
        Status: Success (0x00)
@ MGMT Event: Discovering (0x0013) plen 2              {0x0001} [hci0] 2.438776
        Address type: 0x01
          BR/EDR
        Discovery: Disabled (0x00)
@ MGMT Event: Command Complete (0x0001) plen 4         {0x0001} [hci0] 2.438902
      Stop Discovery (0x0024) plen 1
        Status: Success (0x00)
        Address type: 0x01
          BR/EDR
bluetoothd[2915165]: @ MGMT Command.. (0x003a) plen 4  {0x0001} [hci0] 2.438915
        Address type: 0x07
          BR/EDR
          LE Public
          LE Random
        RSSI: invalid (0x7f)
        UUIDs: 0
< HCI Command: LE Set Address Resolu.. (0x08|0x002d) plen 1  #6 [hci0] 2.439224
        Address resolution: Disabled (0x00)
> HCI Event: Command Complete (0x0e) plen 4                  #7 [hci0] 2.439675
      LE Set Address Resolution Enable (0x08|0x002d) ncmd 1
        Status: Success (0x00)
< HCI Command: LE Set Random Address (0x08|0x0005) plen 6    #8 [hci0] 2.439947
        Address: 3E:64:D7:85:03:75 (Non-Resolvable)
> HCI Event: Command Complete (0x0e) plen 4                  #9 [hci0] 2.440673
      LE Set Random Address (0x08|0x0005) ncmd 1
        Status: Success (0x00)
< HCI Command: LE Set Extended Sca.. (0x08|0x0041) plen 13  #10 [hci0] 2.440796
        Own address type: Random (0x01)
        Filter policy: Accept all advertisement (0x00)
        PHYs: 0x05
        Entry 0: LE 1M
          Type: Active (0x01)
          Interval: 22.500 msec (0x0024)
          Window: 11.250 msec (0x0012)
        Entry 1: LE Coded
          Type: Active (0x01)
          Interval: 67.500 msec (0x006c)
          Window: 33.750 msec (0x0036)
> HCI Event: Command Complete (0x0e) plen 4                 #11 [hci0] 2.441672
      LE Set Extended Scan Parameters (0x08|0x0041) ncmd 1
        Status: Success (0x00)
< HCI Command: LE Set Extended Scan.. (0x08|0x0042) plen 6  #12 [hci0] 2.441840
        Extended scan: Enabled (0x01)
        Filter duplicates: Disabled (0x00)
        Duration: 0 msec (0x0000)
        Period: 0.00 sec (0x0000)
> HCI Event: Command Complete (0x0e) plen 4                 #13 [hci0] 2.442672
      LE Set Extended Scan Enable (0x08|0x0042) ncmd 1
        Status: Success (0x00)
@ MGMT Event: Discovering (0x0013) plen 2              {0x0001} [hci0] 2.442776
        Address type: 0x07
          BR/EDR
          LE Public
          LE Random
        Discovery: Enabled (0x01)
< HCI Command: Inquiry (0x01|0x0001) plen 5                 #14 [hci0] 2.443001
        Access code: 0x9e8b33 (General Inquiry)
        Length: 10.24s (0x08)
        Num responses: 0
> HCI Event: Command Status (0x0f) plen 4                   #15 [hci0] 2.454792
      Inquiry (0x01|0x0001) ncmd 1
        Status: Success (0x00)
@ MGMT Event: Command Complete (0x0001) plen 4         {0x0001} [hci0] 2.454992
      Start Service Discovery (0x003a) plen 1
        Status: Success (0x00)
        Address type: 0x07
          BR/EDR
          LE Public
          LE Random
> HCI Event: LE Meta Event (0x3e) plen 57                   #16 [hci0] 2.465806
      LE Extended Advertising Report (0x0d)
        Num reports: 1
        Entry 0
          Event type: 0x0010
            Props: 0x0010
              Use legacy advertising PDUs
            Data status: [0;32mComplete[0m
          Legacy PDU Type: ADV_NONCONN_IND (0x0010)
          Address type: Random (0x01)
          Address: 5F:B1:D6:AA:D5:5B (Resolvable)
          Primary PHY: LE 1M
          Secondary PHY: No packets
          SID: no ADI field (0xff)
          TX power: 127 dBm
          RSSI: -91 dBm (0xa5)
          Periodic advertising interval: 0.00 msec (0x0000)
          Direct address type: Public (0x00)
          Direct address: 00:00:00:00:00:00 (OUI 00-00-00)
          Data length: 0x1f
        1e ff 06 00 01 09 20 02 0d 51 ad 90 ff 56 23 ff  ...... ..Q...V#.
        9c 41 0c e4 53 42 f3 e7 97 7c 51 a9 c3 68 1a     .A..SB...|Q..h. 
        Company: Microsoft (6)
          Data: 010920020d51ad90ff5623ff9c410ce45342f3e7977c51a9c3681a
@ MGMT Event: Device Found (0x0012) plen 45            {0x0001} [hci0] 2.465850
        LE Address: 5F:B1:D6:AA:D5:5B (Resolvable)
        RSSI: -91 dBm (0xa5)
        Flags: 0x00000004
          Not Connectable
        Data length: 31
        Company: Microsoft (6)
          Data: 010920020d51ad90ff5623ff9c410ce45342f3e7977c51a9c3681a
> HCI Event: LE Meta Event (0x3e) plen 57                   #17 [hci0] 2.570803
      LE Extended Advertising Report (0x0d)
        Num reports: 1
        Entry 0
          Event type: 0x0010
            Props: 0x0010
              Use legacy advertising PDUs
            Data status: [0;32mComplete[0m
          Legacy PDU Type: ADV_NONCONN_IND (0x0010)
          Address type: Random (0x01)
          Address: 5F:B1:D6:AA:D5:5B (Resolvable)
          Primary PHY: LE 1M
          Secondary PHY: No packets
          SID: no ADI field (0xff)
          TX power: 127 dBm
          RSSI: -90 dBm (0xa6)
          Periodic advertising interval: 0.00 msec (0x0000)
          Direct address type: Public (0x00)
          Direct address: 00:00:00:00:00:00 (OUI 00-00-00)
          Data length: 0x1f
        1e ff 06 00 01 09 20 02 0d 51 ad 90 ff 56 23 ff  ...... ..Q...V#.
        9c 41 0c e4 53 42 f3 e7 97 7c 51 a9 c3 68 1a     .A..SB...|Q..h. 
        Company: Microsoft (6)
          Data: 010920020d51ad90ff5623ff9c410ce45342f3e7977c51a9c3681a
@ MGMT Event: Device Found (0x0012) plen 45            {0x0001} [hci0] 2.570976
        LE Address: 5F:B1:D6:AA:D5:5B (Resolvable)
        RSSI: -90 dBm (0xa6)
        Flags: 0x00000004
          Not Connectable
        Data length: 31
        Company: Microsoft (6)
          Data: 010920020d51ad90ff5623ff9c410ce45342f3e7977c51a9c3681a
> HCI Event: LE Meta Event (0x3e) plen 57                   #18 [hci0] 2.674716
      LE Extended Advertising Report (0x0d)
        Num reports: 1
        Entry 0
          Event type: 0x0010
            Props: 0x0010
              Use legacy advertising PDUs
            Data status: [0;32mComplete[0m
          Legacy PDU Type: ADV_NONCONN_IND (0x0010)
          Address type: Random (0x01)
          Address: D9:08:D5:69:61:41 (Static)
          Primary PHY: LE 1M
          Secondary PHY: No packets
          SID: no ADI field (0xff)
          TX power: 127 dBm
          RSSI: -76 dBm (0xb4)
          Periodic advertising interval: 0.00 msec (0x0000)
          Direct address type: Public (0x00)
          Direct address: 00:00:00:00:00:00 (OUI 00-00-00)
          Data length: 0x1f
        1e ff 4c 00 12 19 00 24 33 7a cb 50 39 c8 a0 b4  ..L....$3z.P9...
        b2 f2 de 88 5e ac 5a 2f d9 ef 26 0b 45 00 00     ....^.Z/..&.E.. 
        Company: Apple, Inc. (76)
          Type: Unknown (18)
          Data: 0024337acb5039c8a0b4b2f2de885eac5a2fd9ef260b450000
@ MGMT Event: Device Found (0x0012) plen 45            {0x0001} [hci0] 2.674727
        LE Address: D9:08:D5:69:61:41 (Static)
        RSSI: -76 dBm (0xb4)
        Flags: 0x00000004
          Not Connectable
        Data length: 31
        Company: Apple, Inc. (76)
          Type: Unknown (18)
          Data: 0024337acb5039c8a0b4b2f2de885eac5a2fd9ef260b450000
> HCI Event: LE Meta Event (0x3e) plen 43                   #19 [hci0] 2.867819
      LE Extended Advertising Report (0x0d)
        Num reports: 1
        Entry 0
          Event type: 0x0013
            Props: 0x0013
              Connectable
              Scannable
              Use legacy advertising PDUs
            Data status: [0;32mComplete[0m
          Legacy PDU Type: ADV_IND (0x0013)
          Address type: Random (0x01)
          Address: 77:97:32:85:74:A1 (Resolvable)
          Primary PHY: LE 1M
          Secondary PHY: No packets
          SID: no ADI field (0xff)
          TX power: 127 dBm
          RSSI: -90 dBm (0xa6)
          Periodic advertising interval: 0.00 msec (0x0000)
          Direct address type: Public (0x00)
          Direct address: 00:00:00:00:00:00 (OUI 00-00-00)
          Data length: 0x11
        02 01 1a 02 0a 0c 0a ff 4c 00 10 05 3a 1c 19 e3  ........L...:...
        a2                                               .               
        Flags: 0x1a
          LE General Discoverable Mode
          Simultaneous LE and BR/EDR (Controller)
          Simultaneous LE and BR/EDR (Host)
        TX power: 12 dBm
        Company: Apple, Inc. (76)
          Type: Unknown (16)
          Data: 3a1c19e3a2
> HCI Event: LE Meta Event (0x3e) plen 57                   #20 [hci0] 2.870724
      LE Extended Advertising Report (0x0d)
        Num reports: 1
        Entry 0
          Event type: 0x0010
            Props: 0x0010
              Use legacy advertising PDUs
            Data status: [0;32mComplete[0m
          Legacy PDU Type: ADV_NONCONN_IND (0x0010)
          Address type: Random (0x01)
          Address: 5F:B1:D6:AA:D5:5B (Resolvable)
          Primary PHY: LE 1M
          Secondary PHY: No packets
          SID: no ADI field (0xff)
          TX power: 127 dBm
          RSSI: -91 dBm (0xa5)
          Periodic advertising interval: 0.00 msec (0x0000)
          Direct address type: Public (0x00)
          Direct address: 00:00:00:00:00:00 (OUI 00-00-00)
          Data length: 0x1f
        1e ff 06 00 01 09 20 02 0d 51 ad 90 ff 56 23 ff  ...... ..Q...V#.
        9c 41 0c e4 53 42 f3 e7 97 7c 51 a9 c3 68 1a     .A..SB...|Q..h. 
        Company: Microsoft (6)
          Data: 010920020d51ad90ff5623ff9c410ce45342f3e7977c51a9c3681a
@ MGMT Event: Device Found (0x0012) plen 31            {0x0001} [hci0] 2.870873
        LE Address: 77:97:32:85:74:A1 (Resolvable)
        RSSI: -90 dBm (0xa6)
        Flags: 0x00000000
        Data length: 17
        Flags: 0x1a
          LE General Discoverable Mode
          Simultaneous LE and BR/EDR (Controller)
          Simultaneous LE and BR/EDR (Host)
        TX power: 12 dBm
        Company: Apple, Inc. (76)
          Type: Unknown (16)
          Data: 3a1c19e3a2
@ MGMT Event: Device Found (0x0012) plen 45            {0x0001} [hci0] 2.870878
        LE Address: 5F:B1:D6:AA:D5:5B (Resolvable)
        RSSI: -91 dBm (0xa5)
        Flags: 0x00000004
          Not Connectable
        Data length: 31
        Company: Microsoft (6)
          Data: 010920020d51ad90ff5623ff9c410ce45342f3e7977c51a9c3681a
> HCI Event: LE Meta Event (0x3e) plen 43                   #21 [hci0] 3.411830
      LE Extended Advertising Report (0x0d)
        Num reports: 1
        Entry 0
          Event type: 0x0013
            Props: 0x0013
              Connectable
              Scannable
              Use legacy advertising PDUs
            Data status: [0;32mComplete[0m
          Legacy PDU Type: ADV_IND (0x0013)
          Address type: Random (0x01)
          Address: 77:97:32:85:74:A1 (Resolvable)
          Primary PHY: LE 1M
          Secondary PHY: No packets
          SID: no ADI field (0xff)
          TX power: 127 dBm
          RSSI: -91 dBm (0xa5)
          Periodic advertising interval: 0.00 msec (0x0000)
          Direct address type: Public (0x00)
          Direct address: 00:00:00:00:00:00 (OUI 00-00-00)
          Data length: 0x11
        02 01 1a 02 0a 0c 0a ff 4c 00 10 05 3a 1c 19 e3  ........L...:...
        a2                                               .               
        Flags: 0x1a
          LE General Discoverable Mode
          Simultaneous LE and BR/EDR (Controller)
          Simultaneous LE and BR/EDR (Host)
        TX power: 12 dBm
        Company: Apple, Inc. (76)
          Type: Unknown (16)
          Data: 3a1c19e3a2
> HCI Event: LE Meta Event (0x3e) plen 26                   #22 [hci0] 3.419800
      LE Extended Advertising Report (0x0d)
        Num reports: 1
        Entry 0
          Event type: 0x0013
            Props: 0x0013
              Connectable
              Scannable
              Use legacy advertising PDUs
            Data status: [0;32mComplete[0m
          Legacy PDU Type: ADV_IND (0x0013)
          Address type: Public (0x00)
          Address: 77:97:32:85:74:A1 (OUI 77-97-32)
          Primary PHY: LE 1M
          Secondary PHY: No packets
          SID: no ADI field (0xff)
          TX power: 127 dBm
          RSSI: -91 dBm (0xa5)
          Periodic advertising interval: 0.00 msec (0x0000)
          Direct address type: Public (0x00)
          Direct address: 00:00:00:00:00:00 (OUI 00-00-00)
          Data length: 0x00
@ MGMT Event: Device Found (0x0012) plen 31            {0x0001} [hci0] 3.419920
        LE Address: 77:97:32:85:74:A1 (Resolvable)
        RSSI: -91 dBm (0xa5)
        Flags: 0x00000000
        Data length: 17
        Flags: 0x1a
          LE General Discoverable Mode
          Simultaneous LE and BR/EDR (Controller)
          Simultaneous LE and BR/EDR (Host)
        TX power: 12 dBm
        Company: Apple, Inc. (76)
          Type: Unknown (16)
          Data: 3a1c19e3a2
> HCI Event: LE Meta Event (0x3e) plen 57                   #23 [hci0] 3.496901
      LE Extended Advertising Report (0x0d)
        Num reports: 1
        Entry 0
          Event type: 0x0010
            Props: 0x0010
              Use legacy advertising PDUs
            Data status: [0;32mComplete[0m
          Legacy PDU Type: ADV_NONCONN_IND (0x0010)
          Address type: Random (0x01)
          Address: 5F:B1:D6:AA:D5:5B (Resolvable)
          Primary PHY: LE 1M
          Secondary PHY: No packets
          SID: no ADI field (0xff)
          TX power: 127 dBm
          RSSI: -88 dBm (0xa8)
          Periodic advertising interval: 0.00 msec (0x0000)
          Direct address type: Public (0x00)
          Direct address: 00:00:00:00:00:00 (OUI 00-00-00)
          Data length: 0x1f
        1e ff 06 00 01 09 20 02 0d 51 ad 90 ff 56 23 ff  ...... ..Q...V#.
        9c 41 0c e4 53 42 f3 e7 97 7c 51 a9 c3 68 1a     .A..SB...|Q..h. 
        Company: Microsoft (6)
          Data: 010920020d51ad90ff5623ff9c410ce45342f3e7977c51a9c3681a
@ MGMT Event: Device Found (0x0012) plen 14            {0x0001} [hci0] 3.497051
        LE Address: 77:97:32:85:74:A1 (OUI 77-97-32)
        RSSI: -91 dBm (0xa5)
        Flags: 0x00000000
        Data length: 0
@ MGMT Event: Device Found (0x0012) plen 45            {0x0001} [hci0] 3.497059
        LE Address: 5F:B1:D6:AA:D5:5B (Resolvable)
        RSSI: -88 dBm (0xa8)
        Flags: 0x00000004
          Not Connectable
        Data length: 31
        Company: Microsoft (6)
          Data: 010920020d51ad90ff5623ff9c410ce45342f3e7977c51a9c3681a
bluetoothd[2915165]: = src/device.c:device_new() Unable to registe..   3.497507
bluetoothd[2915165]: = Unable to create object for found de..   [hci0] 3.497543
> HCI Event: LE Meta Event (0x3e) plen 57                   #24 [hci0] 3.809863
      LE Extended Advertising Report (0x0d)
        Num reports: 1
        Entry 0
          Event type: 0x0010
            Props: 0x0010
              Use legacy advertising PDUs
            Data status: [0;32mComplete[0m
          Legacy PDU Type: ADV_NONCONN_IND (0x0010)
          Address type: Random (0x01)
          Address: 5F:B1:D6:AA:D5:5B (Resolvable)
          Primary PHY: LE 1M
          Secondary PHY: No packets
          SID: no ADI field (0xff)
          TX power: 127 dBm
          RSSI: -89 dBm (0xa7)
          Periodic advertising interval: 0.00 msec (0x0000)
          Direct address type: Public (0x00)
          Direct address: 00:00:00:00:00:00 (OUI 00-00-00)
          Data length: 0x1f
        1e ff 06 00 01 09 20 02 0d 51 ad 90 ff 56 23 ff  ...... ..Q...V#.
        9c 41 0c e4 53 42 f3 e7 97 7c 51 a9 c3 68 1a     .A..SB...|Q..h. 
        Company: Microsoft (6)
          Data: 010920020d51ad90ff5623ff9c410ce45342f3e7977c51a9c3681a
@ MGMT Event: Device Found (0x0012) plen 45            {0x0001} [hci0] 3.809958
        LE Address: 5F:B1:D6:AA:D5:5B (Resolvable)
        RSSI: -89 dBm (0xa7)
        Flags: 0x00000004
          Not Connectable
        Data length: 31
        Company: Microsoft (6)
          Data: 010920020d51ad90ff5623ff9c410ce45342f3e7977c51a9c3681a
> HCI Event: LE Meta Event (0x3e) plen 26                   #25 [hci0] 4.754851
      LE Extended Advertising Report (0x0d)
        Num reports: 1
        Entry 0
          Event type: 0x0013
            Props: 0x0013
              Connectable
              Scannable
              Use legacy advertising PDUs
            Data status: [0;32mComplete[0m
          Legacy PDU Type: ADV_IND (0x0013)
          Address type: Random (0x01)
          Address: 5F:B1:D6:AA:D5:5B (Resolvable)
          Primary PHY: LE 1M
          Secondary PHY: No packets
          SID: no ADI field (0xff)
          TX power: 127 dBm
          RSSI: -89 dBm (0xa7)
          Periodic advertising interval: 0.00 msec (0x0000)
          Direct address type: Public (0x00)
          Direct address: 00:00:00:00:00:00 (OUI 00-00-00)
          Data length: 0x00
> HCI Event: LE Meta Event (0x3e) plen 57                   #26 [hci0] 5.694908
      LE Extended Advertising Report (0x0d)
        Num reports: 1
        Entry 0
          Event type: 0x0010
            Props: 0x0010
              Use legacy advertising PDUs
            Data status: [0;32mComplete[0m
          Legacy PDU Type: ADV_NONCONN_IND (0x0010)
          Address type: Random (0x01)
          Address: 5F:B1:D6:AA:D5:5B (Resolvable)
          Primary PHY: LE 1M
          Secondary PHY: No packets
          SID: no ADI field (0xff)
          TX power: 127 dBm
          RSSI: -91 dBm (0xa5)
          Periodic advertising interval: 0.00 msec (0x0000)
          Direct address type: Public (0x00)
          Direct address: 00:00:00:00:00:00 (OUI 00-00-00)
          Data length: 0x1f
        1e ff 06 00 01 09 20 02 0d 51 ad 90 ff 56 23 ff  ...... ..Q...V#.
        9c 41 0c e4 53 42 f3 e7 97 7c 51 a9 c3 68 1a     .A..SB...|Q..h. 
        Company: Microsoft (6)
          Data: 010920020d51ad90ff5623ff9c410ce45342f3e7977c51a9c3681a
@ MGMT Event: Device Found (0x0012) plen 45            {0x0001} [hci0] 5.694935
        LE Address: 5F:B1:D6:AA:D5:5B (Resolvable)
        RSSI: -91 dBm (0xa5)
        Flags: 0x00000004
          Not Connectable
        Data length: 31
        Company: Microsoft (6)
          Data: 010920020d51ad90ff5623ff9c410ce45342f3e7977c51a9c3681a
> HCI Event: LE Meta Event (0x3e) plen 43                   #27 [hci0] 5.884810
      LE Extended Advertising Report (0x0d)
        Num reports: 1
        Entry 0
          Event type: 0x0013
            Props: 0x0013
              Connectable
              Scannable
              Use legacy advertising PDUs
            Data status: [0;32mComplete[0m
          Legacy PDU Type: ADV_IND (0x0013)
          Address type: Random (0x01)
          Address: 77:97:32:85:74:A1 (Resolvable)
          Primary PHY: LE 1M
          Secondary PHY: No packets
          SID: no ADI field (0xff)
          TX power: 127 dBm
          RSSI: -84 dBm (0xac)
          Periodic advertising interval: 0.00 msec (0x0000)
          Direct address type: Public (0x00)
          Direct address: 00:00:00:00:00:00 (OUI 00-00-00)
          Data length: 0x11
        02 01 1a 02 0a 0c 0a ff 4c 00 10 05 3a 1c 19 e3  ........L...:...
        a2                                               .               
        Flags: 0x1a
          LE General Discoverable Mode
          Simultaneous LE and BR/EDR (Controller)
          Simultaneous LE and BR/EDR (Host)
        TX power: 12 dBm
        Company: Apple, Inc. (76)
          Type: Unknown (16)
          Data: 3a1c19e3a2
> HCI Event: LE Meta Event (0x3e) plen 43                   #28 [hci0] 6.162862
      LE Extended Advertising Report (0x0d)
        Num reports: 1
        Entry 0
          Event type: 0x0013
            Props: 0x0013
              Connectable
              Scannable
              Use legacy advertising PDUs
            Data status: [0;32mComplete[0m
          Legacy PDU Type: ADV_IND (0x0013)
          Address type: Random (0x01)
          Address: 77:97:32:85:74:A1 (Resolvable)
          Primary PHY: LE 1M
          Secondary PHY: No packets
          SID: no ADI field (0xff)
          TX power: 127 dBm
          RSSI: -84 dBm (0xac)
          Periodic advertising interval: 0.00 msec (0x0000)
          Direct address type: Public (0x00)
          Direct address: 00:00:00:00:00:00 (OUI 00-00-00)
          Data length: 0x11
        02 01 1a 02 0a 0c 0a ff 4c 00 10 05 3a 1c 19 e3  ........L...:...
        a2                                               .               
        Flags: 0x1a
          LE General Discoverable Mode
          Simultaneous LE and BR/EDR (Controller)
          Simultaneous LE and BR/EDR (Host)
        TX power: 12 dBm
        Company: Apple, Inc. (76)
          Type: Unknown (16)
          Data: 3a1c19e3a2
> HCI Event: LE Meta Event (0x3e) plen 26                   #29 [hci0] 6.163835
      LE Extended Advertising Report (0x0d)
        Num reports: 1
        Entry 0
          Event type: 0x001b
            Props: 0x001b
              Connectable
              Scannable
              Scan response
              Use legacy advertising PDUs
            Data status: [0;32mComplete[0m
          Legacy PDU Type: SCAN_RSP to an ADV_SCAN_IND (0x001b)
          Address type: Random (0x01)
          Address: 77:97:32:85:74:A1 (Resolvable)
          Primary PHY: LE 1M
          Secondary PHY: No packets
          SID: no ADI field (0xff)
          TX power: 127 dBm
          RSSI: -85 dBm (0xab)
          Periodic advertising interval: 0.00 msec (0x0000)
          Direct address type: Public (0x00)
          Direct address: 00:00:00:00:00:00 (OUI 00-00-00)
          Data length: 0x00
@ MGMT Event: Device Found (0x0012) plen 31            {0x0001} [hci0] 6.163855
        LE Address: 77:97:32:85:74:A1 (Resolvable)
        RSSI: -85 dBm (0xab)
        Flags: 0x00000000
        Data length: 17
        Flags: 0x1a
          LE General Discoverable Mode
          Simultaneous LE and BR/EDR (Controller)
          Simultaneous LE and BR/EDR (Host)
        TX power: 12 dBm
        Company: Apple, Inc. (76)
          Type: Unknown (16)
          Data: 3a1c19e3a2
> HCI Event: LE Meta Event (0x3e) plen 43                   #30 [hci0] 6.442946
      LE Extended Advertising Report (0x0d)
        Num reports: 1
        Entry 0
          Event type: 0x0013
            Props: 0x0013
              Connectable
              Scannable
              Use legacy advertising PDUs
            Data status: [0;32mComplete[0m
          Legacy PDU Type: ADV_IND (0x0013)
          Address type: Random (0x01)
          Address: 77:97:32:85:74:A1 (Resolvable)
          Primary PHY: LE 1M
          Secondary PHY: No packets
          SID: no ADI field (0xff)
          TX power: 127 dBm
          RSSI: -84 dBm (0xac)
          Periodic advertising interval: 0.00 msec (0x0000)
          Direct address type: Public (0x00)
          Direct address: 00:00:00:00:00:00 (OUI 00-00-00)
          Data length: 0x11
        02 01 1a 02 0a 0c 0a ff 4c 00 10 05 3a 1c 19 e3  ........L...:...
        a2                                               .               
        Flags: 0x1a
          LE General Discoverable Mode
          Simultaneous LE and BR/EDR (Controller)
          Simultaneous LE and BR/EDR (Host)
        TX power: 12 dBm
        Company: Apple, Inc. (76)
          Type: Unknown (16)
          Data: 3a1c19e3a2
> HCI Event: LE Meta Event (0x3e) plen 26                   #31 [hci0] 6.443887
      LE Extended Advertising Report (0x0d)
        Num reports: 1
        Entry 0
          Event type: 0x001b
            Props: 0x001b
              Connectable
              Scannable
              Scan response
              Use legacy advertising PDUs
            Data status: [0;32mComplete[0m
          Legacy PDU Type: SCAN_RSP to an ADV_SCAN_IND (0x001b)
          Address type: Random (0x01)
          Address: 77:97:32:85:74:A1 (Resolvable)
          Primary PHY: LE 1M
          Secondary PHY: No packets
          SID: no ADI field (0xff)
          TX power: 127 dBm
          RSSI: -85 dBm (0xab)
          Periodic advertising interval: 0.00 msec (0x0000)
          Direct address type: Public (0x00)
          Direct address: 00:00:00:00:00:00 (OUI 00-00-00)
          Data length: 0x00
@ MGMT Event: Device Found (0x0012) plen 31            {0x0001} [hci0] 6.444011
        LE Address: 77:97:32:85:74:A1 (Resolvable)
        RSSI: -85 dBm (0xab)
        Flags: 0x00000000
        Data length: 17
        Flags: 0x1a
          LE General Discoverable Mode
          Simultaneous LE and BR/EDR (Controller)
          Simultaneous LE and BR/EDR (Host)
        TX power: 12 dBm
        Company: Apple, Inc. (76)
          Type: Unknown (16)
          Data: 3a1c19e3a2
> HCI Event: LE Meta Event (0x3e) plen 39                   #32 [hci0] 6.841922
      LE Extended Advertising Report (0x0d)
        Num reports: 1
        Entry 0
          Event type: 0x0013
            Props: 0x0013
              Connectable
              Scannable
              Use legacy advertising PDUs
            Data status: [0;32mComplete[0m
          Legacy PDU Type: ADV_IND (0x0013)
          Address type: Random (0x01)
          Address: C0:DE:54:15:00:51 (Static)
          Primary PHY: LE 1M
          Secondary PHY: No packets
          SID: no ADI field (0xff)
          TX power: 127 dBm
          RSSI: -79 dBm (0xb1)
          Periodic advertising interval: 0.00 msec (0x0000)
          Direct address type: Public (0x00)
          Direct address: 00:00:00:00:00:00 (OUI 00-00-00)
          Data length: 0x0d
        02 01 06 09 09 58 35 34 2d 50 41 49 52           .....X54-PAIR   
        Flags: 0x06
          LE General Discoverable Mode
          BR/EDR Not Supported
        Name (complete): X54-PAIR
> HCI Event: LE Meta Event (0x3e) plen 57                   #33 [hci0] 7.793870
      LE Extended Advertising Report (0x0d)
        Num reports: 1
        Entry 0
          Event type: 0x0010
            Props: 0x0010
              Use legacy advertising PDUs
            Data status: [0;32mComplete[0m
          Legacy PDU Type: ADV_NONCONN_IND (0x0010)
          Address type: Random (0x01)
          Address: 5F:B1:D6:AA:D5:5B (Resolvable)
          Primary PHY: LE 1M
          Secondary PHY: No packets
          SID: no ADI field (0xff)
          TX power: 127 dBm
          RSSI: -89 dBm (0xa7)
          Periodic advertising interval: 0.00 msec (0x0000)
          Direct address type: Public (0x00)
          Direct address: 00:00:00:00:00:00 (OUI 00-00-00)
          Data length: 0x1f
        1e ff 06 00 01 09 20 02 0d 51 ad 90 ff 56 23 ff  ...... ..Q...V#.
        9c 41 0c e4 53 42 f3 e7 97 7c 51 a9 c3 68 1a     .A..SB...|Q..h. 
        Company: Microsoft (6)
          Data: 010920020d51ad90ff5623ff9c410ce45342f3e7977c51a9c3681a
@ MGMT Event: Device Found (0x0012) plen 27            {0x0001} [hci0] 7.793894
        LE Address: C0:DE:54:15:00:51 (Static)
        RSSI: -79 dBm (0xb1)
        Flags: 0x00000000
        Data length: 13
        Flags: 0x06
          LE General Discoverable Mode
          BR/EDR Not Supported
        Name (complete): X54-PAIR
@ MGMT Event: Device Found (0x0012) plen 45            {0x0001} [hci0] 7.793901
        LE Address: 5F:B1:D6:AA:D5:5B (Resolvable)
        RSSI: -89 dBm (0xa7)
        Flags: 0x00000004
          Not Connectable
        Data length: 31
        Company: Microsoft (6)
          Data: 010920020d51ad90ff5623ff9c410ce45342f3e7977c51a9c3681a
> HCI Event: LE Meta Event (0x3e) plen 39                   #34 [hci0] 8.620967
      LE Extended Advertising Report (0x0d)
        Num reports: 1
        Entry 0
          Event type: 0x0013
            Props: 0x0013
              Connectable
              Scannable
              Use legacy advertising PDUs
            Data status: [0;32mComplete[0m
          Legacy PDU Type: ADV_IND (0x0013)
          Address type: Random (0x01)
          Address: C0:DE:54:15:00:51 (Static)
          Primary PHY: LE 1M
          Secondary PHY: No packets
          SID: no ADI field (0xff)
          TX power: 127 dBm
          RSSI: -79 dBm (0xb1)
          Periodic advertising interval: 0.00 msec (0x0000)
          Direct address type: Public (0x00)
          Direct address: 00:00:00:00:00:00 (OUI 00-00-00)
          Data length: 0x0d
        02 01 06 09 09 58 35 34 2d 50 41 49 52           .....X54-PAIR   
        Flags: 0x06
          LE General Discoverable Mode
          BR/EDR Not Supported
        Name (complete): X54-PAIR
> HCI Event: LE Meta Event (0x3e) plen 57                   #35 [hci0] 8.623983
      LE Extended Advertising Report (0x0d)
        Num reports: 1
        Entry 0
          Event type: 0x0010
            Props: 0x0010
              Use legacy advertising PDUs
            Data status: [0;32mComplete[0m
          Legacy PDU Type: ADV_NONCONN_IND (0x0010)
          Address type: Random (0x01)
          Address: 5F:B1:D6:AA:D5:5B (Resolvable)
          Primary PHY: LE 1M
          Secondary PHY: No packets
          SID: no ADI field (0xff)
          TX power: 127 dBm
          RSSI: -88 dBm (0xa8)
          Periodic advertising interval: 0.00 msec (0x0000)
          Direct address type: Public (0x00)
          Direct address: 00:00:00:00:00:00 (OUI 00-00-00)
          Data length: 0x1f
        1e ff 06 00 01 09 20 02 0d 51 ad 90 ff 56 23 ff  ...... ..Q...V#.
        9c 41 0c e4 53 42 f3 e7 97 7c 51 a9 c3 68 1a     .A..SB...|Q..h. 
        Company: Microsoft (6)
          Data: 010920020d51ad90ff5623ff9c410ce45342f3e7977c51a9c3681a
@ MGMT Event: Device Found (0x0012) plen 27            {0x0001} [hci0] 8.624115
        LE Address: C0:DE:54:15:00:51 (Static)
        RSSI: -79 dBm (0xb1)
        Flags: 0x00000000
        Data length: 13
        Flags: 0x06
          LE General Discoverable Mode
          BR/EDR Not Supported
        Name (complete): X54-PAIR
@ MGMT Event: Device Found (0x0012) plen 45            {0x0001} [hci0] 8.624119
        LE Address: 5F:B1:D6:AA:D5:5B (Resolvable)
        RSSI: -88 dBm (0xa8)
        Flags: 0x00000004
          Not Connectable
        Data length: 31
        Company: Microsoft (6)
          Data: 010920020d51ad90ff5623ff9c410ce45342f3e7977c51a9c3681a
> HCI Event: LE Meta Event (0x3e) plen 43                   #36 [hci0] 9.187999
      LE Extended Advertising Report (0x0d)
        Num reports: 1
        Entry 0
          Event type: 0x0013
            Props: 0x0013
              Connectable
              Scannable
              Use legacy advertising PDUs
            Data status: [0;32mComplete[0m
          Legacy PDU Type: ADV_IND (0x0013)
          Address type: Random (0x01)
          Address: 77:97:32:85:74:A1 (Resolvable)
          Primary PHY: LE 1M
          Secondary PHY: No packets
          SID: no ADI field (0xff)
          TX power: 127 dBm
          RSSI: -84 dBm (0xac)
          Periodic advertising interval: 0.00 msec (0x0000)
          Direct address type: Public (0x00)
          Direct address: 00:00:00:00:00:00 (OUI 00-00-00)
          Data length: 0x11
        02 01 1a 02 0a 0c 0a ff 4c 00 10 05 3a 1c 19 e3  ........L...:...
        a2                                               .               
        Flags: 0x1a
          LE General Discoverable Mode
          Simultaneous LE and BR/EDR (Controller)
          Simultaneous LE and BR/EDR (Host)
        TX power: 12 dBm
        Company: Apple, Inc. (76)
          Type: Unknown (16)
          Data: 3a1c19e3a2
> HCI Event: LE Meta Event (0x3e) plen 57                   #37 [hci0] 9.451007
      LE Extended Advertising Report (0x0d)
        Num reports: 1
        Entry 0
          Event type: 0x0010
            Props: 0x0010
              Use legacy advertising PDUs
            Data status: [0;32mComplete[0m
          Legacy PDU Type: ADV_NONCONN_IND (0x0010)
          Address type: Random (0x01)
          Address: 5F:B1:D6:AA:D5:5B (Resolvable)
          Primary PHY: LE 1M
          Secondary PHY: No packets
          SID: no ADI field (0xff)
          TX power: 127 dBm
          RSSI: -88 dBm (0xa8)
          Periodic advertising interval: 0.00 msec (0x0000)
          Direct address type: Public (0x00)
          Direct address: 00:00:00:00:00:00 (OUI 00-00-00)
          Data length: 0x1f
        1e ff 06 00 01 09 20 02 0d 51 ad 90 ff 56 23 ff  ...... ..Q...V#.
        9c 41 0c e4 53 42 f3 e7 97 7c 51 a9 c3 68 1a     .A..SB...|Q..h. 
        Company: Microsoft (6)
          Data: 010920020d51ad90ff5623ff9c410ce45342f3e7977c51a9c3681a
@ MGMT Event: Device Found (0x0012) plen 31            {0x0001} [hci0] 9.451022
        LE Address: 77:97:32:85:74:A1 (Resolvable)
        RSSI: -84 dBm (0xac)
        Flags: 0x00000000
        Data length: 17
        Flags: 0x1a
          LE General Discoverable Mode
          Simultaneous LE and BR/EDR (Controller)
          Simultaneous LE and BR/EDR (Host)
        TX power: 12 dBm
        Company: Apple, Inc. (76)
          Type: Unknown (16)
          Data: 3a1c19e3a2
@ MGMT Event: Device Found (0x0012) plen 45            {0x0001} [hci0] 9.451025
        LE Address: 5F:B1:D6:AA:D5:5B (Resolvable)
        RSSI: -88 dBm (0xa8)
        Flags: 0x00000004
          Not Connectable
        Data length: 31
        Company: Microsoft (6)
          Data: 010920020d51ad90ff5623ff9c410ce45342f3e7977c51a9c3681a
> HCI Event: LE Meta Event (0x3e) plen 57                   #38 [hci0] 9.552024
      LE Extended Advertising Report (0x0d)
        Num reports: 1
        Entry 0
          Event type: 0x0010
            Props: 0x0010
              Use legacy advertising PDUs
            Data status: [0;32mComplete[0m
          Legacy PDU Type: ADV_NONCONN_IND (0x0010)
          Address type: Random (0x01)
          Address: 5F:B1:D6:AA:D5:5B (Resolvable)
          Primary PHY: LE 1M
          Secondary PHY: No packets
          SID: no ADI field (0xff)
          TX power: 127 dBm
          RSSI: -90 dBm (0xa6)
          Periodic advertising interval: 0.00 msec (0x0000)
          Direct address type: Public (0x00)
          Direct address: 00:00:00:00:00:00 (OUI 00-00-00)
          Data length: 0x1f
        1e ff 06 00 01 09 20 02 0d 51 ad 90 ff 56 23 ff  ...... ..Q...V#.
        9c 41 0c e4 53 42 f3 e7 97 7c 51 a9 c3 68 1a     .A..SB...|Q..h. 
        Company: Microsoft (6)
          Data: 010920020d51ad90ff5623ff9c410ce45342f3e7977c51a9c3681a
@ MGMT Event: Device Found (0x0012) plen 45            {0x0001} [hci0] 9.552046
        LE Address: 5F:B1:D6:AA:D5:5B (Resolvable)
        RSSI: -90 dBm (0xa6)
        Flags: 0x00000004
          Not Connectable
        Data length: 31
        Company: Microsoft (6)
          Data: 010920020d51ad90ff5623ff9c410ce45342f3e7977c51a9c3681a
> HCI Event: LE Meta Event (0x3e) plen 57                  #39 [hci0] 11.224088
      LE Extended Advertising Report (0x0d)
        Num reports: 1
        Entry 0
          Event type: 0x0010
            Props: 0x0010
              Use legacy advertising PDUs
            Data status: [0;32mComplete[0m
          Legacy PDU Type: ADV_NONCONN_IND (0x0010)
          Address type: Random (0x01)
          Address: 5F:B1:D6:AA:D5:5B (Resolvable)
          Primary PHY: LE 1M
          Secondary PHY: No packets
          SID: no ADI field (0xff)
          TX power: 127 dBm
          RSSI: -90 dBm (0xa6)
          Periodic advertising interval: 0.00 msec (0x0000)
          Direct address type: Public (0x00)
          Direct address: 00:00:00:00:00:00 (OUI 00-00-00)
          Data length: 0x1f
        1e ff 06 00 01 09 20 02 0d 51 ad 90 ff 56 23 ff  ...... ..Q...V#.
        9c 41 0c e4 53 42 f3 e7 97 7c 51 a9 c3 68 1a     .A..SB...|Q..h. 
        Company: Microsoft (6)
          Data: 010920020d51ad90ff5623ff9c410ce45342f3e7977c51a9c3681a
@ MGMT Event: Device Found (0x0012) plen 45           {0x0001} [hci0] 11.224225
        LE Address: 5F:B1:D6:AA:D5:5B (Resolvable)
        RSSI: -90 dBm (0xa6)
        Flags: 0x00000004
          Not Connectable
        Data length: 31
        Company: Microsoft (6)
          Data: 010920020d51ad90ff5623ff9c410ce45342f3e7977c51a9c3681a
> HCI Event: LE Meta Event (0x3e) plen 57                  #40 [hci0] 11.867000
      LE Extended Advertising Report (0x0d)
        Num reports: 1
        Entry 0
          Event type: 0x0010
            Props: 0x0010
              Use legacy advertising PDUs
            Data status: [0;32mComplete[0m
          Legacy PDU Type: ADV_NONCONN_IND (0x0010)
          Address type: Random (0x01)
          Address: 5F:B1:D6:AA:D5:5B (Resolvable)
          Primary PHY: LE 1M
          Secondary PHY: No packets
          SID: no ADI field (0xff)
          TX power: 127 dBm
          RSSI: -91 dBm (0xa5)
          Periodic advertising interval: 0.00 msec (0x0000)
          Direct address type: Public (0x00)
          Direct address: 00:00:00:00:00:00 (OUI 00-00-00)
          Data length: 0x1f
        1e ff 06 00 01 09 20 02 0d 51 ad 90 ff 56 23 ff  ...... ..Q...V#.
        9c 41 0c e4 53 42 f3 e7 97 7c 51 a9 c3 68 1a     .A..SB...|Q..h. 
        Company: Microsoft (6)
          Data: 010920020d51ad90ff5623ff9c410ce45342f3e7977c51a9c3681a
@ MGMT Event: Device Found (0x0012) plen 45           {0x0001} [hci0] 11.867025
        LE Address: 5F:B1:D6:AA:D5:5B (Resolvable)
        RSSI: -91 dBm (0xa5)
        Flags: 0x00000004
          Not Connectable
        Data length: 31
        Company: Microsoft (6)
          Data: 010920020d51ad90ff5623ff9c410ce45342f3e7977c51a9c3681a
> HCI Event: LE Meta Event (0x3e) plen 43                  #41 [hci0] 11.948019
      LE Extended Advertising Report (0x0d)
        Num reports: 1
        Entry 0
          Event type: 0x0013
            Props: 0x0013
              Connectable
              Scannable
              Use legacy advertising PDUs
            Data status: [0;32mComplete[0m
          Legacy PDU Type: ADV_IND (0x0013)
          Address type: Random (0x01)
          Address: 77:97:32:85:74:A1 (Resolvable)
          Primary PHY: LE 1M
          Secondary PHY: No packets
          SID: no ADI field (0xff)
          TX power: 127 dBm
          RSSI: -84 dBm (0xac)
          Periodic advertising interval: 0.00 msec (0x0000)
          Direct address type: Public (0x00)
          Direct address: 00:00:00:00:00:00 (OUI 00-00-00)
          Data length: 0x11
        02 01 1a 02 0a 0c 0a ff 4c 00 10 05 3a 1c 19 e3  ........L...:...
        a2                                               .               
        Flags: 0x1a
          LE General Discoverable Mode
          Simultaneous LE and BR/EDR (Controller)
          Simultaneous LE and BR/EDR (Host)
        TX power: 12 dBm
        Company: Apple, Inc. (76)
          Type: Unknown (16)
          Data: 3a1c19e3a2
> HCI Event: LE Meta Event (0x3e) plen 26                  #42 [hci0] 11.949029
      LE Extended Advertising Report (0x0d)
        Num reports: 1
        Entry 0
          Event type: 0x001b
            Props: 0x001b
              Connectable
              Scannable
              Scan response
              Use legacy advertising PDUs
            Data status: [0;32mComplete[0m
          Legacy PDU Type: SCAN_RSP to an ADV_SCAN_IND (0x001b)
          Address type: Random (0x01)
          Address: 77:97:32:85:74:A1 (Resolvable)
          Primary PHY: LE 1M
          Secondary PHY: No packets
          SID: no ADI field (0xff)
          TX power: 127 dBm
          RSSI: -84 dBm (0xac)
          Periodic advertising interval: 0.00 msec (0x0000)
          Direct address type: Public (0x00)
          Direct address: 00:00:00:00:00:00 (OUI 00-00-00)
          Data length: 0x00
@ MGMT Event: Device Found (0x0012) plen 31           {0x0001} [hci0] 11.949038
        LE Address: 77:97:32:85:74:A1 (Resolvable)
        RSSI: -84 dBm (0xac)
        Flags: 0x00000000
        Data length: 17
        Flags: 0x1a
          LE General Discoverable Mode
          Simultaneous LE and BR/EDR (Controller)
          Simultaneous LE and BR/EDR (Host)
        TX power: 12 dBm
        Company: Apple, Inc. (76)
          Type: Unknown (16)
          Data: 3a1c19e3a2
bluetoothctl[2375326]: @ MGMT Close: bluetoothctl            {0x0002} 12.437833
bluetoothd[2915165]: @ MGMT Comman.. (0x0024) plen 1  {0x0001} [hci0] 12.447324
        Address type: 0x07
          BR/EDR
          LE Public
          LE Random
< HCI Command: Inquiry Cancel (0x01|0x0002) plen 0         #43 [hci0] 12.447355
> HCI Event: Command Complete (0x0e) plen 4                #44 [hci0] 12.448064
      Inquiry Cancel (0x01|0x0002) ncmd 1
        Status: Success (0x00)
< HCI Command: LE Set Extended Sca.. (0x08|0x0042) plen 6  #45 [hci0] 12.448093
        Extended scan: Disabled (0x00)
        Filter duplicates: Disabled (0x00)
        Duration: 0 msec (0x0000)
        Period: 0.00 sec (0x0000)
bluetoothctl[2376213]: @ MGMT Open: bluetoot.. version 1.23  {0x0002} 12.451688
> HCI Event: Command Complete (0x0e) plen 4                #46 [hci0] 12.461120
      LE Set Extended Scan Enable (0x08|0x0042) ncmd 1
        Status: Success (0x00)
@ MGMT Event: Discovering (0x0013) plen 2             {0x0001} [hci0] 12.461205
        Address type: 0x07
          BR/EDR
          LE Public
          LE Random
        Discovery: Disabled (0x00)
@ MGMT Event: Command Complete (0x0001) plen 4        {0x0001} [hci0] 12.461215
      Stop Discovery (0x0024) plen 1
        Status: Success (0x00)
        Address type: 0x07
          BR/EDR
          LE Public
          LE Random
bluetoothd[2915165]: @ MGMT Comman.. (0x003a) plen 4  {0x0001} [hci0] 12.461484
        Address type: 0x01
          BR/EDR
        RSSI: invalid (0x7f)
        UUIDs: 0
< HCI Command: Inquiry (0x01|0x0001) plen 5                #47 [hci0] 12.461510
        Access code: 0x9e8b33 (General Inquiry)
        Length: 10.24s (0x08)
        Num responses: 0
> HCI Event: Command Status (0x0f) plen 4                  #48 [hci0] 12.462972
      Inquiry (0x01|0x0001) ncmd 1
        Status: Success (0x00)
@ MGMT Event: Command Complete (0x0001) plen 4        {0x0001} [hci0] 12.463082
      Start Service Discovery (0x003a) plen 1
        Status: Success (0x00)
        Address type: 0x01
          BR/EDR
@ MGMT Event: Discovering (0x0013) plen 2             {0x0001} [hci0] 12.463086
        Address type: 0x01
          BR/EDR
        Discovery: Enabled (0x01)
bluetoothctl[2376213]: @ MGMT Close: bluetoothctl            {0x0002} 20.464784
bluetoothctl[2376890]: @ MGMT Open: bluetoot.. version 1.23  {0x0002} 20.479948
bluetoothctl[2376890]: @ MGMT Close: bluetoothctl            {0x0002} 20.486612
bluetoothctl[2376894]: @ MGMT Open: bluetoot.. version 1.23  {0x0002} 20.494332
bluetoothd[2915165]: @ MGMT Comman.. (0x0024) plen 1  {0x0001} [hci0] 20.498649
        Address type: 0x01
          BR/EDR
bluetoothctl[2376894]: @ MGMT Close: bluetoothctl            {0x0002} 20.498836
< HCI Command: Inquiry Cancel (0x01|0x0002) plen 0         #49 [hci0] 20.499041
bluetoothd[2915165]: @ MGMT Comman.. (0x001a) plen 7  {0x0001} [hci0] 20.500693
        LE Address: C0:DE:54:15:00:51 (Static)
@ MGMT Event: Command Status (0x0002) plen 3          {0x0001} [hci0] 20.500696
      Cancel Pair Device (0x001a)
        Status: Invalid Parameters (0x0d)
bluetoothctl[2376895]: @ MGMT Open: bluetoot.. version 1.23  {0x0002} 20.502456
> HCI Event: Command Complete (0x0e) plen 4                #50 [hci0] 20.594211
      Inquiry Cancel (0x01|0x0002) ncmd 1
        Status: Success (0x00)
@ MGMT Event: Discovering (0x0013) plen 2             {0x0001} [hci0] 20.594321
        Address type: 0x01
          BR/EDR
        Discovery: Disabled (0x00)
@ MGMT Event: Command Complete (0x0001) plen 4        {0x0001} [hci0] 20.594434
      Stop Discovery (0x0024) plen 1
        Status: Success (0x00)
        Address type: 0x01
          BR/EDR
bluetoothd[2915165]: @ MGMT Comman.. (0x0019) plen 8  {0x0001} [hci0] 20.594516
        LE Address: C0:DE:54:15:00:51 (Static)
        Capability: NoInputNoOutput (0x03)
< HCI Command: LE Set Address Reso.. (0x08|0x002d) plen 1  #51 [hci0] 20.594531
        Address resolution: Enabled (0x01)
> HCI Event: Command Complete (0x0e) plen 4                #52 [hci0] 20.595207
      LE Set Address Resolution Enable (0x08|0x002d) ncmd 1
        Status: Success (0x00)
< HCI Command: LE Set Extended Sc.. (0x08|0x0041) plen 13  #53 [hci0] 20.595410
        Own address type: Public (0x00)
        Filter policy: Ignore not in accept list (0x01)
        PHYs: 0x05
        Entry 0: LE 1M
          Type: Passive (0x00)
          Interval: 60.000 msec (0x0060)
          Window: 60.000 msec (0x0060)
        Entry 1: LE Coded
          Type: Passive (0x00)
          Interval: 180.000 msec (0x0120)
          Window: 180.000 msec (0x0120)
> HCI Event: Command Complete (0x0e) plen 4                #54 [hci0] 20.596208
      LE Set Extended Scan Parameters (0x08|0x0041) ncmd 1
        Status: Success (0x00)
< HCI Command: LE Set Extended Sca.. (0x08|0x0042) plen 6  #55 [hci0] 20.596405
        Extended scan: Enabled (0x01)
        Filter duplicates: Enabled (0x01)
        Duration: 0 msec (0x0000)
        Period: 0.00 sec (0x0000)
> HCI Event: Command Complete (0x0e) plen 4                #56 [hci0] 20.597206
      LE Set Extended Scan Enable (0x08|0x0042) ncmd 1
        Status: Success (0x00)
> HCI Event: LE Meta Event (0x3e) plen 39                  #57 [hci0] 23.562385
      LE Extended Advertising Report (0x0d)
        Num reports: 1
        Entry 0
          Event type: 0x0013
            Props: 0x0013
              Connectable
              Scannable
              Use legacy advertising PDUs
            Data status: [0;32mComplete[0m
          Legacy PDU Type: ADV_IND (0x0013)
          Address type: Random (0x01)
          Address: C0:DE:54:15:00:51 (Static)
          Primary PHY: LE 1M
          Secondary PHY: No packets
          SID: no ADI field (0xff)
          TX power: 127 dBm
          RSSI: -78 dBm (0xb2)
          Periodic advertising interval: 0.00 msec (0x0000)
          Direct address type: Public (0x00)
          Direct address: 00:00:00:00:00:00 (OUI 00-00-00)
          Data length: 0x0d
        02 01 06 09 09 58 35 34 2d 50 41 49 52           .....X54-PAIR   
        Flags: 0x06
          LE General Discoverable Mode
          BR/EDR Not Supported
        Name (complete): X54-PAIR
< HCI Command: LE Set Extended Sca.. (0x08|0x0042) plen 6  #58 [hci0] 23.562617
        Extended scan: Disabled (0x00)
        Filter duplicates: Disabled (0x00)
        Duration: 0 msec (0x0000)
        Period: 0.00 sec (0x0000)
> HCI Event: Command Complete (0x0e) plen 4                #59 [hci0] 23.637382
      LE Set Extended Scan Enable (0x08|0x0042) ncmd 1
        Status: Success (0x00)
< HCI Command: LE Extended Create.. (0x08|0x0043) plen 26  #60 [hci0] 23.637757
        Filter policy: Accept list is not used (0x00)
        Own address type: Public (0x00)
        Peer address type: Random (0x01)
        Peer address: C0:DE:54:15:00:51 (Static)
        Initiating PHYs: 0x01
        Entry 0: LE 1M
          Scan interval: 60.000 msec (0x0060)
          Scan window: 60.000 msec (0x0060)
          Min connection interval: 30.00 msec (0x0018)
          Max connection interval: 50.00 msec (0x0028)
          Connection latency: 0 (0x0000)
          Supervision timeout: 420 msec (0x002a)
          Min connection length: 0.000 msec (0x0000)
          Max connection length: 0.000 msec (0x0000)
> HCI Event: Command Status (0x0f) plen 4                  #61 [hci0] 23.639388
      LE Extended Create Connection (0x08|0x0043) ncmd 1
        Status: Success (0x00)
> HCI Event: LE Meta Event (0x3e) plen 31                  #62 [hci0] 23.870434
      LE Enhanced Connection Complete (0x0a)
        Status: Success (0x00)
        Handle: 2048
        Role: Central (0x00)
        Peer address type: Random (0x01)
        Peer address: C0:DE:54:15:00:51 (Static)
        Local resolvable private address: 00:00:00:00:00:00 (Non-Resolvable)
        Peer resolvable private address: 00:00:00:00:00:00 (Non-Resolvable)
        Connection interval: 45.00 msec (0x0024)
        Connection latency: 0 (0x0000)
        Supervision timeout: 420 msec (0x002a)
        Central clock accuracy: 0x00
@ MGMT Event: Device Connected (0x000b) plen 26       {0x0001} [hci0] 23.870545
        LE Address: C0:DE:54:15:00:51 (Static)
        Flags: 0x00000008
          Connection Locally Initiated
        Data length: 13
        Flags: 0x06
          LE General Discoverable Mode
          BR/EDR Not Supported
        Name (complete): X54-PAIR
btmon[2375096]: @ RAW Open: btmon (privileged) version 2.22  {0x0003} 23.870596
btmon[2375096]: @ RAW Close: btmon                           {0x0003} 23.870601
> HCI Event: LE Meta Event (0x3e) plen 4                   #63 [hci0] 23.871374
      LE Channel Selection Algorithm (0x14)
        Handle: 2048 Address: C0:DE:54:15:00:51 (Static)
        Algorithm: #2 (0x01)
< HCI Command: LE Read Remote Used.. (0x08|0x0016) plen 2  #64 [hci0] 23.876742
        Handle: 2048 Address: C0:DE:54:15:00:51 (Static)
> HCI Event: Command Status (0x0f) plen 4                  #65 [hci0] 23.877307
      LE Read Remote Used Features (0x08|0x0016) ncmd 1
        Status: Success (0x00)
> HCI Event: LE Meta Event (0x3e) plen 12                  #66 [hci0] 23.958413
      LE Read Remote Used Features (0x04)
        Status: Success (0x00)
        Handle: 2048 Address: C0:DE:54:15:00:51 (Static)
        Features: 0x1f 0x00 0x00 0x00 0x00 0x00 0x00 0x00
          LE Encryption
          Connection Parameter Request Procedure
          Extended Reject Indication
          Peripheral-initiated Features Exchange
          LE Ping
< ACL Data TX: Handle 2048 flags 0x00 dlen 11              #67 [hci0] 23.958550
      SMP: Pairing Request (0x01) len 6
        IO capability: NoInputNoOutput (0x03)
        OOB data: Authentication data not present (0x00)
        Authentication requirement: Bonding, No MITM, SC, No Keypresses, CT2 (0x29)
        Max encryption key size: 16
        Initiator key distribution: EncKey Sign LinkKey (0x0d)
        Responder key distribution: EncKey IdKey Sign LinkKey (0x0f)
bluetoothd[2915165]: < ACL Data TX: H.. flags 0x00 dlen 7  #68 [hci0] 23.958994
      ATT: Exchange MTU Request (0x02) len 2
        Client RX MTU: 517
> HCI Event: Number of Completed Packets (0x13) plen 5     #69 [hci0] 24.047334
        Num handles: 1
        Handle: 2048 Address: C0:DE:54:15:00:51 (Static)
        Count: 1
        #67: len 11 (1 Kb/s)
        Latency: 88 msec (88-88 msec ~88 msec)
> HCI Event: Number of Completed Packets (0x13) plen 5     #70 [hci0] 24.092309
        Num handles: 1
        Handle: 2048 Address: C0:DE:54:15:00:51 (Static)
        Count: 1
        #68: len 7 (0 Kb/s)
        Latency: 133 msec (88-133 msec ~111 msec)
> ACL Data RX: Handle 2048 flags 0x02 dlen 11              #71 [hci0] 24.094731
      SMP: Pairing Response (0x02) len 6
        IO capability: NoInputNoOutput (0x03)
        OOB data: Authentication data not present (0x00)
        Authentication requirement: Bonding, No MITM, Legacy, No Keypresses (0x01)
        Max encryption key size: 16
        Initiator key distribution: EncKey (0x01)
        Responder key distribution: <none> (0x00)
@ MGMT Event: User Confirmation R.. (0x000f) plen 12  {0x0001} [hci0] 24.094748
        LE Address: C0:DE:54:15:00:51 (Static)
        Confirm hint: 0x01
        Value: 0x00000000
bluetoothd[2915165]: @ MGMT Comman.. (0x001c) plen 7  {0x0001} [hci0] 24.094870
        LE Address: C0:DE:54:15:00:51 (Static)
@ MGMT Event: Command Complete (0x0001) plen 10       {0x0001} [hci0] 24.094886
      User Confirmation Reply (0x001c) plen 7
        Status: Success (0x00)
        LE Address: C0:DE:54:15:00:51 (Static)
< ACL Data TX: Handle 2048 flags 0x00 dlen 21              #72 [hci0] 24.094888
      SMP: Pairing Confirm (0x03) len 16
        Confim value: ce20aed5567de2dde3e9073d34767af2
> HCI Event: Number of Completed Packets (0x13) plen 5     #73 [hci0] 24.137328
        Num handles: 1
        Handle: 2048 Address: C0:DE:54:15:00:51 (Static)
        Count: 1
        #72: len 21 (4 Kb/s)
        Latency: 42 msec (42-133 msec ~76 msec)
> ACL Data RX: Handle 2048 flags 0x02 dlen 7               #74 [hci0] 24.137367
      ATT: Exchange MTU Response (0x03) len 2
        Server RX MTU: 23
bluetoothd[2915165]: < ACL Data TX:... flags 0x00 dlen 11  #75 [hci0] 24.137508
      ATT: Read By Type Request (0x08) len 6
        Handle range: 0x0001-0xffff
        Attribute type: Server Supported Features (0x2b3a)
> HCI Event: Number of Completed Packets (0x13) plen 5     #76 [hci0] 24.182316
        Num handles: 1
        Handle: 2048 Address: C0:DE:54:15:00:51 (Static)
        Count: 1
        #75: len 11 (2 Kb/s)
        Latency: 44 msec (42-133 msec ~60 msec)
> ACL Data RX: Handle 2048 flags 0x02 dlen 21              #77 [hci0] 24.183740
      SMP: Pairing Confirm (0x03) len 16
        Confim value: c721c45b828604f9f4ceec33eb106de1
< ACL Data TX: Handle 2048 flags 0x00 dlen 21              #78 [hci0] 24.183854
      SMP: Pairing Random (0x04) len 16
        Random value: 7b363ff395df0d4d1a3110ab37530681
> HCI Event: Number of Completed Packets (0x13) plen 5     #79 [hci0] 24.227349
        Num handles: 1
        Handle: 2048 Address: C0:DE:54:15:00:51 (Static)
        Count: 1
        #78: len 21 (3 Kb/s)
        Latency: 43 msec (42-133 msec ~52 msec)
> ACL Data RX: Handle 2048 flags 0x02 dlen 9               #80 [hci0] 24.227377
      ATT: Error Response (0x01) len 4
        Read By Type Request (0x08)
        Handle: 0x0001
        Error: Attribute Not Found (0x0a)
bluetoothd[2915165]: < ACL Data TX:... flags 0x00 dlen 11  #81 [hci0] 24.227588
      ATT: Read By Group Type Request (0x10) len 6
        Handle range: 0x0001-0xffff
        Attribute group type: Primary Service (0x2800)
> HCI Event: Number of Completed Packets (0x13) plen 5     #82 [hci0] 24.272334
        Num handles: 1
        Handle: 2048 Address: C0:DE:54:15:00:51 (Static)
        Count: 1
        #81: len 11 (2 Kb/s)
        Latency: 44 msec (42-133 msec ~48 msec)
> ACL Data RX: Handle 2048 flags 0x02 dlen 21              #83 [hci0] 24.272367
      SMP: Pairing Random (0x04) len 16
        Random value: 8e2fbc8330291c20cab241237cbe4c11
< HCI Command: LE Start Encryption (0x08|0x0019) plen 28   #84 [hci0] 24.272484
        Handle: 2048 Address: C0:DE:54:15:00:51 (Static)
        Random number: 0x0000000000000000
        Encrypted diversifier: 0x0000
        Long term key: ee0d0aa2fa6d68951316ffe9f1564e41
> HCI Event: Command Status (0x0f) plen 4                  #85 [hci0] 24.273395
      LE Start Encryption (0x08|0x0019) ncmd 1
        Status: Success (0x00)
> HCI Event: Encryption Change (0x08) plen 4               #86 [hci0] 24.407402
        Status: Connection Terminated due to MIC Failure (0x3d)
        Handle: 2048 Address: C0:DE:54:15:00:51 (Static)
        Encryption: Disabled (0x00)
@ MGMT Event: Command Complete (0x0001) plen 10       {0x0001} [hci0] 24.407428
      Pair Device (0x0019) plen 7
        Status: Authentication Failed (0x05)
        LE Address: C0:DE:54:15:00:51 (Static)
< HCI Command: Disconnect (0x01|0x0006) plen 3             #87 [hci0] 24.407566
        Handle: 2048 Address: C0:DE:54:15:00:51 (Static)
        Reason: Authentication Failure (0x05)
> HCI Event: Disconnect Complete (0x05) plen 4             #88 [hci0] 24.408411
        Status: Success (0x00)
        Handle: 2048 Address: C0:DE:54:15:00:51 (Static)
        Reason: Connection Terminated due to MIC Failure (0x3d)
@ MGMT Event: Device Disconnected (0x000c) plen 8     {0x0001} [hci0] 24.408573
        LE Address: C0:DE:54:15:00:51 (Static)
        Reason: Unspecified (0x00)
> HCI Event: Command Status (0x0f) plen 4                  #89 [hci0] 24.409318
      Disconnect (0x01|0x0006) ncmd 1
        Status: Unknown Connection Identifier (0x02)
bluetoothctl[2376895]: @ MGMT Close: bluetoothctl            {0x0002} 28.512322
bluetoothd[2915165]: @ MGMT Comman.. (0x003a) plen 4  {0x0001} [hci0] 29.726221
        Address type: 0x01
          BR/EDR
        RSSI: invalid (0x7f)
        UUIDs: 0
< HCI Command: Inquiry (0x01|0x0001) plen 5                #90 [hci0] 29.726466
        Access code: 0x9e8b33 (General Inquiry)
        Length: 10.24s (0x08)
        Num responses: 0
> HCI Event: Command Status (0x0f) plen 4                  #91 [hci0] 29.821600
      Inquiry (0x01|0x0001) ncmd 1
        Status: Success (0x00)
@ MGMT Event: Command Complete (0x0001) plen 4        {0x0001} [hci0] 29.821867
      Start Service Discovery (0x003a) plen 1
        Status: Success (0x00)
        Address type: 0x01
          BR/EDR
@ MGMT Event: Discovering (0x0013) plen 2             {0x0001} [hci0] 29.821874
        Address type: 0x01
          BR/EDR
        Discovery: Enabled (0x01)
> HCI Event: Inquiry Complete (0x01) plen 1                #92 [hci0] 40.124904
        Status: Success (0x00)
@ MGMT Event: Discovering (0x0013) plen 2             {0x0001} [hci0] 40.124940
        Address type: 0x01
          BR/EDR
        Discovery: Disabled (0x00)
bluetoothd[2915165]: @ MGMT Comman.. (0x003a) plen 4  {0x0001} [hci0] 40.125276
        Address type: 0x01
          BR/EDR
        RSSI: invalid (0x7f)
        UUIDs: 0
< HCI Command: Inquiry (0x01|0x0001) plen 5                #93 [hci0] 40.125437
        Access code: 0x9e8b33 (General Inquiry)
        Length: 10.24s (0x08)
        Num responses: 0
> HCI Event: Command Status (0x0f) plen 4                  #94 [hci0] 40.126781
      Inquiry (0x01|0x0001) ncmd 1
        Status: Success (0x00)
@ MGMT Event: Command Complete (0x0001) plen 4        {0x0001} [hci0] 40.126900
      Start Service Discovery (0x003a) plen 1
        Status: Success (0x00)
        Address type: 0x01
          BR/EDR
@ MGMT Event: Discovering (0x0013) plen 2             {0x0001} [hci0] 40.126909
        Address type: 0x01
          BR/EDR
        Discovery: Enabled (0x01)
